id,name,position,start_date,end_date
ba5fb299-227f-4291-9b29-293e11bb1b59,Aurélie Filippetti,Minister of Culture (France),2012-05-16,
f9623c6f-bf84-463c-b382-fbc514afc521,François Fillon,Minister of Social Affairs,2002-03-07,2004-03-31
f9623c6f-bf84-463c-b382-fbc514afc521,François Fillon,Prime Minister of France,2007-05-17,2012-05-16
d255b1f7-a81e-4d0f-8c72-38fdddc5d64a,Geneviève Fioraso,Ministry of Higher Education and Research,,
d255b1f7-a81e-4d0f-8c72-38fdddc5d64a,Geneviève Fioraso,Secretary of State,,
ab597313-13d2-45b7-9c4e-16bee846cd92,Jean-Marc Ayrault,Prime Minister of France,2012-05-15,2014-03-31
ab597313-13d2-45b7-9c4e-16bee846cd92,Jean-Marc Ayrault,Mayor of Nantes,1989-03-18,2012-06-21
1bed009b-693b-4077-9369-a9b24c25f152,Nathalie Appéré,mayor of Rennes,2014-04-04,
11977b6d-a93a-408d-b84d-dc2356e3e952,Élisabeth Guigou,Minister of Social Affairs,,
