id,name,sort_name,email,twitter,facebook,group,group_id,area_id,area,term,start_date,image,gender,wikidata,wikidata_group,wikidata_area
ccb53ebb-1595-4087-9c14-40736bba1c0b,Adil Abış oğlu Əliyev,Adil Abış oğlu Əliyev,,,,Independent,IND,20,Nərimanov II seçim dairəsi,5,2015-12-01,,,,Q327591,
86563e2c-31a0-4693-8fef-58eb8ccf3277,Aqil Məhəmməd oğlu Abbas,Aqil Məhəmməd oğlu Abbas,,,,Independent,IND,83,Ağcabədi-Füzuli seçim dairəsi,5,2015-12-01,,,,Q327591,
3c2463d8-3da1-452d-a5e7-cdac3d092ded,Aqiyə Həbib qızı Naxçıvanlı,Aqiyə Həbib qızı Naxçıvanlı,,,,Yeni Azərbaycan Partiyası,Yeni Azərbaycan Partiyası,117,Oğuz-Qəbələ seçim dairəsi,5,2015-12-01,,,,,
1f96cc71-a587-45ee-a901-e75aaa90b110,Araz Məmməd-Mübariz oğlu Əlizadə,Araz Məmməd-Mübariz oğlu Əlizadə,,,,Azərbaycan Sosial Demokrat Partiyası,Azərbaycan Sosial Demokrat Partiyası,35,Xətai III seçim dairəsi,5,2015-12-01,,,,,
520d93d5-45ae-4237-bea4-996494ac71fb,Arif Qafar oğlu Rəhimzadə,Arif Qafar oğlu Rəhimzadə,,,,Yeni Azərbaycan Partiyası,Yeni Azərbaycan Partiyası,61,Neftçala seçim dairəsi,5,2015-12-01,,,,,
dcb0139a-8ec7-437b-81bf-801faf9d13bc,Asim Nazim oğlu Mollazadə,Asim Nazim oğlu Mollazadə,,,,Azərbaycan Demokratik İslahatlar Partiyası,Azərbaycan Demokratik İslahatlar Partiyası,22,Nəsimi II seçim dairəsi,5,2015-12-01,,,,,
ed566c31-5100-4a7a-b8ac-beb87087b053,Astan Nuşrəvan oğlu Şahverdiyev,Astan Nuşrəvan oğlu Şahverdiyev,,,,Yeni Azərbaycan Partiyası,Yeni Azərbaycan Partiyası,120,Cəbrayıl-Qubadlı seçim dairəsi,5,2015-12-01,,,,,
064ba94f-dfd6-4908-a4c4-a08e4f171e6c,Aydın Böyükkişi oğlu Mirzəzadə,Aydın Böyükkişi oğlu Mirzəzadə,,,,Yeni Azərbaycan Partiyası,Yeni Azərbaycan Partiyası,47,Mingəçevir seçim dairəsi,5,2015-12-01,,,,,
3e57c055-f402-41ef-b904-9ff4aa50a532,Aydın Nəsir oğlu Hüseynov,Aydın Nəsir oğlu Hüseynov,,,,Yeni Azərbaycan Partiyası,Yeni Azərbaycan Partiyası,11,Qaradağ seçim dairəsi,5,2015-12-01,,,,,
37004919-f484-49fd-8558-98f203a19cb2,Aytən İnqilab qızı Mustafazadə,Aytən İnqilab qızı Mustafazadə,,,,Independent,IND,16,Yasamal II seçim dairəsi,5,2015-12-01,,,,Q327591,
d389e2d8-3ccd-49d9-9bcc-4e77c0338e46,Azay Əjdər oğlu Quliyev,Azay Əjdər oğlu Quliyev,,,,Independent,IND,8,Binəqədi I seçim dairəsi,5,2015-12-01,,,,Q327591,
b0e4f5b8-7b9e-4f38-996a-856d03f586da,Azər Camal oğlu Badamov,Azər Camal oğlu Badamov,,,,Yeni Azərbaycan Partiyası,Yeni Azərbaycan Partiyası,51,Qusar seçim dairəsi,5,2015-12-01,,,,,
8e4da588-285a-43f9-84c6-6cbfbce9a6df,Azər Şəmşid oğlu Kərimli,Azər Şəmşid oğlu Kərimli,,,,Independent,IND,112,Qax seçim dairəsi,5,2015-12-01,,,,Q327591,
345a14a7-72ae-4f4f-b14e-c23af8240a70,Ağacan Qulam oğlu Abıyev,Ağacan Qulam oğlu Abıyev,,,,Yeni Azərbaycan Partiyası,Yeni Azərbaycan Partiyası,32,Suraxanı III seçim dairəsi,5,2015-12-01,,,,,
309c708e-f057-4ee8-81ba-d803547d15b9,Ağalar İsrafil oğlu Vəliyev,Ağalar İsrafil oğlu Vəliyev,,,,Yeni Azərbaycan Partiyası,Yeni Azərbaycan Partiyası,97,Goranboy-Ağdam-Tərtər seçim dairəsi,5,2015-12-01,,,,,
07d969d6-f64b-4b29-ba4e-19ee64336daf,Bahar Əvəz qızı Muradova,Bahar Əvəz qızı Muradova,,,,Yeni Azərbaycan Partiyası,Yeni Azərbaycan Partiyası,84,Füzuli seçim dairəsi,5,2015-12-01,,,,,
90c84f8c-6b84-4274-9439-4ef00e999f3f,Bəxtiyar Həmzə oğlu Əliyev,Bəxtiyar Həmzə oğlu Əliyev,,,,Independent,IND,118,Ağdam şəhər seçim dairəsi,5,2015-12-01,,,,Q327591,
44f8ec9e-9b9d-4dbc-afa0-bdd598f3caa2,Bəxtiyar Yusif oğlu Sadıqov,Bəxtiyar Yusif oğlu Sadıqov,,,,Yeni Azərbaycan Partiyası,Yeni Azərbaycan Partiyası,119,Ağdam qəsəbə seçim dairəsi,5,2015-12-01,,,,,
036eb6c5-c427-4bec-add1-a072bf7c9d11,Cavanşir Hümmət oğlu Paşazadə,Cavanşir Hümmət oğlu Paşazadə,,,,Yeni Azərbaycan Partiyası,Yeni Azərbaycan Partiyası,75,Lənkəran-Masallı seçim dairəsi,5,2015-12-01,,,,,
6abb3d9f-0a60-4b16-adc5-ec11d864e19f,Cavanşir Əyyub oğlu Feyziyev,Cavanşir Əyyub oğlu Feyziyev,,,,Independent,IND,115,Şəki qəsəbə II seçim dairəsi,5,2015-12-01,,,,Q327591,
72426d88-0fb6-41e9-99a8-655e993996ea,Cavid Həmid oğlu Osmanov,Cavid Həmid oğlu Osmanov,,,,Yeni Azərbaycan Partiyası,Yeni Azərbaycan Partiyası,90,Ağdaş seçim dairəsi,5,2015-12-01,,,,,
7fcd605f-2e00-41f1-bbbc-44aef72b9eb1,Cavid Qənbər oğlu Qurbanov,Cavid Qənbər oğlu Qurbanov,,,,Yeni Azərbaycan Partiyası,Yeni Azərbaycan Partiyası,123,Kəlbəcər seçim dairəsi,5,2015-12-01,,,,,
7de3f0f0-9bd5-4fb4-8a52-43ab2eb00d09,Dilarə Məmmədağa qızı Cəbrayılova,Dilarə Məmmədağa qızı Cəbrayılova,,,,Yeni Azərbaycan Partiyası,Yeni Azərbaycan Partiyası,27,Sabunçu II seçim dairəsi,5,2015-12-01,,,,,
7270e2e3-41d1-4298-bd45-ca0498beff70,Eldar Allahyar oğlu Quliyev,Eldar Allahyar oğlu Quliyev,,,,Independent,IND,28,Sabunçu III seçim dairəsi,5,2015-12-01,,,,Q327591,
30044476-876b-420b-ad44-fc4e73e05e32,Eldar Rza oğlu İbrahimov,Eldar Rza oğlu İbrahimov,,,,Yeni Azərbaycan Partiyası,Yeni Azərbaycan Partiyası,4,Naxçıvan şəhər seçim dairəsi,5,2015-12-01,,,,,
6edbee07-be5e-4d73-9c39-f72dbd5221de,Eldəniz Adil oğlu Səlimov,Eldəniz Adil oğlu Səlimov,,,,Yeni Azərbaycan Partiyası,Yeni Azərbaycan Partiyası,55,Xaçmaz şəhər seçim dairəsi,5,2015-12-01,,,,,
680ef82f-6f8b-4771-b6e3-16d1a496eeed,Elman Camal oğlu Məmmədov,Elman Camal oğlu Məmmədov,,,,Yeni Azərbaycan Partiyası,Yeni Azərbaycan Partiyası,124,Şuşa-Ağdam-Xocalı-Xocavənd seçim dairəsi,5,2015-12-01,,,,,
c31cfc0f-7c07-4a24-9f12-b02f57945cdf,Elman Xudam oğlu Nəsirli,Elman Xudam oğlu Nəsirli,,,,Yeni Azərbaycan Partiyası,Yeni Azərbaycan Partiyası,89,Göyçay-Ağdaş seçim dairəsi,5,2015-12-01,,,,,
17df484b-cdf8-4407-9296-b6cc5b5e26df,Elmira Hüseyn qızı Axundova,Elmira Hüseyn qızı Axundova,,,,Independent,IND,71,Masallı qəsəbə seçim dairəsi,5,2015-12-01,,,,Q327591,
e9f57e1e-5f75-4690-9631-2226ee77afcc,Elxan Sirac oğlu Süleymanov,Elxan Sirac oğlu Süleymanov,,,,Independent,IND,85,Şamaxı seçim dairəsi,5,2015-12-01,,,,Q327591,
0510d2a7-9db7-4277-9ebc-6b334e36f692,Elçin Bəybala oğlu Quliyev,Elçin Bəybala oğlu Quliyev,,,,Yeni Azərbaycan Partiyası,Yeni Azərbaycan Partiyası,63,Sabirabad I seçim dairəsi,5,2015-12-01,,,,,
2e310991-c67a-45f8-aeee-bf6bb336bf78,Elşad Eldar oğlu Həsənov,Elşad Eldar oğlu Həsənov,,,,Independent,IND,17,Yasamal III seçim dairəsi,5,2015-12-01,,,,Q327591,
ef935818-fb99-4800-8384-dc6858ed4357,Elşən Məmmədhənifə oğlu Musayev,Elşən Məmmədhənifə oğlu Musayev,,,,Azərbaycan Demokratik Maarifçilik Partiyası,Azərbaycan Demokratik Maarifçilik Partiyası,110,Zaqatala seçim dairəsi,5,2015-12-01,,,,,
32dca022-17af-4e7b-9f3e-d3ccb003e61c,Fazil Qəzənfər oğlu Mustafa,Fazil Qəzənfər oğlu Mustafa,,,,Böyük Quruluş Partiyası,Böyük Quruluş Partiyası,26,Sabunçu I seçim dairəsi,5,2015-12-01,,,,,
df3d2249-9210-48b0-b99c-54cf9b516681,Flora Qasım qızı Qasımova,Flora Qasım qızı Qasımova,,,,Independent,IND,122,Xankəndi seçim dairəsi,5,2015-12-01,,,,Q327591,
308105f7-b60c-4022-bdd1-fe015d47c2ad,Fuad Rauf oğlu Muradov,Fuad Rauf oğlu Muradov,,,,Independent,IND,34,Xətai II seçim dairəsi,5,2015-12-01,,,,Q327591,
07f88b13-ad38-4fd4-9384-6a7e97de7338,Fərəc İbrahim oğlu Quliyev,Fərəc İbrahim oğlu Quliyev,,,,Milli Dirçəliş Hərəkatı Partiyası,Milli Dirçəliş Hərəkatı Partiyası,31,Suraxanı II seçim dairəsi,5,2015-12-01,,,,,
91238555-002c-4f4f-bdf4-2c2556c00da0,Fəttah Səməd oğlu Heydərov,Fəttah Səməd oğlu Heydərov,,,,Independent,IND,116,Qəbələ seçim dairəsi,5,2015-12-01,,,,Q327591,
1cfdd48e-d467-494c-a1e3-3d3339bbba73,Fəzail Feyruz oğlu İbrahimli,Fəzail Feyruz oğlu İbrahimli,,,,Vətəndaş Həmrəyliyi Partiyası,Vətəndaş Həmrəyliyi Partiyası,69,Cəlilabad-Masallı-Biləsuvar seçim dairəsi,5,2015-12-01,,,,,
ff3327c4-3896-4184-8c89-71c675642bae,Fəzail Rəhim oğlu Ağamalı,Fəzail Rəhim oğlu Ağamalı,,,,Ana Vətən Partiyası,Ana Vətən Partiyası,60,Salyan-Neftçala seçim dairəsi,5,2015-12-01,,,,,
eb99e2fa-ab6a-49bf-ab43-221384756825,Gövhər Baxşəli qızı Baxşəliyeva,Gövhər Baxşəli qızı Baxşəliyeva,,,,Independent,IND,93,Bərdə şəhər seçim dairəsi,5,2015-12-01,,,,Q327591,
f78410a5-f042-4913-b5d3-ed18bb5c9b7c,Hacı Hacıbaba oğlu Salayev,Hacı Hacıbaba oğlu Salayev,,,,Independent,IND,44,Sumqayıt-Abşeron seçim dairəsi,5,2015-12-01,,,,Q327591,
b21d8d92-7adf-4505-a18c-548c0a183917,Hadı Musa oğlu Rəcəbli,Hadı Musa oğlu Rəcəbli,,,,Yeni Azərbaycan Partiyası,Yeni Azərbaycan Partiyası,74,Lənkəran qəsəbə seçim dairəsi,5,2015-12-01,,,,,
889573bc-2a2c-4035-9fdb-3d79141b6284,Hikmət Baba oğlu Məmmədov,Hikmət Baba oğlu Məmmədov,,,,Yeni Azərbaycan Partiyası,Yeni Azərbaycan Partiyası,19,Nərimanov I seçim dairəsi,5,2015-12-01,,,,,
37f2ef20-a2ec-4e90-91d5-09675b86c024,Hüseynbala Fazil oğlu Mirələmov,Hüseynbala Fazil oğlu Mirələmov,,,,Yeni Azərbaycan Partiyası,Yeni Azərbaycan Partiyası,33,Xətai I seçim dairəsi,5,2015-12-01,,,,,
73aecca2-e7dc-42aa-b7ad-397f094d5988,Jalə Fazil qızı Əliyeva,Jalə Fazil qızı Əliyeva,,,,Independent,IND,92,Zərdab-Ucar seçim dairəsi,5,2015-12-01,,,,Q327591,
3875b027-31ef-40a4-9323-fca24e4e8b72,Kamaləddin Nəsrəddin oğlu Qafarov,Kamaləddin Nəsrəddin oğlu Qafarov,,,,Yeni Azərbaycan Partiyası,Yeni Azərbaycan Partiyası,9,Binəqədi II seçim dairəsi,5,2015-12-01,,,,,
c85ecb81-b186-4ace-b130-ec3d7c06b663,Kamilə Əli Ağa qızı Əliyeva,Kamilə Əli Ağa qızı Əliyeva,,,,Yeni Azərbaycan Partiyası,Yeni Azərbaycan Partiyası,111,Zaqatala-Balakən seçim dairəsi,5,2015-12-01,,,,,
dc6ca913-ea3c-4d4b-8453-91469d68deeb,Kamran Fərhad oğlu Bayramov,Kamran Fərhad oğlu Bayramov,,,,Yeni Azərbaycan Partiyası,Yeni Azərbaycan Partiyası,100,Şəmkir-Daşkəsən seçim dairəsi,5,2015-12-01,,,,,
e44f703f-b8e9-4853-a2e6-da6eccb08233,Kamran Telman oğlu Nəbizadə,Kamran Telman oğlu Nəbizadə,,,,Independent,IND,107,Qazax seçim dairəsi,5,2015-12-01,,,,Q327591,
418265a3-e389-45f2-911e-2303044683c3,Madər Ələsgər oğlu Musayev,Madər Ələsgər oğlu Musayev,,,,Independent,IND,10,Binəqədi III seçim dairəsi,5,2015-12-01,,,,Q327591,
88e6207c-fabf-4d10-a9c4-bc4b88e8dca2,Mahir Məhəmmədəli oğlu Aslanov,Mahir Məhəmmədəli oğlu Aslanov,,,,Independent,IND,96,Goranboy-Naftalan seçim dairəsi,5,2015-12-01,,,,Q327591,
d4b19ba0-2cde-49c9-9975-2120717499a1,Mahir Tapdıq oğlu Abbaszadə,Mahir Tapdıq oğlu Abbaszadə,,,,Yeni Azərbaycan Partiyası,Yeni Azərbaycan Partiyası,121,Laçın seçim dairəsi,5,2015-12-01,,,,,
5fac6c72-724b-459b-bdf3-61a50cf2739f,Malik Əvəz oğlu Həsənov,Malik Əvəz oğlu Həsənov,,,,Yeni Azərbaycan Partiyası,Yeni Azərbaycan Partiyası,67,Cəlilabad şəhər seçim dairəsi,5,2015-12-01,,,,,
ba5fd355-aef8-4075-942b-689963e75f7d,Mehriban Arif qızı Əliyeva,Mehriban Arif qızı Əliyeva,,,,Yeni Azərbaycan Partiyası,Yeni Azərbaycan Partiyası,14,Xəzər II seçim dairəsi,5,2015-12-01,,,,,
ea3ef8bd-2445-4c30-8179-c7aa4c86052a,Mirkazım Mirməhəmməd oğlu Kazımov,Mirkazım Mirməhəmməd oğlu Kazımov,,,,Yeni Azərbaycan Partiyası,Yeni Azərbaycan Partiyası,68,Cəlilabad qəsəbə seçim dairəsi,5,2015-12-01,,,,,
46246153-6c5c-4601-8803-363027adc1ae,Mirzəcan Mirzəmməd oğlu Xəlilov,Mirzəcan Mirzəmməd oğlu Xəlilov,,,,Yeni Azərbaycan Partiyası,Yeni Azərbaycan Partiyası,41,Sumqayıt I seçim dairəsi,5,2015-12-01,,,,,
e90a8fa8-2319-45d7-b336-a9fa402069d9,Mixail Yuri oğlu Zabelin,Mixail Yuri oğlu Zabelin,,,,Yeni Azərbaycan Partiyası,Yeni Azərbaycan Partiyası,12,Qaradağ-Binəqədi-Yasamal seçim dairəsi,5,2015-12-01,,,,,
92bb9804-f78b-4b5c-9e2f-2f1ebdea3fb3,Musa Cəfər oğlu Qasımlı,Musa Cəfər oğlu Qasımlı,,,,Independent,IND,72,Yardımlı-Masallı seçim dairəsi,5,2015-12-01,,,,Q327591,
494a0d42-c27f-4704-a8cf-e6cb5ac6a0fd,Musa İsa oğlu Quliyev (Urud),Musa İsa oğlu Quliyev (Urud),,,,Yeni Azərbaycan Partiyası,Yeni Azərbaycan Partiyası,40,Kəpəz II seçim dairəsi (Gəncə şəhəri),5,2015-12-01,,,,,
22589404-e546-4cbf-a578-060987289f9c,Muxtar Bahadur oğlu Babayev,Muxtar Bahadur oğlu Babayev,,,,Yeni Azərbaycan Partiyası,Yeni Azərbaycan Partiyası,43,Sumqayıt III seçim dairəsi,5,2015-12-01,,,,,
9f8637c9-9d18-4e69-995d-a8622711d72f,Müslüm Mürsəl oğlu Məmmədov,Müslüm Mürsəl oğlu Məmmədov,,,,Independent,IND,57,Kürdəmir seçim dairəsi,5,2015-12-01,,,,Q327591,
b5b90894-06e0-4942-8d0b-254ffcfebdfa,Məlahət İbrahim qızı Həsənova,Məlahət İbrahim qızı Həsənova,,,,Yeni Azərbaycan Partiyası,Yeni Azərbaycan Partiyası,21,Nəsimi I seçim dairəsi,5,2015-12-01,,,,,
ecabc6d3-bd70-44af-9485-c705c97e82e4,Naqif Ələşrəf oğlu Həmzəyev,Naqif Ələşrəf oğlu Həmzəyev,,,,Yeni Azərbaycan Partiyası,Yeni Azərbaycan Partiyası,38,Nizami II seçim dairəsi (Gəncə şəhəri),5,2015-12-01,,,,,
5c086090-d292-4286-8101-16320d1cdc74,Nizami Qulu oğlu Cəfərov,Nizami Qulu oğlu Cəfərov,,,,Yeni Azərbaycan Partiyası,Yeni Azərbaycan Partiyası,108,Ağstafa seçim dairəsi,5,2015-12-01,,,,,
eddd7c68-b404-465d-918f-f5c1ea298a2a,Novruzəli Davud oğlu Aslanov,Novruzəli Davud oğlu Aslanov,,,,Independent,IND,86,İsmayıllı seçim dairəsi,5,2015-12-01,,,,Q327591,
9fda33e2-bbf9-42aa-83b6-a5ef096d6ca6,Nəriman Əlibala oğlu Əliyev,Nəriman Əlibala oğlu Əliyev,,,,Yeni Azərbaycan Partiyası,Yeni Azərbaycan Partiyası,70,Masallı şəhər seçim dairəsi,5,2015-12-01,,,,,
22bb3099-6aa3-40e8-8fb9-1bc6df35d8ac,Nəsib Məhəmməd oğlu Məhəməliyev,Nəsib Məhəmməd oğlu Məhəməliyev,,,,Yeni Azərbaycan Partiyası,Yeni Azərbaycan Partiyası,109,Balakən seçim dairəsi,5,2015-12-01,,,,,
ab1a9c6b-315b-4854-b76b-a67f41049c48,Oqtay Sabir oğlu Əsədov,Oqtay Sabir oğlu Əsədov,,,,Yeni Azərbaycan Partiyası,Yeni Azərbaycan Partiyası,45,Abşeron seçim dairəsi,5,2015-12-01,,,,,
4abcb57b-758f-435b-af7e-a6244635acbc,Pərvin Orxan qızı Kərimzadə,Pərvin Orxan qızı Kərimzadə,,,,Yeni Azərbaycan Partiyası,Yeni Azərbaycan Partiyası,37,Nizami I seçim dairəsi (Gəncə şəhəri),5,2015-12-01,,,,,
7b8f8625-aba0-4726-9d48-931fd26ed866,Qüdrət Müzəffər oğlu Həsənquliyev,Qüdrət Müzəffər oğlu Həsənquliyev,,,,Bütöv Azərbaycan Xalq Cəbhəsi Partiyası,Bütöv Azərbaycan Xalq Cəbhəsi Partiyası,7,Ordubad-Culfa seçim dairəsi,5,2015-12-01,,,,,
735abd80-4ecb-457a-8991-95a805ed88fc,Qənirə Ələsgər qızı Paşayeva,Qənirə Ələsgər qızı Paşayeva,,,,Independent,IND,105,Tovuz seçim dairəsi,5,2015-12-01,,,,Q327591,
709e5f20-1481-4bae-befc-7a1c3a542673,Rafael Baba oğlu Hüseynov,Rafael Baba oğlu Hüseynov,,,,Independent,IND,58,Hacıqabul-Kürdəmir seçim dairəsi,5,2015-12-01,,,,Q327591,
8d927d67-3348-4f4f-95d8-b0248b1b8c67,Rafael Kamil oğlu Cəbrayılov,Rafael Kamil oğlu Cəbrayılov,,,,Independent,IND,46,Şirvan seçim dairəsi,5,2015-12-01,,,,Q327591,
d3eb7f9d-cc8f-480e-894c-363bd70ce518,Rafiq Musa oğlu Məmmədhəsənov,Rafiq Musa oğlu Məmmədhəsənov,,,,Yeni Azərbaycan Partiyası,Yeni Azərbaycan Partiyası,104,Gədəbəy-Tovuz seçim dairəsi,5,2015-12-01,,,,,
bcaed687-1f1e-4701-a704-4dbb0277c28a,Rasim Nəsrəddin oğlu Musabəyov,Rasim Nəsrəddin oğlu Musabəyov,,,,Independent,IND,18,Nərimanov-Nizami seçim dairəsi,5,2015-12-01,,,,Q327591,
78fe655e-f416-49a4-b4c1-eda70abfefbc,Rauf Asif oğlu Əliyev,Rauf Asif oğlu Əliyev,,,,Yeni Azərbaycan Partiyası,Yeni Azərbaycan Partiyası,13,Xəzər I seçim dairəsi,5,2015-12-01,,,,,
47a861d7-cc20-4619-a539-f73ea2a43705,Rövnəq İbrahim oğlu Abdullayev,Rövnəq İbrahim oğlu Abdullayev,,,,Yeni Azərbaycan Partiyası,Yeni Azərbaycan Partiyası,24,Nizami I seçim dairəsi,5,2015-12-01,,,,,
974b0623-f1c8-413d-8f40-c33ba8fb9af7,Rövşən Şükür oğlu Rzayev,Rövşən Şükür oğlu Rzayev,,,,Independent,IND,101,Göygöl-Daşkəsən seçim dairəsi,5,2015-12-01,,,,Q327591,
5e700054-0a97-4459-a0ae-da317f750858,Rüfət Atakişi oğlu Quliyev,Rüfət Atakişi oğlu Quliyev,,,,Independent,IND,73,Lənkəran şəhər seçim dairəsi,5,2015-12-01,,,,Q327591,
82cfa7b4-fe4b-4d20-88ac-a67d47584d41,Rüstəm Gülabba oğlu Xəlilov,Rüstəm Gülabba oğlu Xəlilov,,,,Yeni Azərbaycan Partiyası,Yeni Azərbaycan Partiyası,64,Sabirabad II seçim dairəsi,5,2015-12-01,,,,,
78842716-1b4c-4740-832d-f24c66333838,Rəşad Məmmədqulu oğlu Mahmudov,Rəşad Məmmədqulu oğlu Mahmudov,,,,Yeni Azərbaycan Partiyası,Yeni Azərbaycan Partiyası,77,Astara seçim dairəsi,5,2015-12-01,,,,,
48069b38-553e-45b6-906b-a7649ee71588,Sabir Kamal oğlu Hacıyev,Sabir Kamal oğlu Hacıyev,,,,Vətəndaş Birliyi Partiyası,Vətəndaş Birliyi Partiyası,88,Göyçay seçim dairəsi,5,2015-12-01,,,,,
f1796d80-8195-4564-84ec-6186e0b3f3de,Sahib Eyvaz oğlu Alıyev,Sahib Eyvaz oğlu Alıyev,,,,Independent,IND,95,Tərtər seçim dairəsi,5,2015-12-01,,,,Q327591,
27fe96f9-2f3e-499f-ba7a-0be00cacdf67,Sahibə Əli qızı Qafarova,Sahibə Əli qızı Qafarova,,,,Yeni Azərbaycan Partiyası,Yeni Azərbaycan Partiyası,98,Şəmkir şəhər seçim dairəsi,5,2015-12-01,,,,,
11b1b418-a51f-448b-bade-8d1b2103cc14,Sevinc Həbib qızı Fətəliyeva,Sevinc Həbib qızı Fətəliyeva,,,,Yeni Azərbaycan Partiyası,Yeni Azərbaycan Partiyası,30,Suraxanı I seçim dairəsi,5,2015-12-01,,,,,
c7e2d962-71f0-4451-8cce-a066cdb37893,Sevinc Əmirəhməd qızı Hüseynova,Sevinc Əmirəhməd qızı Hüseynova,,,,Yeni Azərbaycan Partiyası,Yeni Azərbaycan Partiyası,103,Gədəbəy seçim dairəsi,5,2015-12-01,,,,,
b886d009-c8ba-4bbd-8749-46b6a55ad79e,Siyavuş Dünyamalı oğlu Novruzov,Siyavuş Dünyamalı oğlu Novruzov,,,,Yeni Azərbaycan Partiyası,Yeni Azərbaycan Partiyası,5,Şahbuz-Babək seçim dairəsi,5,2015-12-01,,,,,
b20c2e76-a642-4dd2-a3ce-5581ebeaae9f,Sona Sakit qızı Əliyeva,Sona Sakit qızı Əliyeva,,,,Yeni Azərbaycan Partiyası,Yeni Azərbaycan Partiyası,99,Şəmkir qəsəbə seçim dairəsi,5,2015-12-01,,,,,
f91e43ba-c425-4a7e-93f9-ee2aafd957ab,Sədaqət Süleyman qızı Vəliyeva,Sədaqət Süleyman qızı Vəliyeva,,,,Yeni Azərbaycan Partiyası,Yeni Azərbaycan Partiyası,25,Nizami II seçim dairəsi,5,2015-12-01,,,,,
05a807b7-e6fc-4d07-b1d9-309b62bf120d,Səməd İsmayıl oğlu Seyidov,Səməd İsmayıl oğlu Seyidov,,,,Yeni Azərbaycan Partiyası,Yeni Azərbaycan Partiyası,36,Xətai IV seçim dairəsi,5,2015-12-01,,,,,
4a649b2c-b24c-4795-a632-15a319961205,Səttar Suliddin oğlu Mehbalıyev,Səttar Suliddin oğlu Mehbalıyev,,,,Independent,IND,3,Babək-Kəngərli-Naxçıvan seçim dairəsi,5,2015-12-01,,,,Q327591,
d54ea870-78db-46ef-8a2f-4fcbc607e9d5,Tahir Famil oğlu oğlu Mirkişili,Tahir Famil oğlu oğlu Mirkişili,,,,Yeni Azərbaycan Partiyası,Yeni Azərbaycan Partiyası,42,Sumqayıt II seçim dairəsi,5,2015-12-01,,,,,
3f077dbd-7dee-40f0-98b7-280d8429684d,Tahir Musa oğlu Rzayev,Tahir Musa oğlu Rzayev,,,,Yeni Azərbaycan Partiyası,Yeni Azərbaycan Partiyası,82,Ağcabədi seçim dairəsi,5,2015-12-01,,,,,
01e34364-0ecf-4bc7-9662-683874209806,Tahir Süleyman oğlu Süleymanov,Tahir Süleyman oğlu Süleymanov,,,,Yeni Azərbaycan Partiyası,Yeni Azərbaycan Partiyası,54,Şabran-Siyəzən seçim dairəsi,5,2015-12-01,,,,,
e8cf96c0-8358-4e06-950e-8d619d862510,Tahir Zayıdağa oğlu Kərimli,Tahir Zayıdağa oğlu Kərimli,,,,Vəhdət Partiyası,Vəhdət Partiyası,87,Ağsu-İsmayıllı seçim dairəsi,5,2015-12-01,,,,,
5c89377f-dfb8-4856-9386-84e3bc6a6297,Vahid Qazməmməd oğlu Əhmədov,Vahid Qazməmməd oğlu Əhmədov,,,,Independent,IND,52,Quba seçim dairəsi,5,2015-12-01,,,,Q327591,
06bb99b5-2160-447d-a629-b3c96ada71c0,Valeh Feyruz oğlu Ələsgərov,Valeh Feyruz oğlu Ələsgərov,,,,Independent,IND,102,Samux-Şəmkir seçim dairəsi,5,2015-12-01,,,,Q327591,
7c14bdb3-2b4c-40ae-9017-31fa412c400f,Vasif Yusif oğlu Talıbov,Vasif Yusif oğlu Talıbov,,,,Yeni Azərbaycan Partiyası,Yeni Azərbaycan Partiyası,1,Şərur-Sədərək seçim dairəsi,5,2015-12-01,,,,,
f2515ecf-dcdb-4570-80e2-1d1a643d203d,Vüsal Əfqan oğlu Hüseynov,Vüsal Əfqan oğlu Hüseynov,,,,Yeni Azərbaycan Partiyası,Yeni Azərbaycan Partiyası,91,Ucar seçim dairəsi,5,2015-12-01,,,,,
32a44efa-5279-4e80-a414-daa002ea6370,Xanhüseyn Hüseynağa oğlu Kazımlı,Xanhüseyn Hüseynağa oğlu Kazımlı,,,,Azərbaycan Sosial Rifah Partiyası,Azərbaycan Sosial Rifah Partiyası,66,Biləsuvar seçim dairəsi,5,2015-12-01,,,,,
a751c1cc-d53b-45fa-aeb9-680900145005,Xanlar Nuru oğlu Fətiyev,Xanlar Nuru oğlu Fətiyev,,,,Yeni Azərbaycan Partiyası,Yeni Azərbaycan Partiyası,39,Kəpəz I seçim dairəsi (Gəncə şəhəri),5,2015-12-01,,,,,
d8353d9f-51a6-4ad1-9c59-2b4d7425761c,Yaqub Mikayıl oğlu Mahmudov,Yaqub Mikayıl oğlu Mahmudov,,,,Yeni Azərbaycan Partiyası,Yeni Azərbaycan Partiyası,113,Şəki şəhər seçim dairəsi,5,2015-12-01,,,,,
ab511ae7-a9eb-49cf-b750-fda11b3268dc,Yevda Sasun oğlu Abramov,Yevda Sasun oğlu Abramov,,,,Yeni Azərbaycan Partiyası,Yeni Azərbaycan Partiyası,53,Quba-Qusar seçim dairəsi,5,2015-12-01,,,,,
139496f1-26a3-468e-965a-7b156fceb746,Zahid Məhərrəm oğlu Oruc,Zahid Məhərrəm oğlu Oruc,,,,Independent,IND,94,Bərdə qəsəbə seçim dairəsi,5,2015-12-01,,,,Q327591,
ba7fe5ae-3f59-4b06-a506-87940b1f11f2,Zeynəb Yəhya qızı Xanlarova,Zeynəb Yəhya qızı Xanlarova,,,,Independent,IND,50,Qobustan-Xızı-Sumqayıt seçim dairəsi,5,2015-12-01,,,,Q327591,
e179c85b-0e64-4f34-8ec3-60960111f0a5,Ziyad Əliabbas oğlu Səmədzadə,Ziyad Əliabbas oğlu Səmədzadə,,,,Independent,IND,23,Nəsimi-Səbail seçim dairəsi,5,2015-12-01,,,,Q327591,
d8e0e109-f907-422e-84c1-563ac522baf1,Ziyafət Abbas oğlu Əsgərov,Ziyafət Abbas oğlu Əsgərov,,,,Yeni Azərbaycan Partiyası,Yeni Azərbaycan Partiyası,76,Lənkəran-Astara seçim dairəsi,5,2015-12-01,,,,,
21035c27-c342-4a8f-af07-aa775fb79def,Çingiz Aşralı oğlu Qənizadə,Çingiz Aşralı oğlu Qənizadə,,,,Independent,IND,80,İmişli-Beyləqan seçim dairəsi,5,2015-12-01,,,,Q327591,
ffc153ee-8835-4b47-87b5-da2a9d86523b,Ülvi Zahid oğlu Quliyev,Ülvi Zahid oğlu Quliyev,,,,Independent,IND,15,Yasamal I seçim dairəsi,5,2015-12-01,,,,Q327591,
75acf557-2944-4346-8375-48eb80940db5,Ülviyyə Cavanşir qızı Ağayeva,Ülviyyə Cavanşir qızı Ağayeva,,,,Independent,IND,106,Tovuz-Qazax-Ağstafa seçim dairəsi,5,2015-12-01,,,,Q327591,
0627981b-7e99-4a05-90d6-800491c72437,Ülviyyə Tapdıq qızı Həmzəyeva,Ülviyyə Tapdıq qızı Həmzəyeva,,,,Yeni Azərbaycan Partiyası,Yeni Azərbaycan Partiyası,6,Culfa-Babək seçim dairəsi,5,2015-12-01,,,,,
b0359175-e682-4666-87f6-ab46a129289e,İlham Kazım oğlu Məmmədov,İlham Kazım oğlu Məmmədov,,,,Yeni Azərbaycan Partiyası,Yeni Azərbaycan Partiyası,48,Yevlax seçim dairəsi,5,2015-12-01,,,,,
bb12f325-24ef-4972-bf13-ebf4f8121135,İlham Əlisəftər oğlu Əliyev,İlham Əlisəftər oğlu Əliyev,,,,Yeni Azərbaycan Partiyası,Yeni Azərbaycan Partiyası,56,Xaçmaz qəsəbə seçim dairəsi,5,2015-12-01,,,,,
40daa91c-a003-4f73-880a-27055626c06b,İmamverdi İbiş oğlu İsmayılov,İmamverdi İbiş oğlu İsmayılov,,,,Yeni Azərbaycan Partiyası,Yeni Azərbaycan Partiyası,125,Zəngilan-Qubadlı seçim dairəsi,5,2015-12-01,,,,,
edd49c96-8540-4eae-94cc-28a373e6701d,İqbal Nəriman oğlu Məmmədov,İqbal Nəriman oğlu Məmmədov,,,,Yeni Azərbaycan Partiyası,Yeni Azərbaycan Partiyası,78,Lerik seçim dairəsi,5,2015-12-01,,,,,
d26ff58f-d401-49e4-aa15-a3ebbfaeb10f,İsa Əkbər oğlu Həbibbəyli,İsa Əkbər oğlu Həbibbəyli,,,,Yeni Azərbaycan Partiyası,Yeni Azərbaycan Partiyası,2,Şərur seçim dairəsi,5,2015-12-01,,,,,
ed136eca-ff16-4735-ad77-2dcd3eb3fd9e,Şahin Əmir oğlu İsmayılov,Şahin Əmir oğlu İsmayılov,,,,Yeni Azərbaycan Partiyası,Yeni Azərbaycan Partiyası,81,Beyləqan seçim dairəsi,5,2015-12-01,,,,,
ee6e2745-bb73-45ff-b376-9547802252ea,Şəmsəddin Hümmət oğlu Hacıyev,Şəmsəddin Hümmət oğlu Hacıyev,,,,Yeni Azərbaycan Partiyası,Yeni Azərbaycan Partiyası,29,Səbail seçim dairəsi,5,2015-12-01,,,,,
e9feabf4-ee2a-4b77-85c5-8e43e9a8c418,Əflatun Əhməd oğlu Amaşov,Əflatun Əhməd oğlu Amaşov,,,,Independent,IND,62,Saatlı seçim dairəsi,5,2015-12-01,,,,Q327591,
abe82ca6-8c4e-4e6d-a2a0-3d69b2c353b7,Əhliman Tapdıq oğlu Əmiraslanov,Əhliman Tapdıq oğlu Əmiraslanov,,,,Yeni Azərbaycan Partiyası,Yeni Azərbaycan Partiyası,65,Saatlı-Sabirabad-Kürdəmir seçim dairəsi,5,2015-12-01,,,,,
3736e80a-7e5b-43a5-9ffa-cda5c0522156,Əli Məhəmməd oğlu Hüseynli,Əli Məhəmməd oğlu Hüseynli,,,,Yeni Azərbaycan Partiyası,Yeni Azərbaycan Partiyası,49,Yevlax-Mingəçevir seçim dairəsi,5,2015-12-01,,,,,
f9de3e23-41f4-4692-9479-235bdab0f77a,Əli Əhməd oğlu Məsimli,Əli Əhməd oğlu Məsimli,,,,Independent,IND,114,Şəki qəsəbə I seçim dairəsi,5,2015-12-01,,,,Q327591,
71a12153-4cef-4073-8169-01f62580ab0e,Əliağa İzzət oğlu Hüseynov,Əliağa İzzət oğlu Hüseynov,,,,Independent,IND,59,Salyan seçim dairəsi,5,2015-12-01,,,,Q327591,
a5f55df2-c30e-4e4e-95cc-a75cf0c6e035,Əsabil Qarakişi oğlu Qasımov,Əsabil Qarakişi oğlu Qasımov,,,,Yeni Azərbaycan Partiyası,Yeni Azərbaycan Partiyası,79,İmişli seçim dairəsi,5,2015-12-01,,,,,
