id,name,sort_name,email,twitter,facebook,group,group_id,area_id,area,term,start_date,image,gender,wikidata,wikidata_group,wikidata_area
2e257563-27a1-4bec-b866-7048be3850ec,Adil Abış oğlu Əliyev,Adil Abış oğlu Əliyev,,,,Independent,IND,20,Nərimanov II seçim dairəsi,5,2015-12-01,,,,Q327591,
f0d458aa-9a33-48a8-951e-e7ed43af7ec9,Aqil Məhəmməd oğlu Abbas,Aqil Məhəmməd oğlu Abbas,,,,Independent,IND,83,Ağcabədi-Füzuli seçim dairəsi,5,2015-12-01,,,,Q327591,
293194ba-4463-4db2-97fb-63defbe9014f,Aqiyə Həbib qızı Naxçıvanlı,Aqiyə Həbib qızı Naxçıvanlı,,,,Yeni Azərbaycan Partiyası,Yeni Azərbaycan Partiyası,117,Oğuz-Qəbələ seçim dairəsi,5,2015-12-01,,,,,
165df429-d4f9-42a4-bbf1-783c514a7a9e,Araz Məmməd-Mübariz oğlu Əlizadə,Araz Məmməd-Mübariz oğlu Əlizadə,,,,Azərbaycan Sosial Demokrat Partiyası,Azərbaycan Sosial Demokrat Partiyası,35,Xətai III seçim dairəsi,5,2015-12-01,,,,,
4fd3e3d3-3acb-44e6-94c5-b415d2601361,Arif Qafar oğlu Rəhimzadə,Arif Qafar oğlu Rəhimzadə,,,,Yeni Azərbaycan Partiyası,Yeni Azərbaycan Partiyası,61,Neftçala seçim dairəsi,5,2015-12-01,,,,,
dc3b6f97-85b8-4a31-b769-608bb0ecbdf3,Asim Nazim oğlu Mollazadə,Asim Nazim oğlu Mollazadə,,,,Azərbaycan Demokratik İslahatlar Partiyası,Azərbaycan Demokratik İslahatlar Partiyası,22,Nəsimi II seçim dairəsi,5,2015-12-01,,,,,
ba9a94c5-56ab-4164-bb94-81c4bab266a0,Astan Nuşrəvan oğlu Şahverdiyev,Astan Nuşrəvan oğlu Şahverdiyev,,,,Yeni Azərbaycan Partiyası,Yeni Azərbaycan Partiyası,120,Cəbrayıl-Qubadlı seçim dairəsi,5,2015-12-01,,,,,
57021971-d303-4dbf-9a15-5e4982d9488c,Aydın Böyükkişi oğlu Mirzəzadə,Aydın Böyükkişi oğlu Mirzəzadə,,,,Yeni Azərbaycan Partiyası,Yeni Azərbaycan Partiyası,47,Mingəçevir seçim dairəsi,5,2015-12-01,,,,,
bfec9c12-c78c-4d15-870d-7a4f15a15f6d,Aydın Nəsir oğlu Hüseynov,Aydın Nəsir oğlu Hüseynov,,,,Yeni Azərbaycan Partiyası,Yeni Azərbaycan Partiyası,11,Qaradağ seçim dairəsi,5,2015-12-01,,,,,
b5aea6e2-2c57-4a14-9231-d20b8749666a,Aytən İnqilab qızı Mustafazadə,Aytən İnqilab qızı Mustafazadə,,,,Independent,IND,16,Yasamal II seçim dairəsi,5,2015-12-01,,,,Q327591,
d544f9e0-c87b-45d6-af4e-34f2cf51191a,Azay Əjdər oğlu Quliyev,Azay Əjdər oğlu Quliyev,,,,Independent,IND,8,Binəqədi I seçim dairəsi,5,2015-12-01,,,,Q327591,
7ec071c4-7c38-4bdf-bca0-64355ae91ba1,Azər Camal oğlu Badamov,Azər Camal oğlu Badamov,,,,Yeni Azərbaycan Partiyası,Yeni Azərbaycan Partiyası,51,Qusar seçim dairəsi,5,2015-12-01,,,,,
ac4b722e-c4cb-4ee9-ad23-07eae007178f,Azər Şəmşid oğlu Kərimli,Azər Şəmşid oğlu Kərimli,,,,Independent,IND,112,Qax seçim dairəsi,5,2015-12-01,,,,Q327591,
868a7007-8840-4d17-8c78-76abf9a9dcab,Ağacan Qulam oğlu Abıyev,Ağacan Qulam oğlu Abıyev,,,,Yeni Azərbaycan Partiyası,Yeni Azərbaycan Partiyası,32,Suraxanı III seçim dairəsi,5,2015-12-01,,,,,
dca998e5-0e0b-441d-b78f-12e144e4c925,Ağalar İsrafil oğlu Vəliyev,Ağalar İsrafil oğlu Vəliyev,,,,Yeni Azərbaycan Partiyası,Yeni Azərbaycan Partiyası,97,Goranboy-Ağdam-Tərtər seçim dairəsi,5,2015-12-01,,,,,
8aeeb870-87c1-4e33-a442-16e947e3af6c,Bahar Əvəz qızı Muradova,Bahar Əvəz qızı Muradova,,,,Yeni Azərbaycan Partiyası,Yeni Azərbaycan Partiyası,84,Füzuli seçim dairəsi,5,2015-12-01,,,,,
6386d241-925d-4871-b49f-2d6631fb0b6f,Bəxtiyar Həmzə oğlu Əliyev,Bəxtiyar Həmzə oğlu Əliyev,,,,Independent,IND,118,Ağdam şəhər seçim dairəsi,5,2015-12-01,,,,Q327591,
1823a87e-12b1-43ab-a629-7cbe24cc2396,Bəxtiyar Yusif oğlu Sadıqov,Bəxtiyar Yusif oğlu Sadıqov,,,,Yeni Azərbaycan Partiyası,Yeni Azərbaycan Partiyası,119,Ağdam qəsəbə seçim dairəsi,5,2015-12-01,,,,,
06568a6e-253c-44aa-9989-d3095763202f,Cavanşir Hümmət oğlu Paşazadə,Cavanşir Hümmət oğlu Paşazadə,,,,Yeni Azərbaycan Partiyası,Yeni Azərbaycan Partiyası,75,Lənkəran-Masallı seçim dairəsi,5,2015-12-01,,,,,
a24d859c-7b95-4b5a-9028-02a9d6d08fd8,Cavanşir Əyyub oğlu Feyziyev,Cavanşir Əyyub oğlu Feyziyev,,,,Independent,IND,115,Şəki qəsəbə II seçim dairəsi,5,2015-12-01,,,,Q327591,
ebf3ee28-cd40-4987-b7e9-d3636bef0c27,Cavid Həmid oğlu Osmanov,Cavid Həmid oğlu Osmanov,,,,Yeni Azərbaycan Partiyası,Yeni Azərbaycan Partiyası,90,Ağdaş seçim dairəsi,5,2015-12-01,,,,,
11f43a3d-0d81-4892-a86d-def4e83014a9,Cavid Qənbər oğlu Qurbanov,Cavid Qənbər oğlu Qurbanov,,,,Yeni Azərbaycan Partiyası,Yeni Azərbaycan Partiyası,123,Kəlbəcər seçim dairəsi,5,2015-12-01,,,,,
452cb245-33c8-443b-a4b6-85a11174c6fc,Dilarə Məmmədağa qızı Cəbrayılova,Dilarə Məmmədağa qızı Cəbrayılova,,,,Yeni Azərbaycan Partiyası,Yeni Azərbaycan Partiyası,27,Sabunçu II seçim dairəsi,5,2015-12-01,,,,,
7d875a36-2f13-4cdd-861e-4f5b2bd87520,Eldar Allahyar oğlu Quliyev,Eldar Allahyar oğlu Quliyev,,,,Independent,IND,28,Sabunçu III seçim dairəsi,5,2015-12-01,,,,Q327591,
eab1e573-dad5-4f8b-a02b-daf353753d8f,Eldar Rza oğlu İbrahimov,Eldar Rza oğlu İbrahimov,,,,Yeni Azərbaycan Partiyası,Yeni Azərbaycan Partiyası,4,Naxçıvan şəhər seçim dairəsi,5,2015-12-01,,,,,
ee6813ca-046c-4157-a52c-de5a37395324,Eldəniz Adil oğlu Səlimov,Eldəniz Adil oğlu Səlimov,,,,Yeni Azərbaycan Partiyası,Yeni Azərbaycan Partiyası,55,Xaçmaz şəhər seçim dairəsi,5,2015-12-01,,,,,
3dc3cfb2-158a-45d0-ad39-0e6d0ea69c93,Elman Camal oğlu Məmmədov,Elman Camal oğlu Məmmədov,,,,Yeni Azərbaycan Partiyası,Yeni Azərbaycan Partiyası,124,Şuşa-Ağdam-Xocalı-Xocavənd seçim dairəsi,5,2015-12-01,,,,,
663a341e-afcf-4492-9d1a-11c8f0749be9,Elman Xudam oğlu Nəsirli,Elman Xudam oğlu Nəsirli,,,,Yeni Azərbaycan Partiyası,Yeni Azərbaycan Partiyası,89,Göyçay-Ağdaş seçim dairəsi,5,2015-12-01,,,,,
1c688e38-109f-4a61-bcfa-c4271becebb0,Elmira Hüseyn qızı Axundova,Elmira Hüseyn qızı Axundova,,,,Independent,IND,71,Masallı qəsəbə seçim dairəsi,5,2015-12-01,,,,Q327591,
b62bcf05-f915-41e3-938d-165a5b3f9dd6,Elxan Sirac oğlu Süleymanov,Elxan Sirac oğlu Süleymanov,,,,Independent,IND,85,Şamaxı seçim dairəsi,5,2015-12-01,,,,Q327591,
5d0d0acf-57f3-4660-8690-6ff2f0b22252,Elçin Bəybala oğlu Quliyev,Elçin Bəybala oğlu Quliyev,,,,Yeni Azərbaycan Partiyası,Yeni Azərbaycan Partiyası,63,Sabirabad I seçim dairəsi,5,2015-12-01,,,,,
5c62e701-a209-47dc-a1d4-175244b17d09,Elşad Eldar oğlu Həsənov,Elşad Eldar oğlu Həsənov,,,,Independent,IND,17,Yasamal III seçim dairəsi,5,2015-12-01,,,,Q327591,
5a06ac64-33bd-408f-bbe1-94e2cfa8096f,Elşən Məmmədhənifə oğlu Musayev,Elşən Məmmədhənifə oğlu Musayev,,,,Azərbaycan Demokratik Maarifçilik Partiyası,Azərbaycan Demokratik Maarifçilik Partiyası,110,Zaqatala seçim dairəsi,5,2015-12-01,,,,,
183c7543-35a0-47ad-b4ca-acce15242da7,Fazil Qəzənfər oğlu Mustafa,Fazil Qəzənfər oğlu Mustafa,,,,Böyük Quruluş Partiyası,Böyük Quruluş Partiyası,26,Sabunçu I seçim dairəsi,5,2015-12-01,,,,,
a4fc2c50-a4e7-429d-af69-42fa4587e5c8,Flora Qasım qızı Qasımova,Flora Qasım qızı Qasımova,,,,Independent,IND,122,Xankəndi seçim dairəsi,5,2015-12-01,,,,Q327591,
8ec848dd-39c2-4ced-8b0a-0c14915e6ecb,Fuad Rauf oğlu Muradov,Fuad Rauf oğlu Muradov,,,,Independent,IND,34,Xətai II seçim dairəsi,5,2015-12-01,,,,Q327591,
aebc56ad-a414-4d40-a278-fbaa69aef7e7,Fərəc İbrahim oğlu Quliyev,Fərəc İbrahim oğlu Quliyev,,,,Milli Dirçəliş Hərəkatı Partiyası,Milli Dirçəliş Hərəkatı Partiyası,31,Suraxanı II seçim dairəsi,5,2015-12-01,,,,,
63bbef8f-5bb9-4088-b6c5-77999aedb4fc,Fəttah Səməd oğlu Heydərov,Fəttah Səməd oğlu Heydərov,,,,Independent,IND,116,Qəbələ seçim dairəsi,5,2015-12-01,,,,Q327591,
c3179cd5-52d3-45f6-a24c-8dcc665dc5dd,Fəzail Feyruz oğlu İbrahimli,Fəzail Feyruz oğlu İbrahimli,,,,Vətəndaş Həmrəyliyi Partiyası,Vətəndaş Həmrəyliyi Partiyası,69,Cəlilabad-Masallı-Biləsuvar seçim dairəsi,5,2015-12-01,,,,,
499dc911-3fe7-4285-b0d0-c2f069308ec1,Fəzail Rəhim oğlu Ağamalı,Fəzail Rəhim oğlu Ağamalı,,,,Ana Vətən Partiyası,Ana Vətən Partiyası,60,Salyan-Neftçala seçim dairəsi,5,2015-12-01,,,,,
979c30c5-7a3e-4a59-880f-a93aec624f1c,Gövhər Baxşəli qızı Baxşəliyeva,Gövhər Baxşəli qızı Baxşəliyeva,,,,Independent,IND,93,Bərdə şəhər seçim dairəsi,5,2015-12-01,,,,Q327591,
497870aa-0fde-4f12-a305-0eed9fe2bf56,Hacı Hacıbaba oğlu Salayev,Hacı Hacıbaba oğlu Salayev,,,,Independent,IND,44,Sumqayıt-Abşeron seçim dairəsi,5,2015-12-01,,,,Q327591,
addd9e60-ab2f-46b8-9917-05e3a51eab06,Hadı Musa oğlu Rəcəbli,Hadı Musa oğlu Rəcəbli,,,,Yeni Azərbaycan Partiyası,Yeni Azərbaycan Partiyası,74,Lənkəran qəsəbə seçim dairəsi,5,2015-12-01,,,,,
ebaaf71d-9514-439a-9697-745b6f0be4fd,Hikmət Baba oğlu Məmmədov,Hikmət Baba oğlu Məmmədov,,,,Yeni Azərbaycan Partiyası,Yeni Azərbaycan Partiyası,19,Nərimanov I seçim dairəsi,5,2015-12-01,,,,,
2c4a9075-6eec-4912-92a1-ed1a6cf8ab0b,Hüseynbala Fazil oğlu Mirələmov,Hüseynbala Fazil oğlu Mirələmov,,,,Yeni Azərbaycan Partiyası,Yeni Azərbaycan Partiyası,33,Xətai I seçim dairəsi,5,2015-12-01,,,,,
fb73c115-d29d-4ed5-b2c7-c94bad22cb76,Jalə Fazil qızı Əliyeva,Jalə Fazil qızı Əliyeva,,,,Independent,IND,92,Zərdab-Ucar seçim dairəsi,5,2015-12-01,,,,Q327591,
ef2f9220-04ce-44a3-98f9-aa422461f1e5,Kamaləddin Nəsrəddin oğlu Qafarov,Kamaləddin Nəsrəddin oğlu Qafarov,,,,Yeni Azərbaycan Partiyası,Yeni Azərbaycan Partiyası,9,Binəqədi II seçim dairəsi,5,2015-12-01,,,,,
b3749ab0-5f27-4de0-9c5c-e5621981f1fa,Kamilə Əli Ağa qızı Əliyeva,Kamilə Əli Ağa qızı Əliyeva,,,,Yeni Azərbaycan Partiyası,Yeni Azərbaycan Partiyası,111,Zaqatala-Balakən seçim dairəsi,5,2015-12-01,,,,,
16e9483c-782b-4a78-971b-516aa92eee70,Kamran Fərhad oğlu Bayramov,Kamran Fərhad oğlu Bayramov,,,,Yeni Azərbaycan Partiyası,Yeni Azərbaycan Partiyası,100,Şəmkir-Daşkəsən seçim dairəsi,5,2015-12-01,,,,,
67878e43-dfe5-4d75-9efe-e15b2a5cb112,Kamran Telman oğlu Nəbizadə,Kamran Telman oğlu Nəbizadə,,,,Independent,IND,107,Qazax seçim dairəsi,5,2015-12-01,,,,Q327591,
a766d3a3-6ea7-4378-b1a7-0ac2b1741609,Madər Ələsgər oğlu Musayev,Madər Ələsgər oğlu Musayev,,,,Independent,IND,10,Binəqədi III seçim dairəsi,5,2015-12-01,,,,Q327591,
39385e53-af0a-47c0-99e8-7b86d91ee1d1,Mahir Məhəmmədəli oğlu Aslanov,Mahir Məhəmmədəli oğlu Aslanov,,,,Independent,IND,96,Goranboy-Naftalan seçim dairəsi,5,2015-12-01,,,,Q327591,
a620165e-cd22-471a-b371-e0f87da853fb,Mahir Tapdıq oğlu Abbaszadə,Mahir Tapdıq oğlu Abbaszadə,,,,Yeni Azərbaycan Partiyası,Yeni Azərbaycan Partiyası,121,Laçın seçim dairəsi,5,2015-12-01,,,,,
45e99ab9-8679-4918-9d20-137b02641971,Malik Əvəz oğlu Həsənov,Malik Əvəz oğlu Həsənov,,,,Yeni Azərbaycan Partiyası,Yeni Azərbaycan Partiyası,67,Cəlilabad şəhər seçim dairəsi,5,2015-12-01,,,,,
0a311d45-2492-4927-8649-ad567ff151b7,Mehriban Arif qızı Əliyeva,Mehriban Arif qızı Əliyeva,,,,Yeni Azərbaycan Partiyası,Yeni Azərbaycan Partiyası,14,Xəzər II seçim dairəsi,5,2015-12-01,,,,,
8e0135bb-4508-4da2-a026-a816fff5aec5,Mirkazım Mirməhəmməd oğlu Kazımov,Mirkazım Mirməhəmməd oğlu Kazımov,,,,Yeni Azərbaycan Partiyası,Yeni Azərbaycan Partiyası,68,Cəlilabad qəsəbə seçim dairəsi,5,2015-12-01,,,,,
263d6aa5-1552-4776-9a11-e22110ecc8d9,Mirzəcan Mirzəmməd oğlu Xəlilov,Mirzəcan Mirzəmməd oğlu Xəlilov,,,,Yeni Azərbaycan Partiyası,Yeni Azərbaycan Partiyası,41,Sumqayıt I seçim dairəsi,5,2015-12-01,,,,,
b0eadf00-3ff9-4df5-a043-d27f3996e2a4,Mixail Yuri oğlu Zabelin,Mixail Yuri oğlu Zabelin,,,,Yeni Azərbaycan Partiyası,Yeni Azərbaycan Partiyası,12,Qaradağ-Binəqədi-Yasamal seçim dairəsi,5,2015-12-01,,,,,
666f458c-01d2-4453-9975-ef6a5ed5d9b8,Musa Cəfər oğlu Qasımlı,Musa Cəfər oğlu Qasımlı,,,,Independent,IND,72,Yardımlı-Masallı seçim dairəsi,5,2015-12-01,,,,Q327591,
e66f8b09-e050-4886-ba35-eaf7c054053d,Musa İsa oğlu Quliyev (Urud),Musa İsa oğlu Quliyev (Urud),,,,Yeni Azərbaycan Partiyası,Yeni Azərbaycan Partiyası,40,Kəpəz II seçim dairəsi (Gəncə şəhəri),5,2015-12-01,,,,,
bd53d2e9-9e6f-4933-a1cd-b9666c65067e,Muxtar Bahadur oğlu Babayev,Muxtar Bahadur oğlu Babayev,,,,Yeni Azərbaycan Partiyası,Yeni Azərbaycan Partiyası,43,Sumqayıt III seçim dairəsi,5,2015-12-01,,,,,
01e7e08c-d8d2-49ba-b303-a805eaea9536,Müslüm Mürsəl oğlu Məmmədov,Müslüm Mürsəl oğlu Məmmədov,,,,Independent,IND,57,Kürdəmir seçim dairəsi,5,2015-12-01,,,,Q327591,
659fa255-ebef-4380-8500-f053a65d1139,Məlahət İbrahim qızı Həsənova,Məlahət İbrahim qızı Həsənova,,,,Yeni Azərbaycan Partiyası,Yeni Azərbaycan Partiyası,21,Nəsimi I seçim dairəsi,5,2015-12-01,,,,,
8960b271-0c15-4851-882d-2bb7c7ec1e80,Naqif Ələşrəf oğlu Həmzəyev,Naqif Ələşrəf oğlu Həmzəyev,,,,Yeni Azərbaycan Partiyası,Yeni Azərbaycan Partiyası,38,Nizami II seçim dairəsi (Gəncə şəhəri),5,2015-12-01,,,,,
25768e98-74b0-4228-915e-dddcec356dd8,Nizami Qulu oğlu Cəfərov,Nizami Qulu oğlu Cəfərov,,,,Yeni Azərbaycan Partiyası,Yeni Azərbaycan Partiyası,108,Ağstafa seçim dairəsi,5,2015-12-01,,,,,
ef2088fb-051f-4b96-929e-e44c2fbb7637,Novruzəli Davud oğlu Aslanov,Novruzəli Davud oğlu Aslanov,,,,Independent,IND,86,İsmayıllı seçim dairəsi,5,2015-12-01,,,,Q327591,
94105130-c0ba-4729-b7b0-37e24969ecdf,Nəriman Əlibala oğlu Əliyev,Nəriman Əlibala oğlu Əliyev,,,,Yeni Azərbaycan Partiyası,Yeni Azərbaycan Partiyası,70,Masallı şəhər seçim dairəsi,5,2015-12-01,,,,,
1a5e1505-0b91-49bc-86fd-e770afb0ee99,Nəsib Məhəmməd oğlu Məhəməliyev,Nəsib Məhəmməd oğlu Məhəməliyev,,,,Yeni Azərbaycan Partiyası,Yeni Azərbaycan Partiyası,109,Balakən seçim dairəsi,5,2015-12-01,,,,,
d370bacc-4bcd-4cd7-be37-f21a89ff2e8c,Oqtay Sabir oğlu Əsədov,Oqtay Sabir oğlu Əsədov,,,,Yeni Azərbaycan Partiyası,Yeni Azərbaycan Partiyası,45,Abşeron seçim dairəsi,5,2015-12-01,,,,,
44e53cf2-3758-41c0-ac0c-450f35d069f3,Pərvin Orxan qızı Kərimzadə,Pərvin Orxan qızı Kərimzadə,,,,Yeni Azərbaycan Partiyası,Yeni Azərbaycan Partiyası,37,Nizami I seçim dairəsi (Gəncə şəhəri),5,2015-12-01,,,,,
4e2113c7-313f-40f5-8c6b-8b90f16f00c2,Qüdrət Müzəffər oğlu Həsənquliyev,Qüdrət Müzəffər oğlu Həsənquliyev,,,,Bütöv Azərbaycan Xalq Cəbhəsi Partiyası,Bütöv Azərbaycan Xalq Cəbhəsi Partiyası,7,Ordubad-Culfa seçim dairəsi,5,2015-12-01,,,,,
6d424f70-a98c-43e0-93e1-62803d01a8a9,Qənirə Ələsgər qızı Paşayeva,Qənirə Ələsgər qızı Paşayeva,,,,Independent,IND,105,Tovuz seçim dairəsi,5,2015-12-01,,,,Q327591,
644a481b-11bc-4f95-8938-9f5c5ec71820,Rafael Baba oğlu Hüseynov,Rafael Baba oğlu Hüseynov,,,,Independent,IND,58,Hacıqabul-Kürdəmir seçim dairəsi,5,2015-12-01,,,,Q327591,
c3738130-8ebe-47e7-906f-e87cbaf6a98f,Rafael Kamil oğlu Cəbrayılov,Rafael Kamil oğlu Cəbrayılov,,,,Independent,IND,46,Şirvan seçim dairəsi,5,2015-12-01,,,,Q327591,
e8107043-8afe-4ba6-8da8-16c5b487ecdb,Rafiq Musa oğlu Məmmədhəsənov,Rafiq Musa oğlu Məmmədhəsənov,,,,Yeni Azərbaycan Partiyası,Yeni Azərbaycan Partiyası,104,Gədəbəy-Tovuz seçim dairəsi,5,2015-12-01,,,,,
968224af-6135-401a-ac6e-9d9728cad561,Rasim Nəsrəddin oğlu Musabəyov,Rasim Nəsrəddin oğlu Musabəyov,,,,Independent,IND,18,Nərimanov-Nizami seçim dairəsi,5,2015-12-01,,,,Q327591,
f55832bb-6326-47fb-80e7-fd5d436df13f,Rauf Asif oğlu Əliyev,Rauf Asif oğlu Əliyev,,,,Yeni Azərbaycan Partiyası,Yeni Azərbaycan Partiyası,13,Xəzər I seçim dairəsi,5,2015-12-01,,,,,
33fb41df-844e-4533-a020-8575e987367e,Rövnəq İbrahim oğlu Abdullayev,Rövnəq İbrahim oğlu Abdullayev,,,,Yeni Azərbaycan Partiyası,Yeni Azərbaycan Partiyası,24,Nizami I seçim dairəsi,5,2015-12-01,,,,,
e9fe77d1-3406-43dd-b83d-30edaeefe522,Rövşən Şükür oğlu Rzayev,Rövşən Şükür oğlu Rzayev,,,,Independent,IND,101,Göygöl-Daşkəsən seçim dairəsi,5,2015-12-01,,,,Q327591,
bd5362e7-3e8d-46eb-b1ef-745ee6c8594f,Rüfət Atakişi oğlu Quliyev,Rüfət Atakişi oğlu Quliyev,,,,Independent,IND,73,Lənkəran şəhər seçim dairəsi,5,2015-12-01,,,,Q327591,
b8623b38-e633-469e-904e-ee887f64f904,Rüstəm Gülabba oğlu Xəlilov,Rüstəm Gülabba oğlu Xəlilov,,,,Yeni Azərbaycan Partiyası,Yeni Azərbaycan Partiyası,64,Sabirabad II seçim dairəsi,5,2015-12-01,,,,,
7b1b719e-eb25-49f9-ae5f-0b8ac79369ff,Rəşad Məmmədqulu oğlu Mahmudov,Rəşad Məmmədqulu oğlu Mahmudov,,,,Yeni Azərbaycan Partiyası,Yeni Azərbaycan Partiyası,77,Astara seçim dairəsi,5,2015-12-01,,,,,
6da8b9bf-7f19-4d8a-96eb-d8296b40c9c4,Sabir Kamal oğlu Hacıyev,Sabir Kamal oğlu Hacıyev,,,,Vətəndaş Birliyi Partiyası,Vətəndaş Birliyi Partiyası,88,Göyçay seçim dairəsi,5,2015-12-01,,,,,
dc714461-d596-4775-91b4-1c6e70b6e723,Sahib Eyvaz oğlu Alıyev,Sahib Eyvaz oğlu Alıyev,,,,Independent,IND,95,Tərtər seçim dairəsi,5,2015-12-01,,,,Q327591,
7cb49b7f-94b9-48b4-9cf2-81cb333f539f,Sahibə Əli qızı Qafarova,Sahibə Əli qızı Qafarova,,,,Yeni Azərbaycan Partiyası,Yeni Azərbaycan Partiyası,98,Şəmkir şəhər seçim dairəsi,5,2015-12-01,,,,,
6cebab1e-89cf-46a8-9220-84886a5f22c5,Sevinc Həbib qızı Fətəliyeva,Sevinc Həbib qızı Fətəliyeva,,,,Yeni Azərbaycan Partiyası,Yeni Azərbaycan Partiyası,30,Suraxanı I seçim dairəsi,5,2015-12-01,,,,,
71a6b950-adfc-4087-943f-67071f487bbe,Sevinc Əmirəhməd qızı Hüseynova,Sevinc Əmirəhməd qızı Hüseynova,,,,Yeni Azərbaycan Partiyası,Yeni Azərbaycan Partiyası,103,Gədəbəy seçim dairəsi,5,2015-12-01,,,,,
63e9c56a-ada3-4f9c-ab52-cf45d63ff217,Siyavuş Dünyamalı oğlu Novruzov,Siyavuş Dünyamalı oğlu Novruzov,,,,Yeni Azərbaycan Partiyası,Yeni Azərbaycan Partiyası,5,Şahbuz-Babək seçim dairəsi,5,2015-12-01,,,,,
81528ca2-beaf-4c4a-9573-7f97db322d6e,Sona Sakit qızı Əliyeva,Sona Sakit qızı Əliyeva,,,,Yeni Azərbaycan Partiyası,Yeni Azərbaycan Partiyası,99,Şəmkir qəsəbə seçim dairəsi,5,2015-12-01,,,,,
16997c6a-3bfa-4e22-a56c-0b6e74666431,Sədaqət Süleyman qızı Vəliyeva,Sədaqət Süleyman qızı Vəliyeva,,,,Yeni Azərbaycan Partiyası,Yeni Azərbaycan Partiyası,25,Nizami II seçim dairəsi,5,2015-12-01,,,,,
967bec79-8cf7-427d-8fbd-9747bb01589a,Səməd İsmayıl oğlu Seyidov,Səməd İsmayıl oğlu Seyidov,,,,Yeni Azərbaycan Partiyası,Yeni Azərbaycan Partiyası,36,Xətai IV seçim dairəsi,5,2015-12-01,,,,,
24ee7d83-4fe4-42a9-ad71-d55d4a5064c4,Səttar Suliddin oğlu Mehbalıyev,Səttar Suliddin oğlu Mehbalıyev,,,,Independent,IND,3,Babək-Kəngərli-Naxçıvan seçim dairəsi,5,2015-12-01,,,,Q327591,
24b91911-d7db-44fc-88e6-ea4ff77a1b16,Tahir Famil oğlu oğlu Mirkişili,Tahir Famil oğlu oğlu Mirkişili,,,,Yeni Azərbaycan Partiyası,Yeni Azərbaycan Partiyası,42,Sumqayıt II seçim dairəsi,5,2015-12-01,,,,,
649a54fe-a938-4590-85c9-b17f381675a9,Tahir Musa oğlu Rzayev,Tahir Musa oğlu Rzayev,,,,Yeni Azərbaycan Partiyası,Yeni Azərbaycan Partiyası,82,Ağcabədi seçim dairəsi,5,2015-12-01,,,,,
d0509d71-847e-4f2f-9fef-681093377653,Tahir Süleyman oğlu Süleymanov,Tahir Süleyman oğlu Süleymanov,,,,Yeni Azərbaycan Partiyası,Yeni Azərbaycan Partiyası,54,Şabran-Siyəzən seçim dairəsi,5,2015-12-01,,,,,
bb776133-660d-4b89-a7e9-4f19ddf3dcd1,Tahir Zayıdağa oğlu Kərimli,Tahir Zayıdağa oğlu Kərimli,,,,Vəhdət Partiyası,Vəhdət Partiyası,87,Ağsu-İsmayıllı seçim dairəsi,5,2015-12-01,,,,,
a61d68ce-401d-43c9-a44e-35a9cc1f1837,Vahid Qazməmməd oğlu Əhmədov,Vahid Qazməmməd oğlu Əhmədov,,,,Independent,IND,52,Quba seçim dairəsi,5,2015-12-01,,,,Q327591,
153d6b97-6167-4c32-8b8a-a6b5bca470f1,Valeh Feyruz oğlu Ələsgərov,Valeh Feyruz oğlu Ələsgərov,,,,Independent,IND,102,Samux-Şəmkir seçim dairəsi,5,2015-12-01,,,,Q327591,
2ebd7a59-0f3d-4f5d-8ce8-30aecae9c4ed,Vasif Yusif oğlu Talıbov,Vasif Yusif oğlu Talıbov,,,,Yeni Azərbaycan Partiyası,Yeni Azərbaycan Partiyası,1,Şərur-Sədərək seçim dairəsi,5,2015-12-01,,,,,
19afa636-7323-46bd-860c-812b18704c12,Vüsal Əfqan oğlu Hüseynov,Vüsal Əfqan oğlu Hüseynov,,,,Yeni Azərbaycan Partiyası,Yeni Azərbaycan Partiyası,91,Ucar seçim dairəsi,5,2015-12-01,,,,,
6c7dc21d-60fa-47fe-92aa-57864ad530b7,Xanhüseyn Hüseynağa oğlu Kazımlı,Xanhüseyn Hüseynağa oğlu Kazımlı,,,,Azərbaycan Sosial Rifah Partiyası,Azərbaycan Sosial Rifah Partiyası,66,Biləsuvar seçim dairəsi,5,2015-12-01,,,,,
a37435ff-ac81-4a96-ab8e-ff59c614e3c2,Xanlar Nuru oğlu Fətiyev,Xanlar Nuru oğlu Fətiyev,,,,Yeni Azərbaycan Partiyası,Yeni Azərbaycan Partiyası,39,Kəpəz I seçim dairəsi (Gəncə şəhəri),5,2015-12-01,,,,,
68806bc1-4fe5-4dd1-ab45-83d398b6429c,Yaqub Mikayıl oğlu Mahmudov,Yaqub Mikayıl oğlu Mahmudov,,,,Yeni Azərbaycan Partiyası,Yeni Azərbaycan Partiyası,113,Şəki şəhər seçim dairəsi,5,2015-12-01,,,,,
f056140d-15ff-42da-827c-54bb521334a2,Yevda Sasun oğlu Abramov,Yevda Sasun oğlu Abramov,,,,Yeni Azərbaycan Partiyası,Yeni Azərbaycan Partiyası,53,Quba-Qusar seçim dairəsi,5,2015-12-01,,,,,
6a419557-aea4-41cc-ae36-500e2d270411,Zahid Məhərrəm oğlu Oruc,Zahid Məhərrəm oğlu Oruc,,,,Independent,IND,94,Bərdə qəsəbə seçim dairəsi,5,2015-12-01,,,,Q327591,
f0ca275d-a208-464d-967c-fc4c4d0323dd,Zeynəb Yəhya qızı Xanlarova,Zeynəb Yəhya qızı Xanlarova,,,,Independent,IND,50,Qobustan-Xızı-Sumqayıt seçim dairəsi,5,2015-12-01,,,,Q327591,
1a3bd02f-1252-4ede-affb-36f1d655c6bd,Ziyad Əliabbas oğlu Səmədzadə,Ziyad Əliabbas oğlu Səmədzadə,,,,Independent,IND,23,Nəsimi-Səbail seçim dairəsi,5,2015-12-01,,,,Q327591,
34b1e82f-efc5-4c2f-9339-0b06738874c2,Ziyafət Abbas oğlu Əsgərov,Ziyafət Abbas oğlu Əsgərov,,,,Yeni Azərbaycan Partiyası,Yeni Azərbaycan Partiyası,76,Lənkəran-Astara seçim dairəsi,5,2015-12-01,,,,,
3d0d19bb-e88c-471f-bae2-ac87f66a5e63,Çingiz Aşralı oğlu Qənizadə,Çingiz Aşralı oğlu Qənizadə,,,,Independent,IND,80,İmişli-Beyləqan seçim dairəsi,5,2015-12-01,,,,Q327591,
7c887efc-0e4b-45aa-9196-f1baf831eba3,Ülvi Zahid oğlu Quliyev,Ülvi Zahid oğlu Quliyev,,,,Independent,IND,15,Yasamal I seçim dairəsi,5,2015-12-01,,,,Q327591,
5f72a4fc-d9c5-488c-b2e8-8871b4df7028,Ülviyyə Cavanşir qızı Ağayeva,Ülviyyə Cavanşir qızı Ağayeva,,,,Independent,IND,106,Tovuz-Qazax-Ağstafa seçim dairəsi,5,2015-12-01,,,,Q327591,
23c0c226-e53e-416f-b52b-062c094943f1,Ülviyyə Tapdıq qızı Həmzəyeva,Ülviyyə Tapdıq qızı Həmzəyeva,,,,Yeni Azərbaycan Partiyası,Yeni Azərbaycan Partiyası,6,Culfa-Babək seçim dairəsi,5,2015-12-01,,,,,
5a588356-2c79-4cea-9207-68f178cea801,İlham Kazım oğlu Məmmədov,İlham Kazım oğlu Məmmədov,,,,Yeni Azərbaycan Partiyası,Yeni Azərbaycan Partiyası,48,Yevlax seçim dairəsi,5,2015-12-01,,,,,
3dce8f57-209d-42f4-88e3-8142729fbcf2,İlham Əlisəftər oğlu Əliyev,İlham Əlisəftər oğlu Əliyev,,,,Yeni Azərbaycan Partiyası,Yeni Azərbaycan Partiyası,56,Xaçmaz qəsəbə seçim dairəsi,5,2015-12-01,,,,,
a840941f-ed1d-42d5-8301-2c87bbbe8f2d,İmamverdi İbiş oğlu İsmayılov,İmamverdi İbiş oğlu İsmayılov,,,,Yeni Azərbaycan Partiyası,Yeni Azərbaycan Partiyası,125,Zəngilan-Qubadlı seçim dairəsi,5,2015-12-01,,,,,
3c948f65-1aca-4281-b8d0-f4b790dbb95c,İqbal Nəriman oğlu Məmmədov,İqbal Nəriman oğlu Məmmədov,,,,Yeni Azərbaycan Partiyası,Yeni Azərbaycan Partiyası,78,Lerik seçim dairəsi,5,2015-12-01,,,,,
a7551366-1ce6-4b40-bc74-5f559298ad56,İsa Əkbər oğlu Həbibbəyli,İsa Əkbər oğlu Həbibbəyli,,,,Yeni Azərbaycan Partiyası,Yeni Azərbaycan Partiyası,2,Şərur seçim dairəsi,5,2015-12-01,,,,,
6c6a188f-2531-44b6-a88e-9007c6726461,Şahin Əmir oğlu İsmayılov,Şahin Əmir oğlu İsmayılov,,,,Yeni Azərbaycan Partiyası,Yeni Azərbaycan Partiyası,81,Beyləqan seçim dairəsi,5,2015-12-01,,,,,
da82d082-4b8d-46f1-ab59-f2f5890c49fc,Şəmsəddin Hümmət oğlu Hacıyev,Şəmsəddin Hümmət oğlu Hacıyev,,,,Yeni Azərbaycan Partiyası,Yeni Azərbaycan Partiyası,29,Səbail seçim dairəsi,5,2015-12-01,,,,,
b5f510f2-cf54-42eb-87c8-55d4672e789c,Əflatun Əhməd oğlu Amaşov,Əflatun Əhməd oğlu Amaşov,,,,Independent,IND,62,Saatlı seçim dairəsi,5,2015-12-01,,,,Q327591,
6e7a63ae-3a35-4601-94b7-24e9ad90c047,Əhliman Tapdıq oğlu Əmiraslanov,Əhliman Tapdıq oğlu Əmiraslanov,,,,Yeni Azərbaycan Partiyası,Yeni Azərbaycan Partiyası,65,Saatlı-Sabirabad-Kürdəmir seçim dairəsi,5,2015-12-01,,,,,
c53cc562-e973-4a57-87e8-c68487d09746,Əli Məhəmməd oğlu Hüseynli,Əli Məhəmməd oğlu Hüseynli,,,,Yeni Azərbaycan Partiyası,Yeni Azərbaycan Partiyası,49,Yevlax-Mingəçevir seçim dairəsi,5,2015-12-01,,,,,
a165024f-dcf2-4f6e-984b-3535712fb6ce,Əli Əhməd oğlu Məsimli,Əli Əhməd oğlu Məsimli,,,,Independent,IND,114,Şəki qəsəbə I seçim dairəsi,5,2015-12-01,,,,Q327591,
118a0980-b1ff-46c3-9368-29533d69d3ed,Əliağa İzzət oğlu Hüseynov,Əliağa İzzət oğlu Hüseynov,,,,Independent,IND,59,Salyan seçim dairəsi,5,2015-12-01,,,,Q327591,
610f6cfa-66f1-4a58-9856-4fab931f521c,Əsabil Qarakişi oğlu Qasımov,Əsabil Qarakişi oğlu Qasımov,,,,Yeni Azərbaycan Partiyası,Yeni Azərbaycan Partiyası,79,İmişli seçim dairəsi,5,2015-12-01,,,,,
