id,name,sort_name,email,twitter,facebook,group,group_id,area_id,area,term,start_date,image,gender,wikidata,wikidata_group,wikidata_area
86868d2b-d73e-4c8a-bd5b-06343a823ab7,Adil Abış oğlu Əliyev,Adil Abış oğlu Əliyev,,,,Independent,IND,20,Nərimanov II seçim dairəsi,5,2015-12-01,,,,Q327591,
e00acbc8-8799-49f9-8452-ae36913eb227,Aqil Məhəmməd oğlu Abbas,Aqil Məhəmməd oğlu Abbas,,,,Independent,IND,83,Ağcabədi-Füzuli seçim dairəsi,5,2015-12-01,,,,Q327591,
46e0a8cb-bd0a-46d3-a7e1-942b9300ebeb,Aqiyə Həbib qızı Naxçıvanlı,Aqiyə Həbib qızı Naxçıvanlı,,,,Yeni Azərbaycan Partiyası,Yeni Azərbaycan Partiyası,117,Oğuz-Qəbələ seçim dairəsi,5,2015-12-01,,,,,
c74d9fb3-1e3b-4a63-a03c-54567ba8d28a,Araz Məmməd-Mübariz oğlu Əlizadə,Araz Məmməd-Mübariz oğlu Əlizadə,,,,Azərbaycan Sosial Demokrat Partiyası,Azərbaycan Sosial Demokrat Partiyası,35,Xətai III seçim dairəsi,5,2015-12-01,,,,,
6b2b9e00-f935-4924-87a2-d976421812e0,Arif Qafar oğlu Rəhimzadə,Arif Qafar oğlu Rəhimzadə,,,,Yeni Azərbaycan Partiyası,Yeni Azərbaycan Partiyası,61,Neftçala seçim dairəsi,5,2015-12-01,,,,,
c48843f7-a6db-4aa4-9710-6ad0a35e01db,Asim Nazim oğlu Mollazadə,Asim Nazim oğlu Mollazadə,,,,Azərbaycan Demokratik İslahatlar Partiyası,Azərbaycan Demokratik İslahatlar Partiyası,22,Nəsimi II seçim dairəsi,5,2015-12-01,,,,,
77a2d410-d71b-43f5-9037-46d5a50d61b7,Astan Nuşrəvan oğlu Şahverdiyev,Astan Nuşrəvan oğlu Şahverdiyev,,,,Yeni Azərbaycan Partiyası,Yeni Azərbaycan Partiyası,120,Cəbrayıl-Qubadlı seçim dairəsi,5,2015-12-01,,,,,
cde00fa4-d060-4fcb-ba42-5c23484ba042,Aydın Böyükkişi oğlu Mirzəzadə,Aydın Böyükkişi oğlu Mirzəzadə,,,,Yeni Azərbaycan Partiyası,Yeni Azərbaycan Partiyası,47,Mingəçevir seçim dairəsi,5,2015-12-01,,,,,
fbc4d657-bbfc-492b-a3ea-aaa3e8a27ff0,Aydın Nəsir oğlu Hüseynov,Aydın Nəsir oğlu Hüseynov,,,,Yeni Azərbaycan Partiyası,Yeni Azərbaycan Partiyası,11,Qaradağ seçim dairəsi,5,2015-12-01,,,,,
1189ade2-6f19-436c-aaaf-0d5a17f19387,Aytən İnqilab qızı Mustafazadə,Aytən İnqilab qızı Mustafazadə,,,,Independent,IND,16,Yasamal II seçim dairəsi,5,2015-12-01,,,,Q327591,
79de59fc-9dd9-409a-84f2-6d97719bd920,Azay Əjdər oğlu Quliyev,Azay Əjdər oğlu Quliyev,,,,Independent,IND,8,Binəqədi I seçim dairəsi,5,2015-12-01,,,,Q327591,
9b4ac89a-7a1b-482a-9486-44ef49cc7928,Azər Camal oğlu Badamov,Azər Camal oğlu Badamov,,,,Yeni Azərbaycan Partiyası,Yeni Azərbaycan Partiyası,51,Qusar seçim dairəsi,5,2015-12-01,,,,,
97390fb3-ea13-4c5c-909a-9bb1c86a6982,Azər Şəmşid oğlu Kərimli,Azər Şəmşid oğlu Kərimli,,,,Independent,IND,112,Qax seçim dairəsi,5,2015-12-01,,,,Q327591,
4c8a5dec-f7c0-4af7-bae9-c4c460f496cf,Ağacan Qulam oğlu Abıyev,Ağacan Qulam oğlu Abıyev,,,,Yeni Azərbaycan Partiyası,Yeni Azərbaycan Partiyası,32,Suraxanı III seçim dairəsi,5,2015-12-01,,,,,
dd9f2ce9-054d-4704-bdfb-e2d503c44fe5,Ağalar İsrafil oğlu Vəliyev,Ağalar İsrafil oğlu Vəliyev,,,,Yeni Azərbaycan Partiyası,Yeni Azərbaycan Partiyası,97,Goranboy-Ağdam-Tərtər seçim dairəsi,5,2015-12-01,,,,,
69ee6f10-b232-4535-a6a5-4787a881e29a,Bahar Əvəz qızı Muradova,Bahar Əvəz qızı Muradova,,,,Yeni Azərbaycan Partiyası,Yeni Azərbaycan Partiyası,84,Füzuli seçim dairəsi,5,2015-12-01,,,,,
a8b7c580-9d2a-4958-8e11-93e8bcf8ff57,Bəxtiyar Həmzə oğlu Əliyev,Bəxtiyar Həmzə oğlu Əliyev,,,,Independent,IND,118,Ağdam şəhər seçim dairəsi,5,2015-12-01,,,,Q327591,
d8fa699d-5fd2-493f-aae8-1ecfb15799e7,Bəxtiyar Yusif oğlu Sadıqov,Bəxtiyar Yusif oğlu Sadıqov,,,,Yeni Azərbaycan Partiyası,Yeni Azərbaycan Partiyası,119,Ağdam qəsəbə seçim dairəsi,5,2015-12-01,,,,,
1201153f-8bc7-45cc-b38b-d2cff1354fda,Cavanşir Hümmət oğlu Paşazadə,Cavanşir Hümmət oğlu Paşazadə,,,,Yeni Azərbaycan Partiyası,Yeni Azərbaycan Partiyası,75,Lənkəran-Masallı seçim dairəsi,5,2015-12-01,,,,,
bdde2758-7638-43f6-9797-3c4eee7d4d9b,Cavanşir Əyyub oğlu Feyziyev,Cavanşir Əyyub oğlu Feyziyev,,,,Independent,IND,115,Şəki qəsəbə II seçim dairəsi,5,2015-12-01,,,,Q327591,
ec4ec885-e6c2-4082-8f23-3e139f3f2f73,Cavid Həmid oğlu Osmanov,Cavid Həmid oğlu Osmanov,,,,Yeni Azərbaycan Partiyası,Yeni Azərbaycan Partiyası,90,Ağdaş seçim dairəsi,5,2015-12-01,,,,,
b7b98cc3-6d21-4966-8b81-19557384ba88,Cavid Qənbər oğlu Qurbanov,Cavid Qənbər oğlu Qurbanov,,,,Yeni Azərbaycan Partiyası,Yeni Azərbaycan Partiyası,123,Kəlbəcər seçim dairəsi,5,2015-12-01,,,,,
dcd7aa93-7c69-4ee8-898e-e1252fdb42b5,Dilarə Məmmədağa qızı Cəbrayılova,Dilarə Məmmədağa qızı Cəbrayılova,,,,Yeni Azərbaycan Partiyası,Yeni Azərbaycan Partiyası,27,Sabunçu II seçim dairəsi,5,2015-12-01,,,,,
aa6cd877-adf4-4b6d-8027-f027429ebed9,Eldar Allahyar oğlu Quliyev,Eldar Allahyar oğlu Quliyev,,,,Independent,IND,28,Sabunçu III seçim dairəsi,5,2015-12-01,,,,Q327591,
c8243b85-a7e6-4a6a-817f-d721dc3913fc,Eldar Rza oğlu İbrahimov,Eldar Rza oğlu İbrahimov,,,,Yeni Azərbaycan Partiyası,Yeni Azərbaycan Partiyası,4,Naxçıvan şəhər seçim dairəsi,5,2015-12-01,,,,,
d216ef4e-87a1-4ff8-93e8-347b23afd3aa,Eldəniz Adil oğlu Səlimov,Eldəniz Adil oğlu Səlimov,,,,Yeni Azərbaycan Partiyası,Yeni Azərbaycan Partiyası,55,Xaçmaz şəhər seçim dairəsi,5,2015-12-01,,,,,
86c29298-1da5-4b02-8427-94994da04f87,Elman Camal oğlu Məmmədov,Elman Camal oğlu Məmmədov,,,,Yeni Azərbaycan Partiyası,Yeni Azərbaycan Partiyası,124,Şuşa-Ağdam-Xocalı-Xocavənd seçim dairəsi,5,2015-12-01,,,,,
0a74e48f-0987-42d5-92c1-dd9cac50f426,Elman Xudam oğlu Nəsirli,Elman Xudam oğlu Nəsirli,,,,Yeni Azərbaycan Partiyası,Yeni Azərbaycan Partiyası,89,Göyçay-Ağdaş seçim dairəsi,5,2015-12-01,,,,,
163835e8-6c77-4509-84ec-d31467d08080,Elmira Hüseyn qızı Axundova,Elmira Hüseyn qızı Axundova,,,,Independent,IND,71,Masallı qəsəbə seçim dairəsi,5,2015-12-01,,,,Q327591,
027bdebc-5bf8-427c-9dcc-cb31d07cca5f,Elxan Sirac oğlu Süleymanov,Elxan Sirac oğlu Süleymanov,,,,Independent,IND,85,Şamaxı seçim dairəsi,5,2015-12-01,,,,Q327591,
9e9920d1-3011-4587-8e9c-2ae507ce2d2f,Elçin Bəybala oğlu Quliyev,Elçin Bəybala oğlu Quliyev,,,,Yeni Azərbaycan Partiyası,Yeni Azərbaycan Partiyası,63,Sabirabad I seçim dairəsi,5,2015-12-01,,,,,
507d90f8-920c-41cd-bfc2-bfc18e9cb3f3,Elşad Eldar oğlu Həsənov,Elşad Eldar oğlu Həsənov,,,,Independent,IND,17,Yasamal III seçim dairəsi,5,2015-12-01,,,,Q327591,
c8f4e237-16c6-4abe-bcf0-274893560acd,Elşən Məmmədhənifə oğlu Musayev,Elşən Məmmədhənifə oğlu Musayev,,,,Azərbaycan Demokratik Maarifçilik Partiyası,Azərbaycan Demokratik Maarifçilik Partiyası,110,Zaqatala seçim dairəsi,5,2015-12-01,,,,,
ca72abb4-14a5-4c87-9077-d8c0c3ae9556,Fazil Qəzənfər oğlu Mustafa,Fazil Qəzənfər oğlu Mustafa,,,,Böyük Quruluş Partiyası,Böyük Quruluş Partiyası,26,Sabunçu I seçim dairəsi,5,2015-12-01,,,,,
eb2ce8fc-c11e-4d1d-8b1f-5f3ea3da97f7,Flora Qasım qızı Qasımova,Flora Qasım qızı Qasımova,,,,Independent,IND,122,Xankəndi seçim dairəsi,5,2015-12-01,,,,Q327591,
57608174-e2cc-4584-ac76-b66cf9ba8e7e,Fuad Rauf oğlu Muradov,Fuad Rauf oğlu Muradov,,,,Independent,IND,34,Xətai II seçim dairəsi,5,2015-12-01,,,,Q327591,
ff985cc5-3d1c-43aa-8b2f-101015a750ee,Fərəc İbrahim oğlu Quliyev,Fərəc İbrahim oğlu Quliyev,,,,Milli Dirçəliş Hərəkatı Partiyası,Milli Dirçəliş Hərəkatı Partiyası,31,Suraxanı II seçim dairəsi,5,2015-12-01,,,,,
1701f018-938f-412a-9323-189d9af10710,Fəttah Səməd oğlu Heydərov,Fəttah Səməd oğlu Heydərov,,,,Independent,IND,116,Qəbələ seçim dairəsi,5,2015-12-01,,,,Q327591,
933c5ea2-329b-4488-b347-29742c270298,Fəzail Feyruz oğlu İbrahimli,Fəzail Feyruz oğlu İbrahimli,,,,Vətəndaş Həmrəyliyi Partiyası,Vətəndaş Həmrəyliyi Partiyası,69,Cəlilabad-Masallı-Biləsuvar seçim dairəsi,5,2015-12-01,,,,,
9c35565e-3f46-4fca-becc-83574e783a7f,Fəzail Rəhim oğlu Ağamalı,Fəzail Rəhim oğlu Ağamalı,,,,Ana Vətən Partiyası,Ana Vətən Partiyası,60,Salyan-Neftçala seçim dairəsi,5,2015-12-01,,,,,
4eea7275-b6d2-424c-aca7-c469f3eb6aa0,Gövhər Baxşəli qızı Baxşəliyeva,Gövhər Baxşəli qızı Baxşəliyeva,,,,Independent,IND,93,Bərdə şəhər seçim dairəsi,5,2015-12-01,,,,Q327591,
5c8654c5-142a-4536-a166-ec1adc504e79,Hacı Hacıbaba oğlu Salayev,Hacı Hacıbaba oğlu Salayev,,,,Independent,IND,44,Sumqayıt-Abşeron seçim dairəsi,5,2015-12-01,,,,Q327591,
c1698f8e-a8a2-4ada-b06a-5eff9cbf2973,Hadı Musa oğlu Rəcəbli,Hadı Musa oğlu Rəcəbli,,,,Yeni Azərbaycan Partiyası,Yeni Azərbaycan Partiyası,74,Lənkəran qəsəbə seçim dairəsi,5,2015-12-01,,,,,
c9e575ab-fb51-468c-8cbd-500baf4a24ed,Hikmət Baba oğlu Məmmədov,Hikmət Baba oğlu Məmmədov,,,,Yeni Azərbaycan Partiyası,Yeni Azərbaycan Partiyası,19,Nərimanov I seçim dairəsi,5,2015-12-01,,,,,
b43025be-8d49-4491-8fea-13ef35f46863,Hüseynbala Fazil oğlu Mirələmov,Hüseynbala Fazil oğlu Mirələmov,,,,Yeni Azərbaycan Partiyası,Yeni Azərbaycan Partiyası,33,Xətai I seçim dairəsi,5,2015-12-01,,,,,
f3146713-e111-45cd-a7f6-8166ed173669,Jalə Fazil qızı Əliyeva,Jalə Fazil qızı Əliyeva,,,,Independent,IND,92,Zərdab-Ucar seçim dairəsi,5,2015-12-01,,,,Q327591,
a0a8bfaf-31a6-40ba-879d-2f80402a51ad,Kamaləddin Nəsrəddin oğlu Qafarov,Kamaləddin Nəsrəddin oğlu Qafarov,,,,Yeni Azərbaycan Partiyası,Yeni Azərbaycan Partiyası,9,Binəqədi II seçim dairəsi,5,2015-12-01,,,,,
323ca0de-a0ed-4747-bfd4-e7d0edcdb45f,Kamilə Əli Ağa qızı Əliyeva,Kamilə Əli Ağa qızı Əliyeva,,,,Yeni Azərbaycan Partiyası,Yeni Azərbaycan Partiyası,111,Zaqatala-Balakən seçim dairəsi,5,2015-12-01,,,,,
0cf3661c-bf32-4d45-b523-52795a7b586e,Kamran Fərhad oğlu Bayramov,Kamran Fərhad oğlu Bayramov,,,,Yeni Azərbaycan Partiyası,Yeni Azərbaycan Partiyası,100,Şəmkir-Daşkəsən seçim dairəsi,5,2015-12-01,,,,,
4a6839b1-807d-4c1c-9b5f-850e3562ae83,Kamran Telman oğlu Nəbizadə,Kamran Telman oğlu Nəbizadə,,,,Independent,IND,107,Qazax seçim dairəsi,5,2015-12-01,,,,Q327591,
48b7f103-281d-4d95-9eeb-ef363e5c1915,Madər Ələsgər oğlu Musayev,Madər Ələsgər oğlu Musayev,,,,Independent,IND,10,Binəqədi III seçim dairəsi,5,2015-12-01,,,,Q327591,
520a2f1d-de49-40ac-9c52-3947bed792c3,Mahir Məhəmmədəli oğlu Aslanov,Mahir Məhəmmədəli oğlu Aslanov,,,,Independent,IND,96,Goranboy-Naftalan seçim dairəsi,5,2015-12-01,,,,Q327591,
245f80c2-c107-4d24-ab72-643a697964eb,Mahir Tapdıq oğlu Abbaszadə,Mahir Tapdıq oğlu Abbaszadə,,,,Yeni Azərbaycan Partiyası,Yeni Azərbaycan Partiyası,121,Laçın seçim dairəsi,5,2015-12-01,,,,,
a136cffd-ed49-4cf8-8d84-3d6cfbc5c604,Malik Əvəz oğlu Həsənov,Malik Əvəz oğlu Həsənov,,,,Yeni Azərbaycan Partiyası,Yeni Azərbaycan Partiyası,67,Cəlilabad şəhər seçim dairəsi,5,2015-12-01,,,,,
c5f7d5c7-178d-405e-b5e0-dc69656c6371,Mehriban Arif qızı Əliyeva,Mehriban Arif qızı Əliyeva,,,,Yeni Azərbaycan Partiyası,Yeni Azərbaycan Partiyası,14,Xəzər II seçim dairəsi,5,2015-12-01,,,,,
c9f72371-03a3-4fb8-8a80-945f3fefecc1,Mirkazım Mirməhəmməd oğlu Kazımov,Mirkazım Mirməhəmməd oğlu Kazımov,,,,Yeni Azərbaycan Partiyası,Yeni Azərbaycan Partiyası,68,Cəlilabad qəsəbə seçim dairəsi,5,2015-12-01,,,,,
cfe29038-6d64-460b-832e-2038ddcd0755,Mirzəcan Mirzəmməd oğlu Xəlilov,Mirzəcan Mirzəmməd oğlu Xəlilov,,,,Yeni Azərbaycan Partiyası,Yeni Azərbaycan Partiyası,41,Sumqayıt I seçim dairəsi,5,2015-12-01,,,,,
bd12ae3f-36a6-4d88-a906-4e48bce3e3c6,Mixail Yuri oğlu Zabelin,Mixail Yuri oğlu Zabelin,,,,Yeni Azərbaycan Partiyası,Yeni Azərbaycan Partiyası,12,Qaradağ-Binəqədi-Yasamal seçim dairəsi,5,2015-12-01,,,,,
a3ca46b2-f60f-4a32-a483-5a1bfffb9fc6,Musa Cəfər oğlu Qasımlı,Musa Cəfər oğlu Qasımlı,,,,Independent,IND,72,Yardımlı-Masallı seçim dairəsi,5,2015-12-01,,,,Q327591,
2e3ea5c7-88b1-4d9e-8cd7-8ab346e2a0d6,Musa İsa oğlu Quliyev (Urud),Musa İsa oğlu Quliyev (Urud),,,,Yeni Azərbaycan Partiyası,Yeni Azərbaycan Partiyası,40,Kəpəz II seçim dairəsi (Gəncə şəhəri),5,2015-12-01,,,,,
e971ef5f-22cd-4a26-84cc-291f6e573d94,Muxtar Bahadur oğlu Babayev,Muxtar Bahadur oğlu Babayev,,,,Yeni Azərbaycan Partiyası,Yeni Azərbaycan Partiyası,43,Sumqayıt III seçim dairəsi,5,2015-12-01,,,,,
de346367-dc4e-4086-ab8a-2185e636a49c,Müslüm Mürsəl oğlu Məmmədov,Müslüm Mürsəl oğlu Məmmədov,,,,Independent,IND,57,Kürdəmir seçim dairəsi,5,2015-12-01,,,,Q327591,
80d0ea00-632e-4f22-bca2-46993f5585e1,Məlahət İbrahim qızı Həsənova,Məlahət İbrahim qızı Həsənova,,,,Yeni Azərbaycan Partiyası,Yeni Azərbaycan Partiyası,21,Nəsimi I seçim dairəsi,5,2015-12-01,,,,,
0a9f7023-f418-423d-bc4d-cbd663fc9bac,Naqif Ələşrəf oğlu Həmzəyev,Naqif Ələşrəf oğlu Həmzəyev,,,,Yeni Azərbaycan Partiyası,Yeni Azərbaycan Partiyası,38,Nizami II seçim dairəsi (Gəncə şəhəri),5,2015-12-01,,,,,
95dbb4ac-8c73-4c6f-a4a8-e3e9a10486ee,Nizami Qulu oğlu Cəfərov,Nizami Qulu oğlu Cəfərov,,,,Yeni Azərbaycan Partiyası,Yeni Azərbaycan Partiyası,108,Ağstafa seçim dairəsi,5,2015-12-01,,,,,
a20b625d-5953-4f86-9bb3-9ee400dca61d,Novruzəli Davud oğlu Aslanov,Novruzəli Davud oğlu Aslanov,,,,Independent,IND,86,İsmayıllı seçim dairəsi,5,2015-12-01,,,,Q327591,
dc456073-cb09-4bc4-9a69-a6c249d127b8,Nəriman Əlibala oğlu Əliyev,Nəriman Əlibala oğlu Əliyev,,,,Yeni Azərbaycan Partiyası,Yeni Azərbaycan Partiyası,70,Masallı şəhər seçim dairəsi,5,2015-12-01,,,,,
0a51b247-0dd7-432f-a891-10041fefc03a,Nəsib Məhəmməd oğlu Məhəməliyev,Nəsib Məhəmməd oğlu Məhəməliyev,,,,Yeni Azərbaycan Partiyası,Yeni Azərbaycan Partiyası,109,Balakən seçim dairəsi,5,2015-12-01,,,,,
e9be85a2-8fb6-4f26-9c16-cf14fc83e322,Oqtay Sabir oğlu Əsədov,Oqtay Sabir oğlu Əsədov,,,,Yeni Azərbaycan Partiyası,Yeni Azərbaycan Partiyası,45,Abşeron seçim dairəsi,5,2015-12-01,,,,,
684303ad-0fca-47fd-8d8e-4b6f0c749398,Pərvin Orxan qızı Kərimzadə,Pərvin Orxan qızı Kərimzadə,,,,Yeni Azərbaycan Partiyası,Yeni Azərbaycan Partiyası,37,Nizami I seçim dairəsi (Gəncə şəhəri),5,2015-12-01,,,,,
5c160198-1678-4eb9-b96c-398342ecdbb0,Qüdrət Müzəffər oğlu Həsənquliyev,Qüdrət Müzəffər oğlu Həsənquliyev,,,,Bütöv Azərbaycan Xalq Cəbhəsi Partiyası,Bütöv Azərbaycan Xalq Cəbhəsi Partiyası,7,Ordubad-Culfa seçim dairəsi,5,2015-12-01,,,,,
5071c768-acc8-4f8e-953c-111bc5d8987a,Qənirə Ələsgər qızı Paşayeva,Qənirə Ələsgər qızı Paşayeva,,,,Independent,IND,105,Tovuz seçim dairəsi,5,2015-12-01,,,,Q327591,
91068090-7d87-4a5c-9a97-f41748f68951,Rafael Baba oğlu Hüseynov,Rafael Baba oğlu Hüseynov,,,,Independent,IND,58,Hacıqabul-Kürdəmir seçim dairəsi,5,2015-12-01,,,,Q327591,
d28b037d-94aa-4fc9-a30e-4bbd85202444,Rafael Kamil oğlu Cəbrayılov,Rafael Kamil oğlu Cəbrayılov,,,,Independent,IND,46,Şirvan seçim dairəsi,5,2015-12-01,,,,Q327591,
a7824486-e86d-4eda-af10-43e762f19f2d,Rafiq Musa oğlu Məmmədhəsənov,Rafiq Musa oğlu Məmmədhəsənov,,,,Yeni Azərbaycan Partiyası,Yeni Azərbaycan Partiyası,104,Gədəbəy-Tovuz seçim dairəsi,5,2015-12-01,,,,,
7890eac0-9d72-4506-8294-fff6c89c7c78,Rasim Nəsrəddin oğlu Musabəyov,Rasim Nəsrəddin oğlu Musabəyov,,,,Independent,IND,18,Nərimanov-Nizami seçim dairəsi,5,2015-12-01,,,,Q327591,
cf8575f0-3a72-4f75-bdd0-9ad9459851b1,Rauf Asif oğlu Əliyev,Rauf Asif oğlu Əliyev,,,,Yeni Azərbaycan Partiyası,Yeni Azərbaycan Partiyası,13,Xəzər I seçim dairəsi,5,2015-12-01,,,,,
20828e11-4f67-4a8b-9e54-600d65a5398b,Rövnəq İbrahim oğlu Abdullayev,Rövnəq İbrahim oğlu Abdullayev,,,,Yeni Azərbaycan Partiyası,Yeni Azərbaycan Partiyası,24,Nizami I seçim dairəsi,5,2015-12-01,,,,,
9d5228db-0028-4dca-97ff-0a3c578505dd,Rövşən Şükür oğlu Rzayev,Rövşən Şükür oğlu Rzayev,,,,Independent,IND,101,Göygöl-Daşkəsən seçim dairəsi,5,2015-12-01,,,,Q327591,
33b6fcb7-4b1f-4aa4-b866-ef916445ac1f,Rüfət Atakişi oğlu Quliyev,Rüfət Atakişi oğlu Quliyev,,,,Independent,IND,73,Lənkəran şəhər seçim dairəsi,5,2015-12-01,,,,Q327591,
e2868163-d4a1-49ca-b5e3-99fa3c9c62ff,Rüstəm Gülabba oğlu Xəlilov,Rüstəm Gülabba oğlu Xəlilov,,,,Yeni Azərbaycan Partiyası,Yeni Azərbaycan Partiyası,64,Sabirabad II seçim dairəsi,5,2015-12-01,,,,,
4e3e2cff-e0c9-416d-8260-978723d03e3b,Rəşad Məmmədqulu oğlu Mahmudov,Rəşad Məmmədqulu oğlu Mahmudov,,,,Yeni Azərbaycan Partiyası,Yeni Azərbaycan Partiyası,77,Astara seçim dairəsi,5,2015-12-01,,,,,
6b8df690-6f00-493e-9841-ebfd66235d28,Sabir Kamal oğlu Hacıyev,Sabir Kamal oğlu Hacıyev,,,,Vətəndaş Birliyi Partiyası,Vətəndaş Birliyi Partiyası,88,Göyçay seçim dairəsi,5,2015-12-01,,,,,
07c7e54e-2a82-469f-bb9e-68355ac1fd05,Sahib Eyvaz oğlu Alıyev,Sahib Eyvaz oğlu Alıyev,,,,Independent,IND,95,Tərtər seçim dairəsi,5,2015-12-01,,,,Q327591,
cd5f29a0-9060-4c14-8875-bb7234116876,Sahibə Əli qızı Qafarova,Sahibə Əli qızı Qafarova,,,,Yeni Azərbaycan Partiyası,Yeni Azərbaycan Partiyası,98,Şəmkir şəhər seçim dairəsi,5,2015-12-01,,,,,
9352b06c-c5ed-4eb5-9b49-d296edfa1618,Sevinc Həbib qızı Fətəliyeva,Sevinc Həbib qızı Fətəliyeva,,,,Yeni Azərbaycan Partiyası,Yeni Azərbaycan Partiyası,30,Suraxanı I seçim dairəsi,5,2015-12-01,,,,,
777ed2a5-98a6-424e-b059-94107cf441ed,Sevinc Əmirəhməd qızı Hüseynova,Sevinc Əmirəhməd qızı Hüseynova,,,,Yeni Azərbaycan Partiyası,Yeni Azərbaycan Partiyası,103,Gədəbəy seçim dairəsi,5,2015-12-01,,,,,
a48e642a-5411-42a1-9019-295fabfc94d9,Siyavuş Dünyamalı oğlu Novruzov,Siyavuş Dünyamalı oğlu Novruzov,,,,Yeni Azərbaycan Partiyası,Yeni Azərbaycan Partiyası,5,Şahbuz-Babək seçim dairəsi,5,2015-12-01,,,,,
b306b4bc-6137-4609-8d9c-9b8907cd48cc,Sona Sakit qızı Əliyeva,Sona Sakit qızı Əliyeva,,,,Yeni Azərbaycan Partiyası,Yeni Azərbaycan Partiyası,99,Şəmkir qəsəbə seçim dairəsi,5,2015-12-01,,,,,
5770f589-0e83-452c-845a-7ed7d2dd50ff,Sədaqət Süleyman qızı Vəliyeva,Sədaqət Süleyman qızı Vəliyeva,,,,Yeni Azərbaycan Partiyası,Yeni Azərbaycan Partiyası,25,Nizami II seçim dairəsi,5,2015-12-01,,,,,
e46b6cef-39c6-40f6-8e90-1b0cff9c6386,Səməd İsmayıl oğlu Seyidov,Səməd İsmayıl oğlu Seyidov,,,,Yeni Azərbaycan Partiyası,Yeni Azərbaycan Partiyası,36,Xətai IV seçim dairəsi,5,2015-12-01,,,,,
86bacdd2-a534-4fca-afc7-eb86e47f3683,Səttar Suliddin oğlu Mehbalıyev,Səttar Suliddin oğlu Mehbalıyev,,,,Independent,IND,3,Babək-Kəngərli-Naxçıvan seçim dairəsi,5,2015-12-01,,,,Q327591,
1f22699e-fb1d-4d21-82f7-ce38937e8fbe,Tahir Famil oğlu oğlu Mirkişili,Tahir Famil oğlu oğlu Mirkişili,,,,Yeni Azərbaycan Partiyası,Yeni Azərbaycan Partiyası,42,Sumqayıt II seçim dairəsi,5,2015-12-01,,,,,
bdd7b5d6-ef19-43d7-8290-905c5c635856,Tahir Musa oğlu Rzayev,Tahir Musa oğlu Rzayev,,,,Yeni Azərbaycan Partiyası,Yeni Azərbaycan Partiyası,82,Ağcabədi seçim dairəsi,5,2015-12-01,,,,,
b60443ab-ca4b-4e4b-9c7b-2fcb268758a1,Tahir Süleyman oğlu Süleymanov,Tahir Süleyman oğlu Süleymanov,,,,Yeni Azərbaycan Partiyası,Yeni Azərbaycan Partiyası,54,Şabran-Siyəzən seçim dairəsi,5,2015-12-01,,,,,
86cf4702-ba92-440a-8250-d6bb9caf4b20,Tahir Zayıdağa oğlu Kərimli,Tahir Zayıdağa oğlu Kərimli,,,,Vəhdət Partiyası,Vəhdət Partiyası,87,Ağsu-İsmayıllı seçim dairəsi,5,2015-12-01,,,,,
8ad71010-1fd7-40ce-a6fd-b1cd9a1c4946,Vahid Qazməmməd oğlu Əhmədov,Vahid Qazməmməd oğlu Əhmədov,,,,Independent,IND,52,Quba seçim dairəsi,5,2015-12-01,,,,Q327591,
93b18cb6-68ad-440a-952e-ac29509ea9ce,Valeh Feyruz oğlu Ələsgərov,Valeh Feyruz oğlu Ələsgərov,,,,Independent,IND,102,Samux-Şəmkir seçim dairəsi,5,2015-12-01,,,,Q327591,
32430da6-4411-445d-b22a-b5545d6a6d81,Vasif Yusif oğlu Talıbov,Vasif Yusif oğlu Talıbov,,,,Yeni Azərbaycan Partiyası,Yeni Azərbaycan Partiyası,1,Şərur-Sədərək seçim dairəsi,5,2015-12-01,,,,,
6cf0b4d1-e4ca-45f4-8437-9a0f1560d2bf,Vüsal Əfqan oğlu Hüseynov,Vüsal Əfqan oğlu Hüseynov,,,,Yeni Azərbaycan Partiyası,Yeni Azərbaycan Partiyası,91,Ucar seçim dairəsi,5,2015-12-01,,,,,
0a954d55-a5f8-4fb5-916d-a1ea4b2787b2,Xanhüseyn Hüseynağa oğlu Kazımlı,Xanhüseyn Hüseynağa oğlu Kazımlı,,,,Azərbaycan Sosial Rifah Partiyası,Azərbaycan Sosial Rifah Partiyası,66,Biləsuvar seçim dairəsi,5,2015-12-01,,,,,
c19f47cb-887b-4d9e-b8d6-7c8f058c1997,Xanlar Nuru oğlu Fətiyev,Xanlar Nuru oğlu Fətiyev,,,,Yeni Azərbaycan Partiyası,Yeni Azərbaycan Partiyası,39,Kəpəz I seçim dairəsi (Gəncə şəhəri),5,2015-12-01,,,,,
4c5bdb95-0546-4a2e-931f-48969e305bb0,Yaqub Mikayıl oğlu Mahmudov,Yaqub Mikayıl oğlu Mahmudov,,,,Yeni Azərbaycan Partiyası,Yeni Azərbaycan Partiyası,113,Şəki şəhər seçim dairəsi,5,2015-12-01,,,,,
886de09e-d431-4b06-9ae5-46c7774f29e7,Yevda Sasun oğlu Abramov,Yevda Sasun oğlu Abramov,,,,Yeni Azərbaycan Partiyası,Yeni Azərbaycan Partiyası,53,Quba-Qusar seçim dairəsi,5,2015-12-01,,,,,
5973286c-1c1e-497a-8fdb-db5bcf8c49ad,Zahid Məhərrəm oğlu Oruc,Zahid Məhərrəm oğlu Oruc,,,,Independent,IND,94,Bərdə qəsəbə seçim dairəsi,5,2015-12-01,,,,Q327591,
7c4706ff-19a7-471a-a3b7-fab274c2f59a,Zeynəb Yəhya qızı Xanlarova,Zeynəb Yəhya qızı Xanlarova,,,,Independent,IND,50,Qobustan-Xızı-Sumqayıt seçim dairəsi,5,2015-12-01,,,,Q327591,
f410bb5e-0e85-4610-a141-08919aa85d02,Ziyad Əliabbas oğlu Səmədzadə,Ziyad Əliabbas oğlu Səmədzadə,,,,Independent,IND,23,Nəsimi-Səbail seçim dairəsi,5,2015-12-01,,,,Q327591,
9e07648e-0605-45ec-82fd-9756a2e17b04,Ziyafət Abbas oğlu Əsgərov,Ziyafət Abbas oğlu Əsgərov,,,,Yeni Azərbaycan Partiyası,Yeni Azərbaycan Partiyası,76,Lənkəran-Astara seçim dairəsi,5,2015-12-01,,,,,
13fbf582-2605-4ce3-8c9d-5cee3541c225,Çingiz Aşralı oğlu Qənizadə,Çingiz Aşralı oğlu Qənizadə,,,,Independent,IND,80,İmişli-Beyləqan seçim dairəsi,5,2015-12-01,,,,Q327591,
8d47a2e1-7a69-45c2-a1b2-b467efd3c77a,Ülvi Zahid oğlu Quliyev,Ülvi Zahid oğlu Quliyev,,,,Independent,IND,15,Yasamal I seçim dairəsi,5,2015-12-01,,,,Q327591,
f8e1e464-9bda-4f70-a9e5-4eaaa80c1ea5,Ülviyyə Cavanşir qızı Ağayeva,Ülviyyə Cavanşir qızı Ağayeva,,,,Independent,IND,106,Tovuz-Qazax-Ağstafa seçim dairəsi,5,2015-12-01,,,,Q327591,
8dac8cda-b42a-4664-8f4a-05cf645f9b7f,Ülviyyə Tapdıq qızı Həmzəyeva,Ülviyyə Tapdıq qızı Həmzəyeva,,,,Yeni Azərbaycan Partiyası,Yeni Azərbaycan Partiyası,6,Culfa-Babək seçim dairəsi,5,2015-12-01,,,,,
75ec864f-0764-485b-9490-d91acdafe7f3,İlham Kazım oğlu Məmmədov,İlham Kazım oğlu Məmmədov,,,,Yeni Azərbaycan Partiyası,Yeni Azərbaycan Partiyası,48,Yevlax seçim dairəsi,5,2015-12-01,,,,,
f5dd6d2f-54df-4f0a-969b-d30c56c72881,İlham Əlisəftər oğlu Əliyev,İlham Əlisəftər oğlu Əliyev,,,,Yeni Azərbaycan Partiyası,Yeni Azərbaycan Partiyası,56,Xaçmaz qəsəbə seçim dairəsi,5,2015-12-01,,,,,
441e3079-4842-49a1-8cec-14b61fe447a6,İmamverdi İbiş oğlu İsmayılov,İmamverdi İbiş oğlu İsmayılov,,,,Yeni Azərbaycan Partiyası,Yeni Azərbaycan Partiyası,125,Zəngilan-Qubadlı seçim dairəsi,5,2015-12-01,,,,,
76b4e818-6e62-4f42-b191-e5c054f5c783,İqbal Nəriman oğlu Məmmədov,İqbal Nəriman oğlu Məmmədov,,,,Yeni Azərbaycan Partiyası,Yeni Azərbaycan Partiyası,78,Lerik seçim dairəsi,5,2015-12-01,,,,,
28c9509a-4bda-4773-81d3-28c802e91446,İsa Əkbər oğlu Həbibbəyli,İsa Əkbər oğlu Həbibbəyli,,,,Yeni Azərbaycan Partiyası,Yeni Azərbaycan Partiyası,2,Şərur seçim dairəsi,5,2015-12-01,,,,,
15a6d2d2-a61f-4868-9934-083fa89271d7,Şahin Əmir oğlu İsmayılov,Şahin Əmir oğlu İsmayılov,,,,Yeni Azərbaycan Partiyası,Yeni Azərbaycan Partiyası,81,Beyləqan seçim dairəsi,5,2015-12-01,,,,,
d48547fd-31e1-4f8b-b861-c69d56b98da8,Şəmsəddin Hümmət oğlu Hacıyev,Şəmsəddin Hümmət oğlu Hacıyev,,,,Yeni Azərbaycan Partiyası,Yeni Azərbaycan Partiyası,29,Səbail seçim dairəsi,5,2015-12-01,,,,,
a480ed7b-cf78-49a7-af66-2c32180e03cb,Əflatun Əhməd oğlu Amaşov,Əflatun Əhməd oğlu Amaşov,,,,Independent,IND,62,Saatlı seçim dairəsi,5,2015-12-01,,,,Q327591,
69064b85-1ba4-4f58-a939-fdd132ba6bd8,Əhliman Tapdıq oğlu Əmiraslanov,Əhliman Tapdıq oğlu Əmiraslanov,,,,Yeni Azərbaycan Partiyası,Yeni Azərbaycan Partiyası,65,Saatlı-Sabirabad-Kürdəmir seçim dairəsi,5,2015-12-01,,,,,
df18562e-b914-4630-a6c4-0bdf12c7095e,Əli Məhəmməd oğlu Hüseynli,Əli Məhəmməd oğlu Hüseynli,,,,Yeni Azərbaycan Partiyası,Yeni Azərbaycan Partiyası,49,Yevlax-Mingəçevir seçim dairəsi,5,2015-12-01,,,,,
63ebc74c-2a14-45d5-8f5f-3e92bb699648,Əli Əhməd oğlu Məsimli,Əli Əhməd oğlu Məsimli,,,,Independent,IND,114,Şəki qəsəbə I seçim dairəsi,5,2015-12-01,,,,Q327591,
c68a6c37-2c52-407f-a798-eb50f00f1806,Əliağa İzzət oğlu Hüseynov,Əliağa İzzət oğlu Hüseynov,,,,Independent,IND,59,Salyan seçim dairəsi,5,2015-12-01,,,,Q327591,
3c272dae-d71a-427f-ac3b-70d17207a8d8,Əsabil Qarakişi oğlu Qasımov,Əsabil Qarakişi oğlu Qasımov,,,,Yeni Azərbaycan Partiyası,Yeni Azərbaycan Partiyası,79,İmişli seçim dairəsi,5,2015-12-01,,,,,
