id,name,sort_name,email,twitter,facebook,group,group_id,area_id,area,term,start_date,image,gender,wikidata,wikidata_group,wikidata_area
2ec9a1a6-4e94-4976-a487-f5303e33f949,Adil Abış oğlu Əliyev,Adil Abış oğlu Əliyev,,,,Independent,IND,20,Nərimanov II seçim dairəsi,5,2015-12-01,,,,Q327591,
5c68decc-08c2-47fc-9f77-9c8c8f62c5c0,Aqil Məhəmməd oğlu Abbas,Aqil Məhəmməd oğlu Abbas,,,,Independent,IND,83,Ağcabədi-Füzuli seçim dairəsi,5,2015-12-01,,,,Q327591,
781e07ce-e855-40cd-b76f-44937a743293,Aqiyə Həbib qızı Naxçıvanlı,Aqiyə Həbib qızı Naxçıvanlı,,,,Yeni Azərbaycan Partiyası,Yeni Azərbaycan Partiyası,117,Oğuz-Qəbələ seçim dairəsi,5,2015-12-01,,,,,
7db26d19-9c95-4883-88d9-64be9ecbafd2,Araz Məmməd-Mübariz oğlu Əlizadə,Araz Məmməd-Mübariz oğlu Əlizadə,,,,Azərbaycan Sosial Demokrat Partiyası,Azərbaycan Sosial Demokrat Partiyası,35,Xətai III seçim dairəsi,5,2015-12-01,,,,,
351a8a78-81eb-414a-b5ef-402ab9e74520,Arif Qafar oğlu Rəhimzadə,Arif Qafar oğlu Rəhimzadə,,,,Yeni Azərbaycan Partiyası,Yeni Azərbaycan Partiyası,61,Neftçala seçim dairəsi,5,2015-12-01,,,,,
25755224-9a4a-4fb0-8ea0-c189f8fe1045,Asim Nazim oğlu Mollazadə,Asim Nazim oğlu Mollazadə,,,,Azərbaycan Demokratik İslahatlar Partiyası,Azərbaycan Demokratik İslahatlar Partiyası,22,Nəsimi II seçim dairəsi,5,2015-12-01,,,,,
36a43baf-f69d-4cbf-8b40-bc4a885a58a4,Astan Nuşrəvan oğlu Şahverdiyev,Astan Nuşrəvan oğlu Şahverdiyev,,,,Yeni Azərbaycan Partiyası,Yeni Azərbaycan Partiyası,120,Cəbrayıl-Qubadlı seçim dairəsi,5,2015-12-01,,,,,
eaec36c6-d497-4df8-9d95-aa5d9d350d5f,Aydın Böyükkişi oğlu Mirzəzadə,Aydın Böyükkişi oğlu Mirzəzadə,,,,Yeni Azərbaycan Partiyası,Yeni Azərbaycan Partiyası,47,Mingəçevir seçim dairəsi,5,2015-12-01,,,,,
1d9d9bbc-deea-454a-b72c-2c40674ddb7c,Aydın Nəsir oğlu Hüseynov,Aydın Nəsir oğlu Hüseynov,,,,Yeni Azərbaycan Partiyası,Yeni Azərbaycan Partiyası,11,Qaradağ seçim dairəsi,5,2015-12-01,,,,,
01269368-cb54-4b3a-b169-e12ca5122b59,Aytən İnqilab qızı Mustafazadə,Aytən İnqilab qızı Mustafazadə,,,,Independent,IND,16,Yasamal II seçim dairəsi,5,2015-12-01,,,,Q327591,
dd95c866-1fa0-45f3-a0a1-3b63f2145960,Azay Əjdər oğlu Quliyev,Azay Əjdər oğlu Quliyev,,,,Independent,IND,8,Binəqədi I seçim dairəsi,5,2015-12-01,,,,Q327591,
f939156b-cec0-46c5-8693-d0c721bb6ef6,Azər Camal oğlu Badamov,Azər Camal oğlu Badamov,,,,Yeni Azərbaycan Partiyası,Yeni Azərbaycan Partiyası,51,Qusar seçim dairəsi,5,2015-12-01,,,,,
879c3556-a2b2-44ef-a4ab-39995b398ead,Azər Şəmşid oğlu Kərimli,Azər Şəmşid oğlu Kərimli,,,,Independent,IND,112,Qax seçim dairəsi,5,2015-12-01,,,,Q327591,
85bde1f9-7816-4c04-921b-aa105dd68aba,Ağacan Qulam oğlu Abıyev,Ağacan Qulam oğlu Abıyev,,,,Yeni Azərbaycan Partiyası,Yeni Azərbaycan Partiyası,32,Suraxanı III seçim dairəsi,5,2015-12-01,,,,,
361cab3d-d2d7-49b4-a0d4-f55dbb45646f,Ağalar İsrafil oğlu Vəliyev,Ağalar İsrafil oğlu Vəliyev,,,,Yeni Azərbaycan Partiyası,Yeni Azərbaycan Partiyası,97,Goranboy-Ağdam-Tərtər seçim dairəsi,5,2015-12-01,,,,,
eaf61286-18a0-49b4-ad3c-e54cdcc601f4,Bahar Əvəz qızı Muradova,Bahar Əvəz qızı Muradova,,,,Yeni Azərbaycan Partiyası,Yeni Azərbaycan Partiyası,84,Füzuli seçim dairəsi,5,2015-12-01,,,,,
4cb1a780-aa06-4f9b-90a6-725f51e520bb,Bəxtiyar Həmzə oğlu Əliyev,Bəxtiyar Həmzə oğlu Əliyev,,,,Independent,IND,118,Ağdam şəhər seçim dairəsi,5,2015-12-01,,,,Q327591,
9870c5c1-7bc1-4358-a966-a30dc0c4e598,Bəxtiyar Yusif oğlu Sadıqov,Bəxtiyar Yusif oğlu Sadıqov,,,,Yeni Azərbaycan Partiyası,Yeni Azərbaycan Partiyası,119,Ağdam qəsəbə seçim dairəsi,5,2015-12-01,,,,,
710847d3-9113-4ee9-9286-35f29ca30526,Cavanşir Hümmət oğlu Paşazadə,Cavanşir Hümmət oğlu Paşazadə,,,,Yeni Azərbaycan Partiyası,Yeni Azərbaycan Partiyası,75,Lənkəran-Masallı seçim dairəsi,5,2015-12-01,,,,,
4748204d-6f78-4b78-91a2-a0aa6a7aeae6,Cavanşir Əyyub oğlu Feyziyev,Cavanşir Əyyub oğlu Feyziyev,,,,Independent,IND,115,Şəki qəsəbə II seçim dairəsi,5,2015-12-01,,,,Q327591,
af3bed26-0a90-4f06-92ca-3f8b10ec46c5,Cavid Həmid oğlu Osmanov,Cavid Həmid oğlu Osmanov,,,,Yeni Azərbaycan Partiyası,Yeni Azərbaycan Partiyası,90,Ağdaş seçim dairəsi,5,2015-12-01,,,,,
f8c6b718-ca64-4960-a490-c338bfb1d386,Cavid Qənbər oğlu Qurbanov,Cavid Qənbər oğlu Qurbanov,,,,Yeni Azərbaycan Partiyası,Yeni Azərbaycan Partiyası,123,Kəlbəcər seçim dairəsi,5,2015-12-01,,,,,
275a989e-98c2-4cdd-8ae5-9f3d3914e205,Dilarə Məmmədağa qızı Cəbrayılova,Dilarə Məmmədağa qızı Cəbrayılova,,,,Yeni Azərbaycan Partiyası,Yeni Azərbaycan Partiyası,27,Sabunçu II seçim dairəsi,5,2015-12-01,,,,,
f7fd3b59-cabc-478a-bd83-94dbac943d77,Eldar Allahyar oğlu Quliyev,Eldar Allahyar oğlu Quliyev,,,,Independent,IND,28,Sabunçu III seçim dairəsi,5,2015-12-01,,,,Q327591,
ff4d62d8-c5ef-4f68-ba56-5a1bf4ff5366,Eldar Rza oğlu İbrahimov,Eldar Rza oğlu İbrahimov,,,,Yeni Azərbaycan Partiyası,Yeni Azərbaycan Partiyası,4,Naxçıvan şəhər seçim dairəsi,5,2015-12-01,,,,,
6623fd2f-3b1c-466f-91c3-540b608d7ee5,Eldəniz Adil oğlu Səlimov,Eldəniz Adil oğlu Səlimov,,,,Yeni Azərbaycan Partiyası,Yeni Azərbaycan Partiyası,55,Xaçmaz şəhər seçim dairəsi,5,2015-12-01,,,,,
7450ffab-dae2-4bb7-969c-80d825946e45,Elman Camal oğlu Məmmədov,Elman Camal oğlu Məmmədov,,,,Yeni Azərbaycan Partiyası,Yeni Azərbaycan Partiyası,124,Şuşa-Ağdam-Xocalı-Xocavənd seçim dairəsi,5,2015-12-01,,,,,
ff03813b-c236-4141-b796-19b6815508fa,Elman Xudam oğlu Nəsirli,Elman Xudam oğlu Nəsirli,,,,Yeni Azərbaycan Partiyası,Yeni Azərbaycan Partiyası,89,Göyçay-Ağdaş seçim dairəsi,5,2015-12-01,,,,,
b9c8e28a-f899-41e0-bf30-ee383e5be14a,Elmira Hüseyn qızı Axundova,Elmira Hüseyn qızı Axundova,,,,Independent,IND,71,Masallı qəsəbə seçim dairəsi,5,2015-12-01,,,,Q327591,
c15d94b8-df20-4f2a-b684-b260503df6ee,Elxan Sirac oğlu Süleymanov,Elxan Sirac oğlu Süleymanov,,,,Independent,IND,85,Şamaxı seçim dairəsi,5,2015-12-01,,,,Q327591,
2f9aa5b3-1078-4ce4-ab65-715a05a5c211,Elçin Bəybala oğlu Quliyev,Elçin Bəybala oğlu Quliyev,,,,Yeni Azərbaycan Partiyası,Yeni Azərbaycan Partiyası,63,Sabirabad I seçim dairəsi,5,2015-12-01,,,,,
7e1bace0-2d25-4fe0-a133-505b74035319,Elşad Eldar oğlu Həsənov,Elşad Eldar oğlu Həsənov,,,,Independent,IND,17,Yasamal III seçim dairəsi,5,2015-12-01,,,,Q327591,
4ca32a9f-6ddb-422a-b9e9-e1336d0ed3b1,Elşən Məmmədhənifə oğlu Musayev,Elşən Məmmədhənifə oğlu Musayev,,,,Azərbaycan Demokratik Maarifçilik Partiyası,Azərbaycan Demokratik Maarifçilik Partiyası,110,Zaqatala seçim dairəsi,5,2015-12-01,,,,,
8cb23d00-f11f-4831-ac6b-411143cb6f5c,Fazil Qəzənfər oğlu Mustafa,Fazil Qəzənfər oğlu Mustafa,,,,Böyük Quruluş Partiyası,Böyük Quruluş Partiyası,26,Sabunçu I seçim dairəsi,5,2015-12-01,,,,,
5069257f-723e-41c2-b2d1-aa200461066d,Flora Qasım qızı Qasımova,Flora Qasım qızı Qasımova,,,,Independent,IND,122,Xankəndi seçim dairəsi,5,2015-12-01,,,,Q327591,
7aeb084e-babb-46be-b774-dc1c399f7977,Fuad Rauf oğlu Muradov,Fuad Rauf oğlu Muradov,,,,Independent,IND,34,Xətai II seçim dairəsi,5,2015-12-01,,,,Q327591,
97ae920a-124b-4afa-9bba-898bf7cb9ef0,Fərəc İbrahim oğlu Quliyev,Fərəc İbrahim oğlu Quliyev,,,,Milli Dirçəliş Hərəkatı Partiyası,Milli Dirçəliş Hərəkatı Partiyası,31,Suraxanı II seçim dairəsi,5,2015-12-01,,,,,
7cad5a46-bedd-4a96-9ab1-d83da7d6eb49,Fəttah Səməd oğlu Heydərov,Fəttah Səməd oğlu Heydərov,,,,Independent,IND,116,Qəbələ seçim dairəsi,5,2015-12-01,,,,Q327591,
96501b1e-36ff-4410-a5a8-704128ce2553,Fəzail Feyruz oğlu İbrahimli,Fəzail Feyruz oğlu İbrahimli,,,,Vətəndaş Həmrəyliyi Partiyası,Vətəndaş Həmrəyliyi Partiyası,69,Cəlilabad-Masallı-Biləsuvar seçim dairəsi,5,2015-12-01,,,,,
a535993d-1f7d-41fc-986c-7e1488424121,Fəzail Rəhim oğlu Ağamalı,Fəzail Rəhim oğlu Ağamalı,,,,Ana Vətən Partiyası,Ana Vətən Partiyası,60,Salyan-Neftçala seçim dairəsi,5,2015-12-01,,,,,
d51afa9b-9405-4798-8e3d-933cd5058357,Gövhər Baxşəli qızı Baxşəliyeva,Gövhər Baxşəli qızı Baxşəliyeva,,,,Independent,IND,93,Bərdə şəhər seçim dairəsi,5,2015-12-01,,,,Q327591,
68cba8cf-4977-4b15-b686-eb69ec740191,Hacı Hacıbaba oğlu Salayev,Hacı Hacıbaba oğlu Salayev,,,,Independent,IND,44,Sumqayıt-Abşeron seçim dairəsi,5,2015-12-01,,,,Q327591,
8ce85dd9-1e88-4338-835f-fe7271320e0d,Hadı Musa oğlu Rəcəbli,Hadı Musa oğlu Rəcəbli,,,,Yeni Azərbaycan Partiyası,Yeni Azərbaycan Partiyası,74,Lənkəran qəsəbə seçim dairəsi,5,2015-12-01,,,,,
409fab66-049f-42e3-bfd6-d9ee18f7cfaf,Hikmət Baba oğlu Məmmədov,Hikmət Baba oğlu Məmmədov,,,,Yeni Azərbaycan Partiyası,Yeni Azərbaycan Partiyası,19,Nərimanov I seçim dairəsi,5,2015-12-01,,,,,
27b36650-e8bb-49fb-b642-803776e2f3b9,Hüseynbala Fazil oğlu Mirələmov,Hüseynbala Fazil oğlu Mirələmov,,,,Yeni Azərbaycan Partiyası,Yeni Azərbaycan Partiyası,33,Xətai I seçim dairəsi,5,2015-12-01,,,,,
cb6d6bb1-bb2f-44c3-9e74-35ce02d55b66,Jalə Fazil qızı Əliyeva,Jalə Fazil qızı Əliyeva,,,,Independent,IND,92,Zərdab-Ucar seçim dairəsi,5,2015-12-01,,,,Q327591,
340683fb-dcfd-459d-8f59-e93bdb561762,Kamaləddin Nəsrəddin oğlu Qafarov,Kamaləddin Nəsrəddin oğlu Qafarov,,,,Yeni Azərbaycan Partiyası,Yeni Azərbaycan Partiyası,9,Binəqədi II seçim dairəsi,5,2015-12-01,,,,,
7ed44bb2-f3f0-4534-98dd-91f7cf82bde0,Kamilə Əli Ağa qızı Əliyeva,Kamilə Əli Ağa qızı Əliyeva,,,,Yeni Azərbaycan Partiyası,Yeni Azərbaycan Partiyası,111,Zaqatala-Balakən seçim dairəsi,5,2015-12-01,,,,,
7ec87ccf-3927-4216-a67b-4b62a246a186,Kamran Fərhad oğlu Bayramov,Kamran Fərhad oğlu Bayramov,,,,Yeni Azərbaycan Partiyası,Yeni Azərbaycan Partiyası,100,Şəmkir-Daşkəsən seçim dairəsi,5,2015-12-01,,,,,
7e1e59a1-07fe-4020-9f16-49209895dd18,Kamran Telman oğlu Nəbizadə,Kamran Telman oğlu Nəbizadə,,,,Independent,IND,107,Qazax seçim dairəsi,5,2015-12-01,,,,Q327591,
66749785-c955-4ae3-ab69-a7862a6cf584,Madər Ələsgər oğlu Musayev,Madər Ələsgər oğlu Musayev,,,,Independent,IND,10,Binəqədi III seçim dairəsi,5,2015-12-01,,,,Q327591,
c7b31395-8ba2-46de-ac33-985726329266,Mahir Məhəmmədəli oğlu Aslanov,Mahir Məhəmmədəli oğlu Aslanov,,,,Independent,IND,96,Goranboy-Naftalan seçim dairəsi,5,2015-12-01,,,,Q327591,
2c7edfcb-d1f8-4a22-bdb5-ecb5f18ee853,Mahir Tapdıq oğlu Abbaszadə,Mahir Tapdıq oğlu Abbaszadə,,,,Yeni Azərbaycan Partiyası,Yeni Azərbaycan Partiyası,121,Laçın seçim dairəsi,5,2015-12-01,,,,,
c11cfd6b-7ae8-481d-be88-a15774794444,Malik Əvəz oğlu Həsənov,Malik Əvəz oğlu Həsənov,,,,Yeni Azərbaycan Partiyası,Yeni Azərbaycan Partiyası,67,Cəlilabad şəhər seçim dairəsi,5,2015-12-01,,,,,
20af5ae3-d0f5-48b7-a2b0-854d672f8941,Mehriban Arif qızı Əliyeva,Mehriban Arif qızı Əliyeva,,,,Yeni Azərbaycan Partiyası,Yeni Azərbaycan Partiyası,14,Xəzər II seçim dairəsi,5,2015-12-01,,,,,
1f48b11e-cbc2-4226-9e61-880c98ab47ae,Mirkazım Mirməhəmməd oğlu Kazımov,Mirkazım Mirməhəmməd oğlu Kazımov,,,,Yeni Azərbaycan Partiyası,Yeni Azərbaycan Partiyası,68,Cəlilabad qəsəbə seçim dairəsi,5,2015-12-01,,,,,
dcf204fe-58f3-4c3e-8cb2-7a78c556ef5b,Mirzəcan Mirzəmməd oğlu Xəlilov,Mirzəcan Mirzəmməd oğlu Xəlilov,,,,Yeni Azərbaycan Partiyası,Yeni Azərbaycan Partiyası,41,Sumqayıt I seçim dairəsi,5,2015-12-01,,,,,
634fa894-7aa2-4d62-93bb-fd5125c0e250,Mixail Yuri oğlu Zabelin,Mixail Yuri oğlu Zabelin,,,,Yeni Azərbaycan Partiyası,Yeni Azərbaycan Partiyası,12,Qaradağ-Binəqədi-Yasamal seçim dairəsi,5,2015-12-01,,,,,
7655bc26-b067-4fa6-92cc-573f6b5d65f4,Musa Cəfər oğlu Qasımlı,Musa Cəfər oğlu Qasımlı,,,,Independent,IND,72,Yardımlı-Masallı seçim dairəsi,5,2015-12-01,,,,Q327591,
dbb77116-d91a-4cd1-919c-1926b6a22dfc,Musa İsa oğlu Quliyev (Urud),Musa İsa oğlu Quliyev (Urud),,,,Yeni Azərbaycan Partiyası,Yeni Azərbaycan Partiyası,40,Kəpəz II seçim dairəsi (Gəncə şəhəri),5,2015-12-01,,,,,
2a9cd3ee-a099-4cef-834f-0ace578a259d,Muxtar Bahadur oğlu Babayev,Muxtar Bahadur oğlu Babayev,,,,Yeni Azərbaycan Partiyası,Yeni Azərbaycan Partiyası,43,Sumqayıt III seçim dairəsi,5,2015-12-01,,,,,
5e82c460-4b52-4959-a35a-e4f0c6a8b8b2,Müslüm Mürsəl oğlu Məmmədov,Müslüm Mürsəl oğlu Məmmədov,,,,Independent,IND,57,Kürdəmir seçim dairəsi,5,2015-12-01,,,,Q327591,
7eeab10d-57d4-45e7-bba6-e55dfead1ff1,Məlahət İbrahim qızı Həsənova,Məlahət İbrahim qızı Həsənova,,,,Yeni Azərbaycan Partiyası,Yeni Azərbaycan Partiyası,21,Nəsimi I seçim dairəsi,5,2015-12-01,,,,,
f311579c-e403-464c-87b4-63d0b55faf80,Naqif Ələşrəf oğlu Həmzəyev,Naqif Ələşrəf oğlu Həmzəyev,,,,Yeni Azərbaycan Partiyası,Yeni Azərbaycan Partiyası,38,Nizami II seçim dairəsi (Gəncə şəhəri),5,2015-12-01,,,,,
da612c04-9eb4-4268-9f16-25447e7b0e2f,Nizami Qulu oğlu Cəfərov,Nizami Qulu oğlu Cəfərov,,,,Yeni Azərbaycan Partiyası,Yeni Azərbaycan Partiyası,108,Ağstafa seçim dairəsi,5,2015-12-01,,,,,
e9841e81-0f0c-4fba-8be9-cad224d4c945,Novruzəli Davud oğlu Aslanov,Novruzəli Davud oğlu Aslanov,,,,Independent,IND,86,İsmayıllı seçim dairəsi,5,2015-12-01,,,,Q327591,
a3ebb32f-3e1b-4bba-9906-5b293ef1ce4e,Nəriman Əlibala oğlu Əliyev,Nəriman Əlibala oğlu Əliyev,,,,Yeni Azərbaycan Partiyası,Yeni Azərbaycan Partiyası,70,Masallı şəhər seçim dairəsi,5,2015-12-01,,,,,
3caf507c-67f4-4e5a-9c11-cc88de273a3c,Nəsib Məhəmməd oğlu Məhəməliyev,Nəsib Məhəmməd oğlu Məhəməliyev,,,,Yeni Azərbaycan Partiyası,Yeni Azərbaycan Partiyası,109,Balakən seçim dairəsi,5,2015-12-01,,,,,
2e63c737-3a6d-4dad-a4dd-00b3c923b7e9,Oqtay Sabir oğlu Əsədov,Oqtay Sabir oğlu Əsədov,,,,Yeni Azərbaycan Partiyası,Yeni Azərbaycan Partiyası,45,Abşeron seçim dairəsi,5,2015-12-01,,,,,
9e60494d-73af-41b6-a55e-3bd3705166a3,Pərvin Orxan qızı Kərimzadə,Pərvin Orxan qızı Kərimzadə,,,,Yeni Azərbaycan Partiyası,Yeni Azərbaycan Partiyası,37,Nizami I seçim dairəsi (Gəncə şəhəri),5,2015-12-01,,,,,
400ef8c2-bced-4cb6-bd92-c59d393fe0f2,Qüdrət Müzəffər oğlu Həsənquliyev,Qüdrət Müzəffər oğlu Həsənquliyev,,,,Bütöv Azərbaycan Xalq Cəbhəsi Partiyası,Bütöv Azərbaycan Xalq Cəbhəsi Partiyası,7,Ordubad-Culfa seçim dairəsi,5,2015-12-01,,,,,
e30436af-ceb7-43e9-85c5-7a0903c665cb,Qənirə Ələsgər qızı Paşayeva,Qənirə Ələsgər qızı Paşayeva,,,,Independent,IND,105,Tovuz seçim dairəsi,5,2015-12-01,,,,Q327591,
c48feb21-4212-492c-8c0a-ba6a327f5d86,Rafael Baba oğlu Hüseynov,Rafael Baba oğlu Hüseynov,,,,Independent,IND,58,Hacıqabul-Kürdəmir seçim dairəsi,5,2015-12-01,,,,Q327591,
416a9d2d-a671-424b-9f9d-27e07a482ea0,Rafael Kamil oğlu Cəbrayılov,Rafael Kamil oğlu Cəbrayılov,,,,Independent,IND,46,Şirvan seçim dairəsi,5,2015-12-01,,,,Q327591,
bcfa3393-9855-4416-8761-6523f33c4707,Rafiq Musa oğlu Məmmədhəsənov,Rafiq Musa oğlu Məmmədhəsənov,,,,Yeni Azərbaycan Partiyası,Yeni Azərbaycan Partiyası,104,Gədəbəy-Tovuz seçim dairəsi,5,2015-12-01,,,,,
e0620817-958a-47f8-ae66-2ea671ed0a18,Rasim Nəsrəddin oğlu Musabəyov,Rasim Nəsrəddin oğlu Musabəyov,,,,Independent,IND,18,Nərimanov-Nizami seçim dairəsi,5,2015-12-01,,,,Q327591,
1aee5d2c-029b-433a-a0a8-982c08b4f0f4,Rauf Asif oğlu Əliyev,Rauf Asif oğlu Əliyev,,,,Yeni Azərbaycan Partiyası,Yeni Azərbaycan Partiyası,13,Xəzər I seçim dairəsi,5,2015-12-01,,,,,
c87bc3af-bdc1-4d5a-956b-9ae8c12c08c2,Rövnəq İbrahim oğlu Abdullayev,Rövnəq İbrahim oğlu Abdullayev,,,,Yeni Azərbaycan Partiyası,Yeni Azərbaycan Partiyası,24,Nizami I seçim dairəsi,5,2015-12-01,,,,,
7556849e-e77b-4540-9c7f-aaaf978c4b3a,Rövşən Şükür oğlu Rzayev,Rövşən Şükür oğlu Rzayev,,,,Independent,IND,101,Göygöl-Daşkəsən seçim dairəsi,5,2015-12-01,,,,Q327591,
4ba1bbec-50fc-44b8-a43c-abf8f451174a,Rüfət Atakişi oğlu Quliyev,Rüfət Atakişi oğlu Quliyev,,,,Independent,IND,73,Lənkəran şəhər seçim dairəsi,5,2015-12-01,,,,Q327591,
3d8edc27-7b25-4b4b-93c5-7047119b7265,Rüstəm Gülabba oğlu Xəlilov,Rüstəm Gülabba oğlu Xəlilov,,,,Yeni Azərbaycan Partiyası,Yeni Azərbaycan Partiyası,64,Sabirabad II seçim dairəsi,5,2015-12-01,,,,,
7c86704c-8cdf-4892-b088-1c3a5eee6316,Rəşad Məmmədqulu oğlu Mahmudov,Rəşad Məmmədqulu oğlu Mahmudov,,,,Yeni Azərbaycan Partiyası,Yeni Azərbaycan Partiyası,77,Astara seçim dairəsi,5,2015-12-01,,,,,
7fb11c56-7254-47dc-a3b4-5b2a740011b3,Sabir Kamal oğlu Hacıyev,Sabir Kamal oğlu Hacıyev,,,,Vətəndaş Birliyi Partiyası,Vətəndaş Birliyi Partiyası,88,Göyçay seçim dairəsi,5,2015-12-01,,,,,
a8ff2bf0-6452-4f0b-b7a0-c1d0fc31a420,Sahib Eyvaz oğlu Alıyev,Sahib Eyvaz oğlu Alıyev,,,,Independent,IND,95,Tərtər seçim dairəsi,5,2015-12-01,,,,Q327591,
67cff3d5-d80c-432d-b50d-5f5160501182,Sahibə Əli qızı Qafarova,Sahibə Əli qızı Qafarova,,,,Yeni Azərbaycan Partiyası,Yeni Azərbaycan Partiyası,98,Şəmkir şəhər seçim dairəsi,5,2015-12-01,,,,,
074011a0-570f-4707-b3fb-c30d9c9e8ac9,Sevinc Həbib qızı Fətəliyeva,Sevinc Həbib qızı Fətəliyeva,,,,Yeni Azərbaycan Partiyası,Yeni Azərbaycan Partiyası,30,Suraxanı I seçim dairəsi,5,2015-12-01,,,,,
6056713d-517f-4b80-b298-99f33911bc73,Sevinc Əmirəhməd qızı Hüseynova,Sevinc Əmirəhməd qızı Hüseynova,,,,Yeni Azərbaycan Partiyası,Yeni Azərbaycan Partiyası,103,Gədəbəy seçim dairəsi,5,2015-12-01,,,,,
a835e971-6d1c-45fd-aa04-6ff3274da221,Siyavuş Dünyamalı oğlu Novruzov,Siyavuş Dünyamalı oğlu Novruzov,,,,Yeni Azərbaycan Partiyası,Yeni Azərbaycan Partiyası,5,Şahbuz-Babək seçim dairəsi,5,2015-12-01,,,,,
308241b8-e22b-485a-8483-9539f6a90651,Sona Sakit qızı Əliyeva,Sona Sakit qızı Əliyeva,,,,Yeni Azərbaycan Partiyası,Yeni Azərbaycan Partiyası,99,Şəmkir qəsəbə seçim dairəsi,5,2015-12-01,,,,,
b16e40c5-08ad-4797-b983-85b9fc905a08,Sədaqət Süleyman qızı Vəliyeva,Sədaqət Süleyman qızı Vəliyeva,,,,Yeni Azərbaycan Partiyası,Yeni Azərbaycan Partiyası,25,Nizami II seçim dairəsi,5,2015-12-01,,,,,
1256640a-659a-4d66-8865-acd18903211c,Səməd İsmayıl oğlu Seyidov,Səməd İsmayıl oğlu Seyidov,,,,Yeni Azərbaycan Partiyası,Yeni Azərbaycan Partiyası,36,Xətai IV seçim dairəsi,5,2015-12-01,,,,,
1275b8a2-5efa-4373-9f7c-137c94e7b6a7,Səttar Suliddin oğlu Mehbalıyev,Səttar Suliddin oğlu Mehbalıyev,,,,Independent,IND,3,Babək-Kəngərli-Naxçıvan seçim dairəsi,5,2015-12-01,,,,Q327591,
9ac94655-ba82-419c-a66c-7f96092f8a5b,Tahir Famil oğlu oğlu Mirkişili,Tahir Famil oğlu oğlu Mirkişili,,,,Yeni Azərbaycan Partiyası,Yeni Azərbaycan Partiyası,42,Sumqayıt II seçim dairəsi,5,2015-12-01,,,,,
9e48a349-a9ea-4459-a2e7-a09d7e07eebc,Tahir Musa oğlu Rzayev,Tahir Musa oğlu Rzayev,,,,Yeni Azərbaycan Partiyası,Yeni Azərbaycan Partiyası,82,Ağcabədi seçim dairəsi,5,2015-12-01,,,,,
679165bb-2c67-40ee-9d89-8dbe62b70807,Tahir Süleyman oğlu Süleymanov,Tahir Süleyman oğlu Süleymanov,,,,Yeni Azərbaycan Partiyası,Yeni Azərbaycan Partiyası,54,Şabran-Siyəzən seçim dairəsi,5,2015-12-01,,,,,
640b5343-91ea-4715-adb4-0d3235471020,Tahir Zayıdağa oğlu Kərimli,Tahir Zayıdağa oğlu Kərimli,,,,Vəhdət Partiyası,Vəhdət Partiyası,87,Ağsu-İsmayıllı seçim dairəsi,5,2015-12-01,,,,,
19c6d144-7f89-42ae-ab8b-b558edfc61f5,Vahid Qazməmməd oğlu Əhmədov,Vahid Qazməmməd oğlu Əhmədov,,,,Independent,IND,52,Quba seçim dairəsi,5,2015-12-01,,,,Q327591,
87ddd1c2-8ebe-4f85-bbf0-438f5509645a,Valeh Feyruz oğlu Ələsgərov,Valeh Feyruz oğlu Ələsgərov,,,,Independent,IND,102,Samux-Şəmkir seçim dairəsi,5,2015-12-01,,,,Q327591,
8511beca-3110-485d-92a3-311499fbbe57,Vasif Yusif oğlu Talıbov,Vasif Yusif oğlu Talıbov,,,,Yeni Azərbaycan Partiyası,Yeni Azərbaycan Partiyası,1,Şərur-Sədərək seçim dairəsi,5,2015-12-01,,,,,
3181677f-6cfb-4dfe-8bce-73f804805956,Vüsal Əfqan oğlu Hüseynov,Vüsal Əfqan oğlu Hüseynov,,,,Yeni Azərbaycan Partiyası,Yeni Azərbaycan Partiyası,91,Ucar seçim dairəsi,5,2015-12-01,,,,,
dc2de8c4-9b6d-4aa1-bd8c-8ef89e470bc4,Xanhüseyn Hüseynağa oğlu Kazımlı,Xanhüseyn Hüseynağa oğlu Kazımlı,,,,Azərbaycan Sosial Rifah Partiyası,Azərbaycan Sosial Rifah Partiyası,66,Biləsuvar seçim dairəsi,5,2015-12-01,,,,,
87c68a8a-1dbc-4d0f-984a-14fd6814fb06,Xanlar Nuru oğlu Fətiyev,Xanlar Nuru oğlu Fətiyev,,,,Yeni Azərbaycan Partiyası,Yeni Azərbaycan Partiyası,39,Kəpəz I seçim dairəsi (Gəncə şəhəri),5,2015-12-01,,,,,
067bbbbe-5b53-4560-a1b3-c5a927a18c6d,Yaqub Mikayıl oğlu Mahmudov,Yaqub Mikayıl oğlu Mahmudov,,,,Yeni Azərbaycan Partiyası,Yeni Azərbaycan Partiyası,113,Şəki şəhər seçim dairəsi,5,2015-12-01,,,,,
aa9c711c-3c98-4d3a-a9f1-41997adc5e0f,Yevda Sasun oğlu Abramov,Yevda Sasun oğlu Abramov,,,,Yeni Azərbaycan Partiyası,Yeni Azərbaycan Partiyası,53,Quba-Qusar seçim dairəsi,5,2015-12-01,,,,,
a0cf49af-06ec-4361-adeb-39505e084cd5,Zahid Məhərrəm oğlu Oruc,Zahid Məhərrəm oğlu Oruc,,,,Independent,IND,94,Bərdə qəsəbə seçim dairəsi,5,2015-12-01,,,,Q327591,
abbd9352-49e0-4846-945f-436e7c747955,Zeynəb Yəhya qızı Xanlarova,Zeynəb Yəhya qızı Xanlarova,,,,Independent,IND,50,Qobustan-Xızı-Sumqayıt seçim dairəsi,5,2015-12-01,,,,Q327591,
475692df-033d-4714-b36e-743d1e642852,Ziyad Əliabbas oğlu Səmədzadə,Ziyad Əliabbas oğlu Səmədzadə,,,,Independent,IND,23,Nəsimi-Səbail seçim dairəsi,5,2015-12-01,,,,Q327591,
b440c505-5f9c-46d6-a491-312282ee1112,Ziyafət Abbas oğlu Əsgərov,Ziyafət Abbas oğlu Əsgərov,,,,Yeni Azərbaycan Partiyası,Yeni Azərbaycan Partiyası,76,Lənkəran-Astara seçim dairəsi,5,2015-12-01,,,,,
22c85cbd-0f4c-40b0-be09-cef9ebf93635,Çingiz Aşralı oğlu Qənizadə,Çingiz Aşralı oğlu Qənizadə,,,,Independent,IND,80,İmişli-Beyləqan seçim dairəsi,5,2015-12-01,,,,Q327591,
8054bd4c-9491-4989-8e36-414f64701785,Ülvi Zahid oğlu Quliyev,Ülvi Zahid oğlu Quliyev,,,,Independent,IND,15,Yasamal I seçim dairəsi,5,2015-12-01,,,,Q327591,
91b52181-5929-4b64-bbce-7b15d27f2deb,Ülviyyə Cavanşir qızı Ağayeva,Ülviyyə Cavanşir qızı Ağayeva,,,,Independent,IND,106,Tovuz-Qazax-Ağstafa seçim dairəsi,5,2015-12-01,,,,Q327591,
eb830e11-d9f4-45b6-a6e4-f733149c6390,Ülviyyə Tapdıq qızı Həmzəyeva,Ülviyyə Tapdıq qızı Həmzəyeva,,,,Yeni Azərbaycan Partiyası,Yeni Azərbaycan Partiyası,6,Culfa-Babək seçim dairəsi,5,2015-12-01,,,,,
8b036d3a-69f6-4e0e-b783-bca1337061bd,İlham Kazım oğlu Məmmədov,İlham Kazım oğlu Məmmədov,,,,Yeni Azərbaycan Partiyası,Yeni Azərbaycan Partiyası,48,Yevlax seçim dairəsi,5,2015-12-01,,,,,
9eebfe09-83fe-40a6-91ec-865a373ad3bd,İlham Əlisəftər oğlu Əliyev,İlham Əlisəftər oğlu Əliyev,,,,Yeni Azərbaycan Partiyası,Yeni Azərbaycan Partiyası,56,Xaçmaz qəsəbə seçim dairəsi,5,2015-12-01,,,,,
5d5767d1-9c85-4846-9c5c-24835f14c759,İmamverdi İbiş oğlu İsmayılov,İmamverdi İbiş oğlu İsmayılov,,,,Yeni Azərbaycan Partiyası,Yeni Azərbaycan Partiyası,125,Zəngilan-Qubadlı seçim dairəsi,5,2015-12-01,,,,,
1948341f-3a71-47a3-8c2a-93df156cb85e,İqbal Nəriman oğlu Məmmədov,İqbal Nəriman oğlu Məmmədov,,,,Yeni Azərbaycan Partiyası,Yeni Azərbaycan Partiyası,78,Lerik seçim dairəsi,5,2015-12-01,,,,,
d2166cf9-14a9-4540-aa3e-53d6118bfc80,İsa Əkbər oğlu Həbibbəyli,İsa Əkbər oğlu Həbibbəyli,,,,Yeni Azərbaycan Partiyası,Yeni Azərbaycan Partiyası,2,Şərur seçim dairəsi,5,2015-12-01,,,,,
e4ff6b52-9f1d-4c19-b08c-98401d3796db,Şahin Əmir oğlu İsmayılov,Şahin Əmir oğlu İsmayılov,,,,Yeni Azərbaycan Partiyası,Yeni Azərbaycan Partiyası,81,Beyləqan seçim dairəsi,5,2015-12-01,,,,,
71ed7534-6506-4b6b-9c3c-a40af5e9fb2e,Şəmsəddin Hümmət oğlu Hacıyev,Şəmsəddin Hümmət oğlu Hacıyev,,,,Yeni Azərbaycan Partiyası,Yeni Azərbaycan Partiyası,29,Səbail seçim dairəsi,5,2015-12-01,,,,,
fa6329e3-1fcc-4a4d-98b8-490e5db21722,Əflatun Əhməd oğlu Amaşov,Əflatun Əhməd oğlu Amaşov,,,,Independent,IND,62,Saatlı seçim dairəsi,5,2015-12-01,,,,Q327591,
5ce107f3-3bd3-4845-a426-6af3b3deeb51,Əhliman Tapdıq oğlu Əmiraslanov,Əhliman Tapdıq oğlu Əmiraslanov,,,,Yeni Azərbaycan Partiyası,Yeni Azərbaycan Partiyası,65,Saatlı-Sabirabad-Kürdəmir seçim dairəsi,5,2015-12-01,,,,,
92b0b2b9-5d9b-4145-8d6f-34cf11de8363,Əli Məhəmməd oğlu Hüseynli,Əli Məhəmməd oğlu Hüseynli,,,,Yeni Azərbaycan Partiyası,Yeni Azərbaycan Partiyası,49,Yevlax-Mingəçevir seçim dairəsi,5,2015-12-01,,,,,
991a1ebc-a465-4bd6-a88c-6e0055554643,Əli Əhməd oğlu Məsimli,Əli Əhməd oğlu Məsimli,,,,Independent,IND,114,Şəki qəsəbə I seçim dairəsi,5,2015-12-01,,,,Q327591,
75e5c6f8-2bda-4085-b53b-ed7cf968e4e4,Əliağa İzzət oğlu Hüseynov,Əliağa İzzət oğlu Hüseynov,,,,Independent,IND,59,Salyan seçim dairəsi,5,2015-12-01,,,,Q327591,
9d3e3caa-b73f-4675-a3c5-d96c9af639b1,Əsabil Qarakişi oğlu Qasımov,Əsabil Qarakişi oğlu Qasımov,,,,Yeni Azərbaycan Partiyası,Yeni Azərbaycan Partiyası,79,İmişli seçim dairəsi,5,2015-12-01,,,,,
