id,name,sort_name,email,twitter,facebook,group,group_id,area_id,area,term,start_date,image,gender,wikidata,wikidata_group,wikidata_area
6d4deb62-78b1-4629-b636-e9894f9c44ad,Adil Abış oğlu Əliyev,Adil Abış oğlu Əliyev,,,,Independent,83b82faf-9a1d-4bf8-bd05-5c7f10e6f679,20,Nərimanov II seçim dairəsi,5,2015-12-01,,,,Q327591,
90db0508-1ca5-4fa0-a1d5-5b8dfbd4b46d,Aqil Məhəmməd oğlu Abbas,Aqil Məhəmməd oğlu Abbas,,,,Independent,83b82faf-9a1d-4bf8-bd05-5c7f10e6f679,83,Ağcabədi-Füzuli seçim dairəsi,5,2015-12-01,,,,Q327591,
767fb502-2b67-44f6-b3ca-bd570460dffc,Aqiyə Həbib qızı Naxçıvanlı,Aqiyə Həbib qızı Naxçıvanlı,,,,Yeni Azərbaycan Partiyası,Yeni Azərbaycan Partiyası,117,Oğuz-Qəbələ seçim dairəsi,5,2015-12-01,,,,,
7a02c20a-6dc0-47f1-88b9-d6c51e6428be,Araz Məmməd-Mübariz oğlu Əlizadə,Araz Məmməd-Mübariz oğlu Əlizadə,,,,Azərbaycan Sosial Demokrat Partiyası,Azərbaycan Sosial Demokrat Partiyası,35,Xətai III seçim dairəsi,5,2015-12-01,,,,,
0ee5d588-71a3-48b2-8394-f040df4c3d0b,Arif Qafar oğlu Rəhimzadə,Arif Qafar oğlu Rəhimzadə,,,,Yeni Azərbaycan Partiyası,Yeni Azərbaycan Partiyası,61,Neftçala seçim dairəsi,5,2015-12-01,,,,,
13bff191-ee4f-4bd4-88ee-716571265872,Asim Nazim oğlu Mollazadə,Asim Nazim oğlu Mollazadə,,,,Azərbaycan Demokratik İslahatlar Partiyası,Azərbaycan Demokratik İslahatlar Partiyası,22,Nəsimi II seçim dairəsi,5,2015-12-01,,,,,
ca872455-cca7-4360-ae27-76e449c727d7,Astan Nuşrəvan oğlu Şahverdiyev,Astan Nuşrəvan oğlu Şahverdiyev,,,,Yeni Azərbaycan Partiyası,Yeni Azərbaycan Partiyası,120,Cəbrayıl-Qubadlı seçim dairəsi,5,2015-12-01,,,,,
608c2dcc-3ace-4441-8304-f0bdb8f79e3c,Aydın Böyükkişi oğlu Mirzəzadə,Aydın Böyükkişi oğlu Mirzəzadə,,,,Yeni Azərbaycan Partiyası,Yeni Azərbaycan Partiyası,47,Mingəçevir seçim dairəsi,5,2015-12-01,,,,,
55e18b33-4307-42ea-8da9-414ba4f506be,Aydın Nəsir oğlu Hüseynov,Aydın Nəsir oğlu Hüseynov,,,,Yeni Azərbaycan Partiyası,Yeni Azərbaycan Partiyası,11,Qaradağ seçim dairəsi,5,2015-12-01,,,,,
f24e0367-c272-4bdd-b24b-587ddc955657,Aytən İnqilab qızı Mustafazadə,Aytən İnqilab qızı Mustafazadə,,,,Independent,83b82faf-9a1d-4bf8-bd05-5c7f10e6f679,16,Yasamal II seçim dairəsi,5,2015-12-01,,,,Q327591,
ddaa6f77-6bab-416f-ae1b-faf2e5762a2c,Azay Əjdər oğlu Quliyev,Azay Əjdər oğlu Quliyev,,,,Independent,83b82faf-9a1d-4bf8-bd05-5c7f10e6f679,8,Binəqədi I seçim dairəsi,5,2015-12-01,,,,Q327591,
dc5631e7-a577-4c90-bd6a-de21170fc35c,Azər Camal oğlu Badamov,Azər Camal oğlu Badamov,,,,Yeni Azərbaycan Partiyası,Yeni Azərbaycan Partiyası,51,Qusar seçim dairəsi,5,2015-12-01,,,,,
e59eb888-7d14-423b-b555-739ca5662df9,Azər Şəmşid oğlu Kərimli,Azər Şəmşid oğlu Kərimli,,,,Independent,83b82faf-9a1d-4bf8-bd05-5c7f10e6f679,112,Qax seçim dairəsi,5,2015-12-01,,,,Q327591,
f6b0ed4a-fc01-4fa1-941b-a566d5e63363,Ağacan Qulam oğlu Abıyev,Ağacan Qulam oğlu Abıyev,,,,Yeni Azərbaycan Partiyası,Yeni Azərbaycan Partiyası,32,Suraxanı III seçim dairəsi,5,2015-12-01,,,,,
9e08eb1d-c708-42d9-bb0f-573c8b181ac2,Ağalar İsrafil oğlu Vəliyev,Ağalar İsrafil oğlu Vəliyev,,,,Yeni Azərbaycan Partiyası,Yeni Azərbaycan Partiyası,97,Goranboy-Ağdam-Tərtər seçim dairəsi,5,2015-12-01,,,,,
ba992c17-8913-4542-b7aa-2d57957e1acc,Bahar Əvəz qızı Muradova,Bahar Əvəz qızı Muradova,,,,Yeni Azərbaycan Partiyası,Yeni Azərbaycan Partiyası,84,Füzuli seçim dairəsi,5,2015-12-01,,,,,
eae325da-fc01-4639-87b9-9011b0962440,Bəxtiyar Həmzə oğlu Əliyev,Bəxtiyar Həmzə oğlu Əliyev,,,,Independent,83b82faf-9a1d-4bf8-bd05-5c7f10e6f679,118,Ağdam şəhər seçim dairəsi,5,2015-12-01,,,,Q327591,
28ab2338-5c4e-46a6-8347-dd43bb0b1180,Bəxtiyar Yusif oğlu Sadıqov,Bəxtiyar Yusif oğlu Sadıqov,,,,Yeni Azərbaycan Partiyası,Yeni Azərbaycan Partiyası,119,Ağdam qəsəbə seçim dairəsi,5,2015-12-01,,,,,
50ee0327-830e-413d-8e08-168206f6e26a,Cavanşir Hümmət oğlu Paşazadə,Cavanşir Hümmət oğlu Paşazadə,,,,Yeni Azərbaycan Partiyası,Yeni Azərbaycan Partiyası,75,Lənkəran-Masallı seçim dairəsi,5,2015-12-01,,,,,
21cf9dda-e91d-4942-9ec4-af58f12b953e,Cavanşir Əyyub oğlu Feyziyev,Cavanşir Əyyub oğlu Feyziyev,,,,Independent,83b82faf-9a1d-4bf8-bd05-5c7f10e6f679,115,Şəki qəsəbə II seçim dairəsi,5,2015-12-01,,,,Q327591,
f69ac83b-ffbc-4a6c-ad9d-323eaf99c9e0,Cavid Həmid oğlu Osmanov,Cavid Həmid oğlu Osmanov,,,,Yeni Azərbaycan Partiyası,Yeni Azərbaycan Partiyası,90,Ağdaş seçim dairəsi,5,2015-12-01,,,,,
32dfc645-4f6e-477b-994e-87ccd315462a,Cavid Qənbər oğlu Qurbanov,Cavid Qənbər oğlu Qurbanov,,,,Yeni Azərbaycan Partiyası,Yeni Azərbaycan Partiyası,123,Kəlbəcər seçim dairəsi,5,2015-12-01,,,,,
eb9c11c3-7e52-47c3-bb47-c36053021200,Dilarə Məmmədağa qızı Cəbrayılova,Dilarə Məmmədağa qızı Cəbrayılova,,,,Yeni Azərbaycan Partiyası,Yeni Azərbaycan Partiyası,27,Sabunçu II seçim dairəsi,5,2015-12-01,,,,,
032b83d4-2147-43c9-b28b-5e00e700da31,Eldar Allahyar oğlu Quliyev,Eldar Allahyar oğlu Quliyev,,,,Independent,83b82faf-9a1d-4bf8-bd05-5c7f10e6f679,28,Sabunçu III seçim dairəsi,5,2015-12-01,,,,Q327591,
d0d96171-dc3c-491a-bbec-5c5e2c3f6794,Eldar Rza oğlu İbrahimov,Eldar Rza oğlu İbrahimov,,,,Yeni Azərbaycan Partiyası,Yeni Azərbaycan Partiyası,4,Naxçıvan şəhər seçim dairəsi,5,2015-12-01,,,,,
0868626f-f46b-4f76-bf36-b54030867a7d,Eldəniz Adil oğlu Səlimov,Eldəniz Adil oğlu Səlimov,,,,Yeni Azərbaycan Partiyası,Yeni Azərbaycan Partiyası,55,Xaçmaz şəhər seçim dairəsi,5,2015-12-01,,,,,
85b020bb-4b3c-4c0d-951a-f2aabb135e31,Elman Camal oğlu Məmmədov,Elman Camal oğlu Məmmədov,,,,Yeni Azərbaycan Partiyası,Yeni Azərbaycan Partiyası,124,Şuşa-Ağdam-Xocalı-Xocavənd seçim dairəsi,5,2015-12-01,,,,,
098375db-9579-4dce-8d61-f1ea0f629846,Elman Xudam oğlu Nəsirli,Elman Xudam oğlu Nəsirli,,,,Yeni Azərbaycan Partiyası,Yeni Azərbaycan Partiyası,89,Göyçay-Ağdaş seçim dairəsi,5,2015-12-01,,,,,
b1511e8f-47a2-4411-9bb1-954df27ee0b5,Elmira Hüseyn qızı Axundova,Elmira Hüseyn qızı Axundova,,,,Independent,83b82faf-9a1d-4bf8-bd05-5c7f10e6f679,71,Masallı qəsəbə seçim dairəsi,5,2015-12-01,,,,Q327591,
5a481d8e-2612-4ac8-8ccf-fe3e12e2fe4c,Elxan Sirac oğlu Süleymanov,Elxan Sirac oğlu Süleymanov,,,,Independent,83b82faf-9a1d-4bf8-bd05-5c7f10e6f679,85,Şamaxı seçim dairəsi,5,2015-12-01,,,,Q327591,
5234fd7e-14c8-4860-a8dc-f30af22f3e2f,Elçin Bəybala oğlu Quliyev,Elçin Bəybala oğlu Quliyev,,,,Yeni Azərbaycan Partiyası,Yeni Azərbaycan Partiyası,63,Sabirabad I seçim dairəsi,5,2015-12-01,,,,,
ff26430e-53bf-4115-b3d7-c8f0eb1dd456,Elşad Eldar oğlu Həsənov,Elşad Eldar oğlu Həsənov,,,,Independent,83b82faf-9a1d-4bf8-bd05-5c7f10e6f679,17,Yasamal III seçim dairəsi,5,2015-12-01,,,,Q327591,
daaad0f4-73a8-4797-ac2d-f170b445a922,Elşən Məmmədhənifə oğlu Musayev,Elşən Məmmədhənifə oğlu Musayev,,,,Azərbaycan Demokratik Maarifçilik Partiyası,Azərbaycan Demokratik Maarifçilik Partiyası,110,Zaqatala seçim dairəsi,5,2015-12-01,,,,,
03c5ad22-151c-4340-85f3-d634152256a1,Fazil Qəzənfər oğlu Mustafa,Fazil Qəzənfər oğlu Mustafa,,,,Böyük Quruluş Partiyası,Böyük Quruluş Partiyası,26,Sabunçu I seçim dairəsi,5,2015-12-01,,,,,
d140d176-2471-46af-b21b-0d64fcba4bfd,Flora Qasım qızı Qasımova,Flora Qasım qızı Qasımova,,,,Independent,83b82faf-9a1d-4bf8-bd05-5c7f10e6f679,122,Xankəndi seçim dairəsi,5,2015-12-01,,,,Q327591,
f7df5a15-33df-4606-a8e6-d710c5f0f130,Fuad Rauf oğlu Muradov,Fuad Rauf oğlu Muradov,,,,Independent,83b82faf-9a1d-4bf8-bd05-5c7f10e6f679,34,Xətai II seçim dairəsi,5,2015-12-01,,,,Q327591,
0e046350-dbb6-4a1a-9162-fa1ae54f68f0,Fərəc İbrahim oğlu Quliyev,Fərəc İbrahim oğlu Quliyev,,,,Milli Dirçəliş Hərəkatı Partiyası,Milli Dirçəliş Hərəkatı Partiyası,31,Suraxanı II seçim dairəsi,5,2015-12-01,,,,,
3a852d21-6403-4572-8bb4-077441c6d018,Fəttah Səməd oğlu Heydərov,Fəttah Səməd oğlu Heydərov,,,,Independent,83b82faf-9a1d-4bf8-bd05-5c7f10e6f679,116,Qəbələ seçim dairəsi,5,2015-12-01,,,,Q327591,
d9a8a970-db17-4f1c-8427-6ca26ab63447,Fəzail Feyruz oğlu İbrahimli,Fəzail Feyruz oğlu İbrahimli,,,,Vətəndaş Həmrəyliyi Partiyası,Vətəndaş Həmrəyliyi Partiyası,69,Cəlilabad-Masallı-Biləsuvar seçim dairəsi,5,2015-12-01,,,,,
34c3f30a-cecd-4fd2-a6c8-1a503056d219,Fəzail Rəhim oğlu Ağamalı,Fəzail Rəhim oğlu Ağamalı,,,,Ana Vətən Partiyası,Ana Vətən Partiyası,60,Salyan-Neftçala seçim dairəsi,5,2015-12-01,,,,,
bf345684-7e16-4316-8dde-caadaaf1fccc,Gövhər Baxşəli qızı Baxşəliyeva,Gövhər Baxşəli qızı Baxşəliyeva,,,,Independent,83b82faf-9a1d-4bf8-bd05-5c7f10e6f679,93,Bərdə şəhər seçim dairəsi,5,2015-12-01,,,,Q327591,
1f83d797-ea22-433b-af83-98332eb72651,Hacı Hacıbaba oğlu Salayev,Hacı Hacıbaba oğlu Salayev,,,,Independent,83b82faf-9a1d-4bf8-bd05-5c7f10e6f679,44,Sumqayıt-Abşeron seçim dairəsi,5,2015-12-01,,,,Q327591,
43bf3fea-4ffd-4ca5-a393-ce014e013b9a,Hadı Musa oğlu Rəcəbli,Hadı Musa oğlu Rəcəbli,,,,Yeni Azərbaycan Partiyası,Yeni Azərbaycan Partiyası,74,Lənkəran qəsəbə seçim dairəsi,5,2015-12-01,,,,,
b986b2db-9741-472e-bb21-30bdcb3b786f,Hikmət Baba oğlu Məmmədov,Hikmət Baba oğlu Məmmədov,,,,Yeni Azərbaycan Partiyası,Yeni Azərbaycan Partiyası,19,Nərimanov I seçim dairəsi,5,2015-12-01,,,,,
ea754fd4-4831-462d-95ab-18a772983205,Hüseynbala Fazil oğlu Mirələmov,Hüseynbala Fazil oğlu Mirələmov,,,,Yeni Azərbaycan Partiyası,Yeni Azərbaycan Partiyası,33,Xətai I seçim dairəsi,5,2015-12-01,,,,,
d91d1d22-9a67-4a93-b660-02fdd56c2c16,Jalə Fazil qızı Əliyeva,Jalə Fazil qızı Əliyeva,,,,Independent,83b82faf-9a1d-4bf8-bd05-5c7f10e6f679,92,Zərdab-Ucar seçim dairəsi,5,2015-12-01,,,,Q327591,
9957e00b-b3b9-4713-88bd-d59959909b08,Kamaləddin Nəsrəddin oğlu Qafarov,Kamaləddin Nəsrəddin oğlu Qafarov,,,,Yeni Azərbaycan Partiyası,Yeni Azərbaycan Partiyası,9,Binəqədi II seçim dairəsi,5,2015-12-01,,,,,
dedfcf21-ad37-44f7-b769-943c08d0038d,Kamilə Əli Ağa qızı Əliyeva,Kamilə Əli Ağa qızı Əliyeva,,,,Yeni Azərbaycan Partiyası,Yeni Azərbaycan Partiyası,111,Zaqatala-Balakən seçim dairəsi,5,2015-12-01,,,,,
ef8a9833-503b-41a1-a357-a84bd0ec5c6f,Kamran Fərhad oğlu Bayramov,Kamran Fərhad oğlu Bayramov,,,,Yeni Azərbaycan Partiyası,Yeni Azərbaycan Partiyası,100,Şəmkir-Daşkəsən seçim dairəsi,5,2015-12-01,,,,,
322a6a08-ae26-446b-aabf-e5e5eb63c06a,Kamran Telman oğlu Nəbizadə,Kamran Telman oğlu Nəbizadə,,,,Independent,83b82faf-9a1d-4bf8-bd05-5c7f10e6f679,107,Qazax seçim dairəsi,5,2015-12-01,,,,Q327591,
c4b984c0-83b9-4fb5-8f21-15b77c58b211,Madər Ələsgər oğlu Musayev,Madər Ələsgər oğlu Musayev,,,,Independent,83b82faf-9a1d-4bf8-bd05-5c7f10e6f679,10,Binəqədi III seçim dairəsi,5,2015-12-01,,,,Q327591,
7243a534-e2d8-483e-908b-cabf594e9cb2,Mahir Məhəmmədəli oğlu Aslanov,Mahir Məhəmmədəli oğlu Aslanov,,,,Independent,83b82faf-9a1d-4bf8-bd05-5c7f10e6f679,96,Goranboy-Naftalan seçim dairəsi,5,2015-12-01,,,,Q327591,
4503820f-d71e-4113-a779-719f25f16275,Mahir Tapdıq oğlu Abbaszadə,Mahir Tapdıq oğlu Abbaszadə,,,,Yeni Azərbaycan Partiyası,Yeni Azərbaycan Partiyası,121,Laçın seçim dairəsi,5,2015-12-01,,,,,
10777142-84b6-46e1-83da-7dd88839aacc,Malik Əvəz oğlu Həsənov,Malik Əvəz oğlu Həsənov,,,,Yeni Azərbaycan Partiyası,Yeni Azərbaycan Partiyası,67,Cəlilabad şəhər seçim dairəsi,5,2015-12-01,,,,,
8250a47e-464a-4e06-afc9-9b4119861594,Mehriban Arif qızı Əliyeva,Mehriban Arif qızı Əliyeva,,,,Yeni Azərbaycan Partiyası,Yeni Azərbaycan Partiyası,14,Xəzər II seçim dairəsi,5,2015-12-01,,,,,
556ee4c4-ca39-48aa-8494-4162febe6179,Mirkazım Mirməhəmməd oğlu Kazımov,Mirkazım Mirməhəmməd oğlu Kazımov,,,,Yeni Azərbaycan Partiyası,Yeni Azərbaycan Partiyası,68,Cəlilabad qəsəbə seçim dairəsi,5,2015-12-01,,,,,
24e3a763-1301-4b5f-9e05-0cfa4eba900e,Mirzəcan Mirzəmməd oğlu Xəlilov,Mirzəcan Mirzəmməd oğlu Xəlilov,,,,Yeni Azərbaycan Partiyası,Yeni Azərbaycan Partiyası,41,Sumqayıt I seçim dairəsi,5,2015-12-01,,,,,
70988c9a-c2aa-42f0-b9da-25c9d640e472,Mixail Yuri oğlu Zabelin,Mixail Yuri oğlu Zabelin,,,,Yeni Azərbaycan Partiyası,Yeni Azərbaycan Partiyası,12,Qaradağ-Binəqədi-Yasamal seçim dairəsi,5,2015-12-01,,,,,
a81f7ce8-f778-4531-beaa-394364644930,Musa Cəfər oğlu Qasımlı,Musa Cəfər oğlu Qasımlı,,,,Independent,83b82faf-9a1d-4bf8-bd05-5c7f10e6f679,72,Yardımlı-Masallı seçim dairəsi,5,2015-12-01,,,,Q327591,
b846cf5f-dccb-40d1-abe3-c1f72dbd0bda,Musa İsa oğlu Quliyev (Urud),Musa İsa oğlu Quliyev (Urud),,,,Yeni Azərbaycan Partiyası,Yeni Azərbaycan Partiyası,40,Kəpəz II seçim dairəsi (Gəncə şəhəri),5,2015-12-01,,,,,
311c9f9c-a69f-4ea3-b27a-f6707da13209,Muxtar Bahadur oğlu Babayev,Muxtar Bahadur oğlu Babayev,,,,Yeni Azərbaycan Partiyası,Yeni Azərbaycan Partiyası,43,Sumqayıt III seçim dairəsi,5,2015-12-01,,,,,
5c51a2ad-d9e8-4744-bfaf-a379bb77137a,Müslüm Mürsəl oğlu Məmmədov,Müslüm Mürsəl oğlu Məmmədov,,,,Independent,83b82faf-9a1d-4bf8-bd05-5c7f10e6f679,57,Kürdəmir seçim dairəsi,5,2015-12-01,,,,Q327591,
71f012d1-9adc-454d-8da3-6042e67956e1,Məlahət İbrahim qızı Həsənova,Məlahət İbrahim qızı Həsənova,,,,Yeni Azərbaycan Partiyası,Yeni Azərbaycan Partiyası,21,Nəsimi I seçim dairəsi,5,2015-12-01,,,,,
a239627c-c8d9-4b46-a6c8-17aa9237c194,Naqif Ələşrəf oğlu Həmzəyev,Naqif Ələşrəf oğlu Həmzəyev,,,,Yeni Azərbaycan Partiyası,Yeni Azərbaycan Partiyası,38,Nizami II seçim dairəsi (Gəncə şəhəri),5,2015-12-01,,,,,
b3751176-5c73-46b6-a0ab-6fb21db78fcd,Nizami Qulu oğlu Cəfərov,Nizami Qulu oğlu Cəfərov,,,,Yeni Azərbaycan Partiyası,Yeni Azərbaycan Partiyası,108,Ağstafa seçim dairəsi,5,2015-12-01,,,,,
f2bf6e5f-ec74-4445-8f91-824d20199efa,Novruzəli Davud oğlu Aslanov,Novruzəli Davud oğlu Aslanov,,,,Independent,83b82faf-9a1d-4bf8-bd05-5c7f10e6f679,86,İsmayıllı seçim dairəsi,5,2015-12-01,,,,Q327591,
e94d0496-0477-4fde-a079-8f92b0140267,Nəriman Əlibala oğlu Əliyev,Nəriman Əlibala oğlu Əliyev,,,,Yeni Azərbaycan Partiyası,Yeni Azərbaycan Partiyası,70,Masallı şəhər seçim dairəsi,5,2015-12-01,,,,,
fc152dfa-bed7-4ed5-8699-519c75eccaa8,Nəsib Məhəmməd oğlu Məhəməliyev,Nəsib Məhəmməd oğlu Məhəməliyev,,,,Yeni Azərbaycan Partiyası,Yeni Azərbaycan Partiyası,109,Balakən seçim dairəsi,5,2015-12-01,,,,,
90e1ed0c-5096-49ca-bc41-b80fc60624f6,Oqtay Sabir oğlu Əsədov,Oqtay Sabir oğlu Əsədov,,,,Yeni Azərbaycan Partiyası,Yeni Azərbaycan Partiyası,45,Abşeron seçim dairəsi,5,2015-12-01,,,,,
748f9ba4-8b5f-4c43-abb9-4b6ef4d03c17,Pərvin Orxan qızı Kərimzadə,Pərvin Orxan qızı Kərimzadə,,,,Yeni Azərbaycan Partiyası,Yeni Azərbaycan Partiyası,37,Nizami I seçim dairəsi (Gəncə şəhəri),5,2015-12-01,,,,,
1a014bd6-bdb0-49b5-a45f-0017c644858c,Qüdrət Müzəffər oğlu Həsənquliyev,Qüdrət Müzəffər oğlu Həsənquliyev,,,,Bütöv Azərbaycan Xalq Cəbhəsi Partiyası,Bütöv Azərbaycan Xalq Cəbhəsi Partiyası,7,Ordubad-Culfa seçim dairəsi,5,2015-12-01,,,,,
64d0243e-e7a5-474e-bf2c-806555c14233,Qənirə Ələsgər qızı Paşayeva,Qənirə Ələsgər qızı Paşayeva,,,,Independent,83b82faf-9a1d-4bf8-bd05-5c7f10e6f679,105,Tovuz seçim dairəsi,5,2015-12-01,,,,Q327591,
ff389970-a6f2-4cf4-b7ee-92e059782769,Rafael Baba oğlu Hüseynov,Rafael Baba oğlu Hüseynov,,,,Independent,83b82faf-9a1d-4bf8-bd05-5c7f10e6f679,58,Hacıqabul-Kürdəmir seçim dairəsi,5,2015-12-01,,,,Q327591,
0eadf360-034d-48e7-8dff-ab3b0db982cf,Rafael Kamil oğlu Cəbrayılov,Rafael Kamil oğlu Cəbrayılov,,,,Independent,83b82faf-9a1d-4bf8-bd05-5c7f10e6f679,46,Şirvan seçim dairəsi,5,2015-12-01,,,,Q327591,
6338de12-9e3c-4779-b852-2eed3cf33d04,Rafiq Musa oğlu Məmmədhəsənov,Rafiq Musa oğlu Məmmədhəsənov,,,,Yeni Azərbaycan Partiyası,Yeni Azərbaycan Partiyası,104,Gədəbəy-Tovuz seçim dairəsi,5,2015-12-01,,,,,
90f575cd-3fbd-4813-8a1b-6fdac2841d13,Rasim Nəsrəddin oğlu Musabəyov,Rasim Nəsrəddin oğlu Musabəyov,,,,Independent,83b82faf-9a1d-4bf8-bd05-5c7f10e6f679,18,Nərimanov-Nizami seçim dairəsi,5,2015-12-01,,,,Q327591,
7b76bcd0-1458-42ce-979f-b167bbc3dce1,Rauf Asif oğlu Əliyev,Rauf Asif oğlu Əliyev,,,,Yeni Azərbaycan Partiyası,Yeni Azərbaycan Partiyası,13,Xəzər I seçim dairəsi,5,2015-12-01,,,,,
888b5148-b855-4bc2-b547-0c0255e49e92,Rövnəq İbrahim oğlu Abdullayev,Rövnəq İbrahim oğlu Abdullayev,,,,Yeni Azərbaycan Partiyası,Yeni Azərbaycan Partiyası,24,Nizami I seçim dairəsi,5,2015-12-01,,,,,
cd1aba69-aec0-4458-b1ec-d5344980cded,Rövşən Şükür oğlu Rzayev,Rövşən Şükür oğlu Rzayev,,,,Independent,83b82faf-9a1d-4bf8-bd05-5c7f10e6f679,101,Göygöl-Daşkəsən seçim dairəsi,5,2015-12-01,,,,Q327591,
38830225-7dfa-46a9-a88c-633960e7906d,Rüfət Atakişi oğlu Quliyev,Rüfət Atakişi oğlu Quliyev,,,,Independent,83b82faf-9a1d-4bf8-bd05-5c7f10e6f679,73,Lənkəran şəhər seçim dairəsi,5,2015-12-01,,,,Q327591,
c5ab2cc5-0c45-4011-9f41-6547751ae395,Rüstəm Gülabba oğlu Xəlilov,Rüstəm Gülabba oğlu Xəlilov,,,,Yeni Azərbaycan Partiyası,Yeni Azərbaycan Partiyası,64,Sabirabad II seçim dairəsi,5,2015-12-01,,,,,
a27074c3-de3e-47d1-87ec-a7c23da9b5a7,Rəşad Məmmədqulu oğlu Mahmudov,Rəşad Məmmədqulu oğlu Mahmudov,,,,Yeni Azərbaycan Partiyası,Yeni Azərbaycan Partiyası,77,Astara seçim dairəsi,5,2015-12-01,,,,,
12aad7f2-0717-4d76-91a2-ce8482973bbe,Sabir Kamal oğlu Hacıyev,Sabir Kamal oğlu Hacıyev,,,,Vətəndaş Birliyi Partiyası,Vətəndaş Birliyi Partiyası,88,Göyçay seçim dairəsi,5,2015-12-01,,,,,
d8fae023-73fc-4e60-84f1-25627cf3f9f1,Sahib Eyvaz oğlu Alıyev,Sahib Eyvaz oğlu Alıyev,,,,Independent,83b82faf-9a1d-4bf8-bd05-5c7f10e6f679,95,Tərtər seçim dairəsi,5,2015-12-01,,,,Q327591,
690e8ace-0498-46e1-b755-cc3eb819c0d0,Sahibə Əli qızı Qafarova,Sahibə Əli qızı Qafarova,,,,Yeni Azərbaycan Partiyası,Yeni Azərbaycan Partiyası,98,Şəmkir şəhər seçim dairəsi,5,2015-12-01,,,,,
e64148d0-9092-4504-bd38-8df5df578bdb,Sevinc Həbib qızı Fətəliyeva,Sevinc Həbib qızı Fətəliyeva,,,,Yeni Azərbaycan Partiyası,Yeni Azərbaycan Partiyası,30,Suraxanı I seçim dairəsi,5,2015-12-01,,,,,
3ece6da8-3e1e-4a01-b0b9-543fc11dbe7a,Sevinc Əmirəhməd qızı Hüseynova,Sevinc Əmirəhməd qızı Hüseynova,,,,Yeni Azərbaycan Partiyası,Yeni Azərbaycan Partiyası,103,Gədəbəy seçim dairəsi,5,2015-12-01,,,,,
d226a051-aa26-4671-92a1-67f501a15699,Siyavuş Dünyamalı oğlu Novruzov,Siyavuş Dünyamalı oğlu Novruzov,,,,Yeni Azərbaycan Partiyası,Yeni Azərbaycan Partiyası,5,Şahbuz-Babək seçim dairəsi,5,2015-12-01,,,,,
1d07a2ef-1360-4baa-b8cc-ef82ab955e19,Sona Sakit qızı Əliyeva,Sona Sakit qızı Əliyeva,,,,Yeni Azərbaycan Partiyası,Yeni Azərbaycan Partiyası,99,Şəmkir qəsəbə seçim dairəsi,5,2015-12-01,,,,,
2d8a35a3-17e8-4413-8015-9224cf6bac10,Sədaqət Süleyman qızı Vəliyeva,Sədaqət Süleyman qızı Vəliyeva,,,,Yeni Azərbaycan Partiyası,Yeni Azərbaycan Partiyası,25,Nizami II seçim dairəsi,5,2015-12-01,,,,,
c0eeb5d9-af61-4992-9ef8-8cb1e3e87e7d,Səməd İsmayıl oğlu Seyidov,Səməd İsmayıl oğlu Seyidov,,,,Yeni Azərbaycan Partiyası,Yeni Azərbaycan Partiyası,36,Xətai IV seçim dairəsi,5,2015-12-01,,,,,
6817dc7a-0ec0-4591-859b-ec8b099ed7a2,Səttar Suliddin oğlu Mehbalıyev,Səttar Suliddin oğlu Mehbalıyev,,,,Independent,83b82faf-9a1d-4bf8-bd05-5c7f10e6f679,3,Babək-Kəngərli-Naxçıvan seçim dairəsi,5,2015-12-01,,,,Q327591,
bc393035-8397-4c3c-903f-d27d4c562edf,Tahir Famil oğlu oğlu Mirkişili,Tahir Famil oğlu oğlu Mirkişili,,,,Yeni Azərbaycan Partiyası,Yeni Azərbaycan Partiyası,42,Sumqayıt II seçim dairəsi,5,2015-12-01,,,,,
35b17fd6-dbf9-44a4-ad7d-b659699d0c11,Tahir Musa oğlu Rzayev,Tahir Musa oğlu Rzayev,,,,Yeni Azərbaycan Partiyası,Yeni Azərbaycan Partiyası,82,Ağcabədi seçim dairəsi,5,2015-12-01,,,,,
607bf64b-e93c-43c9-8fc3-144323b4e3aa,Tahir Süleyman oğlu Süleymanov,Tahir Süleyman oğlu Süleymanov,,,,Yeni Azərbaycan Partiyası,Yeni Azərbaycan Partiyası,54,Şabran-Siyəzən seçim dairəsi,5,2015-12-01,,,,,
151053f3-4e49-43c4-ae5e-b117c87a689e,Tahir Zayıdağa oğlu Kərimli,Tahir Zayıdağa oğlu Kərimli,,,,Vəhdət Partiyası,Vəhdət Partiyası,87,Ağsu-İsmayıllı seçim dairəsi,5,2015-12-01,,,,,
c0d2d06c-50ed-485e-a893-0c88fad30c70,Vahid Qazməmməd oğlu Əhmədov,Vahid Qazməmməd oğlu Əhmədov,,,,Independent,83b82faf-9a1d-4bf8-bd05-5c7f10e6f679,52,Quba seçim dairəsi,5,2015-12-01,,,,Q327591,
f2e16989-0465-48ee-b803-4fda48994c75,Valeh Feyruz oğlu Ələsgərov,Valeh Feyruz oğlu Ələsgərov,,,,Independent,83b82faf-9a1d-4bf8-bd05-5c7f10e6f679,102,Samux-Şəmkir seçim dairəsi,5,2015-12-01,,,,Q327591,
dfa81103-ec4a-4872-bc66-8f6860de35ab,Vasif Yusif oğlu Talıbov,Vasif Yusif oğlu Talıbov,,,,Yeni Azərbaycan Partiyası,Yeni Azərbaycan Partiyası,1,Şərur-Sədərək seçim dairəsi,5,2015-12-01,,,,,
a6bdaff6-130e-431f-88d2-73e3ec8ca20b,Vüsal Əfqan oğlu Hüseynov,Vüsal Əfqan oğlu Hüseynov,,,,Yeni Azərbaycan Partiyası,Yeni Azərbaycan Partiyası,91,Ucar seçim dairəsi,5,2015-12-01,,,,,
a47b4a1e-f200-46c0-9afb-75944390e30b,Xanhüseyn Hüseynağa oğlu Kazımlı,Xanhüseyn Hüseynağa oğlu Kazımlı,,,,Azərbaycan Sosial Rifah Partiyası,Azərbaycan Sosial Rifah Partiyası,66,Biləsuvar seçim dairəsi,5,2015-12-01,,,,,
ae58807a-e252-4690-8863-3b2eddf0e8fa,Xanlar Nuru oğlu Fətiyev,Xanlar Nuru oğlu Fətiyev,,,,Yeni Azərbaycan Partiyası,Yeni Azərbaycan Partiyası,39,Kəpəz I seçim dairəsi (Gəncə şəhəri),5,2015-12-01,,,,,
11ca5303-f82d-450e-acf9-a48b5260f231,Yaqub Mikayıl oğlu Mahmudov,Yaqub Mikayıl oğlu Mahmudov,,,,Yeni Azərbaycan Partiyası,Yeni Azərbaycan Partiyası,113,Şəki şəhər seçim dairəsi,5,2015-12-01,,,,,
1cc39803-15b7-4335-bd1d-188d30dd4ca0,Yevda Sasun oğlu Abramov,Yevda Sasun oğlu Abramov,,,,Yeni Azərbaycan Partiyası,Yeni Azərbaycan Partiyası,53,Quba-Qusar seçim dairəsi,5,2015-12-01,,,,,
f77ec503-c25e-46e0-8c18-659ddf39bf1b,Zahid Məhərrəm oğlu Oruc,Zahid Məhərrəm oğlu Oruc,,,,Independent,83b82faf-9a1d-4bf8-bd05-5c7f10e6f679,94,Bərdə qəsəbə seçim dairəsi,5,2015-12-01,,,,Q327591,
28040c70-3232-4497-a33d-e81c080a43bc,Zeynəb Yəhya qızı Xanlarova,Zeynəb Yəhya qızı Xanlarova,,,,Independent,83b82faf-9a1d-4bf8-bd05-5c7f10e6f679,50,Qobustan-Xızı-Sumqayıt seçim dairəsi,5,2015-12-01,,,,Q327591,
b636c50d-96ff-4532-81e1-bf98f87bdc12,Ziyad Əliabbas oğlu Səmədzadə,Ziyad Əliabbas oğlu Səmədzadə,,,,Independent,83b82faf-9a1d-4bf8-bd05-5c7f10e6f679,23,Nəsimi-Səbail seçim dairəsi,5,2015-12-01,,,,Q327591,
06d0d745-e1e2-4655-aad4-71870f6e9778,Ziyafət Abbas oğlu Əsgərov,Ziyafət Abbas oğlu Əsgərov,,,,Yeni Azərbaycan Partiyası,Yeni Azərbaycan Partiyası,76,Lənkəran-Astara seçim dairəsi,5,2015-12-01,,,,,
2e7b959b-73d4-4b94-a522-fcd92ba42614,Çingiz Aşralı oğlu Qənizadə,Çingiz Aşralı oğlu Qənizadə,,,,Independent,83b82faf-9a1d-4bf8-bd05-5c7f10e6f679,80,İmişli-Beyləqan seçim dairəsi,5,2015-12-01,,,,Q327591,
799f7bd8-3cb5-483e-8526-c76d181db920,Ülvi Zahid oğlu Quliyev,Ülvi Zahid oğlu Quliyev,,,,Independent,83b82faf-9a1d-4bf8-bd05-5c7f10e6f679,15,Yasamal I seçim dairəsi,5,2015-12-01,,,,Q327591,
eb96b96f-e556-4c02-a172-83c289fdf37b,Ülviyyə Cavanşir qızı Ağayeva,Ülviyyə Cavanşir qızı Ağayeva,,,,Independent,83b82faf-9a1d-4bf8-bd05-5c7f10e6f679,106,Tovuz-Qazax-Ağstafa seçim dairəsi,5,2015-12-01,,,,Q327591,
b4830fea-e913-43b1-9f07-930d20afb159,Ülviyyə Tapdıq qızı Həmzəyeva,Ülviyyə Tapdıq qızı Həmzəyeva,,,,Yeni Azərbaycan Partiyası,Yeni Azərbaycan Partiyası,6,Culfa-Babək seçim dairəsi,5,2015-12-01,,,,,
4e97d84f-6206-4576-a37f-08b7da7d9cdd,İlham Kazım oğlu Məmmədov,İlham Kazım oğlu Məmmədov,,,,Yeni Azərbaycan Partiyası,Yeni Azərbaycan Partiyası,48,Yevlax seçim dairəsi,5,2015-12-01,,,,,
9cb30336-9335-4e15-9dc2-1b00008605ef,İlham Əlisəftər oğlu Əliyev,İlham Əlisəftər oğlu Əliyev,,,,Yeni Azərbaycan Partiyası,Yeni Azərbaycan Partiyası,56,Xaçmaz qəsəbə seçim dairəsi,5,2015-12-01,,,,,
4c98c693-d2f1-40d9-b6a8-1131bd5b7837,İmamverdi İbiş oğlu İsmayılov,İmamverdi İbiş oğlu İsmayılov,,,,Yeni Azərbaycan Partiyası,Yeni Azərbaycan Partiyası,125,Zəngilan-Qubadlı seçim dairəsi,5,2015-12-01,,,,,
1fab801f-005b-4811-a395-179971ebcbb6,İqbal Nəriman oğlu Məmmədov,İqbal Nəriman oğlu Məmmədov,,,,Yeni Azərbaycan Partiyası,Yeni Azərbaycan Partiyası,78,Lerik seçim dairəsi,5,2015-12-01,,,,,
7250716c-7bac-4aa1-934f-3dba32fc5ce3,İsa Əkbər oğlu Həbibbəyli,İsa Əkbər oğlu Həbibbəyli,,,,Yeni Azərbaycan Partiyası,Yeni Azərbaycan Partiyası,2,Şərur seçim dairəsi,5,2015-12-01,,,,,
45c24f3d-df6c-42ec-a307-ea0ba2100ec9,Şahin Əmir oğlu İsmayılov,Şahin Əmir oğlu İsmayılov,,,,Yeni Azərbaycan Partiyası,Yeni Azərbaycan Partiyası,81,Beyləqan seçim dairəsi,5,2015-12-01,,,,,
31f8b439-bb4e-43f4-b881-fce0b4bcf087,Şəmsəddin Hümmət oğlu Hacıyev,Şəmsəddin Hümmət oğlu Hacıyev,,,,Yeni Azərbaycan Partiyası,Yeni Azərbaycan Partiyası,29,Səbail seçim dairəsi,5,2015-12-01,,,,,
29b83028-c988-4352-875d-b2d722ff5ed5,Əflatun Əhməd oğlu Amaşov,Əflatun Əhməd oğlu Amaşov,,,,Independent,83b82faf-9a1d-4bf8-bd05-5c7f10e6f679,62,Saatlı seçim dairəsi,5,2015-12-01,,,,Q327591,
2b8ffb76-2e59-4b45-9193-5adb5305245c,Əhliman Tapdıq oğlu Əmiraslanov,Əhliman Tapdıq oğlu Əmiraslanov,,,,Yeni Azərbaycan Partiyası,Yeni Azərbaycan Partiyası,65,Saatlı-Sabirabad-Kürdəmir seçim dairəsi,5,2015-12-01,,,,,
