id,fullname,birth_date,death_date,img,mandates,source,name,party,area,term
201559,Wadih Nemer Damous Filho,,,http://www.camara.gov.br/internet/deputado/bandep/189593.jpg,"Deputado Federal, 2015-2019, RJ, PT. Dt. Posse: 19/05/2015.",http://www2.camara.gov.br/deputados/pesquisa/layouts_deputados_biografia?pk=201559&tipo=0,WADIH DAMOUS,PT,RJ,55
201562,Fabricio José Satiro de Oliveira,,,http://www.camara.gov.br/internet/deputado/bandep/190149.jpg,"Deputado Federal, 2015-2019, SC, PSB. Dt. Posse: 08/07/2015.",http://www2.camara.gov.br/deputados/pesquisa/layouts_deputados_biografia?pk=201562&tipo=0,FABRICIO OLIVEIRA,PSB,SC,55
201581,Rosangela Aparecida da Silva Barros,,,http://www.camara.gov.br/internet/deputado/bandep/191684.jpg,"Deputada Federal, 2015-2019, MA, PDT. Dt. Posse: 09/09/2015.",http://www2.camara.gov.br/deputados/pesquisa/layouts_deputados_biografia?pk=201581&tipo=0,ROSÂNGELA CURADO,PDT,MA,55
201603,Flávio Rodrigues Nogueira,,,http://www.camara.gov.br/internet/deputado/bandep/191923.jpg,"Deputado Federal, 2015-2019, PI, PDT. Dt. Posse: 06/10/2015.",http://www2.camara.gov.br/deputados/pesquisa/layouts_deputados_biografia?pk=201603&tipo=0,FLAVIO NOGUEIRA,PDT,PI,55
201604,José Augusto Nalin,,,http://www.camara.gov.br/internet/deputado/bandep/191945.jpg,"Deputado Federal, 2015-2019, RJ, PMDB. Dt. Posse: 08/10/2015.",http://www2.camara.gov.br/deputados/pesquisa/layouts_deputados_biografia?pk=201604&tipo=0,ZÉ AUGUSTO NALIN,PMDB,RJ,55
201605,Angela Albino,,,http://www.camara.gov.br/internet/deputado/bandep/192120.jpg,"Deputada Federal, 2015-2019, SC, PCdoB. Dt. Posse: 28/10/2015.",http://www2.camara.gov.br/deputados/pesquisa/layouts_deputados_biografia?pk=201605&tipo=0,ANGELA ALBINO,PCdoB,SC,55
201684,Wilson Silva Beserra,,,http://www.camara.gov.br/internet/deputado/bandep/193066.jpg,"Deputado Federal, 2015-2019, RJ, PMDB. Dt. Posse: 15/12/2015.",http://www2.camara.gov.br/deputados/pesquisa/layouts_deputados_biografia?pk=201684&tipo=0,WILSON BESERRA,PMDB,RJ,55
201685,Nelson Nahim Matheus de Oliveira,,,http://www.camara.gov.br/internet/deputado/bandep/193069.jpg,"Deputado Federal, 2015-2019, RJ, PSD. Dt. Posse: 15/12/2015.",http://www2.camara.gov.br/deputados/pesquisa/layouts_deputados_biografia?pk=201685&tipo=0,NELSON NAHIM,PSD,RJ,55
201701,Atila Alexandre Nunes Pereira,,,http://www.camara.gov.br/internet/deputado/bandep/193165.jpg,"Deputado Federal, 2015-2019, RJ, PSL. Dt. Posse: 06/01/2016.",http://www2.camara.gov.br/deputados/pesquisa/layouts_deputados_biografia?pk=201701&tipo=0,ÁTILA A. NUNES,PMDB,RJ,55
201730,Paulo Eduardo Lima Martins,,,http://www.camara.gov.br/internet/deputado/bandep/193726.jpg,"Deputado Federal, 2015-2019, PR, PSC. Dt. Posse: 17/03/2016.",http://www2.camara.gov.br/deputados/pesquisa/layouts_deputados_biografia?pk=201730&tipo=0,PAULO MARTINS,PSDB,PR,55
201747,Luciano Fred Braga Penha,,,http://www.camara.gov.br/internet/deputado/bandep/193982.jpg,"Deputado Federal, 2015-2019, BA, DEM. Dt. Posse: 18/04/2016.",http://www2.camara.gov.br/deputados/pesquisa/layouts_deputados_biografia?pk=201747&tipo=0,PASTOR LUCIANO BRAGA,PMB,BA,55
201766,Guilherme Cruz de Souza Coelho,,,http://www.camara.gov.br/internet/deputado/bandep/194259.jpg,"Deputado Federal, 2015-2019, PE, PSDB. Dt. Posse: 17/05/2016.",http://www2.camara.gov.br/deputados/pesquisa/layouts_deputados_biografia?pk=201766&tipo=0,GUILHERME COELHO,PSDB,PE,55
201767,Cleuza Pereira do Nascimento,,,http://www.camara.gov.br/internet/deputado/bandep/194258.jpg,"Deputada Federal, 2015-2019, PE, PSB. Dt. Posse: 17/05/2016.",http://www2.camara.gov.br/deputados/pesquisa/layouts_deputados_biografia?pk=201767&tipo=0,CREUZA PEREIRA,PSB,PE,55
201772,Cajar Onesimo Ribeiro Nardes,,,http://www.camara.gov.br/internet/deputado/bandep/194261.jpg,"Deputado Federal, 2015-2019, RS, PR. Dt. Posse: 17/05/2016.",http://www2.camara.gov.br/deputados/pesquisa/layouts_deputados_biografia?pk=201772&tipo=0,CAJAR NARDES,PR,RS,55
201773,Jones Alexandre Martins,,,http://www.camara.gov.br/internet/deputado/bandep/194262.jpg,"Deputado Federal, 2015-2019, RS, PMDB. Dt. Posse: 17/05/2016.",http://www2.camara.gov.br/deputados/pesquisa/layouts_deputados_biografia?pk=201773&tipo=0,JONES MARTINS,PMDB,RS,55
201778,Nivaldo Ferreira de Albuquerque Neto,,,http://www.camara.gov.br/internet/deputado/bandep/194260.jpg,"Deputado Federal, 2015-2019, AL, PRP. Dt. Posse: 17/05/2016.",http://www2.camara.gov.br/deputados/pesquisa/layouts_deputados_biografia?pk=201778&tipo=0,NIVALDO ALBUQUERQUE,PRP,AL,55
201800,Audival Amélio da Silva Neto,,,http://www.camara.gov.br/internet/deputado/bandep/194340.jpg,"Deputado Federal, 2015-2019, AL, PRTB. Dt. Posse: 25/05/2016.",http://www2.camara.gov.br/deputados/pesquisa/layouts_deputados_biografia?pk=201800&tipo=0,VAL AMÉLIO,PRTB,AL,55
201840,Ildon Marques de Souza,,,http://www.camara.gov.br/internet/deputado/bandep/194592.jpg,"Deputado Federal, 2015-2019, MA, PMN. Dt. Posse: 21/06/2016.",http://www2.camara.gov.br/deputados/pesquisa/layouts_deputados_biografia?pk=201840&tipo=0,ILDON MARQUES,PSB,MA,55
201869,André Augusto Castro do Amaral Filho,,,http://www.camara.gov.br/internet/deputado/bandep/195143.jpg,"Deputado Federal, 2015-2019, PB, PMDB. Dt. Posse: 02/08/2016.",http://www2.camara.gov.br/deputados/pesquisa/layouts_deputados_biografia?pk=201869&tipo=0,ANDRÉ AMARAL,PMDB,PB,55
201902,Moisés Diniz Lima,,,http://www.camara.gov.br/internet/deputado/bandep/195278.jpg,"Deputada Federal, 2015-2019, AC, PCdoB. Dt. Posse: 18/08/2016.",http://www2.camara.gov.br/deputados/pesquisa/layouts_deputados_biografia?pk=201902&tipo=0,MOISÉS DINIZ,PCdoB,AC,55
201949,Ricardo Antonio Buainain Dias,,,http://www.camara.gov.br/internet/deputado/bandep/0.jpg,"Deputado Federal (Constituinte) (Congresso Revisor), 2016-2019, SP, PRB. Dt. Posse: 04/10/2016.",http://www2.camara.gov.br/deputados/pesquisa/layouts_deputados_biografia?pk=201949&tipo=0,RICARDO BENTINHO,PRB,SP,55
202005,Pollyana Fatima Gama Santos,,,http://www.camara.gov.br/internet/deputado/bandep/0.jpg,"Deputada Federal, 2015-2019, SP, PPS. Dt. Posse: 23/11/2016.",http://www2.camara.gov.br/deputados/pesquisa/layouts_deputados_biografia?pk=202005&tipo=0,POLLYANA GAMA,PPS,SP,55
202036,Luana Maria da Silva Costa,,,http://www.camara.gov.br/internet/deputado/bandep/81366.jpg,"Deputada Federal, 2015-2019, MA, PSB. Dt. Posse: 19/12/2016.",http://www2.camara.gov.br/deputados/pesquisa/layouts_deputados_biografia?pk=202036&tipo=0,LUANA COSTA,PSB,MA,55
202039,Raimundo Sabino Castelo Branco Maués,,,http://www.camara.gov.br/internet/deputado/bandep/0.jpg,"Deputado Federal, 2015-2019, AM, . Dt. Posse: 22/12/2016.",http://www2.camara.gov.br/deputados/pesquisa/layouts_deputados_biografia?pk=202039&tipo=0,SABINO CASTELO BRANCO,PTB,AM,55
202042,Dejorge Patricio da Silva,,,http://www.camara.gov.br/internet/deputado/bandep/196357.jpg,"Deputado Federal, 2015-2019, RJ, PR. Dt. Posse: 02/01/2017.",http://www2.camara.gov.br/deputados/pesquisa/layouts_deputados_biografia?pk=202042&tipo=0,DEJORGE PATRÍCIO,PR,RJ,55
202046,Lourival Gomes de Almeida,,,http://www.camara.gov.br/internet/deputado/bandep/196358.jpg,"Deputado Federal, 2015-2019, RJ, PSDC. Dt. Posse: 02/01/2017.",http://www2.camara.gov.br/deputados/pesquisa/layouts_deputados_biografia?pk=202046&tipo=0,LOURIVAL GOMES,PTN,RJ,55
202053,Francisco Vaidon Oliveira,,,http://www.camara.gov.br/internet/deputado/bandep/195866.jpg,"Deputado Federal, 2015-2019, CE, PSDC. Dt. Posse: 02/01/2017.",http://www2.camara.gov.br/deputados/pesquisa/layouts_deputados_biografia?pk=202053&tipo=0,VAIDON OLIVEIRA,PSDC,CE,55
202056,Marcelo Jandre Delaroli,,,http://www.camara.gov.br/internet/deputado/bandep/195826.jpg,"Deputado Federal, 2015-2019, RJ, PR. Dt. Posse: 02/01/2017.",http://www2.camara.gov.br/deputados/pesquisa/layouts_deputados_biografia?pk=202056&tipo=0,MARCELO DELAROLI,PR,RJ,55
202057,Norma Ayub Alves,,,http://www.camara.gov.br/internet/deputado/bandep/66179.jpg,"Deputada Federal, 2015-2019, ES, DEM. Dt. Posse: 02/01/2017.",http://www2.camara.gov.br/deputados/pesquisa/layouts_deputados_biografia?pk=202057&tipo=0,NORMA AYUB,DEM,ES,55
202060,Adérmis Marini Junior,,,http://www.camara.gov.br/internet/deputado/bandep/196359.jpg,"Deputado Federal, 2015-2019, SP, PSDB. Dt. Posse: 02/01/2017.",http://www2.camara.gov.br/deputados/pesquisa/layouts_deputados_biografia?pk=202060&tipo=0,ADÉRMIS MARINI,PSDB,SP,55
202063,Izaque Jose da Silva,,,http://www.camara.gov.br/internet/deputado/bandep/196378.jpg,"Deputado Federal, 2015-2019, SP, PSDB. Dt. Posse: 05/01/2017.",http://www2.camara.gov.br/deputados/pesquisa/layouts_deputados_biografia?pk=202063&tipo=0,IZAQUE SILVA,PSDB,SP,55
96819,José Aldo Rebelo Figueiredo,,,http://www.camara.gov.br/internet/deputado/bandep/73428.jpg,"Deputado Federal (Congresso Revisor), 1991-1995, SP, PCdoB. Dt. Posse: 01/02/1991; Deputado Federal, 1995-1999, SP, PCdoB. Dt. Posse: 01/02/1995; Deputado Federal, 1999-2003, SP, PCdoB. Dt. Posse: 01/02/1999; Deputado Federal, 2003-2007, SP, PCdoB. Dt. Posse: 01/02/2003; Deputado Federal, 2007-2011, SP, PCdoB. Dt. Posse: 01/02/2007; Deputado Federal, 2011-2015, SP, PCdoB. Dt. Posse: 01/02/2011.",http://www2.camara.gov.br/deputados/pesquisa/layouts_deputados_biografia?pk=96819&tipo=0,ALDO REBELO,PCdoB,SP,54
96839,Jair Messias Bolsonaro,,,http://www.camara.gov.br/internet/deputado/bandep/74847.jpg,"Deputado Federal (Congresso Revisor), 1991-1995, RJ, PDC. Dt. Posse: 01/02/1991; Deputado Federal, 1995-1999, RJ, PPR. Dt. Posse: 01/02/1995; Deputado Federal, 1999-2003, RJ, PPB. Dt. Posse: 01/02/1999; Deputado Federal, 2003-2007, RJ, PPB. Dt. Posse: 01/02/2003; Deputado Federal, 2007-2011, RJ, PP. Dt. Posse: 01/02/2007; Deputado Federal, 2011-2015, RJ, PP. Dt. Posse: 01/02/2011; Deputado Federal, 2015-2019, RJ, PP. Dt. Posse: 01/02/2015.",http://www2.camara.gov.br/deputados/pesquisa/layouts_deputados_biografia?pk=96839&tipo=0,JAIR BOLSONARO,PSC,RJ,55
96839,Jair Messias Bolsonaro,,,http://www.camara.gov.br/internet/deputado/bandep/74847.jpg,"Deputado Federal (Congresso Revisor), 1991-1995, RJ, PDC. Dt. Posse: 01/02/1991; Deputado Federal, 1995-1999, RJ, PPR. Dt. Posse: 01/02/1995; Deputado Federal, 1999-2003, RJ, PPB. Dt. Posse: 01/02/1999; Deputado Federal, 2003-2007, RJ, PPB. Dt. Posse: 01/02/2003; Deputado Federal, 2007-2011, RJ, PP. Dt. Posse: 01/02/2007; Deputado Federal, 2011-2015, RJ, PP. Dt. Posse: 01/02/2011; Deputado Federal, 2015-2019, RJ, PP. Dt. Posse: 01/02/2015.",http://www2.camara.gov.br/deputados/pesquisa/layouts_deputados_biografia?pk=96839&tipo=0,JAIR BOLSONARO,PP,RJ,54
96859,Aníbal Ferreira Gomes,,,http://www.camara.gov.br/internet/deputado/bandep/74212.jpg,"Deputado Federal, 1995-1999, CE, PMDB. Dt. Posse: 01/02/1995; Deputado Federal, 1999-2003, CE, PSDB. Dt. Posse: 01/02/1999; Deputado Federal, 2003-2007, CE, PMDB. Dt. Posse: 01/02/2003; Deputado Federal, 2007-2011, CE, PMDB. Dt. Posse: 01/02/2007; Deputado Federal, 2011-2015, CE, PMDB. Dt. Posse: 01/02/2011; Deputado Federal, 2015-2019, CE, PMDB. Dt. Posse: 01/02/2015.",http://www2.camara.gov.br/deputados/pesquisa/layouts_deputados_biografia?pk=96859&tipo=0,ANÍBAL GOMES,PMDB,CE,55
96859,Aníbal Ferreira Gomes,,,http://www.camara.gov.br/internet/deputado/bandep/74212.jpg,"Deputado Federal, 1995-1999, CE, PMDB. Dt. Posse: 01/02/1995; Deputado Federal, 1999-2003, CE, PSDB. Dt. Posse: 01/02/1999; Deputado Federal, 2003-2007, CE, PMDB. Dt. Posse: 01/02/2003; Deputado Federal, 2007-2011, CE, PMDB. Dt. Posse: 01/02/2007; Deputado Federal, 2011-2015, CE, PMDB. Dt. Posse: 01/02/2011; Deputado Federal, 2015-2019, CE, PMDB. Dt. Posse: 01/02/2015.",http://www2.camara.gov.br/deputados/pesquisa/layouts_deputados_biografia?pk=96859&tipo=0,ANÍBAL GOMES,PMDB,CE,54
96943,Aracely de Paula,,,http://www.camara.gov.br/internet/deputado/bandep/74648.jpg,"Deputado Federal (Congresso Revisor), 1991-1995, MG, PFL. Dt. Posse: 01/02/1991; Deputado Federal, 1995-1999, MG, PFL. Dt. Posse: 01/02/1995; Deputado Federal, 1999-2003, MG, PFL. Dt. Posse: 01/02/1999; Deputado Federal, 2003-2007, MG, PFL. Dt. Posse: 01/02/2003; Deputado Federal, 2007-2011, MG, PL. Dt. Posse: 01/02/2007; Deputado Federal, 2011-2015, MG, PR. Dt. Posse: 01/02/2011.",http://www2.camara.gov.br/deputados/pesquisa/layouts_deputados_biografia?pk=96943&tipo=0,ARACELY DE PAULA,PR,MG,54
96950,Arlindo Chignalia Junior,,,http://www.camara.gov.br/internet/deputado/bandep/73433.jpg,"Deputado Federal, 1995-1999, SP, PT. Dt. Posse: 01/02/1995; Deputado Federal, 1999-2003, SP, PT. Dt. Posse: 01/02/1999; Deputado Federal, 2003-2007, SP, PT. Dt. Posse: 01/02/2003; Deputado Federal, 2007-2011, SP, PT. Dt. Posse: 01/02/2007; Deputado Federal, 2011-2015, SP, PT. Dt. Posse: 01/02/2011; Deputado Federal, 2015-2019, SP, PT. Dt. Posse: 01/02/2015.",http://www2.camara.gov.br/deputados/pesquisa/layouts_deputados_biografia?pk=96950&tipo=0,ARLINDO CHINAGLIA,PT,SP,55
96950,Arlindo Chignalia Junior,,,http://www.camara.gov.br/internet/deputado/bandep/73433.jpg,"Deputado Federal, 1995-1999, SP, PT. Dt. Posse: 01/02/1995; Deputado Federal, 1999-2003, SP, PT. Dt. Posse: 01/02/1999; Deputado Federal, 2003-2007, SP, PT. Dt. Posse: 01/02/2003; Deputado Federal, 2007-2011, SP, PT. Dt. Posse: 01/02/2007; Deputado Federal, 2011-2015, SP, PT. Dt. Posse: 01/02/2011; Deputado Federal, 2015-2019, SP, PT. Dt. Posse: 01/02/2015.",http://www2.camara.gov.br/deputados/pesquisa/layouts_deputados_biografia?pk=96950&tipo=0,ARLINDO CHINAGLIA,PT,SP,54
96957,Armando Abilio Vieira,,,http://www.camara.gov.br/internet/deputado/bandep/74405.jpg,"Deputado Federal, 1995-1999, PB, PMDB. Dt. Posse: 01/02/1995; Deputado Federal, 1999-2003, PB, PMDB. Dt. Posse: 01/02/1999; Deputado Federal, 2003-2007, PB, PSDB. Dt. Posse: 01/02/2003; Deputado Federal, 2007-2011, PB, PSDB. Dt. Posse: 01/02/2007; Deputado Federal, 2011-2015, PB, PTB. Dt. Posse: 07/02/2012.",http://www2.camara.gov.br/deputados/pesquisa/layouts_deputados_biografia?pk=96957&tipo=0,ARMANDO ABÍLIO,PTB,PB,54
96966,Arnaldo Faria de Sá,,,http://www.camara.gov.br/internet/deputado/bandep/73434.jpg,"Deputado Federal (Constituinte), 1987-1991, SP, PTB. Dt. Posse: 01/02/1987; Deputado Federal (Congresso Revisor), 1991-1995, SP, PRN. Dt. Posse: 01/02/1991; Deputado Federal, 1995-1999, SP, PPR. Dt. Posse: 01/02/1995; Deputado Federal, 1999-2003, SP, PPB. Dt. Posse: 01/02/1999; Deputado Federal, 2003-2007, SP, PTB. Dt. Posse: 01/02/2003; Deputado Federal, 2007-2011, SP, PTB. Dt. Posse: 01/02/2007; Deputado Federal, 2011-2015, SP, PTB. Dt. Posse: 01/02/2011; Deputado Federal, 2015-2019, SP, PTB. Dt. Posse: 01/02/2015.",http://www2.camara.gov.br/deputados/pesquisa/layouts_deputados_biografia?pk=96966&tipo=0,ARNALDO FARIA DE SÁ,PTB,SP,55
96966,Arnaldo Faria de Sá,,,http://www.camara.gov.br/internet/deputado/bandep/73434.jpg,"Deputado Federal (Constituinte), 1987-1991, SP, PTB. Dt. Posse: 01/02/1987; Deputado Federal (Congresso Revisor), 1991-1995, SP, PRN. Dt. Posse: 01/02/1991; Deputado Federal, 1995-1999, SP, PPR. Dt. Posse: 01/02/1995; Deputado Federal, 1999-2003, SP, PPB. Dt. Posse: 01/02/1999; Deputado Federal, 2003-2007, SP, PTB. Dt. Posse: 01/02/2003; Deputado Federal, 2007-2011, SP, PTB. Dt. Posse: 01/02/2007; Deputado Federal, 2011-2015, SP, PTB. Dt. Posse: 01/02/2011; Deputado Federal, 2015-2019, SP, PTB. Dt. Posse: 01/02/2015.",http://www2.camara.gov.br/deputados/pesquisa/layouts_deputados_biografia?pk=96966&tipo=0,ARNALDO FARIA DE SÁ,PTB,SP,54
96992,Fernando Lopes de Almeida,,,http://www.camara.gov.br/internet/deputado/bandep/74843.jpg,"Deputado Federal (Congresso Revisor), 1991-1995, RJ, PDT. Dt. Posse: 01/02/1991; Deputado Federal, 1995-1999, RJ, PDT. Dt. Posse: 01/02/1995; Deputado Federal, 1999, RJ, PDT. Dt. Posse: 03/02/1999; Deputado Federal, 2003-2007, RJ, PSB. Dt. Posse: 01/02/2003; Deputado Federal, 2007-2011, RJ, PMDB. Dt. Posse: 01/02/2007; Deputado Federal, 2011-2015, RJ, PMDB. Dt. Posse: 03/01/2013.",http://www2.camara.gov.br/deputados/pesquisa/layouts_deputados_biografia?pk=96992&tipo=0,FERNANDO LOPES,PMDB,RJ,54
96997,Átila Sidney Lins Albuquerque,,,http://www.camara.gov.br/internet/deputado/bandep/74090.jpg,"Deputado Federal (Congresso Revisor), 1991-1995, AM, PFL. Dt. Posse: 01/02/1991; Deputado Federal, 1995-1999, AM, PFL. Dt. Posse: 01/02/1995; Deputado Federal, 1999-2003, AM, PFL. Dt. Posse: 01/02/1999; Deputado Federal, 2003-2007, AM, PFL. Dt. Posse: 01/02/2003; Deputado Federal, 2007-2011, AM, PMDB. Dt. Posse: 01/02/2007; Deputado Federal, 2011-2015, AM, PMDB. Dt. Posse: 01/02/2011; Deputado Federal, 2015-2019, AM, PSD. Dt. Posse: 01/02/2015.",http://www2.camara.gov.br/deputados/pesquisa/layouts_deputados_biografia?pk=96997&tipo=0,ÁTILA LINS,PSD,AM,55
96997,Átila Sidney Lins Albuquerque,,,http://www.camara.gov.br/internet/deputado/bandep/74090.jpg,"Deputado Federal (Congresso Revisor), 1991-1995, AM, PFL. Dt. Posse: 01/02/1991; Deputado Federal, 1995-1999, AM, PFL. Dt. Posse: 01/02/1995; Deputado Federal, 1999-2003, AM, PFL. Dt. Posse: 01/02/1999; Deputado Federal, 2003-2007, AM, PFL. Dt. Posse: 01/02/2003; Deputado Federal, 2007-2011, AM, PMDB. Dt. Posse: 01/02/2007; Deputado Federal, 2011-2015, AM, PMDB. Dt. Posse: 01/02/2011; Deputado Federal, 2015-2019, AM, PSD. Dt. Posse: 01/02/2015.",http://www2.camara.gov.br/deputados/pesquisa/layouts_deputados_biografia?pk=96997&tipo=0,ÁTILA LINS,PSD,AM,54
97031,Benito da Gama Santos,,,http://www.camara.gov.br/internet/deputado/bandep/74535.jpg,"Deputado Federal (Constituinte), 1987-1991, BA, PFL. Dt. Posse: 01/02/1987; Deputado Federal, 1991-1995, BA, PFL. Dt. Posse: 01/02/1991; Deputado Federal, 1995-1999, BA, PFL. Dt. Posse: 01/02/1995; Deputado Federal, 1999-2003, BA, PFL. Dt. Posse: 01/02/1999; Deputado Federal, 2015-2019, BA, PTB. Dt. Posse: 01/02/2015.",http://www2.camara.gov.br/deputados/pesquisa/layouts_deputados_biografia?pk=97031&tipo=0,BENITO GAMA,PTB,BA,55
97038,Bonifácio José Tamm de Andrada,,,http://www.camara.gov.br/internet/deputado/bandep/74650.jpg,"Deputado Federal, 1979-1983, MG, ARENA. Dt. Posse: 01/02/1979; Deputado Federal, 1983-1987, MG, PDS. Dt. Posse: 01/02/1983; Deputado Federal (Constituinte), 1987-1991, MG, PDS. Dt. Posse: 01/02/1987; Deputado Federal (Congresso Revisor), 1991-1995, MG, PDS. Dt. Posse: 01/02/1991; Deputado Federal, 1995-1999, MG, PTB. Dt. Posse: 01/02/1995; Deputado Federal, 1999-2003, MG, PSDB. Dt. Posse: 03/02/1999; Deputado Federal, 2003-2007, MG, PSDB. Dt. Posse: 01/02/2003; Deputado Federal, 2007-2011, MG, PSDB. Dt. Posse: 01/02/2007; Deputado Federal, 2011-2015, MG, PSDB. Dt. Posse: 04/02/2011; Deputado Federal, 2015-2019, MG, PSDB. Dt. Posse: 01/02/2015.",http://www2.camara.gov.br/deputados/pesquisa/layouts_deputados_biografia?pk=97038&tipo=0,BONIFÁCIO DE ANDRADA,PSDB,MG,55
97038,Bonifácio José Tamm de Andrada,,,http://www.camara.gov.br/internet/deputado/bandep/74650.jpg,"Deputado Federal, 1979-1983, MG, ARENA. Dt. Posse: 01/02/1979; Deputado Federal, 1983-1987, MG, PDS. Dt. Posse: 01/02/1983; Deputado Federal (Constituinte), 1987-1991, MG, PDS. Dt. Posse: 01/02/1987; Deputado Federal (Congresso Revisor), 1991-1995, MG, PDS. Dt. Posse: 01/02/1991; Deputado Federal, 1995-1999, MG, PTB. Dt. Posse: 01/02/1995; Deputado Federal, 1999-2003, MG, PSDB. Dt. Posse: 03/02/1999; Deputado Federal, 2003-2007, MG, PSDB. Dt. Posse: 01/02/2003; Deputado Federal, 2007-2011, MG, PSDB. Dt. Posse: 01/02/2007; Deputado Federal, 2011-2015, MG, PSDB. Dt. Posse: 04/02/2011; Deputado Federal, 2015-2019, MG, PSDB. Dt. Posse: 01/02/2015.",http://www2.camara.gov.br/deputados/pesquisa/layouts_deputados_biografia?pk=97038&tipo=0,BONIFÁCIO DE ANDRADA,PSDB,MG,54
97050,Carlos Alberto de Sousa Rosado,,,http://www.camara.gov.br/internet/deputado/bandep/74321.jpg,"Deputado Federal, 1995-1999, RN, PFL. Dt. Posse: 01/02/1995; Deputado Federal, 1999-2003, RN, PFL. Dt. Posse: 01/02/1999; Deputado Federal, 2003-2007, RN, PFL. Dt. Posse: 01/02/2003; Deputado Federal, 2007-2011, RN, PFL. Dt. Posse: 02/08/2007; Deputado Federal, 2011-2015, RN, DEM. Dt. Posse: 01/02/2011.",http://www2.camara.gov.br/deputados/pesquisa/layouts_deputados_biografia?pk=97050&tipo=0,BETINHO ROSADO,PP,RN,54
97058,Carlos do Carmo Andrade Melles,,,http://www.camara.gov.br/internet/deputado/bandep/74651.jpg,"Deputado Federal, 1995-1999, MG, PFL. Dt. Posse: 01/02/1995; Deputado Federal, 1999-2003, MG, PFL. Dt. Posse: 01/02/1999; Deputado Federal, 2003-2007, MG, PFL. Dt. Posse: 01/02/2003; Deputado Federal, 2007-2011, MG, PFL. Dt. Posse: 01/02/2007; Deputado Federal, 2011-2015, MG, DEM. Dt. Posse: 01/02/2011; Deputado Federal, 2015-2019, MG, DEM. Dt. Posse: 01/02/2015.",http://www2.camara.gov.br/deputados/pesquisa/layouts_deputados_biografia?pk=97058&tipo=0,CARLOS MELLES,DEM,MG,55
97058,Carlos do Carmo Andrade Melles,,,http://www.camara.gov.br/internet/deputado/bandep/74651.jpg,"Deputado Federal, 1995-1999, MG, PFL. Dt. Posse: 01/02/1995; Deputado Federal, 1999-2003, MG, PFL. Dt. Posse: 01/02/1999; Deputado Federal, 2003-2007, MG, PFL. Dt. Posse: 01/02/2003; Deputado Federal, 2007-2011, MG, PFL. Dt. Posse: 01/02/2007; Deputado Federal, 2011-2015, MG, DEM. Dt. Posse: 01/02/2011; Deputado Federal, 2015-2019, MG, DEM. Dt. Posse: 01/02/2015.",http://www2.camara.gov.br/deputados/pesquisa/layouts_deputados_biografia?pk=97058&tipo=0,CARLOS MELLES,DEM,MG,54
97082,Celso Ubirajara Russomanno,,,http://www.camara.gov.br/internet/deputado/bandep/73441.jpg,"Deputado Federal, 1995-1999, SP, PSDB. Dt. Posse: 01/02/1995; Deputado Federal, 1999-2003, SP, PPB. Dt. Posse: 01/02/1999; Deputado Federal, 2003-2007, SP, PPB. Dt. Posse: 01/02/2003; Deputado Federal, 2007-2011, SP, PP. Dt. Posse: 01/02/2007; Deputado Federal, 2015-2019, SP, PRB. Dt. Posse: 01/02/2015.",http://www2.camara.gov.br/deputados/pesquisa/layouts_deputados_biografia?pk=97082&tipo=0,CELSO RUSSOMANNO,PRB,SP,55
97101,Cláudio Cajado Sampaio,,,http://www.camara.gov.br/internet/deputado/bandep/74537.jpg,"Deputado Federal, 1995-1999, BA, PFL. Dt. Posse: 01/02/1995; Deputado Federal, 1999-2003, BA, PFL. Dt. Posse: 01/02/1999; Deputado Federal, 2003-2007, BA, PFL. Dt. Posse: 01/02/2003; Deputado Federal, 2007-2011, BA, PFL. Dt. Posse: 01/02/2007; Deputado Federal, 2011-2015, BA, DEM. Dt. Posse: 01/02/2011; Deputado Federal, 2015-2019, BA, DEM. Dt. Posse: 01/02/2015.",http://www2.camara.gov.br/deputados/pesquisa/layouts_deputados_biografia?pk=97101&tipo=0,CLAUDIO CAJADO,DEM,BA,55
97101,Cláudio Cajado Sampaio,,,http://www.camara.gov.br/internet/deputado/bandep/74537.jpg,"Deputado Federal, 1995-1999, BA, PFL. Dt. Posse: 01/02/1995; Deputado Federal, 1999-2003, BA, PFL. Dt. Posse: 01/02/1999; Deputado Federal, 2003-2007, BA, PFL. Dt. Posse: 01/02/2003; Deputado Federal, 2007-2011, BA, PFL. Dt. Posse: 01/02/2007; Deputado Federal, 2011-2015, BA, DEM. Dt. Posse: 01/02/2011; Deputado Federal, 2015-2019, BA, DEM. Dt. Posse: 01/02/2015.",http://www2.camara.gov.br/deputados/pesquisa/layouts_deputados_biografia?pk=97101&tipo=0,CLAUDIO CAJADO,DEM,BA,54
97149,Darcísio Paulo Perondi,,,http://www.camara.gov.br/internet/deputado/bandep/73891.jpg,"Deputado Federal, 1995-1999, RS, PMDB. Dt. Posse: 01/02/1995; Deputado Federal, 1999-2003, RS, PMDB. Dt. Posse: 01/02/1999; Deputado Federal, 2003-2007, RS, PMDB. Dt. Posse: 01/02/2003; Deputado Federal, 2007-2011, RS, PMDB. Dt. Posse: 01/02/2007; Deputado Federal, 2011-2015, RS, PMDB. Dt. Posse: 01/02/2011; Deputado Federal, 2015-2019, RS, PMDB. Dt. Posse: 01/02/2015.",http://www2.camara.gov.br/deputados/pesquisa/layouts_deputados_biografia?pk=97149&tipo=0,DARCÍSIO PERONDI,PMDB,RS,55
97149,Darcísio Paulo Perondi,,,http://www.camara.gov.br/internet/deputado/bandep/73891.jpg,"Deputado Federal, 1995-1999, RS, PMDB. Dt. Posse: 01/02/1995; Deputado Federal, 1999-2003, RS, PMDB. Dt. Posse: 01/02/1999; Deputado Federal, 2003-2007, RS, PMDB. Dt. Posse: 01/02/2003; Deputado Federal, 2007-2011, RS, PMDB. Dt. Posse: 01/02/2007; Deputado Federal, 2011-2015, RS, PMDB. Dt. Posse: 01/02/2011; Deputado Federal, 2015-2019, RS, PMDB. Dt. Posse: 01/02/2015.",http://www2.camara.gov.br/deputados/pesquisa/layouts_deputados_biografia?pk=97149&tipo=0,DARCÍSIO PERONDI,PMDB,RS,54
97160,Dilceu João Sperafico,,,http://www.camara.gov.br/internet/deputado/bandep/73768.jpg,"Deputado Federal, 1995-1999, PR, PP. Dt. Posse: 01/02/1995; Deputado Federal, 1999-2003, PR, PPB. Dt. Posse: 01/02/1999; Deputado Federal, 2003-2007, PR, PPB. Dt. Posse: 01/02/2003; Deputado Federal, 2003-2007, PR, PP. Dt. Posse: 01/02/2007; Deputado Federal, 2011-2015, PR, PP. Dt. Posse: 01/02/2011; Deputado Federal, 2015-2019, PR, PP. Dt. Posse: 01/02/2015.",http://www2.camara.gov.br/deputados/pesquisa/layouts_deputados_biografia?pk=97160&tipo=0,DILCEU SPERAFICO,PP,PR,55
97160,Dilceu João Sperafico,,,http://www.camara.gov.br/internet/deputado/bandep/73768.jpg,"Deputado Federal, 1995-1999, PR, PP. Dt. Posse: 01/02/1995; Deputado Federal, 1999-2003, PR, PPB. Dt. Posse: 01/02/1999; Deputado Federal, 2003-2007, PR, PPB. Dt. Posse: 01/02/2003; Deputado Federal, 2003-2007, PR, PP. Dt. Posse: 01/02/2007; Deputado Federal, 2011-2015, PR, PP. Dt. Posse: 01/02/2011; Deputado Federal, 2015-2019, PR, PP. Dt. Posse: 01/02/2015.",http://www2.camara.gov.br/deputados/pesquisa/layouts_deputados_biografia?pk=97160&tipo=0,DILCEU SPERAFICO,PP,PR,54
97182,Edson Bez de Oliveira,,,http://www.camara.gov.br/internet/deputado/bandep/73793.jpg,"Deputado Federal, 1995-1999, SC, PMDB. Dt. Posse: 01/02/1995; Deputado Federal, 1999-2003, SC, PMDB. Dt. Posse: 01/02/1999; Deputado Federal, 2003-2007, SC, PMDB. Dt. Posse: 01/02/2003; Deputado Federal, 2007-2011, SC, PMDB. Dt. Posse: 01/02/2007; Deputado Federal, 2011-2015, SC, PMDB. Dt. Posse: 01/02/2011; Deputado Federal, 2015-2019, SC, PMDB. Dt. Posse: 05/02/2015.",http://www2.camara.gov.br/deputados/pesquisa/layouts_deputados_biografia?pk=97182&tipo=0,EDINHO BEZ,PMDB,SC,55
