name,id
Abel Atahualpa Martínez Durán,a6440520-af31-4808-b8c7-13de4ecda1ad
Abel Martínez Durán,a6440520-af31-4808-b8c7-13de4ecda1ad
Aciris Milcíades Medina Báez,fcf3f7ea-f367-4d93-8ff3-4b90fc541a9f
Adalberto Esteban Rosa Hernández,3730f369-18fc-43ac-b610-e70c26cd51ce
Adalgisa Fátima Pujols,1a1b6db7-04a2-4cb6-8e15-43fc1c43f7b3
Adelis de Jesús Olivares Ortega,78f9a3f9-baa0-4fc1-aa15-ec45fb13e200
Afif Nazario Rizek Camilo,9d7b0cf4-ec53-466f-8900-82c119abcd5c
Agustín Burgos Tejada,d9f4b2d2-fbc9-4bb3-b088-a6c18be53155
Albert Elías Atallah Lajan,838a121f-8fb3-4ffa-af1a-ddac8b66281d
Alejandro Jerez Espinal,b2ada5b3-08c0-44fc-8532-1f3d9595957d
Alexis Isaac Jiménez González,faf4afa6-2f41-433d-90f8-74ff9c670b7b
Alfredo Antonio Rodríguez Azcona,68c7481f-26f1-47f2-bfbb-48ea17f3bd88
Alfredo Martínez,fcfa9c8b-2a25-4018-879d-53eb0b199ebe
Alfredo Pacheco Osoria,ca32b2f6-bf92-43a5-9ef7-45c36e62476b
Altagracia Herrera de Brito,b1e2edbb-ff47-47b0-adad-1ba629497330
Altagracia Mercedes Gonzalez Gonzalez,af731b1a-5ce6-4623-8e13-cefa867fbea9
Amado Antonio Díaz Jiménez,3aeb419c-2579-4c9d-a53e-e1942da38e46
Ana Adalgisa del Carmen Abreu Polanco,994e596d-6938-4480-af74-5330e375351d
Ana Emilia Báez Santana,61eb6688-4e02-45be-a222-de035fa87a55
Ana María Peña Raposo,59662bfd-3132-4aaa-9de5-9378f980f117
Ana Mercedes Rodríguez de Aguasvivas,337a6444-f7ba-4312-aa55-427e61cc8c21
Ana Miledy Cuevas,5ec48db7-c20c-42ef-a29c-0759bc37f65d
Andrés Enmanuel Bautista Taveras,60a1e887-b7df-4f95-9ba9-c9f0e048966f
Angel Esteban Ramírez Taveras,febadb49-7a5b-44fd-adb4-baad4bede9d9
Antonia Suriel Mata,46f5c7fb-57e5-43b5-85df-99ce0815dea7
Antonio Bernabel Colón,1675b118-b3b9-4a88-b438-cc34244165e8
Aníbal Rosario Ramírez,47f77ddf-9d3f-4d7c-a51d-d760f93e8ddf
Aquiles Leonel Ledesma Alcántara,7afa145a-afbe-4878-9303-2b0859437df4
Aquilino Serrata Uceta,966c93c6-0fc3-4f3f-9d9a-dba61870c1a1
Aridio Antonio Reyes,30f2807a-96df-4cc1-af89-5e25c02f3551
Aurelio Agustín Mercedes Moscat,6e3f4242-16b6-4821-8022-a90d96059237
Bernardo Alemán Rodríguez,23d7b397-7105-4a58-a0fd-c46be24e94d7
Besaida Mercedes González de López,20ef3894-b3e9-4135-a120-8eba92d6055f
Bárbara Yvelice Abréu Grullón,725f5199-e2ab-4d0e-afaf-ef805cdd9c59
Carlos Alberto Amarante García,13f91947-df7c-4416-97ec-4c0720064696
Carlos Borromeo Terrero Reyes,ac02955a-9221-42df-9dfe-03b3fd0feddb
Carlos Gabriel García Candelario,d86e90c9-e280-4da8-a62c-01690cc5f5b4
Carlos Marién Elías Guzmán,d4ef3a7a-010a-471f-ab81-1197c3045f06
Carlos María García Gómez,7cf904a3-5055-48af-a33a-66d689cb3e17
Catalina Paredes Pinales,6f2ad493-2867-4ea6-af82-dda721273cd6
Ceila Licelot Encarnación Minyety,e384c0f8-ce19-45ea-b1bc-9ff6f41d7aad
Cristian Encarnación,e773bfca-1304-41ce-b86a-16746fe6fe2e
Cristian Paredes Aponte,1eafa27f-bec7-4456-b461-b2404c8621d6
Cristóbal Venerado Antonio Castillo Liriano,b8abd8fc-fa42-4995-8280-2bbcc8390699
César Enrique Gómez Segura,048367ee-7bb6-47c3-92d9-518f407f6b41
Damarys Vásquez Castillo,f130ed37-da56-4846-acdc-7df3bbb1b7c4
Darío de Jesús Zapata Estévez,d1cd7290-21e5-4136-966d-90fbb1c4ba9e
David Herrera Díaz,39ee9880-305d-43f1-942c-84d806dd6677
Demóstenes Willian Martínez Hernández,8125407d-3ac2-4aa3-b52c-1d48dd9cedaf
Dionisio de la Rosa Rodríguez,762313c4-3e9a-4857-ac0b-7a50fd02033e
Domingo Enrique Barett,691d1816-00c5-4143-99c2-fce47f7351ef
Domingo Eusebio de León Mascaro,0dc5005a-b33e-4fab-a7f4-26eb16084770
Eduard Jorge Gómez,759138b3-ad8e-4fd3-9e56-5c69873ce54d
Eduardo Hidalgo Abreu,af007f33-cac1-4580-942f-503e67584afe
Elpidio Infante Galán,8699a0c4-d27b-4517-abbc-33e97c61d1e5
Elsa Argentina de León Abreu,b1002307-9645-4bf8-90dd-9871be727765
Elvin Antonio Fulgencio,58a340fa-be4c-484c-9c0c-75055dbe7166
Elías Báez de los Santos,2e2bdc92-d3ff-435f-962b-480687c2e526
Elías Rafael Serulle Tavárez,73680766-8ace-4ac5-9a83-698fde435e8e
Esther Mirelys Minyeti,d5828a8a-0217-45fe-b99b-5a8663e36fef
Eugenio Cedeño Areché,ed698b98-fd0d-4ca3-a705-74090aa75266
Eugenio María Méndez Ramírez,6e9d9c9a-067e-4efb-b25d-ee1deb006aad
Evangelina Baciliza Sosa Vásquez,3ccad4de-ed2c-4cba-9ab6-5b535ac2f230
Evelin Andújar Matos,3b8546c1-549d-4279-b303-a732c2fc11be
Fabio Ernesto Vargas Matos,9b90c1d6-53f5-4896-a97f-9a175d96f4e7
Faride Virginia Raful Soriano,6a29fa30-9c8c-4692-9663-558e0056e847
Fausto Ramón Ruiz Valdez,5856d8ac-fc32-4b1c-ac9d-d4a2acf4ab4a
Fidel Ernesto Santana Mejía,c67a9526-a803-4488-b417-c12bc6dee314
Fidelio Arturo Despradel Roque,f38d8321-9740-4abe-8e8f-aef52952dc3b
Francisco Antonio Mancebo Melo,4f2efce0-ac48-4cc0-b49b-77a8e3c0bbb0
Francisco Antonio Matos Mancebo,092a1fbb-0242-4049-9e49-de7b817be125
Francisco Antonio Santos Sosa,00dd6d21-a7a6-4b32-94bc-a7c0c7b6c74b
Francisco Arturo Bautista Medina,7a359d89-377e-4187-b257-e625e9bc2187
Francisco Javier Clark Vásquez,f174a6a5-b7db-451b-89b6-93a56a660ec8
Francisco Javier Paulino,9161a459-2480-4240-a04b-a268ec5fc6d6
Francisco Liranzo,7f563db8-cdd8-47de-853a-e8a5a7ddb471
Frank Alberto Soto Roa,a770a2c0-8b76-43c5-8858-678be103367d
Franklin Martín Romero Morillo,3ea04395-7267-42d4-9b37-0a6df585fb21
Franklin Ysaías Peña Villalona,a3dda529-415e-402b-bd03-6775059d9bac
Félix Antonio Castillo Rodríguez,f3138ec2-b127-4cea-806c-8a5d064777f2
Getrude Ramírez Cabral,59bbca35-4322-4363-b33e-e3eed8bdae73
Gilda Mercedes Moronta Guzmán,a604a09b-9d5d-4fda-b9ab-79d968056ac2
Ginnette Altagracia Bournigal Socías,1156098f-f851-4bf0-9737-4c395f5a9d80
Gloria Roely Reyes Gómez,7071d42b-0baa-4f14-8b3a-eb76d5269f4d
Graciela Fermín Nuesi,82682180-4d4c-48d4-8259-318c12a614b9
Gregorio Reyes Castillo,897fdf8e-91b8-4cf6-8ddb-e1ab2328705e
Guadalupe Valdéz San Pedro,593a94be-4eec-4fd2-8500-58a2631748e7
Guido Cabrera Martínez,94d1a78e-aa12-46cc-9e59-fe07f771f0d4
Guillermo Radhamés Ramos García,1228d0b9-8adc-4275-abde-159342e82609
Gustavo Antonio Sánchez García,9f1f6d4a-5328-4172-9cb7-8ae6d9171e06
Hamlet Amado Sánchez Melo,bac693e3-8106-4132-8a5d-b82c4bb8a824
Henry Modesto Merán Gil,f051254f-ed71-4f25-8c1f-1495ef5ec5cc
Hugo Fernelis Fortuna Tejeda,b9ffe486-7795-40cc-ac5f-d6ccf8ac55e5
Hugo Rafael Núñez Almonte,c4bde5a2-0582-4869-843b-368465f3271d
Hugo Tolentino Dipp,a3693a44-7e5d-49c5-86b6-b39980b8206d
Héctor Darío Féliz Féliz,dc992d9f-2bbe-4626-8af7-2221a20890a1
Héctor Ramón Peguero Maldonado,ddef719a-1d80-440b-a983-ebab6c9523b7
Inés Xiomara Bryan Casey,af321690-373c-4d04-abd0-603f96d0d865
Israel Terrero Vólquez,2b706ab2-933b-4004-87c9-6ffc93d82c3f
Ito Bisonó,93652f7b-a2d9-4500-8851-e497b7305597
Ivannia Rivera Núñez,4239c08f-3fa1-4aeb-9079-2be3820cfb31
Jacqueline Montero,d8481087-80c3-4c8f-a14b-fdbf13b7ff60
Jesús Martínez Alberty,1ad8678d-cc91-4fd0-96b9-f379abc8e0d4
Johanny Mercedes Guzmán Rodríguez,0024fe3c-0e3e-47e4-b760-d678b2f36263
Jorge Frías,d988baf3-bb11-4cc4-9d3a-30d8f0c41edc
Josefa Aquilina Castillo Rodríguez,fd01df67-1ba9-4d2d-8292-6be65971a198
Josefina Tamárez,de79f99f-7a66-4168-a858-1a055811526f
José Alberto Vásquez Fernández,bcd8526d-6ae2-41a1-8065-102136ddf0af
José Altagracia González Sánchez,2d7d2ed1-fc43-42a0-a888-8dc9409b8a3a
José Antonio Díaz Reyes,07b9ddbf-8f9f-4832-8291-4fca16374a2e
José Antonio Fabián Beltré,244ab136-6b34-485b-9a35-c831eeeaeab3
José Ernesto Morel Santana,a3a8900d-0af5-4b76-bb22-c395ded1770f
José Felipe la Luz Núñez,7a24bbcb-b7f7-4701-90f7-f6b31ce6382d
José Francisco López Chávez,bc150608-4c11-4ddb-a397-680cc5739cea
José Francisco Santana Suriel,c56666fc-99d3-4d45-9927-29a3fc514853
José Gabriel Jáquez Vásquez,c981e5a7-3cc8-4e0c-be28-196ab3f43fc9
José Geovanny Tejada Reynoso,4ef0883d-b1a9-46e0-aee0-d20d0123cd45
José Ignacio Paliza,3af01c7e-7ec2-4028-b8db-7df77279d5c2
José Ignacio Paliza Nouel,3af01c7e-7ec2-4028-b8db-7df77279d5c2
José Isidro Rosario Vásquez,e69638c8-131c-48d5-a68c-a8cc992ed30c
José Luis Rodríguez Hiciano,7271f057-c713-4cc0-ae08-1cb3a8b02e6a
José Luís Cosme Mercedes,c986a33d-060c-479f-b0db-665eef6a79b5
José Miguel Cabrera,a0d8da26-5224-40f9-8f2f-f80c627061df
José Nelson Guillén Valdéz,9c51d084-d2c1-48fa-a967-3af9423dba2e
José Paliza,3af01c7e-7ec2-4028-b8db-7df77279d5c2
José Rafael García Mercedes,65b016db-b878-4152-8350-221239d686cb
José Ulises Rodríguez Guzmán,93ff5532-ef24-48c2-9efa-7c90d731d4f0
Juan Agustín Medina Santos,2d1c65be-d6a2-4e3c-bd39-46a962afecef
Juan Andrés Comprés Brito,614a0035-03b1-4a81-b13f-ffb7445a6d00
Juan Andrés Comprés Brito,72a3224e-6998-4279-9d86-649ab350ad4d
Juan Carlos Quiñones Minaya,1bad03ef-a86d-4cc0-ac6b-1c7684e3a665
Juan Hubiere Del Rosario,44f2e9ae-8266-4a92-b12a-6fdf1b6dcd1d
Juan José Morales Cisneros,48db8f57-56f7-4291-a82f-c30a4bdafce2
Juan José Rosario Rosario,d345f465-edc0-42c1-bb18-a760499c0b2a
Juan Julio Campos Ventura,f170e059-93d7-4c16-b2c0-d4980ad98a57
Juan Maldonado Castro,ae686b21-a8f4-49b8-a100-a39e07593ba9
Juan Roberto Rodríguez Hernández,870d16a0-64d5-4ea3-9281-2af729190f9d
Juan Suazo Marte,86cea5d3-3be9-4fcd-b1ea-afc70a8c1ba9
Juana Mercedes Vicente Moronta,e3e2d1c1-4225-4ec4-8c83-0b3b086aa0fd
Julio Alberto Brito Peña,6dfad47c-5590-4906-9e6d-0e7887b5cd0e
Julio Encarnación,0f43725a-d0fb-415f-961a-6f79d51bef93
Julito Fulcar Encarnación,d792b7d7-ad52-44ad-a7ae-1660eb8fd708
Karen Lisbeth Ricardo Corniel,6f3d7df2-e3bb-4cc7-9c00-6380e8561b46
Kenia Milagros Mejía Mercedes,1692dd05-4992-4f97-9d50-7f273cd5b4d0
Leivin Esenobel Guerrero,520f385a-1757-4027-9b82-2c639602e74a
Leoncio Teódulo Sandoval López,8798e379-5929-4fdd-b6e2-ca83c864e23f
Levis Suriel Gómez,09c6b9a7-4def-4634-b83c-ac21e2e03c4b
Lucía Argentina Alba López De Alba,099a113e-d0c3-41d6-ade5-a42c3d463970
Lucía Medina Sánchez de Mejía,a7a9b97f-9e50-4f04-8d0f-d4add4e622aa
Luis Alberto Tejeda Pimentel,d01ef922-121f-4349-8b29-00ed5b0aa238
Luis Antonio Vargas Ramírez,3a1fa154-da12-4f86-9515-7099e2130f73
Luis Enrique Castillo Ogando,64efdfb1-ab14-46a0-9542-508fd33bc855
Luis Jimenez Caminero,3230078f-b90e-4d49-a179-9958556bf5e9
Luis Manuel Henríquez Beato,dc615ab1-2fcf-4a93-a116-9a5c09e4fe5e
Luis Rafael Sánchez Rosario,73600e11-ed79-406c-9992-17f811aee764
Luis Ramón Peña,3728c47b-7e81-4991-ba27-017a97774802
Lupe Núñez Rosario,02f558f5-0959-4613-acb9-f57ffac1492c
Lía Ynocencia Díaz Santana,7bf8549d-8ecb-495e-ad4f-46f5709631f4
Magda Alina Altagracia Rodríguez Azcona,d845f069-2941-4875-8920-7bc7a3c111ba
Manuel Andrés Bernard,2218777c-5404-46bb-adaf-2a243701f855
Manuel Antonio Díaz Santos,7e738910-ba8b-4eba-8cfa-ba72f336fe77
Manuel de Jesús Jiménez Ortega,ecf8c311-8db0-4257-8f1a-f050a8f9ef54
Manuel Elpidio Báez Mejía,b6ddb041-9c4a-4bd5-a707-a669f3c74af8
Manuel Miguel Florián Terrero,b7ffdbd2-d5a1-49df-875a-c230e4a79b19
Manuel Orlando Espinosa Medina,48dd07f1-6c98-43d1-bffb-dc8cb8aff78a
Manuel Sánchez Suazo,1e6d3695-0c51-44b1-b6f4-a244c7c563a5
Marcos Genaro Cross Sánchez,cb3a78eb-7ecb-46d3-8a1a-ac9797597c86
Mariano Montero Vallejo,25208391-3229-434f-96c9-be5b6695975d
Marino Hernández Alberto,e552f5ce-a5f3-4cc5-a228-df8c092d3386
Mario José Esteban Hidalgo Beato,9eb56dec-3f19-4fd1-8a49-c8d0fa33d0a6
María Amparo De Dios Martínez,fafe75ed-9fdd-44cd-ac02-da456a05b4d4
María Aracelis Duarte Duarte,c2f934cd-69b0-43cf-be83-a182ac3516ea
María Cleofia Sánchez Lora,67e76831-d1c4-4718-b84a-de70b2ef05bc
María Cándida Sánchez Mora,248390c1-bb44-47cb-bd7a-9a87f44fc901
María Glotirde Gallard,f1bc10d7-2af6-400f-9f14-ad15cab2ebe7
María Josefina Marmolejos Marmolejos,cdf8c238-ac76-45eb-a394-1da7d6a13f84
María Luisa Guzmán Calderón,798dfc2f-a615-4c0f-b69f-0cd7a2753ecc
María Mercedes Fernández Cruz,a726dc3a-7f21-4b9e-82c3-8815127465cf
Melvin Alexis Lara Melo,3ea8521f-4bc2-465f-a00b-855379066d6b
Miguel David Collado Morales,a32f6083-56de-4aaf-ac06-2fe91dfade83
Miguel Eduardo Espinal Muñóz,517b58c6-4bf0-4760-b613-cc2b00a9c904
Miguel Ángel Jazmín de la Cruz,8f74491e-5374-4021-a335-71790a1c20e4
Miguel Ángel Peguero Méndez,8f907108-7e75-4c06-8b46-9bce27993fd0
Miladys Fatima Núñez Pantaleón,72928598-7569-4281-ada1-5a105f3d1c12
Milcíades Marino Franjul Pimentel,d8915928-9154-460d-9879-3c1017a43934
Miledys Suero Rodríguez,eb4a8744-22ef-463a-88bb-2c10890a46c3
Milna Margarita Tejada,d57e6f1d-e729-463f-b9b3-9ba21db406c1
Minerva Josefina Tavárez Mirabal,d7b6168d-ef3e-4559-8ce8-797c15bc6e75
Minou Tavárez Mirabal,d7b6168d-ef3e-4559-8ce8-797c15bc6e75
Mirian Altagracia Cabral Pérez,612c6abc-1cd2-480b-bbf0-e66280a2fcaa
Máximo Castro,2190171e-2851-4dce-b92a-787e22e4f39a
Nancy Altagracia Santos Peralta,c7ce40d8-bc9a-4efc-a660-aceb8664c28e
Napoleón López Rodríguez,b34a1d65-da8e-4bcc-b192-31a4c279fe1f
Nelson de Jesús Arroyo Perdomo,81a14bdb-46b5-4ef6-a049-2731327cb30a
Nestor Juan Muñoz Rosado,178ca926-fbe0-452b-a7b0-a6298ab46406
Nicolás Tolentino López Mercado,6b8f816b-deb7-4809-820b-cbb4aacc84d3
Nidio Encarnación Santiago,9f2dba54-8173-4d54-a2a3-a8c5875733aa
Noris Elizabeth Medina Medina,2c573ce5-0103-45f7-aa5b-4e8e9b1c2a54
Néstor Julio Cruz Pichardo,3ae149dc-54e9-452e-999e-b52e387a94a2
Olfalida Almonte Santos,e343f001-e8e2-44d6-8113-69569439caab
Olmedo Caba Romano,ce13377b-c9a6-45a1-a877-9db2fce85266
Omar Eugenio De Marchena González,c28ebcbe-24e6-4d9f-b0fe-524362a68dec
Orfelina Liseloth Arias Medrano,a31a2dff-652c-4da5-a2a3-35bcbe3299dc
Orlando Antonio Martínez Peña,01b138ea-2536-4add-a639-18dc9a602026
Pablo Inocencio Santana Díaz,dd6e6418-becf-492a-a274-d826d9eee0f6
Pedro Alejandro Aguirre Hernández,f09109b1-145e-44d4-88ae-9cdfdd8c48b0
Pedro Antonio Tineo Núñez,7a40dfc6-e501-4161-b50b-7495300bd55b
Pedro Billilo Mota,65506808-6fe5-472b-bfdf-1fe37f3bafb1
Pedro Carreras Santana,aa2e6d86-68e3-4e80-bae1-1235edde546b
Pedro Enrique De Óleo Veras,0bd73e13-5bff-47c0-b828-9d0a33730aa9
Pedro Juan Rodríguez Meléndez,65d09520-89b1-4cdb-8ed3-37fdf4a8844e
Pedro Tomás Botello Solimán,9f25d4ca-418b-4e3e-8238-7ade75b76175
Plutarco Pérez,66fccf68-555e-4f97-9043-e26ea2193739
Radhamés Camacho Cuevas,fb78bfe2-6d83-4427-b8e0-d1666a250716
Radhamés Fortuna Sánchez,27841a37-39b4-4e37-a200-1bfcf0a2dc43
Rafael Antonio Abel Lora,0c4a2761-872c-4dda-ad9d-e6272f124033
Rafael Ernesto Arias Ramírez,329d9eca-08d8-4aed-8f15-7c2949432014
Rafael Francisco Vásquez Paulino,b416295b-a189-425e-92fe-4e14fe770aa4
Rafael Leonidas Abréu Valdéz,41db2d9a-e565-4f2e-bd4b-886bfa8ec127
Rafael Méndez,a62ff591-4ec7-48a9-9c68-07af65728a2e
Rafael Tobías Crespo Pérez,5e1f433b-699f-4bf8-a1c1-233d6a775584
Rafaela Alburquerque de González,2b990f6a-b1fb-4765-a843-aa18f69d5a04
Ramón Alfredo Reyes Estévez,c0d21504-a0c2-49e4-a53e-b1cf5f33f3bb
Ramón Antonio Bueno Patiño,680e5123-8b2d-4b9f-af64-2aefe523e879
Ramón Antonio Cabrera Cabrera,6adf1fed-0979-4105-b80f-2e725b500f10
Ramón Antonio Fernández Martínez,623791c6-1244-4494-b91c-5d56724a7ca1
Ramón Arcángel Santana Ramírez,4b02b1c6-76b5-4b52-9848-8075fd2a6661
Ramón Dilepcio Núñez Pérez,77da1781-842b-464f-9d5b-e15ab4032912
Ramón Durán Paredes,3006f256-ce84-4f64-8fd6-e00ead1452fd
Ramón Francisco Toribio,9e0c087f-cc57-4695-98f8-967a9486cbd7
Ramón Noé Camacho Santos,aadd1e0b-0085-424d-b4bc-90cffe921cb1
Ramón Ricardo Sánchez De la Rosa,676a786e-a4db-479c-b8d9-8bb07ba7884b
Ramón Rogelio Genao Durán,2ad174ee-2839-44a4-a0b0-101b61761042
René Polanco Vidal,4c9d0870-822e-4c75-bb8f-4a526d70019e
Ricardo De Jesús Contreras Medina,8cf8fe48-8b78-42b5-90a8-d8cb34256e44
Ricardo de los Santos Polanco,1b1e98a3-0bb3-4c22-a39b-63a0ef812365
Roberto Arturo Berroa Espaillat,0b46303e-2376-4ce2-b92f-8388b4a03b3d
Roberto Pérez Lebrón,b3f4186a-c33f-4093-ae3e-9a95d79ec359
Robinson de Jesús Díaz Mejía,4450f519-168d-462e-937a-916f91bb40af
Rogelio Alfonso Genao Lanza,a5aeeb3a-6553-4207-a65f-2cfc87086497
Ronald José Sánchez Nolasco,778eb73d-a9ba-49c3-aff3-2273fe2031cd
Rosa Hilda Genao Díaz,90bfb42e-a165-4c6d-aa42-e335ab6e4821
Rosa Yris Guzmán Rodríguez,3a81ac92-25d2-42fd-a285-0c90e57ecc78
Rosendo Arsenio Borges Rodríguez,33caf5a1-9dac-4b88-bdaa-10147a7cab18
Rubén Darío Luna Martínez,54b0202d-69ad-4baa-b410-8dbf75056713
Rubén Darío Maldonado Díaz,71fc841b-2e8e-4d4f-9571-ee4ba14de3e9
Ruddy González,e03cacec-59ed-4769-ae04-2e915d0c2300
Rudy María Méndez,428d585d-5f84-4a8e-9007-c0153dabbc68
Rudy Melanio Hidalgo Báez,a6683955-75a7-48ce-b592-7f37c637c6d4
Salomón García Ureña,23951fc6-08ce-4fc2-b87a-0ffdedbe0b7e
Sandra Herminia Abinader Suero,658257ee-a162-4cf7-aa6e-a4b75c195fe7
Santo Ynilcio Ramírez Bethancourt,d3fd9e71-6da3-42ac-8a4c-0337cb660f93
Sergio Julio Muñoz Morales,b5eee31e-a064-4d94-bd6a-7f2cb156fd00
Sergio Moya de la Cruz,102021ee-c454-4ff2-a212-41976c83c216
Severina Gil Carreras De Rodríguez,b7ec0e0d-af0c-48df-9adb-06391357fc0b
Sonya De las Mercedes Abreu Villanueva,e1c5d910-d1d9-45c2-aa01-e97fdb1ad1b7
Teodoro Ursino Reyes,db34fc7c-5816-4f49-9bfe-0a4d6df53e3f
Tulio Jiménez Díaz,fe1b1960-5452-4770-891e-ce0cb6b7c256
Victor Bisono,93652f7b-a2d9-4500-8851-e497b7305597
Victor Bisonó,93652f7b-a2d9-4500-8851-e497b7305597
Victor Luis Lasosé Figueroa,c40b57c4-559b-4b2b-ba96-04bc35de8877
Victor Osvaldo Gómez Casanova,5c40910a-5905-4506-b4ee-c19a436e5eb8
Vinicio Aristeo Castillo Semán,0e44ff2b-eb99-44b3-9598-89637b26d4ed
Virgilio Manuel González Vásquez,c3379ef1-d2ea-496e-ad77-b5d4cab07762
Virgilio Merán Valenzuela,8a6434a7-d21f-417c-9e88-59edc5fa2366
Virginia Monica Lorenzo Núñez,12c7302a-bc6c-4c55-9787-4ecf8bf6ba47
Víctor Enrique Mencía García,85e6ae0c-1435-4ea5-ae7d-213d236ddc97
Víctor Hipólito Sánchez Féliz,e8408226-fffb-438f-b47a-de84c146a76d
Víctor José D´Aza Tineo,ff8eff20-ed44-4dae-817c-8f448d29308a
Víctor Manuel Fadul Lantigua,e2be45f9-ac95-426c-8109-b006eb84fa21
Víctor Orlando Bisonó Haza,93652f7b-a2d9-4500-8851-e497b7305597
Víctor Valdemar Suárez Díaz,c74befb9-3671-4377-844b-d186fc1e3c44
Wandy Modesto Batista Gómez,77726f26-4fbe-4274-b2a2-9d69fffdda21
Wellington Amín Arnaud Bisonó,b2c808a3-19e7-4a36-9afd-25f884eedfc0
Wilson Manuel Marte Estévez,cc6d850c-1e1d-4742-9495-e33e70194557
Yomary Altagracia Saldaña Payano,631d1c09-df6f-4070-852a-e0a59e326dee
Ysabel De La Cruz Javier,6b60c5c2-bcca-4c01-90b5-7733b01503ef
Ysabel Jacqueline Ortiz Flores,bd6721c8-e31a-4543-9e6b-0e41c1ec06d4
Yuderka Yvelisse De la Rosa Guerrero,0a09d900-f1cc-48e6-a25c-020c95129f3d
Ángel Ovelio Ogando Díaz,a4a16123-cbfa-4c16-bc8f-aaabe3e4b313
Ángela Pozo,26d1a45c-9d49-46c7-b3ff-74ca42adbcbb
米努·塔瓦爾·米拉瓦爾,d7b6168d-ef3e-4559-8ce8-797c15bc6e75
