id,name,position,start_date,end_date,type
e4318d8e-8cee-4553-99e0-0f5152b44bb0,Robert Kaliňák,Minister of the Interior,2006-07-04,2010-07-08,cabinet
e4318d8e-8cee-4553-99e0-0f5152b44bb0,Robert Kaliňák,Minister of the Interior,2012-04-04,2081-03-22,cabinet
b4c691bb-31c5-49b0-8db6-19b14a44ffa8,Eugen Jurzyca,"Minister of Education, Science, and Sports",2010-07-08,2012-04-04,cabinet
d988146e-cdca-4afe-ba18-0d465207140f,Robert Fico,Prime Minister of Slovakia,2006-07-04,2010-07-08,cabinet
d988146e-cdca-4afe-ba18-0d465207140f,Robert Fico,Prime Minister of Slovakia,2012-04-04,2018-03-15,cabinet
