name,id
Adil Abış oğlu Əliyev,494c914f-1c02-4505-8dc2-aaf429464bc8
Aqil Məhəmməd oğlu Abbas,9f72d1de-2e71-4b77-b87b-81c697e3bbee
Aqiyə Həbib qızı Naxçıvanlı,24ea8819-19c8-464f-88c7-75e93ebd796b
Araz Məmməd-Mübariz oğlu Əlizadə,401d2a67-d553-4ccf-a599-9ce0f60655cc
Arif Qafar oğlu Rəhimzadə,23098f88-fd07-48f1-87a9-501b40a43a12
Asim Nazim oğlu Mollazadə,b5856108-9bca-4060-a0a5-a369aafd47c2
Aslan Məmmədhüseyn oğlu Cəfərov,43f5d462-072a-47fe-8505-0262647d23f9
Astan Nuşrəvan oğlu Şahverdiyev,7118c5ee-ef78-421e-9ec9-3be619f2a43e
Aydın Böyükkişi oğlu Mirzəzadə,fd2d80d3-7d43-4e0e-982f-0bd98d64fb1f
Aydın Nəsir oğlu Hüseynov,3f3bd730-a9e4-4226-82ff-2b2be89c5d45
Aytən İnqilab qızı Mustafazadə,0e6762ab-3457-459b-8ab8-8b6077e0acb7
Azay Əjdər oğlu Quliyev,05b534d5-4fe5-496d-9b77-aa4e197b014a
Azər Camal oğlu Badamov,cddbe698-7191-4333-b0af-8cfee28d45c6
Azər Şəmşid oğlu Kərimli,2c0b2f75-01ae-4c41-b52c-a10870b9d438
Ağacan Qulam oğlu Abıyev,961d2045-b60d-41ab-9905-7aaf6ab11294
Ağalar İsrafil oğlu Vəliyev,0ab6003c-af01-4438-a84f-d1cfa03e079d
Bahar Əvəz qızı Muradov,255dcf17-6526-427b-aec9-7955035ba0a3
Bahar Əvəz qızı Muradova,10973e96-f5e0-4471-a3d4-8b149b551189
Bəxtiyar Həmzə oğlu Əliyev,7c9f13fa-5d87-466e-9920-0e0c9acfcb5e
Bəxtiyar Yusif oğlu Sadıqov,b906ff82-b112-42a7-b60f-9d5a686b8d22
Cavanşir Hümmət oğlu Paşazadə,403472ea-e8c7-43c0-a8e0-c1f4387e2aae
Cavanşir Əyyub oğlu Feyziyev,8e5db81f-15e6-4c29-a8f9-1b57b519a58e
Cavid Həmid oğlu Osmanov,fc75541b-9887-4aa7-9922-42db62d7ceae
Cavid Qənbər oğlu Qurbanov,52b99a3c-bb8e-4758-891d-d2284aecb4c8
Ceyhun Yunis oğlu Osmanlı,fcd809d1-0137-4f87-9e4d-052671ea3ade
Cəlal Əlirza oğlu Əliyev,ff66645d-6387-4e65-abce-2b85528c50c8
Dilarə Məmmədağa qızı Cəbrayılova,dd492f21-03e9-4687-8b02-73e031c73135
Eldar Allahyar oğlu Quliyev,64a925e3-41ba-414e-9d9c-9d4d747e1d6d
Eldar Rza oğlu İbrahimov,1ed759e4-f07c-4fca-8db0-3344b0cda4a4
Eldəniz Adil oğlu Səlimov,c2ddffb8-4695-49ba-afbb-b196b7bd8a82
Elman Camal oğlu Məmmədov,c358710f-0300-498d-9ba3-0eb7a9c4e83f
Elman Xudam oğlu Nəsirli,2da243eb-1a54-4645-b025-15dfaa81b00e
Elmira Hüseyn qızı Axundova,878ed3dd-2b70-4fae-bb12-600db4fff6d9
Elxan Sirac oğlu Süleymanov,cc095faf-2d1d-49aa-be41-e88ce118ac26
Elçin Bəybala oğlu Quliyev,2b114d2d-0cd7-482f-9c6a-5900ee4238cd
Elşad Eldar oğlu Həsənov,5e76fdc6-6ce6-4a3e-b34d-f227eae59d91
Elşən Məmmədhənifə oğlu Musayev,31bf8e4b-2116-49aa-81b1-975590edfb19
Fazil Qəzənfər oğlu Mustafa,8866bf8e-2984-44dd-8190-d81853b5904b
Flora Qasım qızı Qasımova,530c1048-8b4c-4651-a620-fa98691aec52
Fuad Rauf oğlu Muradov,809bdb14-c1e7-4f2a-ab4d-6a17afa22f56
Fərəc İbrahim oğlu Quliyev,324aa783-04d1-4da7-b4cf-7f4e54c760d3
Fəttah Səməd oğlu Heydərov,bd86dbc7-ac02-4953-9f43-a7cc888f79dd
Fəzail Feyruz oğlu İbrahimli,a95c0767-1d32-4525-9525-6b78cc4519c8
Fəzail Rəhim oğlu Ağamalı,11524923-a67d-4698-afbc-7f48f557013c
Gövhər Baxşəli qızı Baxşəliyeva,5a047ee0-396b-42b3-8dd5-2dd2445302c9
Hacı Hacıbaba oğlu Salayev,5b3fae1a-4c16-4960-86b4-95cc54bca1e6
Hadı Musa oğlu Rəcəbli,35f8cc6d-7812-40a9-a98c-ae1ee124d105
Hikmət Baba oğlu Məmmədov,e81a559e-8887-4308-b68a-0a1fa95cd204
Hikmət İsmayıl oğlu Atayev,d484d0c7-5359-4cbb-96e2-5b6e67a86e2c
Hüseynbala Fazil oğlu Mirələmov,086891bd-d554-46bc-8a89-72447a7b9e64
İlham Kazım oğlu Məmmədov,22513665-5fe7-4561-8b18-8119be9b3c58
İlham Əlisəftər oğlu Əliyev,dd0829c9-995b-4a46-9f96-4e471b48fc8b
İmamverdi İbiş oğlu İsmayılov,344e6581-8fc2-4699-b038-403146862dba
İqbal Nəriman oğlu Məmmədov,6983a970-bc0d-48a1-a96a-b67083ba6da7
İsa Əkbər oğlu Həbibbəyli,24925dd2-e788-4f65-a504-f8b106a5cd75
Jalə Fazil qızı Əliyeva,62feac80-79ab-4040-9dbf-525285f7a66f
Kamaləddin Nəsrəddin oğlu Qafarov,184f1543-f799-47da-bebe-4b830fed7a4f
Kamilə Əli Ağa qızı Əliyeva,08786b7a-79c1-4e2d-9017-024a5ec92f98
Kamran Fərhad oğlu Bayramov,c6380ddf-8eb7-468a-942f-9e808c32cba6
Kamran Telman oğlu Nəbizadə,60b6bc69-7f88-48ba-bbf6-20089eaa1d0a
Madər Ələsgər oğlu Musayev,13e104c6-7e56-4820-8da3-65411b32817b
Mahir Məhəmmədəli oğlu Aslanov,394948f8-119f-4299-a5bc-0142a41f0f18
Mahir Tapdıq oğlu Abbaszadə,b7d98a56-fd76-432d-a40a-0ff48a33ad44
Malik Əvəz oğlu Həsənov,b691dd1a-c4e0-4822-8da5-402caa49a8a6
Mehriban Arif qızı Əliyeva,35d146ec-59d6-4416-8a83-ef5f0ac77bf9
Mirkazım Mirməhəmməd oğlu Kazımov,5d7486a2-313d-4625-a34f-98ecc655e9ee
Mirzəcan Mirzəmməd oğlu Xəlilov,8dfb02cf-ea52-47bf-a5c4-c880eb13b0dc
Mixail Yuri oğlu Zabelin,798c031c-064c-43ba-95b1-09c3ecc1e674
Musa Cəfər oğlu Qasımlı,6c8c887c-9753-495a-8231-fc37a22b8b46
Musa İsa oğlu Quliyev (Urud),050597f1-7eaa-46cc-b5ca-53be7cb9a63b
Muxtar Bahadur oğlu Babayev,de46ebbb-706b-4d73-ad64-2d3e829878ae
Mübariz Qəhrəman oğlu Qurbanlı,cdae0fdb-0232-4414-98c4-de562a3a7664
Müslüm Mürsəl oğlu Məmmədov,40f4029b-1945-46f7-aac8-8e3072e6e07f
Məlahət İbrahim qızı Həsənova,a0ea6d40-6fe8-4ed0-94cc-e3145d61d4d4
Naqif Ələşrəf oğlu Həmzəyev,f53a5c4b-35cb-4e8f-a618-d3b893e52d30
Nazim Fərəc oğlu Fərəcov,e41f18f9-2720-49e5-8510-705f110b3f1e
Nizami Qulu oğlu Cəfərov,81ceee68-0b97-4908-95bf-b82f1a5499ae
Novruzəli Davud oğlu Aslanov,afacfad3-d197-4708-8d90-7c0df9bfd69f
Nəriman Əlibala oğlu Əliyev,b27a85d5-f361-4b5a-9405-62901b5ec542
Nəsib Məhəmməd oğlu Məhəməliyev,6aa79fa0-3b0a-4af9-a540-7baf5fd31b2d
Oqtay Sabir oğlu Əsədov,5f64683a-3a12-42f5-9ae9-cbc04afe63dc
Pərvin Orxan qızı Kərimzadə,d33f69ff-b49a-4c36-a7d3-46c4cd146678
Qüdrət Müzəffər oğlu Həsənquliyev,4469d3b6-7848-4f82-803c-c20d4cc1ab56
Qənirə Ələsgər qızı Paşayeva,1ecaf6ac-5b25-4199-930e-c983a127126f
Rafael Baba oğlu Hüseynov,63225379-3c0b-420f-8f78-da68df5706ec
Rafael Kamil oğlu Cəbrayılov,b2c2e568-9027-4a56-85a4-b1af678f8b7b
Rafiq Musa oğlu Məmmədhəsənov,76ebbef9-23e1-41b7-bf33-d91e868faa48
Rasim Nəsrəddin oğlu Musabəyov,4254e5bf-ea4d-49e5-9e52-ca17efddda30
Rauf Asif oğlu Əliyev,a73cbffb-4e6d-4d33-8245-8c15a238309a
Rövnəq İbrahim oğlu Abdullayev,ca312331-4ebf-4996-b232-34586d02b3b5
Rövşən Şükür oğlu Rzayev,e04fc4ea-73ba-426d-a661-633ffc5b70f6
Rüfət Atakişi oğlu Quliyev,130fb31b-6b8f-466e-b75b-e21b90203cd8
Rüstəm Gülabba oğlu Xəlilov,41b85286-bc1b-4176-8492-075d2a8a3512
Rəbiyyət Nurullah qızı Aslanova,53b590fd-b239-4189-b323-006b60b57959
Rəşad Məmmədqulu oğlu Mahmudov,d0d3f088-4b8f-4fd2-a173-c9c95f488393
Sabir Kamal oğlu Hacıyev,3e26a4b0-0613-45ca-b8d5-bdb809f52d5a
Sabir Xudu oğlu Rüstəmxanlı,fe9c4f29-f85e-4f7b-8daa-c0aeed012172
Sahib Eyvaz oğlu Alıyev,56f0d4bf-9a74-4256-b610-f76e29a549e7
Sahibə Əli qızı Qafarova,dae674f6-6acc-4a74-9ce8-567dde445e7b
Sevinc Həbib qızı Fətəliyeva,dcfe7511-5e34-4e99-b827-15d3ce3b5155
Sevinc Əmirəhməd qızı Hüseynova,07aeab51-65a9-42dc-85c1-7b88fefda70b
Siyavuş Dünyamalı oğlu Novruzov,665e5f70-4eab-486c-8f14-0878c3c18689
Sona Sakit qızı Əliyeva,6b44bcee-efa0-41e1-9736-2d758ebf5484
Sədaqət Süleyman qızı Vəliyeva,26326da2-f725-48a3-b053-5e24b2ec5952
Səməd İsmayıl oğlu Seyidov,d90cad42-6118-4a3b-855b-170416fc1071
Səttar Suliddin oğlu Mehbalıyev,ab8faf8e-7bee-4eda-8092-16a58c1ff708
Tahir Famil oğlu oğlu Mirkişili,7af6f8d7-6e87-4e69-8f0d-eac6551f77b8
Tahir Musa oğlu Rzayev,191436dd-2360-4ef3-9a73-b7a6aa6fb25e
Tahir Süleyman oğlu Süleymanov,1ddf110f-53d7-4d9a-aad7-b7a517d23488
Tahir Zayıdağa oğlu Kərimli,1cdec86d-9543-459e-ad44-4b3e7663e088
Vahid Qazməmməd oğlu Əhmədov,8ca1f239-ec4f-44a3-8925-c86f05fae817
Valeh Feyruz oğlu Ələsgərov,5ba35e6a-5983-4c94-8355-164abd5600f9
Vasif Yusif oğlu Talıbov,25167bf6-a1d0-40ff-b1a7-f60683c25474
Vüsal Əfqan oğlu Hüseynov,3c5df445-e0f6-4580-960d-c5ee364114bf
Xanhüseyn Hüseynağa oğlu Kazımlı,5d006cb6-09a3-45f6-b68b-420601ebd9d6
Xanlar Nuru oğlu Fətiyev,902aa93e-a346-4de3-8ffa-ea7d58b1ff9a
Yaqub Mikayıl oğlu Mahmudov,584c7d0f-0b83-423d-89ce-5deb46884375
Yevda Sasun oğlu Abramov,47f7ca03-a26f-4a56-bc8b-c3a07b1016ad
Zahid Məhərrəm oğlu Oruc,841af6ab-ef4a-4c7c-9970-c1af14577c73
Zeynəb Yəhya qızı Xanlarova,14e50ab2-6469-4543-9684-626a3c4842ca
Ziyad Əliabbas oğlu Səmədzadə,bd050d79-b112-4905-9e46-a5f706279748
Ziyafət Abbas oğlu Əsgərov,edc7cd19-d367-4ec1-975a-1b2bb626b843
Çingiz Aşralı oğlu Qənizadə,4d7f6c04-ff92-4c93-b4f5-88bd2f3664df
Ülvi Zahid oğlu Quliyev,93ba9563-b209-4fb1-84f7-f47e5966922a
Ülviyyə Cavanşir qızı Ağayeva,41879f17-cdc4-4bf1-b4ba-bad19f4d14ee
Ülviyyə Tapdıq qızı Həmzəyeva,8887f0b4-a016-48e6-9526-9ddd0949d00a
Şahin Əmir oğlu İsmayılov,0e55420f-e8ee-427b-863c-778affe29aa3
Şəmsəddin Hümmət oğlu Hacıyev,007e219f-ad84-4b87-9eaa-ad56e2d6c252
Əflatun Əhməd oğlu Amaşov,799971f0-0228-440e-a135-ca73fd27897f
Əhliman Tapdıq oğlu Əmiraslanov,731d79f1-67f2-4dd8-83c9-498764c9ee85
Əli Cavad oğlu Əhmədov,9faefca7-872c-4de1-9ba1-c4f730a75f18
Əli Məhəmməd oğlu Hüseynli,d6f701b0-552a-408c-a9e1-6a5178a9cfca
Əli Məhəmməd oğlu Hüseynov,6e23396d-753a-4c7a-81d7-13dbc10a43ae
Əli Əhməd oğlu Məsimli,50b642a5-0958-44af-abaf-c349440870c4
Əliağa İzzət oğlu Hüseynov,6b543ad8-ea72-42e8-90b1-848d6892e672
Əsabil Qarakişi oğlu Qasımov,43572d5f-2e8c-4e27-9ba1-25727d3edca6
