name,id
Adil Abış oğlu Əliyev,159fbf2b-98e5-4a85-97a9-c5988ab6faab
Aqil Məhəmməd oğlu Abbas,43381b3a-c7d9-4ef7-b286-260fb64ccfeb
Aqiyə Həbib qızı Naxçıvanlı,89b88fd7-3109-4344-bd62-4a0f27cb091a
Araz Məmməd-Mübariz oğlu Əlizadə,f632560e-c98e-48b0-ad8b-6f81bbb5351b
Arif Qafar oğlu Rəhimzadə,ef4f2d3c-db62-4aa0-a9bd-251272f1896a
Asim Nazim oğlu Mollazadə,b8a78c23-d13a-4948-88bb-9dd57a7ed260
Aslan Məmmədhüseyn oğlu Cəfərov,387626c8-af06-4455-ace7-ca420a6cca75
Astan Nuşrəvan oğlu Şahverdiyev,212401de-9544-4ba9-9c69-d6344117f1e1
Aydın Böyükkişi oğlu Mirzəzadə,3b3d673c-f5c1-4b72-ad95-c49b73841111
Aydın Nəsir oğlu Hüseynov,dab309e1-449b-4d57-8302-618354e911b2
Aytən İnqilab qızı Mustafazadə,74beca60-9274-46a6-a948-9f67604a8ff0
Azay Əjdər oğlu Quliyev,106ec1b9-f7d5-49de-9598-807e056df91e
Azər Camal oğlu Badamov,0ace2063-9299-484f-bd2e-e42ec5a919b4
Azər Şəmşid oğlu Kərimli,422e85e2-a538-41e6-92c8-679253a8335c
Ağacan Qulam oğlu Abıyev,d075b906-598e-4cc5-81c0-5928a7097156
Ağalar İsrafil oğlu Vəliyev,607b1c59-74d9-4510-8e90-424d37989b42
Bahar Əvəz qızı Muradov,181eac47-7bad-46bd-8f86-5cb96d80feac
Bahar Əvəz qızı Muradova,6d39a18d-29fa-4323-9193-53fbd3018248
Bəxtiyar Həmzə oğlu Əliyev,fcb1c624-2f23-4559-abbc-13caca6bac5d
Bəxtiyar Yusif oğlu Sadıqov,00953390-7f5b-4123-bb20-83bff40d071d
Cavanşir Hümmət oğlu Paşazadə,8430cf75-eb88-45f2-8da4-62c56ccb9653
Cavanşir Əyyub oğlu Feyziyev,8388b901-5a53-4971-b712-4ec693c0075a
Cavid Həmid oğlu Osmanov,47c9e757-74c4-48e5-a91c-ce944e4c267a
Cavid Qənbər oğlu Qurbanov,20344dce-86b2-450f-97ab-11ea2f33ea06
Ceyhun Yunis oğlu Osmanlı,a2e1e72c-c0d9-4760-b471-19864de10a97
Cəlal Əlirza oğlu Əliyev,67f9c16f-8ba0-45b8-a775-8fa2a9e8cc74
Dilarə Məmmədağa qızı Cəbrayılova,e453c85c-c305-4250-8768-3772626a6cde
Eldar Allahyar oğlu Quliyev,7c62b42f-dea2-41c1-a6f0-438d81c4ca46
Eldar Rza oğlu İbrahimov,7eabe24d-8b8c-4371-aa0d-22fdd2a1605d
Eldəniz Adil oğlu Səlimov,cf7c5cbc-6f44-4671-a00f-7867e89e4ca7
Elman Camal oğlu Məmmədov,95edf37c-981c-4ab2-801d-8050652e8738
Elman Xudam oğlu Nəsirli,b1ca72d4-759c-4fcc-a0f9-cf84a7719479
Elmira Hüseyn qızı Axundova,bd26dcb7-11c9-4955-86da-2b506a57bb0e
Elxan Sirac oğlu Süleymanov,1b5c0e00-b3e1-4b9e-ada1-d26e7c3e4a75
Elçin Bəybala oğlu Quliyev,ee9785c4-11e2-45ba-91b9-dbc42097bc11
Elşad Eldar oğlu Həsənov,851dd97f-0e7a-4093-97f7-fdd144532ae0
Elşən Məmmədhənifə oğlu Musayev,d9493e1f-b925-462c-9cd7-bb93a660b1f3
Fazil Qəzənfər oğlu Mustafa,7327614f-6bb6-4966-ba9b-00251cee5f55
Flora Qasım qızı Qasımova,341fd8f8-6571-4225-a5e1-ab5924597777
Fuad Rauf oğlu Muradov,0390ee43-9f76-4bc5-992c-8545f28396ab
Fərəc İbrahim oğlu Quliyev,2907dcc3-f469-4d66-a293-27265179b459
Fəttah Səməd oğlu Heydərov,7c3340b9-d365-4d15-a6eb-7c1878840bb1
Fəzail Feyruz oğlu İbrahimli,48451670-2867-4b62-ae65-dbf895f7e1ac
Fəzail Rəhim oğlu Ağamalı,17f9aeea-9a69-4f7f-8ab9-21c0a7067190
Gövhər Baxşəli qızı Baxşəliyeva,9fac65e5-14c9-4067-823e-20138dd6efed
Hacı Hacıbaba oğlu Salayev,5853e165-4b67-4704-8ede-04d12407a27f
Hadı Musa oğlu Rəcəbli,89f1a23a-c109-46ff-8feb-58030fdec220
Hikmət Baba oğlu Məmmədov,b9f67e15-73b3-4b53-b02a-b439d41ad894
Hikmət İsmayıl oğlu Atayev,d3ce9383-e5d0-45a4-856c-95d3f347a6bc
Hüseynbala Fazil oğlu Mirələmov,e3a34731-01ba-478d-bb18-a237fbaac910
İlham Kazım oğlu Məmmədov,fe688402-09f8-4015-ba2a-a39818485a3b
İlham Əlisəftər oğlu Əliyev,d10c0261-28c5-4e6e-9d58-fe426cc2c019
İmamverdi İbiş oğlu İsmayılov,5ee7a636-a7de-40e2-93e6-570ad90f1285
İqbal Nəriman oğlu Məmmədov,e5d68cda-09c5-4209-8223-285d0008eff7
İsa Əkbər oğlu Həbibbəyli,78e4dc0b-0cd6-4cc3-a26f-52d62142c625
Jalə Fazil qızı Əliyeva,92a4e690-1ac4-4b2d-8cea-3b4ef30f4c39
Kamaləddin Nəsrəddin oğlu Qafarov,41b72c38-ac77-4950-b4ac-14a19d89e543
Kamilə Əli Ağa qızı Əliyeva,f193bde0-8e16-4ff5-9c2a-e6576c780820
Kamran Fərhad oğlu Bayramov,7f51d276-0f4f-4360-a55d-c8e40a7b55b4
Kamran Telman oğlu Nəbizadə,d8f7bcf7-fd23-427c-ba5e-7cc5a696b027
Madər Ələsgər oğlu Musayev,460fad44-b14e-450e-b984-19186c782f5b
Mahir Məhəmmədəli oğlu Aslanov,1516ad38-3f17-4ab9-a348-e5f9f6126306
Mahir Tapdıq oğlu Abbaszadə,f99fdefb-d99c-430f-9f5e-3b24449ed9e9
Malik Əvəz oğlu Həsənov,b4cd79e4-e839-45f7-8d04-cf89bc55ae87
Mehriban Arif qızı Əliyeva,e0f5d315-d4ad-4b1e-b848-16a5796721ea
Mirkazım Mirməhəmməd oğlu Kazımov,98636415-d980-46cb-b0a9-afa018e24543
Mirzəcan Mirzəmməd oğlu Xəlilov,781adc7b-2c2f-4b71-80de-3ceccf31dff8
Mixail Yuri oğlu Zabelin,e664ba2b-a07a-4a04-ad2e-48f27f412224
Musa Cəfər oğlu Qasımlı,7e32add2-9072-4f0d-b58d-401c4eba6404
Musa İsa oğlu Quliyev (Urud),62a9ed2c-42ce-43aa-a197-5d3245a9bef5
Muxtar Bahadur oğlu Babayev,32ab210d-e057-41f1-ab29-ea64c37d98fc
Mübariz Qəhrəman oğlu Qurbanlı,3a3f0ab6-09bd-484b-baf7-68b605ff9a49
Müslüm Mürsəl oğlu Məmmədov,fd05b457-7e79-4ce3-8b9e-ee576eccbe1d
Məlahət İbrahim qızı Həsənova,93c0429d-1cb8-415e-b644-d83fade45301
Naqif Ələşrəf oğlu Həmzəyev,0b3000e1-1062-4a99-a89b-96f5ba7a86f4
Nazim Fərəc oğlu Fərəcov,2bc24fb2-7831-43e0-891f-b5446ebae134
Nizami Qulu oğlu Cəfərov,a61af4a2-8361-4860-8eea-4bad8d6ca76e
Novruzəli Davud oğlu Aslanov,47c0818c-0d9d-4d2e-ad93-6a6159a56542
Nəriman Əlibala oğlu Əliyev,93bd3513-a60c-4aea-bb00-3680f4c5cf0d
Nəsib Məhəmməd oğlu Məhəməliyev,6427f2a5-d91b-424a-bd96-ba436f23ede0
Oqtay Sabir oğlu Əsədov,ad58ca3f-e917-405a-ac54-297250f9c275
Pərvin Orxan qızı Kərimzadə,02e76d3e-e535-44c4-9624-b1da63f03836
Qüdrət Müzəffər oğlu Həsənquliyev,2b949768-3c5f-409b-8b44-6adbb09fe55a
Qənirə Ələsgər qızı Paşayeva,725fc003-ef75-4d1a-8013-7f58bee82cfe
Rafael Baba oğlu Hüseynov,337037d5-c9ce-481c-91b9-23e7f38760fa
Rafael Kamil oğlu Cəbrayılov,8820130f-d1e9-46ca-8651-6be8b82bf03c
Rafiq Musa oğlu Məmmədhəsənov,6c1907a7-9d1e-4678-b54c-b17620190bdf
Rasim Nəsrəddin oğlu Musabəyov,66d254e6-8ee8-4ac9-adc4-76a695985066
Rauf Asif oğlu Əliyev,2bdec8d8-033a-44c7-bbe5-1bb31c0be030
Rövnəq İbrahim oğlu Abdullayev,d50db993-db0a-43f0-a6dc-0a279acb8350
Rövşən Şükür oğlu Rzayev,fecfb76a-d5a8-4091-a797-6250e8457e3f
Rüfət Atakişi oğlu Quliyev,8d8c9966-d703-4327-9e27-57eef668739a
Rüstəm Gülabba oğlu Xəlilov,0eb5bb68-fec9-447d-a6a1-648d697db7de
Rəbiyyət Nurullah qızı Aslanova,44d75dae-a680-45cc-86fa-ce0d9841335d
Rəşad Məmmədqulu oğlu Mahmudov,5e53a486-bc83-4571-a7c0-0a61907b040e
Sabir Kamal oğlu Hacıyev,4f7088f4-4c1a-4d64-aa96-4c064e1a97e8
Sabir Xudu oğlu Rüstəmxanlı,117d7c88-6088-4266-b05e-377fe02e3358
Sahib Eyvaz oğlu Alıyev,4fb21e1d-14dc-4244-9a06-55fe1cdc0d3b
Sahibə Əli qızı Qafarova,4888ebe1-0cb0-4a29-8527-67742ad02b9b
Sevinc Həbib qızı Fətəliyeva,bad398d1-7647-4db3-b696-96484084c005
Sevinc Əmirəhməd qızı Hüseynova,421b15f7-47c7-41e5-a8bd-7b45a41fd18a
Siyavuş Dünyamalı oğlu Novruzov,9876101a-fea9-438a-ac7d-671d6e3238e3
Sona Sakit qızı Əliyeva,c16e7031-087b-4752-94fc-926daac046d8
Sədaqət Süleyman qızı Vəliyeva,e62f5475-14ac-45db-a4d7-4ae2dd89ec16
Səməd İsmayıl oğlu Seyidov,ea0748d0-13fb-4998-ae29-78f2f63f3ef2
Səttar Suliddin oğlu Mehbalıyev,3ec2f301-59bf-4516-92f3-4ce0dbbbe905
Tahir Famil oğlu oğlu Mirkişili,3da4f2c4-8f9e-43fd-bbb1-ff89af85b322
Tahir Musa oğlu Rzayev,54451489-f9d2-4c08-9e2d-7d682daf5d7d
Tahir Süleyman oğlu Süleymanov,72eda7ff-da34-4344-b58f-9f92e3d85986
Tahir Zayıdağa oğlu Kərimli,8761e103-f90e-4e91-8a3c-61f52ca827d2
Vahid Qazməmməd oğlu Əhmədov,b5613a05-83fa-40fc-8305-fd2d9520a277
Valeh Feyruz oğlu Ələsgərov,e5b7d1a7-f6cf-48a3-9887-7575f5e4ccc2
Vasif Yusif oğlu Talıbov,27919bab-8256-4d6d-87e9-9f57e9cc0823
Vüsal Əfqan oğlu Hüseynov,a9a610da-bffa-4149-92d8-45b25506cd97
Xanhüseyn Hüseynağa oğlu Kazımlı,d7cf2e93-7dcb-424e-bcf3-0d351e93b376
Xanlar Nuru oğlu Fətiyev,a0ec784f-4241-4262-b4fc-eb8fee4da451
Yaqub Mikayıl oğlu Mahmudov,bbbe5e3a-a3bc-4756-bbb7-95fdcbda2963
Yevda Sasun oğlu Abramov,1bb9fbf0-01e7-4835-b667-16afebcabbc1
Zahid Məhərrəm oğlu Oruc,1226ac39-608c-4b5a-8e3c-70cc98f33597
Zeynəb Yəhya qızı Xanlarova,1ea68dfe-38bd-478b-a932-29fefd4fa3d5
Ziyad Əliabbas oğlu Səmədzadə,6b664f7a-373e-4513-a325-b0c69d4a3274
Ziyafət Abbas oğlu Əsgərov,5ac71872-5498-4241-a712-7ae04a91a69f
Çingiz Aşralı oğlu Qənizadə,5eb34051-e0f4-46a7-b6c4-df6df319eb99
Ülvi Zahid oğlu Quliyev,97b4116e-53c3-4f46-b950-8d681787f59e
Ülviyyə Cavanşir qızı Ağayeva,b9c911aa-2529-4c37-82a8-2e43fa2a6ba6
Ülviyyə Tapdıq qızı Həmzəyeva,821776a7-f477-4ec7-bd13-467010ed1971
Şahin Əmir oğlu İsmayılov,58dcb06f-a9e5-4f8f-9f73-e33fe3d9c0b7
Şəmsəddin Hümmət oğlu Hacıyev,cec6ca2c-b263-4f7d-9a6e-80a837fdbfd6
Əflatun Əhməd oğlu Amaşov,9a2de70c-d64e-4867-85d9-f34e2e002502
Əhliman Tapdıq oğlu Əmiraslanov,a513261b-8513-4ce7-a02b-bae9717d3606
Əli Cavad oğlu Əhmədov,f7a7f745-0bf6-43dd-88e9-c615691796b3
Əli Məhəmməd oğlu Hüseynli,5164aa0e-1c9e-4334-8b1f-f73e211ec86e
Əli Məhəmməd oğlu Hüseynov,3fcc94d1-1dbc-4f09-bf41-58bc7ea7c9f5
Əli Əhməd oğlu Məsimli,bc28cb9a-c752-443d-800a-bf5fc66ee4f5
Əliağa İzzət oğlu Hüseynov,a97d4512-7b87-4566-85e6-33a4f47e5042
Əsabil Qarakişi oğlu Qasımov,7f324f82-27d0-46f9-84ea-3d8304b9cf1e
