name,id
Adil Abış oğlu Əliyev,2bd733f9-fb90-4d3b-aeb8-ffc11bc9680f
Aqil Məhəmməd oğlu Abbas,100f0777-712f-4c1b-920c-f4b54c396ebe
Aqiyə Həbib qızı Naxçıvanlı,bd7a744d-ab64-47be-a9ef-29a8c12607f2
Araz Məmməd-Mübariz oğlu Əlizadə,f5bd8c6e-7480-4f93-b88b-7b884a43b573
Arif Qafar oğlu Rəhimzadə,0e393ce6-1f00-4710-8e16-b667eacc439d
Asim Nazim oğlu Mollazadə,4a4c5324-ef9b-458d-b910-e156dd5daa53
Aslan Məmmədhüseyn oğlu Cəfərov,b2b984e5-12ee-4d9d-95ee-89ffc6277b82
Astan Nuşrəvan oğlu Şahverdiyev,a58081d7-935d-47ff-acfd-23ef8b62ba81
Aydın Böyükkişi oğlu Mirzəzadə,c9b88071-3b4b-4c20-bbdd-c52c80fb56c1
Aydın Nəsir oğlu Hüseynov,f3c1a8ae-3023-47b1-86cb-79ec20f48e40
Aytən İnqilab qızı Mustafazadə,9ffbf724-5e63-484d-b9e6-0dd31a28cf15
Azay Əjdər oğlu Quliyev,93b9d5ad-ee05-4969-ad8e-2d3691655e8e
Azər Camal oğlu Badamov,797c8a22-e49f-4598-a337-26f6212976ec
Azər Şəmşid oğlu Kərimli,f09c5440-c0f7-4f68-beac-1e100b1add9b
Ağacan Qulam oğlu Abıyev,e4111645-0ade-4872-9359-01eece751e47
Ağalar İsrafil oğlu Vəliyev,9ba2a7ea-26ff-436f-812c-87383908b5da
Bahar Əvəz qızı Muradov,6058cce4-bceb-4f4b-a26c-d784770f10c0
Bahar Əvəz qızı Muradova,3cc02a9c-1786-4918-8fe6-c1d4e3742403
Bəxtiyar Həmzə oğlu Əliyev,f70d90b5-ac74-41cc-9a4e-1c6539ff8480
Bəxtiyar Yusif oğlu Sadıqov,635834e4-9f5c-41e6-a171-22036ef7afb6
Cavanşir Hümmət oğlu Paşazadə,1ddf4dd3-3d51-4495-9e71-1d374220c4eb
Cavanşir Əyyub oğlu Feyziyev,04a050b5-3b0c-4747-8579-05d9ea3365e4
Cavid Həmid oğlu Osmanov,d84b5ea6-4a81-4b7d-ba56-0fe9c5c09e04
Cavid Qənbər oğlu Qurbanov,28e3b6f2-c2fe-4822-acca-0196b6ab1e5c
Ceyhun Yunis oğlu Osmanlı,9cfaf0af-5663-4cf2-971a-15ddd463bdbf
Cəlal Əlirza oğlu Əliyev,b94ee021-b109-44be-a1f7-6c3f778f71ce
Dilarə Məmmədağa qızı Cəbrayılova,edb608b0-cd6a-4d35-a4fb-0304c107d35d
Eldar Allahyar oğlu Quliyev,87b1d2af-ff96-4f5d-832c-94c163a9bbe3
Eldar Rza oğlu İbrahimov,8565d282-c06e-42de-bc73-0d049c3d73d4
Eldəniz Adil oğlu Səlimov,c2d71cff-5570-450c-81ab-390971b396ef
Elman Camal oğlu Məmmədov,116f1592-ed11-4c7a-8080-ee811fd0cb81
Elman Xudam oğlu Nəsirli,4186ad06-9ff5-4423-9620-14441da293e4
Elmira Hüseyn qızı Axundova,10f2e1c3-d6ad-4084-8331-6224ba666502
Elxan Sirac oğlu Süleymanov,cb414f8f-f688-4740-8754-7370c851b10d
Elçin Bəybala oğlu Quliyev,577ce921-4c9d-46ec-bbb4-15a2c226cfaa
Elşad Eldar oğlu Həsənov,7ea83301-577a-47fe-a5c9-0e83f10c463c
Elşən Məmmədhənifə oğlu Musayev,738c8e56-c24e-4c4c-a4bd-3b498e6699ad
Fazil Qəzənfər oğlu Mustafa,0a071839-51b5-4f36-a7f5-a757931034bf
Flora Qasım qızı Qasımova,202da1b0-d71d-4193-89de-7d914cfa91e1
Fuad Rauf oğlu Muradov,ab521ab9-a056-4f45-910b-b595cbeb2d7b
Fərəc İbrahim oğlu Quliyev,96d0febd-2e50-417e-baeb-77f5e5d9fc38
Fəttah Səməd oğlu Heydərov,e8d9d04f-2461-4795-a5e5-76f239e809b9
Fəzail Feyruz oğlu İbrahimli,7a91cc4a-c40e-47f0-b72c-32c38e7cc891
Fəzail Rəhim oğlu Ağamalı,ee54bf10-800f-478f-ac24-c1c71c7333c3
Gövhər Baxşəli qızı Baxşəliyeva,b6973355-1c4f-425d-b2b4-3b7eb127d99f
Hacı Hacıbaba oğlu Salayev,05c9edc7-97c7-420c-9824-dbe9a21c1bff
Hadı Musa oğlu Rəcəbli,2a25924d-511c-4ff6-b4b0-fcb36a13a0dc
Hikmət Baba oğlu Məmmədov,2850f122-3c71-45e4-9180-ab30e10729b9
Hikmət İsmayıl oğlu Atayev,5e24f6a2-9229-43d0-ba1e-a7d33db11f3c
Hüseynbala Fazil oğlu Mirələmov,b986003f-fa57-49bd-befa-e59a21b6daf5
İlham Kazım oğlu Məmmədov,0ac7d7a8-4a4d-4fd7-8dcf-ed45f58996d4
İlham Əlisəftər oğlu Əliyev,4b1a0ccb-bcaa-4d1d-9c6a-b7612d58b237
İmamverdi İbiş oğlu İsmayılov,3ecbae09-773a-4c35-ac5d-b239c7c58b63
İqbal Nəriman oğlu Məmmədov,fe518f35-b04a-41be-9b32-3ce903fe14ca
İsa Əkbər oğlu Həbibbəyli,20ad55c2-4752-45a1-b5e9-9db5b8e83f9c
Jalə Fazil qızı Əliyeva,59d159c2-a57c-4800-982a-635d5e886b3d
Kamaləddin Nəsrəddin oğlu Qafarov,1a4ea1bf-6197-45fe-9c2b-0ac0f6d844df
Kamilə Əli Ağa qızı Əliyeva,d62dc246-fa0c-4612-be4a-8329a6d6b13f
Kamran Fərhad oğlu Bayramov,c12104c0-5008-405f-900d-ed77f65b27eb
Kamran Telman oğlu Nəbizadə,c9918bdc-e80d-4cf8-b2e8-79e502bec2e0
Madər Ələsgər oğlu Musayev,ff0062cd-0486-4382-affe-aa3a2285a101
Mahir Məhəmmədəli oğlu Aslanov,89021f51-19ee-4379-99b9-db3b69bf06fd
Mahir Tapdıq oğlu Abbaszadə,75cf0d4f-bb4e-4db5-b65c-53a8a3d25372
Malik Əvəz oğlu Həsənov,3a20f655-2f1d-4b71-901f-549117c41332
Mehriban Arif qızı Əliyeva,8d450e08-8b8c-4064-87aa-461b3af04666
Mirkazım Mirməhəmməd oğlu Kazımov,f5b66702-dc40-4746-bb8b-c753b565d1e7
Mirzəcan Mirzəmməd oğlu Xəlilov,ca8a4387-105f-4c7b-91c8-0564742ddf51
Mixail Yuri oğlu Zabelin,80043271-333d-4748-a57a-0b13f28a5669
Musa Cəfər oğlu Qasımlı,bc4fba98-9adc-4b22-82d1-20a53159b7fc
Musa İsa oğlu Quliyev (Urud),ec5e3323-db88-468a-bac5-63ba6d71a346
Muxtar Bahadur oğlu Babayev,89016645-e1ee-45f9-834d-446f758038e3
Mübariz Qəhrəman oğlu Qurbanlı,baf615e2-c5ce-479f-8e66-5e79b335aea4
Müslüm Mürsəl oğlu Məmmədov,6a5d9761-5d94-4428-aee3-5dcc48c23b5f
Məlahət İbrahim qızı Həsənova,a68789d0-c0c2-44df-bd68-6f8337c57ab9
Naqif Ələşrəf oğlu Həmzəyev,263f2c61-1b65-489c-ad5e-6d88d10a4f16
Nazim Fərəc oğlu Fərəcov,cfe34ab4-3fd7-40c0-875f-b5d3f6e90024
Nizami Qulu oğlu Cəfərov,150d7f41-1a7d-49d9-b98e-15afa619935a
Novruzəli Davud oğlu Aslanov,ba5531eb-055f-4518-91a3-6cd692c6450d
Nəriman Əlibala oğlu Əliyev,30524bb0-b30c-4bff-82fa-b4784a4582f2
Nəsib Məhəmməd oğlu Məhəməliyev,40c3ae35-c329-4236-b3d4-3b1db14fa5f7
Oqtay Sabir oğlu Əsədov,e473b377-21e1-48f4-99d1-432d9ff7f981
Pərvin Orxan qızı Kərimzadə,d5751b5f-9aca-469c-aef7-17e982aeb1bf
Qüdrət Müzəffər oğlu Həsənquliyev,a7d97701-cdb3-4168-9c4a-27a5026d4e3e
Qənirə Ələsgər qızı Paşayeva,4404bb2c-29db-466b-9cb8-93b8a5c44ec0
Rafael Baba oğlu Hüseynov,75872e2f-7a47-4c91-b697-158970bddc62
Rafael Kamil oğlu Cəbrayılov,214d24ff-0228-4f51-b54b-0c94e750df88
Rafiq Musa oğlu Məmmədhəsənov,c292fec4-a5b2-4f7e-aadf-9bb1defdfcc1
Rasim Nəsrəddin oğlu Musabəyov,a91c800b-5879-4856-ae19-8503b5c52639
Rauf Asif oğlu Əliyev,03dc3329-016a-4448-a2cf-66c016d52a2f
Rövnəq İbrahim oğlu Abdullayev,aa1a4a1b-14d7-43f4-a92f-3c0fb8bb7438
Rövşən Şükür oğlu Rzayev,52092fe7-3909-467c-85a2-270a2ffea6c8
Rüfət Atakişi oğlu Quliyev,6e03a617-dbdf-4d39-bf4c-70fb7d5702f9
Rüstəm Gülabba oğlu Xəlilov,3aefc115-533e-4a6b-b2ed-76d36ccaef29
Rəbiyyət Nurullah qızı Aslanova,3de4ec01-7485-4613-a306-2353c7cd96a6
Rəşad Məmmədqulu oğlu Mahmudov,3adf35e3-c09a-40a5-8255-316342f8106a
Sabir Kamal oğlu Hacıyev,0f53ed2f-e3b1-4bde-adf2-5e540297c57c
Sabir Xudu oğlu Rüstəmxanlı,cd1898a2-f9ab-406d-b856-3d53632e0fb6
Sahib Eyvaz oğlu Alıyev,52f58725-71eb-46c3-8f43-45dcab2bd48f
Sahibə Əli qızı Qafarova,dd5d3de5-66c0-4062-a4a2-16e4f605cc7f
Sevinc Həbib qızı Fətəliyeva,be148522-3b9a-4990-942b-e6ea2df518b2
Sevinc Əmirəhməd qızı Hüseynova,99315198-a6bd-46aa-b722-49a2c225881a
Siyavuş Dünyamalı oğlu Novruzov,24cdd296-1fe0-43cf-abef-1a077160d9f5
Sona Sakit qızı Əliyeva,e3b67b42-73e7-4a7a-a3d2-9987ba1155c1
Sədaqət Süleyman qızı Vəliyeva,f4af410e-2a98-4766-bf1d-b181acd83e8c
Səməd İsmayıl oğlu Seyidov,a9f21aef-1a9f-48cd-bac8-1eb4745e8b45
Səttar Suliddin oğlu Mehbalıyev,945109cb-e870-4f24-b65b-1c5e12f116ce
Tahir Famil oğlu oğlu Mirkişili,2e5131d7-ceec-4f72-b1b5-8c15e4e59564
Tahir Musa oğlu Rzayev,bc08958a-93d8-4b9c-a6de-bf3df59428a8
Tahir Süleyman oğlu Süleymanov,6aa9d014-5bf6-40dd-ad03-c413c487bcbe
Tahir Zayıdağa oğlu Kərimli,3df2da56-c8ce-4da4-91f5-aad5796246d5
Vahid Qazməmməd oğlu Əhmədov,5842e73f-6b0f-4f64-818c-4baffd2c5470
Valeh Feyruz oğlu Ələsgərov,c2123b55-63df-47df-afda-862bc08111bf
Vasif Yusif oğlu Talıbov,7e2d8e09-e88d-431c-ada1-9dca5c0a5925
Vüsal Əfqan oğlu Hüseynov,1b0be147-26e9-459d-83ac-b259abc30d84
Xanhüseyn Hüseynağa oğlu Kazımlı,4039336a-a55d-4a8f-9abe-7936ec3b03b0
Xanlar Nuru oğlu Fətiyev,0d038eb6-58e6-4b2c-8cd5-7b2ed69a473c
Yaqub Mikayıl oğlu Mahmudov,b73dbb0b-bd72-4c01-acf8-b4bd8bf0f72e
Yevda Sasun oğlu Abramov,af7d281c-404c-4da7-855c-d7e8c6ccd0b7
Zahid Məhərrəm oğlu Oruc,3610f827-b11a-4998-9911-d762e4e34aeb
Zeynəb Yəhya qızı Xanlarova,af6d6781-e806-42a8-9989-4185bf164373
Ziyad Əliabbas oğlu Səmədzadə,2d1f217e-88cf-44a5-8b44-aba2f10cac03
Ziyafət Abbas oğlu Əsgərov,aca03110-d202-40bf-b327-d7b8e0bd1d22
Çingiz Aşralı oğlu Qənizadə,6db86e15-77a8-4d49-b54d-2c8fca16762c
Ülvi Zahid oğlu Quliyev,ac73c4a5-bc68-4e22-9686-ea078b53b7fb
Ülviyyə Cavanşir qızı Ağayeva,3b4f4921-8ec7-4f80-a386-768fb056c316
Ülviyyə Tapdıq qızı Həmzəyeva,3b54dddf-5ff2-4579-ad8a-6d9872e21616
Şahin Əmir oğlu İsmayılov,c9ba68a5-c593-4e3c-a4c7-fa5972b4933c
Şəmsəddin Hümmət oğlu Hacıyev,9f983be5-f0c3-4290-8435-1eb8d0df1804
Əflatun Əhməd oğlu Amaşov,3adcaa89-d1df-4c00-8d79-da0831f5aa21
Əhliman Tapdıq oğlu Əmiraslanov,134d1e23-fd14-4621-b0f9-ae2120ae1e1e
Əli Cavad oğlu Əhmədov,cd350b8c-51b7-41e4-ac99-623ae1c661a7
Əli Məhəmməd oğlu Hüseynli,4c35d7e7-1096-49aa-8e22-3cb9967b262d
Əli Məhəmməd oğlu Hüseynov,26194eae-bd89-4d00-a1ae-d1fdb3bd40d0
Əli Əhməd oğlu Məsimli,75111e68-3f9f-4745-89f8-a062c8999276
Əliağa İzzət oğlu Hüseynov,090a9255-cef4-4f8d-874c-619dbd3f910d
Əsabil Qarakişi oğlu Qasımov,4e5d0687-5a11-4abd-b97c-dc84e1f51857
