name,id
Adil Abış oğlu Əliyev,27a4d7ae-2931-4aef-ae46-39d47212d2af
Aqil Məhəmməd oğlu Abbas,04e962e4-2e44-41e4-b236-11ba322601a7
Aqiyə Həbib qızı Naxçıvanlı,f46e72d3-87c2-42ca-a435-49edb59591a0
Araz Məmməd-Mübariz oğlu Əlizadə,61170ef9-e165-413c-9f4d-32a8f5b40623
Arif Qafar oğlu Rəhimzadə,0998d063-17df-4d73-a71a-46a2d461ddcc
Asim Nazim oğlu Mollazadə,8291cddd-bf3d-444f-9696-deccbeebebc6
Aslan Məmmədhüseyn oğlu Cəfərov,1aafd0d9-7f65-4aac-b943-f88ffc82961a
Astan Nuşrəvan oğlu Şahverdiyev,b523d471-f2af-42e7-b8e0-33ab1f4aaafc
Aydın Böyükkişi oğlu Mirzəzadə,5092da1f-d5b9-4761-b18b-af41ab1dd48f
Aydın Nəsir oğlu Hüseynov,8742e07e-1293-4f1d-a28a-adbe43fdc73e
Aytən İnqilab qızı Mustafazadə,5d6989bd-79c1-4ba3-8625-2cf5b70661f5
Azay Əjdər oğlu Quliyev,c449216a-c734-4345-98ec-26adf5423eab
Azər Camal oğlu Badamov,2ade65b2-1b66-4cbb-a4c5-e0f30295b0e6
Azər Şəmşid oğlu Kərimli,ab41c7c9-1f12-4b26-b094-5f243a31e95e
Ağacan Qulam oğlu Abıyev,6d5673ed-e3f1-4920-8967-fe3dc4e28210
Ağalar İsrafil oğlu Vəliyev,a899a091-28f5-48cf-9f82-b7892ca420a7
Bahar Əvəz qızı Muradov,bec5b40c-c862-4d86-93b0-805c17c61369
Bahar Əvəz qızı Muradova,9cdd208e-c3c5-4e76-9893-e29614568954
Bəxtiyar Həmzə oğlu Əliyev,2c8cb678-9148-4228-afe6-ef2f2c1b749b
Bəxtiyar Yusif oğlu Sadıqov,2e7fd99c-6ec5-4116-8257-690afae7ece4
Cavanşir Hümmət oğlu Paşazadə,0ef18fe0-6700-4f19-a95d-f27d1a687d98
Cavanşir Əyyub oğlu Feyziyev,1288d9c8-88a6-4c99-91fc-8f02dfdae9be
Cavid Həmid oğlu Osmanov,88167e3e-18db-4a4f-a12e-6c2cdf85caf9
Cavid Qənbər oğlu Qurbanov,0364a584-8944-4bf8-9ef0-d786308a97e3
Ceyhun Yunis oğlu Osmanlı,d51bf4a3-75c3-4f86-98c5-1196b3b8d473
Cəlal Əlirza oğlu Əliyev,480a05aa-f97a-4158-a902-ae4b9480b77f
Dilarə Məmmədağa qızı Cəbrayılova,fed92760-c2dc-430e-bf9d-4fd999ec16f1
Eldar Allahyar oğlu Quliyev,3a7958f1-11c2-40e0-92d8-beae1eb47316
Eldar Rza oğlu İbrahimov,e70012fc-0e44-4cc8-80a0-ed7a4cfe0546
Eldəniz Adil oğlu Səlimov,8acc477b-ea3e-4fca-b9bf-f7996c9502d7
Elman Camal oğlu Məmmədov,b7b490f9-2389-4bc8-a05e-e18effcdbc12
Elman Xudam oğlu Nəsirli,7899fe6a-11a4-486d-8822-d3bea193b968
Elmira Hüseyn qızı Axundova,40cac42d-ac5b-4945-8a34-138f5278dd1c
Elxan Sirac oğlu Süleymanov,9270fafd-6c25-4f3d-a6eb-26a443c677b9
Elçin Bəybala oğlu Quliyev,a3b671b5-96d3-45f5-ac6e-23ee473812d3
Elşad Eldar oğlu Həsənov,f357dac0-2079-41f4-a6da-8b139b07b0a6
Elşən Məmmədhənifə oğlu Musayev,2e18c5da-9787-4fbf-a262-9fb025049249
Fazil Qəzənfər oğlu Mustafa,e2d649f9-0546-4944-88fd-1539d00d7e25
Flora Qasım qızı Qasımova,93f98574-1000-4b3a-844a-26cf5c82a9ae
Fuad Rauf oğlu Muradov,0f5e507e-d690-4b2f-836a-685a69e3841c
Fərəc İbrahim oğlu Quliyev,b6abbda5-1772-4a59-9547-b4624e9ab65c
Fəttah Səməd oğlu Heydərov,9e997e06-f4a6-4394-bbe8-1cf36c8c321a
Fəzail Feyruz oğlu İbrahimli,bfe73076-6773-4171-8c7f-f2dada8e07ce
Fəzail Rəhim oğlu Ağamalı,8fd15cd6-7849-43b9-bfbf-e55c1ac13a5c
Gövhər Baxşəli qızı Baxşəliyeva,012177a6-dfa1-4adc-8d4f-ac1987957972
Hacı Hacıbaba oğlu Salayev,5bac9b4f-3fd9-489e-99a5-3f5ea9ff8975
Hadı Musa oğlu Rəcəbli,8fad36d5-bd10-4e1d-85e4-c5c1b8f38d13
Hikmət Baba oğlu Məmmədov,fb853253-645e-40d6-9288-2d48eaa47a64
Hikmət İsmayıl oğlu Atayev,966b65aa-771b-480e-b05e-9f15af49ab37
Hüseynbala Fazil oğlu Mirələmov,0480b812-2f19-4179-9399-703ed8f992a7
İlham Kazım oğlu Məmmədov,2a165fb2-d737-490c-9b9e-92eb84cdab7d
İlham Əlisəftər oğlu Əliyev,1143fb5a-83a9-4baf-b810-9a68a1e0e2a5
İmamverdi İbiş oğlu İsmayılov,b97499cb-1c92-4382-b56f-9498165d8351
İqbal Nəriman oğlu Məmmədov,a5b5d328-caf6-461b-a8f6-8b9ce09f62c3
İsa Əkbər oğlu Həbibbəyli,b1f9b7f9-7823-4128-9e6d-413a4081c167
Jalə Fazil qızı Əliyeva,b7e2eb11-c545-42fd-a517-3c3bff8742ac
Kamaləddin Nəsrəddin oğlu Qafarov,d1d1a009-5ed6-47ae-8c0a-c5c92b86df1c
Kamilə Əli Ağa qızı Əliyeva,3499e2e3-f61f-4cc1-b50d-bdd6886c9c79
Kamran Fərhad oğlu Bayramov,5ccdb54c-1fca-4b92-92f6-2501120c9728
Kamran Telman oğlu Nəbizadə,a37c6311-1c00-486c-bb64-c1b47b0a43b6
Madər Ələsgər oğlu Musayev,e963abf7-00a0-4590-be9b-ef0a00585a00
Mahir Məhəmmədəli oğlu Aslanov,0937e998-9095-45f5-a46a-da64ca9dbc94
Mahir Tapdıq oğlu Abbaszadə,9b5c4964-d010-40a4-bbaf-c7998d3ec566
Malik Əvəz oğlu Həsənov,d5ef2dcd-6af3-4068-a22d-fc0f5877ba6d
Mehriban Arif qızı Əliyeva,76cd7785-92eb-472a-a2c1-09f7835ac9bb
Mirkazım Mirməhəmməd oğlu Kazımov,a8781ff6-96dc-4238-80ad-497423688e55
Mirzəcan Mirzəmməd oğlu Xəlilov,2e3f3894-74ec-46d7-afef-c14806ad2dd0
Mixail Yuri oğlu Zabelin,e8e0f641-fced-429a-8061-1e0fc4af97cf
Musa Cəfər oğlu Qasımlı,063a4372-f187-475c-a993-fe6499d511b2
Musa İsa oğlu Quliyev (Urud),78bbe674-c831-4430-b8bf-36609baf869e
Muxtar Bahadur oğlu Babayev,9944ccb3-9418-4665-892d-14304f5b8018
Mübariz Qəhrəman oğlu Qurbanlı,6082ae9e-faf1-4a40-a07a-68360baf8483
Müslüm Mürsəl oğlu Məmmədov,8b86fc08-0e88-45ff-91c8-7c416eb837ba
Məlahət İbrahim qızı Həsənova,83c0b42b-6eac-4620-957d-3fc47e2fcb86
Naqif Ələşrəf oğlu Həmzəyev,690329d2-8618-4da7-a98f-8724292043d9
Nazim Fərəc oğlu Fərəcov,def9a75d-e9ce-414f-a595-65d8fddffaff
Nizami Qulu oğlu Cəfərov,cb3852c6-d2b3-4115-9ead-245b555e8139
Novruzəli Davud oğlu Aslanov,c231a194-b57a-4c98-9950-1405f79fb7d5
Nəriman Əlibala oğlu Əliyev,e9008bf1-abce-49e2-abac-9bbc65ccf228
Nəsib Məhəmməd oğlu Məhəməliyev,9e334f05-82d1-414d-8d1a-2f358068ef32
Oqtay Sabir oğlu Əsədov,8d1a4adf-c5dc-46cd-939e-597b365255ae
Pərvin Orxan qızı Kərimzadə,9824de82-7954-470d-a040-130aa3f49f05
Qüdrət Müzəffər oğlu Həsənquliyev,cc636775-66a0-4d40-bd1b-e99011f14330
Qənirə Ələsgər qızı Paşayeva,be65ae0e-f9a1-442b-bd7b-14527fb17f8d
Rafael Baba oğlu Hüseynov,d5503e04-3129-43c0-902d-2232e8681d0a
Rafael Kamil oğlu Cəbrayılov,3217435e-7d05-4609-a272-3046d8ec1c92
Rafiq Musa oğlu Məmmədhəsənov,4c72e9ca-8ba3-419c-9a95-0d7ec18e8f83
Rasim Nəsrəddin oğlu Musabəyov,feb3c562-4737-479a-9683-1f8a4fd5fa99
Rauf Asif oğlu Əliyev,1e1b2f83-ea89-4e2f-934f-540c12474bac
Rövnəq İbrahim oğlu Abdullayev,ad2187e6-f5e9-45ea-8a47-549f655c4313
Rövşən Şükür oğlu Rzayev,94022539-c92f-44a3-89cb-441b9ab556ae
Rüfət Atakişi oğlu Quliyev,82428e46-44ac-456d-93e0-9945fa0ac248
Rüstəm Gülabba oğlu Xəlilov,e2426890-f2e7-427f-8249-94f2e95205d5
Rəbiyyət Nurullah qızı Aslanova,da2991c8-b9e8-4d81-a62f-dac606b986f5
Rəşad Məmmədqulu oğlu Mahmudov,3f8eaa14-6377-4f8e-89a8-a5793b59f2fe
Sabir Kamal oğlu Hacıyev,633da5df-f097-4d85-b8ae-72393958e6ed
Sabir Xudu oğlu Rüstəmxanlı,11b3524b-1e46-4591-bf90-61577d18c2c8
Sahib Eyvaz oğlu Alıyev,b33e346b-daad-47a9-bd31-a1d7e36a56c9
Sahibə Əli qızı Qafarova,5218cf48-c4c2-4ba6-89c0-0f1899b6b1c3
Sevinc Həbib qızı Fətəliyeva,fb45330a-c20f-4df6-b3aa-a2ea4b5eb4e3
Sevinc Əmirəhməd qızı Hüseynova,6f317685-3ad1-4a54-973f-830ed01c5285
Siyavuş Dünyamalı oğlu Novruzov,812aa30d-7ce7-4661-8d3d-74b3bb59bfcd
Sona Sakit qızı Əliyeva,abb11112-c4e8-46c9-bf12-fe20e3786f3b
Sədaqət Süleyman qızı Vəliyeva,d412564e-6ca3-453a-95b5-7590fe1870c0
Səməd İsmayıl oğlu Seyidov,eff99776-7803-436d-93f2-369017c1c321
Səttar Suliddin oğlu Mehbalıyev,00994a36-bc39-4436-b7f8-c364b05174d2
Tahir Famil oğlu oğlu Mirkişili,fb216b64-fe80-4c0f-adfa-f6d585072cee
Tahir Musa oğlu Rzayev,6e31bb6d-f465-460e-9726-965d26d9f103
Tahir Süleyman oğlu Süleymanov,08280f01-7341-43c5-a584-cf789437b503
Tahir Zayıdağa oğlu Kərimli,73c6756f-30e6-49eb-916d-d1103a9636b7
Vahid Qazməmməd oğlu Əhmədov,3da3a345-4b9c-493a-8be7-f93d5e15f578
Valeh Feyruz oğlu Ələsgərov,0d9444a8-b390-434b-b199-a6f54b56d16f
Vasif Yusif oğlu Talıbov,fae38e01-0f82-43bb-a5cc-9bae652f7793
Vüsal Əfqan oğlu Hüseynov,cb167f4a-f55f-4932-a65c-e2ac67f0248f
Xanhüseyn Hüseynağa oğlu Kazımlı,7cc093d6-d86c-4d08-9a9c-49a1149f61b7
Xanlar Nuru oğlu Fətiyev,6743e5c7-6d94-4a76-ae7f-4ffed5936c26
Yaqub Mikayıl oğlu Mahmudov,c076b6e3-3a25-4e9a-b2b1-e5668cf4b2d0
Yevda Sasun oğlu Abramov,e8230ed1-3b06-4a18-8c3e-b692f0e3dce8
Zahid Məhərrəm oğlu Oruc,95aff028-181f-4706-aadd-40252f714457
Zeynəb Yəhya qızı Xanlarova,8bdc205d-3edc-46db-b767-11898a10746a
Ziyad Əliabbas oğlu Səmədzadə,c4a72261-dc79-472f-9fa0-09cfbfcaa058
Ziyafət Abbas oğlu Əsgərov,ef5fff1c-220c-45ff-b79f-5add962b8354
Çingiz Aşralı oğlu Qənizadə,03e05806-6006-4b86-a969-4e044958c1e6
Ülvi Zahid oğlu Quliyev,730b6198-9c20-43bf-9ac9-49e485533e69
Ülviyyə Cavanşir qızı Ağayeva,5d6bb5fd-404d-4497-b7b6-478f89e84084
Ülviyyə Tapdıq qızı Həmzəyeva,04222fac-1ef4-4dd1-8213-d2dc39291793
Şahin Əmir oğlu İsmayılov,216680b5-6931-462e-a74e-7cbe9df4e714
Şəmsəddin Hümmət oğlu Hacıyev,75267fc3-461d-4179-8a6c-cabe4d1839c8
Əflatun Əhməd oğlu Amaşov,05da15a4-05c4-4c4a-8dca-9db513ce91cb
Əhliman Tapdıq oğlu Əmiraslanov,649c6f7f-1b3f-4c93-ad9d-d86e640ae27b
Əli Cavad oğlu Əhmədov,95972d98-6dae-43cb-bc76-5fe7b69d70ce
Əli Məhəmməd oğlu Hüseynli,e0a4b44c-32ba-418f-bc86-3fb5f4cfa6b1
Əli Məhəmməd oğlu Hüseynov,dc3bcbc0-b7fb-4f26-ad75-1785378a6843
Əli Əhməd oğlu Məsimli,184c0fb7-a16a-4d5d-8ec6-7dd7a137585b
Əliağa İzzət oğlu Hüseynov,ddd69ee9-88af-44de-8798-118df9235c68
Əsabil Qarakişi oğlu Qasımov,726e2fb0-69f4-4abb-9e8b-550060837a4f
