name,id
Adil Abış oğlu Əliyev,712cd33f-127e-44ae-9766-a806b3859940
Aqil Məhəmməd oğlu Abbas,a3466ffa-1954-4617-bdb8-2cf0fb684604
Aqiyə Həbib qızı Naxçıvanlı,ec51fcac-813f-4e5b-a996-5f1021e12237
Araz Məmməd-Mübariz oğlu Əlizadə,c72632f7-9139-4705-ae84-6d7be1cb1ba3
Arif Qafar oğlu Rəhimzadə,46050024-e5ed-47da-b559-7d0cc91d4da4
Asim Nazim oğlu Mollazadə,83c54f70-332c-4f96-bb8e-1e710b729214
Aslan Məmmədhüseyn oğlu Cəfərov,1c46076d-5f5d-4a98-af99-ee20b50b58f8
Astan Nuşrəvan oğlu Şahverdiyev,47d89d2e-6cc7-4c40-b2c7-300eab2fb099
Aydın Böyükkişi oğlu Mirzəzadə,3bee7d24-4189-49c3-8e9e-fa1225963a3e
Aydın Nəsir oğlu Hüseynov,161c7375-29f2-4518-bd62-5140c413cfc0
Aytən İnqilab qızı Mustafazadə,eb7cd22a-e1c8-4628-939e-483e9e789623
Azay Əjdər oğlu Quliyev,0f2bab60-9aca-437f-adb0-c11994a2b0a9
Azər Camal oğlu Badamov,a39d5208-790a-4270-ac02-9d89f6043a53
Azər Şəmşid oğlu Kərimli,e5b3f92d-b60b-41c2-b2cd-a19934dc9c58
Ağacan Qulam oğlu Abıyev,e5a51fbf-a9de-4ba5-b232-da3204ac39c5
Ağalar İsrafil oğlu Vəliyev,d3e96f9a-0dd1-4a21-8919-470d2f4f117e
Bahar Əvəz qızı Muradov,78a7b569-1566-41b2-b6d9-afda93f8a87c
Bahar Əvəz qızı Muradova,76c188e6-37c0-4950-862e-1e5541100cf4
Bəxtiyar Həmzə oğlu Əliyev,cb731019-bc1d-4f82-96e7-7a2b033efce6
Bəxtiyar Yusif oğlu Sadıqov,126b55a7-1c2f-4e27-a49b-0bb319255e59
Cavanşir Hümmət oğlu Paşazadə,f1fe68e3-4cba-4a1b-9593-3ce6dfeb9b2d
Cavanşir Əyyub oğlu Feyziyev,25421c0a-ac08-4bb5-b45c-1991ebf21234
Cavid Həmid oğlu Osmanov,c4f91d03-b453-400b-94b4-0dedc1fbf416
Cavid Qənbər oğlu Qurbanov,171e9e92-0a61-4226-91d5-a1c12a25f3a7
Ceyhun Yunis oğlu Osmanlı,3045e26b-366c-4afc-819d-f3cac937f9b9
Cəlal Əlirza oğlu Əliyev,f5b6907f-5433-42bd-b843-0851741aa9e6
Dilarə Məmmədağa qızı Cəbrayılova,e913a420-246c-4532-a4e3-cc1f23be66ab
Eldar Allahyar oğlu Quliyev,80889031-4b41-4b16-ab0c-c14c945467d9
Eldar Rza oğlu İbrahimov,85d4600f-4afb-4c85-a20f-a387123d8029
Eldəniz Adil oğlu Səlimov,9086b47c-9184-4548-b283-7754802f92a6
Elman Camal oğlu Məmmədov,d2eea452-a4b0-4907-a87c-42e1eaad945a
Elman Xudam oğlu Nəsirli,c10d59f5-3658-4054-91b6-2d87047a3355
Elmira Hüseyn qızı Axundova,4955a443-2086-467c-b6ad-e259f8190c62
Elxan Sirac oğlu Süleymanov,b77939ca-e75f-4d3d-82df-f8c61a621944
Elçin Bəybala oğlu Quliyev,a22afef6-814f-4c30-90f5-271b9d214469
Elşad Eldar oğlu Həsənov,cb29ce17-8882-471b-9320-46e97cd4faa9
Elşən Məmmədhənifə oğlu Musayev,b1672186-fecc-4032-ad97-da91d25eae4f
Fazil Qəzənfər oğlu Mustafa,9a21f38b-4270-421e-9a1c-fdae0ba296fe
Flora Qasım qızı Qasımova,55c4b948-173e-466a-b60e-0ce84f57492f
Fuad Rauf oğlu Muradov,b16d8ba3-9899-4742-bc5f-ea7aacc72879
Fərəc İbrahim oğlu Quliyev,a3bb54c5-f6d2-41dc-930b-5922ae5e5004
Fəttah Səməd oğlu Heydərov,e585945e-41ee-4539-84e5-ba2ae3eb35ee
Fəzail Feyruz oğlu İbrahimli,9517652c-ffdf-44e7-9d4e-4dd9b005ef3c
Fəzail Rəhim oğlu Ağamalı,fff30399-ab3d-47a0-9242-83a8f07b8da5
Gövhər Baxşəli qızı Baxşəliyeva,aacac822-13a7-4e50-bf7d-c1279a705a18
Hacı Hacıbaba oğlu Salayev,6ab48419-3847-4c11-9b1f-f0fbb899afa6
Hadı Musa oğlu Rəcəbli,62e5edba-df63-4d19-8e9f-bd55a33cd10e
Hikmət Baba oğlu Məmmədov,371fefab-6dcd-484c-9489-5e3fdf12844f
Hikmət İsmayıl oğlu Atayev,66b7b462-909d-4ce5-9229-c150a5c980f3
Hüseynbala Fazil oğlu Mirələmov,04daffd7-10d0-47ca-b5b8-fc78980d1142
İlham Kazım oğlu Məmmədov,12921557-5b0f-481b-9756-d4f85400796f
İlham Əlisəftər oğlu Əliyev,1ad85957-3770-4acd-9dba-13167b53efd0
İmamverdi İbiş oğlu İsmayılov,a0f2c777-9f46-449d-8886-13c86660fbfc
İqbal Nəriman oğlu Məmmədov,b0ccc9f8-786f-4578-af3e-a69a21d68766
İsa Əkbər oğlu Həbibbəyli,a5f5ca23-9981-4ce6-91cf-bd47a072b540
Jalə Fazil qızı Əliyeva,a7878efa-effe-4738-bb3b-aad65499a25b
Kamaləddin Nəsrəddin oğlu Qafarov,0fd9646c-5bec-494f-9548-77be772abc3f
Kamilə Əli Ağa qızı Əliyeva,d9d1ad06-0a90-4067-948b-79d3a560c267
Kamran Fərhad oğlu Bayramov,2ddeb2f8-4406-465d-bb0d-910620311eaa
Kamran Telman oğlu Nəbizadə,39c591fe-ae2a-485f-a9f7-de6b37934d85
Madər Ələsgər oğlu Musayev,3497545c-a2fe-4539-91bb-b6c820353a4f
Mahir Məhəmmədəli oğlu Aslanov,8d0adb83-d48f-4c98-b9ae-6febfa26f06a
Mahir Tapdıq oğlu Abbaszadə,91565f14-0002-4cc8-9eb1-f20934ae670a
Malik Əvəz oğlu Həsənov,4b10452e-a05a-411a-a7d9-a3c82293cf41
Mehriban Arif qızı Əliyeva,6fddfffb-01bd-4b83-a047-299c15154cf5
Mirkazım Mirməhəmməd oğlu Kazımov,35231ecd-2ce7-46da-8479-26b0617ee744
Mirzəcan Mirzəmməd oğlu Xəlilov,cab3f55f-ab1d-4970-b57b-eea6f85921f3
Mixail Yuri oğlu Zabelin,fb763b67-c2ec-44a9-94d1-ab393a504742
Musa Cəfər oğlu Qasımlı,898ce970-812e-47a6-9155-f3d2da53348d
Musa İsa oğlu Quliyev (Urud),61e6cfec-f7fb-4b6e-b05c-31b2e7f076d0
Muxtar Bahadur oğlu Babayev,da46e90b-2718-4bcc-9711-54f76c8c858a
Mübariz Qəhrəman oğlu Qurbanlı,fe505094-3b5a-4134-ae99-4d77f74eb46a
Müslüm Mürsəl oğlu Məmmədov,67d3bc4c-6e5a-4343-8611-60f45c96ac6c
Məlahət İbrahim qızı Həsənova,c356fecb-4544-4b85-99c4-dc775d12d77d
Naqif Ələşrəf oğlu Həmzəyev,60941d33-2717-4ccb-97ca-a626ecbe1bf6
Nazim Fərəc oğlu Fərəcov,b04da79d-5ba2-4272-b9dd-09ec26f74f4d
Nizami Qulu oğlu Cəfərov,c3b47c5b-e276-4f1d-9f82-766ee382b1ed
Novruzəli Davud oğlu Aslanov,9b392db9-9992-458f-8d67-8aa193b53a95
Nəriman Əlibala oğlu Əliyev,fd867371-0e69-4985-ab3a-1853a10a9b62
Nəsib Məhəmməd oğlu Məhəməliyev,fa8fd8b0-3137-45a9-9a16-c408bf6dc44c
Oqtay Sabir oğlu Əsədov,5dc11647-d2e2-4053-b09a-1a169ee55f44
Pərvin Orxan qızı Kərimzadə,32bc1c9c-b72b-448a-8991-67e86b2f5ee2
Qüdrət Müzəffər oğlu Həsənquliyev,0fc90557-f3f4-4ccb-bc6b-03cfe6a1953f
Qənirə Ələsgər qızı Paşayeva,809dfb29-778c-4068-9edd-704736f0a67c
Rafael Baba oğlu Hüseynov,312b2560-9271-49ce-b039-dcace3ff2b5e
Rafael Kamil oğlu Cəbrayılov,2721f55c-d4e1-426a-a81a-c3b3cb5eb9d6
Rafiq Musa oğlu Məmmədhəsənov,5b112922-3f77-4170-8898-376cb07490e8
Rasim Nəsrəddin oğlu Musabəyov,0670f359-9309-4d2d-ac9a-6ebf6c3a48f7
Rauf Asif oğlu Əliyev,7db311bd-b825-4139-adec-436aaaf7a6fe
Rövnəq İbrahim oğlu Abdullayev,4a5efe50-f924-4c15-b7c2-2e6d8981db97
Rövşən Şükür oğlu Rzayev,ee56453b-97a4-422b-8b7a-e5b1bb97b44f
Rüfət Atakişi oğlu Quliyev,8f508775-d246-46da-b50f-f6369a71df89
Rüstəm Gülabba oğlu Xəlilov,8792cb3c-da5f-47e6-a7da-eb19acd3654c
Rəbiyyət Nurullah qızı Aslanova,e8319977-0494-4cc9-b35d-5d9dfcf8a054
Rəşad Məmmədqulu oğlu Mahmudov,36f594c4-96de-4bd7-ac6f-10da977a6a1b
Sabir Kamal oğlu Hacıyev,ee647bc2-2350-43e0-aa32-40b6663e46f9
Sabir Xudu oğlu Rüstəmxanlı,d8986a25-0f82-4b7d-b76c-ca7d3cfb2b6b
Sahib Eyvaz oğlu Alıyev,76f150e0-63e7-4b65-b953-df1a9ac068bc
Sahibə Əli qızı Qafarova,399ecf29-add6-4953-b0ff-60f4f8da68fb
Sevinc Həbib qızı Fətəliyeva,dc0422ec-0e78-4c13-895c-4f3222da2dc0
Sevinc Əmirəhməd qızı Hüseynova,47cd6045-726f-452f-a3d0-7dc8dddba0e3
Siyavuş Dünyamalı oğlu Novruzov,c4c7eb06-b8f4-4e8c-915f-00a8f81db09c
Sona Sakit qızı Əliyeva,5d1beeaa-0bda-42cd-9e61-fa5731786ae1
Sədaqət Süleyman qızı Vəliyeva,506c84fd-6ae6-4c0f-bf32-33c44f9e5fe0
Səməd İsmayıl oğlu Seyidov,486739f0-cbe6-49b0-b3d7-edc4950c8985
Səttar Suliddin oğlu Mehbalıyev,622cf0b8-5311-4e7a-807b-be578da5a464
Tahir Famil oğlu oğlu Mirkişili,13766322-d5fc-4da4-92a0-4860f843e0cc
Tahir Musa oğlu Rzayev,56d5d975-4955-4fa3-bac6-0e817388ea8c
Tahir Süleyman oğlu Süleymanov,792b0304-a47e-48e7-b0a7-fea7805ebc0a
Tahir Zayıdağa oğlu Kərimli,058944b1-f5b3-4286-bf6d-8df974d7bfad
Vahid Qazməmməd oğlu Əhmədov,7b7dc358-fee9-4876-903a-8aebe2c5dba0
Valeh Feyruz oğlu Ələsgərov,3351bed9-f820-4673-98de-6e7c8e5065ad
Vasif Yusif oğlu Talıbov,f67d0247-5309-4a29-9a50-9231b6ec091c
Vüsal Əfqan oğlu Hüseynov,b85e160a-9b5a-41b8-be31-52e17f5b4701
Xanhüseyn Hüseynağa oğlu Kazımlı,66514e1f-444c-49d9-b89b-086e183a90d8
Xanlar Nuru oğlu Fətiyev,9d908929-0190-4193-b129-751ac3e47cef
Yaqub Mikayıl oğlu Mahmudov,e9d58df1-e9fe-4070-8ef5-34c739674696
Yevda Sasun oğlu Abramov,0b79eabc-10f0-4135-9cd8-210d8ddf7409
Zahid Məhərrəm oğlu Oruc,741391c7-fd4a-496c-9215-dce2f66640de
Zeynəb Yəhya qızı Xanlarova,60e20fb0-33c1-4938-be3d-c917c45a94b0
Ziyad Əliabbas oğlu Səmədzadə,7f5cb834-48ea-4ded-8ac2-6bac62613eec
Ziyafət Abbas oğlu Əsgərov,2d460bc3-e541-43ae-8291-b3fc9524eeb9
Çingiz Aşralı oğlu Qənizadə,56fcd5a8-4ea1-42f8-acc4-885a391c8a93
Ülvi Zahid oğlu Quliyev,d51d7153-dc21-478c-97ff-c34f4443ed1d
Ülviyyə Cavanşir qızı Ağayeva,af09a3c7-1afb-4129-9683-6d4f6c810633
Ülviyyə Tapdıq qızı Həmzəyeva,b3cc4830-258e-423f-b548-ac66ad09cf0a
Şahin Əmir oğlu İsmayılov,ac14744d-d2e7-4a10-9ed1-140f1468d420
Şəmsəddin Hümmət oğlu Hacıyev,ab52882d-e08b-4705-b2a3-d6b4be657bf9
Əflatun Əhməd oğlu Amaşov,f1486926-1e81-42be-abd8-914f9080514b
Əhliman Tapdıq oğlu Əmiraslanov,4b11ceb5-35b6-4af2-aa48-b83dfa67152b
Əli Cavad oğlu Əhmədov,11efec63-2864-4091-9e8e-92cf6cbdc9ac
Əli Məhəmməd oğlu Hüseynli,3985eeca-13eb-49b3-b218-a05d837c9167
Əli Məhəmməd oğlu Hüseynov,611a718c-9a11-492a-8863-318809048e97
Əli Əhməd oğlu Məsimli,a6f2aee8-e61d-4d14-a347-84a805331acd
Əliağa İzzət oğlu Hüseynov,d8d69a83-883c-4bd8-ad66-94fc0cea4dd8
Əsabil Qarakişi oğlu Qasımov,90a933e3-3f08-4654-a3c4-19b45d893288
