name,id
Adil Abış oğlu Əliyev,73b145e4-c47e-4ac6-8e47-95f7c9992b7d
Aqil Məhəmməd oğlu Abbas,0500a015-61f9-4b57-9daa-72b470c1f2b6
Aqiyə Həbib qızı Naxçıvanlı,d56858e7-160d-43f4-8da3-8773cb585c9a
Araz Məmməd-Mübariz oğlu Əlizadə,35680d0d-3b9f-4df3-9baf-fd341c4ed449
Arif Qafar oğlu Rəhimzadə,1e533a89-11fc-4d22-adb8-164f2c444e84
Asim Nazim oğlu Mollazadə,27d46d5a-0f1e-4d4c-811a-f856c14495ff
Aslan Məmmədhüseyn oğlu Cəfərov,045052a7-c143-4cd8-af39-ee9269fb181b
Astan Nuşrəvan oğlu Şahverdiyev,a8b9ae4e-0217-45c2-a4f8-ceed18cacdc6
Aydın Böyükkişi oğlu Mirzəzadə,ff439d5c-96ed-466d-b56c-e2edee0af860
Aydın Nəsir oğlu Hüseynov,697d3c83-60e5-4915-b4b5-1a71a0d4b365
Aytən İnqilab qızı Mustafazadə,57002d6f-e2f2-4584-b544-cad0045ee7ff
Azay Əjdər oğlu Quliyev,08531222-8ad5-4fc2-853f-4d005d8b56de
Azər Camal oğlu Badamov,36902536-5d0c-46b9-99f9-28b83f8b9d2e
Azər Şəmşid oğlu Kərimli,3899f286-1d23-44f0-b413-1bcc5367d246
Ağacan Qulam oğlu Abıyev,cc7d4fe9-6c77-45d6-87cd-888823181734
Ağalar İsrafil oğlu Vəliyev,a84ab3cf-3411-4de7-9191-d78d19010075
Bahar Əvəz qızı Muradov,25a91361-9c15-4f85-b7d2-834ef9c430ae
Bahar Əvəz qızı Muradova,56af9179-3ae6-4f3b-84ef-54a39f464335
Bəxtiyar Həmzə oğlu Əliyev,beb8df44-effa-4426-9286-fa19690c7405
Bəxtiyar Yusif oğlu Sadıqov,25e3ec00-9d1e-479f-a264-7f5797515b1d
Cavanşir Hümmət oğlu Paşazadə,b1094590-50df-46b5-b50b-7122898d6506
Cavanşir Əyyub oğlu Feyziyev,f5c3a857-1b42-4b4d-b6dd-fa8fa6c2f5de
Cavid Həmid oğlu Osmanov,aa9923e1-73d7-43ac-8a52-90c99551e27b
Cavid Qənbər oğlu Qurbanov,a9091ad3-a1c5-405a-a897-6438c28dc1d8
Ceyhun Yunis oğlu Osmanlı,a6f62ca6-3a82-4456-b48c-05d2258b665d
Cəlal Əlirza oğlu Əliyev,f9999426-f0fd-4f31-8b09-8fb16661e310
Dilarə Məmmədağa qızı Cəbrayılova,1d0828a8-2254-4105-b00c-096c47c5c3e2
Eldar Allahyar oğlu Quliyev,c08964b6-8303-4bd2-ae27-477fc06a7101
Eldar Rza oğlu İbrahimov,42d94701-6ea6-426d-8cb2-fa54cc6a6999
Eldəniz Adil oğlu Səlimov,4284bfca-8a48-4a53-84a5-1d326c77afe5
Elman Camal oğlu Məmmədov,6c55064c-84ba-40cd-a245-67a4dbd514a0
Elman Xudam oğlu Nəsirli,00ffea6a-46e3-48cb-bff3-97bf47ceef49
Elmira Hüseyn qızı Axundova,1aa898bd-591a-41f7-a590-3076c7dc56ea
Elxan Sirac oğlu Süleymanov,3ecab41d-b43e-406e-93ee-fee5774affd8
Elçin Bəybala oğlu Quliyev,ee916e32-80e6-4991-be01-a1e6e3f54988
Elşad Eldar oğlu Həsənov,040c6c5b-8f6f-42d4-9e33-ed397391ee7f
Elşən Məmmədhənifə oğlu Musayev,38c89588-4735-4060-9651-9533ed2b14dc
Fazil Qəzənfər oğlu Mustafa,ddf706fe-9fb7-49fc-a7ed-f23ddafec462
Flora Qasım qızı Qasımova,1c3762e9-9cc7-4836-935d-d43f9cc499cc
Fuad Rauf oğlu Muradov,cd7b3a4c-5555-48db-b619-3be101432fc5
Fərəc İbrahim oğlu Quliyev,ae43ad4f-cec5-4cee-9c48-229fa784d41c
Fəttah Səməd oğlu Heydərov,b18f1e71-f9f1-4933-881b-7c77d51a7848
Fəzail Feyruz oğlu İbrahimli,e91019e5-3455-455f-bd41-d77cd6ada4d4
Fəzail Rəhim oğlu Ağamalı,0abdec0e-f0aa-4f37-bf2d-56d1e5bcb35a
Gövhər Baxşəli qızı Baxşəliyeva,e30e328e-08b0-47dd-a0f7-9beef73ca9a2
Hacı Hacıbaba oğlu Salayev,3d0673ec-19c3-48c0-b929-26285dbb73ab
Hadı Musa oğlu Rəcəbli,be83c572-5d8b-4ebf-a63e-1c67f5a72d48
Hikmət Baba oğlu Məmmədov,c4f7fa13-ee14-44c0-9c84-ab4142f69a55
Hikmət İsmayıl oğlu Atayev,7a88f0a7-6e27-4b32-a625-f3fd09fc18f0
Hüseynbala Fazil oğlu Mirələmov,9e7817ee-2984-44f5-acf4-2519529aa292
İlham Kazım oğlu Məmmədov,7fb6d553-ba60-447f-ae0a-3edf7d131793
İlham Əlisəftər oğlu Əliyev,13cdefcd-31a9-4b13-9611-49dba461751d
İmamverdi İbiş oğlu İsmayılov,96269863-00c9-4b77-b0c1-8f64f7ef2e52
İqbal Nəriman oğlu Məmmədov,c700be78-c7fb-4baa-bafe-72853ab89e08
İsa Əkbər oğlu Həbibbəyli,a499b024-3a23-4d70-a82e-b0241c693b32
Jalə Fazil qızı Əliyeva,a61f6947-a75f-4bc3-a2c5-d72c7ab8e10a
Kamaləddin Nəsrəddin oğlu Qafarov,fd8de97d-4fbb-403f-8ee7-29d6f2f4dc8c
Kamilə Əli Ağa qızı Əliyeva,ecf0f669-86a3-499b-bbd0-ad1041882f59
Kamran Fərhad oğlu Bayramov,2448ed04-3e95-4670-8a62-b714c1667b11
Kamran Telman oğlu Nəbizadə,b16241d5-99e6-434e-a266-f54265e21f2f
Madər Ələsgər oğlu Musayev,2775ced0-6aec-4ad3-9369-701fc5c024d9
Mahir Məhəmmədəli oğlu Aslanov,6ee82ca0-eb59-4f4f-a350-50f04efcf130
Mahir Tapdıq oğlu Abbaszadə,b3007bcf-c63a-46e4-9d5b-714df10aaecb
Malik Əvəz oğlu Həsənov,ff6d8906-85e1-4656-b0cf-6cf8199f4c8b
Mehriban Arif qızı Əliyeva,f199cb93-6acc-4f60-994f-3e2d6f270127
Mirkazım Mirməhəmməd oğlu Kazımov,e28120fd-a9eb-4593-bfe1-7416fbb142bc
Mirzəcan Mirzəmməd oğlu Xəlilov,8e5b966b-fc28-4314-bd0a-367a60ee52ff
Mixail Yuri oğlu Zabelin,9ffa562f-7937-4080-9f16-0de6f7092e7f
Musa Cəfər oğlu Qasımlı,110dad08-cad7-4846-944e-553cc8492a79
Musa İsa oğlu Quliyev (Urud),7c1df638-30bd-4d0d-abd8-a4eb580b5b45
Muxtar Bahadur oğlu Babayev,d6f98f6e-da1a-41ca-a777-586744776687
Mübariz Qəhrəman oğlu Qurbanlı,41b4948d-8fa5-443b-9b89-8d8d9df68d33
Müslüm Mürsəl oğlu Məmmədov,431a52c9-32b8-4f92-b28b-4c75e03b9ff7
Məlahət İbrahim qızı Həsənova,2012261e-4a5b-4c4f-b6f9-f15aaa9a4a9a
Naqif Ələşrəf oğlu Həmzəyev,f3ea2390-cd61-46b0-b6b8-7e9e5084654c
Nazim Fərəc oğlu Fərəcov,2dba7014-2a59-4b0f-94a5-118c123790ca
Nizami Qulu oğlu Cəfərov,27d9e9b2-6850-4b14-9f24-e0697a88cbda
Novruzəli Davud oğlu Aslanov,bc4fd896-c580-4d38-8490-74cc3f7edb39
Nəriman Əlibala oğlu Əliyev,888d3c02-dcd5-42cb-931f-46b5b570f2ae
Nəsib Məhəmməd oğlu Məhəməliyev,6f2e805e-acfc-4ae9-a7e4-bd3572370f59
Oqtay Sabir oğlu Əsədov,cb050966-97f8-4e68-b5f3-218cc434a221
Pərvin Orxan qızı Kərimzadə,6cedf415-d7aa-4318-83e5-edb856b01ded
Qüdrət Müzəffər oğlu Həsənquliyev,feaea162-c651-4bce-8402-dccfc84585ad
Qənirə Ələsgər qızı Paşayeva,9f32cb43-44fc-4a29-acd5-143ce5fde626
Rafael Baba oğlu Hüseynov,929efa88-1b0f-41ac-8d75-7495ee8c350f
Rafael Kamil oğlu Cəbrayılov,849f136a-de84-49df-aea6-5035435058cf
Rafiq Musa oğlu Məmmədhəsənov,73f832b5-746d-4633-a713-f0559fb4b634
Rasim Nəsrəddin oğlu Musabəyov,b0ee2823-e0fb-4900-bc8a-952b271c00be
Rauf Asif oğlu Əliyev,369642c6-bc4b-4f09-9a49-f24af8a82d62
Rövnəq İbrahim oğlu Abdullayev,6f4ababf-4834-4da5-aeee-8158160e8b78
Rövşən Şükür oğlu Rzayev,87805c57-958a-4500-8912-b534a898a340
Rüfət Atakişi oğlu Quliyev,34854608-f4e9-4266-bcbd-8f783433f073
Rüstəm Gülabba oğlu Xəlilov,7ea894a5-c2ff-472c-9526-ceb7a05b3621
Rəbiyyət Nurullah qızı Aslanova,cce7262e-5ee8-4b8e-a29f-b542cdf971d2
Rəşad Məmmədqulu oğlu Mahmudov,f1e186e0-fd9c-48e3-968f-e590ad20e583
Sabir Kamal oğlu Hacıyev,bc0c4bdb-45fa-4f3e-9b76-cfcd74cd0bf2
Sabir Xudu oğlu Rüstəmxanlı,199e6d49-de22-40c4-a770-484fe0dd6262
Sahib Eyvaz oğlu Alıyev,92a67be7-ab52-4b15-8b53-7e02025212a2
Sahibə Əli qızı Qafarova,2924d15b-a5c2-4cc3-ab62-7b71e9ccf214
Sevinc Həbib qızı Fətəliyeva,40d8e280-aa80-4e2f-9d0b-143699d9577f
Sevinc Əmirəhməd qızı Hüseynova,a1a427d8-b387-4c89-b65f-57b4ca4d9401
Siyavuş Dünyamalı oğlu Novruzov,8c45f207-4cbf-4e56-99a7-6fd609d57c78
Sona Sakit qızı Əliyeva,9eff2296-7c51-475a-be83-0fac265c93df
Sədaqət Süleyman qızı Vəliyeva,a956542e-af87-40b4-b07d-1f4a41104d11
Səməd İsmayıl oğlu Seyidov,167370b0-2b6f-4c30-929a-f7b86e87c432
Səttar Suliddin oğlu Mehbalıyev,f00e4acb-4cf8-4df7-ac64-8e4353d8aeaf
Tahir Famil oğlu oğlu Mirkişili,d67d9bd4-7fac-4a72-8306-a69fef20c541
Tahir Musa oğlu Rzayev,8caa9b0d-0670-4aa7-9710-8febe794012e
Tahir Süleyman oğlu Süleymanov,6acf73ec-3794-4a98-b2eb-24dbe8def62d
Tahir Zayıdağa oğlu Kərimli,8d52f9eb-aebb-4564-a02d-1c2c81500876
Vahid Qazməmməd oğlu Əhmədov,ff307afe-ad2e-4ce6-a3a3-ffa2ed790b73
Valeh Feyruz oğlu Ələsgərov,93eb0737-5f81-45c4-a8b6-d8aaf49ea2fc
Vasif Yusif oğlu Talıbov,1bbf10f0-9afe-4744-964a-54b2dfba3822
Vüsal Əfqan oğlu Hüseynov,9ca25ea7-89b3-4d11-83fc-90f07e648de5
Xanhüseyn Hüseynağa oğlu Kazımlı,cb0fb3fc-2ae9-496e-98b7-56a476811ddd
Xanlar Nuru oğlu Fətiyev,636314c9-9f44-4106-a2fd-bc32fbe48295
Yaqub Mikayıl oğlu Mahmudov,18562e0b-7b73-4b61-a500-ac68ce35a1bb
Yevda Sasun oğlu Abramov,455dc28d-577c-47df-9909-6d78cc72c169
Zahid Məhərrəm oğlu Oruc,ea29f5e1-a1c4-4dba-922e-a48719e9e6e0
Zeynəb Yəhya qızı Xanlarova,5db06b7f-5411-4c4d-b140-a988265ddd9a
Ziyad Əliabbas oğlu Səmədzadə,7bf5aef9-7369-4e67-b478-3eca372b687c
Ziyafət Abbas oğlu Əsgərov,0870a41b-36e1-4614-8d82-ace807dc2f9c
Çingiz Aşralı oğlu Qənizadə,d7657e12-3c5a-4132-a6f4-3fe445602c0f
Ülvi Zahid oğlu Quliyev,059a320b-ab95-4078-a1e4-7dfb8df2153d
Ülviyyə Cavanşir qızı Ağayeva,758d79d1-7945-4023-99ed-4403c43dab4f
Ülviyyə Tapdıq qızı Həmzəyeva,4c72b7fb-5dd5-4a4b-a886-78869c3acafc
Şahin Əmir oğlu İsmayılov,1f235468-a6b0-4fbe-bd18-f6adbf963fde
Şəmsəddin Hümmət oğlu Hacıyev,9c2bef73-4846-4056-b74e-cc8d53510983
Əflatun Əhməd oğlu Amaşov,ff9c51cf-b625-4f66-a487-61ada5b4fc7b
Əhliman Tapdıq oğlu Əmiraslanov,376e57c6-6196-4c8b-a239-417cdd85e427
Əli Cavad oğlu Əhmədov,298c7411-8bfa-46dd-8816-bcd1a862aa94
Əli Məhəmməd oğlu Hüseynli,0f9ef60c-eb7e-4255-b861-46ca2b77f177
Əli Məhəmməd oğlu Hüseynov,341873a7-7536-4eba-8515-6bc001d29957
Əli Əhməd oğlu Məsimli,99347220-a57e-409a-83c5-f32111e9ce04
Əliağa İzzət oğlu Hüseynov,80e2b2a0-fa3f-4aee-834d-7021ac8b3174
Əsabil Qarakişi oğlu Qasımov,79c93f3c-a896-460e-8c92-7d4eb6ae022e
