name,id
Adil Abış oğlu Əliyev,eae371a7-663b-4307-b799-daa994c26cff
Aqil Məhəmməd oğlu Abbas,3a18e1b9-02f8-41d3-87c4-0d7a4dfed3c5
Aqiyə Həbib qızı Naxçıvanlı,b8a75f10-b2dd-4e54-b24d-cdb86fd5e0a7
Araz Məmməd-Mübariz oğlu Əlizadə,4f0702c3-0ecf-4b72-b9ef-a12b2d13d9a2
Arif Qafar oğlu Rəhimzadə,e3c2a102-678f-471c-99e9-11262bd23654
Asim Nazim oğlu Mollazadə,c48cfb29-4d94-49cc-b8c0-fa756786ff4c
Aslan Məmmədhüseyn oğlu Cəfərov,b8691029-63d2-4eb3-8a81-6a52bff71dff
Astan Nuşrəvan oğlu Şahverdiyev,1020d0bf-65bd-4065-a71a-597834b80db0
Aydın Böyükkişi oğlu Mirzəzadə,92dc9b05-1dca-4d65-83de-d688b95de9b4
Aydın Nəsir oğlu Hüseynov,b293fe52-1e3a-4b95-aa36-8cb99bde5462
Aytən İnqilab qızı Mustafazadə,cfd9fdef-5e79-4c26-92e3-3d4d413196dc
Azay Əjdər oğlu Quliyev,dd9d743d-c84e-4eaf-8f5b-45efa2ad5188
Azər Camal oğlu Badamov,4c469314-5cf4-4ceb-a09e-0ff97b3d8ef0
Azər Şəmşid oğlu Kərimli,a804ff56-c63a-4069-98b9-15208e5b9b77
Ağacan Qulam oğlu Abıyev,83a49b44-fef4-41f5-978a-f72d14500b07
Ağalar İsrafil oğlu Vəliyev,a28b3bab-ec76-4761-9254-78fa03ffc514
Bahar Əvəz qızı Muradov,bc6bb5ff-b65b-4030-a908-31a01332cd32
Bahar Əvəz qızı Muradova,7077670c-7ee9-4b1d-a5f2-037f3938eca7
Bəxtiyar Həmzə oğlu Əliyev,d80b3b44-1748-48e7-b243-d77c56224f00
Bəxtiyar Yusif oğlu Sadıqov,a634051e-a678-478e-9cd1-3751dc45c8fa
Cavanşir Hümmət oğlu Paşazadə,4809af05-ccdc-4ea6-a448-4debd9b01ee6
Cavanşir Əyyub oğlu Feyziyev,abfa2e9a-d805-4de6-8187-55e927dfe3f5
Cavid Həmid oğlu Osmanov,2d58c8f9-c63e-4938-8d97-9cdc4d87b74f
Cavid Qənbər oğlu Qurbanov,3c32c78c-9477-4a18-8700-9da8727c7718
Ceyhun Yunis oğlu Osmanlı,88302dbe-77b5-47f8-acf4-610c2d042dc8
Cəlal Əlirza oğlu Əliyev,529a0d75-fd3a-4c65-b62d-a2bc67b2f8cf
Dilarə Məmmədağa qızı Cəbrayılova,d908cfcf-79aa-459e-9b75-a2d009ca1e3d
Eldar Allahyar oğlu Quliyev,05e771d0-6cf0-4dfc-b46c-b0be60bfcdc9
Eldar Rza oğlu İbrahimov,920e07bd-ac9d-415b-a6c6-b29101ac989d
Eldəniz Adil oğlu Səlimov,067d0abc-6cce-4186-a0b2-a796d816f06a
Elman Camal oğlu Məmmədov,288d3aea-23f2-4cf4-847d-e6211e9841c1
Elman Xudam oğlu Nəsirli,1a00ca93-332f-4737-914d-1f4a89fea8ed
Elmira Hüseyn qızı Axundova,1a774a16-9b4c-4999-b6a6-cecb8318081a
Elxan Sirac oğlu Süleymanov,92385668-8a76-4904-a85c-68d43ecc8b64
Elçin Bəybala oğlu Quliyev,99582161-ee71-4566-bd0b-1a36f622c18f
Elşad Eldar oğlu Həsənov,58266516-0624-40d1-8a42-7d4e5097e74e
Elşən Məmmədhənifə oğlu Musayev,94bf60eb-21b0-4078-a60c-35b7f265b925
Fazil Qəzənfər oğlu Mustafa,62502ef4-78c4-4c59-a862-30a0dc1e90c2
Flora Qasım qızı Qasımova,32693446-acd3-45da-897e-eb62b3039d15
Fuad Rauf oğlu Muradov,827b4640-8064-4d86-8d2e-8d8aec912115
Fərəc İbrahim oğlu Quliyev,78a36e4d-fc8c-4091-b0f1-b9d2d0dce3d9
Fəttah Səməd oğlu Heydərov,207a4dc5-374d-40c4-936b-875a998f6108
Fəzail Feyruz oğlu İbrahimli,0caa2be3-d716-49f6-9ac9-8d4dc260e5ad
Fəzail Rəhim oğlu Ağamalı,aca2c9f2-c75d-4dd7-b980-bdeaf3b8d788
Gövhər Baxşəli qızı Baxşəliyeva,d501ecca-b7b9-46b3-9b45-4b990d05d6ff
Hacı Hacıbaba oğlu Salayev,ea2dee7f-1b7d-43a5-88a3-0e26fbbeb214
Hadı Musa oğlu Rəcəbli,55616f2a-5fdc-4a63-8d2f-16075cca6c44
Hikmət Baba oğlu Məmmədov,2fdef17a-2f93-4fdd-9a1d-fa483d0adb63
Hikmət İsmayıl oğlu Atayev,a1173ce3-796d-4f0b-9abb-9812c12d842b
Hüseynbala Fazil oğlu Mirələmov,8ffac5bd-3aed-4236-94f1-1fdbc9679e73
İlham Kazım oğlu Məmmədov,c59ccdc1-31c8-4b46-8b56-a54633217fc7
İlham Əlisəftər oğlu Əliyev,cfbb0f0e-f35f-476e-8e8a-3e4071ff7796
İmamverdi İbiş oğlu İsmayılov,7fb815c2-067b-4c7e-9e58-b6560dddaa1b
İqbal Nəriman oğlu Məmmədov,78a1c79e-87cf-4fff-a8a9-0206db414bd4
İsa Əkbər oğlu Həbibbəyli,531f9bb9-13fc-4db1-a369-fcd1e0233a71
Jalə Fazil qızı Əliyeva,61d7cf7c-62f0-48e2-897e-02fe0fa89356
Kamaləddin Nəsrəddin oğlu Qafarov,aca604b6-fff7-4c1b-bc53-9b9e28348eb0
Kamilə Əli Ağa qızı Əliyeva,e0c66523-36cd-44fa-9528-bfa7ee4829a3
Kamran Fərhad oğlu Bayramov,9923583b-9461-4f28-a6a9-7f170380a13d
Kamran Telman oğlu Nəbizadə,e216a499-62e6-42ea-9085-0805b8867394
Madər Ələsgər oğlu Musayev,160c3d5c-f23c-44d1-9f3d-269b1430faec
Mahir Məhəmmədəli oğlu Aslanov,ebba6fba-3d34-4aea-922f-cddc988db119
Mahir Tapdıq oğlu Abbaszadə,d7c45052-bb3a-4291-8191-5e83d8a63528
Malik Əvəz oğlu Həsənov,70fc0d28-e079-4a51-8668-27bed3cb6172
Mehriban Arif qızı Əliyeva,5e5ad234-50ee-4742-a424-b21e8ac8d127
Mirkazım Mirməhəmməd oğlu Kazımov,7d7458c7-0ed6-443d-845a-555311bda5ec
Mirzəcan Mirzəmməd oğlu Xəlilov,d007e0e6-b1d2-457a-a2f4-0e97561899ab
Mixail Yuri oğlu Zabelin,07eb8bfe-a87e-45b2-a769-ebb3d8d37fd5
Musa Cəfər oğlu Qasımlı,33584c6c-a464-4771-b86c-4d451063f0e0
Musa İsa oğlu Quliyev (Urud),0053c596-59d8-4828-9e08-44b0fff0f630
Muxtar Bahadur oğlu Babayev,51494848-1514-40ae-9e3f-e596de1bab6e
Mübariz Qəhrəman oğlu Qurbanlı,f80ea7fe-fa2f-4c4a-abdd-60e08e46daa1
Müslüm Mürsəl oğlu Məmmədov,e66e8a79-b548-4508-90d2-2c13d9ec79c6
Məlahət İbrahim qızı Həsənova,5874580b-fffc-4148-992b-7e1d9e3c93b6
Naqif Ələşrəf oğlu Həmzəyev,22cd6122-0cb0-4744-8a47-ca67afe5d47f
Nazim Fərəc oğlu Fərəcov,a586456a-93b7-49dc-b24f-6f2b4b5399a7
Nizami Qulu oğlu Cəfərov,436b4923-cd0e-4907-a9ea-e500cea64e3e
Novruzəli Davud oğlu Aslanov,3b2f71dd-86de-4208-976f-9f749f6e8cd2
Nəriman Əlibala oğlu Əliyev,6bb88d89-ba59-4c4e-ae24-4653253271d4
Nəsib Məhəmməd oğlu Məhəməliyev,2537a4d3-3d17-4b6b-94ca-d43054f56ff0
Oqtay Sabir oğlu Əsədov,28a51a34-7606-43c1-8612-64ae8e9dfbff
Pərvin Orxan qızı Kərimzadə,b475c29d-c035-41ff-ac14-9508050772a3
Qüdrət Müzəffər oğlu Həsənquliyev,c958b908-d362-4754-aceb-e53f7429132a
Qənirə Ələsgər qızı Paşayeva,76fee3c8-e1f6-40aa-93ba-06c66ed8a9d7
Rafael Baba oğlu Hüseynov,8ece3790-d38a-471e-b942-02c5cc180ce8
Rafael Kamil oğlu Cəbrayılov,5e29781f-8c3b-4a32-8fbb-5d0651f06ae3
Rafiq Musa oğlu Məmmədhəsənov,86981a8f-6d2e-4ff6-8875-95e4887fe10d
Rasim Nəsrəddin oğlu Musabəyov,59a282d4-03dd-482d-a841-045da18bfe75
Rauf Asif oğlu Əliyev,5aa83742-cc4d-491d-9771-a79ff001173c
Rövnəq İbrahim oğlu Abdullayev,9d66cd5e-8112-4651-a54c-9d21ebd71c56
Rövşən Şükür oğlu Rzayev,8c05fd9f-6268-48a5-8611-f32955196d46
Rüfət Atakişi oğlu Quliyev,9f4d03ed-134e-42cd-8ba9-1c5651d784ad
Rüstəm Gülabba oğlu Xəlilov,12ed3f65-0063-4540-af29-1a81f4e3fda2
Rəbiyyət Nurullah qızı Aslanova,079323ba-277f-48ef-b4ef-7deb752f447e
Rəşad Məmmədqulu oğlu Mahmudov,36c1b478-d31e-4946-a1e4-fd84e92d5b4e
Sabir Kamal oğlu Hacıyev,f6bcb1bc-09a4-42ca-975f-dd801768cb1b
Sabir Xudu oğlu Rüstəmxanlı,bbfb2fa1-2c28-43d8-b041-e572d3deeb51
Sahib Eyvaz oğlu Alıyev,dd84971c-4be9-444d-b17d-a1e120054e9a
Sahibə Əli qızı Qafarova,3104b310-0612-4364-ab5d-33fac6329461
Sevinc Həbib qızı Fətəliyeva,82f53a7a-1b93-4015-9c30-24e0ef513f17
Sevinc Əmirəhməd qızı Hüseynova,af7318c8-61ef-49df-89fa-5d0469ac59fa
Siyavuş Dünyamalı oğlu Novruzov,de9ec1f9-6858-4ce9-b79e-b89c9e352d55
Sona Sakit qızı Əliyeva,adf7591d-646f-43e7-9d7d-3b9188d97530
Sədaqət Süleyman qızı Vəliyeva,efcc9e53-d220-41b8-b460-7cdeace0d3fc
Səməd İsmayıl oğlu Seyidov,b4abdd17-40ec-4699-adf3-e45a1358c9d2
Səttar Suliddin oğlu Mehbalıyev,9311c036-5dc8-401c-a8cf-ed8084d596d2
Tahir Famil oğlu oğlu Mirkişili,5a6881a8-e45c-4d0b-98f7-1ad0d7cd4062
Tahir Musa oğlu Rzayev,7ad6188c-fb93-4e2a-bc4e-33d3eac758e8
Tahir Süleyman oğlu Süleymanov,39255a28-f2aa-40d0-9ca4-24eabb81ad17
Tahir Zayıdağa oğlu Kərimli,a16e2d95-6634-4c3c-9a99-7fb8a36e887c
Vahid Qazməmməd oğlu Əhmədov,cfb18a74-6044-4be7-ab8d-63567c7a5a45
Valeh Feyruz oğlu Ələsgərov,be15f48a-2cb9-40e3-ad3c-efedbfc353b9
Vasif Yusif oğlu Talıbov,fc2c2605-bb97-4be9-8f5d-1bc1f05499eb
Vüsal Əfqan oğlu Hüseynov,1c058bf1-eebc-4393-b5e0-4014a362b26e
Xanhüseyn Hüseynağa oğlu Kazımlı,d07350ab-c312-47f3-812c-f31272a41a2e
Xanlar Nuru oğlu Fətiyev,46fbd290-485b-4e60-b927-d2d0e27f1434
Yaqub Mikayıl oğlu Mahmudov,27cd4623-e540-4989-971f-abb4565bc64a
Yevda Sasun oğlu Abramov,ebf8e4f5-3a72-4575-be41-74d1369719d1
Zahid Məhərrəm oğlu Oruc,57cab768-2d8c-44c1-8a06-e81436cd2279
Zeynəb Yəhya qızı Xanlarova,cef997d6-8ec4-4af8-8083-8b71bd5b9cf4
Ziyad Əliabbas oğlu Səmədzadə,2d6df06d-2fe3-4ee2-8966-602004d2761a
Ziyafət Abbas oğlu Əsgərov,c9554cc7-2556-45a2-a8dd-c1a6396b7e97
Çingiz Aşralı oğlu Qənizadə,412d1349-3edf-41fc-a111-f0a5ed548267
Ülvi Zahid oğlu Quliyev,e3550be4-46d6-44e7-8ec6-6640afb4f3bd
Ülviyyə Cavanşir qızı Ağayeva,87ee6a99-ed05-4308-95a9-a54137162d39
Ülviyyə Tapdıq qızı Həmzəyeva,2f65da8d-7586-4485-be02-209d6be36f98
Şahin Əmir oğlu İsmayılov,42d2c673-cf0e-4cbf-9140-84c42d337344
Şəmsəddin Hümmət oğlu Hacıyev,50cce5a7-2910-45d8-8b7c-c7438f3abc76
Əflatun Əhməd oğlu Amaşov,1e40e80a-819e-41d8-a2c4-5a0243e99613
Əhliman Tapdıq oğlu Əmiraslanov,d05dcc91-bc69-4472-bd9b-29e075b7c604
Əli Cavad oğlu Əhmədov,e71c996c-264e-455c-9f18-cea653580ccb
Əli Məhəmməd oğlu Hüseynli,d4c2309b-635d-4557-b245-a098ac00ebad
Əli Məhəmməd oğlu Hüseynov,582fb8cc-7023-4b05-b8b2-947d5f645a93
Əli Əhməd oğlu Məsimli,fae3f658-8c84-4c25-97af-6a8c67eac605
Əliağa İzzət oğlu Hüseynov,34de20fe-8f05-4624-b415-8777e032ce5b
Əsabil Qarakişi oğlu Qasımov,d44f19eb-c37a-4c51-b202-9d5fbe0bd670
