name,id
Adil Abış oğlu Əliyev,5e1ad958-6066-4597-9718-f78501458952
Aqil Məhəmməd oğlu Abbas,3ab8c3ce-239d-4691-8f6f-f27180d09c45
Aqiyə Həbib qızı Naxçıvanlı,a8a7b7d3-cde8-4cd6-816c-8418f7d324af
Araz Məmməd-Mübariz oğlu Əlizadə,e80116f1-313d-4f67-b73b-d28951cbee90
Arif Qafar oğlu Rəhimzadə,3d904abe-94d5-4393-9096-1609c7c07854
Asim Nazim oğlu Mollazadə,06e038a9-e5a8-4145-95d0-7c78c3ad774e
Aslan Məmmədhüseyn oğlu Cəfərov,96f43537-9181-42b7-b1c5-3c6091c62c03
Astan Nuşrəvan oğlu Şahverdiyev,4b885f60-d001-4687-ad3d-eb9cff2dca16
Aydın Böyükkişi oğlu Mirzəzadə,85e60e77-bb9a-4f29-8d6a-a24415ba7c3d
Aydın Nəsir oğlu Hüseynov,95ca2b09-c047-47d1-8f3b-28f261fdfe5b
Aytən İnqilab qızı Mustafazadə,ef31abdd-5559-441a-930b-2fd13644c450
Azay Əjdər oğlu Quliyev,209ff283-4ff8-417a-8cad-d249c3a80b03
Azər Camal oğlu Badamov,f49fefe8-35d6-4a75-bd66-ba521746a4ab
Azər Şəmşid oğlu Kərimli,5164879b-43b0-4b0e-bb8e-938f83634749
Ağacan Qulam oğlu Abıyev,415a55ef-2ca1-4e95-a16d-ee52972feec3
Ağalar İsrafil oğlu Vəliyev,a614428c-9885-4b32-a99e-9c29bffcaec1
Bahar Əvəz qızı Muradov,bc84c49c-5ec4-4e06-ab30-74c10704cfae
Bahar Əvəz qızı Muradova,e0ab2148-5fab-491d-9bcd-ddf215de79b7
Bəxtiyar Həmzə oğlu Əliyev,c8faeb65-577a-41db-a270-a115dc68a2c1
Bəxtiyar Yusif oğlu Sadıqov,9eca3d63-792b-4e3f-8a8d-be46681bcfb1
Cavanşir Hümmət oğlu Paşazadə,37cbbf78-cfc1-4f69-b79f-83fa7d75403b
Cavanşir Əyyub oğlu Feyziyev,2ace6b88-7cb3-4593-a6fd-7dffd2acae2d
Cavid Həmid oğlu Osmanov,75a2aa2e-ccdc-4e1a-a21e-4e7868aa22df
Cavid Qənbər oğlu Qurbanov,1c3154db-51c4-4951-8362-cd40ba28b487
Ceyhun Yunis oğlu Osmanlı,d7ac52a5-0ae8-4b4c-a7a4-20017c0727da
Cəlal Əlirza oğlu Əliyev,6a994739-a6f5-4048-ae41-35fd4d0fefd3
Dilarə Məmmədağa qızı Cəbrayılova,9057979b-7ec6-4a72-8a6e-dd7510898de3
Eldar Allahyar oğlu Quliyev,af9ad431-74b3-48af-a1a6-a5141bfc07b6
Eldar Rza oğlu İbrahimov,6da2aca0-cae2-42cd-931c-87b545e2fb05
Eldəniz Adil oğlu Səlimov,99cc82e9-ae12-4458-9125-c69f5c48fd23
Elman Camal oğlu Məmmədov,78676866-2aea-49e9-a593-3b247952cfb1
Elman Xudam oğlu Nəsirli,d25cbbf0-2172-4b31-b0b1-c03a68a7889e
Elmira Hüseyn qızı Axundova,ff0c1c7f-9780-4c1f-9d40-83fc55a34bd3
Elxan Sirac oğlu Süleymanov,ff3bd6ce-17b3-4d4e-bd8f-6637731bb67a
Elçin Bəybala oğlu Quliyev,aa12e3ce-cf9d-4fc1-a5b3-d1214e3f38f1
Elşad Eldar oğlu Həsənov,8549aae6-31e1-41c4-93b9-309686a0faae
Elşən Məmmədhənifə oğlu Musayev,b3cf05ce-fcb7-4dcc-bcb6-62360c989c4a
Fazil Qəzənfər oğlu Mustafa,6735525e-8c06-4a9a-bcd1-469515f24031
Flora Qasım qızı Qasımova,8f078a10-4579-49e7-b83c-da256097fa31
Fuad Rauf oğlu Muradov,cae2b683-d421-4841-8971-c7394a6c9572
Fərəc İbrahim oğlu Quliyev,0affd947-15c0-4123-b7ab-ffe5a278923b
Fəttah Səməd oğlu Heydərov,db1297b5-2cd7-4af0-82e9-9c18b7884793
Fəzail Feyruz oğlu İbrahimli,64263ff5-fa72-48ad-a9e6-c4ec58acf698
Fəzail Rəhim oğlu Ağamalı,2ecc3522-178a-4b39-8616-5c760fcc35cd
Gövhər Baxşəli qızı Baxşəliyeva,de75214f-24bf-434c-b1a5-7152af54e7f5
Hacı Hacıbaba oğlu Salayev,89fb13ba-4c34-414b-ab58-d5032a91714c
Hadı Musa oğlu Rəcəbli,8d398d74-2c2e-45f4-983c-2f72d20de210
Hikmət Baba oğlu Məmmədov,f2193ee3-1709-43ee-8630-e933a87b3310
Hikmət İsmayıl oğlu Atayev,58c5f6b4-e3ca-4b7b-8f25-80b22523cefb
Hüseynbala Fazil oğlu Mirələmov,aa8ccaf7-8111-4b3d-b09e-c7d2c1ec1f6d
İlham Kazım oğlu Məmmədov,46ac7997-ccd9-4366-ab86-8eafcd060abc
İlham Əlisəftər oğlu Əliyev,1662597d-3d76-4bf1-8c3a-a95ba61e288f
İmamverdi İbiş oğlu İsmayılov,e41e6026-7bd0-48a2-b408-c324c79bd6d3
İqbal Nəriman oğlu Məmmədov,c71315bb-63a0-4b8f-b2f5-1b1f8498b90f
İsa Əkbər oğlu Həbibbəyli,8eebaaa2-d8aa-4b04-aa14-d35232093a83
Jalə Fazil qızı Əliyeva,6371821c-a3ec-4df4-a233-2c9c584b6b85
Kamaləddin Nəsrəddin oğlu Qafarov,a34b06fe-ef3b-4b76-afdc-6f8290b95da9
Kamilə Əli Ağa qızı Əliyeva,77489516-1cf5-446a-b802-2188790f1487
Kamran Fərhad oğlu Bayramov,649fe16b-def5-4cb1-8180-12a113d54f1b
Kamran Telman oğlu Nəbizadə,34caab42-dc9b-47fd-8d57-28f805fbbb12
Madər Ələsgər oğlu Musayev,5858b4fe-a9d0-4212-b005-945e4dbf2152
Mahir Məhəmmədəli oğlu Aslanov,5c669e8c-3924-4267-9215-0082019392b3
Mahir Tapdıq oğlu Abbaszadə,2226c248-8e3e-499d-9b1d-d8c04d78a158
Malik Əvəz oğlu Həsənov,c64eadfc-19fd-4496-a29f-9e0a6c978902
Mehriban Arif qızı Əliyeva,eb1f2515-46b0-4ab3-bdbd-d316d4f3a0a9
Mirkazım Mirməhəmməd oğlu Kazımov,28ecce9f-f93f-4441-ba83-2442328dde69
Mirzəcan Mirzəmməd oğlu Xəlilov,5757acfc-10f1-486d-ad91-c48d974032ad
Mixail Yuri oğlu Zabelin,bbd1f706-b87b-4187-81dd-b51c23f349dc
Musa Cəfər oğlu Qasımlı,e09f1c81-5e8f-45e7-a37a-5d8154f0ca93
Musa İsa oğlu Quliyev (Urud),05f6f083-e0e9-45b1-b8a8-f63bf6d29508
Muxtar Bahadur oğlu Babayev,8052ba7c-d931-4e02-87d1-ee3cc542a08d
Mübariz Qəhrəman oğlu Qurbanlı,d22f4e3a-67b2-4ab8-9e8c-cc64ba5a7789
Müslüm Mürsəl oğlu Məmmədov,e6240e8c-a012-4023-891c-12da76221050
Məlahət İbrahim qızı Həsənova,0fe63a4b-a09c-4a53-8867-97befdcb0548
Naqif Ələşrəf oğlu Həmzəyev,81efef8f-54f7-448a-908d-3abfa5880d54
Nazim Fərəc oğlu Fərəcov,dd414e99-121d-46ea-9f41-53ead3375435
Nizami Qulu oğlu Cəfərov,e6440af9-0475-4505-a7df-1cb5e38d8475
Novruzəli Davud oğlu Aslanov,8b509665-50b3-4af6-8de6-6ece985935e3
Nəriman Əlibala oğlu Əliyev,ab14c54e-30de-4796-bbad-dd2df7df1858
Nəsib Məhəmməd oğlu Məhəməliyev,6a89d21a-8565-49c8-b34e-e97a8be537d1
Oqtay Sabir oğlu Əsədov,4d1d7735-d0ab-4933-b7fb-547dcb8ac8b0
Pərvin Orxan qızı Kərimzadə,8a6fce9e-64b5-469f-8a1e-a8cc931598a9
Qüdrət Müzəffər oğlu Həsənquliyev,784ce12c-6cc4-4ae3-b54e-57585d540a86
Qənirə Ələsgər qızı Paşayeva,5d7ccb95-8ec8-48e6-bb25-4b7b6fe38457
Rafael Baba oğlu Hüseynov,20974edd-3cd2-4c9f-b6f4-557a2cfd53a2
Rafael Kamil oğlu Cəbrayılov,cca83f90-fa34-4354-918b-cd3dafbab4a7
Rafiq Musa oğlu Məmmədhəsənov,3797df1c-8fc5-4f87-91b3-b7da701c844a
Rasim Nəsrəddin oğlu Musabəyov,ba5a5f8a-7b78-48e9-b73e-eb7b8bebae07
Rauf Asif oğlu Əliyev,f44b8f9a-3efe-4d85-8564-29ccb302612a
Rövnəq İbrahim oğlu Abdullayev,b7d075d8-ab81-4149-befd-cfce6ad78678
Rövşən Şükür oğlu Rzayev,9e5f6226-bcde-427a-b091-b4edea78ab20
Rüfət Atakişi oğlu Quliyev,61531454-a664-4f28-ba47-5b81ebc914dd
Rüstəm Gülabba oğlu Xəlilov,65eae2c3-c1ad-43e2-bef2-0cbc1fa7b750
Rəbiyyət Nurullah qızı Aslanova,b378030b-ac7d-4d76-a45e-b1cd067e63bd
Rəşad Məmmədqulu oğlu Mahmudov,3f637b95-707b-4e0b-8d8f-72d853feb042
Sabir Kamal oğlu Hacıyev,399d4561-42ad-41ce-bfe4-fdafa31d6dfa
Sabir Xudu oğlu Rüstəmxanlı,b43ad25b-5a32-41a2-a514-b26ac91a53c9
Sahib Eyvaz oğlu Alıyev,46b847fc-09ca-4c41-a128-5bc888e07242
Sahibə Əli qızı Qafarova,2760c256-48f5-448c-b699-f31dea81396d
Sevinc Həbib qızı Fətəliyeva,628174a2-22b4-4d6f-a974-c4410df94e7e
Sevinc Əmirəhməd qızı Hüseynova,64e6b0a5-21d6-409e-ad14-1a8e9b22718a
Siyavuş Dünyamalı oğlu Novruzov,86ede250-5313-4cd5-9db5-f1aa2f726c19
Sona Sakit qızı Əliyeva,77008488-cc22-4696-ae00-36a120bd78ec
Sədaqət Süleyman qızı Vəliyeva,cea2067c-6093-417e-a8e1-b2dc82c6390b
Səməd İsmayıl oğlu Seyidov,a8a06bac-29cf-4f75-8a0e-8221503b691b
Səttar Suliddin oğlu Mehbalıyev,aad06862-67ac-4075-8ca8-685e24548c36
Tahir Famil oğlu oğlu Mirkişili,54fa9222-fec2-4d87-89e4-aa0812946430
Tahir Musa oğlu Rzayev,78e5100a-f918-4af3-9d2c-72217c9edf0a
Tahir Süleyman oğlu Süleymanov,4099d19e-b637-42b2-a420-453c4c2cc1e0
Tahir Zayıdağa oğlu Kərimli,b92a6689-7f5a-4fd4-b632-33a68380e628
Vahid Qazməmməd oğlu Əhmədov,c2e3a8f1-0a99-4262-bc97-af03a4826830
Valeh Feyruz oğlu Ələsgərov,cd32f779-1e23-47fb-8370-e09ac8b1b259
Vasif Yusif oğlu Talıbov,d66c97d3-f8b6-46d5-aec2-82601e56dc3e
Vüsal Əfqan oğlu Hüseynov,640c5273-d6f7-4618-8469-2adeaea4f0a0
Xanhüseyn Hüseynağa oğlu Kazımlı,73f3d307-d543-4b0d-8993-d2db81587fbb
Xanlar Nuru oğlu Fətiyev,038e12c5-4c55-4f3b-90be-58539a295fba
Yaqub Mikayıl oğlu Mahmudov,76a7c0cb-1428-41a8-aefb-4117a8f4f95e
Yevda Sasun oğlu Abramov,463b988f-25af-48cc-8447-519d6496138d
Zahid Məhərrəm oğlu Oruc,0d9b156d-b93e-4d32-9316-f86ef930382d
Zeynəb Yəhya qızı Xanlarova,c30a216f-5d4f-492e-b7f1-bc88c6830e0e
Ziyad Əliabbas oğlu Səmədzadə,36d08ff4-4df7-413b-9e59-ef1648fea98e
Ziyafət Abbas oğlu Əsgərov,16a6f4f6-4145-4ca5-b767-1d0980aa74e5
Çingiz Aşralı oğlu Qənizadə,d820d9e1-80af-4b31-a03f-261165b8a4b5
Ülvi Zahid oğlu Quliyev,e35b9d1c-4cb0-42d7-9084-ad6e595ab347
Ülviyyə Cavanşir qızı Ağayeva,cdfeaa6e-ca8b-43de-96a9-b92a10e08656
Ülviyyə Tapdıq qızı Həmzəyeva,1f2e35fb-13cc-4c73-a81c-934b3ea8aa4e
Şahin Əmir oğlu İsmayılov,e954b558-fc87-4f86-891d-8e0ed23b0914
Şəmsəddin Hümmət oğlu Hacıyev,1df21898-2a5a-43f0-8293-3371c2cd103e
Əflatun Əhməd oğlu Amaşov,9bdb3bba-50eb-4169-9613-745246a80c47
Əhliman Tapdıq oğlu Əmiraslanov,39c5a3cf-f7e3-4f25-bd54-bf187a89b132
Əli Cavad oğlu Əhmədov,935e0a6d-dd08-4c80-9fdc-c76501299686
Əli Məhəmməd oğlu Hüseynli,d12c2c6b-7570-4f2c-b2ea-b52e0c8ea2ca
Əli Məhəmməd oğlu Hüseynov,80721a22-bef4-4290-9da3-e36da92b1d8b
Əli Əhməd oğlu Məsimli,588915c9-a12b-4ad4-bf1b-d825081a02b0
Əliağa İzzət oğlu Hüseynov,b30ebcca-4302-4f48-8a55-1510381f325b
Əsabil Qarakişi oğlu Qasımov,0a3e9cfa-c3ba-4639-9849-4e7790b26ef3
