name,id
Adil Abış oğlu Əliyev,55f91663-49f9-45fb-9c7c-41af31fb74bc
Aqil Məhəmməd oğlu Abbas,cbebdda7-3c91-4a0d-b431-1721f7756d9b
Aqiyə Həbib qızı Naxçıvanlı,0fb53f08-c1c9-4e69-a52c-43f3984c0f4b
Araz Məmməd-Mübariz oğlu Əlizadə,35acb91a-6195-456c-b375-75e9c93fcbde
Arif Qafar oğlu Rəhimzadə,2b2ff9c2-74c8-4755-8af5-84e1450e30db
Asim Nazim oğlu Mollazadə,94a2af63-b777-4177-acff-314d6a9bc9b5
Aslan Məmmədhüseyn oğlu Cəfərov,59b09882-82cf-4e09-9034-80a6bc14036d
Astan Nuşrəvan oğlu Şahverdiyev,2de270e2-87a0-4320-ad7f-bb34244868e1
Aydın Böyükkişi oğlu Mirzəzadə,dd2ece7d-6911-4414-b3d0-5017d94db0fb
Aydın Nəsir oğlu Hüseynov,bac1f9f3-0a58-496b-b975-b49ee1285a40
Aytən İnqilab qızı Mustafazadə,4fe1f1a1-e1cb-4769-ad00-9df7d9c91938
Azay Əjdər oğlu Quliyev,3e23ca3c-23eb-41e8-ac60-ff76b17431e4
Azər Camal oğlu Badamov,157d7e18-1e7c-4aa5-894b-c3a2542955b2
Azər Şəmşid oğlu Kərimli,61f2262c-9bcd-4dae-97f2-774c5d344f28
Ağacan Qulam oğlu Abıyev,0bd49c78-96bf-44d6-b6cb-e41a0367ccda
Ağalar İsrafil oğlu Vəliyev,a0527d19-2d73-487b-8678-b38fe14cd614
Bahar Əvəz qızı Muradov,1ffd33df-e992-4527-bddb-769a526d2c47
Bahar Əvəz qızı Muradova,7603471d-0a35-406b-9b45-f389d64b12b9
Bəxtiyar Həmzə oğlu Əliyev,edad4eac-c730-4081-aab5-ac825f04c4fb
Bəxtiyar Yusif oğlu Sadıqov,16722e0a-ff3b-42ef-b67d-80950a25b24b
Cavanşir Hümmət oğlu Paşazadə,589edbba-7d43-4f39-ad01-a4ad6d6e22c5
Cavanşir Əyyub oğlu Feyziyev,49d49ba5-f1de-4b8a-9844-29be79371c47
Cavid Həmid oğlu Osmanov,6d210a5f-1253-4700-b7a6-3caad69865a8
Cavid Qənbər oğlu Qurbanov,be06e5bb-460f-4b59-b350-ecbe844de3ed
Ceyhun Yunis oğlu Osmanlı,fadde47f-1064-4e77-92d2-5f5943714821
Cəlal Əlirza oğlu Əliyev,cf689bb5-36a2-4b50-96f7-df061a17601c
Dilarə Məmmədağa qızı Cəbrayılova,01e350e8-64e9-4122-adfe-4da36db3f422
Eldar Allahyar oğlu Quliyev,4a5f7465-f2a8-4417-9b66-1fe7018d436d
Eldar Rza oğlu İbrahimov,436a9ee5-7c2b-4c8b-8c42-7f4a30e3fc36
Eldəniz Adil oğlu Səlimov,505aa8d1-1638-45ee-9e2b-c95b61c46354
Elman Camal oğlu Məmmədov,ec0d0158-09fd-4710-b5ba-6f71e6f70be7
Elman Xudam oğlu Nəsirli,20b19243-b539-4e77-85a9-7037f0d718c6
Elmira Hüseyn qızı Axundova,8c5b40ae-a7ee-40f1-9390-d912ff1b48f6
Elxan Sirac oğlu Süleymanov,a4dda8ab-fb96-49d4-bf1a-d1cd319c74a6
Elçin Bəybala oğlu Quliyev,a36c3b75-cf9d-43f1-8803-f07ffccc5156
Elşad Eldar oğlu Həsənov,fd470e41-2b14-4ae5-8be3-56a9ec08f977
Elşən Məmmədhənifə oğlu Musayev,c2abe041-6909-44d9-87b9-b19cb29fe7a9
Fazil Qəzənfər oğlu Mustafa,af4e364b-39b8-44d4-a00e-4d6755c71547
Flora Qasım qızı Qasımova,a024e6d0-67b9-451c-a981-98c509f91a70
Fuad Rauf oğlu Muradov,dddc4469-e6ae-4a79-8bf1-33c9b50c6d91
Fərəc İbrahim oğlu Quliyev,99c8ea36-f4a2-4c30-a8a1-58792fb31023
Fəttah Səməd oğlu Heydərov,b29f947b-dfd2-4865-901f-257cfafe7727
Fəzail Feyruz oğlu İbrahimli,3fbf3242-4949-4bed-ab5b-6ed410e80736
Fəzail Rəhim oğlu Ağamalı,d74feb68-cc32-4bab-ab4d-6855fe49c388
Gövhər Baxşəli qızı Baxşəliyeva,108b4007-db7a-4d20-8aed-a8e328911bf2
Hacı Hacıbaba oğlu Salayev,0ed690ca-2fba-4c3b-b748-26077c974cdb
Hadı Musa oğlu Rəcəbli,0d25a434-865d-4f83-89db-fbd659b9bd64
Hikmət Baba oğlu Məmmədov,ef58cc11-7400-437b-9801-3343e2beccbf
Hikmət İsmayıl oğlu Atayev,2c5afc71-03f1-4490-b0cf-97629632b81f
Hüseynbala Fazil oğlu Mirələmov,1787ef6d-0e17-4d14-a999-c0e5be6ddc65
İlham Kazım oğlu Məmmədov,d88e7934-d368-4919-b916-3a25fb51a052
İlham Əlisəftər oğlu Əliyev,5c2e86e1-3df1-4c2d-97ff-6c8f5537d2f1
İmamverdi İbiş oğlu İsmayılov,120fe0bd-7b82-4347-823b-e764144b3563
İqbal Nəriman oğlu Məmmədov,16cc8094-5075-48ac-9668-4be6dd6f64d1
İsa Əkbər oğlu Həbibbəyli,e10867a4-2ea4-462e-84d0-7cdc91a881e1
Jalə Fazil qızı Əliyeva,42d50d85-f636-4fdd-8fa9-0ab91b88643d
Kamaləddin Nəsrəddin oğlu Qafarov,7f37c88b-6629-4b4b-815a-710a5ca7f891
Kamilə Əli Ağa qızı Əliyeva,3745e62a-3612-4212-a0b1-d795445da5d4
Kamran Fərhad oğlu Bayramov,ae7572d3-2f94-469d-993f-35214defaf36
Kamran Telman oğlu Nəbizadə,daf321df-e30c-4883-96ec-149734224b6c
Madər Ələsgər oğlu Musayev,20a4524a-d941-443e-b48d-9dfd4c7a7909
Mahir Məhəmmədəli oğlu Aslanov,c5e32683-1283-4e5b-af6d-a96d479cf3f6
Mahir Tapdıq oğlu Abbaszadə,f10860f0-dd10-4d7e-a93a-e8146d4e3372
Malik Əvəz oğlu Həsənov,3f3c39ae-ba25-4356-9e60-e26e801e9e6e
Mehriban Arif qızı Əliyeva,6de8c1c7-5ab0-46b7-811c-5ecf271bfc9b
Mirkazım Mirməhəmməd oğlu Kazımov,f7a0c8ca-52d2-4ea2-b9d8-7f5c6f8b8100
Mirzəcan Mirzəmməd oğlu Xəlilov,6f57bf19-887d-4de0-927d-237c0d5f959f
Mixail Yuri oğlu Zabelin,dd743939-0414-4f58-898a-4242c45f7d57
Musa Cəfər oğlu Qasımlı,f2de5de7-c46e-4af8-9291-61dae6702cb7
Musa İsa oğlu Quliyev (Urud),dffcdfad-8b3f-45a2-9a15-456bf20fc449
Muxtar Bahadur oğlu Babayev,979a12a5-96c2-407e-8438-336450c738b5
Mübariz Qəhrəman oğlu Qurbanlı,ca8a33e8-1ba8-440c-a6ce-7db56d82282d
Müslüm Mürsəl oğlu Məmmədov,f94a904b-9ac4-41dc-a8c5-38f5c67926c8
Məlahət İbrahim qızı Həsənova,cc9ebc66-b6b9-432e-b3f2-295f424aaa2b
Naqif Ələşrəf oğlu Həmzəyev,5c68b324-e501-4189-8d07-0cdadf07c434
Nazim Fərəc oğlu Fərəcov,0bd72c58-5a9f-4b32-9644-f547a6946072
Nizami Qulu oğlu Cəfərov,69ebfa32-fe73-4b19-a419-fec373319f8f
Novruzəli Davud oğlu Aslanov,bb3c70d3-2ce7-4fa5-8ac9-65a71a724bcf
Nəriman Əlibala oğlu Əliyev,e79fedd1-7887-42bd-800e-4a874aff0353
Nəsib Məhəmməd oğlu Məhəməliyev,04a4691f-aa41-450c-9266-731a18e13ae1
Oqtay Sabir oğlu Əsədov,b069325a-353c-4417-8595-0737b66689d0
Pərvin Orxan qızı Kərimzadə,46520091-7c4e-4bae-9321-db3d1f0647d1
Qüdrət Müzəffər oğlu Həsənquliyev,1a328ad7-cbb4-474d-8938-9af0e1878697
Qənirə Ələsgər qızı Paşayeva,33a47605-3f20-40d0-8823-364152df5943
Rafael Baba oğlu Hüseynov,fc13c546-8fbe-4edc-8d07-a56a8e673784
Rafael Kamil oğlu Cəbrayılov,2423a6c8-f2c4-4045-9cfc-c0c880e4e0ea
Rafiq Musa oğlu Məmmədhəsənov,c1e435c0-f909-4fa8-a4a3-d9488fc2979d
Rasim Nəsrəddin oğlu Musabəyov,724d618b-fa48-4d7a-8263-f494c4316262
Rauf Asif oğlu Əliyev,ed5cb512-7c1f-4a17-8c4d-3d8025321049
Rövnəq İbrahim oğlu Abdullayev,7b5bfab7-b73f-4b70-bbb8-9ccc8a098bec
Rövşən Şükür oğlu Rzayev,d61ae1e1-1c00-40d7-b646-305457c76ccb
Rüfət Atakişi oğlu Quliyev,101dae8d-e615-4044-a7b5-b540a6f0aec3
Rüstəm Gülabba oğlu Xəlilov,fdd54788-689d-4317-b60f-da98a5229a1c
Rəbiyyət Nurullah qızı Aslanova,39638d7e-a0e6-4f39-b2d4-3ee7d7c48c98
Rəşad Məmmədqulu oğlu Mahmudov,926d5024-0307-4715-9835-725479719096
Sabir Kamal oğlu Hacıyev,f1b39121-8483-45ae-96c2-aea3bc0a671d
Sabir Xudu oğlu Rüstəmxanlı,db88b714-a1d6-402b-ba9d-3d5645dc3c32
Sahib Eyvaz oğlu Alıyev,2fbd603c-6922-4a3b-844c-a7796f0098ec
Sahibə Əli qızı Qafarova,2b86cb3a-8562-4e8a-8101-11d98b9cf22d
Sevinc Həbib qızı Fətəliyeva,ed97d36d-1657-4cf1-a562-4f6fa67a5f19
Sevinc Əmirəhməd qızı Hüseynova,c31a0547-c0f5-4fbb-9502-2165b7ace966
Siyavuş Dünyamalı oğlu Novruzov,5853a52d-a05d-49eb-8110-cbe98df38104
Sona Sakit qızı Əliyeva,a574aa6e-ac81-41ff-b40c-0ef1313ae40d
Sədaqət Süleyman qızı Vəliyeva,0f4309a9-f8f1-40eb-b11a-b7ca48a16668
Səməd İsmayıl oğlu Seyidov,08362694-7eac-48c2-982d-46865223e566
Səttar Suliddin oğlu Mehbalıyev,bbbc79e3-7660-4468-b931-dc30728ff7b4
Tahir Famil oğlu oğlu Mirkişili,ad73447a-7b24-45e3-a4a7-304e81fffce4
Tahir Musa oğlu Rzayev,c9440dd2-7c67-4c07-8667-c5283977be83
Tahir Süleyman oğlu Süleymanov,80e8a77d-0fc7-4e03-ab42-fc3eb75ad3dc
Tahir Zayıdağa oğlu Kərimli,1904ea39-f67c-4754-87dc-c6b9a44746d4
Vahid Qazməmməd oğlu Əhmədov,93d8dff7-2521-45e1-bfe6-0c39ea907493
Valeh Feyruz oğlu Ələsgərov,a7e17e58-dab6-4d70-9d5f-eb49651451ae
Vasif Yusif oğlu Talıbov,c91c282e-5358-4bd8-bda0-4e53e7dab9c8
Vüsal Əfqan oğlu Hüseynov,9efd2363-52bf-4bc0-af0d-340d3c8d1530
Xanhüseyn Hüseynağa oğlu Kazımlı,609f2d46-ae46-4f3d-bb3c-49041c11c0c3
Xanlar Nuru oğlu Fətiyev,1cbeaf61-e534-4f08-bed6-8c38c88b4108
Yaqub Mikayıl oğlu Mahmudov,a5c90a28-5cb2-44cd-8493-c7af96bd8ed5
Yevda Sasun oğlu Abramov,f493ec5c-79c6-4f05-827e-e0e26be22a4b
Zahid Məhərrəm oğlu Oruc,1250577e-f7ee-412a-82fc-0c1e5c1c79f2
Zeynəb Yəhya qızı Xanlarova,c63f32d9-7f86-47f6-8c74-de9d6f40062e
Ziyad Əliabbas oğlu Səmədzadə,14779ee0-d6de-4a0c-82ee-4c16ca27fb67
Ziyafət Abbas oğlu Əsgərov,29a5a4f1-70b3-45e9-90a3-dd96fa8765f4
Çingiz Aşralı oğlu Qənizadə,665740fd-390a-4f1d-9dab-36e631bee6f6
Ülvi Zahid oğlu Quliyev,030569ae-26a0-4243-a545-5f4d8e517edf
Ülviyyə Cavanşir qızı Ağayeva,200bdc2b-e487-4e52-a7b1-c3e3e23ae91a
Ülviyyə Tapdıq qızı Həmzəyeva,d9e882ca-0a94-405f-ab15-be6ed3966019
Şahin Əmir oğlu İsmayılov,8901c32b-82ea-40ab-91d3-e977e71b4922
Şəmsəddin Hümmət oğlu Hacıyev,f6f0b124-f2a9-458d-97e0-90db3b5b7efa
Əflatun Əhməd oğlu Amaşov,bb3d084a-40b1-45fc-a56a-1d8e85597b44
Əhliman Tapdıq oğlu Əmiraslanov,0e011017-baf2-48b0-adc0-ef5ece922305
Əli Cavad oğlu Əhmədov,a546c7e7-5749-4ac9-96c2-57d38d69562b
Əli Məhəmməd oğlu Hüseynli,a3189312-0b3d-4c5e-ab02-75840f33b2c2
Əli Məhəmməd oğlu Hüseynov,03ca2cb4-5a85-4726-80fe-1752407c0b72
Əli Əhməd oğlu Məsimli,064fc805-c138-4ca5-91d4-cba3873745fd
Əliağa İzzət oğlu Hüseynov,6c428430-2364-4328-b6bf-b7e32009c847
Əsabil Qarakişi oğlu Qasımov,c0e80e04-ceb9-41c9-9ac4-08c71887a630
