name,id
Adil Abış oğlu Əliyev,4807488e-d056-4c08-b711-c38fd077cd17
Aqil Məhəmməd oğlu Abbas,6936e6ea-6c55-4cf5-8b11-9a449ac18062
Aqiyə Həbib qızı Naxçıvanlı,0ec85013-dd4c-4e7b-aeda-e286e6527756
Araz Məmməd-Mübariz oğlu Əlizadə,bdfb9e60-6304-4e56-acb6-83d9f4ec839a
Arif Qafar oğlu Rəhimzadə,ebd230bb-95e6-48cf-a3c6-247c236e7332
Asim Nazim oğlu Mollazadə,b0d3268f-28ed-477d-8f8b-99249d4f1d97
Astan Nuşrəvan oğlu Şahverdiyev,735899f8-b0a5-44b2-98ea-87eab52f9052
Aydın Böyükkişi oğlu Mirzəzadə,b7362455-b8fe-4686-83ea-dba39583b8bc
Aydın Nəsir oğlu Hüseynov,b847514f-04eb-498c-8360-d3770380dc32
Aytən İnqilab qızı Mustafazadə,fc1230a5-f9fe-49be-aff0-f14e84a0bb0a
Azay Əjdər oğlu Quliyev,904c0d5e-7741-4fdd-831f-a4248039a690
Azər Camal oğlu Badamov,915f6919-0e91-4910-a3b8-1c9ea3910936
Azər Şəmşid oğlu Kərimli,1e291902-0026-46aa-b2d7-4a86e0e86c91
Ağacan Qulam oğlu Abıyev,7438e096-be4f-4fd3-8db8-d0a47dc43d7a
Ağalar İsrafil oğlu Vəliyev,8638eade-6996-4076-9642-9a2bbcd5c3a5
Bahar Əvəz qızı Muradova,886c21fb-88bc-4ebb-8db2-cb98260c7c30
Bəxtiyar Həmzə oğlu Əliyev,6ee6a1d8-3465-4568-8daa-3b6cc3c2e252
Bəxtiyar Yusif oğlu Sadıqov,0ddbfe8c-3f67-450b-9cd8-95aa0949426d
Cavanşir Hümmət oğlu Paşazadə,13d275ff-c221-44d9-a225-079fc48ae46a
Cavanşir Əyyub oğlu Feyziyev,91b95e5b-017f-4161-9e1d-915bfae68263
Cavid Həmid oğlu Osmanov,fd1bf1a4-3b0a-40bf-9ee6-79e4c9ba617e
Cavid Qənbər oğlu Qurbanov,8d257300-d4a6-470c-90f4-83221e783c0c
Dilarə Məmmədağa qızı Cəbrayılova,6f72e3ac-2ee2-4595-89f9-0a1af8ed2e12
Eldar Allahyar oğlu Quliyev,ddb633c6-a921-4009-a49f-4c5dd1360802
Eldar Rza oğlu İbrahimov,6328bcc5-a8e3-4133-afe1-34068f9b749e
Eldəniz Adil oğlu Səlimov,2d60543f-da25-4aa2-baf5-826fcec3571e
Elman Camal oğlu Məmmədov,edfe769c-7853-4453-b46e-adf87a72b196
Elman Xudam oğlu Nəsirli,7a0d5091-8cfc-4bf1-b833-0ee5255b2016
Elmira Hüseyn qızı Axundova,2d0b1abe-468b-4715-ad27-af7b9aeddd82
Elxan Sirac oğlu Süleymanov,543122fd-9de6-43f0-9284-0c8f174fe8e6
Elçin Bəybala oğlu Quliyev,373f2d7d-e6b2-47ac-87a9-e873b7851cc9
Elşad Eldar oğlu Həsənov,153fb8c2-48ee-43dc-a84d-fc9dd6506059
Elşən Məmmədhənifə oğlu Musayev,d9ea6324-14c9-4d2a-a1fe-2930412fc2ba
Fazil Qəzənfər oğlu Mustafa,da16d988-21ab-4cf7-9936-d3972b91f5b5
Flora Qasım qızı Qasımova,e5cd18a6-7956-4ae3-af3f-d135cbcd0e59
Fuad Rauf oğlu Muradov,fd4a96ae-b20c-4121-b6fa-e320ccb5d0dd
Fərəc İbrahim oğlu Quliyev,a0612f80-4608-4c48-a87a-b9015b91c23d
Fəttah Səməd oğlu Heydərov,da8e6ca1-feee-4e88-87cd-08bd7584e060
Fəzail Feyruz oğlu İbrahimli,52e077e9-a9f9-428e-beec-50707319cf5d
Fəzail Rəhim oğlu Ağamalı,bc36f5cd-fdf0-4c20-9908-df3c07a3e338
Gövhər Baxşəli qızı Baxşəliyeva,88a6c56a-6803-433f-b498-14d6a0b3b52d
Hacı Hacıbaba oğlu Salayev,fddb7e6b-01dd-434d-9576-103d1fa7584e
Hadı Musa oğlu Rəcəbli,0a61a53b-3a10-4d26-90bb-3b08207ac4cd
Hikmət Baba oğlu Məmmədov,46358908-46bd-4d02-a42f-91af9b96f66c
Hüseynbala Fazil oğlu Mirələmov,47bc56d1-7d98-41b3-bb6e-a876596b9a79
İlham Kazım oğlu Məmmədov,2e1418c8-2f59-4ad4-b5fe-615173b020ef
İlham Əlisəftər oğlu Əliyev,90c7c5c2-f659-4122-bf27-b63d1daec0bb
İmamverdi İbiş oğlu İsmayılov,1175e6af-fa8c-4bee-a9f3-a89f10f37cdb
İqbal Nəriman oğlu Məmmədov,c9e398bd-6100-4eb3-94cc-27337979f00f
İsa Əkbər oğlu Həbibbəyli,ab8dbd70-1375-4461-9c73-945f7e55b103
Jalə Fazil qızı Əliyeva,2be5221c-8284-411b-831f-d0eb454d03e8
Kamaləddin Nəsrəddin oğlu Qafarov,d9cb499a-d9e8-46b0-813a-0d7bf308aeae
Kamilə Əli Ağa qızı Əliyeva,6d502a9d-b3ec-4084-8ebf-a231daa93e39
Kamran Fərhad oğlu Bayramov,9013a789-9639-4b5c-8798-fada1fad77a1
Kamran Telman oğlu Nəbizadə,86998097-e2ba-40c0-aca2-410a3258317a
Madər Ələsgər oğlu Musayev,e591c5ab-0b2f-477e-93e6-f0b3bfe16f01
Mahir Məhəmmədəli oğlu Aslanov,14ffd9d3-36a0-4319-9f4b-f4b675c66a72
Mahir Tapdıq oğlu Abbaszadə,afc4ed80-aadd-4e52-a211-6ec0a32cdbce
Malik Əvəz oğlu Həsənov,5839c884-610d-4fd3-b9db-e3e24dad02d4
Mehriban Arif qızı Əliyeva,65d5fdfc-6037-48ed-a0b1-093c767589f4
Mirkazım Mirməhəmməd oğlu Kazımov,193b9441-4b06-462a-be16-8e3fc15846d4
Mirzəcan Mirzəmməd oğlu Xəlilov,4db31715-b3ac-4e38-8a04-b8a06f2c8506
Mixail Yuri oğlu Zabelin,d1645967-28e5-4413-a2dd-bc27a42e3604
Musa Cəfər oğlu Qasımlı,39f7c65e-a7c8-4844-b41e-a2fbb212d974
Musa İsa oğlu Quliyev (Urud),1c27176a-5da9-4a57-bf50-1eff783443d3
Muxtar Bahadur oğlu Babayev,3a64277e-bc29-45a6-852f-5028c078d83c
Müslüm Mürsəl oğlu Məmmədov,8b60c47a-2c6e-4e2a-a579-98bc0ccaa195
Məlahət İbrahim qızı Həsənova,62e16d8f-0263-4a08-877d-e9e72990d2f0
Naqif Ələşrəf oğlu Həmzəyev,95197d24-b470-42ea-ad7c-72945ef64f96
Nizami Qulu oğlu Cəfərov,a8a905d6-dec4-4565-bb59-eed7258236e4
Novruzəli Davud oğlu Aslanov,1d433d4f-91b4-4168-9272-1b1ad81cdeea
Nəriman Əlibala oğlu Əliyev,684ca326-4b30-4a78-86bf-321172fcd5e7
Nəsib Məhəmməd oğlu Məhəməliyev,4464c5ac-773a-41b0-a005-38e8af1f60e1
Oqtay Sabir oğlu Əsədov,bc5a60f0-8822-4fc9-a6a9-f2df3df1f273
Pərvin Orxan qızı Kərimzadə,6ca905bd-d194-47e5-b9bb-d0eff7866f62
Qüdrət Müzəffər oğlu Həsənquliyev,9777fd4f-da13-4e45-8866-4f01dc3bfccf
Qənirə Ələsgər qızı Paşayeva,020f48c2-d1b6-4b7b-bc32-fe3bd122fb7f
Rafael Baba oğlu Hüseynov,72c9e720-81f3-4d85-9f45-66f4199320bd
Rafael Kamil oğlu Cəbrayılov,7c6834d7-9966-47fb-b707-9612cb8e5aa4
Rafiq Musa oğlu Məmmədhəsənov,2267f7e6-0233-4e65-b7fc-830f49ecc10d
Rasim Nəsrəddin oğlu Musabəyov,34071a2e-74dd-4618-991d-4d5c8b88ad46
Rauf Asif oğlu Əliyev,a2c03731-11f9-49bf-bdaf-83dd60a0574d
Rövnəq İbrahim oğlu Abdullayev,ca3104fc-64b3-4a9f-b504-515036a48421
Rövşən Şükür oğlu Rzayev,b3768920-56d8-499e-8eb8-3a3cc62cbc01
Rüfət Atakişi oğlu Quliyev,40328509-9d2f-4a1f-b71a-20ba4c98e87c
Rüstəm Gülabba oğlu Xəlilov,fc60b2cc-367f-473e-9210-73f4b685e4d2
Rəşad Məmmədqulu oğlu Mahmudov,2b890442-9b11-4c9e-9c19-9633566632df
Sabir Kamal oğlu Hacıyev,3f95d322-af48-443d-a67b-4f6012fccd08
Sahib Eyvaz oğlu Alıyev,55d263a8-b60a-4bea-b388-5185f72378c9
Sahibə Əli qızı Qafarova,43527eac-379c-4474-ab92-82e3ce58b574
Sevinc Həbib qızı Fətəliyeva,5c51266c-ef79-4df5-b7ff-8bfced542562
Sevinc Əmirəhməd qızı Hüseynova,19c62e68-be6a-44a7-a776-94e4455cca54
Siyavuş Dünyamalı oğlu Novruzov,5b4d4c36-0dfb-44d0-abc5-4ac42ea8fbc4
Sona Sakit qızı Əliyeva,5a8a3f0e-5feb-4eed-8c9e-aa8c71f8a5ed
Sədaqət Süleyman qızı Vəliyeva,a5dc6f06-cfc1-4aa2-89cc-276d2920e6a4
Səməd İsmayıl oğlu Seyidov,7584ac11-3f02-4799-b7bf-f29090e0eaad
Səttar Suliddin oğlu Mehbalıyev,b3d63062-80fb-41d0-bc0b-94332475f177
Tahir Famil oğlu oğlu Mirkişili,cbc7fee0-ccf3-4f07-8313-bba84e9b6a51
Tahir Musa oğlu Rzayev,44d5f8d8-1126-44ba-b0e2-f500fdb205ef
Tahir Süleyman oğlu Süleymanov,63398d89-7586-4e74-81be-b7fadbb48537
Tahir Zayıdağa oğlu Kərimli,a8129fff-7975-4a6f-a91f-a71b248c32a8
Vahid Qazməmməd oğlu Əhmədov,6a3f52a8-d750-4ff6-9cd8-a11c412486cd
Valeh Feyruz oğlu Ələsgərov,7d46d81d-c002-4934-bbf2-702d7c6cf0bc
Vasif Yusif oğlu Talıbov,baf84b91-24b5-4176-aa52-19dbb8877e3a
Vüsal Əfqan oğlu Hüseynov,64b79960-4de2-48f8-af73-d07589207805
Xanhüseyn Hüseynağa oğlu Kazımlı,d933b650-edda-4bd8-8623-67512cd3af19
Xanlar Nuru oğlu Fətiyev,493ac6db-208a-4958-a62d-a1dca6128963
Yaqub Mikayıl oğlu Mahmudov,f4dbd7b3-0bdb-4ae7-8af2-f0b565c043c2
Yevda Sasun oğlu Abramov,be236735-9901-41e0-b900-db35fa07ce63
Zahid Məhərrəm oğlu Oruc,2ae48c99-d02a-4515-b0f3-a72ae15d0f7e
Zeynəb Yəhya qızı Xanlarova,c7676a40-124b-4365-a8aa-885325180a2a
Ziyad Əliabbas oğlu Səmədzadə,be55542f-e6f5-4151-8fee-df8003b5c3b7
Ziyafət Abbas oğlu Əsgərov,9b32c835-84c8-4413-b7b9-9096d7f1267c
Çingiz Aşralı oğlu Qənizadə,a31276ba-55d2-4737-823d-527d9b1fb8e9
Ülvi Zahid oğlu Quliyev,a53d543d-dfc4-4dcf-9c82-2c162fccc9fe
Ülviyyə Cavanşir qızı Ağayeva,ce22b1c7-8e7d-4bfb-9928-4ff367d2c82f
Ülviyyə Tapdıq qızı Həmzəyeva,a76dd66f-5ec5-46dd-909a-a93e791a021a
Şahin Əmir oğlu İsmayılov,4b3f8afd-1303-494e-a987-699bc7ec83db
Şəmsəddin Hümmət oğlu Hacıyev,54f039ed-2936-44c4-9d22-76c9d1b517c4
Əflatun Əhməd oğlu Amaşov,b3eaca19-529a-4b61-89b3-8084baccdf1b
Əhliman Tapdıq oğlu Əmiraslanov,869ef180-29b0-45bd-848a-87d759a876d2
Əli Məhəmməd oğlu Hüseynli,24f79f8b-285e-450a-a42d-15bad32e97f9
Əli Əhməd oğlu Məsimli,4baa599a-e5b1-40b1-9efa-7074d7c274a5
Əliağa İzzət oğlu Hüseynov,753e94ca-8b82-420e-bce2-44dc4d1c238a
Əsabil Qarakişi oğlu Qasımov,5deb251b-124e-4d7d-afed-de57d4484ca2
