name,id
Adil Abış oğlu Əliyev,29942a45-dd2b-4c49-9f67-db0e9cbd6014
Aqil Məhəmməd oğlu Abbas,9eda305a-c53c-4cf4-beec-c1bdb17a4036
Aqiyə Həbib qızı Naxçıvanlı,dc1b501e-eac0-469c-80e1-7c7c964d57ca
Araz Məmməd-Mübariz oğlu Əlizadə,4f41682b-b788-43b0-8acb-84145dd8c017
Arif Qafar oğlu Rəhimzadə,67262e6c-c1b4-4267-ba75-58ee9d49c617
Asim Nazim oğlu Mollazadə,7540a748-8021-4e0a-9475-0d8812af4f0c
Aslan Məmmədhüseyn oğlu Cəfərov,272ae99d-4821-4ebb-aa95-8c39665900dc
Astan Nuşrəvan oğlu Şahverdiyev,956750da-e1f1-45cf-982c-9ad1f6df4d39
Aydın Böyükkişi oğlu Mirzəzadə,5bff0d8e-d20e-46d5-89fa-e06ed745098e
Aydın Nəsir oğlu Hüseynov,e5db1b81-26ef-498d-b286-a09ff65aa498
Aytən İnqilab qızı Mustafazadə,2e421715-34fa-4d67-93aa-a2970d88e010
Azay Əjdər oğlu Quliyev,c38954d8-408f-48e3-99a3-55e8ac903e57
Azər Camal oğlu Badamov,ac987654-42c0-475b-8cdb-034852c4707e
Azər Şəmşid oğlu Kərimli,6fdfff08-7aeb-46d3-9be6-d0a81d884faa
Ağacan Qulam oğlu Abıyev,ad2889ea-a043-44c8-8390-a0b1fcbb73fe
Ağalar İsrafil oğlu Vəliyev,f4a78a65-acd3-4b6a-a20c-d37f58f46246
Bahar Əvəz qızı Muradov,f80cebbf-527d-4b49-a5ef-2f9baae1f555
Bahar Əvəz qızı Muradova,8e3601c0-baef-430f-952a-76742c83de37
Bəxtiyar Həmzə oğlu Əliyev,9ee09092-44f8-4fd0-bf3c-217e1fa977f2
Bəxtiyar Yusif oğlu Sadıqov,0b8203bd-54e6-4f06-89f4-df452df66c14
Cavanşir Hümmət oğlu Paşazadə,1904a1e5-65d5-4e24-ada5-b37ca35d6328
Cavanşir Əyyub oğlu Feyziyev,af1b7d95-5a88-4af6-a314-97eef73d1f75
Cavid Həmid oğlu Osmanov,c713c0df-c6c5-4c66-aca6-a453843c0a21
Cavid Qənbər oğlu Qurbanov,76f2f861-682b-453d-8cef-f74425f5250c
Ceyhun Yunis oğlu Osmanlı,9596db59-6ea1-46b2-9982-97f0507623fa
Cəlal Əlirza oğlu Əliyev,08eb6342-1154-4b58-b2c1-4b72cc023230
Dilarə Məmmədağa qızı Cəbrayılova,92231ecd-2424-46b3-98b3-730204693570
Eldar Allahyar oğlu Quliyev,fb27bece-f17b-486c-9b53-07097a2afda8
Eldar Rza oğlu İbrahimov,45a9688e-338b-4f6d-9714-76c1a2ee312f
Eldəniz Adil oğlu Səlimov,ecff4906-10e9-4fa2-9640-c648622052a4
Elman Camal oğlu Məmmədov,471123fd-504c-47ea-a66a-80d038382248
Elman Xudam oğlu Nəsirli,bed00c34-fdeb-4e62-bed4-575fda5f829e
Elmira Hüseyn qızı Axundova,60fec338-f5bf-4831-b62a-aec84238380e
Elxan Sirac oğlu Süleymanov,4140dc3f-9c2d-4836-9792-2fa3a98c4139
Elçin Bəybala oğlu Quliyev,b6cdb843-d36a-4837-b7b2-06947bf3bb4c
Elşad Eldar oğlu Həsənov,c29de799-94ba-4cec-a785-6d5452432bf3
Elşən Məmmədhənifə oğlu Musayev,f7b123c5-9cb0-402c-8c98-a6b1013d087c
Fazil Qəzənfər oğlu Mustafa,f67edb12-4b71-4fa8-b638-2de8fbc4b23c
Flora Qasım qızı Qasımova,1d0d410e-97ce-4382-aeec-29b74899aeaf
Fuad Rauf oğlu Muradov,1f2a4f07-bb72-4549-b0e3-078132e2c86d
Fərəc İbrahim oğlu Quliyev,e7b7c49d-0132-4f6f-af5a-e13b751b7c91
Fəttah Səməd oğlu Heydərov,6a9abcbd-0bee-4106-8e34-73f91118c263
Fəzail Feyruz oğlu İbrahimli,6ccdce67-234d-49dd-9339-6944faeda73c
Fəzail Rəhim oğlu Ağamalı,215241f6-2c08-46ab-97f2-397ce79a8d30
Gövhər Baxşəli qızı Baxşəliyeva,87016cba-c171-40f7-ad98-5502c4be39f2
Hacı Hacıbaba oğlu Salayev,0de3ff4b-21d2-4882-b4ea-19dbbe5ccaa5
Hadı Musa oğlu Rəcəbli,60b15edb-c581-4073-8642-b06b64520675
Hikmət Baba oğlu Məmmədov,650b0aef-0e6e-4eb9-a7d5-3c71a7fe4c88
Hikmət İsmayıl oğlu Atayev,df699c3c-6d97-4149-b1cf-fe90a85184b6
Hüseynbala Fazil oğlu Mirələmov,54fe0e35-42cb-4933-8be8-524ea5d676a6
İlham Kazım oğlu Məmmədov,527e98aa-f593-4825-8683-f82537eec1dc
İlham Əlisəftər oğlu Əliyev,06dbce21-a589-4b0c-a295-25c6fd627391
İmamverdi İbiş oğlu İsmayılov,f7c0330c-4d68-4562-baa8-5e9f833b14df
İqbal Nəriman oğlu Məmmədov,ae22fcfb-75e5-45b8-904b-51bc1ba24ccd
İsa Əkbər oğlu Həbibbəyli,b709a21b-9c99-43b8-817b-37ee85f38ca8
Jalə Fazil qızı Əliyeva,ce82dd12-6158-4824-91ee-d16a397f152e
Kamaləddin Nəsrəddin oğlu Qafarov,c2e56ea8-9f87-40e9-8dd1-22ed3573f2cf
Kamilə Əli Ağa qızı Əliyeva,dd5c0fd5-c6a0-413d-802d-364ba80aff43
Kamran Fərhad oğlu Bayramov,2a6c8167-f8b8-4abd-b841-ee96174b3080
Kamran Telman oğlu Nəbizadə,603654ce-a811-47a1-b6b6-f9a6a4f054e0
Madər Ələsgər oğlu Musayev,3d170125-6907-4220-a1f5-611de9803b8e
Mahir Məhəmmədəli oğlu Aslanov,f45959c9-b768-4bc9-a23c-041033bc8fac
Mahir Tapdıq oğlu Abbaszadə,336290ef-d3d0-4a1a-8801-910223078f21
Malik Əvəz oğlu Həsənov,abbe5311-86d0-448e-8409-b1b97ada0b6b
Mehriban Arif qızı Əliyeva,8e7a51f7-09ea-46bb-b002-7179130921fa
Mirkazım Mirməhəmməd oğlu Kazımov,5714567f-0725-4f2b-a6d8-3029503a220a
Mirzəcan Mirzəmməd oğlu Xəlilov,348b9d7e-2836-4a30-b3d5-c14d561b43cf
Mixail Yuri oğlu Zabelin,d938e35b-2ffc-4375-af0f-61ff564dabd3
Musa Cəfər oğlu Qasımlı,88c0a9f0-58ad-43fe-8d18-4d9f50041eb7
Musa İsa oğlu Quliyev (Urud),caa4cc11-e20f-4421-a262-5154abb65f8a
Muxtar Bahadur oğlu Babayev,e0ea9228-f6d1-4eac-9380-c4d49684d7ec
Mübariz Qəhrəman oğlu Qurbanlı,e452ef6d-54b0-4901-8c4e-ec660b0d911f
Müslüm Mürsəl oğlu Məmmədov,ce967220-655c-4c98-8e2f-be8e19dbb0bd
Məlahət İbrahim qızı Həsənova,de255925-c64e-4c09-9ca0-0c260c837e2e
Naqif Ələşrəf oğlu Həmzəyev,9661448d-3164-4b52-bf93-9d575f181f5a
Nazim Fərəc oğlu Fərəcov,5856b0e8-9058-423e-bb51-613c6676cfb4
Nizami Qulu oğlu Cəfərov,dee8d97b-6555-47aa-83d4-bd003012331e
Novruzəli Davud oğlu Aslanov,a2a7ab06-58d8-4b97-b05c-7c1c210a5bed
Nəriman Əlibala oğlu Əliyev,8c7f2143-bd13-4ed8-8025-597b885c9e7a
Nəsib Məhəmməd oğlu Məhəməliyev,8960835a-705a-48c7-a0d4-5672bf308e51
Oqtay Sabir oğlu Əsədov,a60327b0-502c-4a34-b1bd-3c3f896d54d6
Pərvin Orxan qızı Kərimzadə,51e57dfa-c39b-45b4-9cef-c5c3c685cb91
Qüdrət Müzəffər oğlu Həsənquliyev,a58afa61-7cad-4ca7-b767-e4775d8e317d
Qənirə Ələsgər qızı Paşayeva,a04e4329-a796-4d93-b32b-4a9f99e91fa9
Rafael Baba oğlu Hüseynov,fd9644d1-9bb9-45b4-8df0-176ac11b1daf
Rafael Kamil oğlu Cəbrayılov,1512d1ad-c1f8-49d2-a57b-483d3714023b
Rafiq Musa oğlu Məmmədhəsənov,b18886c6-90f8-4157-95b1-ec0d0b7979f5
Rasim Nəsrəddin oğlu Musabəyov,62a4b631-b3ab-4bab-afcd-cf80caab7101
Rauf Asif oğlu Əliyev,53ff18b2-c613-4ab7-b3cd-6a8f6bd6560c
Rövnəq İbrahim oğlu Abdullayev,c1a493b6-9202-4a2c-b52e-bbb31eaa34ae
Rövşən Şükür oğlu Rzayev,f242b38a-9b20-47f9-b26e-1a214a0e462d
Rüfət Atakişi oğlu Quliyev,abb73b41-9ce9-4d75-8b0c-a724ee6194c4
Rüstəm Gülabba oğlu Xəlilov,c780cc8b-8869-4cf9-8b91-eb514b816941
Rəbiyyət Nurullah qızı Aslanova,ac8a6e7c-a535-4a6d-a03a-c81c8ab80ae1
Rəşad Məmmədqulu oğlu Mahmudov,6b675ca9-4ff5-4cb1-85cd-cd13a7dd5702
Sabir Kamal oğlu Hacıyev,88f609a2-a3cc-40c1-a302-4292c88aa679
Sabir Xudu oğlu Rüstəmxanlı,9125fe4d-6c11-4d5a-bb5d-1ed9794dcf79
Sahib Eyvaz oğlu Alıyev,d4264454-8401-4f01-a79d-6abe934b62aa
Sahibə Əli qızı Qafarova,3bb4ab6f-0c0c-480a-a0e0-3163a1e364f8
Sevinc Həbib qızı Fətəliyeva,56f6c3c9-6b13-48d8-91eb-011718161b8e
Sevinc Əmirəhməd qızı Hüseynova,8d49c28a-a8ca-4096-82a2-6e9bcc0f64f8
Siyavuş Dünyamalı oğlu Novruzov,9a202870-fa46-4535-b8b1-5c6e4b044305
Sona Sakit qızı Əliyeva,43b81bb4-c91a-4869-81da-9dc011d22957
Sədaqət Süleyman qızı Vəliyeva,f6609cab-3781-4509-b149-a1cb528cc9bb
Səməd İsmayıl oğlu Seyidov,632468c2-6dd3-4b3d-9bd9-e2b0555d14a9
Səttar Suliddin oğlu Mehbalıyev,f65bbda6-f6e3-44c2-8c60-681093c5d6f9
Tahir Famil oğlu oğlu Mirkişili,a114ed8e-a71c-49e6-a92a-f481adca3de1
Tahir Musa oğlu Rzayev,04c26d05-071d-437b-8592-2ce25f84e59f
Tahir Süleyman oğlu Süleymanov,46f7920f-8320-4071-bbc7-3f26eb402562
Tahir Zayıdağa oğlu Kərimli,f130f3ff-6ca6-482b-88dc-536b3ad0be3a
Vahid Qazməmməd oğlu Əhmədov,1d6d1380-cc66-4ce7-9666-db288c50adef
Valeh Feyruz oğlu Ələsgərov,af0098c0-5619-45ab-a3b4-7f8e09a53ddf
Vasif Yusif oğlu Talıbov,a8967be5-a11a-4e01-9ff6-34b59580e4d7
Vüsal Əfqan oğlu Hüseynov,4a392c0f-8a49-4f7c-9a02-33ee60ad309d
Xanhüseyn Hüseynağa oğlu Kazımlı,9696a397-f39f-4662-9610-c76350945ccd
Xanlar Nuru oğlu Fətiyev,0da16256-cd30-4874-8a78-9607565512c3
Yaqub Mikayıl oğlu Mahmudov,6641c3fd-2114-4027-90db-7803ce0fdf9d
Yevda Sasun oğlu Abramov,10919c4d-fd1a-4337-bacb-a310880bf846
Zahid Məhərrəm oğlu Oruc,0a8888c3-21f7-4c7a-87b7-b520f20a3b5e
Zeynəb Yəhya qızı Xanlarova,dc265dd7-c142-40a6-9538-7be0bdbf4446
Ziyad Əliabbas oğlu Səmədzadə,f404373e-0b65-4dc0-afce-c7a1f8d2a41d
Ziyafət Abbas oğlu Əsgərov,73aae306-34b3-42f3-b406-605cbf5a24ef
Çingiz Aşralı oğlu Qənizadə,806a78c2-36ca-4084-81ec-d88486acfa4b
Ülvi Zahid oğlu Quliyev,81c1ba7d-bb15-44dc-ad1a-71f737364908
Ülviyyə Cavanşir qızı Ağayeva,dcae9b6a-ca57-4e08-89d2-4af8aa290def
Ülviyyə Tapdıq qızı Həmzəyeva,6e0af936-9429-4605-9793-6dd54644cc3b
Şahin Əmir oğlu İsmayılov,95b8f08e-ee56-4ecc-baab-107ad9e33755
Şəmsəddin Hümmət oğlu Hacıyev,4e85e04a-6f45-4845-8d99-7a0e9b848431
Əflatun Əhməd oğlu Amaşov,d0c61689-2395-4593-846c-5a8de472f9b1
Əhliman Tapdıq oğlu Əmiraslanov,3f5cd6bc-f52b-4cb8-bddc-75200ee98c4b
Əli Cavad oğlu Əhmədov,449001dc-a16d-4362-b2fa-6a88e5963823
Əli Məhəmməd oğlu Hüseynli,5f1ab98a-6677-47f7-8c9a-0fe79c353ae2
Əli Məhəmməd oğlu Hüseynov,36e60a24-b604-42af-8c83-39ba21f60db4
Əli Əhməd oğlu Məsimli,e68546fe-fa35-405a-9d17-039529293058
Əliağa İzzət oğlu Hüseynov,e9f9259b-5ae5-49aa-ad58-022927befb44
Əsabil Qarakişi oğlu Qasımov,2f145806-117d-4ca3-9e6c-7ef47e623683
