name,id
Adil Abış oğlu Əliyev,b6d90357-696b-4a11-bffd-109e2d14f50e
Aqil Məhəmməd oğlu Abbas,b862dd0a-8468-462d-b0de-fe62b90d83b9
Aqiyə Həbib qızı Naxçıvanlı,b747f5d4-c4ff-4a35-a8a9-808bfffb7dfd
Araz Məmməd-Mübariz oğlu Əlizadə,c005c2f1-8ec2-4e00-8978-67f1a30fd6db
Arif Qafar oğlu Rəhimzadə,1f2547b9-b3f7-482e-a183-819a185721c3
Asim Nazim oğlu Mollazadə,05737925-2afe-435b-ae42-d2df29a6e538
Aslan Məmmədhüseyn oğlu Cəfərov,518f02f7-33d7-4150-b8e8-e7d7fd8092fa
Astan Nuşrəvan oğlu Şahverdiyev,07465a95-ee9e-48aa-83ae-b7391a839bb4
Aydın Böyükkişi oğlu Mirzəzadə,a0b0b692-8126-47f2-acf7-c52f4aa22ad6
Aydın Nəsir oğlu Hüseynov,eca61c07-3f67-456a-93f2-c3537a1b8e47
Aytən İnqilab qızı Mustafazadə,ef2f1b65-a1a1-4930-9b7a-8c575775f7d8
Azay Əjdər oğlu Quliyev,b7111d43-24c3-499c-ac38-2ebbb6ad7659
Azər Camal oğlu Badamov,60473f50-dbee-4f1a-b4e8-d7d93dc7d4de
Azər Şəmşid oğlu Kərimli,567c5199-a0fc-405c-902d-371ae1f6fc1d
Ağacan Qulam oğlu Abıyev,1aa20fe6-3b5f-4898-95f7-21ae8f0f1896
Ağalar İsrafil oğlu Vəliyev,285d2063-b1f5-4747-967f-d377dff59d93
Bahar Əvəz qızı Muradov,dbff6f18-6585-476b-b66a-b426c04649f8
Bahar Əvəz qızı Muradova,19e05e68-5282-45ca-9d54-524dad955d65
Bəxtiyar Həmzə oğlu Əliyev,02437d22-686c-4476-86d8-d34eb28c94ed
Bəxtiyar Yusif oğlu Sadıqov,98365ca7-d17a-4cb7-bf24-0abb2bbeeadf
Cavanşir Hümmət oğlu Paşazadə,c0b39b46-696b-42b5-9ebb-a22937e709b7
Cavanşir Əyyub oğlu Feyziyev,43eb1d75-0dc6-4dea-9267-d32c576bd36b
Cavid Həmid oğlu Osmanov,7e1fb16a-adf2-4360-a434-e2efd7921bc2
Cavid Qənbər oğlu Qurbanov,627c465b-bdeb-4494-bc97-b41288035c74
Ceyhun Yunis oğlu Osmanlı,590d6675-1a63-4217-a640-9eaf2f2a469d
Cəlal Əlirza oğlu Əliyev,5a8bc896-ae9f-48e3-ac49-fb6115181dc5
Dilarə Məmmədağa qızı Cəbrayılova,6f310392-7521-46cd-afa8-d344ff367e0a
Eldar Allahyar oğlu Quliyev,0523121e-a4c1-4803-abac-b86de0d0da35
Eldar Rza oğlu İbrahimov,a1b233ec-72b4-4bb9-a0b3-c4cf2c1acede
Eldəniz Adil oğlu Səlimov,0e9cd029-d3bf-45e3-a4f1-5f9652816a17
Elman Camal oğlu Məmmədov,1d847eb5-93bd-4fbb-a3c6-3dba9869098f
Elman Xudam oğlu Nəsirli,1fd1c938-9420-41aa-af5e-92ce3471112d
Elmira Hüseyn qızı Axundova,2eff5b23-9b6b-4f85-a322-36daa8126003
Elxan Sirac oğlu Süleymanov,cdcf9b01-6236-468a-9c2c-829b21cbe01f
Elçin Bəybala oğlu Quliyev,c6fad8d8-67f4-4952-baae-fff0d794ee63
Elşad Eldar oğlu Həsənov,f4cc69f2-6e1f-479f-9dc6-c975893bd1c8
Elşən Məmmədhənifə oğlu Musayev,4f14b872-6d61-4cf8-9585-b72c0ba3eefc
Fazil Qəzənfər oğlu Mustafa,388873e0-74b7-4621-9f36-da1eba8b602c
Flora Qasım qızı Qasımova,65fc6d71-7d3c-457e-8989-cf178a52d451
Fuad Rauf oğlu Muradov,45b7e64d-144e-484f-a08b-c976fcc450ba
Fərəc İbrahim oğlu Quliyev,87c1d307-fbf4-4ac0-b8a1-356317138211
Fəttah Səməd oğlu Heydərov,8b3298e0-5904-4076-b2a1-7de52706dabc
Fəzail Feyruz oğlu İbrahimli,1216d8b7-4925-40b0-9f42-1853e084671a
Fəzail Rəhim oğlu Ağamalı,980d5cce-a1fb-4b95-a8be-1d4df0c13705
Gövhər Baxşəli qızı Baxşəliyeva,f0ab1f3f-a800-4c3e-a6ba-f6a6c5640b38
Hacı Hacıbaba oğlu Salayev,b3423405-061b-40ae-acb8-e355931e4ca3
Hadı Musa oğlu Rəcəbli,c555dae3-0f7c-4e60-83ce-3399c6f98292
Hikmət Baba oğlu Məmmədov,0bdd94d7-3d87-4b1b-9ba6-f80d46852c09
Hikmət İsmayıl oğlu Atayev,a8bc1320-fe12-4680-a30b-64f66d2ff8f1
Hüseynbala Fazil oğlu Mirələmov,c86a4185-5f49-4814-8792-b14cbb95da5f
İlham Kazım oğlu Məmmədov,a27e8abf-14a5-435c-911f-fb50a0e18a54
İlham Əlisəftər oğlu Əliyev,ee6bc37f-056f-4619-8f10-d8539ae4a6a6
İmamverdi İbiş oğlu İsmayılov,c814539c-62e7-4df4-ba35-1ddaf4520a85
İqbal Nəriman oğlu Məmmədov,3742d69f-b5ef-4121-b005-7cb51d0a2f62
İsa Əkbər oğlu Həbibbəyli,7abefcb2-2518-415d-af6b-e39c2a636010
Jalə Fazil qızı Əliyeva,43d1961a-6acb-4424-88a3-f73ebf5abbb9
Kamaləddin Nəsrəddin oğlu Qafarov,073d8207-9544-429e-ae23-87d3de775fe3
Kamilə Əli Ağa qızı Əliyeva,bf491a45-71b1-4321-b43f-4be4ecf2a002
Kamran Fərhad oğlu Bayramov,794ef837-9cfd-4c2e-b360-2906bbfef21b
Kamran Telman oğlu Nəbizadə,8e526f1d-f26f-451a-a276-bb4a2c862279
Madər Ələsgər oğlu Musayev,c9fd3ad6-de77-4373-934b-3dbe1000426b
Mahir Məhəmmədəli oğlu Aslanov,7f656162-00b7-4b3a-8cd1-e82542f0b16a
Mahir Tapdıq oğlu Abbaszadə,c75d95f0-388d-4d44-ab16-164fa8f6d3a0
Malik Əvəz oğlu Həsənov,08536619-f726-4c21-9565-395e98567a94
Mehriban Arif qızı Əliyeva,c1a983ad-923e-4351-8a65-899328fb420a
Mirkazım Mirməhəmməd oğlu Kazımov,245ccb5d-9ed2-4c86-ba10-9e758a929c98
Mirzəcan Mirzəmməd oğlu Xəlilov,b0b22f2d-b49b-461f-b7c6-510ab4339f29
Mixail Yuri oğlu Zabelin,b179764f-b85f-4c7d-99a0-6c4a4d9afb94
Musa Cəfər oğlu Qasımlı,4ef5f348-7378-4537-8ab1-00abc6ba2fc3
Musa İsa oğlu Quliyev (Urud),9704f493-3d47-49dd-98b0-f68ddfe5021e
Muxtar Bahadur oğlu Babayev,5401e0a2-5227-4895-b025-2fc59c3f9886
Mübariz Qəhrəman oğlu Qurbanlı,86662343-238f-4d8f-80d0-fedce7cdd0dd
Müslüm Mürsəl oğlu Məmmədov,2c7a1b5d-3af0-426d-bb34-bad16e60ded7
Məlahət İbrahim qızı Həsənova,95b85e69-91e8-4b35-8f29-55295cf9ca6c
Naqif Ələşrəf oğlu Həmzəyev,9cd36f51-4233-40dc-a96d-964f7151c29d
Nazim Fərəc oğlu Fərəcov,17b179a5-c2d7-48db-a619-2be8376e88aa
Nizami Qulu oğlu Cəfərov,1aaae4d9-29be-41c4-8983-4d024445f829
Novruzəli Davud oğlu Aslanov,a2592b4c-7c99-45f9-8c3d-92ee7ca5f0b2
Nəriman Əlibala oğlu Əliyev,c104635f-f9ee-4c71-80ef-0a397a1d0e17
Nəsib Məhəmməd oğlu Məhəməliyev,2e36eb38-3da5-495a-87fa-0d32db5a5337
Oqtay Sabir oğlu Əsədov,9b3f988d-4d8b-42ae-a0b7-0cd551340edd
Pərvin Orxan qızı Kərimzadə,dd7a3181-730c-4c09-9b4b-41b93738d2e1
Qüdrət Müzəffər oğlu Həsənquliyev,471b69b1-5846-4e1d-9be0-74babb235452
Qənirə Ələsgər qızı Paşayeva,6f1646b4-7fe2-4ce7-92ae-1379ee3eac4a
Rafael Baba oğlu Hüseynov,400dbdd9-2cff-457b-bf0d-8ec2256bfbde
Rafael Kamil oğlu Cəbrayılov,4167b686-103b-421e-997b-7f9de87de342
Rafiq Musa oğlu Məmmədhəsənov,5c044cd4-bc15-45a2-af72-f4a6a8a3f6a7
Rasim Nəsrəddin oğlu Musabəyov,daee6eb9-f670-487c-b9c7-9de3c9f916f4
Rauf Asif oğlu Əliyev,066ed279-9e3b-45ce-8f04-b2c4eaf0f066
Rövnəq İbrahim oğlu Abdullayev,78d3556d-b7ca-4ced-a8dd-39129defb69e
Rövşən Şükür oğlu Rzayev,d48b27e8-5e95-480c-a23d-851dd3dcd291
Rüfət Atakişi oğlu Quliyev,b2d51b1a-c4dd-45ea-afe3-45a19792046b
Rüstəm Gülabba oğlu Xəlilov,aeb553f5-7bd0-4dff-9f2e-2b7f787a58bb
Rəbiyyət Nurullah qızı Aslanova,1c08b4ae-a64d-4536-82dc-d571690b5356
Rəşad Məmmədqulu oğlu Mahmudov,09fdb99d-c965-463c-8374-240f9c36a99b
Sabir Kamal oğlu Hacıyev,fb684698-0ce8-427f-99d8-3bde9f871555
Sabir Xudu oğlu Rüstəmxanlı,eea734d4-73b5-4a32-bb6f-899bbf5922be
Sahib Eyvaz oğlu Alıyev,9138f89c-de97-4c02-bf42-b6d7467a52ad
Sahibə Əli qızı Qafarova,3426aefe-81b3-43d5-a96f-c4d02d7930b3
Sevinc Həbib qızı Fətəliyeva,9de1a6e4-7063-4a10-b4e0-a3b10ce9b9be
Sevinc Əmirəhməd qızı Hüseynova,005e014b-7276-425e-93db-bea1e96d69bc
Siyavuş Dünyamalı oğlu Novruzov,3565c586-fdd6-4cf1-a40f-cc6b63cbf5b6
Sona Sakit qızı Əliyeva,7e421c54-9fa7-471e-add4-6801b6c49afd
Sədaqət Süleyman qızı Vəliyeva,d46c1f93-ec46-4149-826c-f314375ed6eb
Səməd İsmayıl oğlu Seyidov,039cc198-ea3f-43fe-a402-cba43ff4fa48
Səttar Suliddin oğlu Mehbalıyev,014c0926-813f-4d75-aaf2-273a404cf144
Tahir Famil oğlu oğlu Mirkişili,99e3de2d-4834-47cb-8a47-718c2e85ab7a
Tahir Musa oğlu Rzayev,5fe84768-6fea-4a4d-8cbf-179e982f7154
Tahir Süleyman oğlu Süleymanov,4402fb23-bde4-4c39-93dd-575853ea6891
Tahir Zayıdağa oğlu Kərimli,ac4a1d36-d556-4234-93b3-10cd889e6896
Vahid Qazməmməd oğlu Əhmədov,3fd2d219-b387-40b4-958c-f41b010972f4
Valeh Feyruz oğlu Ələsgərov,1c0cabb8-5b53-44f6-9816-5f451a6c3978
Vasif Yusif oğlu Talıbov,d5155481-d936-449b-a7ec-a4b33a6cf7e0
Vüsal Əfqan oğlu Hüseynov,c0b25cca-200d-4758-9e67-cff239a0f205
Xanhüseyn Hüseynağa oğlu Kazımlı,47096ee1-be58-48f0-a46a-190b899e94d1
Xanlar Nuru oğlu Fətiyev,71095c82-2f85-42e6-9546-3f309b1b4bf9
Yaqub Mikayıl oğlu Mahmudov,19b75390-5a76-4413-aa52-771f8523d2e4
Yevda Sasun oğlu Abramov,eba8cb34-be4e-46d7-b375-810ec7f4206c
Zahid Məhərrəm oğlu Oruc,bcd92795-adb8-4be9-b4c7-3854fe0a873b
Zeynəb Yəhya qızı Xanlarova,eb6c405e-40a8-48e1-a769-f2d87667535d
Ziyad Əliabbas oğlu Səmədzadə,1acc2da0-aa08-4c26-820f-661b8bec3472
Ziyafət Abbas oğlu Əsgərov,976440b3-4d65-4ecd-8be4-2d26f5c6d936
Çingiz Aşralı oğlu Qənizadə,2db34f48-aae1-41ab-af78-f9731ebf7497
Ülvi Zahid oğlu Quliyev,c557addb-66fa-4ca7-91d3-bcc9f55935ce
Ülviyyə Cavanşir qızı Ağayeva,04707a95-4b7f-4af0-9b46-2b6306379d14
Ülviyyə Tapdıq qızı Həmzəyeva,51c7b65a-95a8-4c7d-a691-285572772f1f
Şahin Əmir oğlu İsmayılov,69ee46b3-b623-4ca5-a5fe-39c3a42b510c
Şəmsəddin Hümmət oğlu Hacıyev,cfd297b6-6f19-406c-bd65-ebaced8d8b81
Əflatun Əhməd oğlu Amaşov,f71ad850-4601-44e1-b558-0f3344b54bad
Əhliman Tapdıq oğlu Əmiraslanov,693683af-4793-4579-bc8e-3724a955750c
Əli Cavad oğlu Əhmədov,385c76c2-6648-45af-84c2-e079e4b8ac6a
Əli Məhəmməd oğlu Hüseynli,a2fc9a85-15fc-465a-a420-0cce918915ff
Əli Məhəmməd oğlu Hüseynov,632f55d1-0e6e-4660-be16-14fa4be847f5
Əli Əhməd oğlu Məsimli,20bf7e20-1695-42ea-9d07-275ac3334c7f
Əliağa İzzət oğlu Hüseynov,8a79504b-06d9-4adc-97f3-44dcaf7b11cf
Əsabil Qarakişi oğlu Qasımov,61e75c31-ef1b-4d50-acb3-8212c0eedba9
