name,id
Adil Abış oğlu Əliyev,ccb53ebb-1595-4087-9c14-40736bba1c0b
Aqil Məhəmməd oğlu Abbas,86563e2c-31a0-4693-8fef-58eb8ccf3277
Aqiyə Həbib qızı Naxçıvanlı,3c2463d8-3da1-452d-a5e7-cdac3d092ded
Araz Məmməd-Mübariz oğlu Əlizadə,1f96cc71-a587-45ee-a901-e75aaa90b110
Arif Qafar oğlu Rəhimzadə,520d93d5-45ae-4237-bea4-996494ac71fb
Asim Nazim oğlu Mollazadə,dcb0139a-8ec7-437b-81bf-801faf9d13bc
Aslan Məmmədhüseyn oğlu Cəfərov,ca1a609e-ed84-4d82-a569-4aad5e94ebaf
Astan Nuşrəvan oğlu Şahverdiyev,ed566c31-5100-4a7a-b8ac-beb87087b053
Aydın Böyükkişi oğlu Mirzəzadə,064ba94f-dfd6-4908-a4c4-a08e4f171e6c
Aydın Nəsir oğlu Hüseynov,3e57c055-f402-41ef-b904-9ff4aa50a532
Aytən İnqilab qızı Mustafazadə,37004919-f484-49fd-8558-98f203a19cb2
Azay Əjdər oğlu Quliyev,d389e2d8-3ccd-49d9-9bcc-4e77c0338e46
Azər Camal oğlu Badamov,b0e4f5b8-7b9e-4f38-996a-856d03f586da
Azər Şəmşid oğlu Kərimli,8e4da588-285a-43f9-84c6-6cbfbce9a6df
Ağacan Qulam oğlu Abıyev,345a14a7-72ae-4f4f-b14e-c23af8240a70
Ağalar İsrafil oğlu Vəliyev,309c708e-f057-4ee8-81ba-d803547d15b9
Bahar Əvəz qızı Muradov,554668a6-8fa8-4b42-bca1-2118cc372cac
Bahar Əvəz qızı Muradova,07d969d6-f64b-4b29-ba4e-19ee64336daf
Bəxtiyar Həmzə oğlu Əliyev,90c84f8c-6b84-4274-9439-4ef00e999f3f
Bəxtiyar Yusif oğlu Sadıqov,44f8ec9e-9b9d-4dbc-afa0-bdd598f3caa2
Cavanşir Hümmət oğlu Paşazadə,036eb6c5-c427-4bec-add1-a072bf7c9d11
Cavanşir Əyyub oğlu Feyziyev,6abb3d9f-0a60-4b16-adc5-ec11d864e19f
Cavid Həmid oğlu Osmanov,72426d88-0fb6-41e9-99a8-655e993996ea
Cavid Qənbər oğlu Qurbanov,7fcd605f-2e00-41f1-bbbc-44aef72b9eb1
Ceyhun Yunis oğlu Osmanlı,82cc4a57-1403-462d-9960-5c1ed56cce3e
Cəlal Əlirza oğlu Əliyev,8ff3880b-98ba-4efc-b01f-1b2155450ba7
Dilarə Məmmədağa qızı Cəbrayılova,7de3f0f0-9bd5-4fb4-8a52-43ab2eb00d09
Eldar Allahyar oğlu Quliyev,7270e2e3-41d1-4298-bd45-ca0498beff70
Eldar Rza oğlu İbrahimov,30044476-876b-420b-ad44-fc4e73e05e32
Eldəniz Adil oğlu Səlimov,6edbee07-be5e-4d73-9c39-f72dbd5221de
Elman Camal oğlu Məmmədov,680ef82f-6f8b-4771-b6e3-16d1a496eeed
Elman Xudam oğlu Nəsirli,c31cfc0f-7c07-4a24-9f12-b02f57945cdf
Elmira Hüseyn qızı Axundova,17df484b-cdf8-4407-9296-b6cc5b5e26df
Elxan Sirac oğlu Süleymanov,e9f57e1e-5f75-4690-9631-2226ee77afcc
Elçin Bəybala oğlu Quliyev,0510d2a7-9db7-4277-9ebc-6b334e36f692
Elşad Eldar oğlu Həsənov,2e310991-c67a-45f8-aeee-bf6bb336bf78
Elşən Məmmədhənifə oğlu Musayev,ef935818-fb99-4800-8384-dc6858ed4357
Fazil Qəzənfər oğlu Mustafa,32dca022-17af-4e7b-9f3e-d3ccb003e61c
Flora Qasım qızı Qasımova,df3d2249-9210-48b0-b99c-54cf9b516681
Fuad Rauf oğlu Muradov,308105f7-b60c-4022-bdd1-fe015d47c2ad
Fərəc İbrahim oğlu Quliyev,07f88b13-ad38-4fd4-9384-6a7e97de7338
Fəttah Səməd oğlu Heydərov,91238555-002c-4f4f-bdf4-2c2556c00da0
Fəzail Feyruz oğlu İbrahimli,1cfdd48e-d467-494c-a1e3-3d3339bbba73
Fəzail Rəhim oğlu Ağamalı,ff3327c4-3896-4184-8c89-71c675642bae
Gövhər Baxşəli qızı Baxşəliyeva,eb99e2fa-ab6a-49bf-ab43-221384756825
Hacı Hacıbaba oğlu Salayev,f78410a5-f042-4913-b5d3-ed18bb5c9b7c
Hadı Musa oğlu Rəcəbli,b21d8d92-7adf-4505-a18c-548c0a183917
Hikmət Baba oğlu Məmmədov,889573bc-2a2c-4035-9fdb-3d79141b6284
Hikmət İsmayıl oğlu Atayev,03ca2e93-7508-4013-aa8e-55c713b9a179
Hüseynbala Fazil oğlu Mirələmov,37f2ef20-a2ec-4e90-91d5-09675b86c024
İlham Kazım oğlu Məmmədov,b0359175-e682-4666-87f6-ab46a129289e
İlham Əlisəftər oğlu Əliyev,bb12f325-24ef-4972-bf13-ebf4f8121135
İmamverdi İbiş oğlu İsmayılov,40daa91c-a003-4f73-880a-27055626c06b
İqbal Nəriman oğlu Məmmədov,edd49c96-8540-4eae-94cc-28a373e6701d
İsa Əkbər oğlu Həbibbəyli,d26ff58f-d401-49e4-aa15-a3ebbfaeb10f
Jalə Fazil qızı Əliyeva,73aecca2-e7dc-42aa-b7ad-397f094d5988
Kamaləddin Nəsrəddin oğlu Qafarov,3875b027-31ef-40a4-9323-fca24e4e8b72
Kamilə Əli Ağa qızı Əliyeva,c85ecb81-b186-4ace-b130-ec3d7c06b663
Kamran Fərhad oğlu Bayramov,dc6ca913-ea3c-4d4b-8453-91469d68deeb
Kamran Telman oğlu Nəbizadə,e44f703f-b8e9-4853-a2e6-da6eccb08233
Madər Ələsgər oğlu Musayev,418265a3-e389-45f2-911e-2303044683c3
Mahir Məhəmmədəli oğlu Aslanov,88e6207c-fabf-4d10-a9c4-bc4b88e8dca2
Mahir Tapdıq oğlu Abbaszadə,d4b19ba0-2cde-49c9-9975-2120717499a1
Malik Əvəz oğlu Həsənov,5fac6c72-724b-459b-bdf3-61a50cf2739f
Mehriban Arif qızı Əliyeva,ba5fd355-aef8-4075-942b-689963e75f7d
Mirkazım Mirməhəmməd oğlu Kazımov,ea3ef8bd-2445-4c30-8179-c7aa4c86052a
Mirzəcan Mirzəmməd oğlu Xəlilov,46246153-6c5c-4601-8803-363027adc1ae
Mixail Yuri oğlu Zabelin,e90a8fa8-2319-45d7-b336-a9fa402069d9
Musa Cəfər oğlu Qasımlı,92bb9804-f78b-4b5c-9e2f-2f1ebdea3fb3
Musa İsa oğlu Quliyev (Urud),494a0d42-c27f-4704-a8cf-e6cb5ac6a0fd
Muxtar Bahadur oğlu Babayev,22589404-e546-4cbf-a578-060987289f9c
Mübariz Qəhrəman oğlu Qurbanlı,26fc7a55-b51f-4017-9af3-829a7be8a23a
Müslüm Mürsəl oğlu Məmmədov,9f8637c9-9d18-4e69-995d-a8622711d72f
Məlahət İbrahim qızı Həsənova,b5b90894-06e0-4942-8d0b-254ffcfebdfa
Naqif Ələşrəf oğlu Həmzəyev,ecabc6d3-bd70-44af-9485-c705c97e82e4
Nazim Fərəc oğlu Fərəcov,2672135f-1ef9-4149-9712-5655a569b2ad
Nizami Qulu oğlu Cəfərov,5c086090-d292-4286-8101-16320d1cdc74
Novruzəli Davud oğlu Aslanov,eddd7c68-b404-465d-918f-f5c1ea298a2a
Nəriman Əlibala oğlu Əliyev,9fda33e2-bbf9-42aa-83b6-a5ef096d6ca6
Nəsib Məhəmməd oğlu Məhəməliyev,22bb3099-6aa3-40e8-8fb9-1bc6df35d8ac
Oqtay Sabir oğlu Əsədov,ab1a9c6b-315b-4854-b76b-a67f41049c48
Pərvin Orxan qızı Kərimzadə,4abcb57b-758f-435b-af7e-a6244635acbc
Qüdrət Müzəffər oğlu Həsənquliyev,7b8f8625-aba0-4726-9d48-931fd26ed866
Qənirə Ələsgər qızı Paşayeva,735abd80-4ecb-457a-8991-95a805ed88fc
Rafael Baba oğlu Hüseynov,709e5f20-1481-4bae-befc-7a1c3a542673
Rafael Kamil oğlu Cəbrayılov,8d927d67-3348-4f4f-95d8-b0248b1b8c67
Rafiq Musa oğlu Məmmədhəsənov,d3eb7f9d-cc8f-480e-894c-363bd70ce518
Rasim Nəsrəddin oğlu Musabəyov,bcaed687-1f1e-4701-a704-4dbb0277c28a
Rauf Asif oğlu Əliyev,78fe655e-f416-49a4-b4c1-eda70abfefbc
Rövnəq İbrahim oğlu Abdullayev,47a861d7-cc20-4619-a539-f73ea2a43705
Rövşən Şükür oğlu Rzayev,974b0623-f1c8-413d-8f40-c33ba8fb9af7
Rüfət Atakişi oğlu Quliyev,5e700054-0a97-4459-a0ae-da317f750858
Rüstəm Gülabba oğlu Xəlilov,82cfa7b4-fe4b-4d20-88ac-a67d47584d41
Rəbiyyət Nurullah qızı Aslanova,eb2a2dac-38d6-4d85-870c-353db260d9f6
Rəşad Məmmədqulu oğlu Mahmudov,78842716-1b4c-4740-832d-f24c66333838
Sabir Kamal oğlu Hacıyev,48069b38-553e-45b6-906b-a7649ee71588
Sabir Xudu oğlu Rüstəmxanlı,c224b5bb-ac3d-471e-8476-5f2cc8727b88
Sahib Eyvaz oğlu Alıyev,f1796d80-8195-4564-84ec-6186e0b3f3de
Sahibə Əli qızı Qafarova,27fe96f9-2f3e-499f-ba7a-0be00cacdf67
Sevinc Həbib qızı Fətəliyeva,11b1b418-a51f-448b-bade-8d1b2103cc14
Sevinc Əmirəhməd qızı Hüseynova,c7e2d962-71f0-4451-8cce-a066cdb37893
Siyavuş Dünyamalı oğlu Novruzov,b886d009-c8ba-4bbd-8749-46b6a55ad79e
Sona Sakit qızı Əliyeva,b20c2e76-a642-4dd2-a3ce-5581ebeaae9f
Sədaqət Süleyman qızı Vəliyeva,f91e43ba-c425-4a7e-93f9-ee2aafd957ab
Səməd İsmayıl oğlu Seyidov,05a807b7-e6fc-4d07-b1d9-309b62bf120d
Səttar Suliddin oğlu Mehbalıyev,4a649b2c-b24c-4795-a632-15a319961205
Tahir Famil oğlu oğlu Mirkişili,d54ea870-78db-46ef-8a2f-4fcbc607e9d5
Tahir Musa oğlu Rzayev,3f077dbd-7dee-40f0-98b7-280d8429684d
Tahir Süleyman oğlu Süleymanov,01e34364-0ecf-4bc7-9662-683874209806
Tahir Zayıdağa oğlu Kərimli,e8cf96c0-8358-4e06-950e-8d619d862510
Vahid Qazməmməd oğlu Əhmədov,5c89377f-dfb8-4856-9386-84e3bc6a6297
Valeh Feyruz oğlu Ələsgərov,06bb99b5-2160-447d-a629-b3c96ada71c0
Vasif Yusif oğlu Talıbov,7c14bdb3-2b4c-40ae-9017-31fa412c400f
Vüsal Əfqan oğlu Hüseynov,f2515ecf-dcdb-4570-80e2-1d1a643d203d
Xanhüseyn Hüseynağa oğlu Kazımlı,32a44efa-5279-4e80-a414-daa002ea6370
Xanlar Nuru oğlu Fətiyev,a751c1cc-d53b-45fa-aeb9-680900145005
Yaqub Mikayıl oğlu Mahmudov,d8353d9f-51a6-4ad1-9c59-2b4d7425761c
Yevda Sasun oğlu Abramov,ab511ae7-a9eb-49cf-b750-fda11b3268dc
Zahid Məhərrəm oğlu Oruc,139496f1-26a3-468e-965a-7b156fceb746
Zeynəb Yəhya qızı Xanlarova,ba7fe5ae-3f59-4b06-a506-87940b1f11f2
Ziyad Əliabbas oğlu Səmədzadə,e179c85b-0e64-4f34-8ec3-60960111f0a5
Ziyafət Abbas oğlu Əsgərov,d8e0e109-f907-422e-84c1-563ac522baf1
Çingiz Aşralı oğlu Qənizadə,21035c27-c342-4a8f-af07-aa775fb79def
Ülvi Zahid oğlu Quliyev,ffc153ee-8835-4b47-87b5-da2a9d86523b
Ülviyyə Cavanşir qızı Ağayeva,75acf557-2944-4346-8375-48eb80940db5
Ülviyyə Tapdıq qızı Həmzəyeva,0627981b-7e99-4a05-90d6-800491c72437
Şahin Əmir oğlu İsmayılov,ed136eca-ff16-4735-ad77-2dcd3eb3fd9e
Şəmsəddin Hümmət oğlu Hacıyev,ee6e2745-bb73-45ff-b376-9547802252ea
Əflatun Əhməd oğlu Amaşov,e9feabf4-ee2a-4b77-85c5-8e43e9a8c418
Əhliman Tapdıq oğlu Əmiraslanov,abe82ca6-8c4e-4e6d-a2a0-3d69b2c353b7
Əli Cavad oğlu Əhmədov,1b246071-ba00-4a6e-a37c-b40ac9ef8a28
Əli Məhəmməd oğlu Hüseynli,3736e80a-7e5b-43a5-9ffa-cda5c0522156
Əli Məhəmməd oğlu Hüseynov,e2c13d39-5cf6-48cb-8658-5243e3959bd6
Əli Əhməd oğlu Məsimli,f9de3e23-41f4-4692-9479-235bdab0f77a
Əliağa İzzət oğlu Hüseynov,71a12153-4cef-4073-8169-01f62580ab0e
Əsabil Qarakişi oğlu Qasımov,a5f55df2-c30e-4e4e-95cc-a75cf0c6e035
