name,id
Adil Abış oğlu Əliyev,8e103aef-4da5-4b09-a868-dfbc7a727d4b
Aqil Məhəmməd oğlu Abbas,e239e9c9-1497-47d9-a40f-05eafd82b977
Aqiyə Həbib qızı Naxçıvanlı,b267f5e7-340a-42f7-8710-ec99ced4a37b
Araz Məmməd-Mübariz oğlu Əlizadə,1379c246-15f9-4642-9d2a-5baea5ba4269
Arif Qafar oğlu Rəhimzadə,758c38f4-c600-44f9-9313-88cebb087a84
Asim Nazim oğlu Mollazadə,5e2820b3-1ddb-43c3-9e72-4c9e7b751753
Aslan Məmmədhüseyn oğlu Cəfərov,c6e46a03-2544-4423-97cb-3411c808801a
Astan Nuşrəvan oğlu Şahverdiyev,8d83e4ac-dbee-4d4c-aed3-b3cab988044d
Aydın Böyükkişi oğlu Mirzəzadə,1cc4d39e-6f23-4207-9509-1816b4544fde
Aydın Nəsir oğlu Hüseynov,c9018568-864a-4aa5-992a-d384858613c1
Aytən İnqilab qızı Mustafazadə,4205b3e7-2338-4fd7-ba7f-efb7c1f9612e
Azay Əjdər oğlu Quliyev,befee2f1-e802-4862-a29d-b0b05a6dc840
Azər Camal oğlu Badamov,d099c8ba-22ce-4814-b2a4-0c6f42898c78
Azər Şəmşid oğlu Kərimli,433bdcda-bf5d-4568-a78b-203c3ae8fbb0
Ağacan Qulam oğlu Abıyev,f461585c-d6b4-4a6b-99b4-d51c81c726b3
Ağalar İsrafil oğlu Vəliyev,c0075dc1-f7b7-4969-bdf3-1eb17519556d
Bahar Əvəz qızı Muradov,a6164edf-9cf0-4905-aa30-566bb11ea1ab
Bahar Əvəz qızı Muradova,a877eb90-ccbe-4556-a4f2-829cb6d42ff2
Bəxtiyar Həmzə oğlu Əliyev,743dad74-da45-4221-b523-db21bb874f6f
Bəxtiyar Yusif oğlu Sadıqov,6149d062-406d-459c-af34-6418637bf5a3
Cavanşir Hümmət oğlu Paşazadə,c2eb1615-f24a-4af1-8b43-a3be0af73ed5
Cavanşir Əyyub oğlu Feyziyev,acb89dd0-f365-4831-97fe-3f87250dcc9f
Cavid Həmid oğlu Osmanov,659c29ed-21d2-489e-854a-7788c91c005f
Cavid Qənbər oğlu Qurbanov,8538f4e9-6c46-4392-b886-7fddba693b45
Ceyhun Yunis oğlu Osmanlı,f9dc2f9e-79c1-46a4-a96b-c9f1cf257add
Cəlal Əlirza oğlu Əliyev,f3342a00-88ae-4adc-8267-9de600712e28
Dilarə Məmmədağa qızı Cəbrayılova,061088fa-490d-45a2-899f-967fc9e26220
Eldar Allahyar oğlu Quliyev,c4d3a465-2c87-4b0e-ac5b-7ceca6e39c94
Eldar Rza oğlu İbrahimov,cab97e56-fa6e-4504-b9b9-79c5df918311
Eldəniz Adil oğlu Səlimov,43268d11-2d8f-47be-9d29-d5ced43dd53c
Elman Camal oğlu Məmmədov,e55440ba-dcb6-4080-84cc-79e5dc1d68ef
Elman Xudam oğlu Nəsirli,7e348f92-cc00-4da5-8c74-60f947e06036
Elmira Hüseyn qızı Axundova,6823b430-30e8-422f-93f4-616a4f627c81
Elxan Sirac oğlu Süleymanov,c55ff2d7-9805-4d5a-b17c-5079fd2025cb
Elçin Bəybala oğlu Quliyev,c5624574-3a64-4550-a134-b26ec23cdbfc
Elşad Eldar oğlu Həsənov,294b557c-9a9f-4bc2-b52e-916fd78f158d
Elşən Məmmədhənifə oğlu Musayev,df2fae8a-7be7-4260-88cc-25ceacc5f0ab
Fazil Qəzənfər oğlu Mustafa,9cbc2920-999a-4d0f-af2a-9e0b9b078597
Flora Qasım qızı Qasımova,ef725fc7-50dc-48a8-aa68-374f895463ac
Fuad Rauf oğlu Muradov,c73c3572-2829-4976-ad30-86be7a4af095
Fərəc İbrahim oğlu Quliyev,1a1020a9-6c95-4525-9237-612d2396ef89
Fəttah Səməd oğlu Heydərov,213a5a5a-d7b0-42aa-989b-e89ccf755ba6
Fəzail Feyruz oğlu İbrahimli,3157be40-13c6-41da-97c6-50f4f1e9ba78
Fəzail Rəhim oğlu Ağamalı,09ea1102-fd89-487a-8cf2-04db776484fa
Gövhər Baxşəli qızı Baxşəliyeva,e5c1a537-9497-4a36-8d1e-88a92319002a
Hacı Hacıbaba oğlu Salayev,ea6f54f2-4d97-454e-ad03-063604afdb00
Hadı Musa oğlu Rəcəbli,2e123796-c28c-4666-a2a0-ae9f6147b42b
Hikmət Baba oğlu Məmmədov,41715a6c-de7f-4386-af01-76f50fd75ec0
Hikmət İsmayıl oğlu Atayev,84990ebc-3a42-45f4-ae01-ac8de5ecef1a
Hüseynbala Fazil oğlu Mirələmov,fb6ce681-4d7f-48c6-a59d-9c2042c21f72
İlham Kazım oğlu Məmmədov,dd63fd56-51ce-4775-8865-cbd4fd5ca3c0
İlham Əlisəftər oğlu Əliyev,a030a5a5-e938-4651-828d-45bd85860386
İmamverdi İbiş oğlu İsmayılov,d7df2578-c04b-4d25-b8d4-cc1dcd51c35b
İqbal Nəriman oğlu Məmmədov,0d93530e-528f-4e0b-91bb-504725d3c40a
İsa Əkbər oğlu Həbibbəyli,ac688b5b-ad46-45ce-bb7a-042bff9187c4
Jalə Fazil qızı Əliyeva,09143612-587c-44f9-9cff-370bf16077b4
Kamaləddin Nəsrəddin oğlu Qafarov,2f33e746-7498-429f-83ce-53e964d5b487
Kamilə Əli Ağa qızı Əliyeva,01db8d5e-34a3-4f3d-8c2f-3e9da54867fc
Kamran Fərhad oğlu Bayramov,d940e5c5-8279-4ed4-894c-3df795cbfa11
Kamran Telman oğlu Nəbizadə,f388ad48-fc03-4467-a012-c99fe40c3629
Madər Ələsgər oğlu Musayev,393a4521-d555-4329-9a6d-4f4688d06cb5
Mahir Məhəmmədəli oğlu Aslanov,b0778cc3-5d39-4258-a477-433b86dcb04f
Mahir Tapdıq oğlu Abbaszadə,6f84ba75-4ca5-4c0a-ad75-adba0b6e0f1c
Malik Əvəz oğlu Həsənov,3304d5f2-67ce-466d-a2f1-43be8448e5f9
Mehriban Arif qızı Əliyeva,3dffe4bf-17c8-45aa-ba3a-8cc4668bee97
Mirkazım Mirməhəmməd oğlu Kazımov,f179fe9b-2c0e-4ecf-885a-8aaf19acad23
Mirzəcan Mirzəmməd oğlu Xəlilov,aec18864-c930-472c-bbcc-1547fa6e9b04
Mixail Yuri oğlu Zabelin,d2b25a28-9329-480e-a0cf-7f8d8b58b72f
Musa Cəfər oğlu Qasımlı,10330013-4fb4-452b-ac30-63b911bd4f74
Musa İsa oğlu Quliyev (Urud),b9f72536-0a39-470b-89fe-345f26072be7
Muxtar Bahadur oğlu Babayev,e4785217-4c72-49fa-99bd-87bf47ad9aa1
Mübariz Qəhrəman oğlu Qurbanlı,680e7b66-1a84-4aa0-aeea-2a4d800c1738
Müslüm Mürsəl oğlu Məmmədov,913e80c8-a8df-4268-a2ef-d3f186d04e0e
Məlahət İbrahim qızı Həsənova,97a520a1-ed4b-4d1c-b675-eb66dd374792
Naqif Ələşrəf oğlu Həmzəyev,94fc74cc-b697-4bce-94ad-04b60788c401
Nazim Fərəc oğlu Fərəcov,bff24372-04a8-4b61-8252-c4da6335bbb2
Nizami Qulu oğlu Cəfərov,d039148f-0a2a-4364-b5df-99588be428f3
Novruzəli Davud oğlu Aslanov,14f4dd49-01ed-4edc-b7a9-3750afc609ac
Nəriman Əlibala oğlu Əliyev,518c6e1f-db23-427a-a910-6479f2c02190
Nəsib Məhəmməd oğlu Məhəməliyev,4aa9ea27-5e53-4a73-a0ca-300f56b9e9ea
Oqtay Sabir oğlu Əsədov,82086e1a-b587-4e12-a5f5-956bacade56f
Pərvin Orxan qızı Kərimzadə,c0b57af4-e150-442e-b9a8-8f34238490ae
Qüdrət Müzəffər oğlu Həsənquliyev,00e6fc40-162a-499f-9ab9-f1622b8c1a88
Qənirə Ələsgər qızı Paşayeva,af7f3abb-f15a-434f-95f3-6bd5d07c9788
Rafael Baba oğlu Hüseynov,0bc46cb3-de12-4ff9-b477-b162ff82cc1f
Rafael Kamil oğlu Cəbrayılov,bb57b2ef-2dfa-4236-8462-cd931d545be9
Rafiq Musa oğlu Məmmədhəsənov,c34f35f4-6cba-4102-98d3-5b12e4cb1337
Rasim Nəsrəddin oğlu Musabəyov,6fd2002a-129b-40aa-bda3-a07f72331ba4
Rauf Asif oğlu Əliyev,d36fe616-881c-4688-af84-cfa3e682a8c5
Rövnəq İbrahim oğlu Abdullayev,f4b0c232-abc9-4944-b6a9-c0d179f8116d
Rövşən Şükür oğlu Rzayev,ae0dc9f8-21f2-44f0-ae3c-d2edad907d53
Rüfət Atakişi oğlu Quliyev,f1a3bbf7-91b6-49d5-b636-8c1bd1f7ebde
Rüstəm Gülabba oğlu Xəlilov,2eb9ba36-1c96-430f-8264-5836bb2398ef
Rəbiyyət Nurullah qızı Aslanova,764d02e9-f2af-432f-a5d9-fe790af0b141
Rəşad Məmmədqulu oğlu Mahmudov,d88957db-5fc0-4cdd-8c96-08dada43efe8
Sabir Kamal oğlu Hacıyev,a4b93df5-0fdb-48ab-ad3b-1678ddc4928b
Sabir Xudu oğlu Rüstəmxanlı,6996b63a-36d0-4eca-a693-6dc68739c04e
Sahib Eyvaz oğlu Alıyev,60af4f68-1fb2-4499-b5ca-fb4b41682a28
Sahibə Əli qızı Qafarova,dbdf95cb-33d5-4473-af3a-d64db30a0b57
Sevinc Həbib qızı Fətəliyeva,b86354ea-920d-45c0-9542-6da4d4ce821a
Sevinc Əmirəhməd qızı Hüseynova,44475070-10ca-42c3-9e10-2160f773a34e
Siyavuş Dünyamalı oğlu Novruzov,6724ca2b-9475-491c-9d90-590cfd961aa1
Sona Sakit qızı Əliyeva,c7a56f17-8674-4372-9a8d-87f681efd95c
Sədaqət Süleyman qızı Vəliyeva,e2762cee-8b7a-40a8-9a63-a16d9e872a5f
Səməd İsmayıl oğlu Seyidov,b8223d45-94e1-4cca-bb1c-48d9d1362d9b
Səttar Suliddin oğlu Mehbalıyev,9fb28a91-05dc-49fe-87f2-1b6b42f2f9cf
Tahir Famil oğlu oğlu Mirkişili,7eb39075-6435-42cc-b920-0edc8b62427a
Tahir Musa oğlu Rzayev,00706e63-70a6-4d0f-8af5-84a243d378fa
Tahir Süleyman oğlu Süleymanov,f033f353-2cf8-4c73-a3eb-f51859786b51
Tahir Zayıdağa oğlu Kərimli,6dc2f105-a8ab-4647-bd7d-00303dd83825
Vahid Qazməmməd oğlu Əhmədov,c6e60b62-fc05-46cd-a971-f704a140667e
Valeh Feyruz oğlu Ələsgərov,83276e53-3b9c-44c2-b534-867e7cfb5071
Vasif Yusif oğlu Talıbov,a90df423-9ed3-40d6-9256-6b8befb41f7a
Vüsal Əfqan oğlu Hüseynov,d36b1b98-271e-4af4-99e7-b9f31378bb36
Xanhüseyn Hüseynağa oğlu Kazımlı,c279e60e-3cfb-4f43-ac4f-d72d382695a4
Xanlar Nuru oğlu Fətiyev,6107b286-b051-419d-aba3-0e9abc026098
Yaqub Mikayıl oğlu Mahmudov,28824b1c-32d1-4515-9432-e558a4985ca9
Yevda Sasun oğlu Abramov,5499b964-f61f-4ed9-b50e-5ce84e4e52ae
Zahid Məhərrəm oğlu Oruc,e92a4889-217c-4917-aef8-8f25ddc15b30
Zeynəb Yəhya qızı Xanlarova,bbb8aba0-b495-4dfa-9d93-48532fdf67b2
Ziyad Əliabbas oğlu Səmədzadə,5c8b9673-0758-4b80-9ddc-566e57b7b591
Ziyafət Abbas oğlu Əsgərov,ee61929b-6fcb-40d0-8465-6d7a472b5df5
Çingiz Aşralı oğlu Qənizadə,b741bd97-e000-4865-9424-e61c37ec2faa
Ülvi Zahid oğlu Quliyev,4dc5feb6-9c2e-464d-ab21-7ff2bdced586
Ülviyyə Cavanşir qızı Ağayeva,ab2a3d32-f48a-4479-b128-ab38a2000fc3
Ülviyyə Tapdıq qızı Həmzəyeva,eeaf8888-dcc2-4c35-884c-1a9b439c2702
Şahin Əmir oğlu İsmayılov,23a9f0fe-0593-4cab-b6b0-969c3f8ba50d
Şəmsəddin Hümmət oğlu Hacıyev,6c141f7f-6fa0-4129-b1b2-63dc17c0334e
Əflatun Əhməd oğlu Amaşov,fa615af2-c875-4524-ae38-a1c6faa74e03
Əhliman Tapdıq oğlu Əmiraslanov,3537a53c-afd6-4a7b-9854-58ec2515f988
Əli Cavad oğlu Əhmədov,d6cc2f2a-7b8c-4a49-a148-66f0a033ba57
Əli Məhəmməd oğlu Hüseynli,13806980-09ac-46f6-b378-8074af2c7c74
Əli Məhəmməd oğlu Hüseynov,7e447109-9868-4824-ab41-cedab7de1dd1
Əli Əhməd oğlu Məsimli,dc50e07c-0ef7-475f-84e4-466dd6ea52f9
Əliağa İzzət oğlu Hüseynov,f31e264e-ca2c-4c08-ba8e-a8eeb9d443a9
Əsabil Qarakişi oğlu Qasımov,70e13204-a77b-413f-96e1-2a58d1166906
