name,id
Adil Abış oğlu Əliyev,5434d652-970b-4613-b696-17fd52097d8b
Aqil Məhəmməd oğlu Abbas,df0e8150-a634-45bd-b01d-fcee207e25ea
Aqiyə Həbib qızı Naxçıvanlı,6b647589-aa91-45fa-9aab-6a08944e3e90
Araz Məmməd-Mübariz oğlu Əlizadə,4b249138-36d1-4fb5-85ec-f6c782484aaf
Arif Qafar oğlu Rəhimzadə,a45172f7-c988-4af1-b668-51c951a432f2
Asim Nazim oğlu Mollazadə,ae64b22a-9fec-40e9-b33e-af94bc4843fb
Aslan Məmmədhüseyn oğlu Cəfərov,88dba6a0-8242-4566-bae3-a428337d6c20
Astan Nuşrəvan oğlu Şahverdiyev,77f5fab0-c17e-4adf-8f50-a2f078c85253
Aydın Böyükkişi oğlu Mirzəzadə,f0ddc4a0-53eb-43f3-a591-8709ff9ebb2b
Aydın Nəsir oğlu Hüseynov,d95d8fbb-5ef2-42b2-a579-c883cf5a652d
Aytən İnqilab qızı Mustafazadə,1e8e10d4-8ccc-42a3-9828-253fc493581c
Azay Əjdər oğlu Quliyev,4b4d3779-da76-4689-b906-a1a78fdef0a9
Azər Camal oğlu Badamov,c2ea6a9e-57ff-48fe-8941-e801b05f8ccc
Azər Şəmşid oğlu Kərimli,4412dbbd-d4bd-4920-8757-ff987eab1c7c
Ağacan Qulam oğlu Abıyev,f5f2e55d-94aa-4e9a-92e2-a7bcc8254e2f
Ağalar İsrafil oğlu Vəliyev,f6420777-cdea-4173-862b-2e97712e298d
Bahar Əvəz qızı Muradov,b323afff-724b-4024-8d55-8d75567db278
Bahar Əvəz qızı Muradova,2b5777f1-86e7-4d2a-9442-76c11aef2052
Bəxtiyar Həmzə oğlu Əliyev,718d15ae-50de-48ca-82e3-cd4992235dab
Bəxtiyar Yusif oğlu Sadıqov,9be71cb3-da2d-48b4-8fbe-0e2d1bb23bdd
Cavanşir Hümmət oğlu Paşazadə,30ed9f6d-1aaf-4015-8afe-3116d304f848
Cavanşir Əyyub oğlu Feyziyev,f323695b-bc17-415f-853b-cae55b3a560e
Cavid Həmid oğlu Osmanov,09acf9e2-a69b-4781-9d14-005e145ca426
Cavid Qənbər oğlu Qurbanov,8618ccb9-9727-42d1-a533-514aeae0d302
Ceyhun Yunis oğlu Osmanlı,dce1cf07-5d16-4bf9-8982-13b445e4b320
Cəlal Əlirza oğlu Əliyev,2298d806-9c09-42e9-8d31-8ce4da15f33a
Dilarə Məmmədağa qızı Cəbrayılova,68d064e2-1c70-4eaa-81ea-986bc4e7ed84
Eldar Allahyar oğlu Quliyev,d8606caa-9c73-48c6-9b9f-7543cc068108
Eldar Rza oğlu İbrahimov,b7f86d6a-0758-47fa-9da1-bf9fce2244cf
Eldəniz Adil oğlu Səlimov,14ade1f3-8ace-4169-8f99-dada7d006c63
Elman Camal oğlu Məmmədov,49f019b6-6844-4f06-bc37-e1f474d6f297
Elman Xudam oğlu Nəsirli,be912ad1-19b7-4c1f-9628-89ccf0f0552e
Elmira Hüseyn qızı Axundova,f30b076b-4451-4c5b-a4cc-b281cb74698c
Elxan Sirac oğlu Süleymanov,0809f73a-6d87-4056-bdbd-1c4b4cae7ff3
Elçin Bəybala oğlu Quliyev,aa11e9c1-f238-460b-a35d-ef5f57fa788b
Elşad Eldar oğlu Həsənov,85c1a562-d9ed-4da5-81b9-afb4be5fbd14
Elşən Məmmədhənifə oğlu Musayev,ed271c86-0a3f-449f-b3ab-b05e46321125
Fazil Qəzənfər oğlu Mustafa,3e012b24-8d90-4ed1-b96b-8b6568451c05
Flora Qasım qızı Qasımova,fe0de9df-ff76-4f53-a395-f4a117c62389
Fuad Rauf oğlu Muradov,d32bea48-14e2-4c95-b0bf-65638bb2fd71
Fərəc İbrahim oğlu Quliyev,7c449f29-e3ca-43a6-866b-ba918435e156
Fəttah Səməd oğlu Heydərov,3237f15d-80f5-40f9-b6e9-97fbf00772d1
Fəzail Feyruz oğlu İbrahimli,99757c23-fde0-4590-9c12-cc9dadda23c6
Fəzail Rəhim oğlu Ağamalı,dde04091-cfc2-44e4-8d5a-76f3b2997ae0
Gövhər Baxşəli qızı Baxşəliyeva,f608c51d-bd1c-4cc6-b849-be1b53fbf372
Hacı Hacıbaba oğlu Salayev,c057a871-943f-453d-8741-3f99bd6e66a0
Hadı Musa oğlu Rəcəbli,7109ef47-3b24-477b-b5ae-3f80190da1fd
Hikmət Baba oğlu Məmmədov,b667d6c3-4965-48a4-a0fd-b375be4946e0
Hikmət İsmayıl oğlu Atayev,e2f5386a-7ed7-48ea-ba97-230b4a6facd8
Hüseynbala Fazil oğlu Mirələmov,21ec8293-59a0-4490-bf94-4f5b8a35c872
İlham Kazım oğlu Məmmədov,b6d99c64-0262-4e86-8df3-c47eaedfd201
İlham Əlisəftər oğlu Əliyev,49c19292-55dd-4559-b976-80218db88c64
İmamverdi İbiş oğlu İsmayılov,907589c8-a764-4486-8512-5cef9a6cb3d1
İqbal Nəriman oğlu Məmmədov,67eb8540-51f8-4123-8dc9-8479d8519cb3
İsa Əkbər oğlu Həbibbəyli,0d6ffad1-0e07-438a-bb36-1249aec15e3e
Jalə Fazil qızı Əliyeva,ce71f605-2dcf-44f4-af7f-adf24fda8b9d
Kamaləddin Nəsrəddin oğlu Qafarov,a7cb01fa-83d9-4755-9f3b-292c206cd83f
Kamilə Əli Ağa qızı Əliyeva,81d7b6ad-1fef-4568-95e7-060ab6ad8593
Kamran Fərhad oğlu Bayramov,146bb435-f3c7-4cb3-8edf-01981a6c6bff
Kamran Telman oğlu Nəbizadə,2677e412-2e7a-4ac5-b6d6-f0688fff6e13
Madər Ələsgər oğlu Musayev,5497d9c7-361d-4a5d-83fb-0938c7d59fae
Mahir Məhəmmədəli oğlu Aslanov,6d487263-4642-4a5e-9bb8-7025b17d37b4
Mahir Tapdıq oğlu Abbaszadə,d50e1050-6498-4caa-989c-0186b5eb9f58
Malik Əvəz oğlu Həsənov,220b20f5-6650-4eb1-b8b0-fd1832b37f87
Mehriban Arif qızı Əliyeva,6b8d555b-9559-40f4-8b11-5d6e34c5f7fb
Mirkazım Mirməhəmməd oğlu Kazımov,5b26a7ea-cb75-4e6e-805d-f012faa1698b
Mirzəcan Mirzəmməd oğlu Xəlilov,8ca36692-adfa-494f-bc53-058f48578193
Mixail Yuri oğlu Zabelin,436fbf0d-826e-4669-af93-68e0f4d31194
Musa Cəfər oğlu Qasımlı,c7e07ffe-997c-4cd7-bfba-eb46c7978396
Musa İsa oğlu Quliyev (Urud),6dc4f2e2-e5bf-4c73-b145-e403db4039c2
Muxtar Bahadur oğlu Babayev,86ecc4f1-1c99-4c4d-bd34-aea64ff84e44
Mübariz Qəhrəman oğlu Qurbanlı,bc808894-e84a-47f3-9b15-1111551a2fcd
Müslüm Mürsəl oğlu Məmmədov,9c210b4a-f586-4cb0-a687-bf92ee820163
Məlahət İbrahim qızı Həsənova,9da0775b-5e19-4807-8f12-ebddffc467ac
Naqif Ələşrəf oğlu Həmzəyev,1345294a-636c-4070-8a3b-2a5a1a9afc11
Nazim Fərəc oğlu Fərəcov,c7aa5307-822d-4976-bc07-b7d99eaef97d
Nizami Qulu oğlu Cəfərov,343a885d-873c-474f-98f1-159ce6ef19f6
Novruzəli Davud oğlu Aslanov,3e52de68-ab48-4b34-9a10-ed814fc6de66
Nəriman Əlibala oğlu Əliyev,2121f8a2-cc8e-409e-9faa-8a7ecb66e84a
Nəsib Məhəmməd oğlu Məhəməliyev,99201b10-8e48-436a-ba7f-a33dde5f3919
Oqtay Sabir oğlu Əsədov,17905ec7-e212-4980-8fcc-d5ae076b798d
Pərvin Orxan qızı Kərimzadə,4dc29ef5-6593-41cf-8f77-7d1ddbaae351
Qüdrət Müzəffər oğlu Həsənquliyev,008bc37c-71fd-4870-a37d-9271e470161a
Qənirə Ələsgər qızı Paşayeva,6f8c333c-77eb-4007-9228-8fe283f2ee6f
Rafael Baba oğlu Hüseynov,7ea8edf7-2ba4-4fbf-8c59-97b6b8808f5d
Rafael Kamil oğlu Cəbrayılov,52c7bac5-d090-40dc-9084-af61e395ec4c
Rafiq Musa oğlu Məmmədhəsənov,0c437cb3-49b6-477e-8a05-7ce35f77026d
Rasim Nəsrəddin oğlu Musabəyov,826c489c-9d6c-4e4a-9c8c-9ebb2220710d
Rauf Asif oğlu Əliyev,6d7b70be-16d0-4e50-a7ef-5c08682b2c9e
Rövnəq İbrahim oğlu Abdullayev,353a695c-c1b9-497f-8037-459b94c3ed68
Rövşən Şükür oğlu Rzayev,1934104c-78ea-45e4-9caf-7398c7b90b22
Rüfət Atakişi oğlu Quliyev,214f1872-07fd-4a37-82cb-a8371beb42f9
Rüstəm Gülabba oğlu Xəlilov,96ccec0a-28c5-4666-b08b-d38c09335c06
Rəbiyyət Nurullah qızı Aslanova,0cd06775-1358-4843-91f9-6c3cd5a09c42
Rəşad Məmmədqulu oğlu Mahmudov,452e2837-a0b1-49e3-8865-301a1d06d7a7
Sabir Kamal oğlu Hacıyev,533cd1bc-4bf0-4b6f-a8c1-2172aa49e135
Sabir Xudu oğlu Rüstəmxanlı,c94a5075-b6ab-4c4d-be2d-0fc2011a75d2
Sahib Eyvaz oğlu Alıyev,7bd6389e-ff96-4b1a-b950-83d0e693ea92
Sahibə Əli qızı Qafarova,55da5248-cfd0-4e50-b597-c05fade97946
Sevinc Həbib qızı Fətəliyeva,711f1934-333e-4a7a-a1f6-60fc50f50914
Sevinc Əmirəhməd qızı Hüseynova,6c88c42a-4fb3-4c07-b3d9-c71d6e9f3989
Siyavuş Dünyamalı oğlu Novruzov,8cc555e9-193c-4caa-aab8-f0052872577c
Sona Sakit qızı Əliyeva,5f9a3c6d-5088-42f5-8d66-33c5f28a434c
Sədaqət Süleyman qızı Vəliyeva,bfde504f-a562-49fd-b8cf-b3daa35d8b28
Səməd İsmayıl oğlu Seyidov,01557ffb-63ac-45bc-9e79-09a2e4e4f2a6
Səttar Suliddin oğlu Mehbalıyev,b3ebb705-4022-4e8c-8aec-b29d1ce292a5
Tahir Famil oğlu oğlu Mirkişili,0816d708-977f-4184-874e-1a8c469a7189
Tahir Musa oğlu Rzayev,2a274d8f-70b6-4427-b786-89e1d52c21e6
Tahir Süleyman oğlu Süleymanov,fffe24a2-0048-4c3a-88d5-94d8cd2f2a11
Tahir Zayıdağa oğlu Kərimli,c1c68cdc-4b7d-42ac-8dc3-6ae25730cb17
Vahid Qazməmməd oğlu Əhmədov,c7fac580-15f6-445d-8387-78c5fa8f205a
Valeh Feyruz oğlu Ələsgərov,bdb51053-d0b4-4e0e-ac5a-41d441a0819e
Vasif Yusif oğlu Talıbov,1bf39593-9c1d-4fda-95ae-97dc276517c3
Vüsal Əfqan oğlu Hüseynov,07e107e7-05b8-4a10-a86e-8006738228b2
Xanhüseyn Hüseynağa oğlu Kazımlı,555f9f84-9330-42d7-9ecd-c00389a84cdb
Xanlar Nuru oğlu Fətiyev,5cb9a894-7982-49ad-9e0b-ca8f1c6799e4
Yaqub Mikayıl oğlu Mahmudov,5007f39e-b867-4f2e-afb7-89c037c25281
Yevda Sasun oğlu Abramov,c4e438b5-8b97-4e88-9571-762d9d5e0324
Zahid Məhərrəm oğlu Oruc,a0e25c03-7204-419b-b303-e5b8b15643b3
Zeynəb Yəhya qızı Xanlarova,908122e1-f184-4d92-b3ce-1ba4f47046ae
Ziyad Əliabbas oğlu Səmədzadə,fe3e59c2-d40a-4d21-b23b-688253db1c4c
Ziyafət Abbas oğlu Əsgərov,e9dc45d6-f4b6-4619-9574-58336393c2ae
Çingiz Aşralı oğlu Qənizadə,82a84a0d-d06a-4897-b7ef-1a13d77e60e6
Ülvi Zahid oğlu Quliyev,15cdccee-06ec-401f-abda-2ba7aa3de3d9
Ülviyyə Cavanşir qızı Ağayeva,3bf19c9e-4603-40d0-b4bb-897b7cf3c2f3
Ülviyyə Tapdıq qızı Həmzəyeva,134547d9-f483-493c-8eda-661762c7d469
Şahin Əmir oğlu İsmayılov,e9132fb6-0e3e-4ef8-bf26-197c9c984593
Şəmsəddin Hümmət oğlu Hacıyev,240c06c6-ad05-4b5b-94b0-ea624a96e92b
Əflatun Əhməd oğlu Amaşov,7f52609d-fc64-417c-9226-776b4cc36c2d
Əhliman Tapdıq oğlu Əmiraslanov,b77f5129-eaf6-4b08-b467-5fdfada42cfe
Əli Cavad oğlu Əhmədov,2d5a40af-cdac-428a-aad7-6762c29a24e4
Əli Məhəmməd oğlu Hüseynli,99485b85-db01-40c9-a231-0210d8ffa47e
Əli Məhəmməd oğlu Hüseynov,4a51dcc4-4295-4ae0-8e81-c8bdbdf472c8
Əli Əhməd oğlu Məsimli,1308ce55-24f1-40a4-acca-b3ed5c3cb68c
Əliağa İzzət oğlu Hüseynov,7cb551f2-cf2a-4b0d-9c02-84d254b03ca4
Əsabil Qarakişi oğlu Qasımov,fd035769-b43f-4546-82a1-369ef35fcd29
