name,id
Adil Abış oğlu Əliyev,9ea17fa9-2c0d-42f6-81eb-d4e08fdc47d2
Aqil Məhəmməd oğlu Abbas,822b368f-17b4-458f-8499-d7cc0860ea4c
Aqiyə Həbib qızı Naxçıvanlı,7f5f393a-4def-4ded-8544-41da9f3dda76
Araz Məmməd-Mübariz oğlu Əlizadə,0855d7c8-50b2-495f-8e8e-dcaded6a3493
Arif Qafar oğlu Rəhimzadə,e32394fc-353c-4e1f-a12e-23f10990d2e3
Asim Nazim oğlu Mollazadə,15cc0eb5-6882-4c89-9d92-f3d1147206dc
Aslan Məmmədhüseyn oğlu Cəfərov,b8da7f2f-871e-469a-808c-9cc9885e6653
Astan Nuşrəvan oğlu Şahverdiyev,d6acd8de-b37e-4d8f-b28b-cbb934822d89
Aydın Böyükkişi oğlu Mirzəzadə,c547373f-414d-4cc3-81f7-494e9c697bd1
Aydın Nəsir oğlu Hüseynov,579e0430-e307-4f71-967d-49b81392ca00
Aytən İnqilab qızı Mustafazadə,ef2c0869-b835-4b9f-ae49-34136e98a263
Azay Əjdər oğlu Quliyev,bf0c4cf2-62d7-4eee-92a5-21368ad8eead
Azər Camal oğlu Badamov,28bfe20b-8746-4835-951a-e9406a697863
Azər Şəmşid oğlu Kərimli,4116a61c-1183-4262-beeb-756125f19deb
Ağacan Qulam oğlu Abıyev,7ec33b51-b5fd-4746-b67b-225a75e2fcde
Ağalar İsrafil oğlu Vəliyev,9aa2cf96-e27b-4197-9bec-704417bd2cb1
Bahar Əvəz qızı Muradov,bcbee1fa-7fcb-457a-a0e3-901bc1b29224
Bahar Əvəz qızı Muradova,1c4a3990-61d7-4332-accc-6fabb8356fe8
Bəxtiyar Həmzə oğlu Əliyev,919cf69c-38bc-4104-8b10-0db72134d5cd
Bəxtiyar Yusif oğlu Sadıqov,11708cd3-ba45-472d-b012-3163359d94bb
Cavanşir Hümmət oğlu Paşazadə,e37f99d6-ec89-4cb2-907c-f08f06a957b1
Cavanşir Əyyub oğlu Feyziyev,a0d2974c-230c-4c19-a565-3a86266757a3
Cavid Həmid oğlu Osmanov,337e2146-2ccc-4b23-bb89-190462c2dec7
Cavid Qənbər oğlu Qurbanov,c601afe0-8639-493d-954e-477b12c11393
Ceyhun Yunis oğlu Osmanlı,6f62d006-aa3b-44f1-a6c3-cb154c741656
Cəlal Əlirza oğlu Əliyev,c80c3968-f7c3-4d21-b761-2fc0a019d957
Dilarə Məmmədağa qızı Cəbrayılova,6efd6195-93a9-4052-82d2-79c87071df48
Eldar Allahyar oğlu Quliyev,57b390c2-21f6-4340-b309-af3d964c553c
Eldar Rza oğlu İbrahimov,c6324641-dd9c-4751-afea-7d155b88ad76
Eldəniz Adil oğlu Səlimov,e8f2a598-aebb-4e78-b0b7-5bae18972692
Elman Camal oğlu Məmmədov,1a87a207-6e1b-47c8-b80b-c52feac768d7
Elman Xudam oğlu Nəsirli,284be416-fa8f-460e-b3d4-95e88b3df60d
Elmira Hüseyn qızı Axundova,4eaaa279-d0bc-4652-b5e0-9ab5b314c145
Elxan Sirac oğlu Süleymanov,ca2ac88b-929d-4769-86f8-3b43d025badf
Elçin Bəybala oğlu Quliyev,2996b507-52e2-4ef0-b714-722c4af7ac48
Elşad Eldar oğlu Həsənov,92145364-1f25-4717-b366-130c72385946
Elşən Məmmədhənifə oğlu Musayev,3ec45db5-4a9b-4a96-bd42-d5878bfc242f
Fazil Qəzənfər oğlu Mustafa,f81907d2-6f18-4f20-9121-75ff588849e1
Flora Qasım qızı Qasımova,d182bf9d-c7e5-43fe-a7cd-a19952992e14
Fuad Rauf oğlu Muradov,f0360f80-ff0b-4d13-9bd4-ab13215a0643
Fərəc İbrahim oğlu Quliyev,08d8e7f7-f13d-4388-89e2-2cee8621602c
Fəttah Səməd oğlu Heydərov,90c9ea63-ca1d-4b96-afca-cf65669f8a0c
Fəzail Feyruz oğlu İbrahimli,ae08b1a3-9b8c-4789-918e-edfa1c4b21ad
Fəzail Rəhim oğlu Ağamalı,e7c6df85-bfed-4832-bc6d-d39e8e9b1e32
Gövhər Baxşəli qızı Baxşəliyeva,7866ee59-c59d-45a8-ae31-28b645763272
Hacı Hacıbaba oğlu Salayev,d714812e-d7fe-4272-85b9-68d56c39be14
Hadı Musa oğlu Rəcəbli,8007eade-19e9-4521-b364-c996c0bda560
Hikmət Baba oğlu Məmmədov,07cd4136-b732-4881-8102-355d6b33d881
Hikmət İsmayıl oğlu Atayev,f295680a-7dbc-4164-b5db-ea908ca7f25d
Hüseynbala Fazil oğlu Mirələmov,39ff3a41-2416-4d09-b9b0-be7d1c666be3
İlham Kazım oğlu Məmmədov,9f7f8329-62d5-4815-9c09-61b594b79830
İlham Əlisəftər oğlu Əliyev,f70b0dd2-55bc-4ada-9639-bed8fc7fd5bc
İmamverdi İbiş oğlu İsmayılov,5242ca4a-861b-4c0d-a9c2-a83e5b8d2c4d
İqbal Nəriman oğlu Məmmədov,9181aca9-2052-4f60-8e81-8d9d3b6fe0ef
İsa Əkbər oğlu Həbibbəyli,30bf00bf-1f66-4ac9-921e-b1259b4cf5c1
Jalə Fazil qızı Əliyeva,3201ab69-9a1a-4b63-b7e9-278832448d4a
Kamaləddin Nəsrəddin oğlu Qafarov,5243199b-1940-46a7-b7c5-55fd46551c87
Kamilə Əli Ağa qızı Əliyeva,e953afb8-f6df-4e80-8629-71d51b34a9c8
Kamran Fərhad oğlu Bayramov,903346c3-9fdc-4af5-9cc6-f615c1dd53d8
Kamran Telman oğlu Nəbizadə,8f1f3003-5c70-4ece-9220-1d747e404c27
Madər Ələsgər oğlu Musayev,480c4744-88ce-4206-a1a5-86a7535601a3
Mahir Məhəmmədəli oğlu Aslanov,fe3bf2f7-749c-4364-988a-a477e37a6b4f
Mahir Tapdıq oğlu Abbaszadə,84046471-bf43-4abe-80ea-1087e5c1f5a7
Malik Əvəz oğlu Həsənov,ccbcb3f2-fd4d-4b31-805f-0a0559614102
Mehriban Arif qızı Əliyeva,b24828ce-472b-4b46-8e75-ce2cce61b3ae
Mirkazım Mirməhəmməd oğlu Kazımov,7185f8d9-128c-4f83-8f42-980fc0bc48be
Mirzəcan Mirzəmməd oğlu Xəlilov,a79c0581-f3fc-4702-b59b-cf3774e7ee26
Mixail Yuri oğlu Zabelin,bce71d61-d027-4ef1-b2f9-2c06c4411fdd
Musa Cəfər oğlu Qasımlı,3b638426-998a-4d8a-9770-d31e1ff1926b
Musa İsa oğlu Quliyev (Urud),0f9caac9-533a-4c6d-975c-315a1d520ecf
Muxtar Bahadur oğlu Babayev,0c890c40-5674-4d9b-86c5-f1185acddf40
Mübariz Qəhrəman oğlu Qurbanlı,42bef958-c8d2-42d3-9fcc-7fdd29eb782f
Müslüm Mürsəl oğlu Məmmədov,7517ebc1-fe9b-4152-9f0d-aaa9de480b7f
Məlahət İbrahim qızı Həsənova,5384b40f-5d6c-4bfd-ab27-cd485b40d5eb
Naqif Ələşrəf oğlu Həmzəyev,ac0773cf-0d54-415b-b8f6-8ba654c95724
Nazim Fərəc oğlu Fərəcov,dff2c6c5-9376-469e-92d7-5b4be1c1f1b0
Nizami Qulu oğlu Cəfərov,07c7b8ff-93c2-4f36-a72d-c4fa386766d4
Novruzəli Davud oğlu Aslanov,273ad841-db9e-4d16-9fdf-d1abac1f4aec
Nəriman Əlibala oğlu Əliyev,13007c6c-8fb6-4b46-97fe-dd868aa4489c
Nəsib Məhəmməd oğlu Məhəməliyev,697b5986-8503-4998-9e3d-cb5422297ec7
Oqtay Sabir oğlu Əsədov,98e078cb-25c7-417e-88fd-0c280259026a
Pərvin Orxan qızı Kərimzadə,a7601fe1-dd61-4aba-a6b4-5c17895f0dbc
Qüdrət Müzəffər oğlu Həsənquliyev,8b95935c-a7a9-4ece-9d37-6eb44b410c89
Qənirə Ələsgər qızı Paşayeva,228bc088-baa7-4897-8899-1ff3d15a25db
Rafael Baba oğlu Hüseynov,871cb787-8076-4040-886d-a734028cef64
Rafael Kamil oğlu Cəbrayılov,5c09f3bb-413a-400d-ab90-239e13a7e2a4
Rafiq Musa oğlu Məmmədhəsənov,3bfa970c-5bfa-46e9-9c9d-93e3d8ad335b
Rasim Nəsrəddin oğlu Musabəyov,d7d07f7d-0c25-4dc7-b221-9102d0eb0ba7
Rauf Asif oğlu Əliyev,faca6a93-2952-4882-a19f-6c2332a53ccc
Rövnəq İbrahim oğlu Abdullayev,05a23f67-d918-44bd-84c3-a808f377ebe5
Rövşən Şükür oğlu Rzayev,57f7dfd7-2857-471c-a6a8-860ed08d4dcb
Rüfət Atakişi oğlu Quliyev,8a0253b0-1199-4db8-b88d-c2411a6e9103
Rüstəm Gülabba oğlu Xəlilov,bb8ed623-f9a8-4344-867a-3f565ab50a57
Rəbiyyət Nurullah qızı Aslanova,91ef2955-aeb0-4bd2-8793-17710654e16b
Rəşad Məmmədqulu oğlu Mahmudov,9df25c82-9b9a-426c-88fd-e9656f380f9b
Sabir Kamal oğlu Hacıyev,1643da72-ae5a-48de-87ed-4f208c60b3c4
Sabir Xudu oğlu Rüstəmxanlı,0e6dfb5d-1ea4-4ada-b284-690042a0be55
Sahib Eyvaz oğlu Alıyev,deff9c81-9dd9-48ea-812e-ba3c0d9c8a89
Sahibə Əli qızı Qafarova,59613d11-f56d-4395-8c09-7d00bbfa2520
Sevinc Həbib qızı Fətəliyeva,04ddc30e-8140-48b8-a361-b5ce8d8f567c
Sevinc Əmirəhməd qızı Hüseynova,862aa64f-e7e0-44ed-a4a9-ec83e83d99ce
Siyavuş Dünyamalı oğlu Novruzov,e5d070ac-79ee-4db3-9ef3-cd97c6b48e69
Sona Sakit qızı Əliyeva,2be060a6-6d51-4000-811c-2f494d5a3ba3
Sədaqət Süleyman qızı Vəliyeva,95ad30dc-a0c6-4dc8-a4d0-c33f8e0c422a
Səməd İsmayıl oğlu Seyidov,5768c8c0-6d1f-44dc-8b34-f43750cf3af2
Səttar Suliddin oğlu Mehbalıyev,b98eab6e-136c-4bd6-bf50-817e59d037b3
Tahir Famil oğlu oğlu Mirkişili,befdb074-8e9d-415d-bdcd-989c3ab4a3da
Tahir Musa oğlu Rzayev,f335d50d-abe1-4ee5-8378-aae049926451
Tahir Süleyman oğlu Süleymanov,f29630b9-168f-4810-90ed-72d8bae2c05b
Tahir Zayıdağa oğlu Kərimli,4127a945-5271-4a80-b98a-4e0a62fc4e59
Vahid Qazməmməd oğlu Əhmədov,61305ac4-ce0d-420f-a391-2e095af57540
Valeh Feyruz oğlu Ələsgərov,d4e2bdf0-74cb-4e2a-b585-6dca0369f749
Vasif Yusif oğlu Talıbov,70af4189-7ddc-4094-8860-a7cc205e508f
Vüsal Əfqan oğlu Hüseynov,c7f34aec-5a52-4965-9ee2-71453d612fed
Xanhüseyn Hüseynağa oğlu Kazımlı,56cf9579-ae3a-407e-ad7a-5a850fcacb54
Xanlar Nuru oğlu Fətiyev,f0e91f54-7aa3-44ef-96af-15a5de15fbba
Yaqub Mikayıl oğlu Mahmudov,c7c6ef53-1a12-4bd0-897c-29d82a01d86a
Yevda Sasun oğlu Abramov,04645382-5545-435c-a488-b828d70e97a7
Zahid Məhərrəm oğlu Oruc,be03f124-5286-402a-94e8-eee729a296f9
Zeynəb Yəhya qızı Xanlarova,440010d9-9d06-4dc1-9a7e-177ebcf199b2
Ziyad Əliabbas oğlu Səmədzadə,8c4ef444-2b10-497b-ad11-98ebbbe1b5c1
Ziyafət Abbas oğlu Əsgərov,e5a5d067-215e-46a5-a32f-c26e3de127fb
Çingiz Aşralı oğlu Qənizadə,97bfcb81-14c3-4c1a-bba6-8a59953a5c9f
Ülvi Zahid oğlu Quliyev,fef0dcd3-008a-483b-b806-b7b7401f16c7
Ülviyyə Cavanşir qızı Ağayeva,7496745a-5729-4fb4-9373-5ec03cfd0a92
Ülviyyə Tapdıq qızı Həmzəyeva,101c6ca4-909e-4651-9bdf-649e083b9839
Şahin Əmir oğlu İsmayılov,1ec75e56-d6f0-43e8-a1fc-2ec109e1df58
Şəmsəddin Hümmət oğlu Hacıyev,873d8e96-8a54-4c97-a5a5-5aae7ab2533a
Əflatun Əhməd oğlu Amaşov,7b551ffd-4403-40ff-92c5-74a56668f2e7
Əhliman Tapdıq oğlu Əmiraslanov,428a0a75-c65b-4c3d-b376-dea18bff301f
Əli Cavad oğlu Əhmədov,f3112356-fd0f-4fcb-a31c-ebea48555273
Əli Məhəmməd oğlu Hüseynli,56b1d25f-0a0a-465e-8ab1-8d31d71b17ef
Əli Məhəmməd oğlu Hüseynov,4ede62e2-0e7d-4c5c-8e3d-18dcd08bf2a9
Əli Əhməd oğlu Məsimli,b2fbb5f0-26c9-4c80-b3f5-ece2a3cc9002
Əliağa İzzət oğlu Hüseynov,8e08e720-30dc-47b6-8de0-8cfc9c37dde3
Əsabil Qarakişi oğlu Qasımov,aa288da2-a995-4cd9-9c49-d7df9f4a3fd5
