name,id
Adil Abış oğlu Əliyev,ff70da5f-5e63-41d3-bbf4-5abab0736519
Aqil Məhəmməd oğlu Abbas,155d3868-8cd9-45c0-b90f-8bb2c41325b3
Aqiyə Həbib qızı Naxçıvanlı,b6eab4d9-1c31-444f-b0fa-aa6fde5eb19c
Araz Məmməd-Mübariz oğlu Əlizadə,f87ac3fd-3508-4b6e-a57a-676d87a3d887
Arif Qafar oğlu Rəhimzadə,02b69558-3ce0-4f47-aa9f-b6c86a7066cd
Asim Nazim oğlu Mollazadə,424859fd-d798-4f4b-a098-f6aea1cace62
Aslan Məmmədhüseyn oğlu Cəfərov,e0f713e8-f8f7-4f68-97d8-36821cdbb949
Astan Nuşrəvan oğlu Şahverdiyev,46cbc6e1-7d7c-4a27-b90d-cbabaedcd87d
Aydın Böyükkişi oğlu Mirzəzadə,d28f3221-7e67-4068-afe4-1de32f12dc19
Aydın Nəsir oğlu Hüseynov,1dd149c7-0f25-4fa6-8b2e-296bfca5ada3
Aytən İnqilab qızı Mustafazadə,b20f6c7e-95e2-4950-868e-eadc1d024c06
Azay Əjdər oğlu Quliyev,dcb6beae-c465-472a-b7a9-dca86e02527f
Azər Camal oğlu Badamov,ce35f03e-893e-4a67-aed9-23f592d9a925
Azər Şəmşid oğlu Kərimli,9f72d142-1a74-41f3-9794-616dafa4ac52
Ağacan Qulam oğlu Abıyev,d52fee4a-11ac-49a6-a6c5-7b122f7071ce
Ağalar İsrafil oğlu Vəliyev,5616c953-37ee-42bc-a149-2f4d92c805d4
Bahar Əvəz qızı Muradov,36c02a27-dcd8-431b-b9c7-67eacd423bf5
Bahar Əvəz qızı Muradova,1e24737b-0b71-4d26-b639-ef0080d64af5
Bəxtiyar Həmzə oğlu Əliyev,f34581f6-1b1b-427d-a8a9-8ec94e6dc23d
Bəxtiyar Yusif oğlu Sadıqov,167c8dc6-0601-4063-9846-416a01f11d46
Cavanşir Hümmət oğlu Paşazadə,669f1280-ded8-44e9-bcee-076569e964da
Cavanşir Əyyub oğlu Feyziyev,8e43baef-34ac-4b3a-b295-8ba2368384dd
Cavid Həmid oğlu Osmanov,cec55c84-80c6-4032-8059-f412e088adba
Cavid Qənbər oğlu Qurbanov,fc9e6be8-58b9-4dce-aedf-70a8b6a3e17e
Ceyhun Yunis oğlu Osmanlı,8c3073ac-6a3f-463a-8bb3-81528888c68a
Cəlal Əlirza oğlu Əliyev,974d1abd-ccbb-4237-95cc-0f41772359c7
Dilarə Məmmədağa qızı Cəbrayılova,556acfc3-8578-4dbf-b82a-8f329849fe69
Eldar Allahyar oğlu Quliyev,3c196b91-b15e-41a8-9199-bdd35f316ad4
Eldar Rza oğlu İbrahimov,77cf3dbe-8fb8-488c-af22-65f71c571dbe
Eldəniz Adil oğlu Səlimov,50d3af8f-3826-472d-b606-911fe0018d21
Elman Camal oğlu Məmmədov,8d6d934c-2603-4043-92fc-01bf5bd61799
Elman Xudam oğlu Nəsirli,638917b9-687e-4971-a6b8-07467134eaa7
Elmira Hüseyn qızı Axundova,675d70b2-61dd-415d-b6cd-c65006fee425
Elxan Sirac oğlu Süleymanov,9dbfc351-204c-47a7-b26f-614e5a749649
Elçin Bəybala oğlu Quliyev,1c7e5e29-6b36-4127-86e6-8fa5dbf0dd93
Elşad Eldar oğlu Həsənov,5403c9b2-4a51-46d4-81be-4bec67e97029
Elşən Məmmədhənifə oğlu Musayev,09336bd6-68af-4cef-8250-b16454a08dec
Fazil Qəzənfər oğlu Mustafa,78760d67-07ce-4229-a512-6177034f12ed
Flora Qasım qızı Qasımova,10ad95b0-2a4a-4576-8fe5-e593a78d0bbc
Fuad Rauf oğlu Muradov,2b3d24c4-3c43-41a4-823c-a55db388f289
Fərəc İbrahim oğlu Quliyev,83a124d3-152f-4e7c-935c-8e9b7f921b7f
Fəttah Səməd oğlu Heydərov,889e08fa-6333-44bd-944b-b526dc69a873
Fəzail Feyruz oğlu İbrahimli,5f89507f-7b7d-464f-9f27-dd43f38d1bb3
Fəzail Rəhim oğlu Ağamalı,a40c8aeb-3a4e-4201-ae9c-9b78be36bf05
Gövhər Baxşəli qızı Baxşəliyeva,fdee23c4-dba7-465f-be80-7087bff7d771
Hacı Hacıbaba oğlu Salayev,f5dbb1d4-54d2-4532-b8ed-2d76c8fc8e23
Hadı Musa oğlu Rəcəbli,5e235e4c-bb9a-48f5-800d-91afc227be62
Hikmət Baba oğlu Məmmədov,91ebc3d8-5800-4223-855f-1e83f24d9342
Hikmət İsmayıl oğlu Atayev,34088119-003c-48a8-834e-0e96444562ff
Hüseynbala Fazil oğlu Mirələmov,504e4623-893a-428d-a675-f4295ea2572d
İlham Kazım oğlu Məmmədov,e24911a2-e948-4349-a596-627162e38e82
İlham Əlisəftər oğlu Əliyev,c2ea0ac2-a191-4213-861e-d0444adaaaaa
İmamverdi İbiş oğlu İsmayılov,26dc930a-a18d-4343-8d7f-ff1e3383765d
İqbal Nəriman oğlu Məmmədov,79e45add-2999-4e26-b6e2-e24db6fc421b
İsa Əkbər oğlu Həbibbəyli,4d79ea6a-3e4d-4071-849d-76e59aad0d42
Jalə Fazil qızı Əliyeva,a231b620-7cc3-4123-874c-e05f75c33d66
Kamaləddin Nəsrəddin oğlu Qafarov,293d193c-1d70-4d73-bc1a-3d3aa1b53df9
Kamilə Əli Ağa qızı Əliyeva,c3628e35-ed88-4e67-b415-bf383dfa82cb
Kamran Fərhad oğlu Bayramov,8c6edcaa-abbd-4411-881e-e6ef14dd2a05
Kamran Telman oğlu Nəbizadə,b1007b0c-d886-4f88-a67b-7f8ba5c6e08b
Madər Ələsgər oğlu Musayev,42c1cebb-2368-4080-9cdc-251286783b8f
Mahir Məhəmmədəli oğlu Aslanov,96c7902c-a618-4fef-8e4b-ba320d26376a
Mahir Tapdıq oğlu Abbaszadə,ffd1dcfb-98c2-4865-acbe-cbe6041351ef
Malik Əvəz oğlu Həsənov,7536e8d5-0d06-4bf5-a153-c6f146c4d694
Mehriban Arif qızı Əliyeva,29f81612-9a89-4d3a-8517-4b7090502e6a
Mirkazım Mirməhəmməd oğlu Kazımov,4f4f654b-d93b-4ec7-add6-688932fcd3a6
Mirzəcan Mirzəmməd oğlu Xəlilov,97568669-6e64-49ec-9490-f2debf6c060c
Mixail Yuri oğlu Zabelin,f773da17-a0a3-489a-8abf-b052885b50ef
Musa Cəfər oğlu Qasımlı,3f71d6f7-ec3d-4f95-bb19-b2ccaf290598
Musa İsa oğlu Quliyev (Urud),4ea26188-9bcf-4725-b5cd-223e769ed82c
Muxtar Bahadur oğlu Babayev,e2c7040b-8b04-46b7-9b60-f64b4520a57f
Mübariz Qəhrəman oğlu Qurbanlı,b0d6f8b9-8e44-4b38-ba54-a808358fbb83
Müslüm Mürsəl oğlu Məmmədov,6c0823ba-1be2-40e1-b0a3-6371cb9ba6da
Məlahət İbrahim qızı Həsənova,2fdc737d-66f7-4c2c-8ea7-00409e955b75
Naqif Ələşrəf oğlu Həmzəyev,4a4bcdff-f4bb-49a7-a713-a5cbb2f77894
Nazim Fərəc oğlu Fərəcov,fe7e07d2-87db-44cf-9279-eb938e29186a
Nizami Qulu oğlu Cəfərov,9b8471d6-8215-4a24-a388-cce72f9d5391
Novruzəli Davud oğlu Aslanov,b9d73b4e-b4e3-4d96-abdf-5f101812816a
Nəriman Əlibala oğlu Əliyev,95502725-f6e7-4000-9fe0-696ba05e5ce2
Nəsib Məhəmməd oğlu Məhəməliyev,b87247cd-7005-4099-80f8-70c4d0cc7ff3
Oqtay Sabir oğlu Əsədov,cf66f8bd-0104-413a-9804-2604c52fe05f
Pərvin Orxan qızı Kərimzadə,139dfbe3-32ea-4d0d-8d1b-40206075bdc8
Qüdrət Müzəffər oğlu Həsənquliyev,7e5a4ca0-18a2-4612-a73a-6552fc3946ca
Qənirə Ələsgər qızı Paşayeva,5873eeac-e773-4fa2-bf84-da17f7bcf448
Rafael Baba oğlu Hüseynov,ad43fbc7-9609-4c12-be6e-ba4e902b47c4
Rafael Kamil oğlu Cəbrayılov,f75690a7-2d7d-46e1-b42d-bd3e39ab6cc4
Rafiq Musa oğlu Məmmədhəsənov,f3f8b15e-9de1-4fe1-ba80-39636e0df2bd
Rasim Nəsrəddin oğlu Musabəyov,973231f6-dc29-4602-b4d4-fb920a4a5712
Rauf Asif oğlu Əliyev,40d22ef0-0ef5-4413-98ca-dcb85d4d2f4c
Rövnəq İbrahim oğlu Abdullayev,d873a12f-172c-4fc9-93a8-57467dc3cc48
Rövşən Şükür oğlu Rzayev,e0f48034-1f82-4994-bb84-478a9b49bcc1
Rüfət Atakişi oğlu Quliyev,429fcba8-3921-4ab3-b60a-fbffce3c0d02
Rüstəm Gülabba oğlu Xəlilov,10d7860f-da6b-475d-9c76-4580d1cc6ff0
Rəbiyyət Nurullah qızı Aslanova,bb144a15-9d23-4e4f-81b5-9c328d0ab4e8
Rəşad Məmmədqulu oğlu Mahmudov,dff366ce-aad8-4a22-8d60-82efb647c1aa
Sabir Kamal oğlu Hacıyev,fa28b6b3-c24d-4fb7-8a15-e2ac7a50e0e1
Sabir Xudu oğlu Rüstəmxanlı,bf0703da-b0b0-4161-add6-3c769212d075
Sahib Eyvaz oğlu Alıyev,0e3ede94-4117-4ab6-aefc-402fa6d78233
Sahibə Əli qızı Qafarova,9f7532ec-feac-427e-a3f7-aa5af8669603
Sevinc Həbib qızı Fətəliyeva,54629a5a-396c-47fb-aa9b-a1786f95bf34
Sevinc Əmirəhməd qızı Hüseynova,2e716da8-4111-4288-a4b6-6a00f57fc5a5
Siyavuş Dünyamalı oğlu Novruzov,3bb5a065-60b0-408b-a306-68d1018844c2
Sona Sakit qızı Əliyeva,6f8e9de0-6492-4060-befe-d4c3cfc5dc8e
Sədaqət Süleyman qızı Vəliyeva,af592740-326a-4cae-a99e-3d3b99ba2111
Səməd İsmayıl oğlu Seyidov,f017816c-eefb-4a63-887c-e2de6abcc264
Səttar Suliddin oğlu Mehbalıyev,49961c34-3fed-4ad5-b870-2dd60781983a
Tahir Famil oğlu oğlu Mirkişili,93790009-d858-43b3-bdb2-8e917fac701d
Tahir Musa oğlu Rzayev,de3f22f7-d26b-4546-b596-a03f368ae7f6
Tahir Süleyman oğlu Süleymanov,c06249d9-16bd-4a6a-9e01-8be9b59ef53c
Tahir Zayıdağa oğlu Kərimli,cf6ef4ef-6a56-4f84-9e29-e1cc1d81bb1e
Vahid Qazməmməd oğlu Əhmədov,5ccc53e9-b9dc-4d3b-b278-52ae219335ba
Valeh Feyruz oğlu Ələsgərov,6e4b2232-694f-4da9-882c-a5a7775f24d4
Vasif Yusif oğlu Talıbov,71a24f2f-9ff5-4198-b359-66ceb5711b4a
Vüsal Əfqan oğlu Hüseynov,c4465f96-94c3-4310-9751-1477720e2bcd
Xanhüseyn Hüseynağa oğlu Kazımlı,0db7cdb1-2ffa-4aa8-9ce9-cdcefce571f3
Xanlar Nuru oğlu Fətiyev,d45ca5d0-a0b0-42b4-8d12-bdf999dfee2c
Yaqub Mikayıl oğlu Mahmudov,a42ef325-ccb5-4159-b525-b892294d7fbb
Yevda Sasun oğlu Abramov,88f4359d-946b-4528-840a-cc9df0b1fe4b
Zahid Məhərrəm oğlu Oruc,4b31295f-d42c-4a1e-acc8-4f66f698de32
Zeynəb Yəhya qızı Xanlarova,9374cb72-7478-4689-b325-a03645ae34da
Ziyad Əliabbas oğlu Səmədzadə,06ed6589-9e09-45d4-a63a-fc79caa9d784
Ziyafət Abbas oğlu Əsgərov,f86ef054-ab43-48fb-aee4-de35e47f146c
Çingiz Aşralı oğlu Qənizadə,a316494e-a9ff-4ea8-a4e9-ff62b40e79fe
Ülvi Zahid oğlu Quliyev,b06ccf2b-dfb4-48a1-bcb6-6730b4390503
Ülviyyə Cavanşir qızı Ağayeva,94562174-1994-4322-b8c4-1649e208df05
Ülviyyə Tapdıq qızı Həmzəyeva,7167158a-022f-48e4-9e71-055aae705f93
Şahin Əmir oğlu İsmayılov,c380e9d0-01f3-4a9f-a569-b3bd9e3eeaa7
Şəmsəddin Hümmət oğlu Hacıyev,d2c0049c-0131-4cd8-a41f-fc9f4d3c1178
Əflatun Əhməd oğlu Amaşov,b8949070-5c01-4fa6-9491-737aec1b732a
Əhliman Tapdıq oğlu Əmiraslanov,e35d0e6e-e917-4094-8223-45dd1ae25fb0
Əli Cavad oğlu Əhmədov,5d4f6d61-fd7b-4832-9f92-df07d2435b6a
Əli Məhəmməd oğlu Hüseynli,d0d23c3c-4602-446c-8c71-104d924eec51
Əli Məhəmməd oğlu Hüseynov,7d8317ad-9021-4725-85f1-d4d50e97c483
Əli Əhməd oğlu Məsimli,b517f808-711a-4db1-82ed-2fea52247cae
Əliağa İzzət oğlu Hüseynov,338c3bac-295e-48ba-9c9a-ab2c52e4065c
Əsabil Qarakişi oğlu Qasımov,a29b7cb2-a9d4-4d54-959c-3eb5003a93b4
