name,id
Adil Abış oğlu Əliyev,9a0cc0ae-32bb-4bcb-9f84-4f489af14456
Aqil Məhəmməd oğlu Abbas,91f37295-2ddb-44e2-bce4-1bbae41ee6e8
Aqiyə Həbib qızı Naxçıvanlı,81df5927-c337-46ac-bdef-0fcf7d4e2fd9
Araz Məmməd-Mübariz oğlu Əlizadə,a0d49135-cfb0-4dd3-8b5f-e46d68ca8f8c
Arif Qafar oğlu Rəhimzadə,fef4b118-37e1-4045-9e06-cea7acb4f1cd
Asim Nazim oğlu Mollazadə,26dbf897-b7eb-4fb5-9ca8-6082155f14f4
Aslan Məmmədhüseyn oğlu Cəfərov,e50b8b37-c35f-47dd-bf06-371f204287c9
Astan Nuşrəvan oğlu Şahverdiyev,e0e04556-05bc-49bb-ae67-700aa792e912
Aydın Böyükkişi oğlu Mirzəzadə,5e5eb5b6-59ee-4b9d-978a-5fdf33fa62eb
Aydın Nəsir oğlu Hüseynov,9a4a0017-43ac-423f-964e-3c952a7c5ba1
Aytən İnqilab qızı Mustafazadə,d2078cf0-d8b0-4c36-b0d3-59879adf6319
Azay Əjdər oğlu Quliyev,9b668f85-23da-416e-926d-1b99f35422b4
Azər Camal oğlu Badamov,ac15fa75-94bf-430c-8b5f-2d4c01e25ca8
Azər Şəmşid oğlu Kərimli,8c09e5e9-a795-4ea7-94e3-dcc01a386aa9
Ağacan Qulam oğlu Abıyev,aed79057-3a69-4a9d-8a73-0ad1f9c32eb9
Ağalar İsrafil oğlu Vəliyev,76a780fd-ef7f-4a3d-be7a-f14b3fd7a032
Bahar Əvəz qızı Muradov,25b0cee4-e081-4b40-8261-8b970e9c186e
Bahar Əvəz qızı Muradova,8aff1041-a105-4ef6-b330-585b3d42ea4a
Bəxtiyar Həmzə oğlu Əliyev,2250e506-b7c6-4309-aed7-83782dd4cc0a
Bəxtiyar Yusif oğlu Sadıqov,56ed25a9-8c40-42db-bf00-11e087043ca5
Cavanşir Hümmət oğlu Paşazadə,5411cebc-3173-4fb6-b8db-70c7a27cef05
Cavanşir Əyyub oğlu Feyziyev,09e575ce-f4b0-4155-8f11-d9af8c596f84
Cavid Həmid oğlu Osmanov,25c17b8d-5a7f-486a-8099-2b58e9cb099f
Cavid Qənbər oğlu Qurbanov,bcc6ba6d-4f4e-4d6f-a4b9-309be5348a43
Ceyhun Yunis oğlu Osmanlı,e883f045-e0f5-471d-a5c6-faa271b52126
Cəlal Əlirza oğlu Əliyev,2c17a492-d80d-47a0-8fa6-f26470f5191c
Dilarə Məmmədağa qızı Cəbrayılova,f95e6cfa-fe2f-4128-b5fc-e09c52f08777
Eldar Allahyar oğlu Quliyev,38e37e24-8915-4670-908e-3bb8b33d2abe
Eldar Rza oğlu İbrahimov,33074125-0ff5-449f-86f3-2a5da5bc3908
Eldəniz Adil oğlu Səlimov,63268536-10d5-4fe4-9687-c1064ce4244c
Elman Camal oğlu Məmmədov,30dec3bf-23d3-4edf-89c0-11bcafd0dde4
Elman Xudam oğlu Nəsirli,1167924a-3a09-4378-aeb1-865a8fd65b99
Elmira Hüseyn qızı Axundova,465cf065-1c12-41fe-a9dd-8f23622a2fe3
Elxan Sirac oğlu Süleymanov,603dae17-7c96-4b9b-8762-794fbee10e30
Elçin Bəybala oğlu Quliyev,107799fc-97c1-4727-8aa0-75b283980c4d
Elşad Eldar oğlu Həsənov,5ef708ff-57f0-402c-a351-a2ce209215d7
Elşən Məmmədhənifə oğlu Musayev,77a8b24f-4ffe-4da0-91f9-b0ee4c9942da
Fazil Qəzənfər oğlu Mustafa,1af5a427-c943-45ba-8642-d3a00b8ec47c
Flora Qasım qızı Qasımova,74340c95-af00-4344-adfb-960588243cab
Fuad Rauf oğlu Muradov,8a9a2a9f-bf1e-430f-b819-c1db99c1e32c
Fərəc İbrahim oğlu Quliyev,c9089c6c-367c-4c73-98b1-405fbe1e3418
Fəttah Səməd oğlu Heydərov,eb288647-0508-4363-8522-d20add9ee29f
Fəzail Feyruz oğlu İbrahimli,8e85802f-f400-400c-9834-b3fdbd9aa77a
Fəzail Rəhim oğlu Ağamalı,eeb7db8a-8310-49d2-bec0-dcdbca864dec
Gövhər Baxşəli qızı Baxşəliyeva,1dc6485c-9687-482c-b4b0-ff2dfd42c569
Hacı Hacıbaba oğlu Salayev,41843e76-9fa6-481b-97a1-f535c2abc898
Hadı Musa oğlu Rəcəbli,deb54e8e-0f10-43cc-a424-22b250909d70
Hikmət Baba oğlu Məmmədov,54757c8e-792d-4b0f-9bdd-4715aaf83687
Hikmət İsmayıl oğlu Atayev,d36aa8a3-c661-4cb6-9831-5bdb61a3be85
Hüseynbala Fazil oğlu Mirələmov,4b7f9383-86e7-42ca-9a45-aefffd2e3219
İlham Kazım oğlu Məmmədov,4d2b0dc4-70ae-4889-83a7-35604bfd0658
İlham Əlisəftər oğlu Əliyev,97ff249c-4ebf-4bff-8477-066e95440157
İmamverdi İbiş oğlu İsmayılov,dd1dc61d-e124-4dbc-965f-554416b8b85c
İqbal Nəriman oğlu Məmmədov,c398ab57-d1c5-48e7-a21b-d9fb10e7daaa
İsa Əkbər oğlu Həbibbəyli,326c8f14-d4de-4cab-9a94-d963e62e0348
Jalə Fazil qızı Əliyeva,2c7395b9-28ba-47c2-b839-7e632189d410
Kamaləddin Nəsrəddin oğlu Qafarov,b209af43-8475-43d3-8b04-2280a129a359
Kamilə Əli Ağa qızı Əliyeva,0bcc5eb5-4a3b-421c-a788-092ae2379a45
Kamran Fərhad oğlu Bayramov,a2d6f10b-d79f-4c80-a812-610cae795a90
Kamran Telman oğlu Nəbizadə,90883b89-75a8-420a-a46f-335ff42465bb
Madər Ələsgər oğlu Musayev,f8dbdb60-92af-44ad-9e89-624e230903cb
Mahir Məhəmmədəli oğlu Aslanov,1fdd3ee3-028e-4b1d-a871-09764cfa94c4
Mahir Tapdıq oğlu Abbaszadə,c361aa68-7afa-4d47-8bae-acbd1d18856d
Malik Əvəz oğlu Həsənov,3bc3ebc7-4c07-406a-9234-6b00dc6bc57f
Mehriban Arif qızı Əliyeva,a58dbf2d-d49e-4b9c-bea9-97f03df19743
Mirkazım Mirməhəmməd oğlu Kazımov,a86b5ed3-35c9-4331-907b-dce2cf4c4c1b
Mirzəcan Mirzəmməd oğlu Xəlilov,3007588c-c54c-4be1-ba5f-124dfe0c8547
Mixail Yuri oğlu Zabelin,2da16812-181d-441d-a003-dd1e391cb8f9
Musa Cəfər oğlu Qasımlı,e1865824-c614-420a-bccf-d51983b221b4
Musa İsa oğlu Quliyev (Urud),ad0a6589-c938-442f-81c6-041c839ddbdd
Muxtar Bahadur oğlu Babayev,017d55de-7f28-4062-8661-8843186230a8
Mübariz Qəhrəman oğlu Qurbanlı,cf5b5d98-ea88-4e84-ac8a-ce9aa5c50e96
Müslüm Mürsəl oğlu Məmmədov,a3006a52-e9e0-4565-8737-bb5995deba0e
Məlahət İbrahim qızı Həsənova,fe4aa3c8-8526-4c7b-8033-7e94cd64cdf1
Naqif Ələşrəf oğlu Həmzəyev,97f2527f-2aa2-4f56-a153-9c48a85904ab
Nazim Fərəc oğlu Fərəcov,ade029e4-1ac4-4351-b91e-82c9719e8d5f
Nizami Qulu oğlu Cəfərov,12392757-e84f-4477-80e2-8e3427331237
Novruzəli Davud oğlu Aslanov,d209bab9-33a4-4841-86ec-64443b77a2fc
Nəriman Əlibala oğlu Əliyev,9b19c388-b5ec-48fe-8bd1-6b55437964ee
Nəsib Məhəmməd oğlu Məhəməliyev,07d24afc-a55f-4457-b4de-30d5ca4d5a28
Oqtay Sabir oğlu Əsədov,2ea6a2a6-a225-416a-9df4-6a286d5e43e3
Pərvin Orxan qızı Kərimzadə,2a51fda8-a326-477b-8ef9-347638b09c74
Qüdrət Müzəffər oğlu Həsənquliyev,7a47cad7-291a-4b8a-9ccc-bf4b6c2c1c10
Qənirə Ələsgər qızı Paşayeva,3a1cca44-a7dd-48e9-a775-559519c43594
Rafael Baba oğlu Hüseynov,637d1202-4888-44d5-a498-2502fd65274f
Rafael Kamil oğlu Cəbrayılov,c2ddc692-9030-4f56-a90f-e610789c354a
Rafiq Musa oğlu Məmmədhəsənov,8a86b193-2290-40ed-8962-1bdc3de069d0
Rasim Nəsrəddin oğlu Musabəyov,6faaf8c5-6fbf-4172-b235-960822fee32f
Rauf Asif oğlu Əliyev,5255e6d4-fb42-4056-a6e2-79db96678bb1
Rövnəq İbrahim oğlu Abdullayev,f98359e1-0440-4872-9114-2f3531dcb5be
Rövşən Şükür oğlu Rzayev,ffb56c2f-987f-4ede-8e69-d76bee7fa691
Rüfət Atakişi oğlu Quliyev,6e776d23-dbf3-4fcc-8c3e-cb0178bcde86
Rüstəm Gülabba oğlu Xəlilov,2d999e6a-3892-4a61-8c48-42051660f4df
Rəbiyyət Nurullah qızı Aslanova,b14c1122-6e5c-4ce7-87ab-d7bb420e67ee
Rəşad Məmmədqulu oğlu Mahmudov,bb6bf4af-ec29-40e6-aa7d-88d88bf8f745
Sabir Kamal oğlu Hacıyev,28648b68-65de-4110-ac50-6d1c14f595a0
Sabir Xudu oğlu Rüstəmxanlı,7ded99f2-31f4-44ba-86f4-42bb1b0a3449
Sahib Eyvaz oğlu Alıyev,dcdf5901-1d80-4923-8f22-1056bec0e8e9
Sahibə Əli qızı Qafarova,a6984985-9056-4b38-a3e5-edb047b8a8aa
Sevinc Həbib qızı Fətəliyeva,6a618db3-141d-4e96-bb56-2d85e5d4020d
Sevinc Əmirəhməd qızı Hüseynova,bd85c7fc-2aba-4d72-a641-044c69c98f50
Siyavuş Dünyamalı oğlu Novruzov,152c740b-021e-4ade-b3a9-55c4517579fb
Sona Sakit qızı Əliyeva,86a8ac05-c1ab-4c5e-ba28-57830ab29ed2
Sədaqət Süleyman qızı Vəliyeva,dbb82242-7ad6-4f95-b88b-75feb0bf414c
Səməd İsmayıl oğlu Seyidov,b24becfd-912e-43a3-a11a-61341f2c5881
Səttar Suliddin oğlu Mehbalıyev,eade9662-086a-452c-bab3-dda701ad9c68
Tahir Famil oğlu oğlu Mirkişili,8b69136f-dfe1-427f-90a8-1b02cfec85ce
Tahir Musa oğlu Rzayev,2c1ad9a9-8c8f-43da-afde-09b9fb22533a
Tahir Süleyman oğlu Süleymanov,34e6c3d7-5be8-4a19-afe0-0534ce687fca
Tahir Zayıdağa oğlu Kərimli,094bccec-a4a6-4dbb-983d-ca777e086b94
Vahid Qazməmməd oğlu Əhmədov,7b21a406-1482-496c-a8d9-cc3c989cb6d0
Valeh Feyruz oğlu Ələsgərov,4d1f04fd-fe4f-4e00-9896-23765899c917
Vasif Yusif oğlu Talıbov,6d19c61b-f8cb-4daa-ab6f-8920478dad13
Vüsal Əfqan oğlu Hüseynov,23626249-b79d-4797-afe3-2b402c37edf4
Xanhüseyn Hüseynağa oğlu Kazımlı,b131e56e-def8-439d-917a-6a8c5721dee2
Xanlar Nuru oğlu Fətiyev,2129d1cb-4e10-4e6a-8c62-8a1ec801df67
Yaqub Mikayıl oğlu Mahmudov,a9bb7a7d-46dc-4d9f-82de-aa901d9ef3e5
Yevda Sasun oğlu Abramov,a2e0d66e-c72c-4488-8211-60ec4bd53df8
Zahid Məhərrəm oğlu Oruc,2c0d9cbc-e25e-41b1-9f2c-e9918d4c8a74
Zeynəb Yəhya qızı Xanlarova,f76bb386-0483-4470-8611-072af12e4bc5
Ziyad Əliabbas oğlu Səmədzadə,20546181-2b16-43e9-9ecd-ed820939cc17
Ziyafət Abbas oğlu Əsgərov,0a82f91f-9dfd-497d-a65a-38d3cd5e49ef
Çingiz Aşralı oğlu Qənizadə,19daee7b-3cee-4dcc-ae50-968c705b2b23
Ülvi Zahid oğlu Quliyev,62ac9caf-1849-47c8-901f-14289dec3b5a
Ülviyyə Cavanşir qızı Ağayeva,cad64e82-e6fe-4759-aa4d-c8b0b8d6672b
Ülviyyə Tapdıq qızı Həmzəyeva,4a171969-ec15-428f-bfee-06a3380eddd1
Şahin Əmir oğlu İsmayılov,b4ed6cdc-35df-4481-899b-011ce6c0a625
Şəmsəddin Hümmət oğlu Hacıyev,6cd15372-b5cd-4cf6-96d0-62fcc60c23ca
Əflatun Əhməd oğlu Amaşov,bf03f2aa-aa3b-49b6-bdac-73a47d1982df
Əhliman Tapdıq oğlu Əmiraslanov,55449c1d-b37f-42b2-b6d2-dbe030c06774
Əli Cavad oğlu Əhmədov,aaef4e5e-8991-4424-aa9a-b19b12ec6232
Əli Məhəmməd oğlu Hüseynli,3ada6ee4-3cd4-4133-8590-5e5e60292eee
Əli Məhəmməd oğlu Hüseynov,2ffa804a-a150-49c3-8981-66416ab6394f
Əli Əhməd oğlu Məsimli,2d2bd2b9-eacf-40c2-8acc-3ae6746f00b5
Əliağa İzzət oğlu Hüseynov,81627bc1-2d37-458f-9398-2a320b8e769b
Əsabil Qarakişi oğlu Qasımov,b9ee054e-4570-49c3-8141-9e6f3338008b
