id,name,sort_name,email,twitter,facebook,group,group_id,area_id,area,chamber,term,start_date,end_date,image,gender,wikidata,wikidata_group,wikidata_area
f66a1a3d-ca11-4f6f-b859-6e477df5e52d,Adil Abış oğlu Əliyev,Adil Abış oğlu Əliyev,,,,Independent,IND,20,Nərimanov II seçim dairəsi,National Assembly,5,,,,,,Q327591,
7af37d6a-8f3c-4072-ade9-d22e489f3a97,Aqil Məhəmməd oğlu Abbas,Aqil Məhəmməd oğlu Abbas,,,,Independent,IND,83,Ağcabədi-Füzuli seçim dairəsi,National Assembly,5,,,,,,Q327591,
bafb4d73-fdd4-4b38-b323-732aa6b0101a,Aqiyə Həbib qızı Naxçıvanlı,Aqiyə Həbib qızı Naxçıvanlı,,,,Yeni Azərbaycan Partiyası,Yeni Azərbaycan Partiyası,117,Oğuz-Qəbələ seçim dairəsi,National Assembly,5,,,,,,,
e3625dc9-c0ad-473a-83b7-ae66a5750366,Araz Məmməd-Mübariz oğlu Əlizadə,Araz Məmməd-Mübariz oğlu Əlizadə,,,,Azərbaycan Sosial Demokrat Partiyası,Azərbaycan Sosial Demokrat Partiyası,35,Xətai III seçim dairəsi,National Assembly,5,,,,,,,
1ac23122-1787-4862-8df0-d7328b5f6aef,Arif Qafar oğlu Rəhimzadə,Arif Qafar oğlu Rəhimzadə,,,,Yeni Azərbaycan Partiyası,Yeni Azərbaycan Partiyası,61,Neftçala seçim dairəsi,National Assembly,5,,,,,,,
c6983e0a-233b-4d82-bd52-5ebb5091d840,Asim Nazim oğlu Mollazadə,Asim Nazim oğlu Mollazadə,,,,Azərbaycan Demokratik İslahatlar Partiyası,Azərbaycan Demokratik İslahatlar Partiyası,22,Nəsimi II seçim dairəsi,National Assembly,5,,,,,,,
7a4c6e6a-8f92-489f-a6c4-580463c291e3,Astan Nuşrəvan oğlu Şahverdiyev,Astan Nuşrəvan oğlu Şahverdiyev,,,,Yeni Azərbaycan Partiyası,Yeni Azərbaycan Partiyası,120,Cəbrayıl-Qubadlı seçim dairəsi,National Assembly,5,,,,,,,
35ed9ab0-143e-4690-98d9-7546e8c1e919,Aydın Böyükkişi oğlu Mirzəzadə,Aydın Böyükkişi oğlu Mirzəzadə,,,,Yeni Azərbaycan Partiyası,Yeni Azərbaycan Partiyası,47,Mingəçevir seçim dairəsi,National Assembly,5,,,,,,,
58778d5f-3719-47c8-b0e9-e38bdbbf3389,Aydın Nəsir oğlu Hüseynov,Aydın Nəsir oğlu Hüseynov,,,,Yeni Azərbaycan Partiyası,Yeni Azərbaycan Partiyası,11,Qaradağ seçim dairəsi,National Assembly,5,,,,,,,
f65d6abc-9960-4449-b028-963310081712,Aytən İnqilab qızı Mustafazadə,Aytən İnqilab qızı Mustafazadə,,,,Independent,IND,16,Yasamal II seçim dairəsi,National Assembly,5,,,,,,Q327591,
d2d651f0-5bcb-470d-b104-92c7ba0fd1da,Azay Əjdər oğlu Quliyev,Azay Əjdər oğlu Quliyev,,,,Independent,IND,8,Binəqədi I seçim dairəsi,National Assembly,5,,,,,,Q327591,
4349e477-cd37-4dc5-989b-edabb1c69485,Azər Camal oğlu Badamov,Azər Camal oğlu Badamov,,,,Yeni Azərbaycan Partiyası,Yeni Azərbaycan Partiyası,51,Qusar seçim dairəsi,National Assembly,5,,,,,,,
ce12866c-e979-4f24-b895-a8f3ba36ce46,Azər Şəmşid oğlu Kərimli,Azər Şəmşid oğlu Kərimli,,,,Independent,IND,112,Qax seçim dairəsi,National Assembly,5,,,,,,Q327591,
9123e927-47d2-4030-bd8e-ac26582bd297,Ağacan Qulam oğlu Abıyev,Ağacan Qulam oğlu Abıyev,,,,Yeni Azərbaycan Partiyası,Yeni Azərbaycan Partiyası,32,Suraxanı III seçim dairəsi,National Assembly,5,,,,,,,
d01862e6-4453-430c-af8f-2b2559657b49,Ağalar İsrafil oğlu Vəliyev,Ağalar İsrafil oğlu Vəliyev,,,,Yeni Azərbaycan Partiyası,Yeni Azərbaycan Partiyası,97,Goranboy-Ağdam-Tərtər seçim dairəsi,National Assembly,5,,,,,,,
797b43e4-702e-41ba-8b6f-1511e166e75e,Bahar Əvəz qızı Muradova,Bahar Əvəz qızı Muradova,,,,Yeni Azərbaycan Partiyası,Yeni Azərbaycan Partiyası,84,Füzuli seçim dairəsi,National Assembly,5,,,,,,,
7946c4c7-4ab7-4a8b-972b-d4cdd44430f6,Bəxtiyar Həmzə oğlu Əliyev,Bəxtiyar Həmzə oğlu Əliyev,,,,Independent,IND,118,Ağdam şəhər seçim dairəsi,National Assembly,5,,,,,,Q327591,
af2a3487-8050-4110-8bb6-310b4f5b3faf,Bəxtiyar Yusif oğlu Sadıqov,Bəxtiyar Yusif oğlu Sadıqov,,,,Yeni Azərbaycan Partiyası,Yeni Azərbaycan Partiyası,119,Ağdam qəsəbə seçim dairəsi,National Assembly,5,,,,,,,
292d7367-cbcd-4c3c-bf36-54c8765ae269,Cavanşir Hümmət oğlu Paşazadə,Cavanşir Hümmət oğlu Paşazadə,,,,Yeni Azərbaycan Partiyası,Yeni Azərbaycan Partiyası,75,Lənkəran-Masallı seçim dairəsi,National Assembly,5,,,,,,,
552a59ae-9e9f-4161-91f0-abbbcfb38f4a,Cavanşir Əyyub oğlu Feyziyev,Cavanşir Əyyub oğlu Feyziyev,,,,Independent,IND,115,Şəki qəsəbə II seçim dairəsi,National Assembly,5,,,,,,Q327591,
fc98c3c7-cb32-4f34-9679-3f585ac95f1f,Cavid Həmid oğlu Osmanov,Cavid Həmid oğlu Osmanov,,,,Yeni Azərbaycan Partiyası,Yeni Azərbaycan Partiyası,90,Ağdaş seçim dairəsi,National Assembly,5,,,,,,,
20d0c307-e6e4-4da1-ab63-406df3f622c3,Cavid Qənbər oğlu Qurbanov,Cavid Qənbər oğlu Qurbanov,,,,Yeni Azərbaycan Partiyası,Yeni Azərbaycan Partiyası,123,Kəlbəcər seçim dairəsi,National Assembly,5,,,,,,,
6c764797-bc8e-4366-985c-ea236a0f0acb,Dilarə Məmmədağa qızı Cəbrayılova,Dilarə Məmmədağa qızı Cəbrayılova,,,,Yeni Azərbaycan Partiyası,Yeni Azərbaycan Partiyası,27,Sabunçu II seçim dairəsi,National Assembly,5,,,,,,,
670b9e2b-7a4c-4059-b9ea-05555e777717,Eldar Allahyar oğlu Quliyev,Eldar Allahyar oğlu Quliyev,,,,Independent,IND,28,Sabunçu III seçim dairəsi,National Assembly,5,,,,,,Q327591,
e19f574a-da2c-49f0-8e9f-04fa3b8c6455,Eldar Rza oğlu İbrahimov,Eldar Rza oğlu İbrahimov,,,,Yeni Azərbaycan Partiyası,Yeni Azərbaycan Partiyası,4,Naxçıvan şəhər seçim dairəsi,National Assembly,5,,,,,,,
2474bda9-e79b-4bc9-985f-4ab59d91fa6a,Eldəniz Adil oğlu Səlimov,Eldəniz Adil oğlu Səlimov,,,,Yeni Azərbaycan Partiyası,Yeni Azərbaycan Partiyası,55,Xaçmaz şəhər seçim dairəsi,National Assembly,5,,,,,,,
cee79d71-cbd6-469a-bdd8-b37f9f8b2886,Elman Camal oğlu Məmmədov,Elman Camal oğlu Məmmədov,,,,Yeni Azərbaycan Partiyası,Yeni Azərbaycan Partiyası,124,Şuşa-Ağdam-Xocalı-Xocavənd seçim dairəsi,National Assembly,5,,,,,,,
71146312-7a8b-4b77-89b0-bfa9571a0ba7,Elman Xudam oğlu Nəsirli,Elman Xudam oğlu Nəsirli,,,,Yeni Azərbaycan Partiyası,Yeni Azərbaycan Partiyası,89,Göyçay-Ağdaş seçim dairəsi,National Assembly,5,,,,,,,
ef64bf5f-03c4-40d6-a94e-7d0e20fc68e9,Elmira Hüseyn qızı Axundova,Elmira Hüseyn qızı Axundova,,,,Independent,IND,71,Masallı qəsəbə seçim dairəsi,National Assembly,5,,,,,,Q327591,
fb4981b3-4096-4a65-9540-94a831a0b02f,Elxan Sirac oğlu Süleymanov,Elxan Sirac oğlu Süleymanov,,,,Independent,IND,85,Şamaxı seçim dairəsi,National Assembly,5,,,,,,Q327591,
b4c24c0f-8946-40ca-a73e-23be1cc39ca1,Elçin Bəybala oğlu Quliyev,Elçin Bəybala oğlu Quliyev,,,,Yeni Azərbaycan Partiyası,Yeni Azərbaycan Partiyası,63,Sabirabad I seçim dairəsi,National Assembly,5,,,,,,,
21d2fe3a-e0c6-4baf-9de9-766117ec184a,Elşad Eldar oğlu Həsənov,Elşad Eldar oğlu Həsənov,,,,Independent,IND,17,Yasamal III seçim dairəsi,National Assembly,5,,,,,,Q327591,
561d2a0d-eb8f-4c06-9f51-b402fadc9518,Elşən Məmmədhənifə oğlu Musayev,Elşən Məmmədhənifə oğlu Musayev,,,,Azərbaycan Demokratik Maarifçilik Partiyası,Azərbaycan Demokratik Maarifçilik Partiyası,110,Zaqatala seçim dairəsi,National Assembly,5,,,,,,,
465b974d-c0b3-4ab4-b0d5-2ee473bee425,Fazil Qəzənfər oğlu Mustafa,Fazil Qəzənfər oğlu Mustafa,,,,Böyük Quruluş Partiyası,Böyük Quruluş Partiyası,26,Sabunçu I seçim dairəsi,National Assembly,5,,,,,,,
68456677-90f1-4d0f-b02b-c278a84b01c4,Flora Qasım qızı Qasımova,Flora Qasım qızı Qasımova,,,,Independent,IND,122,Xankəndi seçim dairəsi,National Assembly,5,,,,,,Q327591,
57b76c27-010e-4685-b9b4-2b7e80d28c05,Fuad Rauf oğlu Muradov,Fuad Rauf oğlu Muradov,,,,Independent,IND,34,Xətai II seçim dairəsi,National Assembly,5,,,,,,Q327591,
8816a7f3-94ce-4d64-b9e1-6a677b5c2d67,Fərəc İbrahim oğlu Quliyev,Fərəc İbrahim oğlu Quliyev,,,,Milli Dirçəliş Hərəkatı Partiyası,Milli Dirçəliş Hərəkatı Partiyası,31,Suraxanı II seçim dairəsi,National Assembly,5,,,,,,,
0d48f494-9a67-4a8c-bc05-de31eff9991b,Fəttah Səməd oğlu Heydərov,Fəttah Səməd oğlu Heydərov,,,,Independent,IND,116,Qəbələ seçim dairəsi,National Assembly,5,,,,,,Q327591,
62860acf-4af5-49d6-85f1-006e1b17c766,Fəzail Feyruz oğlu İbrahimli,Fəzail Feyruz oğlu İbrahimli,,,,Vətəndaş Həmrəyliyi Partiyası,Vətəndaş Həmrəyliyi Partiyası,69,Cəlilabad-Masallı-Biləsuvar seçim dairəsi,National Assembly,5,,,,,,,
b2ba45f2-b9c9-438d-b629-eda0fa803f84,Fəzail Rəhim oğlu Ağamalı,Fəzail Rəhim oğlu Ağamalı,,,,Ana Vətən Partiyası,Ana Vətən Partiyası,60,Salyan-Neftçala seçim dairəsi,National Assembly,5,,,,,,,
9e58d141-71de-4b8e-9ae0-5e8c9ec3ead3,Gövhər Baxşəli qızı Baxşəliyeva,Gövhər Baxşəli qızı Baxşəliyeva,,,,Independent,IND,93,Bərdə şəhər seçim dairəsi,National Assembly,5,,,,,,Q327591,
503585cc-102d-4b0e-a120-7564d69565b3,Hacı Hacıbaba oğlu Salayev,Hacı Hacıbaba oğlu Salayev,,,,Independent,IND,44,Sumqayıt-Abşeron seçim dairəsi,National Assembly,5,,,,,,Q327591,
49b4485f-efaf-4c65-af88-0781da927b64,Hadı Musa oğlu Rəcəbli,Hadı Musa oğlu Rəcəbli,,,,Yeni Azərbaycan Partiyası,Yeni Azərbaycan Partiyası,74,Lənkəran qəsəbə seçim dairəsi,National Assembly,5,,,,,,,
4f15bd14-292f-4c7f-af55-7fc789f4170d,Hikmət Baba oğlu Məmmədov,Hikmət Baba oğlu Məmmədov,,,,Yeni Azərbaycan Partiyası,Yeni Azərbaycan Partiyası,19,Nərimanov I seçim dairəsi,National Assembly,5,,,,,,,
099a9d60-11e6-4534-b9e0-ccb2c4424105,Hüseynbala Fazil oğlu Mirələmov,Hüseynbala Fazil oğlu Mirələmov,,,,Yeni Azərbaycan Partiyası,Yeni Azərbaycan Partiyası,33,Xətai I seçim dairəsi,National Assembly,5,,,,,,,
09537143-f8f7-4501-b818-03cfe8625f7e,Jalə Fazil qızı Əliyeva,Jalə Fazil qızı Əliyeva,,,,Independent,IND,92,Zərdab-Ucar seçim dairəsi,National Assembly,5,,,,,,Q327591,
900b6898-bb49-4648-8462-25103d0255b4,Kamaləddin Nəsrəddin oğlu Qafarov,Kamaləddin Nəsrəddin oğlu Qafarov,,,,Yeni Azərbaycan Partiyası,Yeni Azərbaycan Partiyası,9,Binəqədi II seçim dairəsi,National Assembly,5,,,,,,,
4257afa1-f17c-45f6-bd3c-2af4c9395b97,Kamilə Əli Ağa qızı Əliyeva,Kamilə Əli Ağa qızı Əliyeva,,,,Yeni Azərbaycan Partiyası,Yeni Azərbaycan Partiyası,111,Zaqatala-Balakən seçim dairəsi,National Assembly,5,,,,,,,
a2dbb07e-bd52-4060-9dc0-8e6eec1f6999,Kamran Fərhad oğlu Bayramov,Kamran Fərhad oğlu Bayramov,,,,Yeni Azərbaycan Partiyası,Yeni Azərbaycan Partiyası,100,Şəmkir-Daşkəsən seçim dairəsi,National Assembly,5,,,,,,,
acf3edb1-a788-4cc9-a091-a1a497c5f49c,Kamran Telman oğlu Nəbizadə,Kamran Telman oğlu Nəbizadə,,,,Independent,IND,107,Qazax seçim dairəsi,National Assembly,5,,,,,,Q327591,
d049a20c-042e-47f2-95da-e85b7592f67d,Madər Ələsgər oğlu Musayev,Madər Ələsgər oğlu Musayev,,,,Independent,IND,10,Binəqədi III seçim dairəsi,National Assembly,5,,,,,,Q327591,
cf0887b3-be54-494b-9beb-57cb19851604,Mahir Məhəmmədəli oğlu Aslanov,Mahir Məhəmmədəli oğlu Aslanov,,,,Independent,IND,96,Goranboy-Naftalan seçim dairəsi,National Assembly,5,,,,,,Q327591,
2af492bb-727a-4637-a6b7-c9176ce0a3f1,Mahir Tapdıq oğlu Abbaszadə,Mahir Tapdıq oğlu Abbaszadə,,,,Yeni Azərbaycan Partiyası,Yeni Azərbaycan Partiyası,121,Laçın seçim dairəsi,National Assembly,5,,,,,,,
19ff37f3-25c2-46f5-b922-84c589a1d17e,Malik Əvəz oğlu Həsənov,Malik Əvəz oğlu Həsənov,,,,Yeni Azərbaycan Partiyası,Yeni Azərbaycan Partiyası,67,Cəlilabad şəhər seçim dairəsi,National Assembly,5,,,,,,,
3db43290-2d15-4bf2-a21e-fe4ea1d04eef,Mehriban Arif qızı Əliyeva,Mehriban Arif qızı Əliyeva,,,,Yeni Azərbaycan Partiyası,Yeni Azərbaycan Partiyası,14,Xəzər II seçim dairəsi,National Assembly,5,,,,,,,
2d67a4a6-e6e5-4c19-8fc2-24019c69f825,Mirkazım Mirməhəmməd oğlu Kazımov,Mirkazım Mirməhəmməd oğlu Kazımov,,,,Yeni Azərbaycan Partiyası,Yeni Azərbaycan Partiyası,68,Cəlilabad qəsəbə seçim dairəsi,National Assembly,5,,,,,,,
6b0b4a0e-a812-462e-a9ec-b7ac14d0793a,Mirzəcan Mirzəmməd oğlu Xəlilov,Mirzəcan Mirzəmməd oğlu Xəlilov,,,,Yeni Azərbaycan Partiyası,Yeni Azərbaycan Partiyası,41,Sumqayıt I seçim dairəsi,National Assembly,5,,,,,,,
16f55d26-dff1-4f1c-8b44-90881011df2e,Mixail Yuri oğlu Zabelin,Mixail Yuri oğlu Zabelin,,,,Yeni Azərbaycan Partiyası,Yeni Azərbaycan Partiyası,12,Qaradağ-Binəqədi-Yasamal seçim dairəsi,National Assembly,5,,,,,,,
2019ef3c-1ecd-471c-a7ea-29335071c608,Musa Cəfər oğlu Qasımlı,Musa Cəfər oğlu Qasımlı,,,,Independent,IND,72,Yardımlı-Masallı seçim dairəsi,National Assembly,5,,,,,,Q327591,
fb789a9f-57c5-4466-bacb-d6244a452d8c,Musa İsa oğlu Quliyev (Urud),Musa İsa oğlu Quliyev (Urud),,,,Yeni Azərbaycan Partiyası,Yeni Azərbaycan Partiyası,40,Kəpəz II seçim dairəsi (Gəncə şəhəri),National Assembly,5,,,,,,,
6e7f087c-0ca8-4906-89ac-2cdf694ac697,Muxtar Bahadur oğlu Babayev,Muxtar Bahadur oğlu Babayev,,,,Yeni Azərbaycan Partiyası,Yeni Azərbaycan Partiyası,43,Sumqayıt III seçim dairəsi,National Assembly,5,,,,,,,
0415cae7-63f3-4f40-b255-94142dd3bd2a,Müslüm Mürsəl oğlu Məmmədov,Müslüm Mürsəl oğlu Məmmədov,,,,Independent,IND,57,Kürdəmir seçim dairəsi,National Assembly,5,,,,,,Q327591,
5763cd40-900f-4a82-b501-ec4e76b1fbd8,Məlahət İbrahim qızı Həsənova,Məlahət İbrahim qızı Həsənova,,,,Yeni Azərbaycan Partiyası,Yeni Azərbaycan Partiyası,21,Nəsimi I seçim dairəsi,National Assembly,5,,,,,,,
4d778aa3-c504-4dae-abdd-1e3481457e9e,Naqif Ələşrəf oğlu Həmzəyev,Naqif Ələşrəf oğlu Həmzəyev,,,,Yeni Azərbaycan Partiyası,Yeni Azərbaycan Partiyası,38,Nizami II seçim dairəsi (Gəncə şəhəri),National Assembly,5,,,,,,,
9843e447-e6cb-40ce-9c8c-5ba785eacd64,Nizami Qulu oğlu Cəfərov,Nizami Qulu oğlu Cəfərov,,,,Yeni Azərbaycan Partiyası,Yeni Azərbaycan Partiyası,108,Ağstafa seçim dairəsi,National Assembly,5,,,,,,,
2579cb9d-8df0-49e3-8caa-dd02337fadda,Novruzəli Davud oğlu Aslanov,Novruzəli Davud oğlu Aslanov,,,,Independent,IND,86,İsmayıllı seçim dairəsi,National Assembly,5,,,,,,Q327591,
19e563fa-25d5-4aaa-bac9-16bdcd360420,Nəriman Əlibala oğlu Əliyev,Nəriman Əlibala oğlu Əliyev,,,,Yeni Azərbaycan Partiyası,Yeni Azərbaycan Partiyası,70,Masallı şəhər seçim dairəsi,National Assembly,5,,,,,,,
497ce1cb-affe-46bb-b5d2-59cf95ded942,Nəsib Məhəmməd oğlu Məhəməliyev,Nəsib Məhəmməd oğlu Məhəməliyev,,,,Yeni Azərbaycan Partiyası,Yeni Azərbaycan Partiyası,109,Balakən seçim dairəsi,National Assembly,5,,,,,,,
fac1962f-a0fb-45ba-ba1d-78901e613239,Oqtay Sabir oğlu Əsədov,Oqtay Sabir oğlu Əsədov,,,,Yeni Azərbaycan Partiyası,Yeni Azərbaycan Partiyası,45,Abşeron seçim dairəsi,National Assembly,5,,,,,,,
9bbec92c-016b-42f3-98c4-6370d5737648,Pərvin Orxan qızı Kərimzadə,Pərvin Orxan qızı Kərimzadə,,,,Yeni Azərbaycan Partiyası,Yeni Azərbaycan Partiyası,37,Nizami I seçim dairəsi (Gəncə şəhəri),National Assembly,5,,,,,,,
ff949d2e-8588-48b8-bcb7-55dbeb3ae4af,Qüdrət Müzəffər oğlu Həsənquliyev,Qüdrət Müzəffər oğlu Həsənquliyev,,,,Bütöv Azərbaycan Xalq Cəbhəsi Partiyası,Bütöv Azərbaycan Xalq Cəbhəsi Partiyası,7,Ordubad-Culfa seçim dairəsi,National Assembly,5,,,,,,,
5a687885-e1ef-4e97-a395-984dd355f247,Qənirə Ələsgər qızı Paşayeva,Qənirə Ələsgər qızı Paşayeva,,,,Independent,IND,105,Tovuz seçim dairəsi,National Assembly,5,,,,,,Q327591,
fef9faee-37a8-462d-a16e-f89dba382fe2,Rafael Baba oğlu Hüseynov,Rafael Baba oğlu Hüseynov,,,,Independent,IND,58,Hacıqabul-Kürdəmir seçim dairəsi,National Assembly,5,,,,,,Q327591,
8a31e6ff-5eab-456e-a90b-e08cbfe08328,Rafael Kamil oğlu Cəbrayılov,Rafael Kamil oğlu Cəbrayılov,,,,Independent,IND,46,Şirvan seçim dairəsi,National Assembly,5,,,,,,Q327591,
e6e8dfd9-96e1-4ce6-899f-7c96c8499ab8,Rafiq Musa oğlu Məmmədhəsənov,Rafiq Musa oğlu Məmmədhəsənov,,,,Yeni Azərbaycan Partiyası,Yeni Azərbaycan Partiyası,104,Gədəbəy-Tovuz seçim dairəsi,National Assembly,5,,,,,,,
3a8af4d9-85e1-4dc9-9aea-497cf16c413c,Rasim Nəsrəddin oğlu Musabəyov,Rasim Nəsrəddin oğlu Musabəyov,,,,Independent,IND,18,Nərimanov-Nizami seçim dairəsi,National Assembly,5,,,,,,Q327591,
3321f7bc-1bd9-405b-941b-a18574186bb9,Rauf Asif oğlu Əliyev,Rauf Asif oğlu Əliyev,,,,Yeni Azərbaycan Partiyası,Yeni Azərbaycan Partiyası,13,Xəzər I seçim dairəsi,National Assembly,5,,,,,,,
67e20801-610d-46b8-95c2-0cf3189a07f2,Rövnəq İbrahim oğlu Abdullayev,Rövnəq İbrahim oğlu Abdullayev,,,,Yeni Azərbaycan Partiyası,Yeni Azərbaycan Partiyası,24,Nizami I seçim dairəsi,National Assembly,5,,,,,,,
61485249-8d4c-4a09-be2a-b69f9d8ef177,Rövşən Şükür oğlu Rzayev,Rövşən Şükür oğlu Rzayev,,,,Independent,IND,101,Göygöl-Daşkəsən seçim dairəsi,National Assembly,5,,,,,,Q327591,
f250bd46-c1e9-4771-a1db-6d7a65c8b71b,Rüfət Atakişi oğlu Quliyev,Rüfət Atakişi oğlu Quliyev,,,,Independent,IND,73,Lənkəran şəhər seçim dairəsi,National Assembly,5,,,,,,Q327591,
c6a48f33-7066-40c9-b2ed-4870757e45e9,Rüstəm Gülabba oğlu Xəlilov,Rüstəm Gülabba oğlu Xəlilov,,,,Yeni Azərbaycan Partiyası,Yeni Azərbaycan Partiyası,64,Sabirabad II seçim dairəsi,National Assembly,5,,,,,,,
a7d0b86b-c7a3-464a-b217-2d039cb6ea1c,Rəşad Məmmədqulu oğlu Mahmudov,Rəşad Məmmədqulu oğlu Mahmudov,,,,Yeni Azərbaycan Partiyası,Yeni Azərbaycan Partiyası,77,Astara seçim dairəsi,National Assembly,5,,,,,,,
2cbd4e22-8017-4604-8268-6876eaf58195,Sabir Kamal oğlu Hacıyev,Sabir Kamal oğlu Hacıyev,,,,Vətəndaş Birliyi Partiyası,Vətəndaş Birliyi Partiyası,88,Göyçay seçim dairəsi,National Assembly,5,,,,,,,
24108a1f-026d-4257-bbf2-f137d7393ebd,Sahib Eyvaz oğlu Alıyev,Sahib Eyvaz oğlu Alıyev,,,,Independent,IND,95,Tərtər seçim dairəsi,National Assembly,5,,,,,,Q327591,
8044d2d2-b07d-4521-ad5e-46ee98675dbf,Sahibə Əli qızı Qafarova,Sahibə Əli qızı Qafarova,,,,Yeni Azərbaycan Partiyası,Yeni Azərbaycan Partiyası,98,Şəmkir şəhər seçim dairəsi,National Assembly,5,,,,,,,
0e77e510-145c-47d8-86a3-e74f29a2dc23,Sevinc Həbib qızı Fətəliyeva,Sevinc Həbib qızı Fətəliyeva,,,,Yeni Azərbaycan Partiyası,Yeni Azərbaycan Partiyası,30,Suraxanı I seçim dairəsi,National Assembly,5,,,,,,,
77e1f1c4-dc4d-42bf-a60b-af2acf181838,Sevinc Əmirəhməd qızı Hüseynova,Sevinc Əmirəhməd qızı Hüseynova,,,,Yeni Azərbaycan Partiyası,Yeni Azərbaycan Partiyası,103,Gədəbəy seçim dairəsi,National Assembly,5,,,,,,,
6dfeade9-c737-44ba-9c5b-25f2ff51c64f,Siyavuş Dünyamalı oğlu Novruzov,Siyavuş Dünyamalı oğlu Novruzov,,,,Yeni Azərbaycan Partiyası,Yeni Azərbaycan Partiyası,5,Şahbuz-Babək seçim dairəsi,National Assembly,5,,,,,,,
a6e25ca0-20a3-4540-9e2b-bdd6b14e152f,Sona Sakit qızı Əliyeva,Sona Sakit qızı Əliyeva,,,,Yeni Azərbaycan Partiyası,Yeni Azərbaycan Partiyası,99,Şəmkir qəsəbə seçim dairəsi,National Assembly,5,,,,,,,
647f2125-8351-4b01-99ad-57b6295f7472,Sədaqət Süleyman qızı Vəliyeva,Sədaqət Süleyman qızı Vəliyeva,,,,Yeni Azərbaycan Partiyası,Yeni Azərbaycan Partiyası,25,Nizami II seçim dairəsi,National Assembly,5,,,,,,,
96071f71-1dd4-46b9-bac7-1da0d853a382,Səməd İsmayıl oğlu Seyidov,Səməd İsmayıl oğlu Seyidov,,,,Yeni Azərbaycan Partiyası,Yeni Azərbaycan Partiyası,36,Xətai IV seçim dairəsi,National Assembly,5,,,,,,,
d2eb8832-05a6-4688-b014-150639f83e0b,Səttar Suliddin oğlu Mehbalıyev,Səttar Suliddin oğlu Mehbalıyev,,,,Independent,IND,3,Babək-Kəngərli-Naxçıvan seçim dairəsi,National Assembly,5,,,,,,Q327591,
8157fb06-535a-4c01-8501-2004486dafa3,Tahir Famil oğlu oğlu Mirkişili,Tahir Famil oğlu oğlu Mirkişili,,,,Yeni Azərbaycan Partiyası,Yeni Azərbaycan Partiyası,42,Sumqayıt II seçim dairəsi,National Assembly,5,,,,,,,
bcdb4da0-344a-419f-b011-8df4bc5117d0,Tahir Musa oğlu Rzayev,Tahir Musa oğlu Rzayev,,,,Yeni Azərbaycan Partiyası,Yeni Azərbaycan Partiyası,82,Ağcabədi seçim dairəsi,National Assembly,5,,,,,,,
05735795-cd4f-4974-ba11-b7246d3fcb3e,Tahir Süleyman oğlu Süleymanov,Tahir Süleyman oğlu Süleymanov,,,,Yeni Azərbaycan Partiyası,Yeni Azərbaycan Partiyası,54,Şabran-Siyəzən seçim dairəsi,National Assembly,5,,,,,,,
bd780867-dd77-470e-aa14-34fc1cf986b6,Tahir Zayıdağa oğlu Kərimli,Tahir Zayıdağa oğlu Kərimli,,,,Vəhdət Partiyası,Vəhdət Partiyası,87,Ağsu-İsmayıllı seçim dairəsi,National Assembly,5,,,,,,,
7e522046-bc68-4317-ac8f-8e585aa1fe97,Vahid Qazməmməd oğlu Əhmədov,Vahid Qazməmməd oğlu Əhmədov,,,,Independent,IND,52,Quba seçim dairəsi,National Assembly,5,,,,,,Q327591,
6d1be91b-3ccd-4b2c-8bd6-cd0bb71e5e16,Valeh Feyruz oğlu Ələsgərov,Valeh Feyruz oğlu Ələsgərov,,,,Independent,IND,102,Samux-Şəmkir seçim dairəsi,National Assembly,5,,,,,,Q327591,
f4b76d59-d011-48df-8769-c3fbcc12a78e,Vasif Yusif oğlu Talıbov,Vasif Yusif oğlu Talıbov,,,,Yeni Azərbaycan Partiyası,Yeni Azərbaycan Partiyası,1,Şərur-Sədərək seçim dairəsi,National Assembly,5,,,,,,,
bfd59005-b1c2-4149-a892-a76a0c2fae4c,Vüsal Əfqan oğlu Hüseynov,Vüsal Əfqan oğlu Hüseynov,,,,Yeni Azərbaycan Partiyası,Yeni Azərbaycan Partiyası,91,Ucar seçim dairəsi,National Assembly,5,,,,,,,
e279a15b-a16f-4b3b-9cbd-df5af90bc036,Xanhüseyn Hüseynağa oğlu Kazımlı,Xanhüseyn Hüseynağa oğlu Kazımlı,,,,Azərbaycan Sosial Rifah Partiyası,Azərbaycan Sosial Rifah Partiyası,66,Biləsuvar seçim dairəsi,National Assembly,5,,,,,,,
3f9f87cb-af03-469a-b6f7-2c44677bfadd,Xanlar Nuru oğlu Fətiyev,Xanlar Nuru oğlu Fətiyev,,,,Yeni Azərbaycan Partiyası,Yeni Azərbaycan Partiyası,39,Kəpəz I seçim dairəsi (Gəncə şəhəri),National Assembly,5,,,,,,,
a5b6b26c-664b-44e1-bd2c-47ac1316e2e0,Yaqub Mikayıl oğlu Mahmudov,Yaqub Mikayıl oğlu Mahmudov,,,,Yeni Azərbaycan Partiyası,Yeni Azərbaycan Partiyası,113,Şəki şəhər seçim dairəsi,National Assembly,5,,,,,,,
127e11c0-dbc3-4ee9-899a-b85b06bed232,Yevda Sasun oğlu Abramov,Yevda Sasun oğlu Abramov,,,,Yeni Azərbaycan Partiyası,Yeni Azərbaycan Partiyası,53,Quba-Qusar seçim dairəsi,National Assembly,5,,,,,,,
c3237789-3c8d-4c9b-8042-dc1a80897ebc,Zahid Məhərrəm oğlu Oruc,Zahid Məhərrəm oğlu Oruc,,,,Independent,IND,94,Bərdə qəsəbə seçim dairəsi,National Assembly,5,,,,,,Q327591,
8bd07e4b-a1a9-40ef-b518-f33ecf5956d7,Zeynəb Yəhya qızı Xanlarova,Zeynəb Yəhya qızı Xanlarova,,,,Independent,IND,50,Qobustan-Xızı-Sumqayıt seçim dairəsi,National Assembly,5,,,,,,Q327591,
0b754eb1-e054-4e48-8020-9cfe7d2ab382,Ziyad Əliabbas oğlu Səmədzadə,Ziyad Əliabbas oğlu Səmədzadə,,,,Independent,IND,23,Nəsimi-Səbail seçim dairəsi,National Assembly,5,,,,,,Q327591,
2df79453-bbbd-4345-9fb8-b2a4794cd533,Ziyafət Abbas oğlu Əsgərov,Ziyafət Abbas oğlu Əsgərov,,,,Yeni Azərbaycan Partiyası,Yeni Azərbaycan Partiyası,76,Lənkəran-Astara seçim dairəsi,National Assembly,5,,,,,,,
001fe95a-b40d-4b78-b198-88b1a267dd2b,Çingiz Aşralı oğlu Qənizadə,Çingiz Aşralı oğlu Qənizadə,,,,Independent,IND,80,İmişli-Beyləqan seçim dairəsi,National Assembly,5,,,,,,Q327591,
05d037db-289c-4c1e-ab67-b6e8ff04308e,Ülvi Zahid oğlu Quliyev,Ülvi Zahid oğlu Quliyev,,,,Independent,IND,15,Yasamal I seçim dairəsi,National Assembly,5,,,,,,Q327591,
0c9b603b-529f-427c-b7c0-32b070faf91d,Ülviyyə Cavanşir qızı Ağayeva,Ülviyyə Cavanşir qızı Ağayeva,,,,Independent,IND,106,Tovuz-Qazax-Ağstafa seçim dairəsi,National Assembly,5,,,,,,Q327591,
c61d52ce-91a3-41fc-9ff8-4fd5505da494,Ülviyyə Tapdıq qızı Həmzəyeva,Ülviyyə Tapdıq qızı Həmzəyeva,,,,Yeni Azərbaycan Partiyası,Yeni Azərbaycan Partiyası,6,Culfa-Babək seçim dairəsi,National Assembly,5,,,,,,,
e9fa40e6-2525-4ad8-89c4-1b504b5a6c7b,İlham Kazım oğlu Məmmədov,İlham Kazım oğlu Məmmədov,,,,Yeni Azərbaycan Partiyası,Yeni Azərbaycan Partiyası,48,Yevlax seçim dairəsi,National Assembly,5,,,,,,,
6fb34b13-3eef-4f48-b72d-ef783683e278,İlham Əlisəftər oğlu Əliyev,İlham Əlisəftər oğlu Əliyev,,,,Yeni Azərbaycan Partiyası,Yeni Azərbaycan Partiyası,56,Xaçmaz qəsəbə seçim dairəsi,National Assembly,5,,,,,,,
3e491bb7-33a3-4b0d-803c-3ea738900985,İmamverdi İbiş oğlu İsmayılov,İmamverdi İbiş oğlu İsmayılov,,,,Yeni Azərbaycan Partiyası,Yeni Azərbaycan Partiyası,125,Zəngilan-Qubadlı seçim dairəsi,National Assembly,5,,,,,,,
2ff27f24-a081-4740-bede-2a573de49e36,İqbal Nəriman oğlu Məmmədov,İqbal Nəriman oğlu Məmmədov,,,,Yeni Azərbaycan Partiyası,Yeni Azərbaycan Partiyası,78,Lerik seçim dairəsi,National Assembly,5,,,,,,,
ea26ebf7-0fab-4241-b60c-d3361bb1e4cc,İsa Əkbər oğlu Həbibbəyli,İsa Əkbər oğlu Həbibbəyli,,,,Yeni Azərbaycan Partiyası,Yeni Azərbaycan Partiyası,2,Şərur seçim dairəsi,National Assembly,5,,,,,,,
2c015aa2-9ec9-4f16-b4a9-3a94f337cdfd,Şahin Əmir oğlu İsmayılov,Şahin Əmir oğlu İsmayılov,,,,Yeni Azərbaycan Partiyası,Yeni Azərbaycan Partiyası,81,Beyləqan seçim dairəsi,National Assembly,5,,,,,,,
616b0316-a283-49b1-bd8b-49c4f62b3eb2,Şəmsəddin Hümmət oğlu Hacıyev,Şəmsəddin Hümmət oğlu Hacıyev,,,,Yeni Azərbaycan Partiyası,Yeni Azərbaycan Partiyası,29,Səbail seçim dairəsi,National Assembly,5,,,,,,,
cf2095ba-7be7-4239-9a2c-2c6b15335973,Əflatun Əhməd oğlu Amaşov,Əflatun Əhməd oğlu Amaşov,,,,Independent,IND,62,Saatlı seçim dairəsi,National Assembly,5,,,,,,Q327591,
ee562fa2-2cfa-44f2-88fb-d669ed545d56,Əhliman Tapdıq oğlu Əmiraslanov,Əhliman Tapdıq oğlu Əmiraslanov,,,,Yeni Azərbaycan Partiyası,Yeni Azərbaycan Partiyası,65,Saatlı-Sabirabad-Kürdəmir seçim dairəsi,National Assembly,5,,,,,,,
90242fca-7c38-41c0-8b81-65e17e637de1,Əli Məhəmməd oğlu Hüseynli,Əli Məhəmməd oğlu Hüseynli,,,,Yeni Azərbaycan Partiyası,Yeni Azərbaycan Partiyası,49,Yevlax-Mingəçevir seçim dairəsi,National Assembly,5,,,,,,,
