id,name,sort_name,email,twitter,facebook,group,group_id,area_id,area,chamber,term,start_date,end_date,image,gender,wikidata,wikidata_group,wikidata_area
a7f56207-df2a-4324-a43f-fec541dcedc7,Adil Abış oğlu Əliyev,Adil Abış oğlu Əliyev,,,,Independent,IND,20,Nərimanov II seçim dairəsi,National Assembly,5,,,,,,Q327591,
ab90db14-ed30-4313-aed2-a5c623d2f140,Aqil Məhəmməd oğlu Abbas,Aqil Məhəmməd oğlu Abbas,,,,Independent,IND,83,Ağcabədi-Füzuli seçim dairəsi,National Assembly,5,,,,,,Q327591,
869f94fd-64c9-43ff-bdc8-5a28fe1a5608,Aqiyə Həbib qızı Naxçıvanlı,Aqiyə Həbib qızı Naxçıvanlı,,,,Yeni Azərbaycan Partiyası,Yeni Azərbaycan Partiyası,117,Oğuz-Qəbələ seçim dairəsi,National Assembly,5,,,,,,,
02d32a83-3a3d-4042-a890-ec915dd97165,Araz Məmməd-Mübariz oğlu Əlizadə,Araz Məmməd-Mübariz oğlu Əlizadə,,,,Azərbaycan Sosial Demokrat Partiyası,Azərbaycan Sosial Demokrat Partiyası,35,Xətai III seçim dairəsi,National Assembly,5,,,,,,,
b94980ba-917f-4ed1-bc34-198acc4534ff,Arif Qafar oğlu Rəhimzadə,Arif Qafar oğlu Rəhimzadə,,,,Yeni Azərbaycan Partiyası,Yeni Azərbaycan Partiyası,61,Neftçala seçim dairəsi,National Assembly,5,,,,,,,
15fcb671-dd7b-4bf9-ae00-9f0869b37224,Asim Nazim oğlu Mollazadə,Asim Nazim oğlu Mollazadə,,,,Azərbaycan Demokratik İslahatlar Partiyası,Azərbaycan Demokratik İslahatlar Partiyası,22,Nəsimi II seçim dairəsi,National Assembly,5,,,,,,,
593f235f-465b-4a72-8b2e-104363d99078,Astan Nuşrəvan oğlu Şahverdiyev,Astan Nuşrəvan oğlu Şahverdiyev,,,,Yeni Azərbaycan Partiyası,Yeni Azərbaycan Partiyası,120,Cəbrayıl-Qubadlı seçim dairəsi,National Assembly,5,,,,,,,
377fc15e-3f2a-4d5b-9db1-cf731cd68ea8,Aydın Böyükkişi oğlu Mirzəzadə,Aydın Böyükkişi oğlu Mirzəzadə,,,,Yeni Azərbaycan Partiyası,Yeni Azərbaycan Partiyası,47,Mingəçevir seçim dairəsi,National Assembly,5,,,,,,,
acc97f8c-b9af-4bde-babc-393dd3a07057,Aydın Nəsir oğlu Hüseynov,Aydın Nəsir oğlu Hüseynov,,,,Yeni Azərbaycan Partiyası,Yeni Azərbaycan Partiyası,11,Qaradağ seçim dairəsi,National Assembly,5,,,,,,,
d715499e-f41a-48fc-9ab7-cdec4cb737d5,Aytən İnqilab qızı Mustafazadə,Aytən İnqilab qızı Mustafazadə,,,,Independent,IND,16,Yasamal II seçim dairəsi,National Assembly,5,,,,,,Q327591,
b490783d-7070-4117-bdc8-e96dadc5c410,Azay Əjdər oğlu Quliyev,Azay Əjdər oğlu Quliyev,,,,Independent,IND,8,Binəqədi I seçim dairəsi,National Assembly,5,,,,,,Q327591,
3f2323fb-8d51-4e5e-b9d9-e8afcb4060d4,Azər Camal oğlu Badamov,Azər Camal oğlu Badamov,,,,Yeni Azərbaycan Partiyası,Yeni Azərbaycan Partiyası,51,Qusar seçim dairəsi,National Assembly,5,,,,,,,
6e77d04f-e997-44f4-8428-934f64a0b099,Azər Şəmşid oğlu Kərimli,Azər Şəmşid oğlu Kərimli,,,,Independent,IND,112,Qax seçim dairəsi,National Assembly,5,,,,,,Q327591,
583f4c9a-86a5-46fb-86d6-f00b94cd75fa,Ağacan Qulam oğlu Abıyev,Ağacan Qulam oğlu Abıyev,,,,Yeni Azərbaycan Partiyası,Yeni Azərbaycan Partiyası,32,Suraxanı III seçim dairəsi,National Assembly,5,,,,,,,
aab1364c-9bc5-449e-844c-b535985842f3,Ağalar İsrafil oğlu Vəliyev,Ağalar İsrafil oğlu Vəliyev,,,,Yeni Azərbaycan Partiyası,Yeni Azərbaycan Partiyası,97,Goranboy-Ağdam-Tərtər seçim dairəsi,National Assembly,5,,,,,,,
512a4735-ecca-42aa-85d6-46e4a032f1e2,Bahar Əvəz qızı Muradova,Bahar Əvəz qızı Muradova,,,,Yeni Azərbaycan Partiyası,Yeni Azərbaycan Partiyası,84,Füzuli seçim dairəsi,National Assembly,5,,,,,,,
03e1ee90-65df-47d1-89c7-fdfca2bb9810,Bəxtiyar Həmzə oğlu Əliyev,Bəxtiyar Həmzə oğlu Əliyev,,,,Independent,IND,118,Ağdam şəhər seçim dairəsi,National Assembly,5,,,,,,Q327591,
ac61f29b-1350-4ced-a565-9bad7ca8295e,Bəxtiyar Yusif oğlu Sadıqov,Bəxtiyar Yusif oğlu Sadıqov,,,,Yeni Azərbaycan Partiyası,Yeni Azərbaycan Partiyası,119,Ağdam qəsəbə seçim dairəsi,National Assembly,5,,,,,,,
e5c39122-eff1-4706-80a9-e43700429daa,Cavanşir Hümmət oğlu Paşazadə,Cavanşir Hümmət oğlu Paşazadə,,,,Yeni Azərbaycan Partiyası,Yeni Azərbaycan Partiyası,75,Lənkəran-Masallı seçim dairəsi,National Assembly,5,,,,,,,
bafd04a8-e904-441c-a913-2ff7d8104196,Cavanşir Əyyub oğlu Feyziyev,Cavanşir Əyyub oğlu Feyziyev,,,,Independent,IND,115,Şəki qəsəbə II seçim dairəsi,National Assembly,5,,,,,,Q327591,
0ef8c0a6-8014-479d-910f-3d07b1c9f4ca,Cavid Həmid oğlu Osmanov,Cavid Həmid oğlu Osmanov,,,,Yeni Azərbaycan Partiyası,Yeni Azərbaycan Partiyası,90,Ağdaş seçim dairəsi,National Assembly,5,,,,,,,
c5d41e02-dec4-4b1c-9017-fc20f2f4cd61,Cavid Qənbər oğlu Qurbanov,Cavid Qənbər oğlu Qurbanov,,,,Yeni Azərbaycan Partiyası,Yeni Azərbaycan Partiyası,123,Kəlbəcər seçim dairəsi,National Assembly,5,,,,,,,
ebcdcdec-f910-45e4-a21f-a0015028f8d8,Dilarə Məmmədağa qızı Cəbrayılova,Dilarə Məmmədağa qızı Cəbrayılova,,,,Yeni Azərbaycan Partiyası,Yeni Azərbaycan Partiyası,27,Sabunçu II seçim dairəsi,National Assembly,5,,,,,,,
4cd2f757-f539-4be5-89e5-4730ef4220be,Eldar Allahyar oğlu Quliyev,Eldar Allahyar oğlu Quliyev,,,,Independent,IND,28,Sabunçu III seçim dairəsi,National Assembly,5,,,,,,Q327591,
a900220d-60e6-4eef-bd37-25c1cdead7bf,Eldar Rza oğlu İbrahimov,Eldar Rza oğlu İbrahimov,,,,Yeni Azərbaycan Partiyası,Yeni Azərbaycan Partiyası,4,Naxçıvan şəhər seçim dairəsi,National Assembly,5,,,,,,,
9249e262-23a3-440c-b585-55b65019b417,Eldəniz Adil oğlu Səlimov,Eldəniz Adil oğlu Səlimov,,,,Yeni Azərbaycan Partiyası,Yeni Azərbaycan Partiyası,55,Xaçmaz şəhər seçim dairəsi,National Assembly,5,,,,,,,
d96ac15e-b044-47e0-b72c-0a93d703b478,Elman Camal oğlu Məmmədov,Elman Camal oğlu Məmmədov,,,,Yeni Azərbaycan Partiyası,Yeni Azərbaycan Partiyası,124,Şuşa-Ağdam-Xocalı-Xocavənd seçim dairəsi,National Assembly,5,,,,,,,
64f8aec2-3e59-4f35-869e-44a2930888b5,Elman Xudam oğlu Nəsirli,Elman Xudam oğlu Nəsirli,,,,Yeni Azərbaycan Partiyası,Yeni Azərbaycan Partiyası,89,Göyçay-Ağdaş seçim dairəsi,National Assembly,5,,,,,,,
0f44a9d5-9a4e-4e83-9179-f07fa43b7b4d,Elmira Hüseyn qızı Axundova,Elmira Hüseyn qızı Axundova,,,,Independent,IND,71,Masallı qəsəbə seçim dairəsi,National Assembly,5,,,,,,Q327591,
5aa06925-1683-4234-a919-2036bd8397de,Elxan Sirac oğlu Süleymanov,Elxan Sirac oğlu Süleymanov,,,,Independent,IND,85,Şamaxı seçim dairəsi,National Assembly,5,,,,,,Q327591,
650ba687-bc2f-4e30-873a-43ac66c0f5a5,Elçin Bəybala oğlu Quliyev,Elçin Bəybala oğlu Quliyev,,,,Yeni Azərbaycan Partiyası,Yeni Azərbaycan Partiyası,63,Sabirabad I seçim dairəsi,National Assembly,5,,,,,,,
03f3f3af-5cb1-405a-9b2d-c7dace094776,Elşad Eldar oğlu Həsənov,Elşad Eldar oğlu Həsənov,,,,Independent,IND,17,Yasamal III seçim dairəsi,National Assembly,5,,,,,,Q327591,
47f74c1d-ae93-4569-846f-0a2b31acac8b,Elşən Məmmədhənifə oğlu Musayev,Elşən Məmmədhənifə oğlu Musayev,,,,Azərbaycan Demokratik Maarifçilik Partiyası,Azərbaycan Demokratik Maarifçilik Partiyası,110,Zaqatala seçim dairəsi,National Assembly,5,,,,,,,
7081ed4f-5ebf-4d2a-9d5e-bfaa22e5a2ec,Fazil Qəzənfər oğlu Mustafa,Fazil Qəzənfər oğlu Mustafa,,,,Böyük Quruluş Partiyası,Böyük Quruluş Partiyası,26,Sabunçu I seçim dairəsi,National Assembly,5,,,,,,,
26ca4ebd-0120-4ade-8df9-8fa7a027472a,Flora Qasım qızı Qasımova,Flora Qasım qızı Qasımova,,,,Independent,IND,122,Xankəndi seçim dairəsi,National Assembly,5,,,,,,Q327591,
a86460cf-a81d-4c38-9c1c-f1981d229dc8,Fuad Rauf oğlu Muradov,Fuad Rauf oğlu Muradov,,,,Independent,IND,34,Xətai II seçim dairəsi,National Assembly,5,,,,,,Q327591,
aa4e56d5-b16b-4599-a5ec-5bed4f36b83e,Fərəc İbrahim oğlu Quliyev,Fərəc İbrahim oğlu Quliyev,,,,Milli Dirçəliş Hərəkatı Partiyası,Milli Dirçəliş Hərəkatı Partiyası,31,Suraxanı II seçim dairəsi,National Assembly,5,,,,,,,
e4e1c7b6-6e2d-4549-b90b-66404e4ee46f,Fəttah Səməd oğlu Heydərov,Fəttah Səməd oğlu Heydərov,,,,Independent,IND,116,Qəbələ seçim dairəsi,National Assembly,5,,,,,,Q327591,
9cc5525e-2ac9-452d-b944-61cbdf33b4cb,Fəzail Feyruz oğlu İbrahimli,Fəzail Feyruz oğlu İbrahimli,,,,Vətəndaş Həmrəyliyi Partiyası,Vətəndaş Həmrəyliyi Partiyası,69,Cəlilabad-Masallı-Biləsuvar seçim dairəsi,National Assembly,5,,,,,,,
b81dba55-40ad-45d2-bcb4-996d97b639d9,Fəzail Rəhim oğlu Ağamalı,Fəzail Rəhim oğlu Ağamalı,,,,Ana Vətən Partiyası,Ana Vətən Partiyası,60,Salyan-Neftçala seçim dairəsi,National Assembly,5,,,,,,,
10b0a430-0fda-4996-a1cb-8e45a212b6f7,Gövhər Baxşəli qızı Baxşəliyeva,Gövhər Baxşəli qızı Baxşəliyeva,,,,Independent,IND,93,Bərdə şəhər seçim dairəsi,National Assembly,5,,,,,,Q327591,
93574cf5-8d5b-43c7-8c94-48c2c4c334f2,Hacı Hacıbaba oğlu Salayev,Hacı Hacıbaba oğlu Salayev,,,,Independent,IND,44,Sumqayıt-Abşeron seçim dairəsi,National Assembly,5,,,,,,Q327591,
a2e3fe26-0e8f-4ebd-9bbd-0977ad48feab,Hadı Musa oğlu Rəcəbli,Hadı Musa oğlu Rəcəbli,,,,Yeni Azərbaycan Partiyası,Yeni Azərbaycan Partiyası,74,Lənkəran qəsəbə seçim dairəsi,National Assembly,5,,,,,,,
7007f549-0728-457a-95b0-d968c092e10b,Hikmət Baba oğlu Məmmədov,Hikmət Baba oğlu Məmmədov,,,,Yeni Azərbaycan Partiyası,Yeni Azərbaycan Partiyası,19,Nərimanov I seçim dairəsi,National Assembly,5,,,,,,,
29aa91da-6227-456d-b479-ff3528d394b8,Hüseynbala Fazil oğlu Mirələmov,Hüseynbala Fazil oğlu Mirələmov,,,,Yeni Azərbaycan Partiyası,Yeni Azərbaycan Partiyası,33,Xətai I seçim dairəsi,National Assembly,5,,,,,,,
019ca6de-98cb-4ea0-a08e-9e4409281d26,Jalə Fazil qızı Əliyeva,Jalə Fazil qızı Əliyeva,,,,Independent,IND,92,Zərdab-Ucar seçim dairəsi,National Assembly,5,,,,,,Q327591,
3a47f1fe-14d2-4691-9267-b6b954c22b7f,Kamaləddin Nəsrəddin oğlu Qafarov,Kamaləddin Nəsrəddin oğlu Qafarov,,,,Yeni Azərbaycan Partiyası,Yeni Azərbaycan Partiyası,9,Binəqədi II seçim dairəsi,National Assembly,5,,,,,,,
0a6520a9-2dd1-4b51-9caa-1d53ca298619,Kamilə Əli Ağa qızı Əliyeva,Kamilə Əli Ağa qızı Əliyeva,,,,Yeni Azərbaycan Partiyası,Yeni Azərbaycan Partiyası,111,Zaqatala-Balakən seçim dairəsi,National Assembly,5,,,,,,,
9d32295f-f1b2-4653-adeb-fd348a3cc8ef,Kamran Fərhad oğlu Bayramov,Kamran Fərhad oğlu Bayramov,,,,Yeni Azərbaycan Partiyası,Yeni Azərbaycan Partiyası,100,Şəmkir-Daşkəsən seçim dairəsi,National Assembly,5,,,,,,,
c792c670-083d-41c1-93e8-9f0354e2a977,Kamran Telman oğlu Nəbizadə,Kamran Telman oğlu Nəbizadə,,,,Independent,IND,107,Qazax seçim dairəsi,National Assembly,5,,,,,,Q327591,
be472d6b-90d1-459a-bebe-7f57dffaccc2,Madər Ələsgər oğlu Musayev,Madər Ələsgər oğlu Musayev,,,,Independent,IND,10,Binəqədi III seçim dairəsi,National Assembly,5,,,,,,Q327591,
1c73340a-110c-4e89-ac84-20b8fd55e956,Mahir Məhəmmədəli oğlu Aslanov,Mahir Məhəmmədəli oğlu Aslanov,,,,Independent,IND,96,Goranboy-Naftalan seçim dairəsi,National Assembly,5,,,,,,Q327591,
5f31711d-a1bf-49b0-b0f3-7f8597e8f64d,Mahir Tapdıq oğlu Abbaszadə,Mahir Tapdıq oğlu Abbaszadə,,,,Yeni Azərbaycan Partiyası,Yeni Azərbaycan Partiyası,121,Laçın seçim dairəsi,National Assembly,5,,,,,,,
84eebf98-8834-42b0-ae3c-ff441fe399a9,Malik Əvəz oğlu Həsənov,Malik Əvəz oğlu Həsənov,,,,Yeni Azərbaycan Partiyası,Yeni Azərbaycan Partiyası,67,Cəlilabad şəhər seçim dairəsi,National Assembly,5,,,,,,,
f00db38e-0cb1-4be9-8c0b-f5fa2a67f2f9,Mehriban Arif qızı Əliyeva,Mehriban Arif qızı Əliyeva,,,,Yeni Azərbaycan Partiyası,Yeni Azərbaycan Partiyası,14,Xəzər II seçim dairəsi,National Assembly,5,,,,,,,
5ff3734d-9ce8-467f-9158-083e19e0aa69,Mirkazım Mirməhəmməd oğlu Kazımov,Mirkazım Mirməhəmməd oğlu Kazımov,,,,Yeni Azərbaycan Partiyası,Yeni Azərbaycan Partiyası,68,Cəlilabad qəsəbə seçim dairəsi,National Assembly,5,,,,,,,
75a5ee13-804f-45c5-8cee-1579d685d6c6,Mirzəcan Mirzəmməd oğlu Xəlilov,Mirzəcan Mirzəmməd oğlu Xəlilov,,,,Yeni Azərbaycan Partiyası,Yeni Azərbaycan Partiyası,41,Sumqayıt I seçim dairəsi,National Assembly,5,,,,,,,
c39ce48d-b3aa-4cc7-8857-666c0054724a,Mixail Yuri oğlu Zabelin,Mixail Yuri oğlu Zabelin,,,,Yeni Azərbaycan Partiyası,Yeni Azərbaycan Partiyası,12,Qaradağ-Binəqədi-Yasamal seçim dairəsi,National Assembly,5,,,,,,,
02569327-ed44-4016-83a8-fe9c457e7284,Musa Cəfər oğlu Qasımlı,Musa Cəfər oğlu Qasımlı,,,,Independent,IND,72,Yardımlı-Masallı seçim dairəsi,National Assembly,5,,,,,,Q327591,
53a2e540-ec56-4a54-aede-4c12d6df1e67,Musa İsa oğlu Quliyev (Urud),Musa İsa oğlu Quliyev (Urud),,,,Yeni Azərbaycan Partiyası,Yeni Azərbaycan Partiyası,40,Kəpəz II seçim dairəsi (Gəncə şəhəri),National Assembly,5,,,,,,,
ffee0086-26cb-4832-a305-13ac6384f259,Muxtar Bahadur oğlu Babayev,Muxtar Bahadur oğlu Babayev,,,,Yeni Azərbaycan Partiyası,Yeni Azərbaycan Partiyası,43,Sumqayıt III seçim dairəsi,National Assembly,5,,,,,,,
881d3609-6775-4150-8182-5b380cc06b17,Müslüm Mürsəl oğlu Məmmədov,Müslüm Mürsəl oğlu Məmmədov,,,,Independent,IND,57,Kürdəmir seçim dairəsi,National Assembly,5,,,,,,Q327591,
f9167d32-47ef-4bab-b4df-a37705ab442f,Məlahət İbrahim qızı Həsənova,Məlahət İbrahim qızı Həsənova,,,,Yeni Azərbaycan Partiyası,Yeni Azərbaycan Partiyası,21,Nəsimi I seçim dairəsi,National Assembly,5,,,,,,,
e81877e7-3614-4fb6-9966-124ad772e5cb,Naqif Ələşrəf oğlu Həmzəyev,Naqif Ələşrəf oğlu Həmzəyev,,,,Yeni Azərbaycan Partiyası,Yeni Azərbaycan Partiyası,38,Nizami II seçim dairəsi (Gəncə şəhəri),National Assembly,5,,,,,,,
73619d36-d64d-49ed-817a-dc478326f221,Nizami Qulu oğlu Cəfərov,Nizami Qulu oğlu Cəfərov,,,,Yeni Azərbaycan Partiyası,Yeni Azərbaycan Partiyası,108,Ağstafa seçim dairəsi,National Assembly,5,,,,,,,
00c0aa57-174d-40cb-87c1-ffa27965b0e4,Novruzəli Davud oğlu Aslanov,Novruzəli Davud oğlu Aslanov,,,,Independent,IND,86,İsmayıllı seçim dairəsi,National Assembly,5,,,,,,Q327591,
722f5f1e-542e-48f2-b741-b94b7a9bc8ce,Nəriman Əlibala oğlu Əliyev,Nəriman Əlibala oğlu Əliyev,,,,Yeni Azərbaycan Partiyası,Yeni Azərbaycan Partiyası,70,Masallı şəhər seçim dairəsi,National Assembly,5,,,,,,,
cec319ea-48f9-4c3f-bd0e-606c5d2426f1,Nəsib Məhəmməd oğlu Məhəməliyev,Nəsib Məhəmməd oğlu Məhəməliyev,,,,Yeni Azərbaycan Partiyası,Yeni Azərbaycan Partiyası,109,Balakən seçim dairəsi,National Assembly,5,,,,,,,
0511d8be-b450-4838-9fa0-d51c7c8f8270,Oqtay Sabir oğlu Əsədov,Oqtay Sabir oğlu Əsədov,,,,Yeni Azərbaycan Partiyası,Yeni Azərbaycan Partiyası,45,Abşeron seçim dairəsi,National Assembly,5,,,,,,,
25cad8b0-dcb5-4eba-8181-187a4c25e87b,Pərvin Orxan qızı Kərimzadə,Pərvin Orxan qızı Kərimzadə,,,,Yeni Azərbaycan Partiyası,Yeni Azərbaycan Partiyası,37,Nizami I seçim dairəsi (Gəncə şəhəri),National Assembly,5,,,,,,,
b63dafe0-1f0e-4fe5-9fd1-66e2d91c6c9b,Qüdrət Müzəffər oğlu Həsənquliyev,Qüdrət Müzəffər oğlu Həsənquliyev,,,,Bütöv Azərbaycan Xalq Cəbhəsi Partiyası,Bütöv Azərbaycan Xalq Cəbhəsi Partiyası,7,Ordubad-Culfa seçim dairəsi,National Assembly,5,,,,,,,
3945426a-5913-4dba-8e1d-56264e8b7414,Qənirə Ələsgər qızı Paşayeva,Qənirə Ələsgər qızı Paşayeva,,,,Independent,IND,105,Tovuz seçim dairəsi,National Assembly,5,,,,,,Q327591,
70052446-8b58-4050-88ed-25ffc78c3290,Rafael Baba oğlu Hüseynov,Rafael Baba oğlu Hüseynov,,,,Independent,IND,58,Hacıqabul-Kürdəmir seçim dairəsi,National Assembly,5,,,,,,Q327591,
cddb96fc-3f74-4ad6-b56f-1ac88498bb62,Rafael Kamil oğlu Cəbrayılov,Rafael Kamil oğlu Cəbrayılov,,,,Independent,IND,46,Şirvan seçim dairəsi,National Assembly,5,,,,,,Q327591,
f8d18713-02f3-4ae9-a712-73d108789e22,Rafiq Musa oğlu Məmmədhəsənov,Rafiq Musa oğlu Məmmədhəsənov,,,,Yeni Azərbaycan Partiyası,Yeni Azərbaycan Partiyası,104,Gədəbəy-Tovuz seçim dairəsi,National Assembly,5,,,,,,,
3024e3b7-3cf8-4684-854a-eceb8bd58cad,Rasim Nəsrəddin oğlu Musabəyov,Rasim Nəsrəddin oğlu Musabəyov,,,,Independent,IND,18,Nərimanov-Nizami seçim dairəsi,National Assembly,5,,,,,,Q327591,
fc1ad88a-3b91-4919-9433-34655ecb31e7,Rauf Asif oğlu Əliyev,Rauf Asif oğlu Əliyev,,,,Yeni Azərbaycan Partiyası,Yeni Azərbaycan Partiyası,13,Xəzər I seçim dairəsi,National Assembly,5,,,,,,,
45d0583e-1490-44db-9f70-bac8698ec161,Rövnəq İbrahim oğlu Abdullayev,Rövnəq İbrahim oğlu Abdullayev,,,,Yeni Azərbaycan Partiyası,Yeni Azərbaycan Partiyası,24,Nizami I seçim dairəsi,National Assembly,5,,,,,,,
f6e1aa1c-3f85-43f8-b9b1-aa31e45f2ba4,Rövşən Şükür oğlu Rzayev,Rövşən Şükür oğlu Rzayev,,,,Independent,IND,101,Göygöl-Daşkəsən seçim dairəsi,National Assembly,5,,,,,,Q327591,
2f46c83b-7e54-44d5-b0d3-82ac900a528d,Rüfət Atakişi oğlu Quliyev,Rüfət Atakişi oğlu Quliyev,,,,Independent,IND,73,Lənkəran şəhər seçim dairəsi,National Assembly,5,,,,,,Q327591,
7e61229a-7507-4231-866c-85a0ad218d83,Rüstəm Gülabba oğlu Xəlilov,Rüstəm Gülabba oğlu Xəlilov,,,,Yeni Azərbaycan Partiyası,Yeni Azərbaycan Partiyası,64,Sabirabad II seçim dairəsi,National Assembly,5,,,,,,,
545dbc5a-3f06-402f-9457-2326e71bfa5c,Rəşad Məmmədqulu oğlu Mahmudov,Rəşad Məmmədqulu oğlu Mahmudov,,,,Yeni Azərbaycan Partiyası,Yeni Azərbaycan Partiyası,77,Astara seçim dairəsi,National Assembly,5,,,,,,,
1f87e4e6-8403-4f0d-acb5-2b72af6fa043,Sabir Kamal oğlu Hacıyev,Sabir Kamal oğlu Hacıyev,,,,Vətəndaş Birliyi Partiyası,Vətəndaş Birliyi Partiyası,88,Göyçay seçim dairəsi,National Assembly,5,,,,,,,
a9c65759-245d-4785-93c1-bb8926166d51,Sahib Eyvaz oğlu Alıyev,Sahib Eyvaz oğlu Alıyev,,,,Independent,IND,95,Tərtər seçim dairəsi,National Assembly,5,,,,,,Q327591,
894ec39b-2127-492a-ab33-76137b2607f6,Sahibə Əli qızı Qafarova,Sahibə Əli qızı Qafarova,,,,Yeni Azərbaycan Partiyası,Yeni Azərbaycan Partiyası,98,Şəmkir şəhər seçim dairəsi,National Assembly,5,,,,,,,
bb74aa5f-e5f8-40f5-93af-cbf4ad982b21,Sevinc Həbib qızı Fətəliyeva,Sevinc Həbib qızı Fətəliyeva,,,,Yeni Azərbaycan Partiyası,Yeni Azərbaycan Partiyası,30,Suraxanı I seçim dairəsi,National Assembly,5,,,,,,,
1fd6c58f-9414-44e8-9430-6eeee80354e9,Sevinc Əmirəhməd qızı Hüseynova,Sevinc Əmirəhməd qızı Hüseynova,,,,Yeni Azərbaycan Partiyası,Yeni Azərbaycan Partiyası,103,Gədəbəy seçim dairəsi,National Assembly,5,,,,,,,
57554c01-2db1-4516-8652-e5a8083f7ba9,Siyavuş Dünyamalı oğlu Novruzov,Siyavuş Dünyamalı oğlu Novruzov,,,,Yeni Azərbaycan Partiyası,Yeni Azərbaycan Partiyası,5,Şahbuz-Babək seçim dairəsi,National Assembly,5,,,,,,,
5eadba8c-45ec-46ac-9917-1f407179dac9,Sona Sakit qızı Əliyeva,Sona Sakit qızı Əliyeva,,,,Yeni Azərbaycan Partiyası,Yeni Azərbaycan Partiyası,99,Şəmkir qəsəbə seçim dairəsi,National Assembly,5,,,,,,,
6f1787a8-0324-45ce-b3c8-79b414499e69,Sədaqət Süleyman qızı Vəliyeva,Sədaqət Süleyman qızı Vəliyeva,,,,Yeni Azərbaycan Partiyası,Yeni Azərbaycan Partiyası,25,Nizami II seçim dairəsi,National Assembly,5,,,,,,,
c4cf5277-6653-416d-9d68-4a542f8ad63b,Səməd İsmayıl oğlu Seyidov,Səməd İsmayıl oğlu Seyidov,,,,Yeni Azərbaycan Partiyası,Yeni Azərbaycan Partiyası,36,Xətai IV seçim dairəsi,National Assembly,5,,,,,,,
930e7fce-f3c4-44d4-bd28-5317dac018b8,Səttar Suliddin oğlu Mehbalıyev,Səttar Suliddin oğlu Mehbalıyev,,,,Independent,IND,3,Babək-Kəngərli-Naxçıvan seçim dairəsi,National Assembly,5,,,,,,Q327591,
d4ae0ccf-c929-498a-a91c-c4b706b3106b,Tahir Famil oğlu oğlu Mirkişili,Tahir Famil oğlu oğlu Mirkişili,,,,Yeni Azərbaycan Partiyası,Yeni Azərbaycan Partiyası,42,Sumqayıt II seçim dairəsi,National Assembly,5,,,,,,,
14b43d1f-63ab-4222-bd1f-e2f9361fabc0,Tahir Musa oğlu Rzayev,Tahir Musa oğlu Rzayev,,,,Yeni Azərbaycan Partiyası,Yeni Azərbaycan Partiyası,82,Ağcabədi seçim dairəsi,National Assembly,5,,,,,,,
1fcf917f-0e19-4694-90bd-d577edc0c632,Tahir Süleyman oğlu Süleymanov,Tahir Süleyman oğlu Süleymanov,,,,Yeni Azərbaycan Partiyası,Yeni Azərbaycan Partiyası,54,Şabran-Siyəzən seçim dairəsi,National Assembly,5,,,,,,,
56a17e24-f6ec-45cd-8bad-482800c7fbf4,Tahir Zayıdağa oğlu Kərimli,Tahir Zayıdağa oğlu Kərimli,,,,Vəhdət Partiyası,Vəhdət Partiyası,87,Ağsu-İsmayıllı seçim dairəsi,National Assembly,5,,,,,,,
9aa4b0ea-f6df-444b-bde6-6b105f159ba8,Vahid Qazməmməd oğlu Əhmədov,Vahid Qazməmməd oğlu Əhmədov,,,,Independent,IND,52,Quba seçim dairəsi,National Assembly,5,,,,,,Q327591,
5640ef26-6434-456b-aa06-fa2aafda0fef,Valeh Feyruz oğlu Ələsgərov,Valeh Feyruz oğlu Ələsgərov,,,,Independent,IND,102,Samux-Şəmkir seçim dairəsi,National Assembly,5,,,,,,Q327591,
60cbd6a5-0d75-47dd-b1c6-68c488eec0cd,Vasif Yusif oğlu Talıbov,Vasif Yusif oğlu Talıbov,,,,Yeni Azərbaycan Partiyası,Yeni Azərbaycan Partiyası,1,Şərur-Sədərək seçim dairəsi,National Assembly,5,,,,,,,
8b1e62f7-f8fd-4ad8-87a3-8651cc408331,Vüsal Əfqan oğlu Hüseynov,Vüsal Əfqan oğlu Hüseynov,,,,Yeni Azərbaycan Partiyası,Yeni Azərbaycan Partiyası,91,Ucar seçim dairəsi,National Assembly,5,,,,,,,
b06816a7-af13-48c9-907b-340b5e53be5b,Xanhüseyn Hüseynağa oğlu Kazımlı,Xanhüseyn Hüseynağa oğlu Kazımlı,,,,Azərbaycan Sosial Rifah Partiyası,Azərbaycan Sosial Rifah Partiyası,66,Biləsuvar seçim dairəsi,National Assembly,5,,,,,,,
74aae6fe-51e8-4c71-8cf2-a80dbb48288c,Xanlar Nuru oğlu Fətiyev,Xanlar Nuru oğlu Fətiyev,,,,Yeni Azərbaycan Partiyası,Yeni Azərbaycan Partiyası,39,Kəpəz I seçim dairəsi (Gəncə şəhəri),National Assembly,5,,,,,,,
c2fe884e-b9f1-45a0-b1c0-af578fd00bb3,Yaqub Mikayıl oğlu Mahmudov,Yaqub Mikayıl oğlu Mahmudov,,,,Yeni Azərbaycan Partiyası,Yeni Azərbaycan Partiyası,113,Şəki şəhər seçim dairəsi,National Assembly,5,,,,,,,
10827fc4-5ab3-4283-a16e-65ea0d176c96,Yevda Sasun oğlu Abramov,Yevda Sasun oğlu Abramov,,,,Yeni Azərbaycan Partiyası,Yeni Azərbaycan Partiyası,53,Quba-Qusar seçim dairəsi,National Assembly,5,,,,,,,
7428cf77-5875-4d1b-8c33-5d42c723af6d,Zahid Məhərrəm oğlu Oruc,Zahid Məhərrəm oğlu Oruc,,,,Independent,IND,94,Bərdə qəsəbə seçim dairəsi,National Assembly,5,,,,,,Q327591,
37a2891d-a9df-4e64-9fec-85be7e7e1be8,Zeynəb Yəhya qızı Xanlarova,Zeynəb Yəhya qızı Xanlarova,,,,Independent,IND,50,Qobustan-Xızı-Sumqayıt seçim dairəsi,National Assembly,5,,,,,,Q327591,
3ab17f15-4aaa-4366-816d-38f5c5b490c4,Ziyad Əliabbas oğlu Səmədzadə,Ziyad Əliabbas oğlu Səmədzadə,,,,Independent,IND,23,Nəsimi-Səbail seçim dairəsi,National Assembly,5,,,,,,Q327591,
fb8c2b9d-9cab-42bd-ad7b-e9d5dfcdf351,Ziyafət Abbas oğlu Əsgərov,Ziyafət Abbas oğlu Əsgərov,,,,Yeni Azərbaycan Partiyası,Yeni Azərbaycan Partiyası,76,Lənkəran-Astara seçim dairəsi,National Assembly,5,,,,,,,
1a1c5536-eee1-475c-976b-b4a29649f32d,Çingiz Aşralı oğlu Qənizadə,Çingiz Aşralı oğlu Qənizadə,,,,Independent,IND,80,İmişli-Beyləqan seçim dairəsi,National Assembly,5,,,,,,Q327591,
0f8e08d1-6763-42de-a53c-20b214e6ce31,Ülvi Zahid oğlu Quliyev,Ülvi Zahid oğlu Quliyev,,,,Independent,IND,15,Yasamal I seçim dairəsi,National Assembly,5,,,,,,Q327591,
3cc59685-0d39-4b84-8a17-09e999bb3dc1,Ülviyyə Cavanşir qızı Ağayeva,Ülviyyə Cavanşir qızı Ağayeva,,,,Independent,IND,106,Tovuz-Qazax-Ağstafa seçim dairəsi,National Assembly,5,,,,,,Q327591,
b3951aed-5c59-4f76-bdfe-6a22f8be56c3,Ülviyyə Tapdıq qızı Həmzəyeva,Ülviyyə Tapdıq qızı Həmzəyeva,,,,Yeni Azərbaycan Partiyası,Yeni Azərbaycan Partiyası,6,Culfa-Babək seçim dairəsi,National Assembly,5,,,,,,,
5fb127ef-47ca-459d-9d2b-0e0de2fcf3d1,İlham Kazım oğlu Məmmədov,İlham Kazım oğlu Məmmədov,,,,Yeni Azərbaycan Partiyası,Yeni Azərbaycan Partiyası,48,Yevlax seçim dairəsi,National Assembly,5,,,,,,,
98917b97-d15e-4686-9611-cac28411b585,İlham Əlisəftər oğlu Əliyev,İlham Əlisəftər oğlu Əliyev,,,,Yeni Azərbaycan Partiyası,Yeni Azərbaycan Partiyası,56,Xaçmaz qəsəbə seçim dairəsi,National Assembly,5,,,,,,,
b2e75f8e-ca60-47a3-a5e0-f3c70bd260e8,İmamverdi İbiş oğlu İsmayılov,İmamverdi İbiş oğlu İsmayılov,,,,Yeni Azərbaycan Partiyası,Yeni Azərbaycan Partiyası,125,Zəngilan-Qubadlı seçim dairəsi,National Assembly,5,,,,,,,
860c077f-d050-44f2-8bf2-94f185a5b1d9,İqbal Nəriman oğlu Məmmədov,İqbal Nəriman oğlu Məmmədov,,,,Yeni Azərbaycan Partiyası,Yeni Azərbaycan Partiyası,78,Lerik seçim dairəsi,National Assembly,5,,,,,,,
d2b71e68-8bed-4a95-a316-12417cf038a1,İsa Əkbər oğlu Həbibbəyli,İsa Əkbər oğlu Həbibbəyli,,,,Yeni Azərbaycan Partiyası,Yeni Azərbaycan Partiyası,2,Şərur seçim dairəsi,National Assembly,5,,,,,,,
1f7e4419-f8db-4c56-b100-9ce5c72694da,Şahin Əmir oğlu İsmayılov,Şahin Əmir oğlu İsmayılov,,,,Yeni Azərbaycan Partiyası,Yeni Azərbaycan Partiyası,81,Beyləqan seçim dairəsi,National Assembly,5,,,,,,,
9563ed46-972e-4b3e-aed5-55182d22d9cf,Şəmsəddin Hümmət oğlu Hacıyev,Şəmsəddin Hümmət oğlu Hacıyev,,,,Yeni Azərbaycan Partiyası,Yeni Azərbaycan Partiyası,29,Səbail seçim dairəsi,National Assembly,5,,,,,,,
52c7654e-657c-471c-987f-c7e9207f983e,Əflatun Əhməd oğlu Amaşov,Əflatun Əhməd oğlu Amaşov,,,,Independent,IND,62,Saatlı seçim dairəsi,National Assembly,5,,,,,,Q327591,
4ea8fe2b-c6c6-4357-8690-69cd6c88bb18,Əhliman Tapdıq oğlu Əmiraslanov,Əhliman Tapdıq oğlu Əmiraslanov,,,,Yeni Azərbaycan Partiyası,Yeni Azərbaycan Partiyası,65,Saatlı-Sabirabad-Kürdəmir seçim dairəsi,National Assembly,5,,,,,,,
78ffad92-7998-44ed-b82f-ec2cfe82507d,Əli Məhəmməd oğlu Hüseynli,Əli Məhəmməd oğlu Hüseynli,,,,Yeni Azərbaycan Partiyası,Yeni Azərbaycan Partiyası,49,Yevlax-Mingəçevir seçim dairəsi,National Assembly,5,,,,,,,
