id,name,sort_name,email,twitter,facebook,group,group_id,area_id,area,chamber,term,start_date,end_date,image,gender,wikidata,wikidata_group,wikidata_area
6a9f34b3-64d4-48fd-9840-aac7054c5c86,Adil Abış oğlu Əliyev,Adil Abış oğlu Əliyev,,,,Independent,83b82faf-9a1d-4bf8-bd05-5c7f10e6f679,20,Nərimanov II seçim dairəsi,National Assembly,4,,,,,,Q2415493,
3b990d4a-b418-4c7f-a4b7-fd431378857e,Aqil Məhəmməd oğlu Abbas,Aqil Məhəmməd oğlu Abbas,,,,Independent,83b82faf-9a1d-4bf8-bd05-5c7f10e6f679,83,Ağcabədi-Füzuli seçim dairəsi,National Assembly,4,,,,,,Q2415493,
08688c06-6d59-4790-8290-467569f871f4,Aqiyə Həbib qızı Naxçıvanlı,Aqiyə Həbib qızı Naxçıvanlı,,,,Yeni Azərbaycan Partiyası,Yeni Azərbaycan Partiyası,117,Oğuz-Qəbələ seçim dairəsi,National Assembly,4,,,,,,,
21ba7c36-b907-49ac-a60b-1ec31478285d,Arif Qafar oğlu Rəhimzadə,Arif Qafar oğlu Rəhimzadə,,,,Yeni Azərbaycan Partiyası,Yeni Azərbaycan Partiyası,61,Neftçala seçim dairəsi,National Assembly,4,,,,,,,
6a493830-d6ac-4a50-89de-70e935bee6b8,Asim Nazim oğlu Mollazadə,Asim Nazim oğlu Mollazadə,,,,Azərbaycan Demokratik İslahatlar Partiyası,Azərbaycan Demokratik İslahatlar Partiyası,22,Nəsimi II seçim dairəsi,National Assembly,4,,,,,,,
d2b5d95f-104b-498b-b3be-411f6d9a71d4,Aslan Məmmədhüseyn oğlu Cəfərov,Aslan Məmmədhüseyn oğlu Cəfərov,,,,Yeni Azərbaycan Partiyası,Yeni Azərbaycan Partiyası,77,Astara seçim dairəsi,National Assembly,4,,,,,,,
d671cfcd-6545-45cd-bc0e-5bab4b17804f,Astan Nuşrəvan oğlu Şahverdiyev,Astan Nuşrəvan oğlu Şahverdiyev,,,,Yeni Azərbaycan Partiyası,Yeni Azərbaycan Partiyası,120,Cəbrayıl-Qubadlı seçim dairəsi,National Assembly,4,,,,,,,
bc9b59c3-1d7b-436f-8fea-6febad6c4bfc,Aydın Böyükkişi oğlu Mirzəzadə,Aydın Böyükkişi oğlu Mirzəzadə,,,,Yeni Azərbaycan Partiyası,Yeni Azərbaycan Partiyası,47,Mingəçevir seçim dairəsi,National Assembly,4,,,,,,,
f22af873-79ed-4b25-b17f-615767db39a4,Azər Camal oğlu Badamov,Azər Camal oğlu Badamov,,,,Yeni Azərbaycan Partiyası,Yeni Azərbaycan Partiyası,51,Qusar seçim dairəsi,National Assembly,4,,,,,,,
cde68182-31e3-4e68-b5bb-4432af098850,Azər Şəmşid oğlu Kərimli,Azər Şəmşid oğlu Kərimli,,,,Independent,83b82faf-9a1d-4bf8-bd05-5c7f10e6f679,112,Qax seçim dairəsi,National Assembly,4,,,,,,Q2415493,
03a6d16f-10ab-4bf8-9f14-c783d93c8384,Ağacan Qulam oğlu Abıyev,Ağacan Qulam oğlu Abıyev,,,,Yeni Azərbaycan Partiyası,Yeni Azərbaycan Partiyası,32,Suraxanı III seçim dairəsi,National Assembly,4,,,,,,,
bd3cce0b-fd16-4a96-b329-e3da512556c3,Bahar Əvəz qızı Muradov,Bahar Əvəz qızı Muradov,,,,Yeni Azərbaycan Partiyası,Yeni Azərbaycan Partiyası,84,Füzuli seçim dairəsi,National Assembly,4,,,,,,,
8a87cb19-2c6e-4ae4-b096-e5abc59d22d1,Bəxtiyar Həmzə oğlu Əliyev,Bəxtiyar Həmzə oğlu Əliyev,,,,Independent,83b82faf-9a1d-4bf8-bd05-5c7f10e6f679,118,Ağdam şəhər seçim dairəsi,National Assembly,4,,,,,,Q2415493,
b036a28e-8e8c-4cf0-a183-41bc701b6d04,Bəxtiyar Yusif oğlu Sadıqov,Bəxtiyar Yusif oğlu Sadıqov,,,,Yeni Azərbaycan Partiyası,Yeni Azərbaycan Partiyası,119,Ağdam qəsəbə seçim dairəsi,National Assembly,4,,,,,,,
a45361f2-2253-4d5e-b4f9-ed9da8390889,Cavanşir Hümmət oğlu Paşazadə,Cavanşir Hümmət oğlu Paşazadə,,,,Yeni Azərbaycan Partiyası,Yeni Azərbaycan Partiyası,75,Lənkəran-Masallı seçim dairəsi,National Assembly,4,,,,,,,
c59e634e-8562-475c-a69c-319d358df845,Cavanşir Əyyub oğlu Feyziyev,Cavanşir Əyyub oğlu Feyziyev,,,,Independent,83b82faf-9a1d-4bf8-bd05-5c7f10e6f679,115,Şəki qəsəbə II seçim dairəsi,National Assembly,4,,,,,,Q2415493,
7b0d3e35-08f5-4ff6-8d78-a56de8b79032,Cavid Qənbər oğlu Qurbanov,Cavid Qənbər oğlu Qurbanov,,,,Yeni Azərbaycan Partiyası,Yeni Azərbaycan Partiyası,123,Kəlbəcər seçim dairəsi,National Assembly,4,,,,,,,
27c13ad7-0e85-40e7-9d37-3d76f0583f3b,Ceyhun Yunis oğlu Osmanlı,Ceyhun Yunis oğlu Osmanlı,,,,Independent,83b82faf-9a1d-4bf8-bd05-5c7f10e6f679,63,Sabirabad I seçim dairəsi,National Assembly,4,,,,,,Q2415493,
0776bcc7-2829-40ba-8770-66e4619bf574,Cəlal Əlirza oğlu Əliyev,Cəlal Əlirza oğlu Əliyev,,,,Yeni Azərbaycan Partiyası,Yeni Azərbaycan Partiyası,62,Saatlı seçim dairəsi,National Assembly,4,,,,,,,
b4809156-705b-4194-b1ab-24675596f1c7,Eldar Allahyar oğlu Quliyev,Eldar Allahyar oğlu Quliyev,,,,Independent,83b82faf-9a1d-4bf8-bd05-5c7f10e6f679,28,Sabunçu III seçim dairəsi,National Assembly,4,,,,,,Q2415493,
e1ceb740-5d51-47ba-98bd-49aa209b4395,Eldar Rza oğlu İbrahimov,Eldar Rza oğlu İbrahimov,,,,Yeni Azərbaycan Partiyası,Yeni Azərbaycan Partiyası,4,Naxçıvan şəhər seçim dairəsi,National Assembly,4,,,,,,,
83c7dd98-be57-4913-973b-9e4dacb10802,Elman Camal oğlu Məmmədov,Elman Camal oğlu Məmmədov,,,,Yeni Azərbaycan Partiyası,Yeni Azərbaycan Partiyası,124,Şuşa-Ağdam-Xocalı-Xocavənd seçim dairəsi,National Assembly,4,,,,,,,
e3b548a8-1d56-4a47-9e4e-b7836d945d2b,Elmira Hüseyn qızı Axundova,Elmira Hüseyn qızı Axundova,,,,Independent,83b82faf-9a1d-4bf8-bd05-5c7f10e6f679,71,Masallı qəsəbə seçim dairəsi,National Assembly,4,,,,,,Q2415493,
b6884cc4-e1fb-43bf-97f8-da558b00d219,Elxan Sirac oğlu Süleymanov,Elxan Sirac oğlu Süleymanov,,,,Independent,83b82faf-9a1d-4bf8-bd05-5c7f10e6f679,85,Şamaxı seçim dairəsi,National Assembly,4,,,,,,Q2415493,
89811bb7-9500-4d12-8392-77675f774af8,Fazil Qəzənfər oğlu Mustafa,Fazil Qəzənfər oğlu Mustafa,,,,Böyük Quruluş Partiyası,Böyük Quruluş Partiyası,26,Sabunçu I seçim dairəsi,National Assembly,4,,,,,,,
2c9d951d-174e-430b-be15-4fc1b24b3d4e,Flora Qasım qızı Qasımova,Flora Qasım qızı Qasımova,,,,Independent,83b82faf-9a1d-4bf8-bd05-5c7f10e6f679,122,Xankəndi seçim dairəsi,National Assembly,4,,,,,,Q2415493,
cb97ffc0-6df4-43ab-af0c-cfc5a2be4192,Fərəc İbrahim oğlu Quliyev,Fərəc İbrahim oğlu Quliyev,,,,Milli Dirçəliş Hərəkatı Partiyası,Milli Dirçəliş Hərəkatı Partiyası,31,Suraxanı II seçim dairəsi,National Assembly,4,,,,,,,
d5c32ea3-8fd2-46ed-a4a8-b277d2923cf3,Fəttah Səməd oğlu Heydərov,Fəttah Səməd oğlu Heydərov,,,,Independent,83b82faf-9a1d-4bf8-bd05-5c7f10e6f679,116,Qəbələ seçim dairəsi,National Assembly,4,,,,,,Q2415493,
f3d7dfc3-341d-436d-b329-de37f1558671,Fəzail Feyruz oğlu İbrahimli,Fəzail Feyruz oğlu İbrahimli,,,,Vətəndaş Həmrəyliyi Partiyası,Vətəndaş Həmrəyliyi Partiyası,69,Cəlilabad-Masallı-Biləsuvar seçim dairəsi,National Assembly,4,,,,,,,
86620595-e676-42a0-b206-acea3cabf1c0,Fəzail Rəhim oğlu Ağamalı,Fəzail Rəhim oğlu Ağamalı,,,,Independent,83b82faf-9a1d-4bf8-bd05-5c7f10e6f679,60,Salyan-Neftçala seçim dairəsi,National Assembly,4,,,,,,Q2415493,
11f25370-a83e-403f-ab4d-1bdb8190a010,Hacı Hacıbaba oğlu Salayev,Hacı Hacıbaba oğlu Salayev,,,,Independent,83b82faf-9a1d-4bf8-bd05-5c7f10e6f679,44,Sumqayıt-Abşeron seçim dairəsi,National Assembly,4,,,,,,Q2415493,
1d04cfba-e6bd-415d-bb95-7eb5ce72057f,Hadı Musa oğlu Rəcəbli,Hadı Musa oğlu Rəcəbli,,,,Yeni Azərbaycan Partiyası,Yeni Azərbaycan Partiyası,74,Lənkəran qəsəbə seçim dairəsi,National Assembly,4,,,,,,,
c72841a1-274c-4bbc-85df-24bbd5b16b94,Hikmət İsmayıl oğlu Atayev,Hikmət İsmayıl oğlu Atayev,,,,Yeni Azərbaycan Partiyası,Yeni Azərbaycan Partiyası,110,Zaqatala seçim dairəsi,National Assembly,4,,,,,,,
a1ef0fc6-38e8-45bc-8bf4-4caccffa96d8,Hüseynbala Fazil oğlu Mirələmov,Hüseynbala Fazil oğlu Mirələmov,,,,Yeni Azərbaycan Partiyası,Yeni Azərbaycan Partiyası,33,Xətai I seçim dairəsi,National Assembly,4,,,,,,,
324b46f4-7e03-411e-b172-68fdca2b0495,Jalə Fazil qızı Əliyeva,Jalə Fazil qızı Əliyeva,,,,Independent,83b82faf-9a1d-4bf8-bd05-5c7f10e6f679,92,Zərdab-Ucar seçim dairəsi,National Assembly,4,,,,,,Q2415493,
36c6419a-4ad2-49cc-9620-9072ab17df47,Kamilə Əli Ağa qızı Əliyeva,Kamilə Əli Ağa qızı Əliyeva,,,,Yeni Azərbaycan Partiyası,Yeni Azərbaycan Partiyası,111,Zaqatala-Balakən seçim dairəsi,National Assembly,4,,,,,,,
9011be3a-9314-4b96-b571-b0526a4ae796,Madər Ələsgər oğlu Musayev,Madər Ələsgər oğlu Musayev,,,,Independent,83b82faf-9a1d-4bf8-bd05-5c7f10e6f679,10,Binəqədi III seçim dairəsi,National Assembly,4,,,,,,Q2415493,
e7a3d300-dcbb-43d3-a666-4a7b8c72972b,Mahir Məhəmmədəli oğlu Aslanov,Mahir Məhəmmədəli oğlu Aslanov,,,,Independent,83b82faf-9a1d-4bf8-bd05-5c7f10e6f679,96,Goranboy-Naftalan seçim dairəsi,National Assembly,4,,,,,,Q2415493,
c94fa645-b6dd-4bdf-8656-463ed8c03f1d,Malik Əvəz oğlu Həsənov,Malik Əvəz oğlu Həsənov,,,,Yeni Azərbaycan Partiyası,Yeni Azərbaycan Partiyası,67,Cəlilabad şəhər seçim dairəsi,National Assembly,4,,,,,,,
1c1e064f-775f-4c4f-94cf-4110a6fc7f32,Mehriban Arif qızı Əliyeva,Mehriban Arif qızı Əliyeva,,,,Yeni Azərbaycan Partiyası,Yeni Azərbaycan Partiyası,14,Xəzər II seçim dairəsi,National Assembly,4,,,,,,,
6b9d179f-4624-4cc1-b19b-7f6f75e68913,Mirkazım Mirməhəmməd oğlu Kazımov,Mirkazım Mirməhəmməd oğlu Kazımov,,,,Yeni Azərbaycan Partiyası,Yeni Azərbaycan Partiyası,68,Cəlilabad qəsəbə seçim dairəsi,National Assembly,4,,,,,,,
74a36a17-b798-43f4-ae8e-2d609e0e15f5,Mixail Yuri oğlu Zabelin,Mixail Yuri oğlu Zabelin,,,,Yeni Azərbaycan Partiyası,Yeni Azərbaycan Partiyası,12,Qaradağ-Binəqədi-Yasamal seçim dairəsi,National Assembly,4,,,,,,,
58d88887-12eb-4e21-af47-1fb37f6bd264,Musa İsa oğlu Quliyev (Urud),Musa İsa oğlu Quliyev (Urud),,,,Yeni Azərbaycan Partiyası,Yeni Azərbaycan Partiyası,40,Kəpəz II seçim dairəsi (Gəncə şəhəri),National Assembly,4,,,,,,,
1320fb58-ac92-429f-b112-601b994a3d62,Muxtar Bahadur oğlu Babayev,Muxtar Bahadur oğlu Babayev,,,,Yeni Azərbaycan Partiyası,Yeni Azərbaycan Partiyası,43,Sumqayıt III seçim dairəsi,National Assembly,4,,,,,,,
75759451-e23c-496b-ab19-d4c35e79d9a1,Mübariz Qəhrəman oğlu Qurbanlı,Mübariz Qəhrəman oğlu Qurbanlı,,,,Independent,83b82faf-9a1d-4bf8-bd05-5c7f10e6f679,100,Şəmkir-Daşkəsən seçim dairəsi,National Assembly,4,,,,,,Q2415493,
96c61227-80f8-489f-b893-e34ec4d98f30,Nazim Fərəc oğlu Fərəcov,Nazim Fərəc oğlu Fərəcov,,,,Yeni Azərbaycan Partiyası,Yeni Azərbaycan Partiyası,121,Laçın seçim dairəsi,National Assembly,4,,,,,,,
c17bbb12-1493-4ac6-9aa2-76c81b9998bc,Nizami Qulu oğlu Cəfərov,Nizami Qulu oğlu Cəfərov,,,,Yeni Azərbaycan Partiyası,Yeni Azərbaycan Partiyası,108,Ağstafa seçim dairəsi,National Assembly,4,,,,,,,
cf34914f-311f-491f-99ca-57d9a25d77bd,Novruzəli Davud oğlu Aslanov,Novruzəli Davud oğlu Aslanov,,,,Independent,83b82faf-9a1d-4bf8-bd05-5c7f10e6f679,86,İsmayıllı seçim dairəsi,National Assembly,4,,,,,,Q2415493,
0df1157d-e1f9-4685-b698-fe9396913b98,Nəriman Əlibala oğlu Əliyev,Nəriman Əlibala oğlu Əliyev,,,,Yeni Azərbaycan Partiyası,Yeni Azərbaycan Partiyası,70,Masallı şəhər seçim dairəsi,National Assembly,4,,,,,,,
e138f52e-d555-4729-aae0-56ef35fcb837,Qüdrət Müzəffər oğlu Həsənquliyev,Qüdrət Müzəffər oğlu Həsənquliyev,,,,Bütöv Azərbaycan Xalq Cəbhəsi Partiyası,Bütöv Azərbaycan Xalq Cəbhəsi Partiyası,7,Ordubad-Culfa seçim dairəsi,National Assembly,4,,,,,,,
d3839345-ea91-4116-a5f5-a59fc1123303,Qənirə Ələsgər qızı Paşayeva,Qənirə Ələsgər qızı Paşayeva,,,,Independent,83b82faf-9a1d-4bf8-bd05-5c7f10e6f679,105,Tovuz seçim dairəsi,National Assembly,4,,,,,,Q2415493,
8a3d0ee5-e21d-4d89-a247-f48157455da3,Rafael Baba oğlu Hüseynov,Rafael Baba oğlu Hüseynov,,,,Independent,83b82faf-9a1d-4bf8-bd05-5c7f10e6f679,58,Hacıqabul-Kürdəmir seçim dairəsi,National Assembly,4,,,,,,Q2415493,
a358670a-c9f9-4f99-b8e7-07243788ee28,Rafiq Musa oğlu Məmmədhəsənov,Rafiq Musa oğlu Məmmədhəsənov,,,,Yeni Azərbaycan Partiyası,Yeni Azərbaycan Partiyası,104,Gədəbəy-Tovuz seçim dairəsi,National Assembly,4,,,,,,,
166fb331-af8a-43a1-baee-d220fdefab4d,Rasim Nəsrəddin oğlu Musabəyov,Rasim Nəsrəddin oğlu Musabəyov,,,,Independent,83b82faf-9a1d-4bf8-bd05-5c7f10e6f679,18,Nərimanov-Nizami seçim dairəsi,National Assembly,4,,,,,,Q2415493,
6245ccbc-edab-4251-aa33-e75a4dc06591,Rauf Asif oğlu Əliyev,Rauf Asif oğlu Əliyev,,,,Yeni Azərbaycan Partiyası,Yeni Azərbaycan Partiyası,13,Xəzər I seçim dairəsi,National Assembly,4,,,,,,,
d22bec55-c613-4057-a2c5-eba0e0ce9037,Rövnəq İbrahim oğlu Abdullayev,Rövnəq İbrahim oğlu Abdullayev,,,,Yeni Azərbaycan Partiyası,Yeni Azərbaycan Partiyası,24,Nizami I seçim dairəsi,National Assembly,4,,,,,,,
7a7b6096-8bca-444a-bfe2-66d3dd462633,Rövşən Şükür oğlu Rzayev,Rövşən Şükür oğlu Rzayev,,,,Independent,83b82faf-9a1d-4bf8-bd05-5c7f10e6f679,101,Göygöl-Daşkəsən seçim dairəsi,National Assembly,4,,,,,,Q2415493,
267ab0a4-2100-49a9-b29e-fa1820f515e4,Rüfət Atakişi oğlu Quliyev,Rüfət Atakişi oğlu Quliyev,,,,Independent,83b82faf-9a1d-4bf8-bd05-5c7f10e6f679,73,Lənkəran şəhər seçim dairəsi,National Assembly,4,,,,,,Q2415493,
68770e7b-3920-4118-b6ec-577eeb2daf28,Rüstəm Gülabba oğlu Xəlilov,Rüstəm Gülabba oğlu Xəlilov,,,,Yeni Azərbaycan Partiyası,Yeni Azərbaycan Partiyası,64,Sabirabad II seçim dairəsi,National Assembly,4,,,,,,,
9c3a46ee-575c-41c6-85f6-f49d9450302e,Rəbiyyət Nurullah qızı Aslanova,Rəbiyyət Nurullah qızı Aslanova,,,,Yeni Azərbaycan Partiyası,Yeni Azərbaycan Partiyası,109,Balakən seçim dairəsi,National Assembly,4,,,,,,,
c215b9fc-18e0-4ac5-9636-0628b07670ce,Sabir Kamal oğlu Hacıyev,Sabir Kamal oğlu Hacıyev,,,,Vətəndaş Birliyi Partiyası,Vətəndaş Birliyi Partiyası,88,Göyçay seçim dairəsi,National Assembly,4,,,,,,,
f5fb9b8c-ee30-497a-8c33-db36b88d3525,Sabir Xudu oğlu Rüstəmxanlı,Sabir Xudu oğlu Rüstəmxanlı,,,,Vətəndaş Həmrəyliyi Partiyası,Vətəndaş Həmrəyliyi Partiyası,72,Yardımlı-Masallı seçim dairəsi,National Assembly,4,,,,,,,
ad4074c3-27fb-4740-878d-921fdb9bb31b,Sahib Eyvaz oğlu Alıyev,Sahib Eyvaz oğlu Alıyev,,,,Independent,83b82faf-9a1d-4bf8-bd05-5c7f10e6f679,95,Tərtər seçim dairəsi,National Assembly,4,,,,,,Q2415493,
0490305e-bc67-4594-86f4-fd0f6848ce88,Sahibə Əli qızı Qafarova,Sahibə Əli qızı Qafarova,,,,Yeni Azərbaycan Partiyası,Yeni Azərbaycan Partiyası,98,Şəmkir şəhər seçim dairəsi,National Assembly,4,,,,,,,
f3235469-fae2-483d-8c55-8927ce871924,Sevinc Həbib qızı Fətəliyeva,Sevinc Həbib qızı Fətəliyeva,,,,Yeni Azərbaycan Partiyası,Yeni Azərbaycan Partiyası,30,Suraxanı I seçim dairəsi,National Assembly,4,,,,,,,
2abdd925-1d6f-48ec-9d76-98362cca729a,Sevinc Əmirəhməd qızı Hüseynova,Sevinc Əmirəhməd qızı Hüseynova,,,,Yeni Azərbaycan Partiyası,Yeni Azərbaycan Partiyası,103,Gədəbəy seçim dairəsi,National Assembly,4,,,,,,,
f20b41d5-1c4e-44da-96da-6a745ca4cbe5,Siyavuş Dünyamalı oğlu Novruzov,Siyavuş Dünyamalı oğlu Novruzov,,,,Yeni Azərbaycan Partiyası,Yeni Azərbaycan Partiyası,5,Şahbuz-Babək seçim dairəsi,National Assembly,4,,,,,,,
a02a3a47-2bdb-4c5b-9127-bcd734760e30,Sədaqət Süleyman qızı Vəliyeva,Sədaqət Süleyman qızı Vəliyeva,,,,Yeni Azərbaycan Partiyası,Yeni Azərbaycan Partiyası,25,Nizami II seçim dairəsi,National Assembly,4,,,,,,,
3656dd98-b128-4d37-a3d4-d349378edb99,Səməd İsmayıl oğlu Seyidov,Səməd İsmayıl oğlu Seyidov,,,,Yeni Azərbaycan Partiyası,Yeni Azərbaycan Partiyası,36,Xətai IV seçim dairəsi,National Assembly,4,,,,,,,
a0570ab6-feb7-42a2-9dc2-b1328b8ebb7f,Səttar Suliddin oğlu Mehbalıyev,Səttar Suliddin oğlu Mehbalıyev,,,,Independent,83b82faf-9a1d-4bf8-bd05-5c7f10e6f679,3,Babək-Kəngərli-Naxçıvan seçim dairəsi,National Assembly,4,,,,,,Q2415493,
a1547c6d-bdec-4550-942d-4da120bcdec5,Tahir Musa oğlu Rzayev,Tahir Musa oğlu Rzayev,,,,Yeni Azərbaycan Partiyası,Yeni Azərbaycan Partiyası,82,Ağcabədi seçim dairəsi,National Assembly,4,,,,,,,
f645700a-9983-4d89-9364-70ca5b73e9dc,Tahir Süleyman oğlu Süleymanov,Tahir Süleyman oğlu Süleymanov,,,,Yeni Azərbaycan Partiyası,Yeni Azərbaycan Partiyası,54,Şabran-Siyəzən seçim dairəsi,National Assembly,4,,,,,,,
d84665be-33e8-437c-ae01-304aa20ebdf7,Vahid Qazməmməd oğlu Əhmədov,Vahid Qazməmməd oğlu Əhmədov,,,,Independent,83b82faf-9a1d-4bf8-bd05-5c7f10e6f679,52,Quba seçim dairəsi,National Assembly,4,,,,,,Q2415493,
cfdcd156-1c13-44ee-bfc7-477062dc1487,Valeh Feyruz oğlu Ələsgərov,Valeh Feyruz oğlu Ələsgərov,,,,Independent,83b82faf-9a1d-4bf8-bd05-5c7f10e6f679,102,Samux-Şəmkir seçim dairəsi,National Assembly,4,,,,,,Q2415493,
848c0dbb-0df4-4c02-a521-af4a4737ad85,Vasif Yusif oğlu Talıbov,Vasif Yusif oğlu Talıbov,,,,Yeni Azərbaycan Partiyası,Yeni Azərbaycan Partiyası,1,Şərur-Sədərək seçim dairəsi,National Assembly,4,,,,,,,
1ad5a020-5cb0-4a01-8a48-e548a94ca97f,Xanhüseyn Hüseynağa oğlu Kazımlı,Xanhüseyn Hüseynağa oğlu Kazımlı,,,,Azərbaycan Sosial Rifah Partiyası,Azərbaycan Sosial Rifah Partiyası,66,Biləsuvar seçim dairəsi,National Assembly,4,,,,,,,
2f554a5b-473e-400a-a149-82cf57e7a384,Xanlar Nuru oğlu Fətiyev,Xanlar Nuru oğlu Fətiyev,,,,Yeni Azərbaycan Partiyası,Yeni Azərbaycan Partiyası,39,Kəpəz I seçim dairəsi (Gəncə şəhəri),National Assembly,4,,,,,,,
ac6339a6-3e8e-4a96-bed5-c60235265223,Yaqub Mikayıl oğlu Mahmudov,Yaqub Mikayıl oğlu Mahmudov,,,,Yeni Azərbaycan Partiyası,Yeni Azərbaycan Partiyası,113,Şəki şəhər seçim dairəsi,National Assembly,4,,,,,,,
d1cd940a-c43d-42ac-b75e-20457c8e8478,Yevda Sasun oğlu Abramov,Yevda Sasun oğlu Abramov,,,,Yeni Azərbaycan Partiyası,Yeni Azərbaycan Partiyası,53,Quba-Qusar seçim dairəsi,National Assembly,4,,,,,,,
cae5fb04-83bc-4823-a59d-32a007d2df4e,Zeynəb Yəhya qızı Xanlarova,Zeynəb Yəhya qızı Xanlarova,,,,Independent,83b82faf-9a1d-4bf8-bd05-5c7f10e6f679,50,Qobustan-Xızı-Sumqayıt seçim dairəsi,National Assembly,4,,,,,,Q2415493,
c55cd561-3359-477b-9440-b90f136150eb,Ziyad Əliabbas oğlu Səmədzadə,Ziyad Əliabbas oğlu Səmədzadə,,,,Independent,83b82faf-9a1d-4bf8-bd05-5c7f10e6f679,23,Nəsimi-Səbail seçim dairəsi,National Assembly,4,,,,,,Q2415493,
80d8fa3d-6348-4064-b43f-85a188cba327,Ziyafət Abbas oğlu Əsgərov,Ziyafət Abbas oğlu Əsgərov,,,,Yeni Azərbaycan Partiyası,Yeni Azərbaycan Partiyası,76,Lənkəran-Astara seçim dairəsi,National Assembly,4,,,,,,,
6288aabd-91a5-49b3-8461-a8ab1f744c20,Çingiz Aşralı oğlu Qənizadə,Çingiz Aşralı oğlu Qənizadə,,,,Independent,83b82faf-9a1d-4bf8-bd05-5c7f10e6f679,80,İmişli-Beyləqan seçim dairəsi,National Assembly,4,,,,,,Q2415493,
904e73aa-0e6c-472f-87c7-17295f867aec,İlham Kazım oğlu Məmmədov,İlham Kazım oğlu Məmmədov,,,,Yeni Azərbaycan Partiyası,Yeni Azərbaycan Partiyası,48,Yevlax seçim dairəsi,National Assembly,4,,,,,,,
b33dd4e2-9c94-49f3-8de0-70b0eddfb353,İlham Əlisəftər oğlu Əliyev,İlham Əlisəftər oğlu Əliyev,,,,Yeni Azərbaycan Partiyası,Yeni Azərbaycan Partiyası,56,Xaçmaz qəsəbə seçim dairəsi,National Assembly,4,,,,,,,
89737e10-4ec5-4861-b645-8cfc7093b42c,İmamverdi İbiş oğlu İsmayılov,İmamverdi İbiş oğlu İsmayılov,,,,Yeni Azərbaycan Partiyası,Yeni Azərbaycan Partiyası,125,Zəngilan-Qubadlı seçim dairəsi,National Assembly,4,,,,,,,
d17a16f8-6c72-4995-ad34-fcc9712bf416,İqbal Nəriman oğlu Məmmədov,İqbal Nəriman oğlu Məmmədov,,,,Yeni Azərbaycan Partiyası,Yeni Azərbaycan Partiyası,78,Lerik seçim dairəsi,National Assembly,4,,,,,,,
b1e64842-c16f-46fb-bb5a-156646b0fdfa,İsa Əkbər oğlu Həbibbəyli,İsa Əkbər oğlu Həbibbəyli,,,,Yeni Azərbaycan Partiyası,Yeni Azərbaycan Partiyası,2,Şərur seçim dairəsi,National Assembly,4,,,,,,,
b2c51f28-a2f6-4cfa-916d-12d4cbb01fa2,Əhliman Tapdıq oğlu Əmiraslanov,Əhliman Tapdıq oğlu Əmiraslanov,,,,Yeni Azərbaycan Partiyası,Yeni Azərbaycan Partiyası,65,Saatlı-Sabirabad-Kürdəmir seçim dairəsi,National Assembly,4,,,,,,,
4a0a4393-08a6-44c6-a0e9-4187ef1bd9fc,Əli Cavad oğlu Əhmədov,Əli Cavad oğlu Əhmədov,,,,Yeni Azərbaycan Partiyası,Yeni Azərbaycan Partiyası,19,Nərimanov I seçim dairəsi,National Assembly,4,,,,,,,
cb52402a-786e-4581-bae9-96e3b4583528,Əli Məhəmməd oğlu Hüseynov,Əli Məhəmməd oğlu Hüseynov,,,,Yeni Azərbaycan Partiyası,Yeni Azərbaycan Partiyası,49,Yevlax-Mingəçevir seçim dairəsi,National Assembly,4,,,,,,,
66753d03-b8a8-4b9d-9031-27e184b50e16,Əli Əhməd oğlu Məsimli,Əli Əhməd oğlu Məsimli,,,,Independent,83b82faf-9a1d-4bf8-bd05-5c7f10e6f679,114,Şəki qəsəbə I seçim dairəsi,National Assembly,4,,,,,,Q2415493,
6b803553-e608-48ba-b9c4-c88c3a476f4d,Əliağa İzzət oğlu Hüseynov,Əliağa İzzət oğlu Hüseynov,,,,Independent,83b82faf-9a1d-4bf8-bd05-5c7f10e6f679,59,Salyan seçim dairəsi,National Assembly,4,,,,,,Q2415493,
46816ecd-2de0-4fb7-be01-380cc483b07d,Əsabil Qarakişi oğlu Qasımov,Əsabil Qarakişi oğlu Qasımov,,,,Yeni Azərbaycan Partiyası,Yeni Azərbaycan Partiyası,79,İmişli seçim dairəsi,National Assembly,4,,,,,,,
