id,name,sort_name,email,twitter,facebook,group,group_id,area_id,area,chamber,term,start_date,end_date,image,gender,wikidata,wikidata_group,wikidata_area
7af960f9-5aea-4a6f-95c7-9535090f556b,Adil Abış oğlu Əliyev,Adil Abış oğlu Əliyev,,,,Independent,83b82faf-9a1d-4bf8-bd05-5c7f10e6f679,20,Nərimanov II seçim dairəsi,National Assembly,4,,,,,,Q327591,
ab546546-99d7-494f-9879-f3c29e3c1992,Aqil Məhəmməd oğlu Abbas,Aqil Məhəmməd oğlu Abbas,,,,Independent,83b82faf-9a1d-4bf8-bd05-5c7f10e6f679,83,Ağcabədi-Füzuli seçim dairəsi,National Assembly,4,,,,,,Q327591,
5ad880e8-5e9a-47a4-9c7a-1cc048a63573,Aqiyə Həbib qızı Naxçıvanlı,Aqiyə Həbib qızı Naxçıvanlı,,,,Yeni Azərbaycan Partiyası,Yeni Azərbaycan Partiyası,117,Oğuz-Qəbələ seçim dairəsi,National Assembly,4,,,,,,,
8cc53b26-b0fb-4361-bb0c-785f312d52aa,Arif Qafar oğlu Rəhimzadə,Arif Qafar oğlu Rəhimzadə,,,,Yeni Azərbaycan Partiyası,Yeni Azərbaycan Partiyası,61,Neftçala seçim dairəsi,National Assembly,4,,,,,,,
80c8ddcd-3dce-4ba4-8977-be3ef84f7a5a,Asim Nazim oğlu Mollazadə,Asim Nazim oğlu Mollazadə,,,,Azərbaycan Demokratik İslahatlar Partiyası,Azərbaycan Demokratik İslahatlar Partiyası,22,Nəsimi II seçim dairəsi,National Assembly,4,,,,,,,
bc3cd9f4-ac4d-4276-9e68-9e3e287ad53a,Aslan Məmmədhüseyn oğlu Cəfərov,Aslan Məmmədhüseyn oğlu Cəfərov,,,,Yeni Azərbaycan Partiyası,Yeni Azərbaycan Partiyası,77,Astara seçim dairəsi,National Assembly,4,,,,,,,
296403d0-cf9f-4322-843d-9c720ee33e81,Astan Nuşrəvan oğlu Şahverdiyev,Astan Nuşrəvan oğlu Şahverdiyev,,,,Yeni Azərbaycan Partiyası,Yeni Azərbaycan Partiyası,120,Cəbrayıl-Qubadlı seçim dairəsi,National Assembly,4,,,,,,,
2b450226-cd99-4596-9e23-365886bad8c7,Aydın Böyükkişi oğlu Mirzəzadə,Aydın Böyükkişi oğlu Mirzəzadə,,,,Yeni Azərbaycan Partiyası,Yeni Azərbaycan Partiyası,47,Mingəçevir seçim dairəsi,National Assembly,4,,,,,,,
b945b276-6d1a-4049-b7a2-02d83aacd43a,Azər Camal oğlu Badamov,Azər Camal oğlu Badamov,,,,Yeni Azərbaycan Partiyası,Yeni Azərbaycan Partiyası,51,Qusar seçim dairəsi,National Assembly,4,,,,,,,
1954932b-620a-4541-ae31-ffbc708c7ced,Azər Şəmşid oğlu Kərimli,Azər Şəmşid oğlu Kərimli,,,,Independent,83b82faf-9a1d-4bf8-bd05-5c7f10e6f679,112,Qax seçim dairəsi,National Assembly,4,,,,,,Q327591,
77f0c1b1-21d0-474c-93ac-a1a94d8494ba,Ağacan Qulam oğlu Abıyev,Ağacan Qulam oğlu Abıyev,,,,Yeni Azərbaycan Partiyası,Yeni Azərbaycan Partiyası,32,Suraxanı III seçim dairəsi,National Assembly,4,,,,,,,
4c4d40d3-673c-4985-8a15-ce14cb780723,Bahar Əvəz qızı Muradov,Bahar Əvəz qızı Muradov,,,,Yeni Azərbaycan Partiyası,Yeni Azərbaycan Partiyası,84,Füzuli seçim dairəsi,National Assembly,4,,,,,,,
d2553c4b-ace8-4673-abd4-8ee487362f4a,Bəxtiyar Həmzə oğlu Əliyev,Bəxtiyar Həmzə oğlu Əliyev,,,,Independent,83b82faf-9a1d-4bf8-bd05-5c7f10e6f679,118,Ağdam şəhər seçim dairəsi,National Assembly,4,,,,,,Q327591,
fe5410e8-dfdf-49e7-8db5-8db1caa66784,Bəxtiyar Yusif oğlu Sadıqov,Bəxtiyar Yusif oğlu Sadıqov,,,,Yeni Azərbaycan Partiyası,Yeni Azərbaycan Partiyası,119,Ağdam qəsəbə seçim dairəsi,National Assembly,4,,,,,,,
3fb3e53b-f0c6-439b-80a1-df4f17c9b01c,Cavanşir Hümmət oğlu Paşazadə,Cavanşir Hümmət oğlu Paşazadə,,,,Yeni Azərbaycan Partiyası,Yeni Azərbaycan Partiyası,75,Lənkəran-Masallı seçim dairəsi,National Assembly,4,,,,,,,
cb6ab73f-e543-4d5d-ae75-7f8a7bd6596a,Cavanşir Əyyub oğlu Feyziyev,Cavanşir Əyyub oğlu Feyziyev,,,,Independent,83b82faf-9a1d-4bf8-bd05-5c7f10e6f679,115,Şəki qəsəbə II seçim dairəsi,National Assembly,4,,,,,,Q327591,
209d2cc3-82f5-488d-96cd-6cb2852ef45a,Cavid Qənbər oğlu Qurbanov,Cavid Qənbər oğlu Qurbanov,,,,Yeni Azərbaycan Partiyası,Yeni Azərbaycan Partiyası,123,Kəlbəcər seçim dairəsi,National Assembly,4,,,,,,,
a3fb0f2d-d52a-47b9-b2ed-517fee5f6128,Ceyhun Yunis oğlu Osmanlı,Ceyhun Yunis oğlu Osmanlı,,,,Independent,83b82faf-9a1d-4bf8-bd05-5c7f10e6f679,63,Sabirabad I seçim dairəsi,National Assembly,4,,,,,,Q327591,
b14681fa-7a28-409a-9faa-fed131a1aa09,Cəlal Əlirza oğlu Əliyev,Cəlal Əlirza oğlu Əliyev,,,,Yeni Azərbaycan Partiyası,Yeni Azərbaycan Partiyası,62,Saatlı seçim dairəsi,National Assembly,4,,,,,,,
c58962c3-c235-4fec-950e-b4d7fab294a4,Eldar Allahyar oğlu Quliyev,Eldar Allahyar oğlu Quliyev,,,,Independent,83b82faf-9a1d-4bf8-bd05-5c7f10e6f679,28,Sabunçu III seçim dairəsi,National Assembly,4,,,,,,Q327591,
101ebda9-7555-4ba0-bab3-e7ab48c73d31,Eldar Rza oğlu İbrahimov,Eldar Rza oğlu İbrahimov,,,,Yeni Azərbaycan Partiyası,Yeni Azərbaycan Partiyası,4,Naxçıvan şəhər seçim dairəsi,National Assembly,4,,,,,,,
6529d76d-bfdc-4c13-9e5b-86287c5d15f6,Elman Camal oğlu Məmmədov,Elman Camal oğlu Məmmədov,,,,Yeni Azərbaycan Partiyası,Yeni Azərbaycan Partiyası,124,Şuşa-Ağdam-Xocalı-Xocavənd seçim dairəsi,National Assembly,4,,,,,,,
49dfa614-565a-4f74-bce4-e3bb72f4ef93,Elmira Hüseyn qızı Axundova,Elmira Hüseyn qızı Axundova,,,,Independent,83b82faf-9a1d-4bf8-bd05-5c7f10e6f679,71,Masallı qəsəbə seçim dairəsi,National Assembly,4,,,,,,Q327591,
cbca672f-f2f5-4f02-b30f-a879479af54a,Elxan Sirac oğlu Süleymanov,Elxan Sirac oğlu Süleymanov,,,,Independent,83b82faf-9a1d-4bf8-bd05-5c7f10e6f679,85,Şamaxı seçim dairəsi,National Assembly,4,,,,,,Q327591,
95687236-3322-4fe8-ac50-a94c48c1c24f,Fazil Qəzənfər oğlu Mustafa,Fazil Qəzənfər oğlu Mustafa,,,,Böyük Quruluş Partiyası,Böyük Quruluş Partiyası,26,Sabunçu I seçim dairəsi,National Assembly,4,,,,,,,
eb0ce263-aaae-4663-b7f8-25a78d499188,Flora Qasım qızı Qasımova,Flora Qasım qızı Qasımova,,,,Independent,83b82faf-9a1d-4bf8-bd05-5c7f10e6f679,122,Xankəndi seçim dairəsi,National Assembly,4,,,,,,Q327591,
1ac25ddf-fb4d-4332-91b3-9293f8168ebb,Fərəc İbrahim oğlu Quliyev,Fərəc İbrahim oğlu Quliyev,,,,Milli Dirçəliş Hərəkatı Partiyası,Milli Dirçəliş Hərəkatı Partiyası,31,Suraxanı II seçim dairəsi,National Assembly,4,,,,,,,
36795ed2-97c3-4ef6-bdbf-435624e6cd50,Fəttah Səməd oğlu Heydərov,Fəttah Səməd oğlu Heydərov,,,,Independent,83b82faf-9a1d-4bf8-bd05-5c7f10e6f679,116,Qəbələ seçim dairəsi,National Assembly,4,,,,,,Q327591,
37d4b5f4-9333-4932-a5fc-04bbc6bd13e4,Fəzail Feyruz oğlu İbrahimli,Fəzail Feyruz oğlu İbrahimli,,,,Vətəndaş Həmrəyliyi Partiyası,Vətəndaş Həmrəyliyi Partiyası,69,Cəlilabad-Masallı-Biləsuvar seçim dairəsi,National Assembly,4,,,,,,,
facec5f5-72a7-4002-9458-8fe0e02c0320,Fəzail Rəhim oğlu Ağamalı,Fəzail Rəhim oğlu Ağamalı,,,,Independent,83b82faf-9a1d-4bf8-bd05-5c7f10e6f679,60,Salyan-Neftçala seçim dairəsi,National Assembly,4,,,,,,Q327591,
8b69080a-94c8-470c-8cfa-ca2d6594a720,Hacı Hacıbaba oğlu Salayev,Hacı Hacıbaba oğlu Salayev,,,,Independent,83b82faf-9a1d-4bf8-bd05-5c7f10e6f679,44,Sumqayıt-Abşeron seçim dairəsi,National Assembly,4,,,,,,Q327591,
3bb28655-bb63-4265-ba08-25047fefe23d,Hadı Musa oğlu Rəcəbli,Hadı Musa oğlu Rəcəbli,,,,Yeni Azərbaycan Partiyası,Yeni Azərbaycan Partiyası,74,Lənkəran qəsəbə seçim dairəsi,National Assembly,4,,,,,,,
47f150bd-6b8b-43d3-8e18-c425d5428c01,Hikmət İsmayıl oğlu Atayev,Hikmət İsmayıl oğlu Atayev,,,,Yeni Azərbaycan Partiyası,Yeni Azərbaycan Partiyası,110,Zaqatala seçim dairəsi,National Assembly,4,,,,,,,
d3c32d5f-99af-4e52-9b0b-65478dc07b3a,Hüseynbala Fazil oğlu Mirələmov,Hüseynbala Fazil oğlu Mirələmov,,,,Yeni Azərbaycan Partiyası,Yeni Azərbaycan Partiyası,33,Xətai I seçim dairəsi,National Assembly,4,,,,,,,
0f52c2a1-3f6e-4b1c-90cb-ec1fde7a3f4f,Jalə Fazil qızı Əliyeva,Jalə Fazil qızı Əliyeva,,,,Independent,83b82faf-9a1d-4bf8-bd05-5c7f10e6f679,92,Zərdab-Ucar seçim dairəsi,National Assembly,4,,,,,,Q327591,
3d368bff-eec2-4d71-a007-7d793fa5ec2e,Kamilə Əli Ağa qızı Əliyeva,Kamilə Əli Ağa qızı Əliyeva,,,,Yeni Azərbaycan Partiyası,Yeni Azərbaycan Partiyası,111,Zaqatala-Balakən seçim dairəsi,National Assembly,4,,,,,,,
619bf94f-a6c4-492a-bfa6-c701a2a9ca91,Madər Ələsgər oğlu Musayev,Madər Ələsgər oğlu Musayev,,,,Independent,83b82faf-9a1d-4bf8-bd05-5c7f10e6f679,10,Binəqədi III seçim dairəsi,National Assembly,4,,,,,,Q327591,
30a59634-fc62-417e-b004-dcf82b76e225,Mahir Məhəmmədəli oğlu Aslanov,Mahir Məhəmmədəli oğlu Aslanov,,,,Independent,83b82faf-9a1d-4bf8-bd05-5c7f10e6f679,96,Goranboy-Naftalan seçim dairəsi,National Assembly,4,,,,,,Q327591,
693d2f20-b2d1-4dfe-82fe-c298517411f4,Malik Əvəz oğlu Həsənov,Malik Əvəz oğlu Həsənov,,,,Yeni Azərbaycan Partiyası,Yeni Azərbaycan Partiyası,67,Cəlilabad şəhər seçim dairəsi,National Assembly,4,,,,,,,
7e84a363-cb0b-4f8d-b181-f5449302817e,Mehriban Arif qızı Əliyeva,Mehriban Arif qızı Əliyeva,,,,Yeni Azərbaycan Partiyası,Yeni Azərbaycan Partiyası,14,Xəzər II seçim dairəsi,National Assembly,4,,,,,,,
85627ef6-72fd-4399-a508-a698262349ac,Mirkazım Mirməhəmməd oğlu Kazımov,Mirkazım Mirməhəmməd oğlu Kazımov,,,,Yeni Azərbaycan Partiyası,Yeni Azərbaycan Partiyası,68,Cəlilabad qəsəbə seçim dairəsi,National Assembly,4,,,,,,,
8d6c43a9-6159-4aca-acfb-455f18f39395,Mixail Yuri oğlu Zabelin,Mixail Yuri oğlu Zabelin,,,,Yeni Azərbaycan Partiyası,Yeni Azərbaycan Partiyası,12,Qaradağ-Binəqədi-Yasamal seçim dairəsi,National Assembly,4,,,,,,,
609b8d01-1d68-4d5f-a8ea-f1a4420c3ae6,Musa İsa oğlu Quliyev (Urud),Musa İsa oğlu Quliyev (Urud),,,,Yeni Azərbaycan Partiyası,Yeni Azərbaycan Partiyası,40,Kəpəz II seçim dairəsi (Gəncə şəhəri),National Assembly,4,,,,,,,
ffe7e351-5c14-4d5e-b8f9-c4ad4c8c25df,Muxtar Bahadur oğlu Babayev,Muxtar Bahadur oğlu Babayev,,,,Yeni Azərbaycan Partiyası,Yeni Azərbaycan Partiyası,43,Sumqayıt III seçim dairəsi,National Assembly,4,,,,,,,
df2c915e-f113-4ab0-9708-f8bcbf600bc2,Mübariz Qəhrəman oğlu Qurbanlı,Mübariz Qəhrəman oğlu Qurbanlı,,,,Independent,83b82faf-9a1d-4bf8-bd05-5c7f10e6f679,100,Şəmkir-Daşkəsən seçim dairəsi,National Assembly,4,,,,,,Q327591,
239fe1d8-7ea6-43ce-9134-ade304089ffb,Nazim Fərəc oğlu Fərəcov,Nazim Fərəc oğlu Fərəcov,,,,Yeni Azərbaycan Partiyası,Yeni Azərbaycan Partiyası,121,Laçın seçim dairəsi,National Assembly,4,,,,,,,
cb900a7c-3bbb-4f07-b8d5-21317be1b375,Nizami Qulu oğlu Cəfərov,Nizami Qulu oğlu Cəfərov,,,,Yeni Azərbaycan Partiyası,Yeni Azərbaycan Partiyası,108,Ağstafa seçim dairəsi,National Assembly,4,,,,,,,
48437add-4b91-46d5-ae7e-f8393af9ccbf,Novruzəli Davud oğlu Aslanov,Novruzəli Davud oğlu Aslanov,,,,Independent,83b82faf-9a1d-4bf8-bd05-5c7f10e6f679,86,İsmayıllı seçim dairəsi,National Assembly,4,,,,,,Q327591,
1e6b4fc3-c77a-4df5-9f50-01ce7c7934bf,Nəriman Əlibala oğlu Əliyev,Nəriman Əlibala oğlu Əliyev,,,,Yeni Azərbaycan Partiyası,Yeni Azərbaycan Partiyası,70,Masallı şəhər seçim dairəsi,National Assembly,4,,,,,,,
e8747b73-ac86-465f-8f6f-6bde46fc3132,Qüdrət Müzəffər oğlu Həsənquliyev,Qüdrət Müzəffər oğlu Həsənquliyev,,,,Bütöv Azərbaycan Xalq Cəbhəsi Partiyası,Bütöv Azərbaycan Xalq Cəbhəsi Partiyası,7,Ordubad-Culfa seçim dairəsi,National Assembly,4,,,,,,,
89ef3e72-002f-4832-8681-20308f7d78b7,Qənirə Ələsgər qızı Paşayeva,Qənirə Ələsgər qızı Paşayeva,,,,Independent,83b82faf-9a1d-4bf8-bd05-5c7f10e6f679,105,Tovuz seçim dairəsi,National Assembly,4,,,,,,Q327591,
2f2aeddb-1e8d-4d92-8eff-b1fe3e496664,Rafael Baba oğlu Hüseynov,Rafael Baba oğlu Hüseynov,,,,Independent,83b82faf-9a1d-4bf8-bd05-5c7f10e6f679,58,Hacıqabul-Kürdəmir seçim dairəsi,National Assembly,4,,,,,,Q327591,
f107b463-2c3a-40ad-a932-1bf7d98a2cd8,Rafiq Musa oğlu Məmmədhəsənov,Rafiq Musa oğlu Məmmədhəsənov,,,,Yeni Azərbaycan Partiyası,Yeni Azərbaycan Partiyası,104,Gədəbəy-Tovuz seçim dairəsi,National Assembly,4,,,,,,,
c666fe0c-e648-41a3-9eaa-e5d59d5daabf,Rasim Nəsrəddin oğlu Musabəyov,Rasim Nəsrəddin oğlu Musabəyov,,,,Independent,83b82faf-9a1d-4bf8-bd05-5c7f10e6f679,18,Nərimanov-Nizami seçim dairəsi,National Assembly,4,,,,,,Q327591,
f56ee512-ce3f-4966-976c-eee82088b354,Rauf Asif oğlu Əliyev,Rauf Asif oğlu Əliyev,,,,Yeni Azərbaycan Partiyası,Yeni Azərbaycan Partiyası,13,Xəzər I seçim dairəsi,National Assembly,4,,,,,,,
d8efdfaa-59ba-4ccc-9f6d-8382cfc16b5f,Rövnəq İbrahim oğlu Abdullayev,Rövnəq İbrahim oğlu Abdullayev,,,,Yeni Azərbaycan Partiyası,Yeni Azərbaycan Partiyası,24,Nizami I seçim dairəsi,National Assembly,4,,,,,,,
36b2cf56-b16b-497c-844a-2177e2f6ae74,Rövşən Şükür oğlu Rzayev,Rövşən Şükür oğlu Rzayev,,,,Independent,83b82faf-9a1d-4bf8-bd05-5c7f10e6f679,101,Göygöl-Daşkəsən seçim dairəsi,National Assembly,4,,,,,,Q327591,
1b82cfa9-5a10-4118-921b-60316dfc3857,Rüfət Atakişi oğlu Quliyev,Rüfət Atakişi oğlu Quliyev,,,,Independent,83b82faf-9a1d-4bf8-bd05-5c7f10e6f679,73,Lənkəran şəhər seçim dairəsi,National Assembly,4,,,,,,Q327591,
dc02d87e-7cd9-4419-8f1a-485ac7b0a17a,Rüstəm Gülabba oğlu Xəlilov,Rüstəm Gülabba oğlu Xəlilov,,,,Yeni Azərbaycan Partiyası,Yeni Azərbaycan Partiyası,64,Sabirabad II seçim dairəsi,National Assembly,4,,,,,,,
e09117fc-d9b4-4476-9c7a-487777e1a1bd,Rəbiyyət Nurullah qızı Aslanova,Rəbiyyət Nurullah qızı Aslanova,,,,Yeni Azərbaycan Partiyası,Yeni Azərbaycan Partiyası,109,Balakən seçim dairəsi,National Assembly,4,,,,,,,
334190d5-ed2e-4167-9ee1-5a1409986356,Sabir Kamal oğlu Hacıyev,Sabir Kamal oğlu Hacıyev,,,,Vətəndaş Birliyi Partiyası,Vətəndaş Birliyi Partiyası,88,Göyçay seçim dairəsi,National Assembly,4,,,,,,,
ff65b35f-28c7-497a-96a4-7d6ce1d78e9f,Sabir Xudu oğlu Rüstəmxanlı,Sabir Xudu oğlu Rüstəmxanlı,,,,Vətəndaş Həmrəyliyi Partiyası,Vətəndaş Həmrəyliyi Partiyası,72,Yardımlı-Masallı seçim dairəsi,National Assembly,4,,,,,,,
f99a9f3e-289f-43b6-9f94-dfa409e0f715,Sahib Eyvaz oğlu Alıyev,Sahib Eyvaz oğlu Alıyev,,,,Independent,83b82faf-9a1d-4bf8-bd05-5c7f10e6f679,95,Tərtər seçim dairəsi,National Assembly,4,,,,,,Q327591,
a7906ec1-2884-434a-b9a7-a41b35c4483a,Sahibə Əli qızı Qafarova,Sahibə Əli qızı Qafarova,,,,Yeni Azərbaycan Partiyası,Yeni Azərbaycan Partiyası,98,Şəmkir şəhər seçim dairəsi,National Assembly,4,,,,,,,
cae9ea17-b089-4111-b01f-27bc96a0d81c,Sevinc Həbib qızı Fətəliyeva,Sevinc Həbib qızı Fətəliyeva,,,,Yeni Azərbaycan Partiyası,Yeni Azərbaycan Partiyası,30,Suraxanı I seçim dairəsi,National Assembly,4,,,,,,,
348a8667-9ea6-4879-b22c-06ab7246a57a,Sevinc Əmirəhməd qızı Hüseynova,Sevinc Əmirəhməd qızı Hüseynova,,,,Yeni Azərbaycan Partiyası,Yeni Azərbaycan Partiyası,103,Gədəbəy seçim dairəsi,National Assembly,4,,,,,,,
e363e550-df1a-4f81-96c6-1384f8690ab3,Siyavuş Dünyamalı oğlu Novruzov,Siyavuş Dünyamalı oğlu Novruzov,,,,Yeni Azərbaycan Partiyası,Yeni Azərbaycan Partiyası,5,Şahbuz-Babək seçim dairəsi,National Assembly,4,,,,,,,
f19f9683-eb9b-4d72-8151-06b44665d1c8,Sədaqət Süleyman qızı Vəliyeva,Sədaqət Süleyman qızı Vəliyeva,,,,Yeni Azərbaycan Partiyası,Yeni Azərbaycan Partiyası,25,Nizami II seçim dairəsi,National Assembly,4,,,,,,,
57503e2f-afb5-4a7b-a0b7-3deedc3374ab,Səməd İsmayıl oğlu Seyidov,Səməd İsmayıl oğlu Seyidov,,,,Yeni Azərbaycan Partiyası,Yeni Azərbaycan Partiyası,36,Xətai IV seçim dairəsi,National Assembly,4,,,,,,,
6e5820b1-a72d-4a44-8986-917f1d246f1d,Səttar Suliddin oğlu Mehbalıyev,Səttar Suliddin oğlu Mehbalıyev,,,,Independent,83b82faf-9a1d-4bf8-bd05-5c7f10e6f679,3,Babək-Kəngərli-Naxçıvan seçim dairəsi,National Assembly,4,,,,,,Q327591,
54043fa7-067b-480d-aaa0-8ee82df968a8,Tahir Musa oğlu Rzayev,Tahir Musa oğlu Rzayev,,,,Yeni Azərbaycan Partiyası,Yeni Azərbaycan Partiyası,82,Ağcabədi seçim dairəsi,National Assembly,4,,,,,,,
5a64b78c-7bee-4dfb-b7c0-6495e6a46d8c,Tahir Süleyman oğlu Süleymanov,Tahir Süleyman oğlu Süleymanov,,,,Yeni Azərbaycan Partiyası,Yeni Azərbaycan Partiyası,54,Şabran-Siyəzən seçim dairəsi,National Assembly,4,,,,,,,
abe91de1-6e8d-4d1f-98d3-9699c5aca668,Vahid Qazməmməd oğlu Əhmədov,Vahid Qazməmməd oğlu Əhmədov,,,,Independent,83b82faf-9a1d-4bf8-bd05-5c7f10e6f679,52,Quba seçim dairəsi,National Assembly,4,,,,,,Q327591,
0e1d1f13-69d2-40b5-a542-ecd6271feb79,Valeh Feyruz oğlu Ələsgərov,Valeh Feyruz oğlu Ələsgərov,,,,Independent,83b82faf-9a1d-4bf8-bd05-5c7f10e6f679,102,Samux-Şəmkir seçim dairəsi,National Assembly,4,,,,,,Q327591,
01e8ce32-d44e-4c4a-a118-24ddb4619048,Vasif Yusif oğlu Talıbov,Vasif Yusif oğlu Talıbov,,,,Yeni Azərbaycan Partiyası,Yeni Azərbaycan Partiyası,1,Şərur-Sədərək seçim dairəsi,National Assembly,4,,,,,,,
9ecc9b38-5dc9-4e39-b9dd-ff75c4cc50ac,Xanhüseyn Hüseynağa oğlu Kazımlı,Xanhüseyn Hüseynağa oğlu Kazımlı,,,,Azərbaycan Sosial Rifah Partiyası,Azərbaycan Sosial Rifah Partiyası,66,Biləsuvar seçim dairəsi,National Assembly,4,,,,,,,
c2900d8b-027d-43bb-9094-b2fe7731dbd0,Xanlar Nuru oğlu Fətiyev,Xanlar Nuru oğlu Fətiyev,,,,Yeni Azərbaycan Partiyası,Yeni Azərbaycan Partiyası,39,Kəpəz I seçim dairəsi (Gəncə şəhəri),National Assembly,4,,,,,,,
e8a3281d-5aa9-4f06-822c-efdd434dc1b8,Yaqub Mikayıl oğlu Mahmudov,Yaqub Mikayıl oğlu Mahmudov,,,,Yeni Azərbaycan Partiyası,Yeni Azərbaycan Partiyası,113,Şəki şəhər seçim dairəsi,National Assembly,4,,,,,,,
7e94501a-90ee-4242-92a2-cd4a227133ba,Yevda Sasun oğlu Abramov,Yevda Sasun oğlu Abramov,,,,Yeni Azərbaycan Partiyası,Yeni Azərbaycan Partiyası,53,Quba-Qusar seçim dairəsi,National Assembly,4,,,,,,,
e381da6b-676e-414a-92ba-69d01b11fcfd,Zeynəb Yəhya qızı Xanlarova,Zeynəb Yəhya qızı Xanlarova,,,,Independent,83b82faf-9a1d-4bf8-bd05-5c7f10e6f679,50,Qobustan-Xızı-Sumqayıt seçim dairəsi,National Assembly,4,,,,,,Q327591,
204dd7a7-c824-4dd2-9324-7a775375a40c,Ziyad Əliabbas oğlu Səmədzadə,Ziyad Əliabbas oğlu Səmədzadə,,,,Independent,83b82faf-9a1d-4bf8-bd05-5c7f10e6f679,23,Nəsimi-Səbail seçim dairəsi,National Assembly,4,,,,,,Q327591,
5ce4eddf-ad22-4051-8d76-e6db1d2a72c0,Ziyafət Abbas oğlu Əsgərov,Ziyafət Abbas oğlu Əsgərov,,,,Yeni Azərbaycan Partiyası,Yeni Azərbaycan Partiyası,76,Lənkəran-Astara seçim dairəsi,National Assembly,4,,,,,,,
12aa8469-592e-490d-8001-c0988c34e392,Çingiz Aşralı oğlu Qənizadə,Çingiz Aşralı oğlu Qənizadə,,,,Independent,83b82faf-9a1d-4bf8-bd05-5c7f10e6f679,80,İmişli-Beyləqan seçim dairəsi,National Assembly,4,,,,,,Q327591,
ce499f3e-7271-4e9f-987c-93a8e040a302,İlham Kazım oğlu Məmmədov,İlham Kazım oğlu Məmmədov,,,,Yeni Azərbaycan Partiyası,Yeni Azərbaycan Partiyası,48,Yevlax seçim dairəsi,National Assembly,4,,,,,,,
80f1f963-b85f-4960-b10a-90b605e1f930,İlham Əlisəftər oğlu Əliyev,İlham Əlisəftər oğlu Əliyev,,,,Yeni Azərbaycan Partiyası,Yeni Azərbaycan Partiyası,56,Xaçmaz qəsəbə seçim dairəsi,National Assembly,4,,,,,,,
08a3f323-aedc-4562-848e-63f2dcfa75b1,İmamverdi İbiş oğlu İsmayılov,İmamverdi İbiş oğlu İsmayılov,,,,Yeni Azərbaycan Partiyası,Yeni Azərbaycan Partiyası,125,Zəngilan-Qubadlı seçim dairəsi,National Assembly,4,,,,,,,
8ec953ec-b7e1-490f-87c6-9e756943547e,İqbal Nəriman oğlu Məmmədov,İqbal Nəriman oğlu Məmmədov,,,,Yeni Azərbaycan Partiyası,Yeni Azərbaycan Partiyası,78,Lerik seçim dairəsi,National Assembly,4,,,,,,,
ca90908b-060e-472a-89f3-af8838bb42c6,İsa Əkbər oğlu Həbibbəyli,İsa Əkbər oğlu Həbibbəyli,,,,Yeni Azərbaycan Partiyası,Yeni Azərbaycan Partiyası,2,Şərur seçim dairəsi,National Assembly,4,,,,,,,
d805e53b-2330-482d-9a29-ad6e7d498145,Əhliman Tapdıq oğlu Əmiraslanov,Əhliman Tapdıq oğlu Əmiraslanov,,,,Yeni Azərbaycan Partiyası,Yeni Azərbaycan Partiyası,65,Saatlı-Sabirabad-Kürdəmir seçim dairəsi,National Assembly,4,,,,,,,
e40339d7-8ff2-430a-8d2f-a4c3eea12173,Əli Cavad oğlu Əhmədov,Əli Cavad oğlu Əhmədov,,,,Yeni Azərbaycan Partiyası,Yeni Azərbaycan Partiyası,19,Nərimanov I seçim dairəsi,National Assembly,4,,,,,,,
14308d9e-d803-4967-b8ef-d842052560e8,Əli Məhəmməd oğlu Hüseynov,Əli Məhəmməd oğlu Hüseynov,,,,Yeni Azərbaycan Partiyası,Yeni Azərbaycan Partiyası,49,Yevlax-Mingəçevir seçim dairəsi,National Assembly,4,,,,,,,
b3970888-2051-42f8-9abf-0a932b7b5387,Əli Əhməd oğlu Məsimli,Əli Əhməd oğlu Məsimli,,,,Independent,83b82faf-9a1d-4bf8-bd05-5c7f10e6f679,114,Şəki qəsəbə I seçim dairəsi,National Assembly,4,,,,,,Q327591,
ced7ccd1-601f-4375-89b1-a6caae6783b8,Əliağa İzzət oğlu Hüseynov,Əliağa İzzət oğlu Hüseynov,,,,Independent,83b82faf-9a1d-4bf8-bd05-5c7f10e6f679,59,Salyan seçim dairəsi,National Assembly,4,,,,,,Q327591,
24df308a-7444-4d6f-b2b3-d0e480dbd4ea,Əsabil Qarakişi oğlu Qasımov,Əsabil Qarakişi oğlu Qasımov,,,,Yeni Azərbaycan Partiyası,Yeni Azərbaycan Partiyası,79,İmişli seçim dairəsi,National Assembly,4,,,,,,,
