id,name,sort_name,email,twitter,facebook,group,group_id,area_id,area,chamber,term,start_date,end_date,image,gender,wikidata,wikidata_group,wikidata_area
e9f74b44-9707-40cf-8e7d-6f4b6244bcef,Adil Abış oğlu Əliyev,Adil Abış oğlu Əliyev,,,,Independent,83b82faf-9a1d-4bf8-bd05-5c7f10e6f679,20,Nərimanov II seçim dairəsi,National Assembly,4,,,,,,Q2415493,
99649468-b272-4158-86e4-1d87380c6e3e,Aqil Məhəmməd oğlu Abbas,Aqil Məhəmməd oğlu Abbas,,,,Independent,83b82faf-9a1d-4bf8-bd05-5c7f10e6f679,83,Ağcabədi-Füzuli seçim dairəsi,National Assembly,4,,,,,,Q2415493,
a2b3b8cc-1d13-46a4-b0ec-5e88c4bc9277,Aqiyə Həbib qızı Naxçıvanlı,Aqiyə Həbib qızı Naxçıvanlı,,,,Yeni Azərbaycan Partiyası,Yeni Azərbaycan Partiyası,117,Oğuz-Qəbələ seçim dairəsi,National Assembly,4,,,,,,,
6ff915c1-d690-4cf5-8d46-cb805bc5ac4a,Arif Qafar oğlu Rəhimzadə,Arif Qafar oğlu Rəhimzadə,,,,Yeni Azərbaycan Partiyası,Yeni Azərbaycan Partiyası,61,Neftçala seçim dairəsi,National Assembly,4,,,,,,,
6e43a517-0fe8-4d4b-8b83-cb6ee85f8deb,Asim Nazim oğlu Mollazadə,Asim Nazim oğlu Mollazadə,,,,Azərbaycan Demokratik İslahatlar Partiyası,Azərbaycan Demokratik İslahatlar Partiyası,22,Nəsimi II seçim dairəsi,National Assembly,4,,,,,,,
8a3a84c5-5315-4bbf-8b9e-a9de6ac80e4a,Aslan Məmmədhüseyn oğlu Cəfərov,Aslan Məmmədhüseyn oğlu Cəfərov,,,,Yeni Azərbaycan Partiyası,Yeni Azərbaycan Partiyası,77,Astara seçim dairəsi,National Assembly,4,,,,,,,
36c68e52-595b-41ea-b499-36c2c86aecfc,Astan Nuşrəvan oğlu Şahverdiyev,Astan Nuşrəvan oğlu Şahverdiyev,,,,Yeni Azərbaycan Partiyası,Yeni Azərbaycan Partiyası,120,Cəbrayıl-Qubadlı seçim dairəsi,National Assembly,4,,,,,,,
27d26724-d871-4803-8a74-e79172d2ca86,Aydın Böyükkişi oğlu Mirzəzadə,Aydın Böyükkişi oğlu Mirzəzadə,,,,Yeni Azərbaycan Partiyası,Yeni Azərbaycan Partiyası,47,Mingəçevir seçim dairəsi,National Assembly,4,,,,,,,
334fc809-8f99-4794-8464-506b3f91229a,Azər Camal oğlu Badamov,Azər Camal oğlu Badamov,,,,Yeni Azərbaycan Partiyası,Yeni Azərbaycan Partiyası,51,Qusar seçim dairəsi,National Assembly,4,,,,,,,
e66a0332-ee3f-4c5a-ae0a-d4dca8d35fc4,Azər Şəmşid oğlu Kərimli,Azər Şəmşid oğlu Kərimli,,,,Independent,83b82faf-9a1d-4bf8-bd05-5c7f10e6f679,112,Qax seçim dairəsi,National Assembly,4,,,,,,Q2415493,
856912b5-ebda-47f8-bd6e-3ef6892b0848,Ağacan Qulam oğlu Abıyev,Ağacan Qulam oğlu Abıyev,,,,Yeni Azərbaycan Partiyası,Yeni Azərbaycan Partiyası,32,Suraxanı III seçim dairəsi,National Assembly,4,,,,,,,
19565908-2475-4742-b08b-ceb2df9a4280,Bahar Əvəz qızı Muradov,Bahar Əvəz qızı Muradov,,,,Yeni Azərbaycan Partiyası,Yeni Azərbaycan Partiyası,84,Füzuli seçim dairəsi,National Assembly,4,,,,,,,
7482d750-cedb-4884-9d32-ece4fd229986,Bəxtiyar Həmzə oğlu Əliyev,Bəxtiyar Həmzə oğlu Əliyev,,,,Independent,83b82faf-9a1d-4bf8-bd05-5c7f10e6f679,118,Ağdam şəhər seçim dairəsi,National Assembly,4,,,,,,Q2415493,
d0f4fe62-3474-41e6-96b2-ea7a9762a6e6,Bəxtiyar Yusif oğlu Sadıqov,Bəxtiyar Yusif oğlu Sadıqov,,,,Yeni Azərbaycan Partiyası,Yeni Azərbaycan Partiyası,119,Ağdam qəsəbə seçim dairəsi,National Assembly,4,,,,,,,
3689caac-69c8-47de-bf1e-a1fdbef2f495,Cavanşir Hümmət oğlu Paşazadə,Cavanşir Hümmət oğlu Paşazadə,,,,Yeni Azərbaycan Partiyası,Yeni Azərbaycan Partiyası,75,Lənkəran-Masallı seçim dairəsi,National Assembly,4,,,,,,,
0cbf5ac3-e9f5-4df6-835f-a2f535f7e80d,Cavanşir Əyyub oğlu Feyziyev,Cavanşir Əyyub oğlu Feyziyev,,,,Independent,83b82faf-9a1d-4bf8-bd05-5c7f10e6f679,115,Şəki qəsəbə II seçim dairəsi,National Assembly,4,,,,,,Q2415493,
ec1e5819-5592-442a-a36f-55db3144782f,Cavid Qənbər oğlu Qurbanov,Cavid Qənbər oğlu Qurbanov,,,,Yeni Azərbaycan Partiyası,Yeni Azərbaycan Partiyası,123,Kəlbəcər seçim dairəsi,National Assembly,4,,,,,,,
c6d2dcfa-9d63-474d-90d2-c4512e1a19fb,Ceyhun Yunis oğlu Osmanlı,Ceyhun Yunis oğlu Osmanlı,,,,Independent,83b82faf-9a1d-4bf8-bd05-5c7f10e6f679,63,Sabirabad I seçim dairəsi,National Assembly,4,,,,,,Q2415493,
65627ef0-3168-45a5-975b-57ac9f555ea4,Cəlal Əlirza oğlu Əliyev,Cəlal Əlirza oğlu Əliyev,,,,Yeni Azərbaycan Partiyası,Yeni Azərbaycan Partiyası,62,Saatlı seçim dairəsi,National Assembly,4,,,,,,,
78f55864-0de8-43cc-9422-29b087dac7ea,Eldar Allahyar oğlu Quliyev,Eldar Allahyar oğlu Quliyev,,,,Independent,83b82faf-9a1d-4bf8-bd05-5c7f10e6f679,28,Sabunçu III seçim dairəsi,National Assembly,4,,,,,,Q2415493,
de2bcc33-509c-4244-9dd5-a064d3b8abc8,Eldar Rza oğlu İbrahimov,Eldar Rza oğlu İbrahimov,,,,Yeni Azərbaycan Partiyası,Yeni Azərbaycan Partiyası,4,Naxçıvan şəhər seçim dairəsi,National Assembly,4,,,,,,,
5de5f73b-d407-4dcd-a5ab-7ed6b35ae21a,Elman Camal oğlu Məmmədov,Elman Camal oğlu Məmmədov,,,,Yeni Azərbaycan Partiyası,Yeni Azərbaycan Partiyası,124,Şuşa-Ağdam-Xocalı-Xocavənd seçim dairəsi,National Assembly,4,,,,,,,
d2c25769-5a66-421a-9ca2-1f62986bd325,Elmira Hüseyn qızı Axundova,Elmira Hüseyn qızı Axundova,,,,Independent,83b82faf-9a1d-4bf8-bd05-5c7f10e6f679,71,Masallı qəsəbə seçim dairəsi,National Assembly,4,,,,,,Q2415493,
10400972-a518-4f40-99be-535afc4dee5e,Elxan Sirac oğlu Süleymanov,Elxan Sirac oğlu Süleymanov,,,,Independent,83b82faf-9a1d-4bf8-bd05-5c7f10e6f679,85,Şamaxı seçim dairəsi,National Assembly,4,,,,,,Q2415493,
f9aa1fa6-b005-45da-bfba-06a7a92cc1ad,Fazil Qəzənfər oğlu Mustafa,Fazil Qəzənfər oğlu Mustafa,,,,Böyük Quruluş Partiyası,Böyük Quruluş Partiyası,26,Sabunçu I seçim dairəsi,National Assembly,4,,,,,,,
6170adab-58de-4119-94a5-a5b1a3ee2413,Flora Qasım qızı Qasımova,Flora Qasım qızı Qasımova,,,,Independent,83b82faf-9a1d-4bf8-bd05-5c7f10e6f679,122,Xankəndi seçim dairəsi,National Assembly,4,,,,,,Q2415493,
fcb9c4ec-c20c-472a-963c-ae35f44f5230,Fərəc İbrahim oğlu Quliyev,Fərəc İbrahim oğlu Quliyev,,,,Milli Dirçəliş Hərəkatı Partiyası,Milli Dirçəliş Hərəkatı Partiyası,31,Suraxanı II seçim dairəsi,National Assembly,4,,,,,,,
6fd750b4-6a13-44a4-9692-5d01e2dea11f,Fəttah Səməd oğlu Heydərov,Fəttah Səməd oğlu Heydərov,,,,Independent,83b82faf-9a1d-4bf8-bd05-5c7f10e6f679,116,Qəbələ seçim dairəsi,National Assembly,4,,,,,,Q2415493,
af6d9f3d-8547-405f-8f28-abb7d07faa78,Fəzail Feyruz oğlu İbrahimli,Fəzail Feyruz oğlu İbrahimli,,,,Vətəndaş Həmrəyliyi Partiyası,Vətəndaş Həmrəyliyi Partiyası,69,Cəlilabad-Masallı-Biləsuvar seçim dairəsi,National Assembly,4,,,,,,,
749fccf7-45e7-4855-b023-332674d394b8,Fəzail Rəhim oğlu Ağamalı,Fəzail Rəhim oğlu Ağamalı,,,,Independent,83b82faf-9a1d-4bf8-bd05-5c7f10e6f679,60,Salyan-Neftçala seçim dairəsi,National Assembly,4,,,,,,Q2415493,
7f340bb1-3f5a-4061-aed4-499b1a15f885,Hacı Hacıbaba oğlu Salayev,Hacı Hacıbaba oğlu Salayev,,,,Independent,83b82faf-9a1d-4bf8-bd05-5c7f10e6f679,44,Sumqayıt-Abşeron seçim dairəsi,National Assembly,4,,,,,,Q2415493,
ad847170-18fc-43c0-b37f-e57315d18e84,Hadı Musa oğlu Rəcəbli,Hadı Musa oğlu Rəcəbli,,,,Yeni Azərbaycan Partiyası,Yeni Azərbaycan Partiyası,74,Lənkəran qəsəbə seçim dairəsi,National Assembly,4,,,,,,,
554a9f57-46a7-4e4c-9c51-0b4ebe3aa725,Hikmət İsmayıl oğlu Atayev,Hikmət İsmayıl oğlu Atayev,,,,Yeni Azərbaycan Partiyası,Yeni Azərbaycan Partiyası,110,Zaqatala seçim dairəsi,National Assembly,4,,,,,,,
470ac98c-20c8-4ac8-a0a7-fd8e076423fe,Hüseynbala Fazil oğlu Mirələmov,Hüseynbala Fazil oğlu Mirələmov,,,,Yeni Azərbaycan Partiyası,Yeni Azərbaycan Partiyası,33,Xətai I seçim dairəsi,National Assembly,4,,,,,,,
0c7714f2-91c9-48a3-b870-25549c142ade,Jalə Fazil qızı Əliyeva,Jalə Fazil qızı Əliyeva,,,,Independent,83b82faf-9a1d-4bf8-bd05-5c7f10e6f679,92,Zərdab-Ucar seçim dairəsi,National Assembly,4,,,,,,Q2415493,
aa9d81ec-5d26-46c0-8919-0d0071a29d89,Kamilə Əli Ağa qızı Əliyeva,Kamilə Əli Ağa qızı Əliyeva,,,,Yeni Azərbaycan Partiyası,Yeni Azərbaycan Partiyası,111,Zaqatala-Balakən seçim dairəsi,National Assembly,4,,,,,,,
2ff1a630-45f4-4a8e-ac33-10d072e48ee7,Madər Ələsgər oğlu Musayev,Madər Ələsgər oğlu Musayev,,,,Independent,83b82faf-9a1d-4bf8-bd05-5c7f10e6f679,10,Binəqədi III seçim dairəsi,National Assembly,4,,,,,,Q2415493,
c714808f-cc73-495c-b367-f2e01c544b6d,Mahir Məhəmmədəli oğlu Aslanov,Mahir Məhəmmədəli oğlu Aslanov,,,,Independent,83b82faf-9a1d-4bf8-bd05-5c7f10e6f679,96,Goranboy-Naftalan seçim dairəsi,National Assembly,4,,,,,,Q2415493,
7b533af7-6141-48cd-bca6-579eceefb46b,Malik Əvəz oğlu Həsənov,Malik Əvəz oğlu Həsənov,,,,Yeni Azərbaycan Partiyası,Yeni Azərbaycan Partiyası,67,Cəlilabad şəhər seçim dairəsi,National Assembly,4,,,,,,,
be1bc578-095a-4343-b39e-8d289136b99b,Mehriban Arif qızı Əliyeva,Mehriban Arif qızı Əliyeva,,,,Yeni Azərbaycan Partiyası,Yeni Azərbaycan Partiyası,14,Xəzər II seçim dairəsi,National Assembly,4,,,,,,,
97f6ac1e-988f-4f65-bc3f-e4334d6e066b,Mirkazım Mirməhəmməd oğlu Kazımov,Mirkazım Mirməhəmməd oğlu Kazımov,,,,Yeni Azərbaycan Partiyası,Yeni Azərbaycan Partiyası,68,Cəlilabad qəsəbə seçim dairəsi,National Assembly,4,,,,,,,
8736afe0-5139-442c-9065-32b48d3981d0,Mixail Yuri oğlu Zabelin,Mixail Yuri oğlu Zabelin,,,,Yeni Azərbaycan Partiyası,Yeni Azərbaycan Partiyası,12,Qaradağ-Binəqədi-Yasamal seçim dairəsi,National Assembly,4,,,,,,,
5acc5104-70cc-49c3-a633-15efe2ba1872,Musa İsa oğlu Quliyev (Urud),Musa İsa oğlu Quliyev (Urud),,,,Yeni Azərbaycan Partiyası,Yeni Azərbaycan Partiyası,40,Kəpəz II seçim dairəsi (Gəncə şəhəri),National Assembly,4,,,,,,,
f45f9d24-d546-48d7-af15-684558471074,Muxtar Bahadur oğlu Babayev,Muxtar Bahadur oğlu Babayev,,,,Yeni Azərbaycan Partiyası,Yeni Azərbaycan Partiyası,43,Sumqayıt III seçim dairəsi,National Assembly,4,,,,,,,
69fcda92-a4e2-4b1a-8f92-2a09045bd008,Mübariz Qəhrəman oğlu Qurbanlı,Mübariz Qəhrəman oğlu Qurbanlı,,,,Independent,83b82faf-9a1d-4bf8-bd05-5c7f10e6f679,100,Şəmkir-Daşkəsən seçim dairəsi,National Assembly,4,,,,,,Q2415493,
54a670ae-26b2-44a8-8ceb-bb0199a067e3,Nazim Fərəc oğlu Fərəcov,Nazim Fərəc oğlu Fərəcov,,,,Yeni Azərbaycan Partiyası,Yeni Azərbaycan Partiyası,121,Laçın seçim dairəsi,National Assembly,4,,,,,,,
6ca0e892-f606-41ce-94d3-402f94cec9e9,Nizami Qulu oğlu Cəfərov,Nizami Qulu oğlu Cəfərov,,,,Yeni Azərbaycan Partiyası,Yeni Azərbaycan Partiyası,108,Ağstafa seçim dairəsi,National Assembly,4,,,,,,,
e0ec03af-90ff-4957-8d39-6e130bf036b9,Novruzəli Davud oğlu Aslanov,Novruzəli Davud oğlu Aslanov,,,,Independent,83b82faf-9a1d-4bf8-bd05-5c7f10e6f679,86,İsmayıllı seçim dairəsi,National Assembly,4,,,,,,Q2415493,
7eb33746-a49f-41d4-a72e-4e5efe15f575,Nəriman Əlibala oğlu Əliyev,Nəriman Əlibala oğlu Əliyev,,,,Yeni Azərbaycan Partiyası,Yeni Azərbaycan Partiyası,70,Masallı şəhər seçim dairəsi,National Assembly,4,,,,,,,
051a3a68-c30e-41e6-9abc-0b8cbdb50f52,Qüdrət Müzəffər oğlu Həsənquliyev,Qüdrət Müzəffər oğlu Həsənquliyev,,,,Bütöv Azərbaycan Xalq Cəbhəsi Partiyası,Bütöv Azərbaycan Xalq Cəbhəsi Partiyası,7,Ordubad-Culfa seçim dairəsi,National Assembly,4,,,,,,,
d8da5e7c-86a3-4a5c-8933-e5fc4eafb6e9,Qənirə Ələsgər qızı Paşayeva,Qənirə Ələsgər qızı Paşayeva,,,,Independent,83b82faf-9a1d-4bf8-bd05-5c7f10e6f679,105,Tovuz seçim dairəsi,National Assembly,4,,,,,,Q2415493,
f5590e88-e454-4cb8-bdca-a7a472c9dc00,Rafael Baba oğlu Hüseynov,Rafael Baba oğlu Hüseynov,,,,Independent,83b82faf-9a1d-4bf8-bd05-5c7f10e6f679,58,Hacıqabul-Kürdəmir seçim dairəsi,National Assembly,4,,,,,,Q2415493,
77f1e552-58de-4f15-bba0-046cbbff9947,Rafiq Musa oğlu Məmmədhəsənov,Rafiq Musa oğlu Məmmədhəsənov,,,,Yeni Azərbaycan Partiyası,Yeni Azərbaycan Partiyası,104,Gədəbəy-Tovuz seçim dairəsi,National Assembly,4,,,,,,,
0d99e7cd-4c33-402a-999a-ed5c623300f0,Rasim Nəsrəddin oğlu Musabəyov,Rasim Nəsrəddin oğlu Musabəyov,,,,Independent,83b82faf-9a1d-4bf8-bd05-5c7f10e6f679,18,Nərimanov-Nizami seçim dairəsi,National Assembly,4,,,,,,Q2415493,
29f71afa-6d83-4e5a-b7de-1c63b0bfe98c,Rauf Asif oğlu Əliyev,Rauf Asif oğlu Əliyev,,,,Yeni Azərbaycan Partiyası,Yeni Azərbaycan Partiyası,13,Xəzər I seçim dairəsi,National Assembly,4,,,,,,,
d16a1002-b39a-4d31-bda0-bd271039ec0d,Rövnəq İbrahim oğlu Abdullayev,Rövnəq İbrahim oğlu Abdullayev,,,,Yeni Azərbaycan Partiyası,Yeni Azərbaycan Partiyası,24,Nizami I seçim dairəsi,National Assembly,4,,,,,,,
91f76d13-5422-4c2f-8771-1eb91f1a0096,Rövşən Şükür oğlu Rzayev,Rövşən Şükür oğlu Rzayev,,,,Independent,83b82faf-9a1d-4bf8-bd05-5c7f10e6f679,101,Göygöl-Daşkəsən seçim dairəsi,National Assembly,4,,,,,,Q2415493,
8a722628-46e7-4e32-a769-7c6a1a853f55,Rüfət Atakişi oğlu Quliyev,Rüfət Atakişi oğlu Quliyev,,,,Independent,83b82faf-9a1d-4bf8-bd05-5c7f10e6f679,73,Lənkəran şəhər seçim dairəsi,National Assembly,4,,,,,,Q2415493,
c7491586-d76d-4ec7-89bd-ff68bf10dfd1,Rüstəm Gülabba oğlu Xəlilov,Rüstəm Gülabba oğlu Xəlilov,,,,Yeni Azərbaycan Partiyası,Yeni Azərbaycan Partiyası,64,Sabirabad II seçim dairəsi,National Assembly,4,,,,,,,
babea1f2-434a-4b30-96b1-aa6969af72d9,Rəbiyyət Nurullah qızı Aslanova,Rəbiyyət Nurullah qızı Aslanova,,,,Yeni Azərbaycan Partiyası,Yeni Azərbaycan Partiyası,109,Balakən seçim dairəsi,National Assembly,4,,,,,,,
31ddffc2-2252-4c45-a265-563ce8e5bf9a,Sabir Kamal oğlu Hacıyev,Sabir Kamal oğlu Hacıyev,,,,Vətəndaş Birliyi Partiyası,Vətəndaş Birliyi Partiyası,88,Göyçay seçim dairəsi,National Assembly,4,,,,,,,
aeb37bb4-40b8-4178-b534-922e5b6a504e,Sabir Xudu oğlu Rüstəmxanlı,Sabir Xudu oğlu Rüstəmxanlı,,,,Vətəndaş Həmrəyliyi Partiyası,Vətəndaş Həmrəyliyi Partiyası,72,Yardımlı-Masallı seçim dairəsi,National Assembly,4,,,,,,,
d8c69bde-66a9-4fc8-a0e9-d1a9c91e06b4,Sahib Eyvaz oğlu Alıyev,Sahib Eyvaz oğlu Alıyev,,,,Independent,83b82faf-9a1d-4bf8-bd05-5c7f10e6f679,95,Tərtər seçim dairəsi,National Assembly,4,,,,,,Q2415493,
18e29944-2e0f-457c-9a23-de51c217c32d,Sahibə Əli qızı Qafarova,Sahibə Əli qızı Qafarova,,,,Yeni Azərbaycan Partiyası,Yeni Azərbaycan Partiyası,98,Şəmkir şəhər seçim dairəsi,National Assembly,4,,,,,,,
657b5303-4b69-416c-b607-abcb4a473d7e,Sevinc Həbib qızı Fətəliyeva,Sevinc Həbib qızı Fətəliyeva,,,,Yeni Azərbaycan Partiyası,Yeni Azərbaycan Partiyası,30,Suraxanı I seçim dairəsi,National Assembly,4,,,,,,,
f663d391-8ba7-4542-ad11-023d6379dc05,Sevinc Əmirəhməd qızı Hüseynova,Sevinc Əmirəhməd qızı Hüseynova,,,,Yeni Azərbaycan Partiyası,Yeni Azərbaycan Partiyası,103,Gədəbəy seçim dairəsi,National Assembly,4,,,,,,,
b424c42b-131a-4751-a7f7-7472e5e6ce68,Siyavuş Dünyamalı oğlu Novruzov,Siyavuş Dünyamalı oğlu Novruzov,,,,Yeni Azərbaycan Partiyası,Yeni Azərbaycan Partiyası,5,Şahbuz-Babək seçim dairəsi,National Assembly,4,,,,,,,
1e46b468-065a-4ae4-aed4-ba0ca594108f,Sədaqət Süleyman qızı Vəliyeva,Sədaqət Süleyman qızı Vəliyeva,,,,Yeni Azərbaycan Partiyası,Yeni Azərbaycan Partiyası,25,Nizami II seçim dairəsi,National Assembly,4,,,,,,,
1fb268ae-6887-4d2c-9751-8cd0341dacad,Səməd İsmayıl oğlu Seyidov,Səməd İsmayıl oğlu Seyidov,,,,Yeni Azərbaycan Partiyası,Yeni Azərbaycan Partiyası,36,Xətai IV seçim dairəsi,National Assembly,4,,,,,,,
7d0a6c20-f8bc-4362-9a6b-28124bbfe2a8,Səttar Suliddin oğlu Mehbalıyev,Səttar Suliddin oğlu Mehbalıyev,,,,Independent,83b82faf-9a1d-4bf8-bd05-5c7f10e6f679,3,Babək-Kəngərli-Naxçıvan seçim dairəsi,National Assembly,4,,,,,,Q2415493,
06d6875e-64e8-423a-b0b3-d80b8c8fe0d6,Tahir Musa oğlu Rzayev,Tahir Musa oğlu Rzayev,,,,Yeni Azərbaycan Partiyası,Yeni Azərbaycan Partiyası,82,Ağcabədi seçim dairəsi,National Assembly,4,,,,,,,
12f2250d-6af8-4213-81a1-acbb4c489591,Tahir Süleyman oğlu Süleymanov,Tahir Süleyman oğlu Süleymanov,,,,Yeni Azərbaycan Partiyası,Yeni Azərbaycan Partiyası,54,Şabran-Siyəzən seçim dairəsi,National Assembly,4,,,,,,,
6bfbbb2d-11d5-4521-8610-46745487b78b,Vahid Qazməmməd oğlu Əhmədov,Vahid Qazməmməd oğlu Əhmədov,,,,Independent,83b82faf-9a1d-4bf8-bd05-5c7f10e6f679,52,Quba seçim dairəsi,National Assembly,4,,,,,,Q2415493,
6f0fd046-b283-4163-b717-5a79770f2eb0,Valeh Feyruz oğlu Ələsgərov,Valeh Feyruz oğlu Ələsgərov,,,,Independent,83b82faf-9a1d-4bf8-bd05-5c7f10e6f679,102,Samux-Şəmkir seçim dairəsi,National Assembly,4,,,,,,Q2415493,
29b154e9-35ee-4e1c-ac36-3d15eae0427a,Vasif Yusif oğlu Talıbov,Vasif Yusif oğlu Talıbov,,,,Yeni Azərbaycan Partiyası,Yeni Azərbaycan Partiyası,1,Şərur-Sədərək seçim dairəsi,National Assembly,4,,,,,,,
6d8b5c99-a62a-4973-bdf1-654cd599d05e,Xanhüseyn Hüseynağa oğlu Kazımlı,Xanhüseyn Hüseynağa oğlu Kazımlı,,,,Azərbaycan Sosial Rifah Partiyası,Azərbaycan Sosial Rifah Partiyası,66,Biləsuvar seçim dairəsi,National Assembly,4,,,,,,,
638795b5-3fc9-4ca5-b735-56789a5f2f5f,Xanlar Nuru oğlu Fətiyev,Xanlar Nuru oğlu Fətiyev,,,,Yeni Azərbaycan Partiyası,Yeni Azərbaycan Partiyası,39,Kəpəz I seçim dairəsi (Gəncə şəhəri),National Assembly,4,,,,,,,
7ae5761b-1639-4ae4-bbc9-3584048b1f65,Yaqub Mikayıl oğlu Mahmudov,Yaqub Mikayıl oğlu Mahmudov,,,,Yeni Azərbaycan Partiyası,Yeni Azərbaycan Partiyası,113,Şəki şəhər seçim dairəsi,National Assembly,4,,,,,,,
a6eb92d4-6760-4bba-90ef-2946d74db807,Yevda Sasun oğlu Abramov,Yevda Sasun oğlu Abramov,,,,Yeni Azərbaycan Partiyası,Yeni Azərbaycan Partiyası,53,Quba-Qusar seçim dairəsi,National Assembly,4,,,,,,,
b5f8bfed-024d-4405-b9a7-fad79ab408c3,Zeynəb Yəhya qızı Xanlarova,Zeynəb Yəhya qızı Xanlarova,,,,Independent,83b82faf-9a1d-4bf8-bd05-5c7f10e6f679,50,Qobustan-Xızı-Sumqayıt seçim dairəsi,National Assembly,4,,,,,,Q2415493,
ef04a335-2cb2-4e9e-894b-516001aaa2a1,Ziyad Əliabbas oğlu Səmədzadə,Ziyad Əliabbas oğlu Səmədzadə,,,,Independent,83b82faf-9a1d-4bf8-bd05-5c7f10e6f679,23,Nəsimi-Səbail seçim dairəsi,National Assembly,4,,,,,,Q2415493,
dfaf519f-17b8-4fdf-84f9-67d995be8794,Ziyafət Abbas oğlu Əsgərov,Ziyafət Abbas oğlu Əsgərov,,,,Yeni Azərbaycan Partiyası,Yeni Azərbaycan Partiyası,76,Lənkəran-Astara seçim dairəsi,National Assembly,4,,,,,,,
6210ae10-c1f0-4a8c-8be6-e33289a665f6,Çingiz Aşralı oğlu Qənizadə,Çingiz Aşralı oğlu Qənizadə,,,,Independent,83b82faf-9a1d-4bf8-bd05-5c7f10e6f679,80,İmişli-Beyləqan seçim dairəsi,National Assembly,4,,,,,,Q2415493,
6db7317b-5c6c-48e5-be13-6d029f8c2b01,İlham Kazım oğlu Məmmədov,İlham Kazım oğlu Məmmədov,,,,Yeni Azərbaycan Partiyası,Yeni Azərbaycan Partiyası,48,Yevlax seçim dairəsi,National Assembly,4,,,,,,,
d6f67d94-5209-4d8b-96ad-2c35442894bd,İlham Əlisəftər oğlu Əliyev,İlham Əlisəftər oğlu Əliyev,,,,Yeni Azərbaycan Partiyası,Yeni Azərbaycan Partiyası,56,Xaçmaz qəsəbə seçim dairəsi,National Assembly,4,,,,,,,
ee9381ba-380c-4044-a60a-46f606caf071,İmamverdi İbiş oğlu İsmayılov,İmamverdi İbiş oğlu İsmayılov,,,,Yeni Azərbaycan Partiyası,Yeni Azərbaycan Partiyası,125,Zəngilan-Qubadlı seçim dairəsi,National Assembly,4,,,,,,,
b0995650-b4dd-4793-8dad-9de5c5683486,İqbal Nəriman oğlu Məmmədov,İqbal Nəriman oğlu Məmmədov,,,,Yeni Azərbaycan Partiyası,Yeni Azərbaycan Partiyası,78,Lerik seçim dairəsi,National Assembly,4,,,,,,,
d90c612e-c749-4b02-b58f-3511ac473ecd,İsa Əkbər oğlu Həbibbəyli,İsa Əkbər oğlu Həbibbəyli,,,,Yeni Azərbaycan Partiyası,Yeni Azərbaycan Partiyası,2,Şərur seçim dairəsi,National Assembly,4,,,,,,,
f9840b4f-561b-43a7-84c8-fa6e257eecf6,Əhliman Tapdıq oğlu Əmiraslanov,Əhliman Tapdıq oğlu Əmiraslanov,,,,Yeni Azərbaycan Partiyası,Yeni Azərbaycan Partiyası,65,Saatlı-Sabirabad-Kürdəmir seçim dairəsi,National Assembly,4,,,,,,,
2eb2cd56-e295-4181-993d-042f66b143b7,Əli Cavad oğlu Əhmədov,Əli Cavad oğlu Əhmədov,,,,Yeni Azərbaycan Partiyası,Yeni Azərbaycan Partiyası,19,Nərimanov I seçim dairəsi,National Assembly,4,,,,,,,
186af8dc-2dcf-4fab-8813-6a142daa2dc1,Əli Məhəmməd oğlu Hüseynov,Əli Məhəmməd oğlu Hüseynov,,,,Yeni Azərbaycan Partiyası,Yeni Azərbaycan Partiyası,49,Yevlax-Mingəçevir seçim dairəsi,National Assembly,4,,,,,,,
48281730-2efd-4251-80db-7ac3db6ba7e8,Əli Əhməd oğlu Məsimli,Əli Əhməd oğlu Məsimli,,,,Independent,83b82faf-9a1d-4bf8-bd05-5c7f10e6f679,114,Şəki qəsəbə I seçim dairəsi,National Assembly,4,,,,,,Q2415493,
679f63b1-20e2-489c-9321-f548beaf14b4,Əliağa İzzət oğlu Hüseynov,Əliağa İzzət oğlu Hüseynov,,,,Independent,83b82faf-9a1d-4bf8-bd05-5c7f10e6f679,59,Salyan seçim dairəsi,National Assembly,4,,,,,,Q2415493,
d7bd09a5-3fd7-4be3-bc7d-3fda730d4430,Əsabil Qarakişi oğlu Qasımov,Əsabil Qarakişi oğlu Qasımov,,,,Yeni Azərbaycan Partiyası,Yeni Azərbaycan Partiyası,79,İmişli seçim dairəsi,National Assembly,4,,,,,,,
