id,name,sort_name,email,twitter,facebook,group,group_id,area_id,area,chamber,term,start_date,end_date,image,gender,wikidata,wikidata_group,wikidata_area
8e103aef-4da5-4b09-a868-dfbc7a727d4b,Adil Abış oğlu Əliyev,Adil Abış oğlu Əliyev,,,,Independent,IND,20,Nərimanov II seçim dairəsi,National Assembly,4,,,,,,Q327591,
e239e9c9-1497-47d9-a40f-05eafd82b977,Aqil Məhəmməd oğlu Abbas,Aqil Məhəmməd oğlu Abbas,,,,Independent,IND,83,Ağcabədi-Füzuli seçim dairəsi,National Assembly,4,,,,,,Q327591,
b267f5e7-340a-42f7-8710-ec99ced4a37b,Aqiyə Həbib qızı Naxçıvanlı,Aqiyə Həbib qızı Naxçıvanlı,,,,Yeni Azərbaycan Partiyası,Yeni Azərbaycan Partiyası,117,Oğuz-Qəbələ seçim dairəsi,National Assembly,4,,,,,,,
758c38f4-c600-44f9-9313-88cebb087a84,Arif Qafar oğlu Rəhimzadə,Arif Qafar oğlu Rəhimzadə,,,,Yeni Azərbaycan Partiyası,Yeni Azərbaycan Partiyası,61,Neftçala seçim dairəsi,National Assembly,4,,,,,,,
5e2820b3-1ddb-43c3-9e72-4c9e7b751753,Asim Nazim oğlu Mollazadə,Asim Nazim oğlu Mollazadə,,,,Azərbaycan Demokratik İslahatlar Partiyası,Azərbaycan Demokratik İslahatlar Partiyası,22,Nəsimi II seçim dairəsi,National Assembly,4,,,,,,,
c6e46a03-2544-4423-97cb-3411c808801a,Aslan Məmmədhüseyn oğlu Cəfərov,Aslan Məmmədhüseyn oğlu Cəfərov,,,,Yeni Azərbaycan Partiyası,Yeni Azərbaycan Partiyası,77,Astara seçim dairəsi,National Assembly,4,,,,,,,
8d83e4ac-dbee-4d4c-aed3-b3cab988044d,Astan Nuşrəvan oğlu Şahverdiyev,Astan Nuşrəvan oğlu Şahverdiyev,,,,Yeni Azərbaycan Partiyası,Yeni Azərbaycan Partiyası,120,Cəbrayıl-Qubadlı seçim dairəsi,National Assembly,4,,,,,,,
1cc4d39e-6f23-4207-9509-1816b4544fde,Aydın Böyükkişi oğlu Mirzəzadə,Aydın Böyükkişi oğlu Mirzəzadə,,,,Yeni Azərbaycan Partiyası,Yeni Azərbaycan Partiyası,47,Mingəçevir seçim dairəsi,National Assembly,4,,,,,,,
d099c8ba-22ce-4814-b2a4-0c6f42898c78,Azər Camal oğlu Badamov,Azər Camal oğlu Badamov,,,,Yeni Azərbaycan Partiyası,Yeni Azərbaycan Partiyası,51,Qusar seçim dairəsi,National Assembly,4,,,,,,,
433bdcda-bf5d-4568-a78b-203c3ae8fbb0,Azər Şəmşid oğlu Kərimli,Azər Şəmşid oğlu Kərimli,,,,Independent,IND,112,Qax seçim dairəsi,National Assembly,4,,,,,,Q327591,
f461585c-d6b4-4a6b-99b4-d51c81c726b3,Ağacan Qulam oğlu Abıyev,Ağacan Qulam oğlu Abıyev,,,,Yeni Azərbaycan Partiyası,Yeni Azərbaycan Partiyası,32,Suraxanı III seçim dairəsi,National Assembly,4,,,,,,,
a6164edf-9cf0-4905-aa30-566bb11ea1ab,Bahar Əvəz qızı Muradov,Bahar Əvəz qızı Muradov,,,,Yeni Azərbaycan Partiyası,Yeni Azərbaycan Partiyası,84,Füzuli seçim dairəsi,National Assembly,4,,,,,,,
743dad74-da45-4221-b523-db21bb874f6f,Bəxtiyar Həmzə oğlu Əliyev,Bəxtiyar Həmzə oğlu Əliyev,,,,Independent,IND,118,Ağdam şəhər seçim dairəsi,National Assembly,4,,,,,,Q327591,
6149d062-406d-459c-af34-6418637bf5a3,Bəxtiyar Yusif oğlu Sadıqov,Bəxtiyar Yusif oğlu Sadıqov,,,,Yeni Azərbaycan Partiyası,Yeni Azərbaycan Partiyası,119,Ağdam qəsəbə seçim dairəsi,National Assembly,4,,,,,,,
c2eb1615-f24a-4af1-8b43-a3be0af73ed5,Cavanşir Hümmət oğlu Paşazadə,Cavanşir Hümmət oğlu Paşazadə,,,,Yeni Azərbaycan Partiyası,Yeni Azərbaycan Partiyası,75,Lənkəran-Masallı seçim dairəsi,National Assembly,4,,,,,,,
acb89dd0-f365-4831-97fe-3f87250dcc9f,Cavanşir Əyyub oğlu Feyziyev,Cavanşir Əyyub oğlu Feyziyev,,,,Independent,IND,115,Şəki qəsəbə II seçim dairəsi,National Assembly,4,,,,,,Q327591,
8538f4e9-6c46-4392-b886-7fddba693b45,Cavid Qənbər oğlu Qurbanov,Cavid Qənbər oğlu Qurbanov,,,,Yeni Azərbaycan Partiyası,Yeni Azərbaycan Partiyası,123,Kəlbəcər seçim dairəsi,National Assembly,4,,,,,,,
f9dc2f9e-79c1-46a4-a96b-c9f1cf257add,Ceyhun Yunis oğlu Osmanlı,Ceyhun Yunis oğlu Osmanlı,,,,Independent,IND,63,Sabirabad I seçim dairəsi,National Assembly,4,,,,,,Q327591,
f3342a00-88ae-4adc-8267-9de600712e28,Cəlal Əlirza oğlu Əliyev,Cəlal Əlirza oğlu Əliyev,,,,Yeni Azərbaycan Partiyası,Yeni Azərbaycan Partiyası,62,Saatlı seçim dairəsi,National Assembly,4,,,,,,,
c4d3a465-2c87-4b0e-ac5b-7ceca6e39c94,Eldar Allahyar oğlu Quliyev,Eldar Allahyar oğlu Quliyev,,,,Independent,IND,28,Sabunçu III seçim dairəsi,National Assembly,4,,,,,,Q327591,
cab97e56-fa6e-4504-b9b9-79c5df918311,Eldar Rza oğlu İbrahimov,Eldar Rza oğlu İbrahimov,,,,Yeni Azərbaycan Partiyası,Yeni Azərbaycan Partiyası,4,Naxçıvan şəhər seçim dairəsi,National Assembly,4,,,,,,,
e55440ba-dcb6-4080-84cc-79e5dc1d68ef,Elman Camal oğlu Məmmədov,Elman Camal oğlu Məmmədov,,,,Yeni Azərbaycan Partiyası,Yeni Azərbaycan Partiyası,124,Şuşa-Ağdam-Xocalı-Xocavənd seçim dairəsi,National Assembly,4,,,,,,,
6823b430-30e8-422f-93f4-616a4f627c81,Elmira Hüseyn qızı Axundova,Elmira Hüseyn qızı Axundova,,,,Independent,IND,71,Masallı qəsəbə seçim dairəsi,National Assembly,4,,,,,,Q327591,
c55ff2d7-9805-4d5a-b17c-5079fd2025cb,Elxan Sirac oğlu Süleymanov,Elxan Sirac oğlu Süleymanov,,,,Independent,IND,85,Şamaxı seçim dairəsi,National Assembly,4,,,,,,Q327591,
9cbc2920-999a-4d0f-af2a-9e0b9b078597,Fazil Qəzənfər oğlu Mustafa,Fazil Qəzənfər oğlu Mustafa,,,,Böyük Quruluş Partiyası,Böyük Quruluş Partiyası,26,Sabunçu I seçim dairəsi,National Assembly,4,,,,,,,
ef725fc7-50dc-48a8-aa68-374f895463ac,Flora Qasım qızı Qasımova,Flora Qasım qızı Qasımova,,,,Independent,IND,122,Xankəndi seçim dairəsi,National Assembly,4,,,,,,Q327591,
1a1020a9-6c95-4525-9237-612d2396ef89,Fərəc İbrahim oğlu Quliyev,Fərəc İbrahim oğlu Quliyev,,,,Milli Dirçəliş Hərəkatı Partiyası,Milli Dirçəliş Hərəkatı Partiyası,31,Suraxanı II seçim dairəsi,National Assembly,4,,,,,,,
213a5a5a-d7b0-42aa-989b-e89ccf755ba6,Fəttah Səməd oğlu Heydərov,Fəttah Səməd oğlu Heydərov,,,,Independent,IND,116,Qəbələ seçim dairəsi,National Assembly,4,,,,,,Q327591,
3157be40-13c6-41da-97c6-50f4f1e9ba78,Fəzail Feyruz oğlu İbrahimli,Fəzail Feyruz oğlu İbrahimli,,,,Vətəndaş Həmrəyliyi Partiyası,Vətəndaş Həmrəyliyi Partiyası,69,Cəlilabad-Masallı-Biləsuvar seçim dairəsi,National Assembly,4,,,,,,,
09ea1102-fd89-487a-8cf2-04db776484fa,Fəzail Rəhim oğlu Ağamalı,Fəzail Rəhim oğlu Ağamalı,,,,Independent,IND,60,Salyan-Neftçala seçim dairəsi,National Assembly,4,,,,,,Q327591,
ea6f54f2-4d97-454e-ad03-063604afdb00,Hacı Hacıbaba oğlu Salayev,Hacı Hacıbaba oğlu Salayev,,,,Independent,IND,44,Sumqayıt-Abşeron seçim dairəsi,National Assembly,4,,,,,,Q327591,
2e123796-c28c-4666-a2a0-ae9f6147b42b,Hadı Musa oğlu Rəcəbli,Hadı Musa oğlu Rəcəbli,,,,Yeni Azərbaycan Partiyası,Yeni Azərbaycan Partiyası,74,Lənkəran qəsəbə seçim dairəsi,National Assembly,4,,,,,,,
84990ebc-3a42-45f4-ae01-ac8de5ecef1a,Hikmət İsmayıl oğlu Atayev,Hikmət İsmayıl oğlu Atayev,,,,Yeni Azərbaycan Partiyası,Yeni Azərbaycan Partiyası,110,Zaqatala seçim dairəsi,National Assembly,4,,,,,,,
fb6ce681-4d7f-48c6-a59d-9c2042c21f72,Hüseynbala Fazil oğlu Mirələmov,Hüseynbala Fazil oğlu Mirələmov,,,,Yeni Azərbaycan Partiyası,Yeni Azərbaycan Partiyası,33,Xətai I seçim dairəsi,National Assembly,4,,,,,,,
09143612-587c-44f9-9cff-370bf16077b4,Jalə Fazil qızı Əliyeva,Jalə Fazil qızı Əliyeva,,,,Independent,IND,92,Zərdab-Ucar seçim dairəsi,National Assembly,4,,,,,,Q327591,
01db8d5e-34a3-4f3d-8c2f-3e9da54867fc,Kamilə Əli Ağa qızı Əliyeva,Kamilə Əli Ağa qızı Əliyeva,,,,Yeni Azərbaycan Partiyası,Yeni Azərbaycan Partiyası,111,Zaqatala-Balakən seçim dairəsi,National Assembly,4,,,,,,,
393a4521-d555-4329-9a6d-4f4688d06cb5,Madər Ələsgər oğlu Musayev,Madər Ələsgər oğlu Musayev,,,,Independent,IND,10,Binəqədi III seçim dairəsi,National Assembly,4,,,,,,Q327591,
b0778cc3-5d39-4258-a477-433b86dcb04f,Mahir Məhəmmədəli oğlu Aslanov,Mahir Məhəmmədəli oğlu Aslanov,,,,Independent,IND,96,Goranboy-Naftalan seçim dairəsi,National Assembly,4,,,,,,Q327591,
3304d5f2-67ce-466d-a2f1-43be8448e5f9,Malik Əvəz oğlu Həsənov,Malik Əvəz oğlu Həsənov,,,,Yeni Azərbaycan Partiyası,Yeni Azərbaycan Partiyası,67,Cəlilabad şəhər seçim dairəsi,National Assembly,4,,,,,,,
3dffe4bf-17c8-45aa-ba3a-8cc4668bee97,Mehriban Arif qızı Əliyeva,Mehriban Arif qızı Əliyeva,,,,Yeni Azərbaycan Partiyası,Yeni Azərbaycan Partiyası,14,Xəzər II seçim dairəsi,National Assembly,4,,,,,,,
f179fe9b-2c0e-4ecf-885a-8aaf19acad23,Mirkazım Mirməhəmməd oğlu Kazımov,Mirkazım Mirməhəmməd oğlu Kazımov,,,,Yeni Azərbaycan Partiyası,Yeni Azərbaycan Partiyası,68,Cəlilabad qəsəbə seçim dairəsi,National Assembly,4,,,,,,,
d2b25a28-9329-480e-a0cf-7f8d8b58b72f,Mixail Yuri oğlu Zabelin,Mixail Yuri oğlu Zabelin,,,,Yeni Azərbaycan Partiyası,Yeni Azərbaycan Partiyası,12,Qaradağ-Binəqədi-Yasamal seçim dairəsi,National Assembly,4,,,,,,,
b9f72536-0a39-470b-89fe-345f26072be7,Musa İsa oğlu Quliyev (Urud),Musa İsa oğlu Quliyev (Urud),,,,Yeni Azərbaycan Partiyası,Yeni Azərbaycan Partiyası,40,Kəpəz II seçim dairəsi (Gəncə şəhəri),National Assembly,4,,,,,,,
e4785217-4c72-49fa-99bd-87bf47ad9aa1,Muxtar Bahadur oğlu Babayev,Muxtar Bahadur oğlu Babayev,,,,Yeni Azərbaycan Partiyası,Yeni Azərbaycan Partiyası,43,Sumqayıt III seçim dairəsi,National Assembly,4,,,,,,,
680e7b66-1a84-4aa0-aeea-2a4d800c1738,Mübariz Qəhrəman oğlu Qurbanlı,Mübariz Qəhrəman oğlu Qurbanlı,,,,Independent,IND,100,Şəmkir-Daşkəsən seçim dairəsi,National Assembly,4,,,,,,Q327591,
bff24372-04a8-4b61-8252-c4da6335bbb2,Nazim Fərəc oğlu Fərəcov,Nazim Fərəc oğlu Fərəcov,,,,Yeni Azərbaycan Partiyası,Yeni Azərbaycan Partiyası,121,Laçın seçim dairəsi,National Assembly,4,,,,,,,
d039148f-0a2a-4364-b5df-99588be428f3,Nizami Qulu oğlu Cəfərov,Nizami Qulu oğlu Cəfərov,,,,Yeni Azərbaycan Partiyası,Yeni Azərbaycan Partiyası,108,Ağstafa seçim dairəsi,National Assembly,4,,,,,,,
14f4dd49-01ed-4edc-b7a9-3750afc609ac,Novruzəli Davud oğlu Aslanov,Novruzəli Davud oğlu Aslanov,,,,Independent,IND,86,İsmayıllı seçim dairəsi,National Assembly,4,,,,,,Q327591,
518c6e1f-db23-427a-a910-6479f2c02190,Nəriman Əlibala oğlu Əliyev,Nəriman Əlibala oğlu Əliyev,,,,Yeni Azərbaycan Partiyası,Yeni Azərbaycan Partiyası,70,Masallı şəhər seçim dairəsi,National Assembly,4,,,,,,,
00e6fc40-162a-499f-9ab9-f1622b8c1a88,Qüdrət Müzəffər oğlu Həsənquliyev,Qüdrət Müzəffər oğlu Həsənquliyev,,,,Bütöv Azərbaycan Xalq Cəbhəsi Partiyası,Bütöv Azərbaycan Xalq Cəbhəsi Partiyası,7,Ordubad-Culfa seçim dairəsi,National Assembly,4,,,,,,,
af7f3abb-f15a-434f-95f3-6bd5d07c9788,Qənirə Ələsgər qızı Paşayeva,Qənirə Ələsgər qızı Paşayeva,,,,Independent,IND,105,Tovuz seçim dairəsi,National Assembly,4,,,,,,Q327591,
0bc46cb3-de12-4ff9-b477-b162ff82cc1f,Rafael Baba oğlu Hüseynov,Rafael Baba oğlu Hüseynov,,,,Independent,IND,58,Hacıqabul-Kürdəmir seçim dairəsi,National Assembly,4,,,,,,Q327591,
c34f35f4-6cba-4102-98d3-5b12e4cb1337,Rafiq Musa oğlu Məmmədhəsənov,Rafiq Musa oğlu Məmmədhəsənov,,,,Yeni Azərbaycan Partiyası,Yeni Azərbaycan Partiyası,104,Gədəbəy-Tovuz seçim dairəsi,National Assembly,4,,,,,,,
6fd2002a-129b-40aa-bda3-a07f72331ba4,Rasim Nəsrəddin oğlu Musabəyov,Rasim Nəsrəddin oğlu Musabəyov,,,,Independent,IND,18,Nərimanov-Nizami seçim dairəsi,National Assembly,4,,,,,,Q327591,
d36fe616-881c-4688-af84-cfa3e682a8c5,Rauf Asif oğlu Əliyev,Rauf Asif oğlu Əliyev,,,,Yeni Azərbaycan Partiyası,Yeni Azərbaycan Partiyası,13,Xəzər I seçim dairəsi,National Assembly,4,,,,,,,
f4b0c232-abc9-4944-b6a9-c0d179f8116d,Rövnəq İbrahim oğlu Abdullayev,Rövnəq İbrahim oğlu Abdullayev,,,,Yeni Azərbaycan Partiyası,Yeni Azərbaycan Partiyası,24,Nizami I seçim dairəsi,National Assembly,4,,,,,,,
ae0dc9f8-21f2-44f0-ae3c-d2edad907d53,Rövşən Şükür oğlu Rzayev,Rövşən Şükür oğlu Rzayev,,,,Independent,IND,101,Göygöl-Daşkəsən seçim dairəsi,National Assembly,4,,,,,,Q327591,
f1a3bbf7-91b6-49d5-b636-8c1bd1f7ebde,Rüfət Atakişi oğlu Quliyev,Rüfət Atakişi oğlu Quliyev,,,,Independent,IND,73,Lənkəran şəhər seçim dairəsi,National Assembly,4,,,,,,Q327591,
2eb9ba36-1c96-430f-8264-5836bb2398ef,Rüstəm Gülabba oğlu Xəlilov,Rüstəm Gülabba oğlu Xəlilov,,,,Yeni Azərbaycan Partiyası,Yeni Azərbaycan Partiyası,64,Sabirabad II seçim dairəsi,National Assembly,4,,,,,,,
764d02e9-f2af-432f-a5d9-fe790af0b141,Rəbiyyət Nurullah qızı Aslanova,Rəbiyyət Nurullah qızı Aslanova,,,,Yeni Azərbaycan Partiyası,Yeni Azərbaycan Partiyası,109,Balakən seçim dairəsi,National Assembly,4,,,,,,,
a4b93df5-0fdb-48ab-ad3b-1678ddc4928b,Sabir Kamal oğlu Hacıyev,Sabir Kamal oğlu Hacıyev,,,,Vətəndaş Birliyi Partiyası,Vətəndaş Birliyi Partiyası,88,Göyçay seçim dairəsi,National Assembly,4,,,,,,,
6996b63a-36d0-4eca-a693-6dc68739c04e,Sabir Xudu oğlu Rüstəmxanlı,Sabir Xudu oğlu Rüstəmxanlı,,,,Vətəndaş Həmrəyliyi Partiyası,Vətəndaş Həmrəyliyi Partiyası,72,Yardımlı-Masallı seçim dairəsi,National Assembly,4,,,,,,,
60af4f68-1fb2-4499-b5ca-fb4b41682a28,Sahib Eyvaz oğlu Alıyev,Sahib Eyvaz oğlu Alıyev,,,,Independent,IND,95,Tərtər seçim dairəsi,National Assembly,4,,,,,,Q327591,
dbdf95cb-33d5-4473-af3a-d64db30a0b57,Sahibə Əli qızı Qafarova,Sahibə Əli qızı Qafarova,,,,Yeni Azərbaycan Partiyası,Yeni Azərbaycan Partiyası,98,Şəmkir şəhər seçim dairəsi,National Assembly,4,,,,,,,
b86354ea-920d-45c0-9542-6da4d4ce821a,Sevinc Həbib qızı Fətəliyeva,Sevinc Həbib qızı Fətəliyeva,,,,Yeni Azərbaycan Partiyası,Yeni Azərbaycan Partiyası,30,Suraxanı I seçim dairəsi,National Assembly,4,,,,,,,
44475070-10ca-42c3-9e10-2160f773a34e,Sevinc Əmirəhməd qızı Hüseynova,Sevinc Əmirəhməd qızı Hüseynova,,,,Yeni Azərbaycan Partiyası,Yeni Azərbaycan Partiyası,103,Gədəbəy seçim dairəsi,National Assembly,4,,,,,,,
6724ca2b-9475-491c-9d90-590cfd961aa1,Siyavuş Dünyamalı oğlu Novruzov,Siyavuş Dünyamalı oğlu Novruzov,,,,Yeni Azərbaycan Partiyası,Yeni Azərbaycan Partiyası,5,Şahbuz-Babək seçim dairəsi,National Assembly,4,,,,,,,
e2762cee-8b7a-40a8-9a63-a16d9e872a5f,Sədaqət Süleyman qızı Vəliyeva,Sədaqət Süleyman qızı Vəliyeva,,,,Yeni Azərbaycan Partiyası,Yeni Azərbaycan Partiyası,25,Nizami II seçim dairəsi,National Assembly,4,,,,,,,
b8223d45-94e1-4cca-bb1c-48d9d1362d9b,Səməd İsmayıl oğlu Seyidov,Səməd İsmayıl oğlu Seyidov,,,,Yeni Azərbaycan Partiyası,Yeni Azərbaycan Partiyası,36,Xətai IV seçim dairəsi,National Assembly,4,,,,,,,
9fb28a91-05dc-49fe-87f2-1b6b42f2f9cf,Səttar Suliddin oğlu Mehbalıyev,Səttar Suliddin oğlu Mehbalıyev,,,,Independent,IND,3,Babək-Kəngərli-Naxçıvan seçim dairəsi,National Assembly,4,,,,,,Q327591,
00706e63-70a6-4d0f-8af5-84a243d378fa,Tahir Musa oğlu Rzayev,Tahir Musa oğlu Rzayev,,,,Yeni Azərbaycan Partiyası,Yeni Azərbaycan Partiyası,82,Ağcabədi seçim dairəsi,National Assembly,4,,,,,,,
f033f353-2cf8-4c73-a3eb-f51859786b51,Tahir Süleyman oğlu Süleymanov,Tahir Süleyman oğlu Süleymanov,,,,Yeni Azərbaycan Partiyası,Yeni Azərbaycan Partiyası,54,Şabran-Siyəzən seçim dairəsi,National Assembly,4,,,,,,,
c6e60b62-fc05-46cd-a971-f704a140667e,Vahid Qazməmməd oğlu Əhmədov,Vahid Qazməmməd oğlu Əhmədov,,,,Independent,IND,52,Quba seçim dairəsi,National Assembly,4,,,,,,Q327591,
83276e53-3b9c-44c2-b534-867e7cfb5071,Valeh Feyruz oğlu Ələsgərov,Valeh Feyruz oğlu Ələsgərov,,,,Independent,IND,102,Samux-Şəmkir seçim dairəsi,National Assembly,4,,,,,,Q327591,
a90df423-9ed3-40d6-9256-6b8befb41f7a,Vasif Yusif oğlu Talıbov,Vasif Yusif oğlu Talıbov,,,,Yeni Azərbaycan Partiyası,Yeni Azərbaycan Partiyası,1,Şərur-Sədərək seçim dairəsi,National Assembly,4,,,,,,,
c279e60e-3cfb-4f43-ac4f-d72d382695a4,Xanhüseyn Hüseynağa oğlu Kazımlı,Xanhüseyn Hüseynağa oğlu Kazımlı,,,,Azərbaycan Sosial Rifah Partiyası,Azərbaycan Sosial Rifah Partiyası,66,Biləsuvar seçim dairəsi,National Assembly,4,,,,,,,
6107b286-b051-419d-aba3-0e9abc026098,Xanlar Nuru oğlu Fətiyev,Xanlar Nuru oğlu Fətiyev,,,,Yeni Azərbaycan Partiyası,Yeni Azərbaycan Partiyası,39,Kəpəz I seçim dairəsi (Gəncə şəhəri),National Assembly,4,,,,,,,
28824b1c-32d1-4515-9432-e558a4985ca9,Yaqub Mikayıl oğlu Mahmudov,Yaqub Mikayıl oğlu Mahmudov,,,,Yeni Azərbaycan Partiyası,Yeni Azərbaycan Partiyası,113,Şəki şəhər seçim dairəsi,National Assembly,4,,,,,,,
5499b964-f61f-4ed9-b50e-5ce84e4e52ae,Yevda Sasun oğlu Abramov,Yevda Sasun oğlu Abramov,,,,Yeni Azərbaycan Partiyası,Yeni Azərbaycan Partiyası,53,Quba-Qusar seçim dairəsi,National Assembly,4,,,,,,,
bbb8aba0-b495-4dfa-9d93-48532fdf67b2,Zeynəb Yəhya qızı Xanlarova,Zeynəb Yəhya qızı Xanlarova,,,,Independent,IND,50,Qobustan-Xızı-Sumqayıt seçim dairəsi,National Assembly,4,,,,,,Q327591,
5c8b9673-0758-4b80-9ddc-566e57b7b591,Ziyad Əliabbas oğlu Səmədzadə,Ziyad Əliabbas oğlu Səmədzadə,,,,Independent,IND,23,Nəsimi-Səbail seçim dairəsi,National Assembly,4,,,,,,Q327591,
ee61929b-6fcb-40d0-8465-6d7a472b5df5,Ziyafət Abbas oğlu Əsgərov,Ziyafət Abbas oğlu Əsgərov,,,,Yeni Azərbaycan Partiyası,Yeni Azərbaycan Partiyası,76,Lənkəran-Astara seçim dairəsi,National Assembly,4,,,,,,,
b741bd97-e000-4865-9424-e61c37ec2faa,Çingiz Aşralı oğlu Qənizadə,Çingiz Aşralı oğlu Qənizadə,,,,Independent,IND,80,İmişli-Beyləqan seçim dairəsi,National Assembly,4,,,,,,Q327591,
dd63fd56-51ce-4775-8865-cbd4fd5ca3c0,İlham Kazım oğlu Məmmədov,İlham Kazım oğlu Məmmədov,,,,Yeni Azərbaycan Partiyası,Yeni Azərbaycan Partiyası,48,Yevlax seçim dairəsi,National Assembly,4,,,,,,,
a030a5a5-e938-4651-828d-45bd85860386,İlham Əlisəftər oğlu Əliyev,İlham Əlisəftər oğlu Əliyev,,,,Yeni Azərbaycan Partiyası,Yeni Azərbaycan Partiyası,56,Xaçmaz qəsəbə seçim dairəsi,National Assembly,4,,,,,,,
d7df2578-c04b-4d25-b8d4-cc1dcd51c35b,İmamverdi İbiş oğlu İsmayılov,İmamverdi İbiş oğlu İsmayılov,,,,Yeni Azərbaycan Partiyası,Yeni Azərbaycan Partiyası,125,Zəngilan-Qubadlı seçim dairəsi,National Assembly,4,,,,,,,
0d93530e-528f-4e0b-91bb-504725d3c40a,İqbal Nəriman oğlu Məmmədov,İqbal Nəriman oğlu Məmmədov,,,,Yeni Azərbaycan Partiyası,Yeni Azərbaycan Partiyası,78,Lerik seçim dairəsi,National Assembly,4,,,,,,,
ac688b5b-ad46-45ce-bb7a-042bff9187c4,İsa Əkbər oğlu Həbibbəyli,İsa Əkbər oğlu Həbibbəyli,,,,Yeni Azərbaycan Partiyası,Yeni Azərbaycan Partiyası,2,Şərur seçim dairəsi,National Assembly,4,,,,,,,
3537a53c-afd6-4a7b-9854-58ec2515f988,Əhliman Tapdıq oğlu Əmiraslanov,Əhliman Tapdıq oğlu Əmiraslanov,,,,Yeni Azərbaycan Partiyası,Yeni Azərbaycan Partiyası,65,Saatlı-Sabirabad-Kürdəmir seçim dairəsi,National Assembly,4,,,,,,,
d6cc2f2a-7b8c-4a49-a148-66f0a033ba57,Əli Cavad oğlu Əhmədov,Əli Cavad oğlu Əhmədov,,,,Yeni Azərbaycan Partiyası,Yeni Azərbaycan Partiyası,19,Nərimanov I seçim dairəsi,National Assembly,4,,,,,,,
7e447109-9868-4824-ab41-cedab7de1dd1,Əli Məhəmməd oğlu Hüseynov,Əli Məhəmməd oğlu Hüseynov,,,,Yeni Azərbaycan Partiyası,Yeni Azərbaycan Partiyası,49,Yevlax-Mingəçevir seçim dairəsi,National Assembly,4,,,,,,,
dc50e07c-0ef7-475f-84e4-466dd6ea52f9,Əli Əhməd oğlu Məsimli,Əli Əhməd oğlu Məsimli,,,,Independent,IND,114,Şəki qəsəbə I seçim dairəsi,National Assembly,4,,,,,,Q327591,
f31e264e-ca2c-4c08-ba8e-a8eeb9d443a9,Əliağa İzzət oğlu Hüseynov,Əliağa İzzət oğlu Hüseynov,,,,Independent,IND,59,Salyan seçim dairəsi,National Assembly,4,,,,,,Q327591,
70e13204-a77b-413f-96e1-2a58d1166906,Əsabil Qarakişi oğlu Qasımov,Əsabil Qarakişi oğlu Qasımov,,,,Yeni Azərbaycan Partiyası,Yeni Azərbaycan Partiyası,79,İmişli seçim dairəsi,National Assembly,4,,,,,,,
