id,name,sort_name,email,twitter,facebook,group,group_id,area_id,area,chamber,term,start_date,end_date,image,gender,wikidata,wikidata_group,wikidata_area
d529d7f1-b47f-43df-9f4a-73289623457f,Adil Abış oğlu Əliyev,Adil Abış oğlu Əliyev,,,,Independent,83b82faf-9a1d-4bf8-bd05-5c7f10e6f679,20,Nərimanov II seçim dairəsi,National Assembly,4,,,,,,Q327591,
a82a0545-565e-46a8-b98e-d91400f251e4,Aqil Məhəmməd oğlu Abbas,Aqil Məhəmməd oğlu Abbas,,,,Independent,83b82faf-9a1d-4bf8-bd05-5c7f10e6f679,83,Ağcabədi-Füzuli seçim dairəsi,National Assembly,4,,,,,,Q327591,
c79a9109-a6b5-4ca2-89f5-54db2b24abec,Aqiyə Həbib qızı Naxçıvanlı,Aqiyə Həbib qızı Naxçıvanlı,,,,Yeni Azərbaycan Partiyası,Yeni Azərbaycan Partiyası,117,Oğuz-Qəbələ seçim dairəsi,National Assembly,4,,,,,,,
7a49b4bf-7786-408d-8367-1e25f033f7d1,Arif Qafar oğlu Rəhimzadə,Arif Qafar oğlu Rəhimzadə,,,,Yeni Azərbaycan Partiyası,Yeni Azərbaycan Partiyası,61,Neftçala seçim dairəsi,National Assembly,4,,,,,,,
2c26605b-44ec-49c2-914d-7f912c78270b,Asim Nazim oğlu Mollazadə,Asim Nazim oğlu Mollazadə,,,,Azərbaycan Demokratik İslahatlar Partiyası,Azərbaycan Demokratik İslahatlar Partiyası,22,Nəsimi II seçim dairəsi,National Assembly,4,,,,,,,
bceaa18e-48ae-49b5-94b6-3299fda339c9,Aslan Məmmədhüseyn oğlu Cəfərov,Aslan Məmmədhüseyn oğlu Cəfərov,,,,Yeni Azərbaycan Partiyası,Yeni Azərbaycan Partiyası,77,Astara seçim dairəsi,National Assembly,4,,,,,,,
3500e9a1-5790-4e59-9e70-d1287f065608,Astan Nuşrəvan oğlu Şahverdiyev,Astan Nuşrəvan oğlu Şahverdiyev,,,,Yeni Azərbaycan Partiyası,Yeni Azərbaycan Partiyası,120,Cəbrayıl-Qubadlı seçim dairəsi,National Assembly,4,,,,,,,
5d7430b1-179f-483e-96d1-261c8cba8bd7,Aydın Böyükkişi oğlu Mirzəzadə,Aydın Böyükkişi oğlu Mirzəzadə,,,,Yeni Azərbaycan Partiyası,Yeni Azərbaycan Partiyası,47,Mingəçevir seçim dairəsi,National Assembly,4,,,,,,,
33580c4b-5b44-4bdd-a467-1215f0f8504d,Azər Camal oğlu Badamov,Azər Camal oğlu Badamov,,,,Yeni Azərbaycan Partiyası,Yeni Azərbaycan Partiyası,51,Qusar seçim dairəsi,National Assembly,4,,,,,,,
3fe97b38-8a45-4328-aa2c-dc3cebaf9605,Azər Şəmşid oğlu Kərimli,Azər Şəmşid oğlu Kərimli,,,,Independent,83b82faf-9a1d-4bf8-bd05-5c7f10e6f679,112,Qax seçim dairəsi,National Assembly,4,,,,,,Q327591,
e69b5371-ccfd-4806-83b0-8ee29bd0b8d7,Ağacan Qulam oğlu Abıyev,Ağacan Qulam oğlu Abıyev,,,,Yeni Azərbaycan Partiyası,Yeni Azərbaycan Partiyası,32,Suraxanı III seçim dairəsi,National Assembly,4,,,,,,,
e4bf5488-40a9-48de-aae8-d5b841d76ee0,Bahar Əvəz qızı Muradov,Bahar Əvəz qızı Muradov,,,,Yeni Azərbaycan Partiyası,Yeni Azərbaycan Partiyası,84,Füzuli seçim dairəsi,National Assembly,4,,,,,,,
529a93db-8e63-4742-b097-f61dfb2994d2,Bəxtiyar Həmzə oğlu Əliyev,Bəxtiyar Həmzə oğlu Əliyev,,,,Independent,83b82faf-9a1d-4bf8-bd05-5c7f10e6f679,118,Ağdam şəhər seçim dairəsi,National Assembly,4,,,,,,Q327591,
98d1b61c-2f15-44cf-8c55-e4f6612f1e9a,Bəxtiyar Yusif oğlu Sadıqov,Bəxtiyar Yusif oğlu Sadıqov,,,,Yeni Azərbaycan Partiyası,Yeni Azərbaycan Partiyası,119,Ağdam qəsəbə seçim dairəsi,National Assembly,4,,,,,,,
9bb01aa7-01c5-4f6e-a893-d110a004080c,Cavanşir Hümmət oğlu Paşazadə,Cavanşir Hümmət oğlu Paşazadə,,,,Yeni Azərbaycan Partiyası,Yeni Azərbaycan Partiyası,75,Lənkəran-Masallı seçim dairəsi,National Assembly,4,,,,,,,
93baee28-dc87-4b41-8ad1-f4b46d1f6cd6,Cavanşir Əyyub oğlu Feyziyev,Cavanşir Əyyub oğlu Feyziyev,,,,Independent,83b82faf-9a1d-4bf8-bd05-5c7f10e6f679,115,Şəki qəsəbə II seçim dairəsi,National Assembly,4,,,,,,Q327591,
bbcd6069-8a73-4a05-a05d-9958a40a50eb,Cavid Qənbər oğlu Qurbanov,Cavid Qənbər oğlu Qurbanov,,,,Yeni Azərbaycan Partiyası,Yeni Azərbaycan Partiyası,123,Kəlbəcər seçim dairəsi,National Assembly,4,,,,,,,
67865fc6-074c-4114-aaf5-22ace045df9b,Ceyhun Yunis oğlu Osmanlı,Ceyhun Yunis oğlu Osmanlı,,,,Independent,83b82faf-9a1d-4bf8-bd05-5c7f10e6f679,63,Sabirabad I seçim dairəsi,National Assembly,4,,,,,,Q327591,
3f82d51e-9421-42df-b273-b60f9fb5cdd7,Cəlal Əlirza oğlu Əliyev,Cəlal Əlirza oğlu Əliyev,,,,Yeni Azərbaycan Partiyası,Yeni Azərbaycan Partiyası,62,Saatlı seçim dairəsi,National Assembly,4,,,,,,,
01236755-5d04-4d5d-93f6-8bf8c733a8be,Eldar Allahyar oğlu Quliyev,Eldar Allahyar oğlu Quliyev,,,,Independent,83b82faf-9a1d-4bf8-bd05-5c7f10e6f679,28,Sabunçu III seçim dairəsi,National Assembly,4,,,,,,Q327591,
1fc26cc7-54c8-47b0-9549-af458d7fb284,Eldar Rza oğlu İbrahimov,Eldar Rza oğlu İbrahimov,,,,Yeni Azərbaycan Partiyası,Yeni Azərbaycan Partiyası,4,Naxçıvan şəhər seçim dairəsi,National Assembly,4,,,,,,,
48d6b1af-0be5-4fb0-8f7f-0c341595e3cb,Elman Camal oğlu Məmmədov,Elman Camal oğlu Məmmədov,,,,Yeni Azərbaycan Partiyası,Yeni Azərbaycan Partiyası,124,Şuşa-Ağdam-Xocalı-Xocavənd seçim dairəsi,National Assembly,4,,,,,,,
29f20588-11ed-4551-bd93-3622b72e8e14,Elmira Hüseyn qızı Axundova,Elmira Hüseyn qızı Axundova,,,,Independent,83b82faf-9a1d-4bf8-bd05-5c7f10e6f679,71,Masallı qəsəbə seçim dairəsi,National Assembly,4,,,,,,Q327591,
f2a31e4c-a9fa-4cc0-99f1-fbd0ef0d374d,Elxan Sirac oğlu Süleymanov,Elxan Sirac oğlu Süleymanov,,,,Independent,83b82faf-9a1d-4bf8-bd05-5c7f10e6f679,85,Şamaxı seçim dairəsi,National Assembly,4,,,,,,Q327591,
ece6630e-726a-4725-a1b0-c9766d0db2f9,Fazil Qəzənfər oğlu Mustafa,Fazil Qəzənfər oğlu Mustafa,,,,Böyük Quruluş Partiyası,Böyük Quruluş Partiyası,26,Sabunçu I seçim dairəsi,National Assembly,4,,,,,,,
a3c12222-ffdb-42da-963d-7e4e89248538,Flora Qasım qızı Qasımova,Flora Qasım qızı Qasımova,,,,Independent,83b82faf-9a1d-4bf8-bd05-5c7f10e6f679,122,Xankəndi seçim dairəsi,National Assembly,4,,,,,,Q327591,
b16aee01-b681-4789-a922-c54b8a2d9b29,Fərəc İbrahim oğlu Quliyev,Fərəc İbrahim oğlu Quliyev,,,,Milli Dirçəliş Hərəkatı Partiyası,Milli Dirçəliş Hərəkatı Partiyası,31,Suraxanı II seçim dairəsi,National Assembly,4,,,,,,,
1fd5914c-4907-4b90-8635-6cb063d40580,Fəttah Səməd oğlu Heydərov,Fəttah Səməd oğlu Heydərov,,,,Independent,83b82faf-9a1d-4bf8-bd05-5c7f10e6f679,116,Qəbələ seçim dairəsi,National Assembly,4,,,,,,Q327591,
4ad0984b-109d-43eb-be31-4ad62a579c03,Fəzail Feyruz oğlu İbrahimli,Fəzail Feyruz oğlu İbrahimli,,,,Vətəndaş Həmrəyliyi Partiyası,Vətəndaş Həmrəyliyi Partiyası,69,Cəlilabad-Masallı-Biləsuvar seçim dairəsi,National Assembly,4,,,,,,,
2ecedc61-aff6-4e16-ad4c-8d3099954909,Fəzail Rəhim oğlu Ağamalı,Fəzail Rəhim oğlu Ağamalı,,,,Independent,83b82faf-9a1d-4bf8-bd05-5c7f10e6f679,60,Salyan-Neftçala seçim dairəsi,National Assembly,4,,,,,,Q327591,
fa23e2fc-380c-41f1-b6df-c8ebd58b65d0,Hacı Hacıbaba oğlu Salayev,Hacı Hacıbaba oğlu Salayev,,,,Independent,83b82faf-9a1d-4bf8-bd05-5c7f10e6f679,44,Sumqayıt-Abşeron seçim dairəsi,National Assembly,4,,,,,,Q327591,
4f9a4ec0-8a20-456e-9a87-b99ab7160601,Hadı Musa oğlu Rəcəbli,Hadı Musa oğlu Rəcəbli,,,,Yeni Azərbaycan Partiyası,Yeni Azərbaycan Partiyası,74,Lənkəran qəsəbə seçim dairəsi,National Assembly,4,,,,,,,
9501c54c-3fba-4c26-8e21-d8bc2763473d,Hikmət İsmayıl oğlu Atayev,Hikmət İsmayıl oğlu Atayev,,,,Yeni Azərbaycan Partiyası,Yeni Azərbaycan Partiyası,110,Zaqatala seçim dairəsi,National Assembly,4,,,,,,,
7775e520-6bdc-4f2f-a5fd-8949202a5415,Hüseynbala Fazil oğlu Mirələmov,Hüseynbala Fazil oğlu Mirələmov,,,,Yeni Azərbaycan Partiyası,Yeni Azərbaycan Partiyası,33,Xətai I seçim dairəsi,National Assembly,4,,,,,,,
03b5a77b-9738-4a64-a67e-881ea9e55179,Jalə Fazil qızı Əliyeva,Jalə Fazil qızı Əliyeva,,,,Independent,83b82faf-9a1d-4bf8-bd05-5c7f10e6f679,92,Zərdab-Ucar seçim dairəsi,National Assembly,4,,,,,,Q327591,
63d6e76d-264b-4f2a-8564-60608d56d94f,Kamilə Əli Ağa qızı Əliyeva,Kamilə Əli Ağa qızı Əliyeva,,,,Yeni Azərbaycan Partiyası,Yeni Azərbaycan Partiyası,111,Zaqatala-Balakən seçim dairəsi,National Assembly,4,,,,,,,
4c8ae678-fbd0-4b33-b5a6-694a2d2c3dcd,Madər Ələsgər oğlu Musayev,Madər Ələsgər oğlu Musayev,,,,Independent,83b82faf-9a1d-4bf8-bd05-5c7f10e6f679,10,Binəqədi III seçim dairəsi,National Assembly,4,,,,,,Q327591,
88bfd358-ea37-4101-a640-769b7001428b,Mahir Məhəmmədəli oğlu Aslanov,Mahir Məhəmmədəli oğlu Aslanov,,,,Independent,83b82faf-9a1d-4bf8-bd05-5c7f10e6f679,96,Goranboy-Naftalan seçim dairəsi,National Assembly,4,,,,,,Q327591,
722416f7-abe6-4755-b166-f970a9388f87,Malik Əvəz oğlu Həsənov,Malik Əvəz oğlu Həsənov,,,,Yeni Azərbaycan Partiyası,Yeni Azərbaycan Partiyası,67,Cəlilabad şəhər seçim dairəsi,National Assembly,4,,,,,,,
7241e94c-8987-4e7a-90ac-76e965e6ad30,Mehriban Arif qızı Əliyeva,Mehriban Arif qızı Əliyeva,,,,Yeni Azərbaycan Partiyası,Yeni Azərbaycan Partiyası,14,Xəzər II seçim dairəsi,National Assembly,4,,,,,,,
00af131e-d092-4ddb-84e5-a818e7068eda,Mirkazım Mirməhəmməd oğlu Kazımov,Mirkazım Mirməhəmməd oğlu Kazımov,,,,Yeni Azərbaycan Partiyası,Yeni Azərbaycan Partiyası,68,Cəlilabad qəsəbə seçim dairəsi,National Assembly,4,,,,,,,
3aaa67e5-e668-42a9-8006-f6ec1ecd5f67,Mixail Yuri oğlu Zabelin,Mixail Yuri oğlu Zabelin,,,,Yeni Azərbaycan Partiyası,Yeni Azərbaycan Partiyası,12,Qaradağ-Binəqədi-Yasamal seçim dairəsi,National Assembly,4,,,,,,,
70613aca-e085-40e2-94bd-30626d85eabf,Musa İsa oğlu Quliyev (Urud),Musa İsa oğlu Quliyev (Urud),,,,Yeni Azərbaycan Partiyası,Yeni Azərbaycan Partiyası,40,Kəpəz II seçim dairəsi (Gəncə şəhəri),National Assembly,4,,,,,,,
39896e4a-5bcf-4366-80cf-26fc19cc0b78,Muxtar Bahadur oğlu Babayev,Muxtar Bahadur oğlu Babayev,,,,Yeni Azərbaycan Partiyası,Yeni Azərbaycan Partiyası,43,Sumqayıt III seçim dairəsi,National Assembly,4,,,,,,,
b1f885ff-98e4-4abb-8a48-40e6efb419f6,Mübariz Qəhrəman oğlu Qurbanlı,Mübariz Qəhrəman oğlu Qurbanlı,,,,Independent,83b82faf-9a1d-4bf8-bd05-5c7f10e6f679,100,Şəmkir-Daşkəsən seçim dairəsi,National Assembly,4,,,,,,Q327591,
13e466f8-b6d7-4d78-a019-b9eaea1cd4ce,Nazim Fərəc oğlu Fərəcov,Nazim Fərəc oğlu Fərəcov,,,,Yeni Azərbaycan Partiyası,Yeni Azərbaycan Partiyası,121,Laçın seçim dairəsi,National Assembly,4,,,,,,,
e3271ef3-1819-4dba-aa8f-593580f83459,Nizami Qulu oğlu Cəfərov,Nizami Qulu oğlu Cəfərov,,,,Yeni Azərbaycan Partiyası,Yeni Azərbaycan Partiyası,108,Ağstafa seçim dairəsi,National Assembly,4,,,,,,,
cfd1fef1-eb6c-4d81-88ea-96bc1af91be1,Novruzəli Davud oğlu Aslanov,Novruzəli Davud oğlu Aslanov,,,,Independent,83b82faf-9a1d-4bf8-bd05-5c7f10e6f679,86,İsmayıllı seçim dairəsi,National Assembly,4,,,,,,Q327591,
4fd6cf86-5631-4a6d-9a12-8def37d7efbf,Nəriman Əlibala oğlu Əliyev,Nəriman Əlibala oğlu Əliyev,,,,Yeni Azərbaycan Partiyası,Yeni Azərbaycan Partiyası,70,Masallı şəhər seçim dairəsi,National Assembly,4,,,,,,,
435938bb-2a19-4937-b0d0-8aa5a8bb1495,Qüdrət Müzəffər oğlu Həsənquliyev,Qüdrət Müzəffər oğlu Həsənquliyev,,,,Bütöv Azərbaycan Xalq Cəbhəsi Partiyası,Bütöv Azərbaycan Xalq Cəbhəsi Partiyası,7,Ordubad-Culfa seçim dairəsi,National Assembly,4,,,,,,,
9dc768a4-5da5-4cca-9ca8-50f16cabc382,Qənirə Ələsgər qızı Paşayeva,Qənirə Ələsgər qızı Paşayeva,,,,Independent,83b82faf-9a1d-4bf8-bd05-5c7f10e6f679,105,Tovuz seçim dairəsi,National Assembly,4,,,,,,Q327591,
5c93da6d-3c8e-4052-9497-4686465d9fd3,Rafael Baba oğlu Hüseynov,Rafael Baba oğlu Hüseynov,,,,Independent,83b82faf-9a1d-4bf8-bd05-5c7f10e6f679,58,Hacıqabul-Kürdəmir seçim dairəsi,National Assembly,4,,,,,,Q327591,
8e0ab9c5-bfc1-4502-8f13-4070dbcfe1a7,Rafiq Musa oğlu Məmmədhəsənov,Rafiq Musa oğlu Məmmədhəsənov,,,,Yeni Azərbaycan Partiyası,Yeni Azərbaycan Partiyası,104,Gədəbəy-Tovuz seçim dairəsi,National Assembly,4,,,,,,,
fcff621e-17e3-478c-9241-fc64f42ab488,Rasim Nəsrəddin oğlu Musabəyov,Rasim Nəsrəddin oğlu Musabəyov,,,,Independent,83b82faf-9a1d-4bf8-bd05-5c7f10e6f679,18,Nərimanov-Nizami seçim dairəsi,National Assembly,4,,,,,,Q327591,
7d19ce52-c33d-4bef-8445-513fda7b5e8d,Rauf Asif oğlu Əliyev,Rauf Asif oğlu Əliyev,,,,Yeni Azərbaycan Partiyası,Yeni Azərbaycan Partiyası,13,Xəzər I seçim dairəsi,National Assembly,4,,,,,,,
17a69087-18d8-4ffc-a76d-a00614be7a37,Rövnəq İbrahim oğlu Abdullayev,Rövnəq İbrahim oğlu Abdullayev,,,,Yeni Azərbaycan Partiyası,Yeni Azərbaycan Partiyası,24,Nizami I seçim dairəsi,National Assembly,4,,,,,,,
3923b6a3-4ff5-4be6-ab2f-6b1c403e1369,Rövşən Şükür oğlu Rzayev,Rövşən Şükür oğlu Rzayev,,,,Independent,83b82faf-9a1d-4bf8-bd05-5c7f10e6f679,101,Göygöl-Daşkəsən seçim dairəsi,National Assembly,4,,,,,,Q327591,
ea7c52af-14f6-428a-b89d-1280402d229b,Rüfət Atakişi oğlu Quliyev,Rüfət Atakişi oğlu Quliyev,,,,Independent,83b82faf-9a1d-4bf8-bd05-5c7f10e6f679,73,Lənkəran şəhər seçim dairəsi,National Assembly,4,,,,,,Q327591,
875bb1a4-ad81-4e04-bc53-61e47cad4042,Rüstəm Gülabba oğlu Xəlilov,Rüstəm Gülabba oğlu Xəlilov,,,,Yeni Azərbaycan Partiyası,Yeni Azərbaycan Partiyası,64,Sabirabad II seçim dairəsi,National Assembly,4,,,,,,,
61c93908-df9b-46e8-aef5-4e46502d7975,Rəbiyyət Nurullah qızı Aslanova,Rəbiyyət Nurullah qızı Aslanova,,,,Yeni Azərbaycan Partiyası,Yeni Azərbaycan Partiyası,109,Balakən seçim dairəsi,National Assembly,4,,,,,,,
44b0340f-f300-4afd-8c39-025653105bb2,Sabir Kamal oğlu Hacıyev,Sabir Kamal oğlu Hacıyev,,,,Vətəndaş Birliyi Partiyası,Vətəndaş Birliyi Partiyası,88,Göyçay seçim dairəsi,National Assembly,4,,,,,,,
a2f1dfad-68ff-4daa-99cd-2c9963aaba60,Sabir Xudu oğlu Rüstəmxanlı,Sabir Xudu oğlu Rüstəmxanlı,,,,Vətəndaş Həmrəyliyi Partiyası,Vətəndaş Həmrəyliyi Partiyası,72,Yardımlı-Masallı seçim dairəsi,National Assembly,4,,,,,,,
4cbe0e4b-b4c9-4903-b8e5-a24345b5a0c1,Sahib Eyvaz oğlu Alıyev,Sahib Eyvaz oğlu Alıyev,,,,Independent,83b82faf-9a1d-4bf8-bd05-5c7f10e6f679,95,Tərtər seçim dairəsi,National Assembly,4,,,,,,Q327591,
8352a003-c20c-4fb9-a4cc-c897467113ba,Sahibə Əli qızı Qafarova,Sahibə Əli qızı Qafarova,,,,Yeni Azərbaycan Partiyası,Yeni Azərbaycan Partiyası,98,Şəmkir şəhər seçim dairəsi,National Assembly,4,,,,,,,
6cd4e7c1-cfc3-40e6-821f-6720e64dadb7,Sevinc Həbib qızı Fətəliyeva,Sevinc Həbib qızı Fətəliyeva,,,,Yeni Azərbaycan Partiyası,Yeni Azərbaycan Partiyası,30,Suraxanı I seçim dairəsi,National Assembly,4,,,,,,,
25d6e719-0c80-423c-ad00-ccc7366f84f4,Sevinc Əmirəhməd qızı Hüseynova,Sevinc Əmirəhməd qızı Hüseynova,,,,Yeni Azərbaycan Partiyası,Yeni Azərbaycan Partiyası,103,Gədəbəy seçim dairəsi,National Assembly,4,,,,,,,
7a5aeff8-6c03-4861-89e9-5f4c7f1683dd,Siyavuş Dünyamalı oğlu Novruzov,Siyavuş Dünyamalı oğlu Novruzov,,,,Yeni Azərbaycan Partiyası,Yeni Azərbaycan Partiyası,5,Şahbuz-Babək seçim dairəsi,National Assembly,4,,,,,,,
823e33d1-5b8a-405b-879e-13ff4241ca2a,Sədaqət Süleyman qızı Vəliyeva,Sədaqət Süleyman qızı Vəliyeva,,,,Yeni Azərbaycan Partiyası,Yeni Azərbaycan Partiyası,25,Nizami II seçim dairəsi,National Assembly,4,,,,,,,
1db49242-57d8-4bb1-8d6a-1618b86af666,Səməd İsmayıl oğlu Seyidov,Səməd İsmayıl oğlu Seyidov,,,,Yeni Azərbaycan Partiyası,Yeni Azərbaycan Partiyası,36,Xətai IV seçim dairəsi,National Assembly,4,,,,,,,
cb51eafc-4ecf-418f-b7f3-668f623a9c76,Səttar Suliddin oğlu Mehbalıyev,Səttar Suliddin oğlu Mehbalıyev,,,,Independent,83b82faf-9a1d-4bf8-bd05-5c7f10e6f679,3,Babək-Kəngərli-Naxçıvan seçim dairəsi,National Assembly,4,,,,,,Q327591,
5a471887-4011-4100-8ffa-e8b08de50ac6,Tahir Musa oğlu Rzayev,Tahir Musa oğlu Rzayev,,,,Yeni Azərbaycan Partiyası,Yeni Azərbaycan Partiyası,82,Ağcabədi seçim dairəsi,National Assembly,4,,,,,,,
a54c9154-b8db-441c-9798-c1a53a89c40a,Tahir Süleyman oğlu Süleymanov,Tahir Süleyman oğlu Süleymanov,,,,Yeni Azərbaycan Partiyası,Yeni Azərbaycan Partiyası,54,Şabran-Siyəzən seçim dairəsi,National Assembly,4,,,,,,,
f3bca3ca-3bd9-4b91-ac0e-edeaa5919360,Vahid Qazməmməd oğlu Əhmədov,Vahid Qazməmməd oğlu Əhmədov,,,,Independent,83b82faf-9a1d-4bf8-bd05-5c7f10e6f679,52,Quba seçim dairəsi,National Assembly,4,,,,,,Q327591,
c717bbc1-5fdf-4580-8de1-72a909f18560,Valeh Feyruz oğlu Ələsgərov,Valeh Feyruz oğlu Ələsgərov,,,,Independent,83b82faf-9a1d-4bf8-bd05-5c7f10e6f679,102,Samux-Şəmkir seçim dairəsi,National Assembly,4,,,,,,Q327591,
c7308a91-1bad-48b9-b0b7-7756c0d4e712,Vasif Yusif oğlu Talıbov,Vasif Yusif oğlu Talıbov,,,,Yeni Azərbaycan Partiyası,Yeni Azərbaycan Partiyası,1,Şərur-Sədərək seçim dairəsi,National Assembly,4,,,,,,,
d368cc97-d5b2-44ec-8e80-13a82b4f4b0b,Xanhüseyn Hüseynağa oğlu Kazımlı,Xanhüseyn Hüseynağa oğlu Kazımlı,,,,Azərbaycan Sosial Rifah Partiyası,Azərbaycan Sosial Rifah Partiyası,66,Biləsuvar seçim dairəsi,National Assembly,4,,,,,,,
bc803584-f948-4e48-8da2-e2f8d9bf8760,Xanlar Nuru oğlu Fətiyev,Xanlar Nuru oğlu Fətiyev,,,,Yeni Azərbaycan Partiyası,Yeni Azərbaycan Partiyası,39,Kəpəz I seçim dairəsi (Gəncə şəhəri),National Assembly,4,,,,,,,
3df3b8d7-aa7c-4471-a001-b8b811268bd8,Yaqub Mikayıl oğlu Mahmudov,Yaqub Mikayıl oğlu Mahmudov,,,,Yeni Azərbaycan Partiyası,Yeni Azərbaycan Partiyası,113,Şəki şəhər seçim dairəsi,National Assembly,4,,,,,,,
3c35c9a1-1749-4a23-8e2b-b95651bf5d47,Yevda Sasun oğlu Abramov,Yevda Sasun oğlu Abramov,,,,Yeni Azərbaycan Partiyası,Yeni Azərbaycan Partiyası,53,Quba-Qusar seçim dairəsi,National Assembly,4,,,,,,,
28248c8e-e307-45e9-8c45-aaaad499b70b,Zeynəb Yəhya qızı Xanlarova,Zeynəb Yəhya qızı Xanlarova,,,,Independent,83b82faf-9a1d-4bf8-bd05-5c7f10e6f679,50,Qobustan-Xızı-Sumqayıt seçim dairəsi,National Assembly,4,,,,,,Q327591,
096a1d61-578c-458f-9deb-e526456e1cf1,Ziyad Əliabbas oğlu Səmədzadə,Ziyad Əliabbas oğlu Səmədzadə,,,,Independent,83b82faf-9a1d-4bf8-bd05-5c7f10e6f679,23,Nəsimi-Səbail seçim dairəsi,National Assembly,4,,,,,,Q327591,
a087de93-c1b1-41cd-b9b3-284f4917b363,Ziyafət Abbas oğlu Əsgərov,Ziyafət Abbas oğlu Əsgərov,,,,Yeni Azərbaycan Partiyası,Yeni Azərbaycan Partiyası,76,Lənkəran-Astara seçim dairəsi,National Assembly,4,,,,,,,
0a9beb87-fee3-4372-8803-a0b2dc830f1f,Çingiz Aşralı oğlu Qənizadə,Çingiz Aşralı oğlu Qənizadə,,,,Independent,83b82faf-9a1d-4bf8-bd05-5c7f10e6f679,80,İmişli-Beyləqan seçim dairəsi,National Assembly,4,,,,,,Q327591,
fea6b368-258a-478b-b493-32732cde0f03,İlham Kazım oğlu Məmmədov,İlham Kazım oğlu Məmmədov,,,,Yeni Azərbaycan Partiyası,Yeni Azərbaycan Partiyası,48,Yevlax seçim dairəsi,National Assembly,4,,,,,,,
600d5319-96eb-421b-9674-166a792d4919,İlham Əlisəftər oğlu Əliyev,İlham Əlisəftər oğlu Əliyev,,,,Yeni Azərbaycan Partiyası,Yeni Azərbaycan Partiyası,56,Xaçmaz qəsəbə seçim dairəsi,National Assembly,4,,,,,,,
cddde3de-f160-431b-aba1-4a48b2963956,İmamverdi İbiş oğlu İsmayılov,İmamverdi İbiş oğlu İsmayılov,,,,Yeni Azərbaycan Partiyası,Yeni Azərbaycan Partiyası,125,Zəngilan-Qubadlı seçim dairəsi,National Assembly,4,,,,,,,
5a8f277f-2ad7-42f0-90d1-92f06dc5d1c6,İqbal Nəriman oğlu Məmmədov,İqbal Nəriman oğlu Məmmədov,,,,Yeni Azərbaycan Partiyası,Yeni Azərbaycan Partiyası,78,Lerik seçim dairəsi,National Assembly,4,,,,,,,
65a7cad9-e6ee-4e38-ad24-6c4f054024da,İsa Əkbər oğlu Həbibbəyli,İsa Əkbər oğlu Həbibbəyli,,,,Yeni Azərbaycan Partiyası,Yeni Azərbaycan Partiyası,2,Şərur seçim dairəsi,National Assembly,4,,,,,,,
aa108698-49d3-4b30-8866-8a59773ee0c7,Əhliman Tapdıq oğlu Əmiraslanov,Əhliman Tapdıq oğlu Əmiraslanov,,,,Yeni Azərbaycan Partiyası,Yeni Azərbaycan Partiyası,65,Saatlı-Sabirabad-Kürdəmir seçim dairəsi,National Assembly,4,,,,,,,
825b42bf-91a2-45eb-9754-d1456ec978d7,Əli Cavad oğlu Əhmədov,Əli Cavad oğlu Əhmədov,,,,Yeni Azərbaycan Partiyası,Yeni Azərbaycan Partiyası,19,Nərimanov I seçim dairəsi,National Assembly,4,,,,,,,
be75e75f-66fe-45dc-9932-e7fa03eb3aca,Əli Məhəmməd oğlu Hüseynov,Əli Məhəmməd oğlu Hüseynov,,,,Yeni Azərbaycan Partiyası,Yeni Azərbaycan Partiyası,49,Yevlax-Mingəçevir seçim dairəsi,National Assembly,4,,,,,,,
a9f575de-aa50-4eb6-8ecf-a7433bda4c03,Əli Əhməd oğlu Məsimli,Əli Əhməd oğlu Məsimli,,,,Independent,83b82faf-9a1d-4bf8-bd05-5c7f10e6f679,114,Şəki qəsəbə I seçim dairəsi,National Assembly,4,,,,,,Q327591,
cbd63284-dd8f-4dec-a33c-50eeda00bf47,Əliağa İzzət oğlu Hüseynov,Əliağa İzzət oğlu Hüseynov,,,,Independent,83b82faf-9a1d-4bf8-bd05-5c7f10e6f679,59,Salyan seçim dairəsi,National Assembly,4,,,,,,Q327591,
199c772a-e4f7-4401-867c-4f4e6f6a35e9,Əsabil Qarakişi oğlu Qasımov,Əsabil Qarakişi oğlu Qasımov,,,,Yeni Azərbaycan Partiyası,Yeni Azərbaycan Partiyası,79,İmişli seçim dairəsi,National Assembly,4,,,,,,,
