id,name,sort_name,email,twitter,facebook,group,group_id,area_id,area,chamber,term,start_date,end_date,image,gender,wikidata,wikidata_group,wikidata_area
4eb3d5a4-6509-4964-b20e-0c0fea003a03,Adil Abış oğlu Əliyev,Adil Abış oğlu Əliyev,,,,Independent,IND,20,Nərimanov II seçim dairəsi,National Assembly,5,,,,,,Q327591,
0ab2eabe-ec97-4254-ad86-c986898f876b,Aqil Məhəmməd oğlu Abbas,Aqil Məhəmməd oğlu Abbas,,,,Independent,IND,83,Ağcabədi-Füzuli seçim dairəsi,National Assembly,5,,,,,,Q327591,
d5d55203-8a4d-411e-8f35-fb5decde2f3b,Aqiyə Həbib qızı Naxçıvanlı,Aqiyə Həbib qızı Naxçıvanlı,,,,Yeni Azərbaycan Partiyası,Yeni Azərbaycan Partiyası,117,Oğuz-Qəbələ seçim dairəsi,National Assembly,5,,,,,,,
2e4afb91-ab22-4820-ab6d-0f57dcbfa759,Araz Məmməd-Mübariz oğlu Əlizadə,Araz Məmməd-Mübariz oğlu Əlizadə,,,,Azərbaycan Sosial Demokrat Partiyası,Azərbaycan Sosial Demokrat Partiyası,35,Xətai III seçim dairəsi,National Assembly,5,,,,,,,
cf6b74c9-65b6-4710-bdfd-f8b57e5f6e6b,Arif Qafar oğlu Rəhimzadə,Arif Qafar oğlu Rəhimzadə,,,,Yeni Azərbaycan Partiyası,Yeni Azərbaycan Partiyası,61,Neftçala seçim dairəsi,National Assembly,5,,,,,,,
fafde353-a0e8-44c8-9465-67dc661d67f4,Asim Nazim oğlu Mollazadə,Asim Nazim oğlu Mollazadə,,,,Azərbaycan Demokratik İslahatlar Partiyası,Azərbaycan Demokratik İslahatlar Partiyası,22,Nəsimi II seçim dairəsi,National Assembly,5,,,,,,,
c4af0829-c44e-4f6f-b4aa-60125c82bf08,Astan Nuşrəvan oğlu Şahverdiyev,Astan Nuşrəvan oğlu Şahverdiyev,,,,Yeni Azərbaycan Partiyası,Yeni Azərbaycan Partiyası,120,Cəbrayıl-Qubadlı seçim dairəsi,National Assembly,5,,,,,,,
1e9bc6ce-70b4-4212-9dfd-311a1686b33a,Aydın Böyükkişi oğlu Mirzəzadə,Aydın Böyükkişi oğlu Mirzəzadə,,,,Yeni Azərbaycan Partiyası,Yeni Azərbaycan Partiyası,47,Mingəçevir seçim dairəsi,National Assembly,5,,,,,,,
7005ac29-48a5-4b08-a643-35b67650a416,Aydın Nəsir oğlu Hüseynov,Aydın Nəsir oğlu Hüseynov,,,,Yeni Azərbaycan Partiyası,Yeni Azərbaycan Partiyası,11,Qaradağ seçim dairəsi,National Assembly,5,,,,,,,
4763fce7-797d-451b-ad46-ae05f174371d,Aytən İnqilab qızı Mustafazadə,Aytən İnqilab qızı Mustafazadə,,,,Independent,IND,16,Yasamal II seçim dairəsi,National Assembly,5,,,,,,Q327591,
1c6545d1-ed52-49f4-acea-1c2802eafc7a,Azay Əjdər oğlu Quliyev,Azay Əjdər oğlu Quliyev,,,,Independent,IND,8,Binəqədi I seçim dairəsi,National Assembly,5,,,,,,Q327591,
a00bd2f3-f7d0-4096-ba81-73bc4a2e1592,Azər Camal oğlu Badamov,Azər Camal oğlu Badamov,,,,Yeni Azərbaycan Partiyası,Yeni Azərbaycan Partiyası,51,Qusar seçim dairəsi,National Assembly,5,,,,,,,
b09bdf07-fd2f-4a42-81cb-dbf5eec706f2,Azər Şəmşid oğlu Kərimli,Azər Şəmşid oğlu Kərimli,,,,Independent,IND,112,Qax seçim dairəsi,National Assembly,5,,,,,,Q327591,
38699f75-2036-4868-b909-90b291db0911,Ağacan Qulam oğlu Abıyev,Ağacan Qulam oğlu Abıyev,,,,Yeni Azərbaycan Partiyası,Yeni Azərbaycan Partiyası,32,Suraxanı III seçim dairəsi,National Assembly,5,,,,,,,
38f80686-d1fb-4b54-b7a9-535102f6acfc,Ağalar İsrafil oğlu Vəliyev,Ağalar İsrafil oğlu Vəliyev,,,,Yeni Azərbaycan Partiyası,Yeni Azərbaycan Partiyası,97,Goranboy-Ağdam-Tərtər seçim dairəsi,National Assembly,5,,,,,,,
77fe03f1-ce4c-4fd3-8845-c77e0d403f12,Bahar Əvəz qızı Muradova,Bahar Əvəz qızı Muradova,,,,Yeni Azərbaycan Partiyası,Yeni Azərbaycan Partiyası,84,Füzuli seçim dairəsi,National Assembly,5,,,,,,,
76d32c35-fb19-4d45-aeae-414e27898fa3,Bəxtiyar Həmzə oğlu Əliyev,Bəxtiyar Həmzə oğlu Əliyev,,,,Independent,IND,118,Ağdam şəhər seçim dairəsi,National Assembly,5,,,,,,Q327591,
bc4a8aa4-223a-4f5a-81da-8c5126047321,Bəxtiyar Yusif oğlu Sadıqov,Bəxtiyar Yusif oğlu Sadıqov,,,,Yeni Azərbaycan Partiyası,Yeni Azərbaycan Partiyası,119,Ağdam qəsəbə seçim dairəsi,National Assembly,5,,,,,,,
29d5fe18-f322-4695-8b18-5f8c5ec2e502,Cavanşir Hümmət oğlu Paşazadə,Cavanşir Hümmət oğlu Paşazadə,,,,Yeni Azərbaycan Partiyası,Yeni Azərbaycan Partiyası,75,Lənkəran-Masallı seçim dairəsi,National Assembly,5,,,,,,,
0906e5c6-7e08-4616-baad-adc3852d8672,Cavanşir Əyyub oğlu Feyziyev,Cavanşir Əyyub oğlu Feyziyev,,,,Independent,IND,115,Şəki qəsəbə II seçim dairəsi,National Assembly,5,,,,,,Q327591,
eef24847-b35a-4a1c-8751-70d71c1e91c4,Cavid Həmid oğlu Osmanov,Cavid Həmid oğlu Osmanov,,,,Yeni Azərbaycan Partiyası,Yeni Azərbaycan Partiyası,90,Ağdaş seçim dairəsi,National Assembly,5,,,,,,,
4a0d25b5-7d29-4bdc-809b-2789ee446359,Cavid Qənbər oğlu Qurbanov,Cavid Qənbər oğlu Qurbanov,,,,Yeni Azərbaycan Partiyası,Yeni Azərbaycan Partiyası,123,Kəlbəcər seçim dairəsi,National Assembly,5,,,,,,,
dd3814da-5ad1-4a64-94fd-a779ae0cc2c4,Dilarə Məmmədağa qızı Cəbrayılova,Dilarə Məmmədağa qızı Cəbrayılova,,,,Yeni Azərbaycan Partiyası,Yeni Azərbaycan Partiyası,27,Sabunçu II seçim dairəsi,National Assembly,5,,,,,,,
3bac2c99-7dcf-4381-9160-99cf83ffd81d,Eldar Allahyar oğlu Quliyev,Eldar Allahyar oğlu Quliyev,,,,Independent,IND,28,Sabunçu III seçim dairəsi,National Assembly,5,,,,,,Q327591,
f7e6102e-481d-4f35-86b4-fe614588266e,Eldar Rza oğlu İbrahimov,Eldar Rza oğlu İbrahimov,,,,Yeni Azərbaycan Partiyası,Yeni Azərbaycan Partiyası,4,Naxçıvan şəhər seçim dairəsi,National Assembly,5,,,,,,,
770f3194-4534-43bd-b9d0-63e6db2d0fe4,Eldəniz Adil oğlu Səlimov,Eldəniz Adil oğlu Səlimov,,,,Yeni Azərbaycan Partiyası,Yeni Azərbaycan Partiyası,55,Xaçmaz şəhər seçim dairəsi,National Assembly,5,,,,,,,
3a5a47a4-98ff-49ba-baf7-1e5b00c380e0,Elman Camal oğlu Məmmədov,Elman Camal oğlu Məmmədov,,,,Yeni Azərbaycan Partiyası,Yeni Azərbaycan Partiyası,124,Şuşa-Ağdam-Xocalı-Xocavənd seçim dairəsi,National Assembly,5,,,,,,,
05395af0-87f3-4d10-b397-58a38c31c4dd,Elman Xudam oğlu Nəsirli,Elman Xudam oğlu Nəsirli,,,,Yeni Azərbaycan Partiyası,Yeni Azərbaycan Partiyası,89,Göyçay-Ağdaş seçim dairəsi,National Assembly,5,,,,,,,
07426b5f-36fb-41a2-84cd-77ca5af5df35,Elmira Hüseyn qızı Axundova,Elmira Hüseyn qızı Axundova,,,,Independent,IND,71,Masallı qəsəbə seçim dairəsi,National Assembly,5,,,,,,Q327591,
87a434d6-b8f1-4c7e-adc8-76f0aff65af7,Elxan Sirac oğlu Süleymanov,Elxan Sirac oğlu Süleymanov,,,,Independent,IND,85,Şamaxı seçim dairəsi,National Assembly,5,,,,,,Q327591,
160f757e-564d-4d06-bc57-6b56edb1c21f,Elçin Bəybala oğlu Quliyev,Elçin Bəybala oğlu Quliyev,,,,Yeni Azərbaycan Partiyası,Yeni Azərbaycan Partiyası,63,Sabirabad I seçim dairəsi,National Assembly,5,,,,,,,
2d4a207a-379e-40aa-8ae7-5be9bdd64fd3,Elşad Eldar oğlu Həsənov,Elşad Eldar oğlu Həsənov,,,,Independent,IND,17,Yasamal III seçim dairəsi,National Assembly,5,,,,,,Q327591,
227ec4f1-0a01-4883-b9b0-17513d1b4775,Elşən Məmmədhənifə oğlu Musayev,Elşən Məmmədhənifə oğlu Musayev,,,,Azərbaycan Demokratik Maarifçilik Partiyası,Azərbaycan Demokratik Maarifçilik Partiyası,110,Zaqatala seçim dairəsi,National Assembly,5,,,,,,,
19591fa8-5dfc-4865-bcb5-ccb3e53ec316,Fazil Qəzənfər oğlu Mustafa,Fazil Qəzənfər oğlu Mustafa,,,,Böyük Quruluş Partiyası,Böyük Quruluş Partiyası,26,Sabunçu I seçim dairəsi,National Assembly,5,,,,,,,
de805197-a7cd-4825-b87d-92a33504387f,Flora Qasım qızı Qasımova,Flora Qasım qızı Qasımova,,,,Independent,IND,122,Xankəndi seçim dairəsi,National Assembly,5,,,,,,Q327591,
8fed56bd-54c3-4d4f-a44d-5b37f870a4ec,Fuad Rauf oğlu Muradov,Fuad Rauf oğlu Muradov,,,,Independent,IND,34,Xətai II seçim dairəsi,National Assembly,5,,,,,,Q327591,
7b4ae31b-2346-4c05-9cc1-f147b9a76863,Fərəc İbrahim oğlu Quliyev,Fərəc İbrahim oğlu Quliyev,,,,Milli Dirçəliş Hərəkatı Partiyası,Milli Dirçəliş Hərəkatı Partiyası,31,Suraxanı II seçim dairəsi,National Assembly,5,,,,,,,
b0e1368d-1754-4076-ad37-0aeda144dafc,Fəttah Səməd oğlu Heydərov,Fəttah Səməd oğlu Heydərov,,,,Independent,IND,116,Qəbələ seçim dairəsi,National Assembly,5,,,,,,Q327591,
6877687f-a40e-403c-a860-00a4ea0821c9,Fəzail Feyruz oğlu İbrahimli,Fəzail Feyruz oğlu İbrahimli,,,,Vətəndaş Həmrəyliyi Partiyası,Vətəndaş Həmrəyliyi Partiyası,69,Cəlilabad-Masallı-Biləsuvar seçim dairəsi,National Assembly,5,,,,,,,
a6bd91d5-4060-4cb9-8e2c-6312d3b34fdf,Fəzail Rəhim oğlu Ağamalı,Fəzail Rəhim oğlu Ağamalı,,,,Ana Vətən Partiyası,Ana Vətən Partiyası,60,Salyan-Neftçala seçim dairəsi,National Assembly,5,,,,,,,
72415361-b211-494a-9640-2d57fdbdfe63,Gövhər Baxşəli qızı Baxşəliyeva,Gövhər Baxşəli qızı Baxşəliyeva,,,,Independent,IND,93,Bərdə şəhər seçim dairəsi,National Assembly,5,,,,,,Q327591,
d89c4af3-ddf1-4bf0-8da4-be3600ff96ec,Hacı Hacıbaba oğlu Salayev,Hacı Hacıbaba oğlu Salayev,,,,Independent,IND,44,Sumqayıt-Abşeron seçim dairəsi,National Assembly,5,,,,,,Q327591,
d265de45-029d-4b11-8d5b-3bacf69eb342,Hadı Musa oğlu Rəcəbli,Hadı Musa oğlu Rəcəbli,,,,Yeni Azərbaycan Partiyası,Yeni Azərbaycan Partiyası,74,Lənkəran qəsəbə seçim dairəsi,National Assembly,5,,,,,,,
203c1cfe-0558-48ec-9c8b-4bd69de952fb,Hikmət Baba oğlu Məmmədov,Hikmət Baba oğlu Məmmədov,,,,Yeni Azərbaycan Partiyası,Yeni Azərbaycan Partiyası,19,Nərimanov I seçim dairəsi,National Assembly,5,,,,,,,
08c1bc9c-c69b-48ee-85c4-c0a1dcf5cac0,Hüseynbala Fazil oğlu Mirələmov,Hüseynbala Fazil oğlu Mirələmov,,,,Yeni Azərbaycan Partiyası,Yeni Azərbaycan Partiyası,33,Xətai I seçim dairəsi,National Assembly,5,,,,,,,
43d9d95c-90a5-4282-9cd5-b85e7067c281,Jalə Fazil qızı Əliyeva,Jalə Fazil qızı Əliyeva,,,,Independent,IND,92,Zərdab-Ucar seçim dairəsi,National Assembly,5,,,,,,Q327591,
55090867-1f40-43fe-9e05-926e885b8fa3,Kamaləddin Nəsrəddin oğlu Qafarov,Kamaləddin Nəsrəddin oğlu Qafarov,,,,Yeni Azərbaycan Partiyası,Yeni Azərbaycan Partiyası,9,Binəqədi II seçim dairəsi,National Assembly,5,,,,,,,
ed1aab2c-fdf8-47c7-9cba-566fb1c1fad8,Kamilə Əli Ağa qızı Əliyeva,Kamilə Əli Ağa qızı Əliyeva,,,,Yeni Azərbaycan Partiyası,Yeni Azərbaycan Partiyası,111,Zaqatala-Balakən seçim dairəsi,National Assembly,5,,,,,,,
551da290-6b9e-4b9e-99e0-717a7287b194,Kamran Fərhad oğlu Bayramov,Kamran Fərhad oğlu Bayramov,,,,Yeni Azərbaycan Partiyası,Yeni Azərbaycan Partiyası,100,Şəmkir-Daşkəsən seçim dairəsi,National Assembly,5,,,,,,,
498a5df4-1e8c-40f9-b8d7-762f50be3cd4,Kamran Telman oğlu Nəbizadə,Kamran Telman oğlu Nəbizadə,,,,Independent,IND,107,Qazax seçim dairəsi,National Assembly,5,,,,,,Q327591,
0e260b80-c92a-4280-a693-f293d314ca96,Madər Ələsgər oğlu Musayev,Madər Ələsgər oğlu Musayev,,,,Independent,IND,10,Binəqədi III seçim dairəsi,National Assembly,5,,,,,,Q327591,
04a98ea3-346b-4190-8112-36c3e664660a,Mahir Məhəmmədəli oğlu Aslanov,Mahir Məhəmmədəli oğlu Aslanov,,,,Independent,IND,96,Goranboy-Naftalan seçim dairəsi,National Assembly,5,,,,,,Q327591,
774aa261-b4f7-4149-aaf9-a4644a4308ff,Mahir Tapdıq oğlu Abbaszadə,Mahir Tapdıq oğlu Abbaszadə,,,,Yeni Azərbaycan Partiyası,Yeni Azərbaycan Partiyası,121,Laçın seçim dairəsi,National Assembly,5,,,,,,,
1f7e7d9e-baf2-43d4-aeea-dd5ee378707e,Malik Əvəz oğlu Həsənov,Malik Əvəz oğlu Həsənov,,,,Yeni Azərbaycan Partiyası,Yeni Azərbaycan Partiyası,67,Cəlilabad şəhər seçim dairəsi,National Assembly,5,,,,,,,
3721d862-0a68-4419-b2d0-8c7662f33b88,Mehriban Arif qızı Əliyeva,Mehriban Arif qızı Əliyeva,,,,Yeni Azərbaycan Partiyası,Yeni Azərbaycan Partiyası,14,Xəzər II seçim dairəsi,National Assembly,5,,,,,,,
636f8242-13f0-4cc3-89d5-3baecc05e47b,Mirkazım Mirməhəmməd oğlu Kazımov,Mirkazım Mirməhəmməd oğlu Kazımov,,,,Yeni Azərbaycan Partiyası,Yeni Azərbaycan Partiyası,68,Cəlilabad qəsəbə seçim dairəsi,National Assembly,5,,,,,,,
9981c3ac-e495-4a15-b71f-e15e7540cefc,Mirzəcan Mirzəmməd oğlu Xəlilov,Mirzəcan Mirzəmməd oğlu Xəlilov,,,,Yeni Azərbaycan Partiyası,Yeni Azərbaycan Partiyası,41,Sumqayıt I seçim dairəsi,National Assembly,5,,,,,,,
ef9a5f36-156d-473a-895b-0b433ac7df0a,Mixail Yuri oğlu Zabelin,Mixail Yuri oğlu Zabelin,,,,Yeni Azərbaycan Partiyası,Yeni Azərbaycan Partiyası,12,Qaradağ-Binəqədi-Yasamal seçim dairəsi,National Assembly,5,,,,,,,
53830157-593f-45ea-bce9-fb67f1bd6c78,Musa Cəfər oğlu Qasımlı,Musa Cəfər oğlu Qasımlı,,,,Independent,IND,72,Yardımlı-Masallı seçim dairəsi,National Assembly,5,,,,,,Q327591,
8ab64cca-3bc5-4284-a928-2f359a3096cc,Musa İsa oğlu Quliyev (Urud),Musa İsa oğlu Quliyev (Urud),,,,Yeni Azərbaycan Partiyası,Yeni Azərbaycan Partiyası,40,Kəpəz II seçim dairəsi (Gəncə şəhəri),National Assembly,5,,,,,,,
9420ccdb-6e22-4b37-b867-3ed3859945c3,Muxtar Bahadur oğlu Babayev,Muxtar Bahadur oğlu Babayev,,,,Yeni Azərbaycan Partiyası,Yeni Azərbaycan Partiyası,43,Sumqayıt III seçim dairəsi,National Assembly,5,,,,,,,
db9ea398-1ac3-4584-8edf-8f53b1f8604e,Müslüm Mürsəl oğlu Məmmədov,Müslüm Mürsəl oğlu Məmmədov,,,,Independent,IND,57,Kürdəmir seçim dairəsi,National Assembly,5,,,,,,Q327591,
297eb292-f257-4c60-b32e-8b9fed499980,Məlahət İbrahim qızı Həsənova,Məlahət İbrahim qızı Həsənova,,,,Yeni Azərbaycan Partiyası,Yeni Azərbaycan Partiyası,21,Nəsimi I seçim dairəsi,National Assembly,5,,,,,,,
2a78b10d-20f1-499d-9c83-e77172884b59,Naqif Ələşrəf oğlu Həmzəyev,Naqif Ələşrəf oğlu Həmzəyev,,,,Yeni Azərbaycan Partiyası,Yeni Azərbaycan Partiyası,38,Nizami II seçim dairəsi (Gəncə şəhəri),National Assembly,5,,,,,,,
1a4b8be6-cbc1-4750-a29a-0d4968811837,Nizami Qulu oğlu Cəfərov,Nizami Qulu oğlu Cəfərov,,,,Yeni Azərbaycan Partiyası,Yeni Azərbaycan Partiyası,108,Ağstafa seçim dairəsi,National Assembly,5,,,,,,,
34c12dd6-f618-4ff2-8714-7e4a30272f1f,Novruzəli Davud oğlu Aslanov,Novruzəli Davud oğlu Aslanov,,,,Independent,IND,86,İsmayıllı seçim dairəsi,National Assembly,5,,,,,,Q327591,
d948e261-2c02-49d8-89ee-3938979eb804,Nəriman Əlibala oğlu Əliyev,Nəriman Əlibala oğlu Əliyev,,,,Yeni Azərbaycan Partiyası,Yeni Azərbaycan Partiyası,70,Masallı şəhər seçim dairəsi,National Assembly,5,,,,,,,
bc01b65e-e1aa-4d25-b26c-27536227f4d9,Nəsib Məhəmməd oğlu Məhəməliyev,Nəsib Məhəmməd oğlu Məhəməliyev,,,,Yeni Azərbaycan Partiyası,Yeni Azərbaycan Partiyası,109,Balakən seçim dairəsi,National Assembly,5,,,,,,,
3a100285-1166-4bd7-b685-2b5c796d9f01,Oqtay Sabir oğlu Əsədov,Oqtay Sabir oğlu Əsədov,,,,Yeni Azərbaycan Partiyası,Yeni Azərbaycan Partiyası,45,Abşeron seçim dairəsi,National Assembly,5,,,,,,,
c6388b5c-af03-462d-9c3e-6d90ab34f762,Pərvin Orxan qızı Kərimzadə,Pərvin Orxan qızı Kərimzadə,,,,Yeni Azərbaycan Partiyası,Yeni Azərbaycan Partiyası,37,Nizami I seçim dairəsi (Gəncə şəhəri),National Assembly,5,,,,,,,
d55d1089-b51c-491e-b6e8-f444e31bf4da,Qüdrət Müzəffər oğlu Həsənquliyev,Qüdrət Müzəffər oğlu Həsənquliyev,,,,Bütöv Azərbaycan Xalq Cəbhəsi Partiyası,Bütöv Azərbaycan Xalq Cəbhəsi Partiyası,7,Ordubad-Culfa seçim dairəsi,National Assembly,5,,,,,,,
03281514-4b92-4f97-9486-680fc80c554b,Qənirə Ələsgər qızı Paşayeva,Qənirə Ələsgər qızı Paşayeva,,,,Independent,IND,105,Tovuz seçim dairəsi,National Assembly,5,,,,,,Q327591,
2329f3e3-1ebc-4976-9c79-17264f4bd7ef,Rafael Baba oğlu Hüseynov,Rafael Baba oğlu Hüseynov,,,,Independent,IND,58,Hacıqabul-Kürdəmir seçim dairəsi,National Assembly,5,,,,,,Q327591,
4d529436-5a4c-4baf-a658-9ac2801f48f6,Rafael Kamil oğlu Cəbrayılov,Rafael Kamil oğlu Cəbrayılov,,,,Independent,IND,46,Şirvan seçim dairəsi,National Assembly,5,,,,,,Q327591,
215bbb63-8293-4b6a-a8cd-bc780153d087,Rafiq Musa oğlu Məmmədhəsənov,Rafiq Musa oğlu Məmmədhəsənov,,,,Yeni Azərbaycan Partiyası,Yeni Azərbaycan Partiyası,104,Gədəbəy-Tovuz seçim dairəsi,National Assembly,5,,,,,,,
b17c27c1-15b3-489c-bb53-a1effa52f8bc,Rasim Nəsrəddin oğlu Musabəyov,Rasim Nəsrəddin oğlu Musabəyov,,,,Independent,IND,18,Nərimanov-Nizami seçim dairəsi,National Assembly,5,,,,,,Q327591,
db56b6d4-048c-4c00-bab7-8419b82034a7,Rauf Asif oğlu Əliyev,Rauf Asif oğlu Əliyev,,,,Yeni Azərbaycan Partiyası,Yeni Azərbaycan Partiyası,13,Xəzər I seçim dairəsi,National Assembly,5,,,,,,,
06864c83-5032-4fb3-9852-5636bb9d5c29,Rövnəq İbrahim oğlu Abdullayev,Rövnəq İbrahim oğlu Abdullayev,,,,Yeni Azərbaycan Partiyası,Yeni Azərbaycan Partiyası,24,Nizami I seçim dairəsi,National Assembly,5,,,,,,,
24b2a471-1000-4d66-8143-39941220a677,Rövşən Şükür oğlu Rzayev,Rövşən Şükür oğlu Rzayev,,,,Independent,IND,101,Göygöl-Daşkəsən seçim dairəsi,National Assembly,5,,,,,,Q327591,
b8d6602e-8d5c-4b33-8e4b-122cd8c400e8,Rüfət Atakişi oğlu Quliyev,Rüfət Atakişi oğlu Quliyev,,,,Independent,IND,73,Lənkəran şəhər seçim dairəsi,National Assembly,5,,,,,,Q327591,
8a0ab932-bf96-464c-ba8f-e7a0cae15b4b,Rüstəm Gülabba oğlu Xəlilov,Rüstəm Gülabba oğlu Xəlilov,,,,Yeni Azərbaycan Partiyası,Yeni Azərbaycan Partiyası,64,Sabirabad II seçim dairəsi,National Assembly,5,,,,,,,
8bbab9e8-4de5-48ee-a61d-60f4f8454a31,Rəşad Məmmədqulu oğlu Mahmudov,Rəşad Məmmədqulu oğlu Mahmudov,,,,Yeni Azərbaycan Partiyası,Yeni Azərbaycan Partiyası,77,Astara seçim dairəsi,National Assembly,5,,,,,,,
d996e042-a398-46dd-9014-c7a40521e46d,Sabir Kamal oğlu Hacıyev,Sabir Kamal oğlu Hacıyev,,,,Vətəndaş Birliyi Partiyası,Vətəndaş Birliyi Partiyası,88,Göyçay seçim dairəsi,National Assembly,5,,,,,,,
ad1d0448-f64f-43b9-b4d3-a918250bac27,Sahib Eyvaz oğlu Alıyev,Sahib Eyvaz oğlu Alıyev,,,,Independent,IND,95,Tərtər seçim dairəsi,National Assembly,5,,,,,,Q327591,
663d95b4-d0c0-4e17-a507-6a4a211f226f,Sahibə Əli qızı Qafarova,Sahibə Əli qızı Qafarova,,,,Yeni Azərbaycan Partiyası,Yeni Azərbaycan Partiyası,98,Şəmkir şəhər seçim dairəsi,National Assembly,5,,,,,,,
588a5147-9b95-4ad0-9333-dab21d7a7c5b,Sevinc Həbib qızı Fətəliyeva,Sevinc Həbib qızı Fətəliyeva,,,,Yeni Azərbaycan Partiyası,Yeni Azərbaycan Partiyası,30,Suraxanı I seçim dairəsi,National Assembly,5,,,,,,,
f5367782-0eb7-4540-a718-fa3f31b92a28,Sevinc Əmirəhməd qızı Hüseynova,Sevinc Əmirəhməd qızı Hüseynova,,,,Yeni Azərbaycan Partiyası,Yeni Azərbaycan Partiyası,103,Gədəbəy seçim dairəsi,National Assembly,5,,,,,,,
556709d9-d1e0-4f8c-9df5-792ed029a22b,Siyavuş Dünyamalı oğlu Novruzov,Siyavuş Dünyamalı oğlu Novruzov,,,,Yeni Azərbaycan Partiyası,Yeni Azərbaycan Partiyası,5,Şahbuz-Babək seçim dairəsi,National Assembly,5,,,,,,,
d6fe83b3-640c-4483-bcbf-48e9b03b5ccf,Sona Sakit qızı Əliyeva,Sona Sakit qızı Əliyeva,,,,Yeni Azərbaycan Partiyası,Yeni Azərbaycan Partiyası,99,Şəmkir qəsəbə seçim dairəsi,National Assembly,5,,,,,,,
4a734644-0989-4997-b5a1-022ebc4dfe7a,Sədaqət Süleyman qızı Vəliyeva,Sədaqət Süleyman qızı Vəliyeva,,,,Yeni Azərbaycan Partiyası,Yeni Azərbaycan Partiyası,25,Nizami II seçim dairəsi,National Assembly,5,,,,,,,
87028cf3-aa00-4d41-b658-7f8852caba31,Səməd İsmayıl oğlu Seyidov,Səməd İsmayıl oğlu Seyidov,,,,Yeni Azərbaycan Partiyası,Yeni Azərbaycan Partiyası,36,Xətai IV seçim dairəsi,National Assembly,5,,,,,,,
391aebc6-8627-4c93-859f-fd92d9fdcd70,Səttar Suliddin oğlu Mehbalıyev,Səttar Suliddin oğlu Mehbalıyev,,,,Independent,IND,3,Babək-Kəngərli-Naxçıvan seçim dairəsi,National Assembly,5,,,,,,Q327591,
3985990c-a1bf-4120-96a5-825b86f32cda,Tahir Famil oğlu oğlu Mirkişili,Tahir Famil oğlu oğlu Mirkişili,,,,Yeni Azərbaycan Partiyası,Yeni Azərbaycan Partiyası,42,Sumqayıt II seçim dairəsi,National Assembly,5,,,,,,,
33ebf988-3dbd-4899-a056-b4d1c7650518,Tahir Musa oğlu Rzayev,Tahir Musa oğlu Rzayev,,,,Yeni Azərbaycan Partiyası,Yeni Azərbaycan Partiyası,82,Ağcabədi seçim dairəsi,National Assembly,5,,,,,,,
0daf3fa5-cd4b-4884-b467-d7f940fa824f,Tahir Süleyman oğlu Süleymanov,Tahir Süleyman oğlu Süleymanov,,,,Yeni Azərbaycan Partiyası,Yeni Azərbaycan Partiyası,54,Şabran-Siyəzən seçim dairəsi,National Assembly,5,,,,,,,
3eb0b539-052b-4418-8a05-e59ff16961d5,Tahir Zayıdağa oğlu Kərimli,Tahir Zayıdağa oğlu Kərimli,,,,Vəhdət Partiyası,Vəhdət Partiyası,87,Ağsu-İsmayıllı seçim dairəsi,National Assembly,5,,,,,,,
68029778-f5da-45b1-9d67-58fb8bb83dd0,Vahid Qazməmməd oğlu Əhmədov,Vahid Qazməmməd oğlu Əhmədov,,,,Independent,IND,52,Quba seçim dairəsi,National Assembly,5,,,,,,Q327591,
fdc26c81-e62c-401a-bd61-cf030eff5d4c,Valeh Feyruz oğlu Ələsgərov,Valeh Feyruz oğlu Ələsgərov,,,,Independent,IND,102,Samux-Şəmkir seçim dairəsi,National Assembly,5,,,,,,Q327591,
2ac59144-215e-4dda-8aa6-bd4ebd7960a2,Vasif Yusif oğlu Talıbov,Vasif Yusif oğlu Talıbov,,,,Yeni Azərbaycan Partiyası,Yeni Azərbaycan Partiyası,1,Şərur-Sədərək seçim dairəsi,National Assembly,5,,,,,,,
f24d5f57-e754-4fda-8e29-9bbf39376b75,Vüsal Əfqan oğlu Hüseynov,Vüsal Əfqan oğlu Hüseynov,,,,Yeni Azərbaycan Partiyası,Yeni Azərbaycan Partiyası,91,Ucar seçim dairəsi,National Assembly,5,,,,,,,
cfdf4c94-b613-47f7-ad95-8ccd6ba9e41d,Xanhüseyn Hüseynağa oğlu Kazımlı,Xanhüseyn Hüseynağa oğlu Kazımlı,,,,Azərbaycan Sosial Rifah Partiyası,Azərbaycan Sosial Rifah Partiyası,66,Biləsuvar seçim dairəsi,National Assembly,5,,,,,,,
3575200c-66f3-4730-a13e-59864f6b33ea,Xanlar Nuru oğlu Fətiyev,Xanlar Nuru oğlu Fətiyev,,,,Yeni Azərbaycan Partiyası,Yeni Azərbaycan Partiyası,39,Kəpəz I seçim dairəsi (Gəncə şəhəri),National Assembly,5,,,,,,,
b5f77c2d-a37d-4bf9-94c4-9a86c34e6ddb,Yaqub Mikayıl oğlu Mahmudov,Yaqub Mikayıl oğlu Mahmudov,,,,Yeni Azərbaycan Partiyası,Yeni Azərbaycan Partiyası,113,Şəki şəhər seçim dairəsi,National Assembly,5,,,,,,,
3d9136f6-5c50-4e3a-b2ca-d06786cb3a51,Yevda Sasun oğlu Abramov,Yevda Sasun oğlu Abramov,,,,Yeni Azərbaycan Partiyası,Yeni Azərbaycan Partiyası,53,Quba-Qusar seçim dairəsi,National Assembly,5,,,,,,,
095fa563-eee0-4d7c-9988-6563e6d80006,Zahid Məhərrəm oğlu Oruc,Zahid Məhərrəm oğlu Oruc,,,,Independent,IND,94,Bərdə qəsəbə seçim dairəsi,National Assembly,5,,,,,,Q327591,
e465eddb-456d-49ed-9811-c68a82fef787,Zeynəb Yəhya qızı Xanlarova,Zeynəb Yəhya qızı Xanlarova,,,,Independent,IND,50,Qobustan-Xızı-Sumqayıt seçim dairəsi,National Assembly,5,,,,,,Q327591,
72d5e377-ae16-48c1-82a1-2b767292518e,Ziyad Əliabbas oğlu Səmədzadə,Ziyad Əliabbas oğlu Səmədzadə,,,,Independent,IND,23,Nəsimi-Səbail seçim dairəsi,National Assembly,5,,,,,,Q327591,
3f1df726-ac2a-4eae-ab27-3836ae68691e,Ziyafət Abbas oğlu Əsgərov,Ziyafət Abbas oğlu Əsgərov,,,,Yeni Azərbaycan Partiyası,Yeni Azərbaycan Partiyası,76,Lənkəran-Astara seçim dairəsi,National Assembly,5,,,,,,,
69be540b-f30f-401a-8059-7f87fc0f6be8,Çingiz Aşralı oğlu Qənizadə,Çingiz Aşralı oğlu Qənizadə,,,,Independent,IND,80,İmişli-Beyləqan seçim dairəsi,National Assembly,5,,,,,,Q327591,
0b6520de-2da6-43e4-a104-4a476d6f6070,Ülvi Zahid oğlu Quliyev,Ülvi Zahid oğlu Quliyev,,,,Independent,IND,15,Yasamal I seçim dairəsi,National Assembly,5,,,,,,Q327591,
53474175-8efb-4f96-bac0-e55af14251b0,Ülviyyə Cavanşir qızı Ağayeva,Ülviyyə Cavanşir qızı Ağayeva,,,,Independent,IND,106,Tovuz-Qazax-Ağstafa seçim dairəsi,National Assembly,5,,,,,,Q327591,
ba1b5f13-ef84-4480-88a1-17e4130cee01,Ülviyyə Tapdıq qızı Həmzəyeva,Ülviyyə Tapdıq qızı Həmzəyeva,,,,Yeni Azərbaycan Partiyası,Yeni Azərbaycan Partiyası,6,Culfa-Babək seçim dairəsi,National Assembly,5,,,,,,,
55685d5f-c607-4ca4-8762-a5cde5cffe15,İlham Kazım oğlu Məmmədov,İlham Kazım oğlu Məmmədov,,,,Yeni Azərbaycan Partiyası,Yeni Azərbaycan Partiyası,48,Yevlax seçim dairəsi,National Assembly,5,,,,,,,
829068f1-37cd-459b-a8a9-070ee75f887b,İlham Əlisəftər oğlu Əliyev,İlham Əlisəftər oğlu Əliyev,,,,Yeni Azərbaycan Partiyası,Yeni Azərbaycan Partiyası,56,Xaçmaz qəsəbə seçim dairəsi,National Assembly,5,,,,,,,
c8fdd079-b454-4c9f-8c91-c8a825f04e7d,İmamverdi İbiş oğlu İsmayılov,İmamverdi İbiş oğlu İsmayılov,,,,Yeni Azərbaycan Partiyası,Yeni Azərbaycan Partiyası,125,Zəngilan-Qubadlı seçim dairəsi,National Assembly,5,,,,,,,
f1c09354-db8a-473e-af54-2e02876b6d93,İqbal Nəriman oğlu Məmmədov,İqbal Nəriman oğlu Məmmədov,,,,Yeni Azərbaycan Partiyası,Yeni Azərbaycan Partiyası,78,Lerik seçim dairəsi,National Assembly,5,,,,,,,
677e6a72-3e7b-4041-9ab9-855e35a3c890,İsa Əkbər oğlu Həbibbəyli,İsa Əkbər oğlu Həbibbəyli,,,,Yeni Azərbaycan Partiyası,Yeni Azərbaycan Partiyası,2,Şərur seçim dairəsi,National Assembly,5,,,,,,,
9eac868d-e0fb-44e5-a8cf-a5835b9c20c1,Şahin Əmir oğlu İsmayılov,Şahin Əmir oğlu İsmayılov,,,,Yeni Azərbaycan Partiyası,Yeni Azərbaycan Partiyası,81,Beyləqan seçim dairəsi,National Assembly,5,,,,,,,
cf4f0d97-38e0-4ac5-a8ae-3b3af3eadd28,Şəmsəddin Hümmət oğlu Hacıyev,Şəmsəddin Hümmət oğlu Hacıyev,,,,Yeni Azərbaycan Partiyası,Yeni Azərbaycan Partiyası,29,Səbail seçim dairəsi,National Assembly,5,,,,,,,
7b45d17f-d9b0-48a2-bb8d-bbdc077d97de,Əflatun Əhməd oğlu Amaşov,Əflatun Əhməd oğlu Amaşov,,,,Independent,IND,62,Saatlı seçim dairəsi,National Assembly,5,,,,,,Q327591,
69c818b1-71dc-42a4-8076-1b2192771ce8,Əhliman Tapdıq oğlu Əmiraslanov,Əhliman Tapdıq oğlu Əmiraslanov,,,,Yeni Azərbaycan Partiyası,Yeni Azərbaycan Partiyası,65,Saatlı-Sabirabad-Kürdəmir seçim dairəsi,National Assembly,5,,,,,,,
bcf4a276-f486-4797-a267-6613ba831f0d,Əli Məhəmməd oğlu Hüseynli,Əli Məhəmməd oğlu Hüseynli,,,,Yeni Azərbaycan Partiyası,Yeni Azərbaycan Partiyası,49,Yevlax-Mingəçevir seçim dairəsi,National Assembly,5,,,,,,,
