id,name,sort_name,email,twitter,facebook,group,group_id,area_id,area,chamber,term,start_date,end_date,image,gender,wikidata,wikidata_group,wikidata_area
e902c15f-0def-4220-9cad-e9cf03f28600,Adil Abış oğlu Əliyev,Adil Abış oğlu Əliyev,,,,Independent,IND,20,Nərimanov II seçim dairəsi,National Assembly,4,,,,,,Q327591,
78257a42-9a74-491e-a143-a1780be53418,Aqil Məhəmməd oğlu Abbas,Aqil Məhəmməd oğlu Abbas,,,,Independent,IND,83,Ağcabədi-Füzuli seçim dairəsi,National Assembly,4,,,,,,Q327591,
17c361a4-0403-4b13-a154-cebbcae48b10,Aqiyə Həbib qızı Naxçıvanlı,Aqiyə Həbib qızı Naxçıvanlı,,,,Yeni Azərbaycan Partiyası,Yeni Azərbaycan Partiyası,117,Oğuz-Qəbələ seçim dairəsi,National Assembly,4,,,,,,,
2d2d5e78-0e6a-45bb-89de-6e9f7b5ecf9d,Arif Qafar oğlu Rəhimzadə,Arif Qafar oğlu Rəhimzadə,,,,Yeni Azərbaycan Partiyası,Yeni Azərbaycan Partiyası,61,Neftçala seçim dairəsi,National Assembly,4,,,,,,,
68fa5639-dfea-4920-9f51-178ce943d413,Asim Nazim oğlu Mollazadə,Asim Nazim oğlu Mollazadə,,,,Azərbaycan Demokratik İslahatlar Partiyası,Azərbaycan Demokratik İslahatlar Partiyası,22,Nəsimi II seçim dairəsi,National Assembly,4,,,,,,,
09cdc2e2-5f62-41c1-91cc-dfbb31bd1732,Aslan Məmmədhüseyn oğlu Cəfərov,Aslan Məmmədhüseyn oğlu Cəfərov,,,,Yeni Azərbaycan Partiyası,Yeni Azərbaycan Partiyası,77,Astara seçim dairəsi,National Assembly,4,,,,,,,
0023b3f4-ee5d-4910-b94e-849ff0d75421,Astan Nuşrəvan oğlu Şahverdiyev,Astan Nuşrəvan oğlu Şahverdiyev,,,,Yeni Azərbaycan Partiyası,Yeni Azərbaycan Partiyası,120,Cəbrayıl-Qubadlı seçim dairəsi,National Assembly,4,,,,,,,
ea1fe2b7-0ece-4c4b-9f30-71fd4944e343,Aydın Böyükkişi oğlu Mirzəzadə,Aydın Böyükkişi oğlu Mirzəzadə,,,,Yeni Azərbaycan Partiyası,Yeni Azərbaycan Partiyası,47,Mingəçevir seçim dairəsi,National Assembly,4,,,,,,,
a8ef6e4a-e2b3-488b-9816-ec0f431668d4,Azər Camal oğlu Badamov,Azər Camal oğlu Badamov,,,,Yeni Azərbaycan Partiyası,Yeni Azərbaycan Partiyası,51,Qusar seçim dairəsi,National Assembly,4,,,,,,,
817694ba-adc2-4c96-aa2f-d335901207e0,Azər Şəmşid oğlu Kərimli,Azər Şəmşid oğlu Kərimli,,,,Independent,IND,112,Qax seçim dairəsi,National Assembly,4,,,,,,Q327591,
919dd04f-8c92-4fd4-9266-bf5844ef7061,Ağacan Qulam oğlu Abıyev,Ağacan Qulam oğlu Abıyev,,,,Yeni Azərbaycan Partiyası,Yeni Azərbaycan Partiyası,32,Suraxanı III seçim dairəsi,National Assembly,4,,,,,,,
c2ff39de-3fc0-431d-9db4-59ce0b6652b7,Bahar Əvəz qızı Muradov,Bahar Əvəz qızı Muradov,,,,Yeni Azərbaycan Partiyası,Yeni Azərbaycan Partiyası,84,Füzuli seçim dairəsi,National Assembly,4,,,,,,,
b8b098cb-2837-4166-a462-ede34bba0e4c,Bəxtiyar Həmzə oğlu Əliyev,Bəxtiyar Həmzə oğlu Əliyev,,,,Independent,IND,118,Ağdam şəhər seçim dairəsi,National Assembly,4,,,,,,Q327591,
cfcf3d48-da35-4474-8cbf-41be40c641cb,Bəxtiyar Yusif oğlu Sadıqov,Bəxtiyar Yusif oğlu Sadıqov,,,,Yeni Azərbaycan Partiyası,Yeni Azərbaycan Partiyası,119,Ağdam qəsəbə seçim dairəsi,National Assembly,4,,,,,,,
858db313-020d-4d08-a24f-5c9a9c793785,Cavanşir Hümmət oğlu Paşazadə,Cavanşir Hümmət oğlu Paşazadə,,,,Yeni Azərbaycan Partiyası,Yeni Azərbaycan Partiyası,75,Lənkəran-Masallı seçim dairəsi,National Assembly,4,,,,,,,
9582ec9f-b19e-463d-83d7-af588e5d0f78,Cavanşir Əyyub oğlu Feyziyev,Cavanşir Əyyub oğlu Feyziyev,,,,Independent,IND,115,Şəki qəsəbə II seçim dairəsi,National Assembly,4,,,,,,Q327591,
c53e9c47-0adb-4ac0-9484-1140be212f71,Cavid Qənbər oğlu Qurbanov,Cavid Qənbər oğlu Qurbanov,,,,Yeni Azərbaycan Partiyası,Yeni Azərbaycan Partiyası,123,Kəlbəcər seçim dairəsi,National Assembly,4,,,,,,,
b5c541de-a1fd-4216-86ee-b6e892c4bb55,Ceyhun Yunis oğlu Osmanlı,Ceyhun Yunis oğlu Osmanlı,,,,Independent,IND,63,Sabirabad I seçim dairəsi,National Assembly,4,,,,,,Q327591,
21734f8c-08f2-469b-b46d-7c58ba7b18b4,Cəlal Əlirza oğlu Əliyev,Cəlal Əlirza oğlu Əliyev,,,,Yeni Azərbaycan Partiyası,Yeni Azərbaycan Partiyası,62,Saatlı seçim dairəsi,National Assembly,4,,,,,,,
e870502f-6a94-4160-a295-aefed6c5b807,Eldar Allahyar oğlu Quliyev,Eldar Allahyar oğlu Quliyev,,,,Independent,IND,28,Sabunçu III seçim dairəsi,National Assembly,4,,,,,,Q327591,
38f37b0a-393b-4290-a14d-f1363c81bd20,Eldar Rza oğlu İbrahimov,Eldar Rza oğlu İbrahimov,,,,Yeni Azərbaycan Partiyası,Yeni Azərbaycan Partiyası,4,Naxçıvan şəhər seçim dairəsi,National Assembly,4,,,,,,,
f3a1ea82-cfd5-4a75-b0f1-14c3f0a52337,Elman Camal oğlu Məmmədov,Elman Camal oğlu Məmmədov,,,,Yeni Azərbaycan Partiyası,Yeni Azərbaycan Partiyası,124,Şuşa-Ağdam-Xocalı-Xocavənd seçim dairəsi,National Assembly,4,,,,,,,
9d1c4517-445a-4cd3-bdeb-de1e2ccbabb9,Elmira Hüseyn qızı Axundova,Elmira Hüseyn qızı Axundova,,,,Independent,IND,71,Masallı qəsəbə seçim dairəsi,National Assembly,4,,,,,,Q327591,
34fef792-7701-49ba-a468-e2d52d0a343c,Elxan Sirac oğlu Süleymanov,Elxan Sirac oğlu Süleymanov,,,,Independent,IND,85,Şamaxı seçim dairəsi,National Assembly,4,,,,,,Q327591,
12a33896-c47b-4db3-a532-4b5efc42b897,Fazil Qəzənfər oğlu Mustafa,Fazil Qəzənfər oğlu Mustafa,,,,Böyük Quruluş Partiyası,Böyük Quruluş Partiyası,26,Sabunçu I seçim dairəsi,National Assembly,4,,,,,,,
665e327c-740a-4eb7-baa1-c47a5e56e701,Flora Qasım qızı Qasımova,Flora Qasım qızı Qasımova,,,,Independent,IND,122,Xankəndi seçim dairəsi,National Assembly,4,,,,,,Q327591,
79631068-8078-42b5-b382-c43ea8a7f76e,Fərəc İbrahim oğlu Quliyev,Fərəc İbrahim oğlu Quliyev,,,,Milli Dirçəliş Hərəkatı Partiyası,Milli Dirçəliş Hərəkatı Partiyası,31,Suraxanı II seçim dairəsi,National Assembly,4,,,,,,,
95308c9a-f205-4cb7-9f23-2f89ead01da2,Fəttah Səməd oğlu Heydərov,Fəttah Səməd oğlu Heydərov,,,,Independent,IND,116,Qəbələ seçim dairəsi,National Assembly,4,,,,,,Q327591,
a2e32a8f-ede7-4b1f-9894-5c3a3dd25bd5,Fəzail Feyruz oğlu İbrahimli,Fəzail Feyruz oğlu İbrahimli,,,,Vətəndaş Həmrəyliyi Partiyası,Vətəndaş Həmrəyliyi Partiyası,69,Cəlilabad-Masallı-Biləsuvar seçim dairəsi,National Assembly,4,,,,,,,
2862a408-8d5a-4f69-9734-cd8e81233774,Fəzail Rəhim oğlu Ağamalı,Fəzail Rəhim oğlu Ağamalı,,,,Independent,IND,60,Salyan-Neftçala seçim dairəsi,National Assembly,4,,,,,,Q327591,
60c77fa2-7ddf-499f-ac8d-dfed98a3195c,Hacı Hacıbaba oğlu Salayev,Hacı Hacıbaba oğlu Salayev,,,,Independent,IND,44,Sumqayıt-Abşeron seçim dairəsi,National Assembly,4,,,,,,Q327591,
94471284-5c85-44ed-bdc2-9caac4b85ebc,Hadı Musa oğlu Rəcəbli,Hadı Musa oğlu Rəcəbli,,,,Yeni Azərbaycan Partiyası,Yeni Azərbaycan Partiyası,74,Lənkəran qəsəbə seçim dairəsi,National Assembly,4,,,,,,,
a78c090c-d719-4652-a652-dd14372b63dc,Hikmət İsmayıl oğlu Atayev,Hikmət İsmayıl oğlu Atayev,,,,Yeni Azərbaycan Partiyası,Yeni Azərbaycan Partiyası,110,Zaqatala seçim dairəsi,National Assembly,4,,,,,,,
7990191a-9b06-42ab-a87f-5679a293599b,Hüseynbala Fazil oğlu Mirələmov,Hüseynbala Fazil oğlu Mirələmov,,,,Yeni Azərbaycan Partiyası,Yeni Azərbaycan Partiyası,33,Xətai I seçim dairəsi,National Assembly,4,,,,,,,
b1073735-9c69-453e-8fb8-50bdcd9c707c,Jalə Fazil qızı Əliyeva,Jalə Fazil qızı Əliyeva,,,,Independent,IND,92,Zərdab-Ucar seçim dairəsi,National Assembly,4,,,,,,Q327591,
f2df0872-fdec-49a9-a3b1-af589148815d,Kamilə Əli Ağa qızı Əliyeva,Kamilə Əli Ağa qızı Əliyeva,,,,Yeni Azərbaycan Partiyası,Yeni Azərbaycan Partiyası,111,Zaqatala-Balakən seçim dairəsi,National Assembly,4,,,,,,,
993ccdae-4eb0-4093-9b39-1d8ead03ea82,Madər Ələsgər oğlu Musayev,Madər Ələsgər oğlu Musayev,,,,Independent,IND,10,Binəqədi III seçim dairəsi,National Assembly,4,,,,,,Q327591,
44dbb1a3-54a9-482f-ac0f-60b81fb5f946,Mahir Məhəmmədəli oğlu Aslanov,Mahir Məhəmmədəli oğlu Aslanov,,,,Independent,IND,96,Goranboy-Naftalan seçim dairəsi,National Assembly,4,,,,,,Q327591,
462eda1d-5f63-4738-85fa-438b175991e9,Malik Əvəz oğlu Həsənov,Malik Əvəz oğlu Həsənov,,,,Yeni Azərbaycan Partiyası,Yeni Azərbaycan Partiyası,67,Cəlilabad şəhər seçim dairəsi,National Assembly,4,,,,,,,
65260749-be64-466d-b89a-c891eb2d16e3,Mehriban Arif qızı Əliyeva,Mehriban Arif qızı Əliyeva,,,,Yeni Azərbaycan Partiyası,Yeni Azərbaycan Partiyası,14,Xəzər II seçim dairəsi,National Assembly,4,,,,,,,
34f57f1c-e60c-4929-8917-26eeb07a6e7a,Mirkazım Mirməhəmməd oğlu Kazımov,Mirkazım Mirməhəmməd oğlu Kazımov,,,,Yeni Azərbaycan Partiyası,Yeni Azərbaycan Partiyası,68,Cəlilabad qəsəbə seçim dairəsi,National Assembly,4,,,,,,,
83ac7354-4d8b-4b31-af38-66e6a83acb82,Mixail Yuri oğlu Zabelin,Mixail Yuri oğlu Zabelin,,,,Yeni Azərbaycan Partiyası,Yeni Azərbaycan Partiyası,12,Qaradağ-Binəqədi-Yasamal seçim dairəsi,National Assembly,4,,,,,,,
85169500-911b-4476-9224-ae8ccf12be03,Musa İsa oğlu Quliyev (Urud),Musa İsa oğlu Quliyev (Urud),,,,Yeni Azərbaycan Partiyası,Yeni Azərbaycan Partiyası,40,Kəpəz II seçim dairəsi (Gəncə şəhəri),National Assembly,4,,,,,,,
c743859c-7aea-4b72-82bc-83711b510b7a,Muxtar Bahadur oğlu Babayev,Muxtar Bahadur oğlu Babayev,,,,Yeni Azərbaycan Partiyası,Yeni Azərbaycan Partiyası,43,Sumqayıt III seçim dairəsi,National Assembly,4,,,,,,,
0341cca7-172c-49fb-b94e-c2960af07659,Mübariz Qəhrəman oğlu Qurbanlı,Mübariz Qəhrəman oğlu Qurbanlı,,,,Independent,IND,100,Şəmkir-Daşkəsən seçim dairəsi,National Assembly,4,,,,,,Q327591,
04377071-0969-48c2-b246-222fbb5310a3,Nazim Fərəc oğlu Fərəcov,Nazim Fərəc oğlu Fərəcov,,,,Yeni Azərbaycan Partiyası,Yeni Azərbaycan Partiyası,121,Laçın seçim dairəsi,National Assembly,4,,,,,,,
f9495d80-e980-4243-a974-ae2fe94ff9de,Nizami Qulu oğlu Cəfərov,Nizami Qulu oğlu Cəfərov,,,,Yeni Azərbaycan Partiyası,Yeni Azərbaycan Partiyası,108,Ağstafa seçim dairəsi,National Assembly,4,,,,,,,
0415a741-0df9-40eb-bc87-a9bbb135b639,Novruzəli Davud oğlu Aslanov,Novruzəli Davud oğlu Aslanov,,,,Independent,IND,86,İsmayıllı seçim dairəsi,National Assembly,4,,,,,,Q327591,
48c3deb9-59bd-47f8-bc12-e5f693320373,Nəriman Əlibala oğlu Əliyev,Nəriman Əlibala oğlu Əliyev,,,,Yeni Azərbaycan Partiyası,Yeni Azərbaycan Partiyası,70,Masallı şəhər seçim dairəsi,National Assembly,4,,,,,,,
46eecf57-eb01-45a0-bad0-7acbc6d65293,Qüdrət Müzəffər oğlu Həsənquliyev,Qüdrət Müzəffər oğlu Həsənquliyev,,,,Bütöv Azərbaycan Xalq Cəbhəsi Partiyası,Bütöv Azərbaycan Xalq Cəbhəsi Partiyası,7,Ordubad-Culfa seçim dairəsi,National Assembly,4,,,,,,,
98678e82-49f8-4553-b6c2-ce4da716f91b,Qənirə Ələsgər qızı Paşayeva,Qənirə Ələsgər qızı Paşayeva,,,,Independent,IND,105,Tovuz seçim dairəsi,National Assembly,4,,,,,,Q327591,
3c469aaa-0285-476e-bda8-de8480a45882,Rafael Baba oğlu Hüseynov,Rafael Baba oğlu Hüseynov,,,,Independent,IND,58,Hacıqabul-Kürdəmir seçim dairəsi,National Assembly,4,,,,,,Q327591,
7cf66a76-fb86-4a3c-affd-caa642a9fda2,Rafiq Musa oğlu Məmmədhəsənov,Rafiq Musa oğlu Məmmədhəsənov,,,,Yeni Azərbaycan Partiyası,Yeni Azərbaycan Partiyası,104,Gədəbəy-Tovuz seçim dairəsi,National Assembly,4,,,,,,,
473e9c86-be3c-4754-af31-5d26977c06db,Rasim Nəsrəddin oğlu Musabəyov,Rasim Nəsrəddin oğlu Musabəyov,,,,Independent,IND,18,Nərimanov-Nizami seçim dairəsi,National Assembly,4,,,,,,Q327591,
ddfbb3fc-2caa-4a49-a124-90a6cf6fb84f,Rauf Asif oğlu Əliyev,Rauf Asif oğlu Əliyev,,,,Yeni Azərbaycan Partiyası,Yeni Azərbaycan Partiyası,13,Xəzər I seçim dairəsi,National Assembly,4,,,,,,,
03643d12-148a-4abc-99b4-434714cb86ce,Rövnəq İbrahim oğlu Abdullayev,Rövnəq İbrahim oğlu Abdullayev,,,,Yeni Azərbaycan Partiyası,Yeni Azərbaycan Partiyası,24,Nizami I seçim dairəsi,National Assembly,4,,,,,,,
723843ba-c825-412a-afe6-a0b3ea701106,Rövşən Şükür oğlu Rzayev,Rövşən Şükür oğlu Rzayev,,,,Independent,IND,101,Göygöl-Daşkəsən seçim dairəsi,National Assembly,4,,,,,,Q327591,
74b4c174-a4d9-4edb-8dca-f3b45b72dc9f,Rüfət Atakişi oğlu Quliyev,Rüfət Atakişi oğlu Quliyev,,,,Independent,IND,73,Lənkəran şəhər seçim dairəsi,National Assembly,4,,,,,,Q327591,
c5476720-e85c-4bb8-9b34-09324f165231,Rüstəm Gülabba oğlu Xəlilov,Rüstəm Gülabba oğlu Xəlilov,,,,Yeni Azərbaycan Partiyası,Yeni Azərbaycan Partiyası,64,Sabirabad II seçim dairəsi,National Assembly,4,,,,,,,
fffb60d6-d3c0-4fd1-909c-121c4e66747a,Rəbiyyət Nurullah qızı Aslanova,Rəbiyyət Nurullah qızı Aslanova,,,,Yeni Azərbaycan Partiyası,Yeni Azərbaycan Partiyası,109,Balakən seçim dairəsi,National Assembly,4,,,,,,,
5fa7e3eb-fca4-49cf-83cb-ae11a2338fed,Sabir Kamal oğlu Hacıyev,Sabir Kamal oğlu Hacıyev,,,,Vətəndaş Birliyi Partiyası,Vətəndaş Birliyi Partiyası,88,Göyçay seçim dairəsi,National Assembly,4,,,,,,,
aa1718ed-c2fd-4009-a2b8-8560e7d355a0,Sabir Xudu oğlu Rüstəmxanlı,Sabir Xudu oğlu Rüstəmxanlı,,,,Vətəndaş Həmrəyliyi Partiyası,Vətəndaş Həmrəyliyi Partiyası,72,Yardımlı-Masallı seçim dairəsi,National Assembly,4,,,,,,,
36ceb3f7-0c50-4a23-b815-6e5036775b08,Sahib Eyvaz oğlu Alıyev,Sahib Eyvaz oğlu Alıyev,,,,Independent,IND,95,Tərtər seçim dairəsi,National Assembly,4,,,,,,Q327591,
acb7471b-c068-4a78-b41d-cfcb51018c7d,Sahibə Əli qızı Qafarova,Sahibə Əli qızı Qafarova,,,,Yeni Azərbaycan Partiyası,Yeni Azərbaycan Partiyası,98,Şəmkir şəhər seçim dairəsi,National Assembly,4,,,,,,,
2acda039-fcfa-45f1-adb9-5b32a660fd82,Sevinc Həbib qızı Fətəliyeva,Sevinc Həbib qızı Fətəliyeva,,,,Yeni Azərbaycan Partiyası,Yeni Azərbaycan Partiyası,30,Suraxanı I seçim dairəsi,National Assembly,4,,,,,,,
ec62ba68-8bc9-4186-9846-5cb845427a4d,Sevinc Əmirəhməd qızı Hüseynova,Sevinc Əmirəhməd qızı Hüseynova,,,,Yeni Azərbaycan Partiyası,Yeni Azərbaycan Partiyası,103,Gədəbəy seçim dairəsi,National Assembly,4,,,,,,,
e2503304-167b-417f-86a3-a19c5904167e,Siyavuş Dünyamalı oğlu Novruzov,Siyavuş Dünyamalı oğlu Novruzov,,,,Yeni Azərbaycan Partiyası,Yeni Azərbaycan Partiyası,5,Şahbuz-Babək seçim dairəsi,National Assembly,4,,,,,,,
acfea10d-0cf9-44ef-afe0-30209902b814,Sədaqət Süleyman qızı Vəliyeva,Sədaqət Süleyman qızı Vəliyeva,,,,Yeni Azərbaycan Partiyası,Yeni Azərbaycan Partiyası,25,Nizami II seçim dairəsi,National Assembly,4,,,,,,,
3a796081-232d-4f2c-9628-57c65478e64b,Səməd İsmayıl oğlu Seyidov,Səməd İsmayıl oğlu Seyidov,,,,Yeni Azərbaycan Partiyası,Yeni Azərbaycan Partiyası,36,Xətai IV seçim dairəsi,National Assembly,4,,,,,,,
524e8a11-d297-4102-98f9-4e0e77024c1a,Səttar Suliddin oğlu Mehbalıyev,Səttar Suliddin oğlu Mehbalıyev,,,,Independent,IND,3,Babək-Kəngərli-Naxçıvan seçim dairəsi,National Assembly,4,,,,,,Q327591,
ea4402f6-5e83-4ef1-8097-d9c9a8b2d1eb,Tahir Musa oğlu Rzayev,Tahir Musa oğlu Rzayev,,,,Yeni Azərbaycan Partiyası,Yeni Azərbaycan Partiyası,82,Ağcabədi seçim dairəsi,National Assembly,4,,,,,,,
e4dc7a15-ee3f-4c74-b8b2-61218e73a93e,Tahir Süleyman oğlu Süleymanov,Tahir Süleyman oğlu Süleymanov,,,,Yeni Azərbaycan Partiyası,Yeni Azərbaycan Partiyası,54,Şabran-Siyəzən seçim dairəsi,National Assembly,4,,,,,,,
7db0994f-d476-4dad-b57f-79d7f39836d9,Vahid Qazməmməd oğlu Əhmədov,Vahid Qazməmməd oğlu Əhmədov,,,,Independent,IND,52,Quba seçim dairəsi,National Assembly,4,,,,,,Q327591,
824a52cb-7384-4254-a356-308e0c4dfafc,Valeh Feyruz oğlu Ələsgərov,Valeh Feyruz oğlu Ələsgərov,,,,Independent,IND,102,Samux-Şəmkir seçim dairəsi,National Assembly,4,,,,,,Q327591,
a660ce75-f3b6-4ef3-bee0-a3222aa5ded0,Vasif Yusif oğlu Talıbov,Vasif Yusif oğlu Talıbov,,,,Yeni Azərbaycan Partiyası,Yeni Azərbaycan Partiyası,1,Şərur-Sədərək seçim dairəsi,National Assembly,4,,,,,,,
7eb8ceaa-2921-4c39-ae2f-9e942896245b,Xanhüseyn Hüseynağa oğlu Kazımlı,Xanhüseyn Hüseynağa oğlu Kazımlı,,,,Azərbaycan Sosial Rifah Partiyası,Azərbaycan Sosial Rifah Partiyası,66,Biləsuvar seçim dairəsi,National Assembly,4,,,,,,,
af02f71e-f329-4a73-af8e-8f76f3af8457,Xanlar Nuru oğlu Fətiyev,Xanlar Nuru oğlu Fətiyev,,,,Yeni Azərbaycan Partiyası,Yeni Azərbaycan Partiyası,39,Kəpəz I seçim dairəsi (Gəncə şəhəri),National Assembly,4,,,,,,,
b04f004e-b393-4358-999c-1cf5a4e2cda6,Yaqub Mikayıl oğlu Mahmudov,Yaqub Mikayıl oğlu Mahmudov,,,,Yeni Azərbaycan Partiyası,Yeni Azərbaycan Partiyası,113,Şəki şəhər seçim dairəsi,National Assembly,4,,,,,,,
7c5c1659-bec9-4dc4-bebd-bff72cc6c768,Yevda Sasun oğlu Abramov,Yevda Sasun oğlu Abramov,,,,Yeni Azərbaycan Partiyası,Yeni Azərbaycan Partiyası,53,Quba-Qusar seçim dairəsi,National Assembly,4,,,,,,,
86fe6b3a-cf45-4036-83c0-2dfe09bb001f,Zeynəb Yəhya qızı Xanlarova,Zeynəb Yəhya qızı Xanlarova,,,,Independent,IND,50,Qobustan-Xızı-Sumqayıt seçim dairəsi,National Assembly,4,,,,,,Q327591,
06b3cc66-fecc-4242-a4e0-a0a88b4ab664,Ziyad Əliabbas oğlu Səmədzadə,Ziyad Əliabbas oğlu Səmədzadə,,,,Independent,IND,23,Nəsimi-Səbail seçim dairəsi,National Assembly,4,,,,,,Q327591,
64384f06-31a9-4dcb-844d-5a4142af7766,Ziyafət Abbas oğlu Əsgərov,Ziyafət Abbas oğlu Əsgərov,,,,Yeni Azərbaycan Partiyası,Yeni Azərbaycan Partiyası,76,Lənkəran-Astara seçim dairəsi,National Assembly,4,,,,,,,
590d5186-ca74-413c-a423-4e042d3a944a,Çingiz Aşralı oğlu Qənizadə,Çingiz Aşralı oğlu Qənizadə,,,,Independent,IND,80,İmişli-Beyləqan seçim dairəsi,National Assembly,4,,,,,,Q327591,
0c1830d9-b263-4880-95bd-1060f6c3588b,İlham Kazım oğlu Məmmədov,İlham Kazım oğlu Məmmədov,,,,Yeni Azərbaycan Partiyası,Yeni Azərbaycan Partiyası,48,Yevlax seçim dairəsi,National Assembly,4,,,,,,,
d35be6d9-04a9-4b0c-b47e-b83a88753d62,İlham Əlisəftər oğlu Əliyev,İlham Əlisəftər oğlu Əliyev,,,,Yeni Azərbaycan Partiyası,Yeni Azərbaycan Partiyası,56,Xaçmaz qəsəbə seçim dairəsi,National Assembly,4,,,,,,,
ed9eae68-b6e6-4fce-8eb4-fd0b60ca8c9f,İmamverdi İbiş oğlu İsmayılov,İmamverdi İbiş oğlu İsmayılov,,,,Yeni Azərbaycan Partiyası,Yeni Azərbaycan Partiyası,125,Zəngilan-Qubadlı seçim dairəsi,National Assembly,4,,,,,,,
57ad8778-948f-4824-9b48-1e35f85ea130,İqbal Nəriman oğlu Məmmədov,İqbal Nəriman oğlu Məmmədov,,,,Yeni Azərbaycan Partiyası,Yeni Azərbaycan Partiyası,78,Lerik seçim dairəsi,National Assembly,4,,,,,,,
e9260221-fd5d-43db-bd8d-1b2ffdeb69d9,İsa Əkbər oğlu Həbibbəyli,İsa Əkbər oğlu Həbibbəyli,,,,Yeni Azərbaycan Partiyası,Yeni Azərbaycan Partiyası,2,Şərur seçim dairəsi,National Assembly,4,,,,,,,
f42b9c52-b02c-428c-8e41-48a4f09df9af,Əhliman Tapdıq oğlu Əmiraslanov,Əhliman Tapdıq oğlu Əmiraslanov,,,,Yeni Azərbaycan Partiyası,Yeni Azərbaycan Partiyası,65,Saatlı-Sabirabad-Kürdəmir seçim dairəsi,National Assembly,4,,,,,,,
d88b374d-bf1e-4627-8fd0-7e349062cc2c,Əli Cavad oğlu Əhmədov,Əli Cavad oğlu Əhmədov,,,,Yeni Azərbaycan Partiyası,Yeni Azərbaycan Partiyası,19,Nərimanov I seçim dairəsi,National Assembly,4,,,,,,,
3d49a123-ecc4-4e8e-bf9e-2344c571280c,Əli Məhəmməd oğlu Hüseynov,Əli Məhəmməd oğlu Hüseynov,,,,Yeni Azərbaycan Partiyası,Yeni Azərbaycan Partiyası,49,Yevlax-Mingəçevir seçim dairəsi,National Assembly,4,,,,,,,
3de35cca-1902-431a-9672-d55424ef5039,Əli Əhməd oğlu Məsimli,Əli Əhməd oğlu Məsimli,,,,Independent,IND,114,Şəki qəsəbə I seçim dairəsi,National Assembly,4,,,,,,Q327591,
c774a724-591e-4a6e-a27c-01b5f9c18ca4,Əliağa İzzət oğlu Hüseynov,Əliağa İzzət oğlu Hüseynov,,,,Independent,IND,59,Salyan seçim dairəsi,National Assembly,4,,,,,,Q327591,
9e50a70a-bc7c-45ac-bd33-dd091ecbeb5c,Əsabil Qarakişi oğlu Qasımov,Əsabil Qarakişi oğlu Qasımov,,,,Yeni Azərbaycan Partiyası,Yeni Azərbaycan Partiyası,79,İmişli seçim dairəsi,National Assembly,4,,,,,,,
