id,name,sort_name,email,twitter,facebook,group,group_id,area_id,area,chamber,term,start_date,end_date,image,gender,wikidata,wikidata_group,wikidata_area
fc209b76-e97f-465c-b6b3-ee38f0e072ba,Adil Abış oğlu Əliyev,Adil Abış oğlu Əliyev,,,,Independent,IND,20,Nərimanov II seçim dairəsi,National Assembly,4,,,,,,Q327591,
3c4a4c3b-514d-451a-9285-4635e5f72665,Aqil Məhəmməd oğlu Abbas,Aqil Məhəmməd oğlu Abbas,,,,Independent,IND,83,Ağcabədi-Füzuli seçim dairəsi,National Assembly,4,,,,,,Q327591,
7d4ffdad-1da1-42dd-833a-fc5ec9461a8c,Aqiyə Həbib qızı Naxçıvanlı,Aqiyə Həbib qızı Naxçıvanlı,,,,Yeni Azərbaycan Partiyası,Yeni Azərbaycan Partiyası,117,Oğuz-Qəbələ seçim dairəsi,National Assembly,4,,,,,,,
39b7461e-398e-4e11-af89-a17f7c8dddef,Arif Qafar oğlu Rəhimzadə,Arif Qafar oğlu Rəhimzadə,,,,Yeni Azərbaycan Partiyası,Yeni Azərbaycan Partiyası,61,Neftçala seçim dairəsi,National Assembly,4,,,,,,,
2ac19119-6dea-441f-b0a5-ca634343de16,Asim Nazim oğlu Mollazadə,Asim Nazim oğlu Mollazadə,,,,Azərbaycan Demokratik İslahatlar Partiyası,Azərbaycan Demokratik İslahatlar Partiyası,22,Nəsimi II seçim dairəsi,National Assembly,4,,,,,,,
8ce51ecf-a932-4980-945e-324b449701ec,Aslan Məmmədhüseyn oğlu Cəfərov,Aslan Məmmədhüseyn oğlu Cəfərov,,,,Yeni Azərbaycan Partiyası,Yeni Azərbaycan Partiyası,77,Astara seçim dairəsi,National Assembly,4,,,,,,,
5e981f25-ca0b-4fa9-a2b5-34e7a04f2d19,Astan Nuşrəvan oğlu Şahverdiyev,Astan Nuşrəvan oğlu Şahverdiyev,,,,Yeni Azərbaycan Partiyası,Yeni Azərbaycan Partiyası,120,Cəbrayıl-Qubadlı seçim dairəsi,National Assembly,4,,,,,,,
adcef5b9-eaa0-412b-993b-d2e93cc9c5e6,Aydın Böyükkişi oğlu Mirzəzadə,Aydın Böyükkişi oğlu Mirzəzadə,,,,Yeni Azərbaycan Partiyası,Yeni Azərbaycan Partiyası,47,Mingəçevir seçim dairəsi,National Assembly,4,,,,,,,
416c8cf0-da61-4f35-911e-a7a6d99ac932,Azər Camal oğlu Badamov,Azər Camal oğlu Badamov,,,,Yeni Azərbaycan Partiyası,Yeni Azərbaycan Partiyası,51,Qusar seçim dairəsi,National Assembly,4,,,,,,,
cac5273d-2e0e-4048-af17-484a72995ae6,Azər Şəmşid oğlu Kərimli,Azər Şəmşid oğlu Kərimli,,,,Independent,IND,112,Qax seçim dairəsi,National Assembly,4,,,,,,Q327591,
0790a16d-ea21-476c-8656-625996d6993e,Ağacan Qulam oğlu Abıyev,Ağacan Qulam oğlu Abıyev,,,,Yeni Azərbaycan Partiyası,Yeni Azərbaycan Partiyası,32,Suraxanı III seçim dairəsi,National Assembly,4,,,,,,,
916bae42-dc24-45eb-8407-fa78ba6cf9b0,Bahar Əvəz qızı Muradov,Bahar Əvəz qızı Muradov,,,,Yeni Azərbaycan Partiyası,Yeni Azərbaycan Partiyası,84,Füzuli seçim dairəsi,National Assembly,4,,,,,,,
c9b3815d-cdd9-4339-beec-9a82112a0f7c,Bəxtiyar Həmzə oğlu Əliyev,Bəxtiyar Həmzə oğlu Əliyev,,,,Independent,IND,118,Ağdam şəhər seçim dairəsi,National Assembly,4,,,,,,Q327591,
932060e9-efa9-4476-9339-9d72b3958fa2,Bəxtiyar Yusif oğlu Sadıqov,Bəxtiyar Yusif oğlu Sadıqov,,,,Yeni Azərbaycan Partiyası,Yeni Azərbaycan Partiyası,119,Ağdam qəsəbə seçim dairəsi,National Assembly,4,,,,,,,
c28475ce-f58c-4398-867b-7477312dbd3c,Cavanşir Hümmət oğlu Paşazadə,Cavanşir Hümmət oğlu Paşazadə,,,,Yeni Azərbaycan Partiyası,Yeni Azərbaycan Partiyası,75,Lənkəran-Masallı seçim dairəsi,National Assembly,4,,,,,,,
e7367d00-7ff6-4d61-9b9a-0bd15893e1cc,Cavanşir Əyyub oğlu Feyziyev,Cavanşir Əyyub oğlu Feyziyev,,,,Independent,IND,115,Şəki qəsəbə II seçim dairəsi,National Assembly,4,,,,,,Q327591,
97bb57ee-b566-4b3e-8c79-cc43445770dc,Cavid Qənbər oğlu Qurbanov,Cavid Qənbər oğlu Qurbanov,,,,Yeni Azərbaycan Partiyası,Yeni Azərbaycan Partiyası,123,Kəlbəcər seçim dairəsi,National Assembly,4,,,,,,,
1e960198-71e8-474f-885e-3dde0edc6cb7,Ceyhun Yunis oğlu Osmanlı,Ceyhun Yunis oğlu Osmanlı,,,,Independent,IND,63,Sabirabad I seçim dairəsi,National Assembly,4,,,,,,Q327591,
b6feaeb8-0dd3-43e9-94c0-37d839717816,Cəlal Əlirza oğlu Əliyev,Cəlal Əlirza oğlu Əliyev,,,,Yeni Azərbaycan Partiyası,Yeni Azərbaycan Partiyası,62,Saatlı seçim dairəsi,National Assembly,4,,,,,,,
3658ed53-9878-4b32-875d-42fe2859613d,Eldar Allahyar oğlu Quliyev,Eldar Allahyar oğlu Quliyev,,,,Independent,IND,28,Sabunçu III seçim dairəsi,National Assembly,4,,,,,,Q327591,
141210d7-aded-4b51-8e1f-9345fd8f2291,Eldar Rza oğlu İbrahimov,Eldar Rza oğlu İbrahimov,,,,Yeni Azərbaycan Partiyası,Yeni Azərbaycan Partiyası,4,Naxçıvan şəhər seçim dairəsi,National Assembly,4,,,,,,,
14c5c584-0a66-4091-bf25-024fc2260d6c,Elman Camal oğlu Məmmədov,Elman Camal oğlu Məmmədov,,,,Yeni Azərbaycan Partiyası,Yeni Azərbaycan Partiyası,124,Şuşa-Ağdam-Xocalı-Xocavənd seçim dairəsi,National Assembly,4,,,,,,,
7bd3d726-154b-4686-b978-20acee6f5e36,Elmira Hüseyn qızı Axundova,Elmira Hüseyn qızı Axundova,,,,Independent,IND,71,Masallı qəsəbə seçim dairəsi,National Assembly,4,,,,,,Q327591,
64a577a8-e0b3-4233-9c7b-90d4341ed559,Elxan Sirac oğlu Süleymanov,Elxan Sirac oğlu Süleymanov,,,,Independent,IND,85,Şamaxı seçim dairəsi,National Assembly,4,,,,,,Q327591,
6d0ec0bb-c349-4bfe-b39d-180f48c8be69,Fazil Qəzənfər oğlu Mustafa,Fazil Qəzənfər oğlu Mustafa,,,,Böyük Quruluş Partiyası,Böyük Quruluş Partiyası,26,Sabunçu I seçim dairəsi,National Assembly,4,,,,,,,
67ee0544-bfad-46ed-8573-ed3cd7a8a5d5,Flora Qasım qızı Qasımova,Flora Qasım qızı Qasımova,,,,Independent,IND,122,Xankəndi seçim dairəsi,National Assembly,4,,,,,,Q327591,
2b63d68c-27aa-4c2c-8a12-c13ff7d9fdab,Fərəc İbrahim oğlu Quliyev,Fərəc İbrahim oğlu Quliyev,,,,Milli Dirçəliş Hərəkatı Partiyası,Milli Dirçəliş Hərəkatı Partiyası,31,Suraxanı II seçim dairəsi,National Assembly,4,,,,,,,
aa3da23d-c8d9-4abd-9b65-76a401eefa4e,Fəttah Səməd oğlu Heydərov,Fəttah Səməd oğlu Heydərov,,,,Independent,IND,116,Qəbələ seçim dairəsi,National Assembly,4,,,,,,Q327591,
e203eeec-60c1-4161-b184-82f237cd51c0,Fəzail Feyruz oğlu İbrahimli,Fəzail Feyruz oğlu İbrahimli,,,,Vətəndaş Həmrəyliyi Partiyası,Vətəndaş Həmrəyliyi Partiyası,69,Cəlilabad-Masallı-Biləsuvar seçim dairəsi,National Assembly,4,,,,,,,
e91d2df6-bb36-447f-b617-3cd7836bd235,Fəzail Rəhim oğlu Ağamalı,Fəzail Rəhim oğlu Ağamalı,,,,Independent,IND,60,Salyan-Neftçala seçim dairəsi,National Assembly,4,,,,,,Q327591,
c4981616-765f-4db5-a420-c00de9d0a884,Hacı Hacıbaba oğlu Salayev,Hacı Hacıbaba oğlu Salayev,,,,Independent,IND,44,Sumqayıt-Abşeron seçim dairəsi,National Assembly,4,,,,,,Q327591,
f986719b-1871-4eab-b66e-0586363fb539,Hadı Musa oğlu Rəcəbli,Hadı Musa oğlu Rəcəbli,,,,Yeni Azərbaycan Partiyası,Yeni Azərbaycan Partiyası,74,Lənkəran qəsəbə seçim dairəsi,National Assembly,4,,,,,,,
5b3a1066-b03b-47e7-a4a6-78c3aaedfb33,Hikmət İsmayıl oğlu Atayev,Hikmət İsmayıl oğlu Atayev,,,,Yeni Azərbaycan Partiyası,Yeni Azərbaycan Partiyası,110,Zaqatala seçim dairəsi,National Assembly,4,,,,,,,
126419dd-ada2-4ad4-a0ea-250882a364bb,Hüseynbala Fazil oğlu Mirələmov,Hüseynbala Fazil oğlu Mirələmov,,,,Yeni Azərbaycan Partiyası,Yeni Azərbaycan Partiyası,33,Xətai I seçim dairəsi,National Assembly,4,,,,,,,
f783e9da-7b83-479b-80a7-f39990b59ce2,Jalə Fazil qızı Əliyeva,Jalə Fazil qızı Əliyeva,,,,Independent,IND,92,Zərdab-Ucar seçim dairəsi,National Assembly,4,,,,,,Q327591,
ebc41246-945b-4a7a-8f3c-1f5c4fe5bd90,Kamilə Əli Ağa qızı Əliyeva,Kamilə Əli Ağa qızı Əliyeva,,,,Yeni Azərbaycan Partiyası,Yeni Azərbaycan Partiyası,111,Zaqatala-Balakən seçim dairəsi,National Assembly,4,,,,,,,
636336cc-ced9-4904-895b-685ae0f1bf4d,Madər Ələsgər oğlu Musayev,Madər Ələsgər oğlu Musayev,,,,Independent,IND,10,Binəqədi III seçim dairəsi,National Assembly,4,,,,,,Q327591,
42288a4c-4e7e-43b3-87ea-b78ddf8121d8,Mahir Məhəmmədəli oğlu Aslanov,Mahir Məhəmmədəli oğlu Aslanov,,,,Independent,IND,96,Goranboy-Naftalan seçim dairəsi,National Assembly,4,,,,,,Q327591,
e6a6bb24-bc02-4820-80b0-cb88b950ce20,Malik Əvəz oğlu Həsənov,Malik Əvəz oğlu Həsənov,,,,Yeni Azərbaycan Partiyası,Yeni Azərbaycan Partiyası,67,Cəlilabad şəhər seçim dairəsi,National Assembly,4,,,,,,,
1ffd0d41-6526-483a-a2c0-78110832da60,Mehriban Arif qızı Əliyeva,Mehriban Arif qızı Əliyeva,,,,Yeni Azərbaycan Partiyası,Yeni Azərbaycan Partiyası,14,Xəzər II seçim dairəsi,National Assembly,4,,,,,,,
21d1d60c-cc0d-428a-8439-5367e3290760,Mirkazım Mirməhəmməd oğlu Kazımov,Mirkazım Mirməhəmməd oğlu Kazımov,,,,Yeni Azərbaycan Partiyası,Yeni Azərbaycan Partiyası,68,Cəlilabad qəsəbə seçim dairəsi,National Assembly,4,,,,,,,
f6073746-e235-4699-880d-f5e230368569,Mixail Yuri oğlu Zabelin,Mixail Yuri oğlu Zabelin,,,,Yeni Azərbaycan Partiyası,Yeni Azərbaycan Partiyası,12,Qaradağ-Binəqədi-Yasamal seçim dairəsi,National Assembly,4,,,,,,,
6c8ba4ea-3358-4be8-8330-eba3c550f3ad,Musa İsa oğlu Quliyev (Urud),Musa İsa oğlu Quliyev (Urud),,,,Yeni Azərbaycan Partiyası,Yeni Azərbaycan Partiyası,40,Kəpəz II seçim dairəsi (Gəncə şəhəri),National Assembly,4,,,,,,,
40320714-d30e-45b5-b0a2-e4e4a64158b6,Muxtar Bahadur oğlu Babayev,Muxtar Bahadur oğlu Babayev,,,,Yeni Azərbaycan Partiyası,Yeni Azərbaycan Partiyası,43,Sumqayıt III seçim dairəsi,National Assembly,4,,,,,,,
d158e00e-50f3-4958-812f-071704bd8a94,Mübariz Qəhrəman oğlu Qurbanlı,Mübariz Qəhrəman oğlu Qurbanlı,,,,Independent,IND,100,Şəmkir-Daşkəsən seçim dairəsi,National Assembly,4,,,,,,Q327591,
3e6f54c8-f6d5-4845-b2bd-16fa5507eb98,Nazim Fərəc oğlu Fərəcov,Nazim Fərəc oğlu Fərəcov,,,,Yeni Azərbaycan Partiyası,Yeni Azərbaycan Partiyası,121,Laçın seçim dairəsi,National Assembly,4,,,,,,,
dbded2c0-b8a8-43f8-b7e6-5cf94486f2a2,Nizami Qulu oğlu Cəfərov,Nizami Qulu oğlu Cəfərov,,,,Yeni Azərbaycan Partiyası,Yeni Azərbaycan Partiyası,108,Ağstafa seçim dairəsi,National Assembly,4,,,,,,,
99679c96-1be9-4a1c-be0f-8e9138163439,Novruzəli Davud oğlu Aslanov,Novruzəli Davud oğlu Aslanov,,,,Independent,IND,86,İsmayıllı seçim dairəsi,National Assembly,4,,,,,,Q327591,
72517411-9ef1-4c01-8267-60bd471cfe64,Nəriman Əlibala oğlu Əliyev,Nəriman Əlibala oğlu Əliyev,,,,Yeni Azərbaycan Partiyası,Yeni Azərbaycan Partiyası,70,Masallı şəhər seçim dairəsi,National Assembly,4,,,,,,,
bafd36a2-8a5c-4da6-833f-1a060b6823b2,Qüdrət Müzəffər oğlu Həsənquliyev,Qüdrət Müzəffər oğlu Həsənquliyev,,,,Bütöv Azərbaycan Xalq Cəbhəsi Partiyası,Bütöv Azərbaycan Xalq Cəbhəsi Partiyası,7,Ordubad-Culfa seçim dairəsi,National Assembly,4,,,,,,,
e2c18cc2-3dd4-49c1-b955-851d6b5313c1,Qənirə Ələsgər qızı Paşayeva,Qənirə Ələsgər qızı Paşayeva,,,,Independent,IND,105,Tovuz seçim dairəsi,National Assembly,4,,,,,,Q327591,
f1f139a9-6033-44fb-bb3b-690f3e80f803,Rafael Baba oğlu Hüseynov,Rafael Baba oğlu Hüseynov,,,,Independent,IND,58,Hacıqabul-Kürdəmir seçim dairəsi,National Assembly,4,,,,,,Q327591,
29fb8fc3-71f0-4070-93e5-c1f1f8797222,Rafiq Musa oğlu Məmmədhəsənov,Rafiq Musa oğlu Məmmədhəsənov,,,,Yeni Azərbaycan Partiyası,Yeni Azərbaycan Partiyası,104,Gədəbəy-Tovuz seçim dairəsi,National Assembly,4,,,,,,,
a385280d-c4a8-478a-944c-741194cc1e37,Rasim Nəsrəddin oğlu Musabəyov,Rasim Nəsrəddin oğlu Musabəyov,,,,Independent,IND,18,Nərimanov-Nizami seçim dairəsi,National Assembly,4,,,,,,Q327591,
40362a9e-551f-4783-a688-4e429ef5582f,Rauf Asif oğlu Əliyev,Rauf Asif oğlu Əliyev,,,,Yeni Azərbaycan Partiyası,Yeni Azərbaycan Partiyası,13,Xəzər I seçim dairəsi,National Assembly,4,,,,,,,
1321c3a7-3db0-44b1-8d28-59258502837e,Rövnəq İbrahim oğlu Abdullayev,Rövnəq İbrahim oğlu Abdullayev,,,,Yeni Azərbaycan Partiyası,Yeni Azərbaycan Partiyası,24,Nizami I seçim dairəsi,National Assembly,4,,,,,,,
bde3cb86-43f2-408b-b7e9-89a698c71201,Rövşən Şükür oğlu Rzayev,Rövşən Şükür oğlu Rzayev,,,,Independent,IND,101,Göygöl-Daşkəsən seçim dairəsi,National Assembly,4,,,,,,Q327591,
0cb5a061-122a-4547-affe-c9142ac54240,Rüfət Atakişi oğlu Quliyev,Rüfət Atakişi oğlu Quliyev,,,,Independent,IND,73,Lənkəran şəhər seçim dairəsi,National Assembly,4,,,,,,Q327591,
657cce44-e548-4b06-9270-e50172b6743e,Rüstəm Gülabba oğlu Xəlilov,Rüstəm Gülabba oğlu Xəlilov,,,,Yeni Azərbaycan Partiyası,Yeni Azərbaycan Partiyası,64,Sabirabad II seçim dairəsi,National Assembly,4,,,,,,,
fec327d4-b06f-4ae0-9968-44f3648547b8,Rəbiyyət Nurullah qızı Aslanova,Rəbiyyət Nurullah qızı Aslanova,,,,Yeni Azərbaycan Partiyası,Yeni Azərbaycan Partiyası,109,Balakən seçim dairəsi,National Assembly,4,,,,,,,
3dd6dce4-4235-43b3-afb8-8b7ead6da119,Sabir Kamal oğlu Hacıyev,Sabir Kamal oğlu Hacıyev,,,,Vətəndaş Birliyi Partiyası,Vətəndaş Birliyi Partiyası,88,Göyçay seçim dairəsi,National Assembly,4,,,,,,,
dae7bd5b-72a6-49cb-898c-3a62d5249b80,Sabir Xudu oğlu Rüstəmxanlı,Sabir Xudu oğlu Rüstəmxanlı,,,,Vətəndaş Həmrəyliyi Partiyası,Vətəndaş Həmrəyliyi Partiyası,72,Yardımlı-Masallı seçim dairəsi,National Assembly,4,,,,,,,
ea1c322b-a369-4c40-9994-cf3d10338664,Sahib Eyvaz oğlu Alıyev,Sahib Eyvaz oğlu Alıyev,,,,Independent,IND,95,Tərtər seçim dairəsi,National Assembly,4,,,,,,Q327591,
dea48daa-4c68-4fad-b263-a8383d6caafa,Sahibə Əli qızı Qafarova,Sahibə Əli qızı Qafarova,,,,Yeni Azərbaycan Partiyası,Yeni Azərbaycan Partiyası,98,Şəmkir şəhər seçim dairəsi,National Assembly,4,,,,,,,
4c41fc82-9cf6-4b56-a9b0-9d5ce820569d,Sevinc Həbib qızı Fətəliyeva,Sevinc Həbib qızı Fətəliyeva,,,,Yeni Azərbaycan Partiyası,Yeni Azərbaycan Partiyası,30,Suraxanı I seçim dairəsi,National Assembly,4,,,,,,,
e8bb6647-28d2-49f9-9f81-17915ae4310f,Sevinc Əmirəhməd qızı Hüseynova,Sevinc Əmirəhməd qızı Hüseynova,,,,Yeni Azərbaycan Partiyası,Yeni Azərbaycan Partiyası,103,Gədəbəy seçim dairəsi,National Assembly,4,,,,,,,
fd706c13-bf9e-4bd3-a38f-b4ba41a7bb63,Siyavuş Dünyamalı oğlu Novruzov,Siyavuş Dünyamalı oğlu Novruzov,,,,Yeni Azərbaycan Partiyası,Yeni Azərbaycan Partiyası,5,Şahbuz-Babək seçim dairəsi,National Assembly,4,,,,,,,
e2b8a70b-4a73-4bcd-9f44-64141b9527ec,Sədaqət Süleyman qızı Vəliyeva,Sədaqət Süleyman qızı Vəliyeva,,,,Yeni Azərbaycan Partiyası,Yeni Azərbaycan Partiyası,25,Nizami II seçim dairəsi,National Assembly,4,,,,,,,
898a7b89-f82e-443d-9cbb-8611bd2bce5c,Səməd İsmayıl oğlu Seyidov,Səməd İsmayıl oğlu Seyidov,,,,Yeni Azərbaycan Partiyası,Yeni Azərbaycan Partiyası,36,Xətai IV seçim dairəsi,National Assembly,4,,,,,,,
a0ac1867-0f49-4d36-b5af-5a4714aff409,Səttar Suliddin oğlu Mehbalıyev,Səttar Suliddin oğlu Mehbalıyev,,,,Independent,IND,3,Babək-Kəngərli-Naxçıvan seçim dairəsi,National Assembly,4,,,,,,Q327591,
b9897fbe-6edc-4772-bdf3-e3a2b056a70d,Tahir Musa oğlu Rzayev,Tahir Musa oğlu Rzayev,,,,Yeni Azərbaycan Partiyası,Yeni Azərbaycan Partiyası,82,Ağcabədi seçim dairəsi,National Assembly,4,,,,,,,
5fdc7105-d9a8-4746-9755-1413c89fe670,Tahir Süleyman oğlu Süleymanov,Tahir Süleyman oğlu Süleymanov,,,,Yeni Azərbaycan Partiyası,Yeni Azərbaycan Partiyası,54,Şabran-Siyəzən seçim dairəsi,National Assembly,4,,,,,,,
91abbcc1-ffb8-4510-a80a-fa901e71cd86,Vahid Qazməmməd oğlu Əhmədov,Vahid Qazməmməd oğlu Əhmədov,,,,Independent,IND,52,Quba seçim dairəsi,National Assembly,4,,,,,,Q327591,
794809b5-da47-47cf-aa9e-40a44ac80c2d,Valeh Feyruz oğlu Ələsgərov,Valeh Feyruz oğlu Ələsgərov,,,,Independent,IND,102,Samux-Şəmkir seçim dairəsi,National Assembly,4,,,,,,Q327591,
298c2bb5-9250-46d9-b47e-a863886928d2,Vasif Yusif oğlu Talıbov,Vasif Yusif oğlu Talıbov,,,,Yeni Azərbaycan Partiyası,Yeni Azərbaycan Partiyası,1,Şərur-Sədərək seçim dairəsi,National Assembly,4,,,,,,,
1a70aac0-a007-4c3b-9d0c-7767b34f41bf,Xanhüseyn Hüseynağa oğlu Kazımlı,Xanhüseyn Hüseynağa oğlu Kazımlı,,,,Azərbaycan Sosial Rifah Partiyası,Azərbaycan Sosial Rifah Partiyası,66,Biləsuvar seçim dairəsi,National Assembly,4,,,,,,,
ff52d20f-e4d1-4ea9-930f-a6860bc81777,Xanlar Nuru oğlu Fətiyev,Xanlar Nuru oğlu Fətiyev,,,,Yeni Azərbaycan Partiyası,Yeni Azərbaycan Partiyası,39,Kəpəz I seçim dairəsi (Gəncə şəhəri),National Assembly,4,,,,,,,
ce1cf796-ed15-40f6-b507-bd4cd3c68d13,Yaqub Mikayıl oğlu Mahmudov,Yaqub Mikayıl oğlu Mahmudov,,,,Yeni Azərbaycan Partiyası,Yeni Azərbaycan Partiyası,113,Şəki şəhər seçim dairəsi,National Assembly,4,,,,,,,
98b4806f-10cd-482f-9cbf-03d607627c38,Yevda Sasun oğlu Abramov,Yevda Sasun oğlu Abramov,,,,Yeni Azərbaycan Partiyası,Yeni Azərbaycan Partiyası,53,Quba-Qusar seçim dairəsi,National Assembly,4,,,,,,,
b0e968b4-ca91-4429-85cd-b8260109549b,Zeynəb Yəhya qızı Xanlarova,Zeynəb Yəhya qızı Xanlarova,,,,Independent,IND,50,Qobustan-Xızı-Sumqayıt seçim dairəsi,National Assembly,4,,,,,,Q327591,
f066b5db-09c3-4662-a33f-a36e0ffc8281,Ziyad Əliabbas oğlu Səmədzadə,Ziyad Əliabbas oğlu Səmədzadə,,,,Independent,IND,23,Nəsimi-Səbail seçim dairəsi,National Assembly,4,,,,,,Q327591,
0ac66358-c9e0-4886-b3c5-a7d34cec8b27,Ziyafət Abbas oğlu Əsgərov,Ziyafət Abbas oğlu Əsgərov,,,,Yeni Azərbaycan Partiyası,Yeni Azərbaycan Partiyası,76,Lənkəran-Astara seçim dairəsi,National Assembly,4,,,,,,,
e5835558-00c1-4566-a956-34774a9cd236,Çingiz Aşralı oğlu Qənizadə,Çingiz Aşralı oğlu Qənizadə,,,,Independent,IND,80,İmişli-Beyləqan seçim dairəsi,National Assembly,4,,,,,,Q327591,
af25d228-23bf-4ea2-82be-948fea381b78,İlham Kazım oğlu Məmmədov,İlham Kazım oğlu Məmmədov,,,,Yeni Azərbaycan Partiyası,Yeni Azərbaycan Partiyası,48,Yevlax seçim dairəsi,National Assembly,4,,,,,,,
ff6cdc05-0920-4910-a4b6-986c9a868796,İlham Əlisəftər oğlu Əliyev,İlham Əlisəftər oğlu Əliyev,,,,Yeni Azərbaycan Partiyası,Yeni Azərbaycan Partiyası,56,Xaçmaz qəsəbə seçim dairəsi,National Assembly,4,,,,,,,
4306660c-f21f-4435-b728-42098ab2c247,İmamverdi İbiş oğlu İsmayılov,İmamverdi İbiş oğlu İsmayılov,,,,Yeni Azərbaycan Partiyası,Yeni Azərbaycan Partiyası,125,Zəngilan-Qubadlı seçim dairəsi,National Assembly,4,,,,,,,
cd2032f8-bc25-4a22-9af7-552ef74b0205,İqbal Nəriman oğlu Məmmədov,İqbal Nəriman oğlu Məmmədov,,,,Yeni Azərbaycan Partiyası,Yeni Azərbaycan Partiyası,78,Lerik seçim dairəsi,National Assembly,4,,,,,,,
51a19cbe-f45c-4fda-ab5b-50e11b1f1a5b,İsa Əkbər oğlu Həbibbəyli,İsa Əkbər oğlu Həbibbəyli,,,,Yeni Azərbaycan Partiyası,Yeni Azərbaycan Partiyası,2,Şərur seçim dairəsi,National Assembly,4,,,,,,,
f877497a-7d29-4c06-967b-7ed68460a657,Əhliman Tapdıq oğlu Əmiraslanov,Əhliman Tapdıq oğlu Əmiraslanov,,,,Yeni Azərbaycan Partiyası,Yeni Azərbaycan Partiyası,65,Saatlı-Sabirabad-Kürdəmir seçim dairəsi,National Assembly,4,,,,,,,
bc4efaff-8cb4-409e-a716-8abb462994be,Əli Cavad oğlu Əhmədov,Əli Cavad oğlu Əhmədov,,,,Yeni Azərbaycan Partiyası,Yeni Azərbaycan Partiyası,19,Nərimanov I seçim dairəsi,National Assembly,4,,,,,,,
d276f4d3-60c3-4368-85da-80ceb986a490,Əli Məhəmməd oğlu Hüseynov,Əli Məhəmməd oğlu Hüseynov,,,,Yeni Azərbaycan Partiyası,Yeni Azərbaycan Partiyası,49,Yevlax-Mingəçevir seçim dairəsi,National Assembly,4,,,,,,,
b56bf99c-0764-4af9-a128-1d06d236ec42,Əli Əhməd oğlu Məsimli,Əli Əhməd oğlu Məsimli,,,,Independent,IND,114,Şəki qəsəbə I seçim dairəsi,National Assembly,4,,,,,,Q327591,
53422b3c-ea99-4ffa-8de9-2ca73055498c,Əliağa İzzət oğlu Hüseynov,Əliağa İzzət oğlu Hüseynov,,,,Independent,IND,59,Salyan seçim dairəsi,National Assembly,4,,,,,,Q327591,
940abe48-50f1-481e-9c24-ed3894bcd73d,Əsabil Qarakişi oğlu Qasımov,Əsabil Qarakişi oğlu Qasımov,,,,Yeni Azərbaycan Partiyası,Yeni Azərbaycan Partiyası,79,İmişli seçim dairəsi,National Assembly,4,,,,,,,
