id,name,position,start_date,end_date,type
423db8e2-7be0-47ee-b698-2a0957d27a9d,Dominic Raab,Secretary of State for Exiting the European Union,2018-07-09,,cabinet
f966006e-e5ba-430a-b458-b28589da24df,Norman Fowler,Secretary of State for Transport,1981-01-05,1981-09-14,cabinet
f966006e-e5ba-430a-b458-b28589da24df,Norman Fowler,Secretary of State for Social Services,1981-09-14,1987-06-13,cabinet
f966006e-e5ba-430a-b458-b28589da24df,Norman Fowler,Secretary of State for Employment,1987-06-13,1990-01-03,cabinet
f422b764-c3e9-4334-98b1-fd13d09873d1,Chris Smith,"Secretary of State for Culture, Media and Sport",1997-05-02,2001-06-08,cabinet
ca7326cb-2626-418b-b2b3-c64db150bade,Tony Blair,Prime Minister of the United Kingdom,1997-05-02,2007-06-27,cabinet
