id,name,position,start_date,end_date,type
fd42a445-d9d2-4a9e-ad5b-b5e6ae18a124,Konrad Adenauer,Federal Minister for Foreign Affairs,1951-03-15,1956-06-06,cabinet
8690ae26-013c-4a9c-bcff-ca46e37f7d38,Ernst Benda,Federal Minister of the Interior,1968-04-02,1969-10-21,cabinet
81b36885-5faf-4da4-98af-012b367cc446,Hans Eichel,Federal Minister of Finance,1999-04-12,2005-11-22,cabinet
ef1bbdf3-db1b-46a5-a6a7-44321cd79571,Theodor Blank,Federal Minister of Defence,1955-06-07,1956-10-16,cabinet
47abae41-991f-42fa-a14c-55ec6f051a83,Paul Lücke,Federal Minister of the Interior,1965-10-26,1968-04-02,cabinet
f20468a2-7ca2-401c-a355-05412ef6b641,Rupert Scholz,Federal Minister of Defence,1988-05-18,1989-04-21,cabinet
