id,name,position,start_date,end_date,type
b544320d-ad8d-4d14-9c33-f606ec76c327,Gustav Heinemann,Federal Minister of the Interior,1949-09-20,1950-10-11,cabinet
666cab19-f3fe-474e-ae81-211c0bd1b62a,Manfred Wörner,Federal Minister of Defence,1982-10-04,1988-05-18,cabinet
e4d94125-b765-4354-805a-fd33c37f2ec7,Gerhard Stoltenberg,Federal Minister of Finance,1982-10-04,1989-04-21,cabinet
e4d94125-b765-4354-805a-fd33c37f2ec7,Gerhard Stoltenberg,Federal Minister of Defence,1989-04-21,1992-03-31,cabinet
ab835559-ef9c-4ead-bfa4-002ae60c42fa,Markus Meckel,Minister for Foreign Affairs (German Democratic Republic),1990-04-12,1990-08-20,cabinet
ca62ffdc-cf62-4252-9df9-bcfb27f4a732,Frank-Walter Steinmeier,Vice-Chancellor of Germany,2007-11-21,2009-10-28,cabinet
ca62ffdc-cf62-4252-9df9-bcfb27f4a732,Frank-Walter Steinmeier,Federal Minister for Foreign Affairs,2005-11-22,2009-10-28,cabinet
ca62ffdc-cf62-4252-9df9-bcfb27f4a732,Frank-Walter Steinmeier,Federal Minister for Foreign Affairs,2013-12-17,2017-01-27,cabinet
a4fccabe-eba0-4b81-975a-379aef684823,Karl-Theodor zu Guttenberg,Federal Minister of Defence,2009-10-28,2011-03-03,cabinet
