id,name,position,start_date,end_date,type
3eb6871b-6405-4f30-b1d7-c5dbf0aee955,Oskar Lafontaine,Federal Minister of Finance,1998-10-27,1999-03-18,cabinet
fd42a445-d9d2-4a9e-ad5b-b5e6ae18a124,Konrad Adenauer,Federal Minister for Foreign Affairs,1951-03-15,1956-06-06,cabinet
64044d44-a2a8-475d-8875-3e0afba0794b,Helmut Schmidt,Federal Minister of Finance,1972-07-07,1974-05-15,cabinet
64044d44-a2a8-475d-8875-3e0afba0794b,Helmut Schmidt,Federal Minister of Defence,1969-10-22,1972-07-07,cabinet
64044d44-a2a8-475d-8875-3e0afba0794b,Helmut Schmidt,Federal Minister for Foreign Affairs,1982-09-17,1982-10-04,cabinet
b544320d-ad8d-4d14-9c33-f606ec76c327,Gustav Heinemann,Federal Minister of the Interior,1949-09-20,1950-10-11,cabinet
b72ff202-a0ca-43e2-b36c-43566442d5b7,Ronald Pofalla,Federal Minister for Special Affairs of Germany,2009-10-28,2013-12-17,cabinet
ef32b499-1487-4fd0-9053-205ea99ccdcf,Georg Leber,Federal Minister of Defence,1972-07-07,1978-02-16,cabinet
